01:57:02.717716 IP 192.168.4.2 > 192.168.4.1: ICMP echo request, id 26740, seq 1, length 64
01:57:02.717727 IP 192.168.4.1 > 192.168.4.2: ICMP echo reply, id 26740, seq 1, length 64
01:57:05.631142 ARP, Request who-has 192.168.3.1 tell 192.168.3.2, length 28
01:57:05.631152 ARP, Reply 192.168.3.1 is-at de:58:f1:38:35:a5 (oui Unknown), length 28
01:57:07.739371 IP 192.168.4.2 > 192.168.2.1: ICMP echo request, id 26753, seq 1, length 64
01:57:07.739386 IP 192.168.4.2 > 192.168.2.1: ICMP echo request, id 26753, seq 1, length 64
01:57:07.739532 IP 192.168.2.1 > 192.168.4.2: ICMP echo reply, id 26753, seq 1, length 64
01:57:07.739538 IP 192.168.2.1 > 192.168.4.2: ICMP echo reply, id 26753, seq 1, length 64
01:57:07.746414 IP 192.168.4.2 > 192.168.2.2: ICMP echo request, id 26756, seq 1, length 64
01:57:07.746431 IP 192.168.2.2 > 192.168.4.2: ICMP echo reply, id 26756, seq 1, length 64
01:57:07.752809 IP 192.168.4.2 > 192.168.3.1: ICMP echo request, id 26759, seq 1, length 64
01:57:07.752826 IP 192.168.3.1 > 192.168.4.2: ICMP echo reply, id 26759, seq 1, length 64
01:57:07.770770 IP 192.168.4.2 > 192.168.3.2: ICMP echo request, id 26768, seq 1, length 64
01:57:07.770784 IP 192.168.4.2 > 192.168.3.2: ICMP echo request, id 26768, seq 1, length 64
01:57:07.770901 IP 192.168.3.2 > 192.168.4.2: ICMP echo reply, id 26768, seq 1, length 64
01:57:07.770906 IP 192.168.3.2 > 192.168.4.2: ICMP echo reply, id 26768, seq 1, length 64
01:57:07.785993 IP 192.168.4.2 > 192.168.1.2: ICMP echo request, id 26780, seq 1, length 64
01:57:07.786000 IP 192.168.4.2 > 192.168.1.2: ICMP echo request, id 26780, seq 1, length 64
01:57:07.786153 IP 192.168.1.2 > 192.168.4.2: ICMP echo reply, id 26780, seq 1, length 64
01:57:07.786156 IP 192.168.1.2 > 192.168.4.2: ICMP echo reply, id 26780, seq 1, length 64
01:57:07.789478 IP 192.168.4.2 > 192.168.1.1: ICMP echo request, id 26783, seq 1, length 64
01:57:07.789483 IP 192.168.4.2 > 192.168.1.1: ICMP echo request, id 26783, seq 1, length 64
01:57:07.789541 IP 192.168.1.1 > 192.168.4.2: ICMP echo reply, id 26783, seq 1, length 64
01:57:07.789543 IP 192.168.1.1 > 192.168.4.2: ICMP echo reply, id 26783, seq 1, length 64
01:57:09.834130 IP 192.168.4.2 > 192.168.4.1: ICMP echo request, id 26818, seq 1, length 64
01:57:09.834140 IP 192.168.4.1 > 192.168.4.2: ICMP echo reply, id 26818, seq 1, length 64
01:57:14.846398 ARP, Request who-has 192.168.4.2 tell 192.168.4.1, length 28
01:57:14.850474 ARP, Reply 192.168.4.2 is-at 16:db:37:6e:d2:c7 (oui Unknown), length 28
01:57:14.855649 IP 192.168.4.2 > 192.168.2.1: ICMP echo request, id 26839, seq 1, length 64
01:57:14.855667 IP 192.168.4.2 > 192.168.2.1: ICMP echo request, id 26839, seq 1, length 64
01:57:14.855871 IP 192.168.2.1 > 192.168.4.2: ICMP echo reply, id 26839, seq 1, length 64
01:57:14.855878 IP 192.168.2.1 > 192.168.4.2: ICMP echo reply, id 26839, seq 1, length 64
01:57:14.867223 IP 192.168.4.2 > 192.168.2.2: ICMP echo request, id 26842, seq 1, length 64
01:57:14.867244 IP 192.168.2.2 > 192.168.4.2: ICMP echo reply, id 26842, seq 1, length 64
01:57:14.876401 IP 192.168.4.2 > 192.168.3.1: ICMP echo request, id 26845, seq 1, length 64
01:57:14.876421 IP 192.168.3.1 > 192.168.4.2: ICMP echo reply, id 26845, seq 1, length 64
01:57:14.892687 IP 192.168.4.2 > 192.168.3.2: ICMP echo request, id 26854, seq 1, length 64
01:57:14.892698 IP 192.168.4.2 > 192.168.3.2: ICMP echo request, id 26854, seq 1, length 64
01:57:14.892800 IP 192.168.3.2 > 192.168.4.2: ICMP echo reply, id 26854, seq 1, length 64
01:57:14.892804 IP 192.168.3.2 > 192.168.4.2: ICMP echo reply, id 26854, seq 1, length 64
01:57:14.913132 IP 192.168.4.2 > 192.168.1.2: ICMP echo request, id 26866, seq 1, length 64
01:57:14.913143 IP 192.168.4.2 > 192.168.1.2: ICMP echo request, id 26866, seq 1, length 64
01:57:14.913372 IP 192.168.1.2 > 192.168.4.2: ICMP echo reply, id 26866, seq 1, length 64
01:57:14.913376 IP 192.168.1.2 > 192.168.4.2: ICMP echo reply, id 26866, seq 1, length 64
01:57:14.920139 IP 192.168.4.2 > 192.168.1.1: ICMP echo request, id 26869, seq 1, length 64
01:57:14.920149 IP 192.168.4.2 > 192.168.1.1: ICMP echo request, id 26869, seq 1, length 64
01:57:14.920352 IP 192.168.1.1 > 192.168.4.2: ICMP echo reply, id 26869, seq 1, length 64
01:57:14.920357 IP 192.168.1.1 > 192.168.4.2: ICMP echo reply, id 26869, seq 1, length 64
01:57:17.001377 IP 192.168.4.2 > 192.168.4.1: ICMP echo request, id 26902, seq 1, length 64
01:57:17.001396 IP 192.168.4.1 > 192.168.4.2: ICMP echo reply, id 26902, seq 1, length 64
01:57:22.014646 ARP, Request who-has 192.168.4.1 tell 192.168.4.2, length 28
01:57:22.014667 ARP, Reply 192.168.4.1 is-at 56:35:ab:88:19:d3 (oui Unknown), length 28
01:57:22.030281 IP 192.168.4.2 > 192.168.2.1: ICMP echo request, id 26913, seq 1, length 64
01:57:22.030300 IP 192.168.4.2 > 192.168.2.1: ICMP echo request, id 26913, seq 1, length 64
01:57:22.030616 IP 192.168.2.1 > 192.168.4.2: ICMP echo reply, id 26913, seq 1, length 64
01:57:22.030627 IP 192.168.2.1 > 192.168.4.2: ICMP echo reply, id 26913, seq 1, length 64
01:57:22.040709 IP 192.168.4.2 > 192.168.2.2: ICMP echo request, id 26916, seq 1, length 64
01:57:22.040728 IP 192.168.2.2 > 192.168.4.2: ICMP echo reply, id 26916, seq 1, length 64
01:57:22.050027 IP 192.168.4.2 > 192.168.3.1: ICMP echo request, id 26919, seq 1, length 64
01:57:22.050050 IP 192.168.3.1 > 192.168.4.2: ICMP echo reply, id 26919, seq 1, length 64
01:57:22.073997 IP 192.168.4.2 > 192.168.3.2: ICMP echo request, id 26928, seq 1, length 64
01:57:22.074010 IP 192.168.4.2 > 192.168.3.2: ICMP echo request, id 26928, seq 1, length 64
01:57:22.074115 IP 192.168.3.2 > 192.168.4.2: ICMP echo reply, id 26928, seq 1, length 64
01:57:22.074119 IP 192.168.3.2 > 192.168.4.2: ICMP echo reply, id 26928, seq 1, length 64
01:57:22.095428 IP 192.168.4.2 > 192.168.1.2: ICMP echo request, id 26940, seq 1, length 64
01:57:22.095440 IP 192.168.4.2 > 192.168.1.2: ICMP echo request, id 26940, seq 1, length 64
01:57:22.095671 IP 192.168.1.2 > 192.168.4.2: ICMP echo reply, id 26940, seq 1, length 64
01:57:22.095676 IP 192.168.1.2 > 192.168.4.2: ICMP echo reply, id 26940, seq 1, length 64
01:57:22.101661 IP 192.168.4.2 > 192.168.1.1: ICMP echo request, id 26943, seq 1, length 64
01:57:22.101670 IP 192.168.4.2 > 192.168.1.1: ICMP echo request, id 26943, seq 1, length 64
01:57:22.101768 IP 192.168.1.1 > 192.168.4.2: ICMP echo reply, id 26943, seq 1, length 64
01:57:22.101771 IP 192.168.1.1 > 192.168.4.2: ICMP echo reply, id 26943, seq 1, length 64
01:57:23.153451 IP 192.168.4.2 > 192.168.4.1: ICMP echo request, id 26973, seq 1, length 64
01:57:23.153463 IP 192.168.4.1 > 192.168.4.2: ICMP echo reply, id 26973, seq 1, length 64
01:57:27.038626 ARP, Request who-has 192.168.2.1 tell 192.168.2.2, length 28
01:57:27.038938 ARP, Request who-has 192.168.2.2 tell 192.168.2.1, length 28
01:57:27.038960 ARP, Reply 192.168.2.2 is-at fe:c3:81:6b:fc:a1 (oui Unknown), length 28
01:57:27.039122 ARP, Reply 192.168.2.1 is-at 4e:80:72:df:66:29 (oui Unknown), length 28
01:57:27.086393 ARP, Request who-has 192.168.3.2 tell 192.168.3.1, length 28
01:57:27.086846 ARP, Reply 192.168.3.2 is-at ae:87:e4:75:95:d6 (oui Unknown), length 28
01:57:28.171360 IP 192.168.4.2 > 192.168.2.1: ICMP echo request, id 26983, seq 1, length 64
01:57:28.171373 IP 192.168.4.2 > 192.168.2.1: ICMP echo request, id 26983, seq 1, length 64
01:57:28.171474 IP 192.168.2.1 > 192.168.4.2: ICMP echo reply, id 26983, seq 1, length 64
01:57:28.171478 IP 192.168.2.1 > 192.168.4.2: ICMP echo reply, id 26983, seq 1, length 64
01:57:28.177797 IP 192.168.4.2 > 192.168.2.2: ICMP echo request, id 26986, seq 1, length 64
01:57:28.177812 IP 192.168.2.2 > 192.168.4.2: ICMP echo reply, id 26986, seq 1, length 64
01:57:28.183261 IP 192.168.4.2 > 192.168.3.1: ICMP echo request, id 26989, seq 1, length 64
01:57:28.183276 IP 192.168.3.1 > 192.168.4.2: ICMP echo reply, id 26989, seq 1, length 64
01:57:28.191770 IP 192.168.4.2 > 192.168.3.2: ICMP echo request, id 26998, seq 1, length 64
01:57:28.191777 IP 192.168.4.2 > 192.168.3.2: ICMP echo request, id 26998, seq 1, length 64
01:57:28.191828 IP 192.168.3.2 > 192.168.4.2: ICMP echo reply, id 26998, seq 1, length 64
01:57:28.191830 IP 192.168.3.2 > 192.168.4.2: ICMP echo reply, id 26998, seq 1, length 64
01:57:28.202917 IP 192.168.4.2 > 192.168.1.2: ICMP echo request, id 27010, seq 1, length 64
01:57:28.202926 IP 192.168.4.2 > 192.168.1.2: ICMP echo request, id 27010, seq 1, length 64
01:57:28.203046 IP 192.168.1.2 > 192.168.4.2: ICMP echo reply, id 27010, seq 1, length 64
01:57:28.203048 IP 192.168.1.2 > 192.168.4.2: ICMP echo reply, id 27010, seq 1, length 64
01:57:28.206139 IP 192.168.4.2 > 192.168.1.1: ICMP echo request, id 27013, seq 1, length 64
01:57:28.206143 IP 192.168.4.2 > 192.168.1.1: ICMP echo request, id 27013, seq 1, length 64
01:57:28.206189 IP 192.168.1.1 > 192.168.4.2: ICMP echo reply, id 27013, seq 1, length 64
01:57:28.206191 IP 192.168.1.1 > 192.168.4.2: ICMP echo reply, id 27013, seq 1, length 64
01:57:29.234933 IP 192.168.4.2 > 192.168.4.1: ICMP echo request, id 27040, seq 1, length 64
01:57:29.234941 IP 192.168.4.1 > 192.168.4.2: ICMP echo reply, id 27040, seq 1, length 64

01:57:39.339433 IP 192.168.4.2 > 192.168.2.1: ICMP echo request, id 27120, seq 1, length 64
01:57:39.339455 IP 192.168.4.2 > 192.168.2.1: ICMP echo request, id 27120, seq 1, length 64
01:57:39.339512 IP 192.168.2.1 > 192.168.4.2: ICMP echo reply, id 27120, seq 1, length 64
01:57:39.339514 IP 192.168.2.1 > 192.168.4.2: ICMP echo reply, id 27120, seq 1, length 64
01:57:39.343405 IP 192.168.4.2 > 192.168.2.2: ICMP echo request, id 27123, seq 1, length 64
01:57:39.343417 IP 192.168.2.2 > 192.168.4.2: ICMP echo reply, id 27123, seq 1, length 64
01:57:39.347521 IP 192.168.4.2 > 192.168.3.1: ICMP echo request, id 27126, seq 1, length 64
01:57:39.347532 IP 192.168.3.1 > 192.168.4.2: ICMP echo reply, id 27126, seq 1, length 64
01:57:39.362434 IP 192.168.4.2 > 192.168.3.2: ICMP echo request, id 27135, seq 1, length 64
01:57:39.362506 IP 192.168.4.2 > 192.168.3.2: ICMP echo request, id 27135, seq 1, length 64
01:57:39.363186 IP 192.168.3.2 > 192.168.4.2: ICMP echo reply, id 27135, seq 1, length 64
01:57:39.363190 IP 192.168.3.2 > 192.168.4.2: ICMP echo reply, id 27135, seq 1, length 64
01:57:39.381442 IP 192.168.4.2 > 192.168.1.2: ICMP echo request, id 27147, seq 1, length 64
01:57:39.381465 IP 192.168.4.2 > 192.168.1.2: ICMP echo request, id 27147, seq 1, length 64
01:57:39.381752 IP 192.168.1.2 > 192.168.4.2: ICMP echo reply, id 27147, seq 1, length 64
01:57:39.381756 IP 192.168.1.2 > 192.168.4.2: ICMP echo reply, id 27147, seq 1, length 64
01:57:39.393028 IP 192.168.4.2 > 192.168.1.1: ICMP echo request, id 27150, seq 1, length 64
01:57:39.393039 IP 192.168.4.2 > 192.168.1.1: ICMP echo request, id 27150, seq 1, length 64
01:57:39.393165 IP 192.168.1.1 > 192.168.4.2: ICMP echo reply, id 27150, seq 1, length 64
01:57:39.393170 IP 192.168.1.1 > 192.168.4.2: ICMP echo reply, id 27150, seq 1, length 64
01:57:39.429009 IP 192.168.4.2 > 192.168.4.1: ICMP echo request, id 27179, seq 1, length 64
01:57:39.429019 IP 192.168.4.1 > 192.168.4.2: ICMP echo reply, id 27179, seq 1, length 64
01:57:44.350525 ARP, Request who-has 192.168.4.2 tell 192.168.4.1, length 28
01:57:44.350938 ARP, Reply 192.168.4.2 is-at 16:db:37:6e:d2:c7 (oui Unknown), length 28
01:57:44.366857 ARP, Request who-has 192.168.3.1 tell 192.168.3.2, length 28
01:57:44.366879 ARP, Reply 192.168.3.1 is-at de:58:f1:38:35:a5 (oui Unknown), length 28
01:57:44.449521 IP 192.168.4.2 > 192.168.2.1: ICMP echo request, id 27188, seq 1, length 64
01:57:44.449539 IP 192.168.4.2 > 192.168.2.1: ICMP echo request, id 27188, seq 1, length 64
01:57:44.449763 IP 192.168.2.1 > 192.168.4.2: ICMP echo reply, id 27188, seq 1, length 64
01:57:44.449773 IP 192.168.2.1 > 192.168.4.2: ICMP echo reply, id 27188, seq 1, length 64
01:57:44.461387 IP 192.168.4.2 > 192.168.2.2: ICMP echo request, id 27191, seq 1, length 64
01:57:44.461411 IP 192.168.2.2 > 192.168.4.2: ICMP echo reply, id 27191, seq 1, length 64
01:57:44.472671 IP 192.168.4.2 > 192.168.3.1: ICMP echo request, id 27194, seq 1, length 64
01:57:44.472697 IP 192.168.3.1 > 192.168.4.2: ICMP echo reply, id 27194, seq 1, length 64
01:57:44.500168 IP 192.168.4.2 > 192.168.3.2: ICMP echo request, id 27203, seq 1, length 64
01:57:44.500186 IP 192.168.4.2 > 192.168.3.2: ICMP echo request, id 27203, seq 1, length 64
01:57:44.500354 IP 192.168.3.2 > 192.168.4.2: ICMP echo reply, id 27203, seq 1, length 64
01:57:44.500361 IP 192.168.3.2 > 192.168.4.2: ICMP echo reply, id 27203, seq 1, length 64
01:57:44.519918 IP 192.168.4.2 > 192.168.1.2: ICMP echo request, id 27215, seq 1, length 64
01:57:44.519927 IP 192.168.4.2 > 192.168.1.2: ICMP echo request, id 27215, seq 1, length 64
01:57:44.520068 IP 192.168.1.2 > 192.168.4.2: ICMP echo reply, id 27215, seq 1, length 64
01:57:44.520071 IP 192.168.1.2 > 192.168.4.2: ICMP echo reply, id 27215, seq 1, length 64
01:57:44.524670 IP 192.168.4.2 > 192.168.1.1: ICMP echo request, id 27218, seq 1, length 64
01:57:44.524676 IP 192.168.4.2 > 192.168.1.1: ICMP echo request, id 27218, seq 1, length 64
01:57:44.524754 IP 192.168.1.1 > 192.168.4.2: ICMP echo reply, id 27218, seq 1, length 64
01:57:44.524757 IP 192.168.1.1 > 192.168.4.2: ICMP echo reply, id 27218, seq 1, length 64
01:57:44.558511 IP 192.168.4.2 > 192.168.4.1: ICMP echo request, id 27245, seq 1, length 64
01:57:44.558521 IP 192.168.4.1 > 192.168.4.2: ICMP echo reply, id 27245, seq 1, length 64
01:57:49.577245 IP 192.168.4.2 > 192.168.2.1: ICMP echo request, id 27268, seq 1, length 64
01:57:49.577262 IP 192.168.4.2 > 192.168.2.1: ICMP echo request, id 27268, seq 1, length 64
01:57:49.577556 IP 192.168.2.1 > 192.168.4.2: ICMP echo reply, id 27268, seq 1, length 64
01:57:49.577566 IP 192.168.2.1 > 192.168.4.2: ICMP echo reply, id 27268, seq 1, length 64
01:57:49.587804 IP 192.168.4.2 > 192.168.2.2: ICMP echo request, id 27271, seq 1, length 64
01:57:49.587879 IP 192.168.2.2 > 192.168.4.2: ICMP echo reply, id 27271, seq 1, length 64
01:57:49.597358 IP 192.168.4.2 > 192.168.3.1: ICMP echo request, id 27274, seq 1, length 64
01:57:49.597438 IP 192.168.3.1 > 192.168.4.2: ICMP echo reply, id 27274, seq 1, length 64
01:57:49.614305 IP 192.168.4.2 > 192.168.3.2: ICMP echo request, id 27283, seq 1, length 64
01:57:49.614314 IP 192.168.4.2 > 192.168.3.2: ICMP echo request, id 27283, seq 1, length 64
01:57:49.614391 IP 192.168.3.2 > 192.168.4.2: ICMP echo reply, id 27283, seq 1, length 64
01:57:49.614393 IP 192.168.3.2 > 192.168.4.2: ICMP echo reply, id 27283, seq 1, length 64
01:57:49.630340 IP 192.168.4.2 > 192.168.1.2: ICMP echo request, id 27295, seq 1, length 64
01:57:49.630348 IP 192.168.4.2 > 192.168.1.2: ICMP echo request, id 27295, seq 1, length 64
01:57:49.630486 IP 192.168.1.2 > 192.168.4.2: ICMP echo reply, id 27295, seq 1, length 64
01:57:49.630488 IP 192.168.1.2 > 192.168.4.2: ICMP echo reply, id 27295, seq 1, length 64
01:57:49.634943 IP 192.168.4.2 > 192.168.1.1: ICMP echo request, id 27298, seq 1, length 64
01:57:49.634949 IP 192.168.4.2 > 192.168.1.1: ICMP echo request, id 27298, seq 1, length 64
01:57:49.635023 IP 192.168.1.1 > 192.168.4.2: ICMP echo reply, id 27298, seq 1, length 64
01:57:49.635026 IP 192.168.1.1 > 192.168.4.2: ICMP echo reply, id 27298, seq 1, length 64
01:57:49.674132 IP 192.168.4.2 > 192.168.4.1: ICMP echo request, id 27325, seq 1, length 64
01:57:49.674144 IP 192.168.4.1 > 192.168.4.2: ICMP echo reply, id 27325, seq 1, length 64
01:57:54.694769 IP 192.168.4.2 > 192.168.2.1: ICMP echo request, id 27336, seq 1, length 64
01:57:54.694789 IP 192.168.4.2 > 192.168.2.1: ICMP echo request, id 27336, seq 1, length 64
01:57:54.695049 IP 192.168.2.1 > 192.168.4.2: ICMP echo reply, id 27336, seq 1, length 64
01:57:54.695057 IP 192.168.2.1 > 192.168.4.2: ICMP echo reply, id 27336, seq 1, length 64
01:57:54.707158 IP 192.168.4.2 > 192.168.2.2: ICMP echo request, id 27339, seq 1, length 64
01:57:54.707184 IP 192.168.2.2 > 192.168.4.2: ICMP echo reply, id 27339, seq 1, length 64
01:57:54.712753 IP 192.168.4.2 > 192.168.3.1: ICMP echo request, id 27342, seq 1, length 64
01:57:54.712767 IP 192.168.3.1 > 192.168.4.2: ICMP echo reply, id 27342, seq 1, length 64
01:57:54.726702 IP 192.168.4.2 > 192.168.3.2: ICMP echo request, id 27351, seq 1, length 64
01:57:54.726714 IP 192.168.4.2 > 192.168.3.2: ICMP echo request, id 27351, seq 1, length 64
01:57:54.726834 IP 192.168.3.2 > 192.168.4.2: ICMP echo reply, id 27351, seq 1, length 64
01:57:54.726839 IP 192.168.3.2 > 192.168.4.2: ICMP echo reply, id 27351, seq 1, length 64
01:57:54.744381 IP 192.168.4.2 > 192.168.1.2: ICMP echo request, id 27363, seq 1, length 64
01:57:54.744389 IP 192.168.4.2 > 192.168.1.2: ICMP echo request, id 27363, seq 1, length 64
01:57:54.744532 IP 192.168.1.2 > 192.168.4.2: ICMP echo reply, id 27363, seq 1, length 64
01:57:54.744535 IP 192.168.1.2 > 192.168.4.2: ICMP echo reply, id 27363, seq 1, length 64
01:57:54.749296 IP 192.168.4.2 > 192.168.1.1: ICMP echo request, id 27366, seq 1, length 64
01:57:54.749304 IP 192.168.4.2 > 192.168.1.1: ICMP echo request, id 27366, seq 1, length 64
01:57:54.749438 IP 192.168.1.1 > 192.168.4.2: ICMP echo reply, id 27366, seq 1, length 64
01:57:54.749441 IP 192.168.1.1 > 192.168.4.2: ICMP echo reply, id 27366, seq 1, length 64
01:57:54.778608 IP 192.168.4.2 > 192.168.4.1: ICMP echo request, id 27393, seq 1, length 64
01:57:54.778616 IP 192.168.4.1 > 192.168.4.2: ICMP echo reply, id 27393, seq 1, length 64
01:57:59.694631 ARP, Request who-has 192.168.4.1 tell 192.168.4.2, length 28
01:57:59.694654 ARP, Reply 192.168.4.1 is-at 56:35:ab:88:19:d3 (oui Unknown), length 28
01:57:59.789468 IP 192.168.4.2 > 192.168.2.1: ICMP echo request, id 27417, seq 1, length 64
01:57:59.789483 IP 192.168.4.2 > 192.168.2.1: ICMP echo request, id 27417, seq 1, length 64
01:57:59.789644 IP 192.168.2.1 > 192.168.4.2: ICMP echo reply, id 27417, seq 1, length 64
01:57:59.789649 IP 192.168.2.1 > 192.168.4.2: ICMP echo reply, id 27417, seq 1, length 64
01:57:59.793089 IP 192.168.4.2 > 192.168.2.2: ICMP echo request, id 27420, seq 1, length 64
01:57:59.793099 IP 192.168.2.2 > 192.168.4.2: ICMP echo reply, id 27420, seq 1, length 64
01:57:59.796043 IP 192.168.4.2 > 192.168.3.1: ICMP echo request, id 27423, seq 1, length 64
01:57:59.796051 IP 192.168.3.1 > 192.168.4.2: ICMP echo reply, id 27423, seq 1, length 64
01:57:59.803498 IP 192.168.4.2 > 192.168.3.2: ICMP echo request, id 27432, seq 1, length 64
01:57:59.803517 IP 192.168.4.2 > 192.168.3.2: ICMP echo request, id 27432, seq 1, length 64
01:57:59.803569 IP 192.168.3.2 > 192.168.4.2: ICMP echo reply, id 27432, seq 1, length 64
01:57:59.803570 IP 192.168.3.2 > 192.168.4.2: ICMP echo reply, id 27432, seq 1, length 64
01:57:59.814112 IP 192.168.4.2 > 192.168.1.2: ICMP echo request, id 27444, seq 1, length 64
01:57:59.814117 IP 192.168.4.2 > 192.168.1.2: ICMP echo request, id 27444, seq 1, length 64
01:57:59.814203 IP 192.168.1.2 > 192.168.4.2: ICMP echo reply, id 27444, seq 1, length 64
01:57:59.814205 IP 192.168.1.2 > 192.168.4.2: ICMP echo reply, id 27444, seq 1, length 64
01:57:59.817119 IP 192.168.4.2 > 192.168.1.1: ICMP echo request, id 27447, seq 1, length 64
01:57:59.817123 IP 192.168.4.2 > 192.168.1.1: ICMP echo request, id 27447, seq 1, length 64
01:57:59.817170 IP 192.168.1.1 > 192.168.4.2: ICMP echo reply, id 27447, seq 1, length 64
01:57:59.817172 IP 192.168.1.1 > 192.168.4.2: ICMP echo reply, id 27447, seq 1, length 64
01:57:59.842388 IP 192.168.4.2 > 192.168.4.1: ICMP echo request, id 27474, seq 1, length 64
01:57:59.842395 IP 192.168.4.1 > 192.168.4.2: ICMP echo reply, id 27474, seq 1, length 64

01:58:09.870583 ARP, Request who-has 192.168.2.2 tell 192.168.2.1, length 28
01:58:09.870607 ARP, Reply 192.168.2.2 is-at fe:c3:81:6b:fc:a1 (oui Unknown), length 28
01:58:09.902487 ARP, Request who-has 192.168.3.2 tell 192.168.3.1, length 28
01:58:09.902947 ARP, Reply 192.168.3.2 is-at ae:87:e4:75:95:d6 (oui Unknown), length 28
01:58:09.994829 IP 192.168.4.2 > 192.168.2.1: ICMP echo request, id 27555, seq 1, length 64
01:58:09.994848 IP 192.168.4.2 > 192.168.2.1: ICMP echo request, id 27555, seq 1, length 64
01:58:09.994878 IP 192.168.2.1 > 192.168.4.2: ICMP echo reply, id 27555, seq 1, length 64
01:58:09.994884 IP 192.168.2.1 > 192.168.4.2: ICMP echo reply, id 27555, seq 1, length 64
01:58:10.004096 IP 192.168.4.2 > 192.168.2.2: ICMP echo request, id 27558, seq 1, length 64
01:58:10.004114 IP 192.168.2.2 > 192.168.4.2: ICMP echo reply, id 27558, seq 1, length 64
01:58:10.012893 IP 192.168.4.2 > 192.168.3.1: ICMP echo request, id 27561, seq 1, length 64
01:58:10.012915 IP 192.168.3.1 > 192.168.4.2: ICMP echo reply, id 27561, seq 1, length 64
01:58:10.041043 IP 192.168.4.2 > 192.168.3.2: ICMP echo request, id 27570, seq 1, length 64
01:58:10.041060 IP 192.168.4.2 > 192.168.3.2: ICMP echo request, id 27570, seq 1, length 64
01:58:10.041084 IP 192.168.3.2 > 192.168.4.2: ICMP echo reply, id 27570, seq 1, length 64
01:58:10.041087 IP 192.168.3.2 > 192.168.4.2: ICMP echo reply, id 27570, seq 1, length 64
01:58:10.056285 IP 192.168.4.2 > 192.168.1.2: ICMP echo request, id 27582, seq 1, length 64
01:58:10.056292 IP 192.168.4.2 > 192.168.1.2: ICMP echo request, id 27582, seq 1, length 64
01:58:10.056310 IP 192.168.1.2 > 192.168.4.2: ICMP echo reply, id 27582, seq 1, length 64
01:58:10.056312 IP 192.168.1.2 > 192.168.4.2: ICMP echo reply, id 27582, seq 1, length 64
01:58:10.059719 IP 192.168.4.2 > 192.168.1.1: ICMP echo request, id 27585, seq 1, length 64
01:58:10.059726 IP 192.168.4.2 > 192.168.1.1: ICMP echo request, id 27585, seq 1, length 64
01:58:10.059735 IP 192.168.1.1 > 192.168.4.2: ICMP echo reply, id 27585, seq 1, length 64
01:58:10.059736 IP 192.168.1.1 > 192.168.4.2: ICMP echo reply, id 27585, seq 1, length 64
01:58:10.090121 IP 192.168.4.2 > 192.168.4.1: ICMP echo request, id 27612, seq 1, length 64
01:58:10.090131 IP 192.168.4.1 > 192.168.4.2: ICMP echo reply, id 27612, seq 1, length 64
01:58:15.006273 ARP, Request who-has 192.168.4.2 tell 192.168.4.1, length 28
01:58:15.006738 ARP, Reply 192.168.4.2 is-at 16:db:37:6e:d2:c7 (oui Unknown), length 28
01:58:15.112444 IP 192.168.4.2 > 192.168.2.1: ICMP echo request, id 27621, seq 1, length 64
01:58:15.112462 IP 192.168.4.2 > 192.168.2.1: ICMP echo request, id 27621, seq 1, length 64
01:58:15.112574 IP 192.168.2.1 > 192.168.4.2: ICMP echo reply, id 27621, seq 1, length 64
01:58:15.112583 IP 192.168.2.1 > 192.168.4.2: ICMP echo reply, id 27621, seq 1, length 64
01:58:15.122064 IP 192.168.4.2 > 192.168.2.2: ICMP echo request, id 27624, seq 1, length 64
01:58:15.122082 IP 192.168.2.2 > 192.168.4.2: ICMP echo reply, id 27624, seq 1, length 64
01:58:15.130259 IP 192.168.4.2 > 192.168.3.1: ICMP echo request, id 27627, seq 1, length 64
01:58:15.130274 IP 192.168.3.1 > 192.168.4.2: ICMP echo reply, id 27627, seq 1, length 64
01:58:15.160637 IP 192.168.4.2 > 192.168.3.2: ICMP echo request, id 27636, seq 1, length 64
01:58:15.160647 IP 192.168.4.2 > 192.168.3.2: ICMP echo request, id 27636, seq 1, length 64
01:58:15.160662 IP 192.168.3.2 > 192.168.4.2: ICMP echo reply, id 27636, seq 1, length 64
01:58:15.160664 IP 192.168.3.2 > 192.168.4.2: ICMP echo reply, id 27636, seq 1, length 64
01:58:15.178748 IP 192.168.4.2 > 192.168.1.2: ICMP echo request, id 27649, seq 1, length 64
01:58:15.178757 IP 192.168.4.2 > 192.168.1.2: ICMP echo request, id 27649, seq 1, length 64
01:58:15.178782 IP 192.168.1.2 > 192.168.4.2: ICMP echo reply, id 27649, seq 1, length 64
01:58:15.178783 IP 192.168.1.2 > 192.168.4.2: ICMP echo reply, id 27649, seq 1, length 64
01:58:15.183311 IP 192.168.4.2 > 192.168.1.1: ICMP echo request, id 27652, seq 1, length 64
01:58:15.183318 IP 192.168.4.2 > 192.168.1.1: ICMP echo request, id 27652, seq 1, length 64
01:58:15.183332 IP 192.168.1.1 > 192.168.4.2: ICMP echo reply, id 27652, seq 1, length 64
01:58:15.183333 IP 192.168.1.1 > 192.168.4.2: ICMP echo reply, id 27652, seq 1, length 64
01:58:15.215229 IP 192.168.4.2 > 192.168.4.1: ICMP echo request, id 27679, seq 1, length 64
01:58:15.215235 IP 192.168.4.1 > 192.168.4.2: ICMP echo reply, id 27679, seq 1, length 64
01:58:20.230497 IP 192.168.4.2 > 192.168.2.1: ICMP echo request, id 27690, seq 1, length 64
01:58:20.230514 IP 192.168.4.2 > 192.168.2.1: ICMP echo request, id 27690, seq 1, length 64
01:58:20.230538 IP 192.168.2.1 > 192.168.4.2: ICMP echo reply, id 27690, seq 1, length 64
01:58:20.230541 IP 192.168.2.1 > 192.168.4.2: ICMP echo reply, id 27690, seq 1, length 64
01:58:20.239887 IP 192.168.4.2 > 192.168.2.2: ICMP echo request, id 27693, seq 1, length 64
01:58:20.239909 IP 192.168.2.2 > 192.168.4.2: ICMP echo reply, id 27693, seq 1, length 64
01:58:20.248317 IP 192.168.4.2 > 192.168.3.1: ICMP echo request, id 27696, seq 1, length 64
01:58:20.248328 IP 192.168.3.1 > 192.168.4.2: ICMP echo reply, id 27696, seq 1, length 64
01:58:20.258071 IP 192.168.4.2 > 192.168.3.2: ICMP echo request, id 27705, seq 1, length 64
01:58:20.258080 IP 192.168.4.2 > 192.168.3.2: ICMP echo request, id 27705, seq 1, length 64
01:58:20.258094 IP 192.168.3.2 > 192.168.4.2: ICMP echo reply, id 27705, seq 1, length 64
01:58:20.258095 IP 192.168.3.2 > 192.168.4.2: ICMP echo reply, id 27705, seq 1, length 64
01:58:20.271235 IP 192.168.4.2 > 192.168.1.2: ICMP echo request, id 27717, seq 1, length 64
01:58:20.271243 IP 192.168.4.2 > 192.168.1.2: ICMP echo request, id 27717, seq 1, length 64
01:58:20.271264 IP 192.168.1.2 > 192.168.4.2: ICMP echo reply, id 27717, seq 1, length 64
01:58:20.271265 IP 192.168.1.2 > 192.168.4.2: ICMP echo reply, id 27717, seq 1, length 64
01:58:20.274568 IP 192.168.4.2 > 192.168.1.1: ICMP echo request, id 27720, seq 1, length 64
01:58:20.274574 IP 192.168.4.2 > 192.168.1.1: ICMP echo request, id 27720, seq 1, length 64
01:58:20.274586 IP 192.168.1.1 > 192.168.4.2: ICMP echo reply, id 27720, seq 1, length 64
01:58:20.274587 IP 192.168.1.1 > 192.168.4.2: ICMP echo reply, id 27720, seq 1, length 64
01:58:20.299755 IP 192.168.4.2 > 192.168.4.1: ICMP echo request, id 27747, seq 1, length 64
01:58:20.299763 IP 192.168.4.1 > 192.168.4.2: ICMP echo reply, id 27747, seq 1, length 64
01:58:25.262757 ARP, Request who-has 192.168.3.1 tell 192.168.3.2, length 28
01:58:25.262777 ARP, Reply 192.168.3.1 is-at de:58:f1:38:35:a5 (oui Unknown), length 28
01:58:25.314773 IP 192.168.4.2 > 192.168.2.1: ICMP echo request, id 27758, seq 1, length 64
01:58:25.314783 IP 192.168.4.2 > 192.168.2.1: ICMP echo request, id 27758, seq 1, length 64
01:58:25.314865 IP 192.168.2.1 > 192.168.4.2: ICMP echo reply, id 27758, seq 1, length 64
01:58:25.314868 IP 192.168.2.1 > 192.168.4.2: ICMP echo reply, id 27758, seq 1, length 64
01:58:25.319295 IP 192.168.4.2 > 192.168.2.2: ICMP echo request, id 27761, seq 1, length 64
01:58:25.319307 IP 192.168.2.2 > 192.168.4.2: ICMP echo reply, id 27761, seq 1, length 64
01:58:25.322691 IP 192.168.4.2 > 192.168.3.1: ICMP echo request, id 27764, seq 1, length 64
01:58:25.322701 IP 192.168.3.1 > 192.168.4.2: ICMP echo reply, id 27764, seq 1, length 64
01:58:25.331851 IP 192.168.4.2 > 192.168.3.2: ICMP echo request, id 27773, seq 1, length 64
01:58:25.331869 IP 192.168.4.2 > 192.168.3.2: ICMP echo request, id 27773, seq 1, length 64
01:58:25.331949 IP 192.168.3.2 > 192.168.4.2: ICMP echo reply, id 27773, seq 1, length 64
01:58:25.331952 IP 192.168.3.2 > 192.168.4.2: ICMP echo reply, id 27773, seq 1, length 64
01:58:25.343835 IP 192.168.4.2 > 192.168.1.2: ICMP echo request, id 27785, seq 1, length 64
01:58:25.343842 IP 192.168.4.2 > 192.168.1.2: ICMP echo request, id 27785, seq 1, length 64
01:58:25.343927 IP 192.168.1.2 > 192.168.4.2: ICMP echo reply, id 27785, seq 1, length 64
01:58:25.343929 IP 192.168.1.2 > 192.168.4.2: ICMP echo reply, id 27785, seq 1, length 64
01:58:25.346966 IP 192.168.4.2 > 192.168.1.1: ICMP echo request, id 27788, seq 1, length 64
01:58:25.346971 IP 192.168.4.2 > 192.168.1.1: ICMP echo request, id 27788, seq 1, length 64
01:58:25.347077 IP 192.168.1.1 > 192.168.4.2: ICMP echo reply, id 27788, seq 1, length 64
01:58:25.347080 IP 192.168.1.1 > 192.168.4.2: ICMP echo reply, id 27788, seq 1, length 64
01:58:25.373415 IP 192.168.4.2 > 192.168.4.1: ICMP echo request, id 27815, seq 1, length 64
01:58:25.373426 IP 192.168.4.1 > 192.168.4.2: ICMP echo reply, id 27815, seq 1, length 64

01:58:40.478212 ARP, Request who-has 192.168.2.1 tell 192.168.2.2, length 28
01:58:40.478677 ARP, Reply 192.168.2.1 is-at 4e:80:72:df:66:29 (oui Unknown), length 28
01:58:40.562058 IP 192.168.4.2 > 192.168.2.1: ICMP echo request, id 27976, seq 1, length 64
01:58:40.562075 IP 192.168.4.2 > 192.168.2.1: ICMP echo request, id 27976, seq 1, length 64
01:58:40.562099 IP 192.168.2.1 > 192.168.4.2: ICMP echo reply, id 27976, seq 1, length 64
01:58:40.562105 IP 192.168.2.1 > 192.168.4.2: ICMP echo reply, id 27976, seq 1, length 64
01:58:40.570753 IP 192.168.4.2 > 192.168.2.2: ICMP echo request, id 27979, seq 1, length 64
01:58:40.570778 IP 192.168.2.2 > 192.168.4.2: ICMP echo reply, id 27979, seq 1, length 64
01:58:40.578695 IP 192.168.4.2 > 192.168.3.1: ICMP echo request, id 27982, seq 1, length 64
01:58:40.578711 IP 192.168.3.1 > 192.168.4.2: ICMP echo reply, id 27982, seq 1, length 64
01:58:40.601709 IP 192.168.4.2 > 192.168.3.2: ICMP echo request, id 27991, seq 1, length 64
01:58:40.601723 IP 192.168.4.2 > 192.168.3.2: ICMP echo request, id 27991, seq 1, length 64
01:58:40.601743 IP 192.168.3.2 > 192.168.4.2: ICMP echo reply, id 27991, seq 1, length 64
01:58:40.601772 IP 192.168.3.2 > 192.168.4.2: ICMP echo reply, id 27991, seq 1, length 64
01:58:40.629430 IP 192.168.4.2 > 192.168.1.2: ICMP echo request, id 28003, seq 1, length 64
01:58:40.629439 IP 192.168.4.2 > 192.168.1.2: ICMP echo request, id 28003, seq 1, length 64
01:58:40.629460 IP 192.168.1.2 > 192.168.4.2: ICMP echo reply, id 28003, seq 1, length 64
01:58:40.629461 IP 192.168.1.2 > 192.168.4.2: ICMP echo reply, id 28003, seq 1, length 64
01:58:40.632857 IP 192.168.4.2 > 192.168.1.1: ICMP echo request, id 28006, seq 1, length 64
01:58:40.632864 IP 192.168.4.2 > 192.168.1.1: ICMP echo request, id 28006, seq 1, length 64
01:58:40.632875 IP 192.168.1.1 > 192.168.4.2: ICMP echo reply, id 28006, seq 1, length 64
01:58:40.632876 IP 192.168.1.1 > 192.168.4.2: ICMP echo reply, id 28006, seq 1, length 64
01:58:40.660786 IP 192.168.4.2 > 192.168.4.1: ICMP echo request, id 28033, seq 1, length 64
01:58:40.660793 IP 192.168.4.1 > 192.168.4.2: ICMP echo reply, id 28033, seq 1, length 64
01:58:45.566600 ARP, Request who-has 192.168.4.2 tell 192.168.4.1, length 28
01:58:45.567222 ARP, Reply 192.168.4.2 is-at 16:db:37:6e:d2:c7 (oui Unknown), length 28
01:58:45.673521 IP 192.168.4.2 > 192.168.2.1: ICMP echo request, id 28054, seq 1, length 64
01:58:45.673538 IP 192.168.4.2 > 192.168.2.1: ICMP echo request, id 28054, seq 1, length 64
01:58:45.673566 IP 192.168.2.1 > 192.168.4.2: ICMP echo reply, id 28054, seq 1, length 64
01:58:45.673569 IP 192.168.2.1 > 192.168.4.2: ICMP echo reply, id 28054, seq 1, length 64
01:58:45.683318 IP 192.168.4.2 > 192.168.2.2: ICMP echo request, id 28057, seq 1, length 64
01:58:45.683344 IP 192.168.2.2 > 192.168.4.2: ICMP echo reply, id 28057, seq 1, length 64
01:58:45.692767 IP 192.168.4.2 > 192.168.3.1: ICMP echo request, id 28060, seq 1, length 64
01:58:45.692787 IP 192.168.3.1 > 192.168.4.2: ICMP echo reply, id 28060, seq 1, length 64
01:58:45.707740 IP 192.168.4.2 > 192.168.3.2: ICMP echo request, id 28069, seq 1, length 64
01:58:45.707750 IP 192.168.4.2 > 192.168.3.2: ICMP echo request, id 28069, seq 1, length 64
01:58:45.707764 IP 192.168.3.2 > 192.168.4.2: ICMP echo reply, id 28069, seq 1, length 64
01:58:45.707766 IP 192.168.3.2 > 192.168.4.2: ICMP echo reply, id 28069, seq 1, length 64
01:58:45.724477 IP 192.168.4.2 > 192.168.1.2: ICMP echo request, id 28081, seq 1, length 64
01:58:45.724485 IP 192.168.4.2 > 192.168.1.2: ICMP echo request, id 28081, seq 1, length 64
01:58:45.724532 IP 192.168.1.2 > 192.168.4.2: ICMP echo reply, id 28081, seq 1, length 64
01:58:45.724535 IP 192.168.1.2 > 192.168.4.2: ICMP echo reply, id 28081, seq 1, length 64
01:58:45.728223 IP 192.168.4.2 > 192.168.1.1: ICMP echo request, id 28084, seq 1, length 64
01:58:45.728228 IP 192.168.4.2 > 192.168.1.1: ICMP echo request, id 28084, seq 1, length 64
01:58:45.728236 IP 192.168.1.1 > 192.168.4.2: ICMP echo reply, id 28084, seq 1, length 64
01:58:45.728237 IP 192.168.1.1 > 192.168.4.2: ICMP echo reply, id 28084, seq 1, length 64
01:58:45.752940 IP 192.168.4.2 > 192.168.4.1: ICMP echo request, id 28111, seq 1, length 64
01:58:45.752948 IP 192.168.4.1 > 192.168.4.2: ICMP echo reply, id 28111, seq 1, length 64
01:58:50.686718 ARP, Request who-has 192.168.2.2 tell 192.168.2.1, length 28
01:58:50.686738 ARP, Reply 192.168.2.2 is-at fe:c3:81:6b:fc:a1 (oui Unknown), length 28
01:58:50.718206 ARP, Request who-has 192.168.3.2 tell 192.168.3.1, length 28
01:58:50.718603 ARP, Reply 192.168.3.2 is-at ae:87:e4:75:95:d6 (oui Unknown), length 28
01:58:50.769884 IP 192.168.4.2 > 192.168.2.1: ICMP echo request, id 28122, seq 1, length 64
01:58:50.769900 IP 192.168.4.2 > 192.168.2.1: ICMP echo request, id 28122, seq 1, length 64
01:58:50.769924 IP 192.168.2.1 > 192.168.4.2: ICMP echo reply, id 28122, seq 1, length 64
01:58:50.769927 IP 192.168.2.1 > 192.168.4.2: ICMP echo reply, id 28122, seq 1, length 64
01:58:50.778457 IP 192.168.4.2 > 192.168.2.2: ICMP echo request, id 28125, seq 1, length 64
01:58:50.778474 IP 192.168.2.2 > 192.168.4.2: ICMP echo reply, id 28125, seq 1, length 64
01:58:50.787946 IP 192.168.4.2 > 192.168.3.1: ICMP echo request, id 28128, seq 1, length 64
01:58:50.787968 IP 192.168.3.1 > 192.168.4.2: ICMP echo reply, id 28128, seq 1, length 64
01:58:50.808106 IP 192.168.4.2 > 192.168.3.2: ICMP echo request, id 28137, seq 1, length 64
01:58:50.808117 IP 192.168.4.2 > 192.168.3.2: ICMP echo request, id 28137, seq 1, length 64
01:58:50.808131 IP 192.168.3.2 > 192.168.4.2: ICMP echo reply, id 28137, seq 1, length 64
01:58:50.808133 IP 192.168.3.2 > 192.168.4.2: ICMP echo reply, id 28137, seq 1, length 64
01:58:50.827545 IP 192.168.4.2 > 192.168.1.2: ICMP echo request, id 28149, seq 1, length 64
01:58:50.827555 IP 192.168.4.2 > 192.168.1.2: ICMP echo request, id 28149, seq 1, length 64
01:58:50.827583 IP 192.168.1.2 > 192.168.4.2: ICMP echo reply, id 28149, seq 1, length 64
01:58:50.827585 IP 192.168.1.2 > 192.168.4.2: ICMP echo reply, id 28149, seq 1, length 64
01:58:50.830999 IP 192.168.4.2 > 192.168.1.1: ICMP echo request, id 28152, seq 1, length 64
01:58:50.831006 IP 192.168.4.2 > 192.168.1.1: ICMP echo request, id 28152, seq 1, length 64
01:58:50.831016 IP 192.168.1.1 > 192.168.4.2: ICMP echo reply, id 28152, seq 1, length 64
01:58:50.831017 IP 192.168.1.1 > 192.168.4.2: ICMP echo reply, id 28152, seq 1, length 64
01:58:50.853581 IP 192.168.4.2 > 192.168.4.1: ICMP echo request, id 28179, seq 1, length 64
01:58:50.853589 IP 192.168.4.1 > 192.168.4.2: ICMP echo reply, id 28179, seq 1, length 64
01:58:55.865492 IP 192.168.4.2 > 192.168.2.1: ICMP echo request, id 28188, seq 1, length 64
01:58:55.865518 IP 192.168.4.2 > 192.168.2.1: ICMP echo request, id 28188, seq 1, length 64
01:58:55.865531 IP 192.168.2.1 > 192.168.4.2: ICMP echo reply, id 28188, seq 1, length 64
01:58:55.865533 IP 192.168.2.1 > 192.168.4.2: ICMP echo reply, id 28188, seq 1, length 64
01:58:55.869244 IP 192.168.4.2 > 192.168.2.2: ICMP echo request, id 28191, seq 1, length 64
01:58:55.869254 IP 192.168.2.2 > 192.168.4.2: ICMP echo reply, id 28191, seq 1, length 64
01:58:55.872061 IP 192.168.4.2 > 192.168.3.1: ICMP echo request, id 28194, seq 1, length 64
01:58:55.872069 IP 192.168.3.1 > 192.168.4.2: ICMP echo reply, id 28194, seq 1, length 64
01:58:55.883168 IP 192.168.4.2 > 192.168.3.2: ICMP echo request, id 28203, seq 1, length 64
01:58:55.883176 IP 192.168.4.2 > 192.168.3.2: ICMP echo request, id 28203, seq 1, length 64
01:58:55.883186 IP 192.168.3.2 > 192.168.4.2: ICMP echo reply, id 28203, seq 1, length 64
01:58:55.883187 IP 192.168.3.2 > 192.168.4.2: ICMP echo reply, id 28203, seq 1, length 64
01:58:55.896793 IP 192.168.4.2 > 192.168.1.2: ICMP echo request, id 28215, seq 1, length 64
01:58:55.896800 IP 192.168.4.2 > 192.168.1.2: ICMP echo request, id 28215, seq 1, length 64
01:58:55.896819 IP 192.168.1.2 > 192.168.4.2: ICMP echo reply, id 28215, seq 1, length 64
01:58:55.896820 IP 192.168.1.2 > 192.168.4.2: ICMP echo reply, id 28215, seq 1, length 64
01:58:55.900523 IP 192.168.4.2 > 192.168.1.1: ICMP echo request, id 28218, seq 1, length 64
01:58:55.900528 IP 192.168.4.2 > 192.168.1.1: ICMP echo request, id 28218, seq 1, length 64
01:58:55.900537 IP 192.168.1.1 > 192.168.4.2: ICMP echo reply, id 28218, seq 1, length 64
01:58:55.900538 IP 192.168.1.1 > 192.168.4.2: ICMP echo reply, id 28218, seq 1, length 64
01:58:55.926099 IP 192.168.4.2 > 192.168.4.1: ICMP echo request, id 28245, seq 1, length 64
01:58:55.926107 IP 192.168.4.1 > 192.168.4.2: ICMP echo reply, id 28245, seq 1, length 64

01:59:05.966989 ARP, Request who-has 192.168.3.1 tell 192.168.3.2, length 28
01:59:05.967000 ARP, Reply 192.168.3.1 is-at de:58:f1:38:35:a5 (oui Unknown), length 28
01:59:05.999739 IP 192.168.4.2 > 192.168.2.1: ICMP echo request, id 28325, seq 1, length 64
01:59:05.999756 IP 192.168.4.2 > 192.168.2.1: ICMP echo request, id 28325, seq 1, length 64
01:59:05.999782 IP 192.168.2.1 > 192.168.4.2: ICMP echo reply, id 28325, seq 1, length 64
01:59:05.999785 IP 192.168.2.1 > 192.168.4.2: ICMP echo reply, id 28325, seq 1, length 64
01:59:06.009430 IP 192.168.4.2 > 192.168.2.2: ICMP echo request, id 28328, seq 1, length 64
01:59:06.009448 IP 192.168.2.2 > 192.168.4.2: ICMP echo reply, id 28328, seq 1, length 64
01:59:06.016571 IP 192.168.4.2 > 192.168.3.1: ICMP echo request, id 28331, seq 1, length 64
01:59:06.016581 IP 192.168.3.1 > 192.168.4.2: ICMP echo reply, id 28331, seq 1, length 64
01:59:06.028274 IP 192.168.4.2 > 192.168.3.2: ICMP echo request, id 28340, seq 1, length 64
01:59:06.028283 IP 192.168.4.2 > 192.168.3.2: ICMP echo request, id 28340, seq 1, length 64
01:59:06.028297 IP 192.168.3.2 > 192.168.4.2: ICMP echo reply, id 28340, seq 1, length 64
01:59:06.028298 IP 192.168.3.2 > 192.168.4.2: ICMP echo reply, id 28340, seq 1, length 64
01:59:06.045611 IP 192.168.4.2 > 192.168.1.2: ICMP echo request, id 28352, seq 1, length 64
01:59:06.045617 IP 192.168.4.2 > 192.168.1.2: ICMP echo request, id 28352, seq 1, length 64
01:59:06.045634 IP 192.168.1.2 > 192.168.4.2: ICMP echo reply, id 28352, seq 1, length 64
01:59:06.045635 IP 192.168.1.2 > 192.168.4.2: ICMP echo reply, id 28352, seq 1, length 64
01:59:06.048193 IP 192.168.4.2 > 192.168.1.1: ICMP echo request, id 28355, seq 1, length 64
01:59:06.048196 IP 192.168.4.2 > 192.168.1.1: ICMP echo request, id 28355, seq 1, length 64
01:59:06.048204 IP 192.168.1.1 > 192.168.4.2: ICMP echo reply, id 28355, seq 1, length 64
01:59:06.048205 IP 192.168.1.1 > 192.168.4.2: ICMP echo reply, id 28355, seq 1, length 64
01:59:06.069113 IP 192.168.4.2 > 192.168.4.1: ICMP echo request, id 28382, seq 1, length 64
01:59:06.069120 IP 192.168.4.1 > 192.168.4.2: ICMP echo reply, id 28382, seq 1, length 64
01:59:11.006558 ARP, Request who-has 192.168.4.1 tell 192.168.4.2, length 28
01:59:11.006579 ARP, Reply 192.168.4.1 is-at 56:35:ab:88:19:d3 (oui Unknown), length 28
01:59:11.087220 IP 192.168.4.2 > 192.168.2.1: ICMP echo request, id 28393, seq 1, length 64
01:59:11.087235 IP 192.168.4.2 > 192.168.2.1: ICMP echo request, id 28393, seq 1, length 64
01:59:11.087256 IP 192.168.2.1 > 192.168.4.2: ICMP echo reply, id 28393, seq 1, length 64
01:59:11.087260 IP 192.168.2.1 > 192.168.4.2: ICMP echo reply, id 28393, seq 1, length 64
01:59:11.093812 IP 192.168.4.2 > 192.168.2.2: ICMP echo request, id 28396, seq 1, length 64
01:59:11.093827 IP 192.168.2.2 > 192.168.4.2: ICMP echo reply, id 28396, seq 1, length 64
01:59:11.100479 IP 192.168.4.2 > 192.168.3.1: ICMP echo request, id 28399, seq 1, length 64
