














03:14:19.149785 IP 192.168.1.2 > 192.168.12.1: ICMP echo request, id 30853, seq 1, length 64
03:14:19.149791 IP 192.168.1.2 > 192.168.12.1: ICMP echo request, id 30853, seq 1, length 64
03:14:19.150910 IP 192.168.12.1 > 192.168.1.2: ICMP echo reply, id 30853, seq 1, length 64
03:14:19.150913 IP 192.168.12.1 > 192.168.1.2: ICMP echo reply, id 30853, seq 1, length 64
03:14:19.152437 IP 192.168.10.2 > 192.168.1.2: ICMP echo request, id 30854, seq 1, length 64
03:14:19.152441 IP 192.168.10.2 > 192.168.1.2: ICMP echo request, id 30854, seq 1, length 64
03:14:19.152644 IP 192.168.1.2 > 192.168.10.2: ICMP echo reply, id 30854, seq 1, length 64
03:14:19.152646 IP 192.168.1.2 > 192.168.10.2: ICMP echo reply, id 30854, seq 1, length 64
03:14:20.156646 IP 192.168.1.2 > 192.168.12.1: ICMP echo request, id 30855, seq 1, length 64
03:14:20.156652 IP 192.168.1.2 > 192.168.12.1: ICMP echo request, id 30855, seq 1, length 64
03:14:20.156766 IP 192.168.12.1 > 192.168.1.2: ICMP echo reply, id 30855, seq 1, length 64
03:14:20.156768 IP 192.168.12.1 > 192.168.1.2: ICMP echo reply, id 30855, seq 1, length 64
03:14:20.159266 IP 192.168.10.2 > 192.168.1.2: ICMP echo request, id 30856, seq 1, length 64
03:14:20.159269 IP 192.168.10.2 > 192.168.1.2: ICMP echo request, id 30856, seq 1, length 64
03:14:20.159368 IP 192.168.1.2 > 192.168.10.2: ICMP echo reply, id 30856, seq 1, length 64
03:14:20.159370 IP 192.168.1.2 > 192.168.10.2: ICMP echo reply, id 30856, seq 1, length 64
03:14:21.164088 IP 192.168.1.2 > 192.168.12.1: ICMP echo request, id 30859, seq 1, length 64
03:14:21.164093 IP 192.168.1.2 > 192.168.12.1: ICMP echo request, id 30859, seq 1, length 64
03:14:21.164115 IP 192.168.12.1 > 192.168.1.2: ICMP echo reply, id 30859, seq 1, length 64
03:14:21.164116 IP 192.168.12.1 > 192.168.1.2: ICMP echo reply, id 30859, seq 1, length 64
03:14:21.166051 IP 192.168.10.2 > 192.168.1.2: ICMP echo request, id 30860, seq 1, length 64
03:14:21.166054 IP 192.168.10.2 > 192.168.1.2: ICMP echo request, id 30860, seq 1, length 64
03:14:21.166070 IP 192.168.1.2 > 192.168.10.2: ICMP echo reply, id 30860, seq 1, length 64
03:14:21.166071 IP 192.168.1.2 > 192.168.10.2: ICMP echo reply, id 30860, seq 1, length 64
03:14:22.169555 IP 192.168.1.2 > 192.168.12.1: ICMP echo request, id 30867, seq 1, length 64
03:14:22.169560 IP 192.168.1.2 > 192.168.12.1: ICMP echo request, id 30867, seq 1, length 64
03:14:22.169583 IP 192.168.12.1 > 192.168.1.2: ICMP echo reply, id 30867, seq 1, length 64
03:14:22.169584 IP 192.168.12.1 > 192.168.1.2: ICMP echo reply, id 30867, seq 1, length 64
03:14:22.171434 IP 192.168.10.2 > 192.168.1.2: ICMP echo request, id 30868, seq 1, length 64
03:14:22.171437 IP 192.168.10.2 > 192.168.1.2: ICMP echo request, id 30868, seq 1, length 64
03:14:22.171454 IP 192.168.1.2 > 192.168.10.2: ICMP echo reply, id 30868, seq 1, length 64
03:14:22.171455 IP 192.168.1.2 > 192.168.10.2: ICMP echo reply, id 30868, seq 1, length 64
03:14:23.146713 ARP, Request who-has 192.168.6.2 tell 192.168.6.1, length 28
03:14:23.146735 ARP, Request who-has 192.168.4.1 tell 192.168.4.2, length 28
03:14:23.148638 ARP, Request who-has 192.168.6.1 tell 192.168.6.2, length 28
03:14:23.148644 ARP, Reply 192.168.6.1 is-at aa:70:26:6c:a9:7d (oui Unknown), length 28
03:14:23.152146 ARP, Reply 192.168.6.2 is-at 56:b1:c8:bc:db:c2 (oui Unknown), length 28
03:14:23.152283 ARP, Request who-has 192.168.4.2 tell 192.168.4.1, length 28
03:14:23.152287 ARP, Reply 192.168.4.2 is-at e6:26:9b:b8:1a:39 (oui Unknown), length 28
03:14:23.152318 ARP, Reply 192.168.4.1 is-at 6e:ce:03:64:68:9c (oui Unknown), length 28
03:14:23.175612 IP 192.168.1.2 > 192.168.12.1: ICMP echo request, id 30870, seq 1, length 64
03:14:23.175617 IP 192.168.1.2 > 192.168.12.1: ICMP echo request, id 30870, seq 1, length 64
03:14:23.175883 IP 192.168.12.1 > 192.168.1.2: ICMP echo reply, id 30870, seq 1, length 64
03:14:23.175886 IP 192.168.12.1 > 192.168.1.2: ICMP echo reply, id 30870, seq 1, length 64
03:14:23.178750 IP 192.168.10.2 > 192.168.1.2: ICMP echo request, id 30871, seq 1, length 64
03:14:23.178753 IP 192.168.10.2 > 192.168.1.2: ICMP echo request, id 30871, seq 1, length 64
03:14:23.178931 IP 192.168.1.2 > 192.168.10.2: ICMP echo reply, id 30871, seq 1, length 64
03:14:23.178933 IP 192.168.1.2 > 192.168.10.2: ICMP echo reply, id 30871, seq 1, length 64

03:14:25.191637 IP 192.168.1.2 > 192.168.12.1: ICMP echo request, id 30893, seq 1, length 64
03:14:25.191641 IP 192.168.1.2 > 192.168.12.1: ICMP echo request, id 30893, seq 1, length 64
03:14:25.191678 IP 192.168.12.1 > 192.168.1.2: ICMP echo reply, id 30893, seq 1, length 64
03:14:25.191679 IP 192.168.12.1 > 192.168.1.2: ICMP echo reply, id 30893, seq 1, length 64
03:14:25.196949 IP 192.168.10.2 > 192.168.1.2: ICMP echo request, id 30894, seq 1, length 64
03:14:25.196952 IP 192.168.10.2 > 192.168.1.2: ICMP echo request, id 30894, seq 1, length 64
03:14:25.196974 IP 192.168.1.2 > 192.168.10.2: ICMP echo reply, id 30894, seq 1, length 64
03:14:25.196975 IP 192.168.1.2 > 192.168.10.2: ICMP echo reply, id 30894, seq 1, length 64
03:14:26.202652 IP 192.168.1.2 > 192.168.12.1: ICMP echo request, id 30895, seq 1, length 64
03:14:26.202656 IP 192.168.1.2 > 192.168.12.1: ICMP echo request, id 30895, seq 1, length 64
03:14:26.202679 IP 192.168.12.1 > 192.168.1.2: ICMP echo reply, id 30895, seq 1, length 64
03:14:26.202680 IP 192.168.12.1 > 192.168.1.2: ICMP echo reply, id 30895, seq 1, length 64
03:14:26.207466 IP 192.168.10.2 > 192.168.1.2: ICMP echo request, id 30896, seq 1, length 64
03:14:26.207469 IP 192.168.10.2 > 192.168.1.2: ICMP echo request, id 30896, seq 1, length 64
03:14:26.207483 IP 192.168.1.2 > 192.168.10.2: ICMP echo reply, id 30896, seq 1, length 64
03:14:26.207484 IP 192.168.1.2 > 192.168.10.2: ICMP echo reply, id 30896, seq 1, length 64
03:14:27.213091 IP 192.168.1.2 > 192.168.12.1: ICMP echo request, id 30897, seq 1, length 64
03:14:27.213095 IP 192.168.1.2 > 192.168.12.1: ICMP echo request, id 30897, seq 1, length 64
03:14:27.213165 IP 192.168.12.1 > 192.168.1.2: ICMP echo reply, id 30897, seq 1, length 64
03:14:27.213166 IP 192.168.12.1 > 192.168.1.2: ICMP echo reply, id 30897, seq 1, length 64
03:14:27.219608 IP 192.168.10.2 > 192.168.1.2: ICMP echo request, id 30898, seq 1, length 64
03:14:27.219611 IP 192.168.10.2 > 192.168.1.2: ICMP echo request, id 30898, seq 1, length 64
03:14:27.219641 IP 192.168.1.2 > 192.168.10.2: ICMP echo reply, id 30898, seq 1, length 64
03:14:27.219642 IP 192.168.1.2 > 192.168.10.2: ICMP echo reply, id 30898, seq 1, length 64
03:14:30.430423 IP 192.168.1.2 > 192.168.5.2: ICMP echo request, id 30910, seq 1, length 64
03:14:30.430430 IP 192.168.1.2 > 192.168.5.2: ICMP echo request, id 30910, seq 1, length 64
03:14:30.431414 IP 192.168.5.2 > 192.168.1.2: ICMP echo reply, id 30910, seq 1, length 64
03:14:30.431421 IP 192.168.5.2 > 192.168.1.2: ICMP echo reply, id 30910, seq 1, length 64
03:14:30.450900 IP 192.168.1.2 > 192.168.8.2: ICMP echo request, id 30917, seq 1, length 64
03:14:30.450907 IP 192.168.1.2 > 192.168.8.2: ICMP echo request, id 30917, seq 1, length 64
03:14:30.453485 IP 192.168.8.2 > 192.168.1.2: ICMP echo reply, id 30917, seq 1, length 64
03:14:30.453490 IP 192.168.8.2 > 192.168.1.2: ICMP echo reply, id 30917, seq 1, length 64
03:14:30.471707 IP 192.168.1.2 > 192.168.7.2: ICMP echo request, id 30924, seq 1, length 64
03:14:30.471713 IP 192.168.1.2 > 192.168.7.2: ICMP echo request, id 30924, seq 1, length 64
03:14:30.473621 IP 192.168.7.2 > 192.168.1.2: ICMP echo reply, id 30924, seq 1, length 64
03:14:30.473626 IP 192.168.7.2 > 192.168.1.2: ICMP echo reply, id 30924, seq 1, length 64
03:14:30.489276 IP 192.168.1.2 > 192.168.12.2: ICMP echo request, id 30931, seq 1, length 64
03:14:30.489282 IP 192.168.1.2 > 192.168.12.2: ICMP echo request, id 30931, seq 1, length 64
03:14:30.492919 IP 192.168.12.2 > 192.168.1.2: ICMP echo reply, id 30931, seq 1, length 64
03:14:30.492923 IP 192.168.12.2 > 192.168.1.2: ICMP echo reply, id 30931, seq 1, length 64
03:14:30.512632 IP 192.168.1.2 > 192.168.12.3: ICMP echo request, id 30938, seq 1, length 64
03:14:30.512638 IP 192.168.1.2 > 192.168.12.3: ICMP echo request, id 30938, seq 1, length 64
03:14:30.516634 IP 192.168.12.3 > 192.168.1.2: ICMP echo reply, id 30938, seq 1, length 64
03:14:30.516640 IP 192.168.12.3 > 192.168.1.2: ICMP echo reply, id 30938, seq 1, length 64
03:14:30.535195 IP 192.168.1.2 > 192.168.13.2: ICMP echo request, id 30945, seq 1, length 64
03:14:30.535201 IP 192.168.1.2 > 192.168.13.2: ICMP echo request, id 30945, seq 1, length 64
03:14:30.538921 IP 192.168.13.2 > 192.168.1.2: ICMP echo reply, id 30945, seq 1, length 64
03:14:30.538926 IP 192.168.13.2 > 192.168.1.2: ICMP echo reply, id 30945, seq 1, length 64
03:14:30.619796 IP 192.168.1.2.49394 > 192.168.5.2.http: Flags [S], seq 1573545802, win 5840, options [mss 1460], length 0
03:14:30.619809 IP 192.168.4.2 > 192.168.1.2: ICMP time exceeded in-transit, length 52
03:14:30.625247 IP 192.168.1.2.45270 > 192.168.5.2.http: Flags [S], seq 1111791698, win 5840, options [mss 1460], length 0
03:14:30.625252 IP 192.168.1.2.45270 > 192.168.5.2.http: Flags [S], seq 1111791698, win 5840, options [mss 1460], length 0
03:14:30.625279 IP 192.168.1.2.54746 > 192.168.5.2.http: Flags [S], seq 2122672446, win 5840, options [mss 1460], length 0
03:14:30.625281 IP 192.168.1.2.54746 > 192.168.5.2.http: Flags [S], seq 2122672446, win 5840, options [mss 1460], length 0
03:14:30.625304 IP 192.168.1.2.56555 > 192.168.5.2.http: Flags [S], seq 901780800, win 5840, options [mss 1460], length 0
03:14:30.625306 IP 192.168.1.2.56555 > 192.168.5.2.http: Flags [S], seq 901780800, win 5840, options [mss 1460], length 0
03:14:30.625328 IP 192.168.1.2.44279 > 192.168.5.2.http: Flags [S], seq 1027650606, win 5840, options [mss 1460], length 0
03:14:30.625330 IP 192.168.1.2.44279 > 192.168.5.2.http: Flags [S], seq 1027650606, win 5840, options [mss 1460], length 0
03:14:30.625352 IP 192.168.1.2.49628 > 192.168.5.2.http: Flags [S], seq 1716958477, win 5840, options [mss 1460], length 0
03:14:30.625357 IP 192.168.4.2 > 192.168.1.2: ICMP time exceeded in-transit, length 52
03:14:30.627673 IP 192.168.1.2.32868 > 192.168.5.2.http: Flags [S], seq 155742181, win 5840, options [mss 1460], length 0
03:14:30.627675 IP 192.168.1.2.32868 > 192.168.5.2.http: Flags [S], seq 155742181, win 5840, options [mss 1460], length 0
03:14:30.627703 IP 192.168.1.2.41146 > 192.168.5.2.http: Flags [S], seq 1111323204, win 5840, options [mss 1460], length 0
03:14:30.627705 IP 192.168.1.2.41146 > 192.168.5.2.http: Flags [S], seq 1111323204, win 5840, options [mss 1460], length 0
03:14:30.627729 IP 192.168.1.2.41352 > 192.168.5.2.http: Flags [S], seq 288833275, win 5840, options [mss 1460], length 0
03:14:30.627730 IP 192.168.1.2.41352 > 192.168.5.2.http: Flags [S], seq 288833275, win 5840, options [mss 1460], length 0
03:14:30.627754 IP 192.168.1.2.41325 > 192.168.5.2.http: Flags [S], seq 1887395214, win 5840, options [mss 1460], length 0
03:14:30.627756 IP 192.168.1.2.41325 > 192.168.5.2.http: Flags [S], seq 1887395214, win 5840, options [mss 1460], length 0
03:14:30.627779 IP 192.168.1.2.44000 > 192.168.5.2.http: Flags [S], seq 1738726173, win 5840, options [mss 1460], length 0
03:14:30.627784 IP 192.168.4.2 > 192.168.1.2: ICMP time exceeded in-transit, length 52
03:14:30.627809 IP 192.168.1.2.48124 > 192.168.5.2.http: Flags [S], seq 3682069360, win 5840, options [mss 1460], length 0
03:14:30.627811 IP 192.168.1.2.48124 > 192.168.5.2.http: Flags [S], seq 3682069360, win 5840, options [mss 1460], length 0
03:14:30.630375 IP 192.168.5.2.http > 192.168.1.2.45270: Flags [R.], seq 0, ack 1111791699, win 0, length 0
03:14:30.630380 IP 192.168.5.2.http > 192.168.1.2.45270: Flags [R.], seq 0, ack 1, win 0, length 0
03:14:30.630426 IP 192.168.5.2.http > 192.168.1.2.54746: Flags [R.], seq 0, ack 2122672447, win 0, length 0
03:14:30.630428 IP 192.168.5.2.http > 192.168.1.2.54746: Flags [R.], seq 0, ack 1, win 0, length 0
03:14:30.630467 IP 192.168.5.2.http > 192.168.1.2.56555: Flags [R.], seq 0, ack 901780801, win 0, length 0
03:14:30.630469 IP 192.168.5.2.http > 192.168.1.2.56555: Flags [R.], seq 0, ack 1, win 0, length 0
03:14:30.630564 IP 192.168.5.2.http > 192.168.1.2.44279: Flags [R.], seq 0, ack 1027650607, win 0, length 0
03:14:30.630569 IP 192.168.5.2.http > 192.168.1.2.44279: Flags [R.], seq 0, ack 1, win 0, length 0
03:14:30.630864 IP 192.168.1.2.43586 > 192.168.5.2.http: Flags [S], seq 980015646, win 5840, options [mss 1460], length 0
03:14:30.630867 IP 192.168.1.2.43586 > 192.168.5.2.http: Flags [S], seq 980015646, win 5840, options [mss 1460], length 0
03:14:30.632665 IP 192.168.5.2.http > 192.168.1.2.32868: Flags [R.], seq 0, ack 155742182, win 0, length 0
03:14:30.632668 IP 192.168.5.2.http > 192.168.1.2.32868: Flags [R.], seq 0, ack 1, win 0, length 0
03:14:30.632703 IP 192.168.5.2.http > 192.168.1.2.41146: Flags [R.], seq 0, ack 1111323205, win 0, length 0
03:14:30.632705 IP 192.168.5.2.http > 192.168.1.2.41146: Flags [R.], seq 0, ack 1, win 0, length 0
03:14:30.632731 IP 192.168.5.2.http > 192.168.1.2.41352: Flags [R.], seq 0, ack 288833276, win 0, length 0
03:14:30.632733 IP 192.168.5.2.http > 192.168.1.2.41352: Flags [R.], seq 0, ack 1, win 0, length 0
03:14:30.632763 IP 192.168.5.2.http > 192.168.1.2.41325: Flags [R.], seq 0, ack 1887395215, win 0, length 0
03:14:30.632765 IP 192.168.5.2.http > 192.168.1.2.41325: Flags [R.], seq 0, ack 1, win 0, length 0
03:14:30.635331 IP 192.168.5.2.http > 192.168.1.2.48124: Flags [R.], seq 0, ack 3682069361, win 0, length 0
03:14:30.635335 IP 192.168.5.2.http > 192.168.1.2.48124: Flags [R.], seq 0, ack 1, win 0, length 0
03:14:30.638572 IP 192.168.5.2.http > 192.168.1.2.43586: Flags [R.], seq 0, ack 980015647, win 0, length 0
03:14:30.638578 IP 192.168.5.2.http > 192.168.1.2.43586: Flags [R.], seq 0, ack 1, win 0, length 0
03:14:30.639188 IP 192.168.1.2.56296 > 192.168.5.2.http: Flags [S], seq 3615916757, win 5840, options [mss 1460], length 0
03:14:30.639192 IP 192.168.1.2.56296 > 192.168.5.2.http: Flags [S], seq 3615916757, win 5840, options [mss 1460], length 0
03:14:30.640419 IP 192.168.1.2.52438 > 192.168.5.2.http: Flags [S], seq 468363176, win 5840, options [mss 1460], length 0
03:14:30.640438 IP 192.168.1.2.52438 > 192.168.5.2.http: Flags [S], seq 468363176, win 5840, options [mss 1460], length 0
03:14:30.640699 IP 192.168.1.2.41344 > 192.168.5.2.http: Flags [S], seq 3005706488, win 5840, options [mss 1460], length 0
03:14:30.640701 IP 192.168.1.2.41344 > 192.168.5.2.http: Flags [S], seq 3005706488, win 5840, options [mss 1460], length 0
03:14:30.640729 IP 192.168.1.2.51353 > 192.168.5.2.http: Flags [S], seq 1256193420, win 5840, options [mss 1460], length 0
03:14:30.640731 IP 192.168.1.2.51353 > 192.168.5.2.http: Flags [S], seq 1256193420, win 5840, options [mss 1460], length 0
03:14:30.640756 IP 192.168.1.2.38932 > 192.168.5.2.http: Flags [S], seq 468744315, win 5840, options [mss 1460], length 0
03:14:30.640758 IP 192.168.1.2.38932 > 192.168.5.2.http: Flags [S], seq 468744315, win 5840, options [mss 1460], length 0
03:14:30.641778 IP 192.168.5.2.http > 192.168.1.2.56296: Flags [R.], seq 0, ack 3615916758, win 0, length 0
03:14:30.641782 IP 192.168.5.2.http > 192.168.1.2.56296: Flags [R.], seq 0, ack 1, win 0, length 0
03:14:30.642804 IP 192.168.1.2.57825 > 192.168.5.2.http: Flags [S], seq 2341302818, win 5840, options [mss 1460], length 0
03:14:30.642808 IP 192.168.1.2.57825 > 192.168.5.2.http: Flags [S], seq 2341302818, win 5840, options [mss 1460], length 0
03:14:30.643295 IP 192.168.5.2.http > 192.168.1.2.52438: Flags [R.], seq 0, ack 468363177, win 0, length 0
03:14:30.643299 IP 192.168.5.2.http > 192.168.1.2.52438: Flags [R.], seq 0, ack 1, win 0, length 0
03:14:30.643624 IP 192.168.5.2.http > 192.168.1.2.41344: Flags [R.], seq 0, ack 3005706489, win 0, length 0
03:14:30.643628 IP 192.168.5.2.http > 192.168.1.2.41344: Flags [R.], seq 0, ack 1, win 0, length 0
03:14:30.643659 IP 192.168.5.2.http > 192.168.1.2.51353: Flags [R.], seq 0, ack 1256193421, win 0, length 0
03:14:30.643660 IP 192.168.5.2.http > 192.168.1.2.51353: Flags [R.], seq 0, ack 1, win 0, length 0
03:14:30.643686 IP 192.168.5.2.http > 192.168.1.2.38932: Flags [R.], seq 0, ack 468744316, win 0, length 0
03:14:30.643688 IP 192.168.5.2.http > 192.168.1.2.38932: Flags [R.], seq 0, ack 1, win 0, length 0
03:14:30.644619 IP 192.168.5.2.http > 192.168.1.2.57825: Flags [R.], seq 0, ack 2341302819, win 0, length 0
03:14:30.644623 IP 192.168.5.2.http > 192.168.1.2.57825: Flags [R.], seq 0, ack 1, win 0, length 0
03:14:30.662973 IP 192.168.1.2.43700 > 192.168.8.2.http: Flags [S], seq 1537022305, win 5840, options [mss 1460], length 0
03:14:30.662980 IP 192.168.1.2.43700 > 192.168.8.2.http: Flags [S], seq 1537022305, win 5840, options [mss 1460], length 0
03:14:30.663019 IP 192.168.1.2.40737 > 192.168.8.2.http: Flags [S], seq 3441112573, win 5840, options [mss 1460], length 0
03:14:30.663021 IP 192.168.1.2.40737 > 192.168.8.2.http: Flags [S], seq 3441112573, win 5840, options [mss 1460], length 0
03:14:30.663048 IP 192.168.1.2.33065 > 192.168.8.2.http: Flags [S], seq 1587321720, win 5840, options [mss 1460], length 0
03:14:30.663050 IP 192.168.1.2.33065 > 192.168.8.2.http: Flags [S], seq 1587321720, win 5840, options [mss 1460], length 0
03:14:30.663075 IP 192.168.1.2.58231 > 192.168.8.2.http: Flags [S], seq 1038726360, win 5840, options [mss 1460], length 0
03:14:30.663076 IP 192.168.1.2.58231 > 192.168.8.2.http: Flags [S], seq 1038726360, win 5840, options [mss 1460], length 0
03:14:30.663100 IP 192.168.1.2.46022 > 192.168.8.2.http: Flags [S], seq 1788931917, win 5840, options [mss 1460], length 0
03:14:30.663102 IP 192.168.1.2.46022 > 192.168.8.2.http: Flags [S], seq 1788931917, win 5840, options [mss 1460], length 0
03:14:30.663126 IP 192.168.1.2.54911 > 192.168.8.2.http: Flags [S], seq 2171541287, win 5840, options [mss 1460], length 0
03:14:30.663133 IP 192.168.4.2 > 192.168.1.2: ICMP time exceeded in-transit, length 52
03:14:30.663159 IP 192.168.1.2.43673 > 192.168.8.2.http: Flags [S], seq 1058727377, win 5840, options [mss 1460], length 0
03:14:30.663163 IP 192.168.4.2 > 192.168.1.2: ICMP time exceeded in-transit, length 52
03:14:30.663187 IP 192.168.1.2.57706 > 192.168.8.2.http: Flags [S], seq 1422886368, win 5840, options [mss 1460], length 0
03:14:30.663190 IP 192.168.4.2 > 192.168.1.2: ICMP time exceeded in-transit, length 52
03:14:30.663214 IP 192.168.1.2.44918 > 192.168.8.2.http: Flags [S], seq 464094334, win 5840, options [mss 1460], length 0
03:14:30.663216 IP 192.168.1.2.44918 > 192.168.8.2.http: Flags [S], seq 464094334, win 5840, options [mss 1460], length 0
03:14:30.663244 IP 192.168.1.2.33142 > 192.168.8.2.http: Flags [S], seq 1481732673, win 5840, options [mss 1460], length 0
03:14:30.663246 IP 192.168.1.2.33142 > 192.168.8.2.http: Flags [S], seq 1481732673, win 5840, options [mss 1460], length 0
03:14:30.664867 IP 192.168.6.2 > 192.168.1.2: ICMP time exceeded in-transit, length 52
03:14:30.664871 IP 192.168.6.2 > 192.168.1.2: ICMP time exceeded in-transit, length 52
03:14:30.664909 IP 192.168.6.2 > 192.168.1.2: ICMP time exceeded in-transit, length 52
03:14:30.664911 IP 192.168.6.2 > 192.168.1.2: ICMP time exceeded in-transit, length 52
03:14:30.664942 IP 192.168.6.2 > 192.168.1.2: ICMP time exceeded in-transit, length 52
03:14:30.664944 IP 192.168.6.2 > 192.168.1.2: ICMP time exceeded in-transit, length 52
03:14:30.668501 IP 192.168.8.2.http > 192.168.1.2.43700: Flags [R.], seq 0, ack 1537022306, win 0, length 0
03:14:30.668505 IP 192.168.8.2.http > 192.168.1.2.43700: Flags [R.], seq 0, ack 1, win 0, length 0
03:14:30.668896 IP 192.168.8.2.http > 192.168.1.2.40737: Flags [R.], seq 0, ack 3441112574, win 0, length 0
03:14:30.668900 IP 192.168.8.2.http > 192.168.1.2.40737: Flags [R.], seq 0, ack 1, win 0, length 0
03:14:30.668941 IP 192.168.8.2.http > 192.168.1.2.33065: Flags [R.], seq 0, ack 1587321721, win 0, length 0
03:14:30.668943 IP 192.168.8.2.http > 192.168.1.2.33065: Flags [R.], seq 0, ack 1, win 0, length 0
03:14:30.668980 IP 192.168.8.2.http > 192.168.1.2.33142: Flags [R.], seq 0, ack 1481732674, win 0, length 0
03:14:30.668983 IP 192.168.8.2.http > 192.168.1.2.33142: Flags [R.], seq 0, ack 1, win 0, length 0
03:14:30.670432 IP 192.168.1.2.45883 > 192.168.8.2.http: Flags [S], seq 3842372820, win 5840, options [mss 1460], length 0
03:14:30.670434 IP 192.168.1.2.45883 > 192.168.8.2.http: Flags [S], seq 3842372820, win 5840, options [mss 1460], length 0
03:14:30.670460 IP 192.168.1.2.45887 > 192.168.8.2.http: Flags [S], seq 3340068362, win 5840, options [mss 1460], length 0
03:14:30.670462 IP 192.168.1.2.45887 > 192.168.8.2.http: Flags [S], seq 3340068362, win 5840, options [mss 1460], length 0
03:14:30.670491 IP 192.168.1.2.33190 > 192.168.8.2.http: Flags [S], seq 4047133155, win 5840, options [mss 1460], length 0
03:14:30.670492 IP 192.168.1.2.33190 > 192.168.8.2.http: Flags [S], seq 4047133155, win 5840, options [mss 1460], length 0
03:14:30.672204 IP 192.168.1.2.50210 > 192.168.8.2.http: Flags [S], seq 2039505927, win 5840, options [mss 1460], length 0
03:14:30.672207 IP 192.168.1.2.50210 > 192.168.8.2.http: Flags [S], seq 2039505927, win 5840, options [mss 1460], length 0
03:14:30.673404 IP 192.168.1.2.35797 > 192.168.8.2.http: Flags [S], seq 653749666, win 5840, options [mss 1460], length 0
03:14:30.673406 IP 192.168.1.2.35797 > 192.168.8.2.http: Flags [S], seq 653749666, win 5840, options [mss 1460], length 0
03:14:30.673442 IP 192.168.1.2.51174 > 192.168.8.2.http: Flags [S], seq 1971112392, win 5840, options [mss 1460], length 0
03:14:30.673443 IP 192.168.1.2.51174 > 192.168.8.2.http: Flags [S], seq 1971112392, win 5840, options [mss 1460], length 0
03:14:30.674556 IP 192.168.8.2.http > 192.168.1.2.45883: Flags [R.], seq 0, ack 3842372821, win 0, length 0
03:14:30.674559 IP 192.168.8.2.http > 192.168.1.2.45883: Flags [R.], seq 0, ack 1, win 0, length 0
03:14:30.676021 IP 192.168.8.2.http > 192.168.1.2.45887: Flags [R.], seq 0, ack 3340068363, win 0, length 0
03:14:30.676025 IP 192.168.8.2.http > 192.168.1.2.45887: Flags [R.], seq 0, ack 1, win 0, length 0
03:14:30.676186 IP 192.168.8.2.http > 192.168.1.2.33190: Flags [R.], seq 0, ack 4047133156, win 0, length 0
03:14:30.676189 IP 192.168.8.2.http > 192.168.1.2.33190: Flags [R.], seq 0, ack 1, win 0, length 0
03:14:30.676238 IP 192.168.8.2.http > 192.168.1.2.50210: Flags [R.], seq 0, ack 2039505928, win 0, length 0
03:14:30.676241 IP 192.168.8.2.http > 192.168.1.2.50210: Flags [R.], seq 0, ack 1, win 0, length 0
03:14:30.677527 IP 192.168.8.2.http > 192.168.1.2.35797: Flags [R.], seq 0, ack 653749667, win 0, length 0
03:14:30.677532 IP 192.168.8.2.http > 192.168.1.2.35797: Flags [R.], seq 0, ack 1, win 0, length 0
03:14:30.677820 IP 192.168.8.2.http > 192.168.1.2.51174: Flags [R.], seq 0, ack 1971112393, win 0, length 0
03:14:30.677824 IP 192.168.8.2.http > 192.168.1.2.51174: Flags [R.], seq 0, ack 1, win 0, length 0
03:14:31.681109 IP 192.168.1.2.37982 > 192.168.7.2.http: Flags [S], seq 3590520610, win 5840, options [mss 1460], length 0
03:14:31.681116 IP 192.168.1.2.37982 > 192.168.7.2.http: Flags [S], seq 3590520610, win 5840, options [mss 1460], length 0
03:14:31.681162 IP 192.168.1.2.33800 > 192.168.7.2.http: Flags [S], seq 1998026694, win 5840, options [mss 1460], length 0
03:14:31.681164 IP 192.168.1.2.33800 > 192.168.7.2.http: Flags [S], seq 1998026694, win 5840, options [mss 1460], length 0
03:14:31.681199 IP 192.168.1.2.42558 > 192.168.7.2.http: Flags [S], seq 1884978018, win 5840, options [mss 1460], length 0
03:14:31.681201 IP 192.168.1.2.42558 > 192.168.7.2.http: Flags [S], seq 1884978018, win 5840, options [mss 1460], length 0
03:14:31.681233 IP 192.168.1.2.58302 > 192.168.7.2.http: Flags [S], seq 4282928606, win 5840, options [mss 1460], length 0
03:14:31.681240 IP 192.168.4.2 > 192.168.1.2: ICMP time exceeded in-transit, length 52
03:14:31.681276 IP 192.168.1.2.32858 > 192.168.7.2.http: Flags [S], seq 4034999859, win 5840, options [mss 1460], length 0
03:14:31.681278 IP 192.168.1.2.32858 > 192.168.7.2.http: Flags [S], seq 4034999859, win 5840, options [mss 1460], length 0
03:14:31.681330 IP 192.168.1.2.45598 > 192.168.7.2.http: Flags [S], seq 3763923703, win 5840, options [mss 1460], length 0
03:14:31.681334 IP 192.168.1.2.45598 > 192.168.7.2.http: Flags [S], seq 3763923703, win 5840, options [mss 1460], length 0
03:14:31.681376 IP 192.168.1.2.36458 > 192.168.7.2.http: Flags [S], seq 3586776498, win 5840, options [mss 1460], length 0
03:14:31.681392 IP 192.168.1.2.47443 > 192.168.7.2.http: Flags [S], seq 3652572872, win 5840, options [mss 1460], length 0
03:14:31.681394 IP 192.168.1.2.47443 > 192.168.7.2.http: Flags [S], seq 3652572872, win 5840, options [mss 1460], length 0
03:14:31.681428 IP 192.168.1.2.57750 > 192.168.7.2.http: Flags [S], seq 2104189181, win 5840, options [mss 1460], length 0
03:14:31.681430 IP 192.168.1.2.57750 > 192.168.7.2.http: Flags [S], seq 2104189181, win 5840, options [mss 1460], length 0
03:14:31.681462 IP 192.168.1.2.50792 > 192.168.7.2.http: Flags [S], seq 3006638147, win 5840, options [mss 1460], length 0
03:14:31.681476 IP 192.168.1.2.37439 > 192.168.7.2.http: Flags [S], seq 3106427519, win 5840, options [mss 1460], length 0
03:14:31.681477 IP 192.168.1.2.37439 > 192.168.7.2.http: Flags [S], seq 3106427519, win 5840, options [mss 1460], length 0
03:14:31.684458 IP 192.168.6.2 > 192.168.1.2: ICMP time exceeded in-transit, length 52
03:14:31.684466 IP 192.168.6.2 > 192.168.1.2: ICMP time exceeded in-transit, length 52
03:14:31.685018 IP 192.168.6.2 > 192.168.1.2: ICMP time exceeded in-transit, length 52
03:14:31.685023 IP 192.168.6.2 > 192.168.1.2: ICMP time exceeded in-transit, length 52
03:14:31.685069 IP 192.168.6.2 > 192.168.1.2: ICMP time exceeded in-transit, length 52
03:14:31.685071 IP 192.168.6.2 > 192.168.1.2: ICMP time exceeded in-transit, length 52
03:14:31.686909 IP 192.168.1.2.53925 > 192.168.7.2.http: Flags [S], seq 778790802, win 5840, options [mss 1460], length 0
03:14:31.686914 IP 192.168.1.2.53925 > 192.168.7.2.http: Flags [S], seq 778790802, win 5840, options [mss 1460], length 0
03:14:31.687563 IP 192.168.7.2.http > 192.168.1.2.37982: Flags [R.], seq 0, ack 3590520611, win 0, length 0
03:14:31.687568 IP 192.168.7.2.http > 192.168.1.2.37982: Flags [R.], seq 0, ack 1, win 0, length 0
03:14:31.688123 IP 192.168.7.2.http > 192.168.1.2.45598: Flags [R.], seq 0, ack 3763923704, win 0, length 0
03:14:31.688127 IP 192.168.7.2.http > 192.168.1.2.45598: Flags [R.], seq 0, ack 1, win 0, length 0
03:14:31.688178 IP 192.168.7.2.http > 192.168.1.2.47443: Flags [R.], seq 0, ack 3652572873, win 0, length 0
03:14:31.688182 IP 192.168.7.2.http > 192.168.1.2.47443: Flags [R.], seq 0, ack 1, win 0, length 0
03:14:31.688225 IP 192.168.7.2.http > 192.168.1.2.57750: Flags [R.], seq 0, ack 2104189182, win 0, length 0
03:14:31.688228 IP 192.168.7.2.http > 192.168.1.2.57750: Flags [R.], seq 0, ack 1, win 0, length 0
03:14:31.688287 IP 192.168.7.2.http > 192.168.1.2.37439: Flags [R.], seq 0, ack 3106427520, win 0, length 0
03:14:31.688291 IP 192.168.7.2.http > 192.168.1.2.37439: Flags [R.], seq 0, ack 1, win 0, length 0
03:14:31.691584 IP 192.168.1.2.44940 > 192.168.7.2.http: Flags [S], seq 1423743875, win 5840, options [mss 1460], length 0
03:14:31.691587 IP 192.168.1.2.44940 > 192.168.7.2.http: Flags [S], seq 1423743875, win 5840, options [mss 1460], length 0
03:14:31.692522 IP 192.168.7.2.http > 192.168.1.2.53925: Flags [R.], seq 0, ack 778790803, win 0, length 0
03:14:31.692526 IP 192.168.7.2.http > 192.168.1.2.53925: Flags [R.], seq 0, ack 1, win 0, length 0
03:14:31.695031 IP 192.168.1.2.59982 > 192.168.7.2.http: Flags [S], seq 38477731, win 5840, options [mss 1460], length 0
03:14:31.695034 IP 192.168.1.2.59982 > 192.168.7.2.http: Flags [S], seq 38477731, win 5840, options [mss 1460], length 0
03:14:31.695071 IP 192.168.1.2.40690 > 192.168.7.2.http: Flags [S], seq 439422855, win 5840, options [mss 1460], length 0
03:14:31.695073 IP 192.168.1.2.40690 > 192.168.7.2.http: Flags [S], seq 439422855, win 5840, options [mss 1460], length 0
03:14:31.695114 IP 192.168.1.2.44234 > 192.168.7.2.http: Flags [S], seq 3569166637, win 5840, options [mss 1460], length 0
03:14:31.695116 IP 192.168.1.2.44234 > 192.168.7.2.http: Flags [S], seq 3569166637, win 5840, options [mss 1460], length 0
03:14:31.696305 IP 192.168.7.2.http > 192.168.1.2.44940: Flags [R.], seq 0, ack 1423743876, win 0, length 0
03:14:31.696309 IP 192.168.7.2.http > 192.168.1.2.44940: Flags [R.], seq 0, ack 1, win 0, length 0
03:14:31.699826 IP 192.168.7.2.http > 192.168.1.2.59982: Flags [R.], seq 0, ack 38477732, win 0, length 0
03:14:31.699832 IP 192.168.7.2.http > 192.168.1.2.59982: Flags [R.], seq 0, ack 1, win 0, length 0
03:14:31.700034 IP 192.168.7.2.http > 192.168.1.2.40690: Flags [R.], seq 0, ack 439422856, win 0, length 0
03:14:31.700037 IP 192.168.7.2.http > 192.168.1.2.40690: Flags [R.], seq 0, ack 1, win 0, length 0
03:14:31.700077 IP 192.168.7.2.http > 192.168.1.2.44234: Flags [R.], seq 0, ack 3569166638, win 0, length 0
03:14:31.700079 IP 192.168.7.2.http > 192.168.1.2.44234: Flags [R.], seq 0, ack 1, win 0, length 0
03:14:32.695850 IP 192.168.1.2.47382 > 192.168.12.2.http: Flags [S], seq 3582755275, win 5840, options [mss 1460], length 0
03:14:32.695861 IP 192.168.4.2 > 192.168.1.2: ICMP time exceeded in-transit, length 52
03:14:32.695904 IP 192.168.1.2.47246 > 192.168.12.2.http: Flags [S], seq 1092335066, win 5840, options [mss 1460], length 0
03:14:32.695907 IP 192.168.1.2.47246 > 192.168.12.2.http: Flags [S], seq 1092335066, win 5840, options [mss 1460], length 0
03:14:32.695935 IP 192.168.1.2.47688 > 192.168.12.2.http: Flags [S], seq 2426288680, win 5840, options [mss 1460], length 0
03:14:32.695937 IP 192.168.1.2.47688 > 192.168.12.2.http: Flags [S], seq 2426288680, win 5840, options [mss 1460], length 0
03:14:32.695962 IP 192.168.1.2.57130 > 192.168.12.2.http: Flags [S], seq 4221561382, win 5840, options [mss 1460], length 0
03:14:32.695963 IP 192.168.1.2.57130 > 192.168.12.2.http: Flags [S], seq 4221561382, win 5840, options [mss 1460], length 0
03:14:32.695987 IP 192.168.1.2.55783 > 192.168.12.2.http: Flags [S], seq 2889858542, win 5840, options [mss 1460], length 0
03:14:32.695989 IP 192.168.1.2.55783 > 192.168.12.2.http: Flags [S], seq 2889858542, win 5840, options [mss 1460], length 0
03:14:32.696013 IP 192.168.1.2.43498 > 192.168.12.2.http: Flags [S], seq 1728882438, win 5840, options [mss 1460], length 0
03:14:32.696014 IP 192.168.1.2.43498 > 192.168.12.2.http: Flags [S], seq 1728882438, win 5840, options [mss 1460], length 0
03:14:32.696037 IP 192.168.1.2.47822 > 192.168.12.2.http: Flags [S], seq 1588042137, win 5840, options [mss 1460], length 0
03:14:32.696047 IP 192.168.1.2.54425 > 192.168.12.2.http: Flags [S], seq 2442084805, win 5840, options [mss 1460], length 0
03:14:32.696048 IP 192.168.1.2.54425 > 192.168.12.2.http: Flags [S], seq 2442084805, win 5840, options [mss 1460], length 0
03:14:32.696072 IP 192.168.1.2.47155 > 192.168.12.2.http: Flags [S], seq 3364370779, win 5840, options [mss 1460], length 0
03:14:32.696073 IP 192.168.1.2.47155 > 192.168.12.2.http: Flags [S], seq 3364370779, win 5840, options [mss 1460], length 0
03:14:32.696097 IP 192.168.1.2.60981 > 192.168.12.2.http: Flags [S], seq 1663966877, win 5840, options [mss 1460], length 0
03:14:32.696098 IP 192.168.1.2.60981 > 192.168.12.2.http: Flags [S], seq 1663966877, win 5840, options [mss 1460], length 0
03:14:32.696122 IP 192.168.1.2.38193 > 192.168.12.2.http: Flags [S], seq 1276758066, win 5840, options [mss 1460], length 0
03:14:32.698534 IP 192.168.6.2 > 192.168.1.2: ICMP time exceeded in-transit, length 52
03:14:32.698537 IP 192.168.6.2 > 192.168.1.2: ICMP time exceeded in-transit, length 52
03:14:32.698570 IP 192.168.6.2 > 192.168.1.2: ICMP time exceeded in-transit, length 52
03:14:32.698571 IP 192.168.6.2 > 192.168.1.2: ICMP time exceeded in-transit, length 52
03:14:32.699440 IP 192.168.1.2.55931 > 192.168.12.2.http: Flags [S], seq 960237808, win 5840, options [mss 1460], length 0
03:14:32.699443 IP 192.168.1.2.55931 > 192.168.12.2.http: Flags [S], seq 960237808, win 5840, options [mss 1460], length 0
03:14:32.701093 IP 192.168.9.2 > 192.168.1.2: ICMP time exceeded in-transit, length 52
03:14:32.701095 IP 192.168.9.2 > 192.168.1.2: ICMP time exceeded in-transit, length 52
03:14:32.701222 IP 192.168.9.2 > 192.168.1.2: ICMP time exceeded in-transit, length 52
03:14:32.701224 IP 192.168.9.2 > 192.168.1.2: ICMP time exceeded in-transit, length 52
03:14:32.701250 IP 192.168.9.2 > 192.168.1.2: ICMP time exceeded in-transit, length 52
03:14:32.701251 IP 192.168.9.2 > 192.168.1.2: ICMP time exceeded in-transit, length 52
03:14:32.703694 IP 192.168.1.2.53203 > 192.168.12.2.http: Flags [S], seq 3792622130, win 5840, options [mss 1460], length 0
03:14:32.703697 IP 192.168.1.2.53203 > 192.168.12.2.http: Flags [S], seq 3792622130, win 5840, options [mss 1460], length 0
03:14:32.704274 IP 192.168.10.2 > 192.168.1.2: ICMP time exceeded in-transit, length 52
03:14:32.704277 IP 192.168.10.2 > 192.168.1.2: ICMP time exceeded in-transit, length 52
03:14:32.704639 IP 192.168.10.2 > 192.168.1.2: ICMP time exceeded in-transit, length 52
03:14:32.704642 IP 192.168.10.2 > 192.168.1.2: ICMP time exceeded in-transit, length 52
03:14:32.705618 IP 192.168.1.2.59407 > 192.168.12.2.http: Flags [S], seq 291273482, win 5840, options [mss 1460], length 0
03:14:32.705620 IP 192.168.1.2.59407 > 192.168.12.2.http: Flags [S], seq 291273482, win 5840, options [mss 1460], length 0
03:14:32.705650 IP 192.168.1.2.40542 > 192.168.12.2.http: Flags [S], seq 2255628984, win 5840, options [mss 1460], length 0
03:14:32.705651 IP 192.168.1.2.40542 > 192.168.12.2.http: Flags [S], seq 2255628984, win 5840, options [mss 1460], length 0
03:14:32.707181 IP 192.168.10.2 > 192.168.1.2: ICMP time exceeded in-transit, length 52
03:14:32.707184 IP 192.168.10.2 > 192.168.1.2: ICMP time exceeded in-transit, length 52
03:14:32.708174 IP 192.168.1.2.41243 > 192.168.12.2.http: Flags [S], seq 409589455, win 5840, options [mss 1460], length 0
03:14:32.708178 IP 192.168.1.2.41243 > 192.168.12.2.http: Flags [S], seq 409589455, win 5840, options [mss 1460], length 0
03:14:32.708826 IP 192.168.1.2.36683 > 192.168.12.2.http: Flags [S], seq 1242860803, win 5840, options [mss 1460], length 0
03:14:32.708830 IP 192.168.1.2.36683 > 192.168.12.2.http: Flags [S], seq 1242860803, win 5840, options [mss 1460], length 0
03:14:32.708893 IP 192.168.1.2.36469 > 192.168.12.2.http: Flags [S], seq 1971167303, win 5840, options [mss 1460], length 0
03:14:32.708895 IP 192.168.1.2.36469 > 192.168.12.2.http: Flags [S], seq 1971167303, win 5840, options [mss 1460], length 0
03:14:32.710301 IP 192.168.1.2.43371 > 192.168.12.2.http: Flags [S], seq 4199753515, win 5840, options [mss 1460], length 0
03:14:32.710305 IP 192.168.1.2.43371 > 192.168.12.2.http: Flags [S], seq 4199753515, win 5840, options [mss 1460], length 0
03:14:32.712093 IP 192.168.1.2.53647 > 192.168.12.2.http: Flags [S], seq 1840090974, win 5840, options [mss 1460], length 0
03:14:32.712097 IP 192.168.1.2.53647 > 192.168.12.2.http: Flags [S], seq 1840090974, win 5840, options [mss 1460], length 0
03:14:32.714857 IP 192.168.1.2.55909 > 192.168.12.2.http: Flags [S], seq 3821052354, win 5840, options [mss 1460], length 0
03:14:32.714861 IP 192.168.1.2.55909 > 192.168.12.2.http: Flags [S], seq 3821052354, win 5840, options [mss 1460], length 0
03:14:32.717319 IP 192.168.12.2.http > 192.168.1.2.53203: Flags [R.], seq 0, ack 3792622131, win 0, length 0
03:14:32.717323 IP 192.168.12.2.http > 192.168.1.2.53203: Flags [R.], seq 0, ack 1, win 0, length 0
03:14:32.717377 IP 192.168.12.2.http > 192.168.1.2.59407: Flags [R.], seq 0, ack 291273483, win 0, length 0
03:14:32.717379 IP 192.168.12.2.http > 192.168.1.2.59407: Flags [R.], seq 0, ack 1, win 0, length 0
03:14:32.719089 IP 192.168.12.2.http > 192.168.1.2.40542: Flags [R.], seq 0, ack 2255628985, win 0, length 0
03:14:32.719091 IP 192.168.12.2.http > 192.168.1.2.40542: Flags [R.], seq 0, ack 1, win 0, length 0
03:14:32.719863 IP 192.168.12.2.http > 192.168.1.2.41243: Flags [R.], seq 0, ack 409589456, win 0, length 0
03:14:32.719866 IP 192.168.12.2.http > 192.168.1.2.41243: Flags [R.], seq 0, ack 1, win 0, length 0
03:14:32.720109 IP 192.168.12.2.http > 192.168.1.2.36683: Flags [R.], seq 0, ack 1242860804, win 0, length 0
03:14:32.720111 IP 192.168.12.2.http > 192.168.1.2.36683: Flags [R.], seq 0, ack 1, win 0, length 0
03:14:32.720142 IP 192.168.12.2.http > 192.168.1.2.36469: Flags [R.], seq 0, ack 1971167304, win 0, length 0
03:14:32.720144 IP 192.168.12.2.http > 192.168.1.2.36469: Flags [R.], seq 0, ack 1, win 0, length 0
03:14:32.722503 IP 192.168.12.2.http > 192.168.1.2.43371: Flags [R.], seq 0, ack 4199753516, win 0, length 0
03:14:32.722505 IP 192.168.12.2.http > 192.168.1.2.43371: Flags [R.], seq 0, ack 1, win 0, length 0
03:14:32.722538 IP 192.168.12.2.http > 192.168.1.2.53647: Flags [R.], seq 0, ack 1840090975, win 0, length 0
03:14:32.722540 IP 192.168.12.2.http > 192.168.1.2.53647: Flags [R.], seq 0, ack 1, win 0, length 0
03:14:32.724589 IP 192.168.12.2.http > 192.168.1.2.55909: Flags [R.], seq 0, ack 3821052355, win 0, length 0
03:14:32.724592 IP 192.168.12.2.http > 192.168.1.2.55909: Flags [R.], seq 0, ack 1, win 0, length 0
03:14:33.712731 IP 192.168.1.2.59638 > 192.168.12.3.http: Flags [S], seq 2462637333, win 5840, options [mss 1460], length 0
03:14:33.712744 IP 192.168.4.2 > 192.168.1.2: ICMP time exceeded in-transit, length 52
03:14:33.713227 IP 192.168.1.2.37470 > 192.168.12.3.http: Flags [S], seq 1740414553, win 5840, options [mss 1460], length 0
03:14:33.713245 IP 192.168.1.2.44139 > 192.168.12.3.http: Flags [S], seq 981828958, win 5840, options [mss 1460], length 0
03:14:33.713258 IP 192.168.1.2.57104 > 192.168.12.3.http: Flags [S], seq 1489233569, win 5840, options [mss 1460], length 0
03:14:33.713261 IP 192.168.1.2.57104 > 192.168.12.3.http: Flags [S], seq 1489233569, win 5840, options [mss 1460], length 0
03:14:33.713301 IP 192.168.1.2.48391 > 192.168.12.3.http: Flags [S], seq 2584579232, win 5840, options [mss 1460], length 0
03:14:33.713304 IP 192.168.1.2.48391 > 192.168.12.3.http: Flags [S], seq 2584579232, win 5840, options [mss 1460], length 0
03:14:33.713338 IP 192.168.1.2.33833 > 192.168.12.3.http: Flags [S], seq 2610299413, win 5840, options [mss 1460], length 0
03:14:33.713341 IP 192.168.1.2.33833 > 192.168.12.3.http: Flags [S], seq 2610299413, win 5840, options [mss 1460], length 0
03:14:33.713455 IP 192.168.1.2.56249 > 192.168.12.3.http: Flags [S], seq 3975696542, win 5840, options [mss 1460], length 0
03:14:33.713458 IP 192.168.1.2.56249 > 192.168.12.3.http: Flags [S], seq 3975696542, win 5840, options [mss 1460], length 0
03:14:33.713485 IP 192.168.1.2.53246 > 192.168.12.3.http: Flags [S], seq 553943262, win 5840, options [mss 1460], length 0
03:14:33.713486 IP 192.168.1.2.53246 > 192.168.12.3.http: Flags [S], seq 553943262, win 5840, options [mss 1460], length 0
03:14:33.713523 IP 192.168.1.2.43419 > 192.168.12.3.http: Flags [S], seq 3580191971, win 5840, options [mss 1460], length 0
03:14:33.713525 IP 192.168.1.2.43419 > 192.168.12.3.http: Flags [S], seq 3580191971, win 5840, options [mss 1460], length 0
03:14:33.713548 IP 192.168.1.2.52310 > 192.168.12.3.http: Flags [S], seq 3361632863, win 5840, options [mss 1460], length 0
03:14:33.713549 IP 192.168.1.2.52310 > 192.168.12.3.http: Flags [S], seq 3361632863, win 5840, options [mss 1460], length 0
03:14:33.713578 IP 192.168.1.2.60631 > 192.168.12.3.http: Flags [S], seq 2724397097, win 5840, options [mss 1460], length 0
03:14:33.713579 IP 192.168.1.2.60631 > 192.168.12.3.http: Flags [S], seq 2724397097, win 5840, options [mss 1460], length 0
03:14:33.716812 IP 192.168.6.2 > 192.168.1.2: ICMP time exceeded in-transit, length 52
03:14:33.716818 IP 192.168.6.2 > 192.168.1.2: ICMP time exceeded in-transit, length 52
03:14:33.717739 IP 192.168.1.2.58075 > 192.168.12.3.http: Flags [S], seq 2152821960, win 5840, options [mss 1460], length 0
03:14:33.717742 IP 192.168.1.2.58075 > 192.168.12.3.http: Flags [S], seq 2152821960, win 5840, options [mss 1460], length 0
03:14:33.719252 IP 192.168.9.2 > 192.168.1.2: ICMP time exceeded in-transit, length 52
03:14:33.719256 IP 192.168.9.2 > 192.168.1.2: ICMP time exceeded in-transit, length 52
03:14:33.719448 IP 192.168.9.2 > 192.168.1.2: ICMP time exceeded in-transit, length 52
03:14:33.719451 IP 192.168.9.2 > 192.168.1.2: ICMP time exceeded in-transit, length 52
03:14:33.719483 IP 192.168.9.2 > 192.168.1.2: ICMP time exceeded in-transit, length 52
03:14:33.719485 IP 192.168.9.2 > 192.168.1.2: ICMP time exceeded in-transit, length 52
03:14:33.721632 IP 192.168.10.2 > 192.168.1.2: ICMP time exceeded in-transit, length 52
03:14:33.721635 IP 192.168.10.2 > 192.168.1.2: ICMP time exceeded in-transit, length 52
03:14:33.721668 IP 192.168.10.2 > 192.168.1.2: ICMP time exceeded in-transit, length 52
03:14:33.721669 IP 192.168.10.2 > 192.168.1.2: ICMP time exceeded in-transit, length 52
03:14:33.723179 IP 192.168.1.2.45797 > 192.168.12.3.http: Flags [S], seq 256267574, win 5840, options [mss 1460], length 0
03:14:33.723182 IP 192.168.1.2.45797 > 192.168.12.3.http: Flags [S], seq 256267574, win 5840, options [mss 1460], length 0
03:14:33.724735 IP 192.168.1.2.39375 > 192.168.12.3.http: Flags [S], seq 3617864550, win 5840, options [mss 1460], length 0
03:14:33.724738 IP 192.168.1.2.39375 > 192.168.12.3.http: Flags [S], seq 3617864550, win 5840, options [mss 1460], length 0
03:14:33.726215 IP 192.168.1.2.37940 > 192.168.12.3.http: Flags [S], seq 4283933983, win 5840, options [mss 1460], length 0
03:14:33.726218 IP 192.168.1.2.37940 > 192.168.12.3.http: Flags [S], seq 4283933983, win 5840, options [mss 1460], length 0
03:14:33.726406 IP 192.168.1.2.33286 > 192.168.12.3.http: Flags [S], seq 3411680531, win 5840, options [mss 1460], length 0
03:14:33.726409 IP 192.168.1.2.33286 > 192.168.12.3.http: Flags [S], seq 3411680531, win 5840, options [mss 1460], length 0
03:14:33.726441 IP 192.168.1.2.52536 > 192.168.12.3.http: Flags [S], seq 2519794469, win 5840, options [mss 1460], length 0
03:14:33.726442 IP 192.168.1.2.52536 > 192.168.12.3.http: Flags [S], seq 2519794469, win 5840, options [mss 1460], length 0
03:14:33.726657 IP 192.168.10.2 > 192.168.1.2: ICMP time exceeded in-transit, length 52
03:14:33.726660 IP 192.168.10.2 > 192.168.1.2: ICMP time exceeded in-transit, length 52
03:14:33.727616 IP 192.168.1.2.38126 > 192.168.12.3.http: Flags [S], seq 2093926864, win 5840, options [mss 1460], length 0
03:14:33.727619 IP 192.168.1.2.38126 > 192.168.12.3.http: Flags [S], seq 2093926864, win 5840, options [mss 1460], length 0
03:14:33.727650 IP 192.168.1.2.36847 > 192.168.12.3.http: Flags [S], seq 3487900159, win 5840, options [mss 1460], length 0
03:14:33.727652 IP 192.168.1.2.36847 > 192.168.12.3.http: Flags [S], seq 3487900159, win 5840, options [mss 1460], length 0
03:14:33.732290 IP 192.168.12.3.http > 192.168.1.2.45797: Flags [R.], seq 0, ack 256267575, win 0, length 0
03:14:33.732294 IP 192.168.12.3.http > 192.168.1.2.45797: Flags [R.], seq 0, ack 1, win 0, length 0
03:14:33.732644 IP 192.168.1.2.34445 > 192.168.12.3.http: Flags [S], seq 1729799524, win 5840, options [mss 1460], length 0
03:14:33.732647 IP 192.168.1.2.34445 > 192.168.12.3.http: Flags [S], seq 1729799524, win 5840, options [mss 1460], length 0
03:14:33.734282 IP 192.168.12.3.http > 192.168.1.2.39375: Flags [R.], seq 0, ack 3617864551, win 0, length 0
03:14:33.734286 IP 192.168.12.3.http > 192.168.1.2.39375: Flags [R.], seq 0, ack 1, win 0, length 0
03:14:33.734318 IP 192.168.12.3.http > 192.168.1.2.37940: Flags [R.], seq 0, ack 4283933984, win 0, length 0
03:14:33.734320 IP 192.168.12.3.http > 192.168.1.2.37940: Flags [R.], seq 0, ack 1, win 0, length 0
03:14:33.734345 IP 192.168.12.3.http > 192.168.1.2.33286: Flags [R.], seq 0, ack 3411680532, win 0, length 0
03:14:33.734347 IP 192.168.12.3.http > 192.168.1.2.33286: Flags [R.], seq 0, ack 1, win 0, length 0
03:14:33.734371 IP 192.168.12.3.http > 192.168.1.2.52536: Flags [R.], seq 0, ack 2519794470, win 0, length 0
03:14:33.734373 IP 192.168.12.3.http > 192.168.1.2.52536: Flags [R.], seq 0, ack 1, win 0, length 0
03:14:33.736036 IP 192.168.12.3.http > 192.168.1.2.38126: Flags [R.], seq 0, ack 2093926865, win 0, length 0
03:14:33.736039 IP 192.168.12.3.http > 192.168.1.2.38126: Flags [R.], seq 0, ack 1, win 0, length 0
03:14:33.736173 IP 192.168.12.3.http > 192.168.1.2.36847: Flags [R.], seq 0, ack 3487900160, win 0, length 0
03:14:33.736175 IP 192.168.12.3.http > 192.168.1.2.36847: Flags [R.], seq 0, ack 1, win 0, length 0
03:14:33.739360 IP 192.168.12.3.http > 192.168.1.2.34445: Flags [R.], seq 0, ack 1729799525, win 0, length 0
03:14:33.739363 IP 192.168.12.3.http > 192.168.1.2.34445: Flags [R.], seq 0, ack 1, win 0, length 0
03:14:34.726499 IP 192.168.1.2.43767 > 192.168.13.2.http: Flags [S], seq 252334436, win 5840, options [mss 1460], length 0
03:14:34.726512 IP 192.168.4.2 > 192.168.1.2: ICMP time exceeded in-transit, length 52
03:14:34.727706 IP 192.168.1.2.57317 > 192.168.13.2.http: Flags [S], seq 465662134, win 5840, options [mss 1460], length 0
03:14:34.727728 IP 192.168.1.2.50005 > 192.168.13.2.http: Flags [S], seq 4014402798, win 5840, options [mss 1460], length 0
03:14:34.727730 IP 192.168.1.2.50005 > 192.168.13.2.http: Flags [S], seq 4014402798, win 5840, options [mss 1460], length 0
03:14:34.727775 IP 192.168.1.2.59223 > 192.168.13.2.http: Flags [S], seq 4291939830, win 5840, options [mss 1460], length 0
03:14:34.727777 IP 192.168.1.2.59223 > 192.168.13.2.http: Flags [S], seq 4291939830, win 5840, options [mss 1460], length 0
03:14:34.727814 IP 192.168.1.2.59567 > 192.168.13.2.http: Flags [S], seq 3813685592, win 5840, options [mss 1460], length 0
03:14:34.727829 IP 192.168.1.2.46951 > 192.168.13.2.http: Flags [S], seq 173495838, win 5840, options [mss 1460], length 0
03:14:34.727831 IP 192.168.1.2.46951 > 192.168.13.2.http: Flags [S], seq 173495838, win 5840, options [mss 1460], length 0
03:14:34.728056 IP 192.168.1.2.33838 > 192.168.13.2.http: Flags [S], seq 2515795922, win 5840, options [mss 1460], length 0
03:14:34.728060 IP 192.168.1.2.33838 > 192.168.13.2.http: Flags [S], seq 2515795922, win 5840, options [mss 1460], length 0
03:14:34.728102 IP 192.168.1.2.58567 > 192.168.13.2.http: Flags [S], seq 2912958513, win 5840, options [mss 1460], length 0
03:14:34.728104 IP 192.168.1.2.58567 > 192.168.13.2.http: Flags [S], seq 2912958513, win 5840, options [mss 1460], length 0
03:14:34.728140 IP 192.168.1.2.42096 > 192.168.13.2.http: Flags [S], seq 1828625064, win 5840, options [mss 1460], length 0
03:14:34.728142 IP 192.168.1.2.42096 > 192.168.13.2.http: Flags [S], seq 1828625064, win 5840, options [mss 1460], length 0
03:14:34.728176 IP 192.168.1.2.51264 > 192.168.13.2.http: Flags [S], seq 737237448, win 5840, options [mss 1460], length 0
03:14:34.728178 IP 192.168.1.2.51264 > 192.168.13.2.http: Flags [S], seq 737237448, win 5840, options [mss 1460], length 0
03:14:34.728212 IP 192.168.1.2.56573 > 192.168.13.2.http: Flags [S], seq 3539969639, win 5840, options [mss 1460], length 0
03:14:34.728214 IP 192.168.1.2.56573 > 192.168.13.2.http: Flags [S], seq 3539969639, win 5840, options [mss 1460], length 0
03:14:34.730782 IP 192.168.6.2 > 192.168.1.2: ICMP time exceeded in-transit, length 52
03:14:34.730785 IP 192.168.6.2 > 192.168.1.2: ICMP time exceeded in-transit, length 52
03:14:34.731255 IP 192.168.1.2.42778 > 192.168.13.2.http: Flags [S], seq 3450469828, win 5840, options [mss 1460], length 0
03:14:34.731257 IP 192.168.1.2.42778 > 192.168.13.2.http: Flags [S], seq 3450469828, win 5840, options [mss 1460], length 0
03:14:34.733086 IP 192.168.9.2 > 192.168.1.2: ICMP time exceeded in-transit, length 52
03:14:34.733091 IP 192.168.9.2 > 192.168.1.2: ICMP time exceeded in-transit, length 52
03:14:34.733138 IP 192.168.9.2 > 192.168.1.2: ICMP time exceeded in-transit, length 52
03:14:34.733140 IP 192.168.9.2 > 192.168.1.2: ICMP time exceeded in-transit, length 52
03:14:34.734617 IP 192.168.1.2.35122 > 192.168.13.2.http: Flags [S], seq 1451064148, win 5840, options [mss 1460], length 0
03:14:34.734620 IP 192.168.1.2.35122 > 192.168.13.2.http: Flags [S], seq 1451064148, win 5840, options [mss 1460], length 0
03:14:34.735862 IP 192.168.11.2 > 192.168.1.2: ICMP time exceeded in-transit, length 52
03:14:34.735866 IP 192.168.11.2 > 192.168.1.2: ICMP time exceeded in-transit, length 52
03:14:34.735924 IP 192.168.11.2 > 192.168.1.2: ICMP time exceeded in-transit, length 52
03:14:34.735927 IP 192.168.11.2 > 192.168.1.2: ICMP time exceeded in-transit, length 52
03:14:34.738563 IP 192.168.1.2.53047 > 192.168.13.2.http: Flags [S], seq 208125687, win 5840, options [mss 1460], length 0
03:14:34.738566 IP 192.168.1.2.53047 > 192.168.13.2.http: Flags [S], seq 208125687, win 5840, options [mss 1460], length 0
03:14:34.740792 IP 192.168.1.2.40499 > 192.168.13.2.http: Flags [S], seq 2957967592, win 5840, options [mss 1460], length 0
03:14:34.740795 IP 192.168.1.2.40499 > 192.168.13.2.http: Flags [S], seq 2957967592, win 5840, options [mss 1460], length 0
03:14:34.740851 IP 192.168.1.2.34592 > 192.168.13.2.http: Flags [S], seq 4188996741, win 5840, options [mss 1460], length 0
03:14:34.740854 IP 192.168.1.2.34592 > 192.168.13.2.http: Flags [S], seq 4188996741, win 5840, options [mss 1460], length 0
03:14:34.742053 IP 192.168.11.2 > 192.168.1.2: ICMP time exceeded in-transit, length 52
03:14:34.742055 IP 192.168.11.2 > 192.168.1.2: ICMP time exceeded in-transit, length 52
03:14:34.742584 IP 192.168.1.2.52406 > 192.168.13.2.http: Flags [S], seq 404333099, win 5840, options [mss 1460], length 0
03:14:34.742587 IP 192.168.1.2.52406 > 192.168.13.2.http: Flags [S], seq 404333099, win 5840, options [mss 1460], length 0
03:14:34.742615 IP 192.168.1.2.42402 > 192.168.13.2.http: Flags [S], seq 1884361568, win 5840, options [mss 1460], length 0
03:14:34.742617 IP 192.168.1.2.42402 > 192.168.13.2.http: Flags [S], seq 1884361568, win 5840, options [mss 1460], length 0
03:14:34.744038 IP 192.168.13.2.http > 192.168.1.2.35122: Flags [R.], seq 0, ack 1451064149, win 0, length 0
03:14:34.744042 IP 192.168.13.2.http > 192.168.1.2.35122: Flags [R.], seq 0, ack 1, win 0, length 0
03:14:34.748310 IP 192.168.13.2.http > 192.168.1.2.53047: Flags [R.], seq 0, ack 208125688, win 0, length 0
03:14:34.748314 IP 192.168.13.2.http > 192.168.1.2.53047: Flags [R.], seq 0, ack 1, win 0, length 0
03:14:34.748837 IP 192.168.1.2.55490 > 192.168.13.2.http: Flags [S], seq 3991438175, win 5840, options [mss 1460], length 0
03:14:34.748840 IP 192.168.1.2.55490 > 192.168.13.2.http: Flags [S], seq 3991438175, win 5840, options [mss 1460], length 0
03:14:34.750625 IP 192.168.13.2.http > 192.168.1.2.40499: Flags [R.], seq 0, ack 2957967593, win 0, length 0
03:14:34.750628 IP 192.168.13.2.http > 192.168.1.2.40499: Flags [R.], seq 0, ack 1, win 0, length 0
03:14:34.750654 IP 192.168.13.2.http > 192.168.1.2.34592: Flags [R.], seq 0, ack 4188996742, win 0, length 0
03:14:34.750656 IP 192.168.13.2.http > 192.168.1.2.34592: Flags [R.], seq 0, ack 1, win 0, length 0
03:14:34.752148 IP 192.168.13.2.http > 192.168.1.2.52406: Flags [R.], seq 0, ack 404333100, win 0, length 0
03:14:34.752150 IP 192.168.13.2.http > 192.168.1.2.52406: Flags [R.], seq 0, ack 1, win 0, length 0
03:14:34.753600 IP 192.168.13.2.http > 192.168.1.2.42402: Flags [R.], seq 0, ack 1884361569, win 0, length 0
03:14:34.753603 IP 192.168.13.2.http > 192.168.1.2.42402: Flags [R.], seq 0, ack 1, win 0, length 0
03:14:34.755709 IP 192.168.13.2.http > 192.168.1.2.55490: Flags [R.], seq 0, ack 3991438176, win 0, length 0
03:14:34.755711 IP 192.168.13.2.http > 192.168.1.2.55490: Flags [R.], seq 0, ack 1, win 0, length 0
03:14:35.434834 ARP, Request who-has 192.168.5.2 tell 192.168.5.1, length 28
03:14:35.435436 ARP, Request who-has 192.168.5.1 tell 192.168.5.2, length 28
03:14:35.435440 ARP, Reply 192.168.5.1 is-at 22:1c:4a:43:e0:6a (oui Unknown), length 28
03:14:35.435923 ARP, Reply 192.168.5.2 is-at b6:69:ea:0c:25:25 (oui Unknown), length 28

