01:24:36.533770 ARP, Request who-has 192.168.2.3 tell 192.168.2.2, length 28
01:24:36.536685 ARP, Request who-has 192.168.2.4 tell 192.168.2.2, length 28
01:24:36.539103 ARP, Request who-has 192.168.2.1 tell 192.168.2.2, length 28
01:24:36.552061 ARP, Request who-has 192.168.2.4 tell 192.168.2.3, length 28
01:24:36.555609 ARP, Request who-has 192.168.2.1 tell 192.168.2.3, length 28
01:24:36.570108 ARP, Request who-has 192.168.2.1 tell 192.168.2.4, length 28
01:24:36.633461 ARP, Request who-has 192.168.2.102 tell 192.168.2.1, length 28
01:24:36.633475 ARP, Reply 192.168.2.102 is-at f2:78:19:62:42:48 (oui Unknown), length 28
01:24:36.634124 IP 192.168.1.3 > 192.168.2.102: ICMP echo request, id 18617, seq 1, length 64
01:24:36.634130 IP 192.168.2.102 > 192.168.1.3: ICMP echo reply, id 18617, seq 1, length 64
01:24:36.636417 IP 192.168.1.4 > 192.168.2.102: ICMP echo request, id 18618, seq 1, length 64
01:24:36.636422 IP 192.168.2.102 > 192.168.1.4: ICMP echo reply, id 18618, seq 1, length 64
01:24:36.638788 IP 192.168.1.2 > 192.168.2.102: ICMP echo request, id 18619, seq 1, length 64
01:24:36.638793 IP 192.168.2.102 > 192.168.1.2: ICMP echo reply, id 18619, seq 1, length 64
01:24:41.528836 ARP, Request who-has 192.168.2.102 tell 192.168.2.101, length 28
01:24:41.528851 ARP, Reply 192.168.2.102 is-at f2:78:19:62:42:48 (oui Unknown), length 28
01:24:41.529493 IP 192.168.2.101 > 192.168.2.102: ICMP echo request, id 18661, seq 1, length 64
01:24:41.529501 IP 192.168.2.102 > 192.168.2.101: ICMP echo reply, id 18661, seq 1, length 64
01:24:41.639414 ARP, Request who-has 192.168.2.1 tell 192.168.2.102, length 28
01:24:41.644859 ARP, Reply 192.168.2.1 is-at 1e:8b:08:71:dc:c0 (oui Unknown), length 28
01:24:46.534442 ARP, Request who-has 192.168.2.101 tell 192.168.2.102, length 28
01:24:46.536092 ARP, Reply 192.168.2.101 is-at f2:d9:9a:c5:21:10 (oui Unknown), length 28
01:24:46.579725 IP 192.168.2.101 > 192.168.2.102: ICMP echo request, id 18717, seq 1, length 64
01:24:46.579736 IP 192.168.2.102 > 192.168.2.101: ICMP echo reply, id 18717, seq 1, length 64
01:24:51.644809 IP 192.168.2.101 > 192.168.2.102: ICMP echo request, id 18774, seq 1, length 64
01:24:51.644823 IP 192.168.2.102 > 192.168.2.101: ICMP echo reply, id 18774, seq 1, length 64

01:24:56.855527 IP 192.168.2.101 > 192.168.2.102: ICMP echo request, id 18864, seq 1, length 64
01:24:56.855536 IP 192.168.2.102 > 192.168.2.101: ICMP echo reply, id 18864, seq 1, length 64
01:25:02.007383 IP 192.168.2.101 > 192.168.2.102: ICMP echo request, id 18952, seq 1, length 64
01:25:02.007396 IP 192.168.2.102 > 192.168.2.101: ICMP echo reply, id 18952, seq 1, length 64
01:25:07.014826 ARP, Request who-has 192.168.2.102 tell 192.168.2.101, length 28
01:25:07.014833 ARP, Reply 192.168.2.102 is-at f2:78:19:62:42:48 (oui Unknown), length 28
01:25:07.123945 IP 192.168.2.101 > 192.168.2.102: ICMP echo request, id 19024, seq 1, length 64
01:25:07.123954 IP 192.168.2.102 > 192.168.2.101: ICMP echo reply, id 19024, seq 1, length 64
01:25:12.236899 IP 192.168.2.101 > 192.168.2.102: ICMP echo request, id 19082, seq 1, length 64
01:25:12.236913 IP 192.168.2.102 > 192.168.2.101: ICMP echo reply, id 19082, seq 1, length 64
01:25:17.238287 ARP, Request who-has 192.168.2.101 tell 192.168.2.102, length 28
01:25:17.238369 ARP, Reply 192.168.2.101 is-at f2:d9:9a:c5:21:10 (oui Unknown), length 28
01:25:17.592104 IP 192.168.2.101 > 192.168.2.102: ICMP echo request, id 19167, seq 1, length 64
01:25:17.592114 IP 192.168.2.102 > 192.168.2.101: ICMP echo reply, id 19167, seq 1, length 64
01:25:22.922784 IP 192.168.2.101 > 192.168.2.102: ICMP echo request, id 19267, seq 1, length 64
01:25:22.922793 IP 192.168.2.102 > 192.168.2.101: ICMP echo reply, id 19267, seq 1, length 64

01:25:27.999269 IP 192.168.2.101 > 192.168.2.102: ICMP echo request, id 19327, seq 1, length 64
01:25:27.999277 IP 192.168.2.102 > 192.168.2.101: ICMP echo reply, id 19327, seq 1, length 64
01:25:32.999576 ARP, Request who-has 192.168.2.102 tell 192.168.2.101, length 28
01:25:32.999648 ARP, Reply 192.168.2.102 is-at f2:78:19:62:42:48 (oui Unknown), length 28
01:25:33.063733 IP 192.168.2.101 > 192.168.2.102: ICMP echo request, id 19384, seq 1, length 64
01:25:33.063758 IP 192.168.2.102 > 192.168.2.101: ICMP echo reply, id 19384, seq 1, length 64
01:25:38.114351 IP 192.168.2.101 > 192.168.2.102: ICMP echo request, id 19438, seq 1, length 64
01:25:38.114362 IP 192.168.2.102 > 192.168.2.101: ICMP echo reply, id 19438, seq 1, length 64
01:25:43.149484 IP 192.168.2.101 > 192.168.2.102: ICMP echo request, id 19503, seq 1, length 64
01:25:43.149494 IP 192.168.2.102 > 192.168.2.101: ICMP echo reply, id 19503, seq 1, length 64
01:25:48.151112 ARP, Request who-has 192.168.2.101 tell 192.168.2.102, length 28
01:25:48.151510 ARP, Reply 192.168.2.101 is-at f2:d9:9a:c5:21:10 (oui Unknown), length 28
01:25:48.190016 IP 192.168.2.101 > 192.168.2.102: ICMP echo request, id 19557, seq 1, length 64
01:25:48.190025 IP 192.168.2.102 > 192.168.2.101: ICMP echo reply, id 19557, seq 1, length 64
01:25:53.223761 IP 192.168.2.101 > 192.168.2.102: ICMP echo request, id 19613, seq 1, length 64
01:25:53.223771 IP 192.168.2.102 > 192.168.2.101: ICMP echo reply, id 19613, seq 1, length 64

01:25:58.231314 ARP, Request who-has 192.168.2.102 tell 192.168.2.101, length 28
01:25:58.231323 ARP, Reply 192.168.2.102 is-at f2:78:19:62:42:48 (oui Unknown), length 28
01:25:58.251842 IP 192.168.2.101 > 192.168.2.102: ICMP echo request, id 19673, seq 1, length 64
01:25:58.251849 IP 192.168.2.102 > 192.168.2.101: ICMP echo reply, id 19673, seq 1, length 64
01:26:03.364253 IP 192.168.2.101 > 192.168.2.102: ICMP echo request, id 19750, seq 1, length 64
01:26:03.364260 IP 192.168.2.102 > 192.168.2.101: ICMP echo reply, id 19750, seq 1, length 64
01:26:08.503636 IP 192.168.2.101 > 192.168.2.102: ICMP echo request, id 19843, seq 1, length 64
01:26:08.503649 IP 192.168.2.102 > 192.168.2.101: ICMP echo reply, id 19843, seq 1, length 64
01:26:13.565870 IP 192.168.2.101 > 192.168.2.102: ICMP echo request, id 19899, seq 1, length 64
01:26:13.565880 IP 192.168.2.102 > 192.168.2.101: ICMP echo reply, id 19899, seq 1, length 64
01:26:18.566325 ARP, Request who-has 192.168.2.101 tell 192.168.2.102, length 28
01:26:18.566734 ARP, Reply 192.168.2.101 is-at f2:d9:9a:c5:21:10 (oui Unknown), length 28
01:26:18.616917 IP 192.168.2.101 > 192.168.2.102: ICMP echo request, id 19953, seq 1, length 64
01:26:18.616928 IP 192.168.2.102 > 192.168.2.101: ICMP echo reply, id 19953, seq 1, length 64
01:26:23.815819 IP 192.168.2.101 > 192.168.2.102: ICMP echo request, id 20033, seq 1, length 64
01:26:23.815829 IP 192.168.2.102 > 192.168.2.101: ICMP echo reply, id 20033, seq 1, length 64

01:26:28.981571 IP 192.168.2.101 > 192.168.2.102: ICMP echo request, id 20129, seq 1, length 64
01:26:28.981589 IP 192.168.2.102 > 192.168.2.101: ICMP echo reply, id 20129, seq 1, length 64
01:26:34.036293 IP 192.168.2.101 > 192.168.2.102: ICMP echo request, id 20185, seq 1, length 64
01:26:34.036303 IP 192.168.2.102 > 192.168.2.101: ICMP echo reply, id 20185, seq 1, length 64
01:26:39.046997 ARP, Request who-has 192.168.2.102 tell 192.168.2.101, length 28
01:26:39.047019 ARP, Reply 192.168.2.102 is-at f2:78:19:62:42:48 (oui Unknown), length 28

