02:43:50.005526 IP 12.10.5.101 > 192.168.1.103: ICMP echo request, id 6707, seq 1, length 64
02:43:50.006575 IP 192.168.1.103 > 12.10.5.101: ICMP echo reply, id 6707, seq 1, length 64
02:43:50.027786 IP 192.168.1.101 > 192.168.1.1: ICMP echo request, id 6714, seq 1, length 64
02:43:50.027798 IP 192.168.1.1 > 192.168.1.101: ICMP echo reply, id 6714, seq 1, length 64
02:43:50.037767 ARP, Request who-has 192.168.1.103 tell 192.168.1.101, length 28
02:43:55.048024 IP 192.168.1.101 > 192.168.2.1: ICMP echo request, id 6745, seq 1, length 64
02:43:55.048039 IP 192.168.2.1 > 192.168.1.101: ICMP echo reply, id 6745, seq 1, length 64
02:43:55.052258 IP 192.168.1.101 > 12.10.5.103: ICMP echo request, id 6749, seq 1, length 64
02:43:55.052350 IP 12.10.5.103 > 192.168.1.101: ICMP echo reply, id 6749, seq 1, length 64
02:43:55.055831 IP 192.168.1.101 > 12.10.5.1: ICMP echo request, id 6753, seq 1, length 64
02:43:55.055843 IP 12.10.5.1 > 192.168.1.101: ICMP echo reply, id 6753, seq 1, length 64
02:43:55.061162 IP 192.168.1.101 > 192.168.2.103: ICMP echo request, id 6760, seq 1, length 64
02:43:56.067001 IP 192.168.1.101 > 192.168.1.1: ICMP echo request, id 6832, seq 1, length 64
02:43:56.067013 IP 192.168.1.1 > 192.168.1.101: ICMP echo reply, id 6832, seq 1, length 64
02:43:56.074188 IP 12.10.5.101 > 192.168.1.103: ICMP echo request, id 6838, seq 1, length 64
02:43:56.074240 IP 192.168.1.103 > 12.10.5.101: ICMP echo reply, id 6838, seq 1, length 64
02:43:56.080993 IP 192.168.1.101 > 12.10.5.101: ICMP echo request, id 6841, seq 1, length 64
02:43:56.082221 IP 12.10.5.101 > 192.168.1.101: ICMP echo reply, id 6841, seq 1, length 64
02:44:00.048698 ARP, Request who-has 192.168.1.101 tell 192.168.1.1, length 28
02:44:00.049952 ARP, Reply 192.168.1.101 is-at 0a:71:b8:f0:45:bc (oui Unknown), length 28
02:44:01.088616 ARP, Request who-has 192.168.1.103 tell 192.168.1.1, length 28
02:44:01.092694 ARP, Reply 192.168.1.103 is-at 76:37:35:03:14:0d (oui Unknown), length 28
02:44:01.097434 IP 192.168.1.101 > 192.168.2.1: ICMP echo request, id 6874, seq 1, length 64
02:44:01.097449 IP 192.168.2.1 > 192.168.1.101: ICMP echo reply, id 6874, seq 1, length 64
02:44:01.106882 IP 192.168.1.101 > 12.10.5.103: ICMP echo request, id 6880, seq 1, length 64
02:44:01.107031 IP 12.10.5.103 > 192.168.1.101: ICMP echo reply, id 6880, seq 1, length 64
02:44:01.118217 IP 192.168.1.101 > 12.10.5.1: ICMP echo request, id 6886, seq 1, length 64
02:44:01.118232 IP 12.10.5.1 > 192.168.1.101: ICMP echo reply, id 6886, seq 1, length 64
02:44:01.122467 IP 192.168.1.101 > 192.168.2.103: ICMP echo request, id 6892, seq 1, length 64
02:44:02.056820 ARP, Request who-has 192.168.1.3 tell 192.168.1.1, length 28
02:44:02.057793 ARP, Reply 192.168.1.3 is-at 32:eb:ec:b7:2b:7f (oui Unknown), length 28
02:44:02.057801 IP 12.10.5.2 > 192.168.1.3: ICMP echo request, id 6897, seq 1, length 64
02:44:02.059103 IP 192.168.1.3 > 12.10.5.2: ICMP echo reply, id 6897, seq 1, length 64
02:44:02.064804 ARP, Request who-has 192.168.1.2 tell 192.168.1.1, length 28
02:44:02.065865 ARP, Reply 192.168.1.2 is-at 6e:1d:1b:41:e1:b8 (oui Unknown), length 28
02:44:02.065872 IP 12.10.5.2 > 192.168.1.2: ICMP echo request, id 6898, seq 1, length 64
02:44:02.069449 IP 192.168.1.2 > 12.10.5.2: ICMP echo reply, id 6898, seq 1, length 64
02:44:02.074339 ARP, Request who-has 192.168.1.4 tell 192.168.1.1, length 28
02:44:02.075372 ARP, Reply 192.168.1.4 is-at aa:87:8d:56:f4:3c (oui Unknown), length 28
02:44:02.075378 IP 12.10.5.2 > 192.168.1.4: ICMP echo request, id 6899, seq 1, length 64
02:44:02.076733 IP 192.168.1.4 > 12.10.5.2: ICMP echo reply, id 6899, seq 1, length 64
02:44:02.158482 IP 192.168.1.101 > 192.168.1.1: ICMP echo request, id 6904, seq 1, length 64
02:44:02.158497 IP 192.168.1.1 > 192.168.1.101: ICMP echo reply, id 6904, seq 1, length 64
02:44:02.159836 IP 12.10.5.101 > 192.168.1.103: ICMP echo request, id 6907, seq 1, length 64
02:44:02.159928 IP 192.168.1.103 > 12.10.5.101: ICMP echo reply, id 6907, seq 1, length 64
02:44:02.177968 IP 12.10.5.101 > 192.168.1.101: ICMP echo request, id 6913, seq 1, length 64
02:44:02.179903 IP 192.168.1.101 > 12.10.5.101: ICMP echo reply, id 6913, seq 1, length 64
02:44:02.194036 IP 192.168.1.101 > 12.10.5.101: ICMP echo request, id 6919, seq 1, length 64
02:44:02.194151 IP 12.10.5.101 > 192.168.1.101: ICMP echo reply, id 6919, seq 1, length 64
02:44:07.089732 ARP, Request who-has 192.168.1.1 tell 192.168.1.4, length 28
02:44:07.089741 ARP, Reply 192.168.1.1 is-at c2:6a:24:4a:ba:54 (oui Unknown), length 28
02:44:07.168437 ARP, Request who-has 192.168.1.1 tell 192.168.1.103, length 28
02:44:07.168449 ARP, Reply 192.168.1.1 is-at c2:6a:24:4a:ba:54 (oui Unknown), length 28
02:44:07.204398 IP 192.168.1.101 > 192.168.2.1: ICMP echo request, id 6958, seq 1, length 64
02:44:07.204410 IP 192.168.2.1 > 192.168.1.101: ICMP echo reply, id 6958, seq 1, length 64
02:44:07.208386 IP 192.168.1.101 > 12.10.5.103: ICMP echo request, id 6963, seq 1, length 64
02:44:07.208469 IP 12.10.5.103 > 192.168.1.101: ICMP echo reply, id 6963, seq 1, length 64
02:44:07.215191 IP 192.168.1.101 > 12.10.5.1: ICMP echo request, id 6969, seq 1, length 64
02:44:07.215202 IP 12.10.5.1 > 192.168.1.101: ICMP echo reply, id 6969, seq 1, length 64
02:44:07.220404 IP 192.168.1.101 > 192.168.2.103: ICMP echo request, id 6975, seq 1, length 64
02:44:08.222101 IP 12.10.5.101 > 192.168.1.103: ICMP echo request, id 6978, seq 1, length 64
02:44:08.222192 IP 192.168.1.103 > 12.10.5.101: ICMP echo reply, id 6978, seq 1, length 64
02:44:08.233001 IP 192.168.1.101 > 12.10.5.101: ICMP echo request, id 6990, seq 1, length 64
02:44:08.233109 IP 12.10.5.101 > 192.168.1.101: ICMP echo reply, id 6990, seq 1, length 64
02:44:08.233641 IP 12.10.5.101 > 192.168.1.101: ICMP echo request, id 6987, seq 1, length 64
02:44:08.233686 IP 192.168.1.101 > 12.10.5.101: ICMP echo reply, id 6987, seq 1, length 64
02:44:08.247846 IP 12.10.5.101 > 192.168.1.3: ICMP echo request, id 6999, seq 1, length 64
02:44:08.249161 IP 192.168.1.3 > 12.10.5.101: ICMP echo reply, id 6999, seq 1, length 64
02:44:08.251180 IP 192.168.1.101 > 12.10.5.2: ICMP echo request, id 7002, seq 1, length 64
02:44:08.252323 IP 12.10.5.2 > 192.168.1.101: ICMP echo reply, id 7002, seq 1, length 64
02:44:08.258136 IP 12.10.5.101 > 192.168.1.2: ICMP echo request, id 7008, seq 1, length 64
02:44:08.258965 IP 192.168.1.2 > 12.10.5.101: ICMP echo reply, id 7008, seq 1, length 64
02:44:08.263122 ARP, Request who-has 192.168.1.3 tell 192.168.1.101, length 28
02:44:08.269913 ARP, Request who-has 192.168.1.2 tell 192.168.1.101, length 28
02:44:08.272546 IP 12.10.5.101 > 192.168.1.4: ICMP echo request, id 7011, seq 1, length 64
02:44:08.273473 IP 192.168.1.4 > 12.10.5.101: ICMP echo reply, id 7011, seq 1, length 64
02:44:08.278517 ARP, Request who-has 192.168.1.4 tell 192.168.1.101, length 28
02:44:12.208950 ARP, Request who-has 192.168.1.1 tell 192.168.1.101, length 28
02:44:12.208961 ARP, Reply 192.168.1.1 is-at c2:6a:24:4a:ba:54 (oui Unknown), length 28
02:44:13.265326 ARP, Request who-has 192.168.1.1 tell 192.168.1.2, length 28
02:44:13.265337 ARP, Reply 192.168.1.1 is-at c2:6a:24:4a:ba:54 (oui Unknown), length 28
02:44:13.265422 ARP, Request who-has 192.168.1.1 tell 192.168.1.3, length 28
02:44:13.265427 ARP, Reply 192.168.1.1 is-at c2:6a:24:4a:ba:54 (oui Unknown), length 28
02:44:13.293711 IP 192.168.1.101 > 192.168.2.1: ICMP echo request, id 7047, seq 1, length 64
02:44:13.293725 IP 192.168.2.1 > 192.168.1.101: ICMP echo reply, id 7047, seq 1, length 64
02:44:13.299389 IP 192.168.1.101 > 12.10.5.103: ICMP echo request, id 7056, seq 1, length 64
02:44:13.299502 IP 12.10.5.103 > 192.168.1.101: ICMP echo reply, id 7056, seq 1, length 64
02:44:13.310248 IP 192.168.1.101 > 12.10.5.1: ICMP echo request, id 7059, seq 1, length 64
02:44:13.310265 IP 12.10.5.1 > 192.168.1.101: ICMP echo reply, id 7059, seq 1, length 64
02:44:13.316463 IP 12.10.5.101 > 192.168.1.103: ICMP echo request, id 7065, seq 1, length 64
02:44:13.316558 IP 192.168.1.103 > 12.10.5.101: ICMP echo reply, id 7065, seq 1, length 64
02:44:13.317569 IP 192.168.1.101 > 192.168.1.1: ICMP echo request, id 7068, seq 1, length 64
02:44:13.317579 IP 192.168.1.1 > 192.168.1.101: ICMP echo reply, id 7068, seq 1, length 64
02:44:13.330685 IP 12.10.5.101 > 192.168.1.101: ICMP echo request, id 7080, seq 1, length 64
02:44:13.330779 IP 192.168.1.101 > 12.10.5.101: ICMP echo reply, id 7080, seq 1, length 64
02:44:13.333753 IP 192.168.1.101 > 12.10.5.101: ICMP echo request, id 7077, seq 1, length 64
02:44:13.333843 IP 12.10.5.101 > 192.168.1.101: ICMP echo reply, id 7077, seq 1, length 64
02:44:13.343622 IP 12.10.5.101 > 192.168.1.3: ICMP echo request, id 7092, seq 1, length 64
02:44:13.343718 IP 192.168.1.3 > 12.10.5.101: ICMP echo reply, id 7092, seq 1, length 64
02:44:13.349408 IP 192.168.1.101 > 12.10.5.2: ICMP echo request, id 7089, seq 1, length 64
02:44:13.349568 IP 12.10.5.2 > 192.168.1.101: ICMP echo reply, id 7089, seq 1, length 64
02:44:13.354313 IP 12.10.5.101 > 192.168.1.2: ICMP echo request, id 7095, seq 1, length 64
02:44:13.354385 IP 192.168.1.2 > 12.10.5.101: ICMP echo reply, id 7095, seq 1, length 64
02:44:13.364834 IP 12.10.5.101 > 192.168.1.4: ICMP echo request, id 7101, seq 1, length 64
02:44:13.364974 IP 192.168.1.4 > 12.10.5.101: ICMP echo reply, id 7101, seq 1, length 64

02:44:19.130110 IP 12.10.5.103.33840 > 192.168.1.4.33447: UDP, length 32
02:44:19.130187 IP 12.10.5.103.35156 > 192.168.1.4.33438: UDP, length 32
02:44:19.130245 IP 12.10.5.103.44891 > 192.168.1.4.33444: UDP, length 32
02:44:19.130275 IP 12.10.5.103.33359 > 192.168.1.4.33441: UDP, length 32
02:44:19.130344 IP 12.10.5.103.35299 > 192.168.1.4.33449: UDP, length 32
02:44:19.130389 IP 12.10.5.103.55767 > 192.168.1.4.33446: UDP, length 32
02:44:19.130449 IP 12.10.5.103.33609 > 192.168.1.4.33437: UDP, length 32
02:44:19.130500 IP 12.10.5.103.53874 > 192.168.1.4.33448: UDP, length 32
02:44:19.130532 IP 12.10.5.103.49996 > 192.168.1.4.33445: UDP, length 32
02:44:19.130604 IP 12.10.5.103.34460 > 192.168.1.4.33439: UDP, length 32
02:44:19.130641 IP 12.10.5.103.45846 > 192.168.1.4.33443: UDP, length 32
02:44:19.130669 IP 12.10.5.103.37389 > 192.168.1.4.33440: UDP, length 32
02:44:19.130724 IP 12.10.5.103.45077 > 192.168.1.4.33442: UDP, length 32
02:44:19.132391 IP 192.168.1.4 > 12.10.5.103: ICMP 192.168.1.4 udp port 33447 unreachable, length 68
02:44:19.132564 IP 192.168.1.4 > 12.10.5.103: ICMP 192.168.1.4 udp port 33438 unreachable, length 68
02:44:19.132612 IP 192.168.1.4 > 12.10.5.103: ICMP 192.168.1.4 udp port 33444 unreachable, length 68
02:44:19.132650 IP 192.168.1.4 > 12.10.5.103: ICMP 192.168.1.4 udp port 33441 unreachable, length 68
02:44:19.132687 IP 192.168.1.4 > 12.10.5.103: ICMP 192.168.1.4 udp port 33449 unreachable, length 68
02:44:19.132731 IP 192.168.1.4 > 12.10.5.103: ICMP 192.168.1.4 udp port 33446 unreachable, length 68
02:44:23.457786 IP 192.168.1.101 > 192.168.2.1: ICMP echo request, id 7287, seq 1, length 64
02:44:23.457801 IP 192.168.2.1 > 192.168.1.101: ICMP echo reply, id 7287, seq 1, length 64
02:44:23.463331 IP 192.168.1.101 > 12.10.5.103: ICMP echo request, id 7293, seq 1, length 64
02:44:23.463406 IP 12.10.5.103 > 192.168.1.101: ICMP echo reply, id 7293, seq 1, length 64
02:44:23.469097 IP 192.168.1.101 > 12.10.5.1: ICMP echo request, id 7299, seq 1, length 64
02:44:23.469108 IP 12.10.5.1 > 192.168.1.101: ICMP echo reply, id 7299, seq 1, length 64
02:44:23.475127 IP 12.10.5.101 > 192.168.1.103: ICMP echo request, id 7305, seq 1, length 64
02:44:23.475180 IP 192.168.1.103 > 12.10.5.101: ICMP echo reply, id 7305, seq 1, length 64
02:44:23.477363 IP 192.168.1.101 > 192.168.1.1: ICMP echo request, id 7302, seq 1, length 64
02:44:23.477404 IP 192.168.1.1 > 192.168.1.101: ICMP echo reply, id 7302, seq 1, length 64
02:44:23.486074 IP 192.168.1.101 > 12.10.5.101: ICMP echo request, id 7317, seq 1, length 64
02:44:23.486139 IP 12.10.5.101 > 192.168.1.101: ICMP echo reply, id 7317, seq 1, length 64
02:44:23.489087 IP 12.10.5.101 > 192.168.1.101: ICMP echo request, id 7314, seq 1, length 64
02:44:23.489204 IP 192.168.1.101 > 12.10.5.101: ICMP echo reply, id 7314, seq 1, length 64
02:44:23.500948 IP 192.168.1.101 > 12.10.5.2: ICMP echo request, id 7329, seq 1, length 64
02:44:23.501078 IP 12.10.5.2 > 192.168.1.101: ICMP echo reply, id 7329, seq 1, length 64
02:44:23.503156 IP 12.10.5.101 > 192.168.1.3: ICMP echo request, id 7326, seq 1, length 64
02:44:23.503265 IP 192.168.1.3 > 12.10.5.101: ICMP echo reply, id 7326, seq 1, length 64
02:44:23.508938 IP 12.10.5.101 > 192.168.1.2: ICMP echo request, id 7335, seq 1, length 64
02:44:23.508993 IP 192.168.1.2 > 12.10.5.101: ICMP echo reply, id 7335, seq 1, length 64
02:44:23.513113 IP 12.10.5.101 > 192.168.1.4: ICMP echo request, id 7341, seq 1, length 64
02:44:23.513208 IP 192.168.1.4 > 12.10.5.101: ICMP echo reply, id 7341, seq 1, length 64
02:44:24.140173 IP 12.10.5.103.59341 > 192.168.1.3.33437: UDP, length 32
02:44:24.140906 IP 192.168.1.3 > 12.10.5.103: ICMP 192.168.1.3 udp port 33437 unreachable, length 68
02:44:24.142271 IP 12.10.5.103.36258 > 192.168.1.3.33449: UDP, length 32
02:44:24.143105 IP 12.10.5.103.56464 > 192.168.1.3.33438: UDP, length 32
02:44:24.143409 IP 192.168.1.3 > 12.10.5.103: ICMP 192.168.1.3 udp port 33449 unreachable, length 68
02:44:24.143802 IP 12.10.5.103.35917 > 192.168.1.3.33446: UDP, length 32
02:44:24.144904 IP 12.10.5.103.59534 > 192.168.1.3.33439: UDP, length 32
02:44:24.145529 IP 192.168.1.3 > 12.10.5.103: ICMP 192.168.1.3 udp port 33438 unreachable, length 68
02:44:24.145572 IP 192.168.1.3 > 12.10.5.103: ICMP 192.168.1.3 udp port 33446 unreachable, length 68
02:44:24.145676 IP 12.10.5.103.45556 > 192.168.1.3.33445: UDP, length 32
02:44:24.145706 IP 12.10.5.103.34702 > 192.168.1.3.33441: UDP, length 32
02:44:24.145731 IP 12.10.5.103.33113 > 192.168.1.3.33442: UDP, length 32
02:44:24.145756 IP 12.10.5.103.40718 > 192.168.1.3.33447: UDP, length 32
02:44:24.145781 IP 12.10.5.103.43188 > 192.168.1.3.33448: UDP, length 32
02:44:24.145806 IP 12.10.5.103.33922 > 192.168.1.3.33443: UDP, length 32
02:44:24.145832 IP 12.10.5.103.55711 > 192.168.1.3.33444: UDP, length 32
02:44:24.145856 IP 12.10.5.103.55599 > 192.168.1.3.33440: UDP, length 32
02:44:24.146544 IP 192.168.1.3 > 12.10.5.103: ICMP 192.168.1.3 udp port 33439 unreachable, length 68
02:44:24.147133 IP 192.168.1.3 > 12.10.5.103: ICMP 192.168.1.3 udp port 33445 unreachable, length 68
02:44:24.152551 IP 12.10.5.103.34184 > 192.168.1.2.33441: UDP, length 32
02:44:24.152635 IP 12.10.5.103.47210 > 192.168.1.2.33442: UDP, length 32
02:44:24.152662 IP 12.10.5.103.36174 > 192.168.1.2.33439: UDP, length 32
02:44:24.152718 IP 12.10.5.103.50576 > 192.168.1.2.33445: UDP, length 32
02:44:24.152744 IP 12.10.5.103.56880 > 192.168.1.2.33448: UDP, length 32
02:44:24.152769 IP 12.10.5.103.53675 > 192.168.1.2.33438: UDP, length 32
02:44:24.152795 IP 12.10.5.103.47456 > 192.168.1.2.33449: UDP, length 32
02:44:24.152835 IP 12.10.5.103.35249 > 192.168.1.2.33437: UDP, length 32
02:44:24.152861 IP 12.10.5.103.55322 > 192.168.1.2.33443: UDP, length 32
02:44:24.152923 IP 12.10.5.103.48341 > 192.168.1.2.33444: UDP, length 32
02:44:24.153942 IP 12.10.5.103.55944 > 192.168.1.2.33447: UDP, length 32
02:44:24.154015 IP 12.10.5.103.56911 > 192.168.1.2.33440: UDP, length 32
02:44:24.154084 IP 12.10.5.103.50983 > 192.168.1.2.33446: UDP, length 32
02:44:24.154828 IP 192.168.1.2 > 12.10.5.103: ICMP 192.168.1.2 udp port 33441 unreachable, length 68
02:44:24.154863 IP 192.168.1.2 > 12.10.5.103: ICMP 192.168.1.2 udp port 33442 unreachable, length 68
02:44:24.154929 IP 192.168.1.2 > 12.10.5.103: ICMP 192.168.1.2 udp port 33439 unreachable, length 68
02:44:24.154975 IP 192.168.1.2 > 12.10.5.103: ICMP 192.168.1.2 udp port 33445 unreachable, length 68
02:44:24.155001 IP 192.168.1.2 > 12.10.5.103: ICMP 192.168.1.2 udp port 33448 unreachable, length 68
02:44:24.155026 IP 192.168.1.2 > 12.10.5.103: ICMP 192.168.1.2 udp port 33438 unreachable, length 68
02:44:24.155547 IP 12.10.5.103.57031 > 192.168.1.2.33451: UDP, length 32
02:44:24.155584 IP 12.10.5.103.45683 > 192.168.1.2.33450: UDP, length 32
02:44:28.530320 IP 192.168.1.101 > 192.168.2.1: ICMP echo request, id 7426, seq 1, length 64
02:44:28.530332 IP 192.168.2.1 > 192.168.1.101: ICMP echo reply, id 7426, seq 1, length 64
02:44:28.534750 IP 192.168.1.101 > 12.10.5.103: ICMP echo request, id 7432, seq 1, length 64
02:44:28.534836 IP 12.10.5.103 > 192.168.1.101: ICMP echo reply, id 7432, seq 1, length 64
02:44:28.542171 IP 192.168.1.101 > 12.10.5.1: ICMP echo request, id 7438, seq 1, length 64
02:44:28.542180 IP 12.10.5.1 > 192.168.1.101: ICMP echo reply, id 7438, seq 1, length 64
02:44:28.547216 IP 12.10.5.101 > 192.168.1.103: ICMP echo request, id 7444, seq 1, length 64
02:44:28.547294 IP 192.168.1.103 > 12.10.5.101: ICMP echo reply, id 7444, seq 1, length 64
02:44:28.551012 IP 192.168.1.101 > 192.168.1.1: ICMP echo request, id 7441, seq 1, length 64
02:44:28.551039 IP 192.168.1.1 > 192.168.1.101: ICMP echo reply, id 7441, seq 1, length 64
02:44:28.562257 IP 192.168.1.101 > 12.10.5.101: ICMP echo request, id 7456, seq 1, length 64
02:44:28.562362 IP 12.10.5.101 > 192.168.1.101: ICMP echo reply, id 7456, seq 1, length 64
02:44:28.564758 IP 12.10.5.101 > 192.168.1.101: ICMP echo request, id 7453, seq 1, length 64
02:44:28.564809 IP 192.168.1.101 > 12.10.5.101: ICMP echo reply, id 7453, seq 1, length 64
02:44:28.574151 IP 192.168.1.101 > 12.10.5.2: ICMP echo request, id 7468, seq 1, length 64
02:44:28.574217 IP 12.10.5.2 > 192.168.1.101: ICMP echo reply, id 7468, seq 1, length 64
02:44:28.575726 IP 12.10.5.101 > 192.168.1.3: ICMP echo request, id 7465, seq 1, length 64
02:44:28.575774 IP 192.168.1.3 > 12.10.5.101: ICMP echo reply, id 7465, seq 1, length 64
02:44:28.579652 IP 12.10.5.101 > 192.168.1.2: ICMP echo request, id 7474, seq 1, length 64
02:44:28.579707 IP 192.168.1.2 > 12.10.5.101: ICMP echo reply, id 7474, seq 1, length 64
02:44:28.585560 IP 12.10.5.101 > 192.168.1.4: ICMP echo request, id 7480, seq 1, length 64
02:44:28.585603 IP 192.168.1.4 > 12.10.5.101: ICMP echo reply, id 7480, seq 1, length 64
02:44:29.164880 IP 12.10.5.103.36202 > 192.168.1.103.33437: UDP, length 32
02:44:29.165877 IP 192.168.1.103 > 12.10.5.103: ICMP 192.168.1.103 udp port 33437 unreachable, length 68
02:44:29.166771 IP 12.10.5.103.43801 > 192.168.1.103.33438: UDP, length 32
02:44:29.167539 IP 192.168.1.103 > 12.10.5.103: ICMP 192.168.1.103 udp port 33438 unreachable, length 68
02:44:29.168578 IP 12.10.5.103.59503 > 192.168.1.103.33449: UDP, length 32
02:44:29.169325 IP 12.10.5.103.58925 > 192.168.1.103.33440: UDP, length 32
02:44:29.170200 IP 192.168.1.103 > 12.10.5.103: ICMP 192.168.1.103 udp port 33449 unreachable, length 68
02:44:29.170312 IP 12.10.5.103.41303 > 192.168.1.103.33444: UDP, length 32
02:44:29.170343 IP 12.10.5.103.52469 > 192.168.1.103.33445: UDP, length 32
02:44:29.170370 IP 12.10.5.103.51035 > 192.168.1.103.33447: UDP, length 32
02:44:29.170434 IP 12.10.5.103.39685 > 192.168.1.103.33443: UDP, length 32
02:44:29.170463 IP 12.10.5.103.32832 > 192.168.1.103.33439: UDP, length 32
02:44:29.170489 IP 12.10.5.103.35427 > 192.168.1.103.33441: UDP, length 32
02:44:29.170514 IP 12.10.5.103.33658 > 192.168.1.103.33448: UDP, length 32
02:44:29.170539 IP 12.10.5.103.59928 > 192.168.1.103.33446: UDP, length 32
02:44:29.170564 IP 12.10.5.103.35454 > 192.168.1.103.33442: UDP, length 32
02:44:29.171277 IP 192.168.1.103 > 12.10.5.103: ICMP 192.168.1.103 udp port 33440 unreachable, length 68
02:44:29.171868 IP 192.168.1.103 > 12.10.5.103: ICMP 192.168.1.103 udp port 33444 unreachable, length 68
02:44:29.171953 IP 192.168.1.103 > 12.10.5.103: ICMP 192.168.1.103 udp port 33445 unreachable, length 68
02:44:32.095370 IP 12.10.5.3 > 192.168.1.3: ICMP echo request, id 7489, seq 1, length 64
02:44:32.096323 IP 192.168.1.3 > 12.10.5.3: ICMP echo reply, id 7489, seq 1, length 64
02:44:32.098856 IP 12.10.5.3 > 192.168.1.2: ICMP echo request, id 7490, seq 1, length 64
02:44:32.099474 IP 192.168.1.2 > 12.10.5.3: ICMP echo reply, id 7490, seq 1, length 64
02:44:32.101831 IP 12.10.5.3 > 192.168.1.4: ICMP echo request, id 7491, seq 1, length 64
02:44:32.102373 IP 192.168.1.4 > 12.10.5.3: ICMP echo reply, id 7491, seq 1, length 64
02:44:33.536252 ARP, Request who-has 192.168.1.101 tell 192.168.1.1, length 28
02:44:33.536374 ARP, Request who-has 192.168.1.1 tell 192.168.1.101, length 28
02:44:33.536383 ARP, Reply 192.168.1.1 is-at c2:6a:24:4a:ba:54 (oui Unknown), length 28
02:44:33.536430 ARP, Reply 192.168.1.101 is-at 0a:71:b8:f0:45:bc (oui Unknown), length 28
02:44:33.552252 ARP, Request who-has 192.168.1.103 tell 192.168.1.1, length 28
02:44:33.552389 ARP, Reply 192.168.1.103 is-at 76:37:35:03:14:0d (oui Unknown), length 28
02:44:33.585478 ARP, Request who-has 192.168.1.3 tell 192.168.1.1, length 28
02:44:33.585480 ARP, Request who-has 192.168.1.2 tell 192.168.1.1, length 28
02:44:33.586139 ARP, Reply 192.168.1.2 is-at 6e:1d:1b:41:e1:b8 (oui Unknown), length 28
02:44:33.586599 ARP, Reply 192.168.1.3 is-at 32:eb:ec:b7:2b:7f (oui Unknown), length 28
02:44:33.596825 IP 192.168.1.101 > 192.168.2.1: ICMP echo request, id 7532, seq 1, length 64
02:44:33.596835 IP 192.168.2.1 > 192.168.1.101: ICMP echo reply, id 7532, seq 1, length 64
02:44:33.600368 ARP, Request who-has 192.168.1.4 tell 192.168.1.1, length 28
02:44:33.601910 ARP, Reply 192.168.1.4 is-at aa:87:8d:56:f4:3c (oui Unknown), length 28
02:44:33.603624 IP 192.168.1.101 > 12.10.5.103: ICMP echo request, id 7538, seq 1, length 64
02:44:33.603680 IP 12.10.5.103 > 192.168.1.101: ICMP echo reply, id 7538, seq 1, length 64
02:44:33.609438 IP 192.168.1.101 > 12.10.5.1: ICMP echo request, id 7544, seq 1, length 64
02:44:33.609446 IP 12.10.5.1 > 192.168.1.101: ICMP echo reply, id 7544, seq 1, length 64
02:44:33.610653 IP 12.10.5.101 > 192.168.1.103: ICMP echo request, id 7547, seq 1, length 64
02:44:33.610701 IP 192.168.1.103 > 12.10.5.101: ICMP echo reply, id 7547, seq 1, length 64
02:44:33.614533 IP 192.168.1.101 > 192.168.1.1: ICMP echo request, id 7550, seq 1, length 64
02:44:33.614544 IP 192.168.1.1 > 192.168.1.101: ICMP echo reply, id 7550, seq 1, length 64
02:44:33.621018 IP 12.10.5.101 > 192.168.1.101: ICMP echo request, id 7556, seq 1, length 64
02:44:33.621064 IP 192.168.1.101 > 12.10.5.101: ICMP echo reply, id 7556, seq 1, length 64
02:44:33.625365 IP 192.168.1.101 > 12.10.5.101: ICMP echo request, id 7562, seq 1, length 64
02:44:33.625419 IP 12.10.5.101 > 192.168.1.101: ICMP echo reply, id 7562, seq 1, length 64
02:44:33.629471 IP 12.10.5.101 > 192.168.1.3: ICMP echo request, id 7568, seq 1, length 64
02:44:33.629523 IP 192.168.1.3 > 12.10.5.101: ICMP echo reply, id 7568, seq 1, length 64
02:44:33.634583 IP 12.10.5.101 > 192.168.1.2: ICMP echo request, id 7577, seq 1, length 64
02:44:33.634663 IP 192.168.1.2 > 12.10.5.101: ICMP echo reply, id 7577, seq 1, length 64
02:44:33.635276 IP 192.168.1.101 > 12.10.5.2: ICMP echo request, id 7574, seq 1, length 64
02:44:33.635328 IP 12.10.5.2 > 192.168.1.101: ICMP echo reply, id 7574, seq 1, length 64
02:44:33.638958 IP 12.10.5.101 > 192.168.1.4: ICMP echo request, id 7583, seq 1, length 64
02:44:33.639007 IP 192.168.1.4 > 12.10.5.101: ICMP echo reply, id 7583, seq 1, length 64
02:44:34.228799 IP 192.168.1.103.59186 > 12.10.5.1.33434: UDP, length 32
02:44:34.228816 IP 12.10.5.1 > 192.168.1.103: ICMP 12.10.5.1 udp port 33434 unreachable, length 68
02:44:34.229918 IP 192.168.1.103.34394 > 12.10.5.1.33435: UDP, length 32
02:44:34.229927 IP 12.10.5.1 > 192.168.1.103: ICMP 12.10.5.1 udp port 33435 unreachable, length 68
02:44:34.231198 IP 192.168.1.103.56209 > 12.10.5.1.33436: UDP, length 32
02:44:34.231205 IP 12.10.5.1 > 192.168.1.103: ICMP 12.10.5.1 udp port 33436 unreachable, length 68
02:44:34.232669 IP 192.168.1.103.35762 > 12.10.5.1.33445: UDP, length 32
02:44:34.232678 IP 12.10.5.1 > 192.168.1.103: ICMP 12.10.5.1 udp port 33445 unreachable, length 68
02:44:34.232730 IP 192.168.1.103.33733 > 12.10.5.1.33439: UDP, length 32
02:44:34.232735 IP 12.10.5.1 > 192.168.1.103: ICMP 12.10.5.1 udp port 33439 unreachable, length 68
02:44:34.232774 IP 192.168.1.103.36700 > 12.10.5.1.33437: UDP, length 32
02:44:34.232779 IP 12.10.5.1 > 192.168.1.103: ICMP 12.10.5.1 udp port 33437 unreachable, length 68
02:44:34.232814 IP 192.168.1.103.43946 > 12.10.5.1.33441: UDP, length 32
02:44:34.232830 IP 192.168.1.103.48921 > 12.10.5.1.33442: UDP, length 32
02:44:34.232844 IP 192.168.1.103.55390 > 12.10.5.1.33444: UDP, length 32
02:44:34.232857 IP 192.168.1.103.55425 > 12.10.5.1.33447: UDP, length 32
02:44:34.232870 IP 192.168.1.103.56075 > 12.10.5.1.33446: UDP, length 32
02:44:34.232883 IP 192.168.1.103.37984 > 12.10.5.1.33448: UDP, length 32
02:44:34.232897 IP 192.168.1.103.55508 > 12.10.5.1.33440: UDP, length 32
02:44:34.232909 IP 192.168.1.103.60064 > 12.10.5.1.33443: UDP, length 32
02:44:34.232922 IP 192.168.1.103.55719 > 12.10.5.1.33449: UDP, length 32
02:44:34.232943 IP 192.168.1.103.52538 > 12.10.5.1.33438: UDP, length 32
02:44:34.240743 IP 192.168.1.103.48808 > 12.10.5.3.33434: UDP, length 32
02:44:34.241302 IP 192.168.1.103.47213 > 12.10.5.3.33435: UDP, length 32
02:44:34.241899 IP 192.168.1.103.40130 > 12.10.5.3.33436: UDP, length 32
02:44:34.242461 IP 192.168.1.103.43818 > 12.10.5.3.33437: UDP, length 32
02:44:34.243275 IP 12.10.5.3 > 192.168.1.103: ICMP 12.10.5.3 udp port 33437 unreachable, length 68
02:44:34.244024 IP 192.168.1.103.55212 > 12.10.5.3.33438: UDP, length 32
02:44:34.245141 IP 192.168.1.103.59481 > 12.10.5.3.33447: UDP, length 32
02:44:34.245183 IP 192.168.1.103.45221 > 12.10.5.3.33439: UDP, length 32
02:44:34.245214 IP 192.168.1.103.38333 > 12.10.5.3.33445: UDP, length 32
02:44:34.245242 IP 192.168.1.103.39284 > 12.10.5.3.33448: UDP, length 32
02:44:34.245268 IP 192.168.1.103.45757 > 12.10.5.3.33440: UDP, length 32
02:44:34.245294 IP 192.168.1.103.49168 > 12.10.5.3.33441: UDP, length 32
02:44:34.245320 IP 192.168.1.103.45086 > 12.10.5.3.33442: UDP, length 32
02:44:34.245346 IP 192.168.1.103.36156 > 12.10.5.3.33446: UDP, length 32
02:44:34.245372 IP 192.168.1.103.59573 > 12.10.5.3.33449: UDP, length 32
02:44:34.245397 IP 192.168.1.103.60788 > 12.10.5.3.33443: UDP, length 32
02:44:34.245428 IP 192.168.1.103.46923 > 12.10.5.3.33444: UDP, length 32
02:44:34.245498 IP 12.10.5.3 > 192.168.1.103: ICMP 12.10.5.3 udp port 33438 unreachable, length 68
02:44:34.246904 IP 12.10.5.3 > 192.168.1.103: ICMP 12.10.5.3 udp port 33447 unreachable, length 68
02:44:34.246943 IP 12.10.5.3 > 192.168.1.103: ICMP 12.10.5.3 udp port 33439 unreachable, length 68
02:44:34.246971 IP 12.10.5.3 > 192.168.1.103: ICMP 12.10.5.3 udp port 33445 unreachable, length 68
02:44:34.247002 IP 12.10.5.3 > 192.168.1.103: ICMP 12.10.5.3 udp port 33448 unreachable, length 68
02:44:38.624429 ARP, Request who-has 192.168.1.1 tell 192.168.1.103, length 28
02:44:38.624437 ARP, Reply 192.168.1.1 is-at c2:6a:24:4a:ba:54 (oui Unknown), length 28
02:44:38.654353 IP 192.168.1.101 > 192.168.2.1: ICMP echo request, id 7688, seq 1, length 64
02:44:38.654363 IP 192.168.2.1 > 192.168.1.101: ICMP echo reply, id 7688, seq 1, length 64
02:44:38.659190 IP 192.168.1.101 > 12.10.5.103: ICMP echo request, id 7697, seq 1, length 64
02:44:38.659268 IP 12.10.5.103 > 192.168.1.101: ICMP echo reply, id 7697, seq 1, length 64
02:44:38.664285 IP 12.10.5.101 > 192.168.1.103: ICMP echo request, id 7703, seq 1, length 64
02:44:38.664334 IP 192.168.1.103 > 12.10.5.101: ICMP echo reply, id 7703, seq 1, length 64
02:44:38.665754 IP 192.168.1.101 > 12.10.5.1: ICMP echo request, id 7700, seq 1, length 64
02:44:38.665761 IP 12.10.5.1 > 192.168.1.101: ICMP echo reply, id 7700, seq 1, length 64
02:44:38.670065 IP 192.168.1.101 > 192.168.1.1: ICMP echo request, id 7709, seq 1, length 64
02:44:38.670074 IP 192.168.1.1 > 192.168.1.101: ICMP echo reply, id 7709, seq 1, length 64
02:44:38.675200 IP 12.10.5.101 > 192.168.1.101: ICMP echo request, id 7712, seq 1, length 64
02:44:38.675247 IP 192.168.1.101 > 12.10.5.101: ICMP echo reply, id 7712, seq 1, length 64
02:44:38.681167 IP 192.168.1.101 > 12.10.5.101: ICMP echo request, id 7718, seq 1, length 64
02:44:38.681242 IP 12.10.5.101 > 192.168.1.101: ICMP echo reply, id 7718, seq 1, length 64
02:44:38.685011 IP 12.10.5.101 > 192.168.1.3: ICMP echo request, id 7724, seq 1, length 64
02:44:38.685070 IP 192.168.1.3 > 12.10.5.101: ICMP echo reply, id 7724, seq 1, length 64
02:44:38.689105 IP 12.10.5.101 > 192.168.1.2: ICMP echo request, id 7733, seq 1, length 64
02:44:38.689158 IP 192.168.1.2 > 12.10.5.101: ICMP echo reply, id 7733, seq 1, length 64
02:44:38.691231 IP 192.168.1.101 > 12.10.5.2: ICMP echo request, id 7730, seq 1, length 64
02:44:38.691286 IP 12.10.5.2 > 192.168.1.101: ICMP echo reply, id 7730, seq 1, length 64
02:44:38.696932 IP 12.10.5.101 > 192.168.1.4: ICMP echo request, id 7736, seq 1, length 64
02:44:38.696983 IP 192.168.1.4 > 12.10.5.101: ICMP echo reply, id 7736, seq 1, length 64
02:44:38.713428 IP 192.168.1.101 > 12.10.5.3: ICMP echo request, id 7751, seq 1, length 64
02:44:38.714544 IP 12.10.5.3 > 192.168.1.101: ICMP echo reply, id 7751, seq 1, length 64
02:44:39.251576 IP 192.168.1.103.51450 > 12.10.5.103.33434: UDP, length 32
02:44:39.251622 IP 192.168.1.1 > 192.168.1.103: ICMP time exceeded in-transit, length 68
02:44:39.251987 IP 192.168.1.103.55103 > 12.10.5.103.33435: UDP, length 32
02:44:39.251992 IP 192.168.1.1 > 192.168.1.103: ICMP time exceeded in-transit, length 68
02:44:39.253245 IP 192.168.1.103.49667 > 12.10.5.103.33436: UDP, length 32
02:44:39.253251 IP 192.168.1.1 > 192.168.1.103: ICMP time exceeded in-transit, length 68
02:44:39.254040 IP 192.168.1.103.47781 > 12.10.5.103.33437: UDP, length 32
02:44:39.254861 IP 12.10.5.103 > 192.168.1.103: ICMP 12.10.5.103 udp port 33437 unreachable, length 68
02:44:39.256448 IP 192.168.1.103.53098 > 12.10.5.103.33446: UDP, length 32
02:44:39.256503 IP 192.168.1.103.38768 > 12.10.5.103.33442: UDP, length 32
02:44:39.256544 IP 192.168.1.103.40340 > 12.10.5.103.33439: UDP, length 32
02:44:39.256680 IP 192.168.1.103.38715 > 12.10.5.103.33438: UDP, length 32
02:44:39.256735 IP 192.168.1.103.52870 > 12.10.5.103.33449: UDP, length 32
02:44:39.256771 IP 192.168.1.103.34552 > 12.10.5.103.33448: UDP, length 32
02:44:39.256806 IP 192.168.1.103.59389 > 12.10.5.103.33441: UDP, length 32
02:44:39.256841 IP 192.168.1.103.50126 > 12.10.5.103.33447: UDP, length 32
02:44:39.256877 IP 192.168.1.103.45282 > 12.10.5.103.33445: UDP, length 32
02:44:39.256912 IP 192.168.1.103.37109 > 12.10.5.103.33440: UDP, length 32
02:44:39.256947 IP 192.168.1.103.34019 > 12.10.5.103.33443: UDP, length 32
02:44:39.256989 IP 192.168.1.103.51625 > 12.10.5.103.33444: UDP, length 32
02:44:39.258668 IP 12.10.5.103 > 192.168.1.103: ICMP 12.10.5.103 udp port 33446 unreachable, length 68
02:44:39.258708 IP 12.10.5.103 > 192.168.1.103: ICMP 12.10.5.103 udp port 33442 unreachable, length 68
02:44:39.258737 IP 12.10.5.103 > 192.168.1.103: ICMP 12.10.5.103 udp port 33439 unreachable, length 68
02:44:39.258763 IP 12.10.5.103 > 192.168.1.103: ICMP 12.10.5.103 udp port 33438 unreachable, length 68
02:44:39.258794 IP 12.10.5.103 > 192.168.1.103: ICMP 12.10.5.103 udp port 33449 unreachable, length 68
02:44:39.263992 IP 192.168.1.103.47451 > 12.10.5.2.33434: UDP, length 32
02:44:39.264005 IP 192.168.1.1 > 192.168.1.103: ICMP time exceeded in-transit, length 68
02:44:39.265210 IP 192.168.1.103.60195 > 12.10.5.2.33445: UDP, length 32
02:44:39.265251 IP 192.168.1.103.48014 > 12.10.5.2.33437: UDP, length 32
02:44:39.265280 IP 192.168.1.103.51042 > 12.10.5.2.33438: UDP, length 32
02:44:39.265306 IP 192.168.1.103.50386 > 12.10.5.2.33448: UDP, length 32
02:44:39.265331 IP 192.168.1.103.60572 > 12.10.5.2.33443: UDP, length 32
02:44:39.265356 IP 192.168.1.103.35848 > 12.10.5.2.33439: UDP, length 32
02:44:39.265381 IP 192.168.1.103.36627 > 12.10.5.2.33441: UDP, length 32
02:44:39.265405 IP 192.168.1.103.56257 > 12.10.5.2.33444: UDP, length 32
02:44:39.265429 IP 192.168.1.103.56572 > 12.10.5.2.33440: UDP, length 32
02:44:39.265454 IP 192.168.1.103.60025 > 12.10.5.2.33449: UDP, length 32
02:44:39.265478 IP 192.168.1.103.34569 > 12.10.5.2.33435: UDP, length 32
02:44:39.265483 IP 192.168.1.1 > 192.168.1.103: ICMP time exceeded in-transit, length 68
02:44:39.265548 IP 192.168.1.103.59379 > 12.10.5.2.33442: UDP, length 32
02:44:39.265596 IP 192.168.1.103.49801 > 12.10.5.2.33447: UDP, length 32
02:44:39.265621 IP 192.168.1.103.38016 > 12.10.5.2.33446: UDP, length 32
02:44:39.265646 IP 192.168.1.103.37976 > 12.10.5.2.33436: UDP, length 32
02:44:39.267171 IP 12.10.5.2 > 192.168.1.103: ICMP 12.10.5.2 udp port 33445 unreachable, length 68
02:44:39.267207 IP 12.10.5.2 > 192.168.1.103: ICMP 12.10.5.2 udp port 33437 unreachable, length 68
02:44:39.267234 IP 12.10.5.2 > 192.168.1.103: ICMP 12.10.5.2 udp port 33438 unreachable, length 68
02:44:39.267260 IP 12.10.5.2 > 192.168.1.103: ICMP 12.10.5.2 udp port 33448 unreachable, length 68
02:44:39.267285 IP 12.10.5.2 > 192.168.1.103: ICMP 12.10.5.2 udp port 33443 unreachable, length 68
02:44:39.267315 IP 12.10.5.2 > 192.168.1.103: ICMP 12.10.5.2 udp port 33439 unreachable, length 68
02:44:39.267823 IP 192.168.1.103.38129 > 12.10.5.2.33450: UDP, length 32
02:44:39.268262 IP 192.168.1.103.46369 > 12.10.5.2.33451: UDP, length 32
02:44:43.726098 IP 192.168.1.101 > 192.168.2.1: ICMP echo request, id 7789, seq 1, length 64
02:44:43.726108 IP 192.168.2.1 > 192.168.1.101: ICMP echo reply, id 7789, seq 1, length 64
02:44:43.731886 IP 192.168.1.101 > 12.10.5.103: ICMP echo request, id 7795, seq 1, length 64
02:44:43.731943 IP 12.10.5.103 > 192.168.1.101: ICMP echo reply, id 7795, seq 1, length 64
02:44:43.735387 IP 12.10.5.101 > 192.168.1.103: ICMP echo request, id 7798, seq 1, length 64
02:44:43.735451 IP 192.168.1.103 > 12.10.5.101: ICMP echo reply, id 7798, seq 1, length 64
02:44:43.738058 IP 192.168.1.101 > 12.10.5.1: ICMP echo request, id 7801, seq 1, length 64
02:44:43.738068 IP 12.10.5.1 > 192.168.1.101: ICMP echo reply, id 7801, seq 1, length 64
02:44:43.742805 IP 192.168.1.101 > 192.168.1.1: ICMP echo request, id 7807, seq 1, length 64
02:44:43.742813 IP 192.168.1.1 > 192.168.1.101: ICMP echo reply, id 7807, seq 1, length 64
02:44:43.746368 IP 12.10.5.101 > 192.168.1.101: ICMP echo request, id 7810, seq 1, length 64
02:44:43.746413 IP 192.168.1.101 > 12.10.5.101: ICMP echo reply, id 7810, seq 1, length 64
02:44:43.753858 IP 192.168.1.101 > 12.10.5.101: ICMP echo request, id 7819, seq 1, length 64
02:44:43.753947 IP 12.10.5.101 > 192.168.1.101: ICMP echo reply, id 7819, seq 1, length 64
02:44:43.760837 IP 12.10.5.101 > 192.168.1.3: ICMP echo request, id 7822, seq 1, length 64
02:44:43.760888 IP 192.168.1.3 > 12.10.5.101: ICMP echo reply, id 7822, seq 1, length 64
02:44:43.763917 IP 192.168.1.101 > 12.10.5.2: ICMP echo request, id 7828, seq 1, length 64
02:44:43.763974 IP 12.10.5.2 > 192.168.1.101: ICMP echo reply, id 7828, seq 1, length 64
02:44:43.766146 IP 12.10.5.101 > 192.168.1.2: ICMP echo request, id 7831, seq 1, length 64
02:44:43.766195 IP 192.168.1.2 > 12.10.5.101: ICMP echo reply, id 7831, seq 1, length 64
02:44:43.771805 IP 12.10.5.101 > 192.168.1.4: ICMP echo request, id 7837, seq 1, length 64
02:44:43.771870 IP 192.168.1.4 > 12.10.5.101: ICMP echo reply, id 7837, seq 1, length 64
02:44:43.785195 IP 192.168.1.101 > 12.10.5.3: ICMP echo request, id 7849, seq 1, length 64
02:44:43.785271 IP 12.10.5.3 > 192.168.1.101: ICMP echo reply, id 7849, seq 1, length 64
02:44:44.274883 ARP, Request who-has 192.168.1.4 tell 192.168.1.103, length 28
02:44:44.287450 ARP, Request who-has 192.168.1.3 tell 192.168.1.103, length 28

02:44:49.300150 ARP, Request who-has 192.168.1.2 tell 192.168.1.103, length 28
02:44:53.856936 ARP, Request who-has 192.168.1.1 tell 192.168.1.4, length 28
02:44:53.856944 ARP, Reply 192.168.1.1 is-at c2:6a:24:4a:ba:54 (oui Unknown), length 28
02:44:53.868332 IP 192.168.1.101 > 192.168.2.1: ICMP echo request, id 8020, seq 1, length 64
02:44:53.868344 IP 192.168.2.1 > 192.168.1.101: ICMP echo reply, id 8020, seq 1, length 64
02:44:53.873637 IP 192.168.1.101 > 12.10.5.103: ICMP echo request, id 8026, seq 1, length 64
02:44:53.873722 IP 12.10.5.103 > 192.168.1.101: ICMP echo reply, id 8026, seq 1, length 64
02:44:53.880840 IP 192.168.1.101 > 12.10.5.1: ICMP echo request, id 8029, seq 1, length 64
02:44:53.880848 IP 12.10.5.1 > 192.168.1.101: ICMP echo reply, id 8029, seq 1, length 64
02:44:53.885103 IP 192.168.1.101 > 192.168.1.1: ICMP echo request, id 8038, seq 1, length 64
02:44:53.885113 IP 192.168.1.1 > 192.168.1.101: ICMP echo reply, id 8038, seq 1, length 64
02:44:53.886082 IP 12.10.5.101 > 192.168.1.103: ICMP echo request, id 8035, seq 1, length 64
02:44:53.886129 IP 192.168.1.103 > 12.10.5.101: ICMP echo reply, id 8035, seq 1, length 64
02:44:53.895127 IP 192.168.1.101 > 12.10.5.101: ICMP echo request, id 8050, seq 1, length 64
02:44:53.895216 IP 12.10.5.101 > 192.168.1.101: ICMP echo reply, id 8050, seq 1, length 64
02:44:53.897331 IP 12.10.5.101 > 192.168.1.101: ICMP echo request, id 8047, seq 1, length 64
02:44:53.897379 IP 192.168.1.101 > 12.10.5.101: ICMP echo reply, id 8047, seq 1, length 64
02:44:53.906828 IP 192.168.1.101 > 12.10.5.2: ICMP echo request, id 8059, seq 1, length 64
02:44:53.906888 IP 12.10.5.2 > 192.168.1.101: ICMP echo reply, id 8059, seq 1, length 64
02:44:53.908358 IP 12.10.5.101 > 192.168.1.3: ICMP echo request, id 8062, seq 1, length 64
02:44:53.908477 IP 192.168.1.3 > 12.10.5.101: ICMP echo reply, id 8062, seq 1, length 64
02:44:53.911781 IP 12.10.5.101 > 192.168.1.2: ICMP echo request, id 8068, seq 1, length 64
02:44:53.911829 IP 192.168.1.2 > 12.10.5.101: ICMP echo reply, id 8068, seq 1, length 64
02:44:53.919485 IP 12.10.5.101 > 192.168.1.4: ICMP echo request, id 8071, seq 1, length 64
02:44:53.919532 IP 192.168.1.4 > 12.10.5.101: ICMP echo reply, id 8071, seq 1, length 64
02:44:53.926152 IP 192.168.1.101 > 12.10.5.3: ICMP echo request, id 8083, seq 1, length 64
02:44:53.926208 IP 12.10.5.3 > 192.168.1.101: ICMP echo reply, id 8083, seq 1, length 64
02:44:58.880771 ARP, Request who-has 192.168.1.1 tell 192.168.1.101, length 28
02:44:58.880782 ARP, Reply 192.168.1.1 is-at c2:6a:24:4a:ba:54 (oui Unknown), length 28
02:44:58.937782 IP 192.168.1.101 > 192.168.2.1: ICMP echo request, id 8171, seq 1, length 64
02:44:58.937812 IP 192.168.2.1 > 192.168.1.101: ICMP echo reply, id 8171, seq 1, length 64
02:44:58.944722 IP 192.168.1.101 > 12.10.5.103: ICMP echo request, id 8180, seq 1, length 64
02:44:58.944860 IP 12.10.5.103 > 192.168.1.101: ICMP echo reply, id 8180, seq 1, length 64
02:44:58.952128 IP 192.168.1.101 > 12.10.5.1: ICMP echo request, id 8183, seq 1, length 64
02:44:58.952143 IP 12.10.5.1 > 192.168.1.101: ICMP echo reply, id 8183, seq 1, length 64
02:44:58.957134 IP 12.10.5.101 > 192.168.1.103: ICMP echo request, id 8189, seq 1, length 64
02:44:58.957216 IP 192.168.1.103 > 12.10.5.101: ICMP echo reply, id 8189, seq 1, length 64
02:44:58.957927 IP 192.168.1.101 > 192.168.1.1: ICMP echo request, id 8192, seq 1, length 64
02:44:58.957935 IP 192.168.1.1 > 192.168.1.101: ICMP echo reply, id 8192, seq 1, length 64
02:44:58.969755 IP 192.168.1.101 > 12.10.5.101: ICMP echo request, id 8204, seq 1, length 64
02:44:58.969841 IP 12.10.5.101 > 192.168.1.101: ICMP echo reply, id 8204, seq 1, length 64
02:44:58.970835 IP 12.10.5.101 > 192.168.1.101: ICMP echo request, id 8201, seq 1, length 64
02:44:58.970915 IP 192.168.1.101 > 12.10.5.101: ICMP echo reply, id 8201, seq 1, length 64
02:44:58.982687 IP 12.10.5.101 > 192.168.1.3: ICMP echo request, id 8216, seq 1, length 64
02:44:58.982743 IP 192.168.1.3 > 12.10.5.101: ICMP echo reply, id 8216, seq 1, length 64
02:44:58.983428 IP 192.168.1.101 > 12.10.5.2: ICMP echo request, id 8213, seq 1, length 64
02:44:58.983483 IP 12.10.5.2 > 192.168.1.101: ICMP echo reply, id 8213, seq 1, length 64
