14:08:02.442787 ARP, Request who-has 192.168.3.1 tell 192.168.3.10, length 28
14:08:02.442795 ARP, Reply 192.168.3.1 is-at ee:29:cd:ea:ea:df (oui Unknown), length 28
14:08:09.743002 ARP, Request who-has 192.168.3.1 tell 192.168.3.11, length 28
14:08:09.743021 ARP, Reply 192.168.3.1 is-at ee:29:cd:ea:ea:df (oui Unknown), length 28
14:08:09.744200 IP 192.168.3.11 > 192.168.2.3: ICMP echo request, id 18648, seq 1, length 64
14:08:09.744211 IP 192.168.2.3 > 192.168.3.11: ICMP echo reply, id 18648, seq 1, length 64
14:08:09.747243 ARP, Request who-has 192.168.3.1 tell 192.168.3.12, length 28
14:08:09.747272 ARP, Reply 192.168.3.1 is-at ee:29:cd:ea:ea:df (oui Unknown), length 28
14:08:09.748525 IP 192.168.3.12 > 192.168.2.3: ICMP echo request, id 18649, seq 1, length 64
14:08:09.748533 IP 192.168.2.3 > 192.168.3.12: ICMP echo reply, id 18649, seq 1, length 64
14:08:09.751581 ARP, Request who-has 192.168.3.1 tell 192.168.3.13, length 28
14:08:09.751594 ARP, Reply 192.168.3.1 is-at ee:29:cd:ea:ea:df (oui Unknown), length 28
14:08:09.752899 IP 192.168.3.13 > 192.168.2.3: ICMP echo request, id 18650, seq 1, length 64
14:08:09.752907 IP 192.168.2.3 > 192.168.3.13: ICMP echo reply, id 18650, seq 1, length 64
14:08:09.755907 ARP, Request who-has 192.168.3.1 tell 192.168.3.14, length 28
14:08:09.755920 ARP, Reply 192.168.3.1 is-at ee:29:cd:ea:ea:df (oui Unknown), length 28
14:08:09.757250 IP 192.168.3.14 > 192.168.2.3: ICMP echo request, id 18651, seq 1, length 64
14:08:09.757259 IP 192.168.2.3 > 192.168.3.14: ICMP echo reply, id 18651, seq 1, length 64
14:08:09.759741 ARP, Request who-has 192.168.3.1 tell 192.168.3.15, length 28
14:08:09.759751 ARP, Reply 192.168.3.1 is-at ee:29:cd:ea:ea:df (oui Unknown), length 28
14:08:09.760686 IP 192.168.3.15 > 192.168.2.3: ICMP echo request, id 18652, seq 1, length 64
14:08:09.760693 IP 192.168.2.3 > 192.168.3.15: ICMP echo reply, id 18652, seq 1, length 64
14:08:09.762946 ARP, Request who-has 192.168.3.1 tell 192.168.3.16, length 28
14:08:09.762959 ARP, Reply 192.168.3.1 is-at ee:29:cd:ea:ea:df (oui Unknown), length 28
14:08:09.764400 IP 192.168.3.16 > 192.168.2.3: ICMP echo request, id 18653, seq 1, length 64
14:08:09.764410 IP 192.168.2.3 > 192.168.3.16: ICMP echo reply, id 18653, seq 1, length 64
14:08:09.767486 ARP, Request who-has 192.168.3.1 tell 192.168.3.17, length 28
14:08:09.767503 ARP, Reply 192.168.3.1 is-at ee:29:cd:ea:ea:df (oui Unknown), length 28
14:08:09.768833 IP 192.168.3.17 > 192.168.2.3: ICMP echo request, id 18654, seq 1, length 64
14:08:09.768842 IP 192.168.2.3 > 192.168.3.17: ICMP echo reply, id 18654, seq 1, length 64
14:08:09.805063 IP 192.168.3.1 > 192.168.3.11: ICMP echo request, id 18664, seq 1, length 64
14:08:09.806133 IP 192.168.3.11 > 192.168.3.1: ICMP echo reply, id 18664, seq 1, length 64
14:08:14.601042 ARP, Request who-has 192.168.3.11 tell 192.168.3.9, length 28
14:08:14.605712 ARP, Request who-has 192.168.3.1 tell 192.168.3.9, length 28
14:08:14.605726 ARP, Reply 192.168.3.1 is-at ee:29:cd:ea:ea:df (oui Unknown), length 28
14:08:14.606561 IP 192.168.3.9 > 192.168.2.3: ICMP echo request, id 18707, seq 1, length 64
14:08:14.606568 IP 192.168.2.3 > 192.168.3.9: ICMP echo reply, id 18707, seq 1, length 64
14:08:14.610550 ARP, Request who-has 192.168.3.12 tell 192.168.3.9, length 28
14:08:14.615271 ARP, Request who-has 192.168.3.13 tell 192.168.3.9, length 28
14:08:14.620410 ARP, Request who-has 192.168.3.14 tell 192.168.3.9, length 28
14:08:14.624940 ARP, Request who-has 192.168.3.15 tell 192.168.3.9, length 28
14:08:14.629775 ARP, Request who-has 192.168.3.16 tell 192.168.3.9, length 28
14:08:14.635170 ARP, Request who-has 192.168.3.17 tell 192.168.3.9, length 28
14:08:14.640853 IP 192.168.3.9 > 192.168.3.1: ICMP echo request, id 18728, seq 1, length 64
14:08:14.640862 IP 192.168.3.1 > 192.168.3.9: ICMP echo reply, id 18728, seq 1, length 64
14:08:14.746332 ARP, Request who-has 192.168.3.11 tell 192.168.3.1, length 28
14:08:14.747662 ARP, Reply 192.168.3.11 is-at 96:bb:aa:b6:51:36 (oui Unknown), length 28
14:08:14.762118 ARP, Request who-has 192.168.3.12 tell 192.168.3.1, length 28
14:08:14.762121 ARP, Request who-has 192.168.3.13 tell 192.168.3.1, length 28
14:08:14.762122 ARP, Request who-has 192.168.3.14 tell 192.168.3.1, length 28
14:08:14.762123 ARP, Request who-has 192.168.3.15 tell 192.168.3.1, length 28
14:08:14.764205 ARP, Reply 192.168.3.15 is-at ba:b3:31:c8:d2:c0 (oui Unknown), length 28
14:08:14.764238 ARP, Reply 192.168.3.12 is-at 22:4d:2e:c9:75:7d (oui Unknown), length 28
14:08:14.764248 ARP, Reply 192.168.3.14 is-at f6:53:43:3f:e8:03 (oui Unknown), length 28
14:08:14.764257 ARP, Reply 192.168.3.13 is-at fa:28:68:0f:bb:32 (oui Unknown), length 28
14:08:14.778142 ARP, Request who-has 192.168.3.16 tell 192.168.3.1, length 28
14:08:14.778145 ARP, Request who-has 192.168.3.17 tell 192.168.3.1, length 28
14:08:14.780175 ARP, Reply 192.168.3.17 is-at 0a:d6:66:5d:5a:68 (oui Unknown), length 28
14:08:14.780192 ARP, Reply 192.168.3.16 is-at 16:26:12:81:54:b5 (oui Unknown), length 28
14:08:19.642502 ARP, Request who-has 192.168.3.9 tell 192.168.3.1, length 28
14:08:19.645765 ARP, Reply 192.168.3.9 is-at f2:ed:b3:0b:b1:15 (oui Unknown), length 28
14:08:19.652171 IP 192.168.3.9 > 192.168.2.3: ICMP echo request, id 18805, seq 1, length 64
14:08:19.652181 IP 192.168.2.3 > 192.168.3.9: ICMP echo reply, id 18805, seq 1, length 64
14:08:19.674356 IP 192.168.3.9 > 192.168.3.1: ICMP echo request, id 18826, seq 1, length 64
14:08:19.674383 IP 192.168.3.1 > 192.168.3.9: ICMP echo reply, id 18826, seq 1, length 64
14:08:24.688519 IP 192.168.3.9 > 192.168.2.3: ICMP echo request, id 18908, seq 1, length 64
14:08:24.688528 IP 192.168.2.3 > 192.168.3.9: ICMP echo reply, id 18908, seq 1, length 64
14:08:24.707880 IP 192.168.3.9 > 192.168.3.1: ICMP echo request, id 18929, seq 1, length 64
14:08:24.707889 IP 192.168.3.1 > 192.168.3.9: ICMP echo reply, id 18929, seq 1, length 64

14:08:29.721561 IP 192.168.3.9 > 192.168.2.3: ICMP echo request, id 19023, seq 1, length 64
14:08:29.721571 IP 192.168.2.3 > 192.168.3.9: ICMP echo reply, id 19023, seq 1, length 64
14:08:29.745820 IP 192.168.3.9 > 192.168.3.1: ICMP echo request, id 19046, seq 1, length 64
14:08:29.745829 IP 192.168.3.1 > 192.168.3.9: ICMP echo reply, id 19046, seq 1, length 64
14:08:34.759240 IP 192.168.3.9 > 192.168.2.3: ICMP echo request, id 19125, seq 1, length 64
14:08:34.759250 IP 192.168.2.3 > 192.168.3.9: ICMP echo reply, id 19125, seq 1, length 64
14:08:34.776885 IP 192.168.3.9 > 192.168.3.1: ICMP echo request, id 19146, seq 1, length 64
14:08:34.776894 IP 192.168.3.1 > 192.168.3.9: ICMP echo reply, id 19146, seq 1, length 64
14:08:39.788635 IP 192.168.3.9 > 192.168.2.3: ICMP echo request, id 19230, seq 1, length 64
14:08:39.788648 IP 192.168.2.3 > 192.168.3.9: ICMP echo reply, id 19230, seq 1, length 64
14:08:39.810508 IP 192.168.3.9 > 192.168.3.1: ICMP echo request, id 19251, seq 1, length 64
14:08:39.810520 IP 192.168.3.1 > 192.168.3.9: ICMP echo reply, id 19251, seq 1, length 64
14:08:44.795364 ARP, Request who-has 192.168.3.1 tell 192.168.3.9, length 28
14:08:44.795371 ARP, Reply 192.168.3.1 is-at ee:29:cd:ea:ea:df (oui Unknown), length 28
14:08:44.823235 IP 192.168.3.9 > 192.168.2.3: ICMP echo request, id 19333, seq 1, length 64
14:08:44.823245 IP 192.168.2.3 > 192.168.3.9: ICMP echo reply, id 19333, seq 1, length 64
14:08:44.841715 IP 192.168.3.9 > 192.168.3.1: ICMP echo request, id 19354, seq 1, length 64
14:08:44.841724 IP 192.168.3.1 > 192.168.3.9: ICMP echo reply, id 19354, seq 1, length 64
14:08:49.834414 ARP, Request who-has 192.168.3.9 tell 192.168.3.1, length 28
14:08:49.834524 ARP, Reply 192.168.3.9 is-at f2:ed:b3:0b:b1:15 (oui Unknown), length 28
14:08:49.851233 IP 192.168.3.9 > 192.168.2.3: ICMP echo request, id 19439, seq 1, length 64
14:08:49.851242 IP 192.168.2.3 > 192.168.3.9: ICMP echo reply, id 19439, seq 1, length 64
14:08:49.869961 IP 192.168.3.9 > 192.168.3.1: ICMP echo request, id 19460, seq 1, length 64
14:08:49.869971 IP 192.168.3.1 > 192.168.3.9: ICMP echo reply, id 19460, seq 1, length 64
14:08:54.883674 IP 192.168.3.9 > 192.168.2.3: ICMP echo request, id 19539, seq 1, length 64
14:08:54.883683 IP 192.168.2.3 > 192.168.3.9: ICMP echo reply, id 19539, seq 1, length 64
14:08:54.905876 IP 192.168.3.9 > 192.168.3.1: ICMP echo request, id 19563, seq 1, length 64
14:08:54.905885 IP 192.168.3.1 > 192.168.3.9: ICMP echo reply, id 19563, seq 1, length 64

14:08:59.980036 IP 192.168.3.9 > 192.168.2.3: ICMP echo request, id 19663, seq 1, length 64
14:08:59.980067 IP 192.168.2.3 > 192.168.3.9: ICMP echo reply, id 19663, seq 1, length 64
14:09:00.200036 IP 192.168.3.9 > 192.168.3.1: ICMP echo request, id 19707, seq 1, length 64
14:09:00.200047 IP 192.168.3.1 > 192.168.3.9: ICMP echo reply, id 19707, seq 1, length 64
14:09:04.946940 IP 192.168.3.10.41729 > 192.168.2.3.33434: UDP, length 32
14:09:04.946955 IP 192.168.2.3 > 192.168.3.10: ICMP 192.168.2.3 udp port 33434 unreachable, length 68
14:09:04.948565 IP 192.168.3.10.57554 > 192.168.2.3.33435: UDP, length 32
14:09:04.948577 IP 192.168.2.3 > 192.168.3.10: ICMP 192.168.2.3 udp port 33435 unreachable, length 68
14:09:04.950548 IP 192.168.3.10.53399 > 192.168.2.3.33436: UDP, length 32
14:09:04.950564 IP 192.168.2.3 > 192.168.3.10: ICMP 192.168.2.3 udp port 33436 unreachable, length 68
14:09:04.952586 IP 192.168.3.10.45526 > 192.168.2.3.33439: UDP, length 32
14:09:04.952598 IP 192.168.2.3 > 192.168.3.10: ICMP 192.168.2.3 udp port 33439 unreachable, length 68
14:09:04.954094 IP 192.168.3.10.48368 > 192.168.2.3.33440: UDP, length 32
14:09:04.954104 IP 192.168.2.3 > 192.168.3.10: ICMP 192.168.2.3 udp port 33440 unreachable, length 68
14:09:04.954572 IP 192.168.3.10.54994 > 192.168.2.3.33442: UDP, length 32
14:09:04.954580 IP 192.168.2.3 > 192.168.3.10: ICMP 192.168.2.3 udp port 33442 unreachable, length 68
14:09:04.954642 IP 192.168.3.10.56507 > 192.168.2.3.33446: UDP, length 32
14:09:04.954661 IP 192.168.3.10.50043 > 192.168.2.3.33449: UDP, length 32
14:09:04.954676 IP 192.168.3.10.37147 > 192.168.2.3.33448: UDP, length 32
14:09:04.954690 IP 192.168.3.10.56785 > 192.168.2.3.33447: UDP, length 32
14:09:04.954715 IP 192.168.3.10.55154 > 192.168.2.3.33445: UDP, length 32
14:09:04.958249 IP 192.168.3.10.60115 > 192.168.2.3.33443: UDP, length 32
14:09:04.958277 IP 192.168.3.10.38517 > 192.168.2.3.33441: UDP, length 32
14:09:04.958293 IP 192.168.3.10.44828 > 192.168.2.3.33444: UDP, length 32
14:09:04.958308 IP 192.168.3.10.37157 > 192.168.2.3.33438: UDP, length 32
14:09:04.958322 IP 192.168.3.10.51189 > 192.168.2.3.33437: UDP, length 32
14:09:04.971142 ARP, Request who-has 192.168.3.12 tell 192.168.3.10, length 28
14:09:05.255958 IP 192.168.3.9 > 192.168.2.3: ICMP echo request, id 19798, seq 1, length 64
14:09:05.255968 IP 192.168.2.3 > 192.168.3.9: ICMP echo reply, id 19798, seq 1, length 64
14:09:05.383248 IP 192.168.3.9 > 192.168.3.1: ICMP echo request, id 19828, seq 1, length 64
14:09:05.383258 IP 192.168.3.1 > 192.168.3.9: ICMP echo reply, id 19828, seq 1, length 64
14:09:09.963163 ARP, Request who-has 192.168.3.1 tell 192.168.3.10, length 28
14:09:09.963174 ARP, Reply 192.168.3.1 is-at ee:29:cd:ea:ea:df (oui Unknown), length 28
14:09:09.983796 ARP, Request who-has 192.168.3.13 tell 192.168.3.10, length 28
14:09:09.991339 ARP, Request who-has 192.168.3.11 tell 192.168.3.10, length 28
14:09:10.266160 ARP, Request who-has 192.168.3.1 tell 192.168.3.9, length 28
14:09:10.266168 ARP, Reply 192.168.3.1 is-at ee:29:cd:ea:ea:df (oui Unknown), length 28
14:09:10.419504 IP 192.168.3.9 > 192.168.2.3: ICMP echo request, id 19906, seq 1, length 64
14:09:10.419516 IP 192.168.2.3 > 192.168.3.9: ICMP echo reply, id 19906, seq 1, length 64
14:09:10.442479 IP 192.168.3.9 > 192.168.3.1: ICMP echo request, id 19927, seq 1, length 64
14:09:10.442490 IP 192.168.3.1 > 192.168.3.9: ICMP echo reply, id 19927, seq 1, length 64
14:09:10.449131 ARP, Request who-has 192.168.3.10 tell 192.168.3.9, length 28
14:09:14.996789 ARP, Request who-has 192.168.3.16 tell 192.168.3.10, length 28
14:09:15.008609 ARP, Request who-has 192.168.3.17 tell 192.168.3.10, length 28
14:09:15.463160 IP 192.168.3.9 > 192.168.2.3: ICMP echo request, id 20013, seq 1, length 64
14:09:15.463216 IP 192.168.2.3 > 192.168.3.9: ICMP echo reply, id 20013, seq 1, length 64
14:09:15.487196 IP 192.168.3.9 > 192.168.3.1: ICMP echo request, id 20034, seq 1, length 64
14:09:15.487207 IP 192.168.3.1 > 192.168.3.9: ICMP echo reply, id 20034, seq 1, length 64
14:09:20.048178 ARP, Request who-has 192.168.3.14 tell 192.168.3.10, length 28
14:09:20.099727 ARP, Request who-has 192.168.3.15 tell 192.168.3.10, length 28
14:09:20.474220 ARP, Request who-has 192.168.3.9 tell 192.168.3.1, length 28
14:09:20.474420 ARP, Reply 192.168.3.9 is-at f2:ed:b3:0b:b1:15 (oui Unknown), length 28
14:09:20.544355 IP 192.168.3.9 > 192.168.2.3: ICMP echo request, id 20165, seq 1, length 64
14:09:20.544368 IP 192.168.2.3 > 192.168.3.9: ICMP echo reply, id 20165, seq 1, length 64
14:09:20.727899 IP 192.168.3.9 > 192.168.3.1: ICMP echo request, id 20198, seq 1, length 64
14:09:20.727912 IP 192.168.3.1 > 192.168.3.9: ICMP echo reply, id 20198, seq 1, length 64
14:09:25.859703 IP 192.168.3.9 > 192.168.2.3: ICMP echo request, id 20307, seq 1, length 64
14:09:25.859712 IP 192.168.2.3 > 192.168.3.9: ICMP echo reply, id 20307, seq 1, length 64
14:09:25.999076 IP 192.168.3.9 > 192.168.3.1: ICMP echo request, id 20328, seq 1, length 64
14:09:25.999090 IP 192.168.3.1 > 192.168.3.9: ICMP echo reply, id 20328, seq 1, length 64

14:09:31.064440 IP 192.168.3.9 > 192.168.2.3: ICMP echo request, id 20427, seq 1, length 64
14:09:31.064452 IP 192.168.2.3 > 192.168.3.9: ICMP echo reply, id 20427, seq 1, length 64
14:09:31.081812 IP 192.168.3.9 > 192.168.3.1: ICMP echo request, id 20448, seq 1, length 64
14:09:31.081821 IP 192.168.3.1 > 192.168.3.9: ICMP echo reply, id 20448, seq 1, length 64
14:09:36.074266 ARP, Request who-has 192.168.3.1 tell 192.168.3.9, length 28
14:09:36.074272 ARP, Reply 192.168.3.1 is-at ee:29:cd:ea:ea:df (oui Unknown), length 28
14:09:36.097514 IP 192.168.3.9 > 192.168.2.3: ICMP echo request, id 20537, seq 1, length 64
14:09:36.097525 IP 192.168.2.3 > 192.168.3.9: ICMP echo reply, id 20537, seq 1, length 64
14:09:36.117164 IP 192.168.3.9 > 192.168.3.1: ICMP echo request, id 20558, seq 1, length 64
14:09:36.117172 IP 192.168.3.1 > 192.168.3.9: ICMP echo reply, id 20558, seq 1, length 64
14:09:41.133053 IP 192.168.3.9 > 192.168.2.3: ICMP echo request, id 20648, seq 1, length 64
14:09:41.133063 IP 192.168.2.3 > 192.168.3.9: ICMP echo reply, id 20648, seq 1, length 64
14:09:41.151521 IP 192.168.3.9 > 192.168.3.1: ICMP echo request, id 20669, seq 1, length 64
14:09:41.151531 IP 192.168.3.1 > 192.168.3.9: ICMP echo reply, id 20669, seq 1, length 64
14:09:46.167589 IP 192.168.3.9 > 192.168.2.3: ICMP echo request, id 20757, seq 1, length 64
14:09:46.167599 IP 192.168.2.3 > 192.168.3.9: ICMP echo reply, id 20757, seq 1, length 64
14:09:46.185866 IP 192.168.3.9 > 192.168.3.1: ICMP echo request, id 20778, seq 1, length 64
14:09:46.185875 IP 192.168.3.1 > 192.168.3.9: ICMP echo reply, id 20778, seq 1, length 64
14:09:51.178180 ARP, Request who-has 192.168.3.9 tell 192.168.3.1, length 28
14:09:51.178321 ARP, Reply 192.168.3.9 is-at f2:ed:b3:0b:b1:15 (oui Unknown), length 28
14:09:51.223804 IP 192.168.3.9 > 192.168.2.3: ICMP echo request, id 20895, seq 1, length 64
14:09:51.223815 IP 192.168.2.3 > 192.168.3.9: ICMP echo reply, id 20895, seq 1, length 64
14:09:51.363005 IP 192.168.3.9 > 192.168.3.1: ICMP echo request, id 20923, seq 1, length 64
14:09:51.363015 IP 192.168.3.1 > 192.168.3.9: ICMP echo reply, id 20923, seq 1, length 64
14:09:55.262174 IP 192.168.3.10.48750 > 192.168.2.3.33434: UDP, length 32
14:09:55.262189 IP 192.168.2.3 > 192.168.3.10: ICMP 192.168.2.3 udp port 33434 unreachable, length 68
14:09:55.263536 IP 192.168.3.10.53393 > 192.168.2.3.33435: UDP, length 32
14:09:55.263543 IP 192.168.2.3 > 192.168.3.10: ICMP 192.168.2.3 udp port 33435 unreachable, length 68
14:09:55.264708 IP 192.168.3.10.38330 > 192.168.2.3.33436: UDP, length 32
14:09:55.264728 IP 192.168.2.3 > 192.168.3.10: ICMP 192.168.2.3 udp port 33436 unreachable, length 68
14:09:55.266201 IP 192.168.3.10.48416 > 192.168.2.3.33444: UDP, length 32
14:09:55.266210 IP 192.168.2.3 > 192.168.3.10: ICMP 192.168.2.3 udp port 33444 unreachable, length 68
14:09:55.266827 IP 192.168.3.10.51720 > 192.168.2.3.33440: UDP, length 32
14:09:55.266835 IP 192.168.2.3 > 192.168.3.10: ICMP 192.168.2.3 udp port 33440 unreachable, length 68
14:09:55.267497 IP 192.168.3.10.34718 > 192.168.2.3.33441: UDP, length 32
14:09:55.267503 IP 192.168.2.3 > 192.168.3.10: ICMP 192.168.2.3 udp port 33441 unreachable, length 68
14:09:55.268755 IP 192.168.3.10.57100 > 192.168.2.3.33449: UDP, length 32
14:09:55.268773 IP 192.168.3.10.34765 > 192.168.2.3.33447: UDP, length 32
14:09:55.268783 IP 192.168.3.10.58827 > 192.168.2.3.33446: UDP, length 32
14:09:55.268791 IP 192.168.3.10.53582 > 192.168.2.3.33438: UDP, length 32
14:09:55.268800 IP 192.168.3.10.55715 > 192.168.2.3.33442: UDP, length 32
14:09:55.268808 IP 192.168.3.10.54653 > 192.168.2.3.33445: UDP, length 32
14:09:55.268816 IP 192.168.3.10.42508 > 192.168.2.3.33437: UDP, length 32
14:09:55.268824 IP 192.168.3.10.56218 > 192.168.2.3.33439: UDP, length 32
14:09:55.269823 IP 192.168.3.10.49641 > 192.168.2.3.33448: UDP, length 32
14:09:55.269842 IP 192.168.3.10.33913 > 192.168.2.3.33443: UDP, length 32
14:09:56.427644 IP 192.168.3.9 > 192.168.2.3: ICMP echo request, id 21019, seq 1, length 64
14:09:56.427653 IP 192.168.2.3 > 192.168.3.9: ICMP echo reply, id 21019, seq 1, length 64
14:09:56.445254 IP 192.168.3.9 > 192.168.3.1: ICMP echo request, id 21040, seq 1, length 64
14:09:56.445264 IP 192.168.3.1 > 192.168.3.9: ICMP echo reply, id 21040, seq 1, length 64

14:10:00.266149 ARP, Request who-has 192.168.3.10 tell 192.168.3.1, length 28
14:10:00.266291 ARP, Request who-has 192.168.3.1 tell 192.168.3.10, length 28
14:10:00.266312 ARP, Reply 192.168.3.1 is-at ee:29:cd:ea:ea:df (oui Unknown), length 28
14:10:00.268406 ARP, Reply 192.168.3.10 is-at da:23:0f:c5:31:d3 (oui Unknown), length 28
14:10:01.459509 IP 192.168.3.9 > 192.168.2.3: ICMP echo request, id 21139, seq 1, length 64
14:10:01.459520 IP 192.168.2.3 > 192.168.3.9: ICMP echo reply, id 21139, seq 1, length 64
14:10:01.483871 IP 192.168.3.9 > 192.168.3.1: ICMP echo request, id 21160, seq 1, length 64
14:10:01.483883 IP 192.168.3.1 > 192.168.3.9: ICMP echo reply, id 21160, seq 1, length 64
14:10:06.474380 ARP, Request who-has 192.168.3.1 tell 192.168.3.9, length 28
14:10:06.474387 ARP, Reply 192.168.3.1 is-at ee:29:cd:ea:ea:df (oui Unknown), length 28
14:10:06.555274 IP 192.168.3.9 > 192.168.2.3: ICMP echo request, id 21294, seq 1, length 64
14:10:06.555285 IP 192.168.2.3 > 192.168.3.9: ICMP echo reply, id 21294, seq 1, length 64
14:10:06.844232 IP 192.168.3.9 > 192.168.3.1: ICMP echo request, id 21322, seq 1, length 64
14:10:06.844243 IP 192.168.3.1 > 192.168.3.9: ICMP echo reply, id 21322, seq 1, length 64
14:10:12.017215 IP 192.168.3.9 > 192.168.2.3: ICMP echo request, id 21468, seq 1, length 64
14:10:12.017226 IP 192.168.2.3 > 192.168.3.9: ICMP echo reply, id 21468, seq 1, length 64
14:10:12.039192 IP 192.168.3.9 > 192.168.3.1: ICMP echo request, id 21489, seq 1, length 64
14:10:12.039205 IP 192.168.3.1 > 192.168.3.9: ICMP echo reply, id 21489, seq 1, length 64
14:10:17.018220 ARP, Request who-has 192.168.3.9 tell 192.168.3.1, length 28
14:10:17.018413 ARP, Reply 192.168.3.9 is-at f2:ed:b3:0b:b1:15 (oui Unknown), length 28
14:10:17.057402 IP 192.168.3.9 > 192.168.2.3: ICMP echo request, id 21576, seq 1, length 64
14:10:17.057412 IP 192.168.2.3 > 192.168.3.9: ICMP echo reply, id 21576, seq 1, length 64
14:10:17.075769 IP 192.168.3.9 > 192.168.3.1: ICMP echo request, id 21597, seq 1, length 64
14:10:17.075778 IP 192.168.3.1 > 192.168.3.9: ICMP echo reply, id 21597, seq 1, length 64
14:10:22.123887 IP 192.168.3.9 > 192.168.2.3: ICMP echo request, id 21723, seq 1, length 64
14:10:22.123900 IP 192.168.2.3 > 192.168.3.9: ICMP echo reply, id 21723, seq 1, length 64
14:10:22.271504 IP 192.168.3.9 > 192.168.3.1: ICMP echo request, id 21744, seq 1, length 64
14:10:22.271514 IP 192.168.3.1 > 192.168.3.9: ICMP echo reply, id 21744, seq 1, length 64
14:10:27.388078 IP 192.168.3.9 > 192.168.2.3: ICMP echo request, id 21880, seq 1, length 64
14:10:27.388090 IP 192.168.2.3 > 192.168.3.9: ICMP echo reply, id 21880, seq 1, length 64
14:10:27.607572 IP 192.168.3.9 > 192.168.3.1: ICMP echo request, id 21907, seq 1, length 64
14:10:27.607583 IP 192.168.3.1 > 192.168.3.9: ICMP echo reply, id 21907, seq 1, length 64

14:10:32.712634 IP 192.168.3.9 > 192.168.2.3: ICMP echo request, id 22040, seq 1, length 64
14:10:32.712646 IP 192.168.2.3 > 192.168.3.9: ICMP echo reply, id 22040, seq 1, length 64
14:10:32.736129 IP 192.168.3.9 > 192.168.3.1: ICMP echo request, id 22061, seq 1, length 64
14:10:32.736141 IP 192.168.3.1 > 192.168.3.9: ICMP echo reply, id 22061, seq 1, length 64
14:10:37.722213 ARP, Request who-has 192.168.3.1 tell 192.168.3.9, length 28
14:10:37.722219 ARP, Reply 192.168.3.1 is-at ee:29:cd:ea:ea:df (oui Unknown), length 28
14:10:37.751045 IP 192.168.3.9 > 192.168.2.3: ICMP echo request, id 22148, seq 1, length 64
14:10:37.751056 IP 192.168.2.3 > 192.168.3.9: ICMP echo reply, id 22148, seq 1, length 64
14:10:37.771100 IP 192.168.3.9 > 192.168.3.1: ICMP echo request, id 22169, seq 1, length 64
14:10:37.771113 IP 192.168.3.1 > 192.168.3.9: ICMP echo reply, id 22169, seq 1, length 64
14:10:42.762127 ARP, Request who-has 192.168.3.9 tell 192.168.3.1, length 28
14:10:42.762331 ARP, Reply 192.168.3.9 is-at f2:ed:b3:0b:b1:15 (oui Unknown), length 28
14:10:42.792555 IP 192.168.3.9 > 192.168.2.3: ICMP echo request, id 22258, seq 1, length 64
14:10:42.792566 IP 192.168.2.3 > 192.168.3.9: ICMP echo reply, id 22258, seq 1, length 64
14:10:42.813405 IP 192.168.3.9 > 192.168.3.1: ICMP echo request, id 22279, seq 1, length 64
14:10:42.813415 IP 192.168.3.1 > 192.168.3.9: ICMP echo reply, id 22279, seq 1, length 64
14:10:47.829788 IP 192.168.3.9 > 192.168.2.3: ICMP echo request, id 22375, seq 1, length 64
14:10:47.829799 IP 192.168.2.3 > 192.168.3.9: ICMP echo reply, id 22375, seq 1, length 64
14:10:47.854594 IP 192.168.3.9 > 192.168.3.1: ICMP echo request, id 22396, seq 1, length 64
14:10:47.854605 IP 192.168.3.1 > 192.168.3.9: ICMP echo reply, id 22396, seq 1, length 64
14:10:52.873018 IP 192.168.3.9 > 192.168.2.3: ICMP echo request, id 22485, seq 1, length 64
14:10:52.873030 IP 192.168.2.3 > 192.168.3.9: ICMP echo reply, id 22485, seq 1, length 64
14:10:52.895171 IP 192.168.3.9 > 192.168.3.1: ICMP echo request, id 22506, seq 1, length 64
14:10:52.895196 IP 192.168.3.1 > 192.168.3.9: ICMP echo reply, id 22506, seq 1, length 64
14:10:57.911092 IP 192.168.3.9 > 192.168.2.3: ICMP echo request, id 22595, seq 1, length 64
14:10:57.911102 IP 192.168.2.3 > 192.168.3.9: ICMP echo reply, id 22595, seq 1, length 64
14:10:57.932978 IP 192.168.3.9 > 192.168.3.1: ICMP echo request, id 22616, seq 1, length 64
14:10:57.932989 IP 192.168.3.1 > 192.168.3.9: ICMP echo reply, id 22616, seq 1, length 64

14:11:02.952355 IP 192.168.3.9 > 192.168.2.3: ICMP echo request, id 22715, seq 1, length 64
14:11:02.952368 IP 192.168.2.3 > 192.168.3.9: ICMP echo reply, id 22715, seq 1, length 64
14:11:02.977683 IP 192.168.3.9 > 192.168.3.1: ICMP echo request, id 22736, seq 1, length 64
14:11:02.977696 IP 192.168.3.1 > 192.168.3.9: ICMP echo reply, id 22736, seq 1, length 64
14:11:07.962133 ARP, Request who-has 192.168.3.9 tell 192.168.3.1, length 28
14:11:07.962248 ARP, Request who-has 192.168.3.1 tell 192.168.3.9, length 28
14:11:07.962256 ARP, Reply 192.168.3.1 is-at ee:29:cd:ea:ea:df (oui Unknown), length 28
14:11:07.962345 ARP, Reply 192.168.3.9 is-at f2:ed:b3:0b:b1:15 (oui Unknown), length 28
14:11:07.993589 IP 192.168.3.9 > 192.168.2.3: ICMP echo request, id 22824, seq 1, length 64
14:11:07.993603 IP 192.168.2.3 > 192.168.3.9: ICMP echo reply, id 22824, seq 1, length 64
14:11:08.016151 IP 192.168.3.9 > 192.168.3.1: ICMP echo request, id 22845, seq 1, length 64
14:11:08.016162 IP 192.168.3.1 > 192.168.3.9: ICMP echo reply, id 22845, seq 1, length 64
14:11:13.034711 IP 192.168.3.9 > 192.168.2.3: ICMP echo request, id 22934, seq 1, length 64
14:11:13.034721 IP 192.168.2.3 > 192.168.3.9: ICMP echo reply, id 22934, seq 1, length 64
14:11:13.053586 IP 192.168.3.9 > 192.168.3.1: ICMP echo request, id 22955, seq 1, length 64
14:11:13.053595 IP 192.168.3.1 > 192.168.3.9: ICMP echo reply, id 22955, seq 1, length 64
14:11:18.067233 IP 192.168.3.9 > 192.168.2.3: ICMP echo request, id 23042, seq 1, length 64
14:11:18.067242 IP 192.168.2.3 > 192.168.3.9: ICMP echo reply, id 23042, seq 1, length 64
14:11:18.083939 IP 192.168.3.9 > 192.168.3.1: ICMP echo request, id 23063, seq 1, length 64
14:11:18.083947 IP 192.168.3.1 > 192.168.3.9: ICMP echo reply, id 23063, seq 1, length 64
14:11:23.097342 IP 192.168.3.9 > 192.168.2.3: ICMP echo request, id 23152, seq 1, length 64
14:11:23.097353 IP 192.168.2.3 > 192.168.3.9: ICMP echo reply, id 23152, seq 1, length 64
14:11:23.117115 IP 192.168.3.9 > 192.168.3.1: ICMP echo request, id 23173, seq 1, length 64
14:11:23.117126 IP 192.168.3.1 > 192.168.3.9: ICMP echo reply, id 23173, seq 1, length 64
14:11:28.134193 IP 192.168.3.9 > 192.168.2.3: ICMP echo request, id 23260, seq 1, length 64
14:11:28.134217 IP 192.168.2.3 > 192.168.3.9: ICMP echo reply, id 23260, seq 1, length 64
14:11:28.155961 IP 192.168.3.9 > 192.168.3.1: ICMP echo request, id 23281, seq 1, length 64
14:11:28.155970 IP 192.168.3.1 > 192.168.3.9: ICMP echo reply, id 23281, seq 1, length 64

14:11:33.146550 ARP, Request who-has 192.168.3.9 tell 192.168.3.1, length 28
14:11:33.146681 ARP, Reply 192.168.3.9 is-at f2:ed:b3:0b:b1:15 (oui Unknown), length 28
14:11:33.167878 IP 192.168.3.9 > 192.168.2.3: ICMP echo request, id 23379, seq 1, length 64
14:11:33.167886 IP 192.168.2.3 > 192.168.3.9: ICMP echo reply, id 23379, seq 1, length 64
14:11:33.186057 IP 192.168.3.9 > 192.168.3.1: ICMP echo request, id 23400, seq 1, length 64
14:11:33.186067 IP 192.168.3.1 > 192.168.3.9: ICMP echo reply, id 23400, seq 1, length 64
14:11:38.170537 ARP, Request who-has 192.168.3.1 tell 192.168.3.9, length 28
14:11:38.170544 ARP, Reply 192.168.3.1 is-at ee:29:cd:ea:ea:df (oui Unknown), length 28
14:11:38.211001 IP 192.168.3.9 > 192.168.2.3: ICMP echo request, id 23497, seq 1, length 64
14:11:38.211010 IP 192.168.2.3 > 192.168.3.9: ICMP echo reply, id 23497, seq 1, length 64
14:11:38.303538 IP 192.168.3.9 > 192.168.3.1: ICMP echo request, id 23518, seq 1, length 64
14:11:38.303546 IP 192.168.3.1 > 192.168.3.9: ICMP echo reply, id 23518, seq 1, length 64
14:11:43.376108 IP 192.168.3.9 > 192.168.2.3: ICMP echo request, id 23687, seq 1, length 64
14:11:43.376119 IP 192.168.2.3 > 192.168.3.9: ICMP echo reply, id 23687, seq 1, length 64
14:11:43.499878 IP 192.168.3.9 > 192.168.3.1: ICMP echo request, id 23708, seq 1, length 64
14:11:43.499890 IP 192.168.3.1 > 192.168.3.9: ICMP echo reply, id 23708, seq 1, length 64
14:11:48.547712 IP 192.168.3.9 > 192.168.2.3: ICMP echo request, id 23795, seq 1, length 64
14:11:48.547722 IP 192.168.2.3 > 192.168.3.9: ICMP echo reply, id 23795, seq 1, length 64
14:11:48.564952 IP 192.168.3.9 > 192.168.3.1: ICMP echo request, id 23816, seq 1, length 64
14:11:48.564960 IP 192.168.3.1 > 192.168.3.9: ICMP echo reply, id 23816, seq 1, length 64
14:11:53.580670 IP 192.168.3.9 > 192.168.2.3: ICMP echo request, id 23905, seq 1, length 64
14:11:53.580680 IP 192.168.2.3 > 192.168.3.9: ICMP echo reply, id 23905, seq 1, length 64
14:11:53.597819 IP 192.168.3.9 > 192.168.3.1: ICMP echo request, id 23926, seq 1, length 64
14:11:53.597827 IP 192.168.3.1 > 192.168.3.9: ICMP echo reply, id 23926, seq 1, length 64
14:11:58.586406 ARP, Request who-has 192.168.3.9 tell 192.168.3.1, length 28
14:11:58.586540 ARP, Reply 192.168.3.9 is-at f2:ed:b3:0b:b1:15 (oui Unknown), length 28
14:11:58.628042 IP 192.168.3.9 > 192.168.2.3: ICMP echo request, id 24023, seq 1, length 64
14:11:58.628054 IP 192.168.2.3 > 192.168.3.9: ICMP echo reply, id 24023, seq 1, length 64
14:11:58.748827 IP 192.168.3.9 > 192.168.3.1: ICMP echo request, id 24051, seq 1, length 64
14:11:58.748839 IP 192.168.3.1 > 192.168.3.9: ICMP echo reply, id 24051, seq 1, length 64

14:12:03.872391 IP 192.168.3.9 > 192.168.2.3: ICMP echo request, id 24224, seq 1, length 64
14:12:03.872402 IP 192.168.2.3 > 192.168.3.9: ICMP echo reply, id 24224, seq 1, length 64
14:12:04.000067 IP 192.168.3.9 > 192.168.3.1: ICMP echo request, id 24245, seq 1, length 64
14:12:04.000095 IP 192.168.3.1 > 192.168.3.9: ICMP echo reply, id 24245, seq 1, length 64
14:12:08.874467 ARP, Request who-has 192.168.3.1 tell 192.168.3.9, length 28
14:12:08.874477 ARP, Reply 192.168.3.1 is-at ee:29:cd:ea:ea:df (oui Unknown), length 28
14:12:09.059857 IP 192.168.3.9 > 192.168.2.3: ICMP echo request, id 24332, seq 1, length 64
14:12:09.059866 IP 192.168.2.3 > 192.168.3.9: ICMP echo reply, id 24332, seq 1, length 64
14:12:09.079859 IP 192.168.3.9 > 192.168.3.1: ICMP echo request, id 24353, seq 1, length 64
14:12:09.079868 IP 192.168.3.1 > 192.168.3.9: ICMP echo reply, id 24353, seq 1, length 64
14:12:14.096588 IP 192.168.3.9 > 192.168.2.3: ICMP echo request, id 24442, seq 1, length 64
14:12:14.096599 IP 192.168.2.3 > 192.168.3.9: ICMP echo reply, id 24442, seq 1, length 64
14:12:14.113683 IP 192.168.3.9 > 192.168.3.1: ICMP echo request, id 24463, seq 1, length 64
14:12:14.113691 IP 192.168.3.1 > 192.168.3.9: ICMP echo reply, id 24463, seq 1, length 64
14:12:19.128759 IP 192.168.3.9 > 192.168.2.3: ICMP echo request, id 24550, seq 1, length 64
14:12:19.128768 IP 192.168.2.3 > 192.168.3.9: ICMP echo reply, id 24550, seq 1, length 64
14:12:19.147214 IP 192.168.3.9 > 192.168.3.1: ICMP echo request, id 24571, seq 1, length 64
14:12:19.147223 IP 192.168.3.1 > 192.168.3.9: ICMP echo reply, id 24571, seq 1, length 64
14:12:24.138189 ARP, Request who-has 192.168.3.9 tell 192.168.3.1, length 28
14:12:24.138305 ARP, Reply 192.168.3.9 is-at f2:ed:b3:0b:b1:15 (oui Unknown), length 28
14:12:24.162882 IP 192.168.3.9 > 192.168.2.3: ICMP echo request, id 24660, seq 1, length 64
14:12:24.162891 IP 192.168.2.3 > 192.168.3.9: ICMP echo reply, id 24660, seq 1, length 64
14:12:24.179766 IP 192.168.3.9 > 192.168.3.1: ICMP echo request, id 24681, seq 1, length 64
14:12:24.179774 IP 192.168.3.1 > 192.168.3.9: ICMP echo reply, id 24681, seq 1, length 64

14:12:34.223218 IP 192.168.3.9 > 192.168.2.3: ICMP echo request, id 24887, seq 1, length 64
14:12:34.223230 IP 192.168.2.3 > 192.168.3.9: ICMP echo reply, id 24887, seq 1, length 64
14:12:34.242963 IP 192.168.3.9 > 192.168.3.1: ICMP echo request, id 24908, seq 1, length 64
14:12:34.242971 IP 192.168.3.1 > 192.168.3.9: ICMP echo reply, id 24908, seq 1, length 64
14:12:39.226505 ARP, Request who-has 192.168.3.1 tell 192.168.3.9, length 28
14:12:39.226512 ARP, Reply 192.168.3.1 is-at ee:29:cd:ea:ea:df (oui Unknown), length 28
14:12:39.256461 IP 192.168.3.9 > 192.168.2.3: ICMP echo request, id 24995, seq 1, length 64
14:12:39.256472 IP 192.168.2.3 > 192.168.3.9: ICMP echo reply, id 24995, seq 1, length 64
14:12:39.276201 IP 192.168.3.9 > 192.168.3.1: ICMP echo request, id 25016, seq 1, length 64
14:12:39.276209 IP 192.168.3.1 > 192.168.3.9: ICMP echo reply, id 25016, seq 1, length 64
14:12:44.291179 IP 192.168.3.9 > 192.168.2.3: ICMP echo request, id 25105, seq 1, length 64
14:12:44.291189 IP 192.168.2.3 > 192.168.3.9: ICMP echo reply, id 25105, seq 1, length 64
14:12:44.306583 IP 192.168.3.9 > 192.168.3.1: ICMP echo request, id 25126, seq 1, length 64
14:12:44.306592 IP 192.168.3.1 > 192.168.3.9: ICMP echo reply, id 25126, seq 1, length 64
14:12:49.306138 ARP, Request who-has 192.168.3.9 tell 192.168.3.1, length 28
14:12:49.306297 ARP, Reply 192.168.3.9 is-at f2:ed:b3:0b:b1:15 (oui Unknown), length 28
14:12:49.319343 IP 192.168.3.9 > 192.168.2.3: ICMP echo request, id 25213, seq 1, length 64
14:12:49.319351 IP 192.168.2.3 > 192.168.3.9: ICMP echo reply, id 25213, seq 1, length 64
14:12:49.335851 IP 192.168.3.9 > 192.168.3.1: ICMP echo request, id 25234, seq 1, length 64
14:12:49.335859 IP 192.168.3.1 > 192.168.3.9: ICMP echo reply, id 25234, seq 1, length 64
14:12:54.347223 IP 192.168.3.9 > 192.168.2.3: ICMP echo request, id 25323, seq 1, length 64
14:12:54.347233 IP 192.168.2.3 > 192.168.3.9: ICMP echo reply, id 25323, seq 1, length 64
14:12:54.364964 IP 192.168.3.9 > 192.168.3.1: ICMP echo request, id 25344, seq 1, length 64
14:12:54.364974 IP 192.168.3.1 > 192.168.3.9: ICMP echo reply, id 25344, seq 1, length 64

14:13:04.411051 IP 192.168.3.9 > 192.168.2.3: ICMP echo request, id 25550, seq 1, length 64
14:13:04.411060 IP 192.168.2.3 > 192.168.3.9: ICMP echo reply, id 25550, seq 1, length 64
14:13:04.429950 IP 192.168.3.9 > 192.168.3.1: ICMP echo request, id 25571, seq 1, length 64
14:13:04.429958 IP 192.168.3.1 > 192.168.3.9: ICMP echo reply, id 25571, seq 1, length 64
14:13:09.418489 ARP, Request who-has 192.168.3.1 tell 192.168.3.9, length 28
14:13:09.418497 ARP, Reply 192.168.3.1 is-at ee:29:cd:ea:ea:df (oui Unknown), length 28
14:13:09.447163 IP 192.168.3.9 > 192.168.2.3: ICMP echo request, id 25658, seq 1, length 64
14:13:09.447189 IP 192.168.2.3 > 192.168.3.9: ICMP echo reply, id 25658, seq 1, length 64
14:13:09.464370 IP 192.168.3.9 > 192.168.3.1: ICMP echo request, id 25679, seq 1, length 64
14:13:09.464379 IP 192.168.3.1 > 192.168.3.9: ICMP echo reply, id 25679, seq 1, length 64
14:13:14.458180 ARP, Request who-has 192.168.3.9 tell 192.168.3.1, length 28
14:13:14.458336 ARP, Reply 192.168.3.9 is-at f2:ed:b3:0b:b1:15 (oui Unknown), length 28
14:13:14.535585 IP 192.168.3.9 > 192.168.2.3: ICMP echo request, id 25811, seq 1, length 64
14:13:14.535596 IP 192.168.2.3 > 192.168.3.9: ICMP echo reply, id 25811, seq 1, length 64
14:13:14.743958 IP 192.168.3.9 > 192.168.3.1: ICMP echo request, id 25839, seq 1, length 64
14:13:14.743969 IP 192.168.3.1 > 192.168.3.9: ICMP echo reply, id 25839, seq 1, length 64
14:13:19.867748 IP 192.168.3.9 > 192.168.2.3: ICMP echo request, id 25968, seq 1, length 64
14:13:19.867757 IP 192.168.2.3 > 192.168.3.9: ICMP echo reply, id 25968, seq 1, length 64
14:13:19.885149 IP 192.168.3.9 > 192.168.3.1: ICMP echo request, id 25989, seq 1, length 64
14:13:19.885158 IP 192.168.3.1 > 192.168.3.9: ICMP echo reply, id 25989, seq 1, length 64
14:13:24.899093 IP 192.168.3.9 > 192.168.2.3: ICMP echo request, id 26076, seq 1, length 64
14:13:24.899102 IP 192.168.2.3 > 192.168.3.9: ICMP echo reply, id 26076, seq 1, length 64
14:13:24.918705 IP 192.168.3.9 > 192.168.3.1: ICMP echo request, id 26097, seq 1, length 64
14:13:24.918717 IP 192.168.3.1 > 192.168.3.9: ICMP echo reply, id 26097, seq 1, length 64

14:13:29.937238 IP 192.168.3.9 > 192.168.2.3: ICMP echo request, id 26192, seq 1, length 64
14:13:29.937249 IP 192.168.2.3 > 192.168.3.9: ICMP echo reply, id 26192, seq 1, length 64
14:13:29.956458 IP 192.168.3.9 > 192.168.3.1: ICMP echo request, id 26213, seq 1, length 64
14:13:29.956468 IP 192.168.3.1 > 192.168.3.9: ICMP echo reply, id 26213, seq 1, length 64
14:13:34.999392 IP 192.168.3.9 > 192.168.2.3: ICMP echo request, id 26352, seq 1, length 64
14:13:34.999403 IP 192.168.2.3 > 192.168.3.9: ICMP echo reply, id 26352, seq 1, length 64
14:13:35.268295 IP 192.168.3.9 > 192.168.3.1: ICMP echo request, id 26379, seq 1, length 64
14:13:35.268307 IP 192.168.3.1 > 192.168.3.9: ICMP echo reply, id 26379, seq 1, length 64
14:13:40.010121 ARP, Request who-has 192.168.3.9 tell 192.168.3.1, length 28
14:13:40.010184 ARP, Request who-has 192.168.3.1 tell 192.168.3.9, length 28
14:13:40.010190 ARP, Reply 192.168.3.1 is-at ee:29:cd:ea:ea:df (oui Unknown), length 28
14:13:40.010227 ARP, Reply 192.168.3.9 is-at f2:ed:b3:0b:b1:15 (oui Unknown), length 28
14:13:40.323507 IP 192.168.3.9 > 192.168.2.3: ICMP echo request, id 26503, seq 1, length 64
14:13:40.323516 IP 192.168.2.3 > 192.168.3.9: ICMP echo reply, id 26503, seq 1, length 64
14:13:40.339508 IP 192.168.3.9 > 192.168.3.1: ICMP echo request, id 26524, seq 1, length 64
14:13:40.339516 IP 192.168.3.1 > 192.168.3.9: ICMP echo reply, id 26524, seq 1, length 64
14:13:45.352236 IP 192.168.3.9 > 192.168.2.3: ICMP echo request, id 26611, seq 1, length 64
14:13:45.352257 IP 192.168.2.3 > 192.168.3.9: ICMP echo reply, id 26611, seq 1, length 64
14:13:45.370784 IP 192.168.3.9 > 192.168.3.1: ICMP echo request, id 26632, seq 1, length 64
14:13:45.370792 IP 192.168.3.1 > 192.168.3.9: ICMP echo reply, id 26632, seq 1, length 64
14:13:50.386673 IP 192.168.3.9 > 192.168.2.3: ICMP echo request, id 26721, seq 1, length 64
14:13:50.386684 IP 192.168.2.3 > 192.168.3.9: ICMP echo reply, id 26721, seq 1, length 64
14:13:50.403656 IP 192.168.3.9 > 192.168.3.1: ICMP echo request, id 26742, seq 1, length 64
14:13:50.403664 IP 192.168.3.1 > 192.168.3.9: ICMP echo reply, id 26742, seq 1, length 64
14:13:55.418674 IP 192.168.3.9 > 192.168.2.3: ICMP echo request, id 26829, seq 1, length 64
14:13:55.418683 IP 192.168.2.3 > 192.168.3.9: ICMP echo reply, id 26829, seq 1, length 64
14:13:55.438125 IP 192.168.3.9 > 192.168.3.1: ICMP echo request, id 26850, seq 1, length 64
14:13:55.438134 IP 192.168.3.1 > 192.168.3.9: ICMP echo reply, id 26850, seq 1, length 64

14:14:00.454596 IP 192.168.3.9 > 192.168.2.3: ICMP echo request, id 26948, seq 1, length 64
14:14:00.454605 IP 192.168.2.3 > 192.168.3.9: ICMP echo reply, id 26948, seq 1, length 64
14:14:00.472260 IP 192.168.3.9 > 192.168.3.1: ICMP echo request, id 26969, seq 1, length 64
14:14:00.472268 IP 192.168.3.1 > 192.168.3.9: ICMP echo reply, id 26969, seq 1, length 64
14:14:05.466115 ARP, Request who-has 192.168.3.9 tell 192.168.3.1, length 28
14:14:05.466252 ARP, Reply 192.168.3.9 is-at f2:ed:b3:0b:b1:15 (oui Unknown), length 28
14:14:05.487078 IP 192.168.3.9 > 192.168.2.3: ICMP echo request, id 27056, seq 1, length 64
14:14:05.487089 IP 192.168.2.3 > 192.168.3.9: ICMP echo reply, id 27056, seq 1, length 64
14:14:05.504265 IP 192.168.3.9 > 192.168.3.1: ICMP echo request, id 27077, seq 1, length 64
14:14:05.504273 IP 192.168.3.1 > 192.168.3.9: ICMP echo reply, id 27077, seq 1, length 64
14:14:10.490303 ARP, Request who-has 192.168.3.1 tell 192.168.3.9, length 28
14:14:10.490310 ARP, Reply 192.168.3.1 is-at ee:29:cd:ea:ea:df (oui Unknown), length 28
14:14:10.519942 IP 192.168.3.9 > 192.168.2.3: ICMP echo request, id 27166, seq 1, length 64
14:14:10.519966 IP 192.168.2.3 > 192.168.3.9: ICMP echo reply, id 27166, seq 1, length 64
14:14:10.538698 IP 192.168.3.9 > 192.168.3.1: ICMP echo request, id 27187, seq 1, length 64
14:14:10.538706 IP 192.168.3.1 > 192.168.3.9: ICMP echo reply, id 27187, seq 1, length 64
14:14:15.551145 IP 192.168.3.9 > 192.168.2.3: ICMP echo request, id 27274, seq 1, length 64
14:14:15.551154 IP 192.168.2.3 > 192.168.3.9: ICMP echo reply, id 27274, seq 1, length 64
14:14:15.568209 IP 192.168.3.9 > 192.168.3.1: ICMP echo request, id 27295, seq 1, length 64
14:14:15.568218 IP 192.168.3.1 > 192.168.3.9: ICMP echo reply, id 27295, seq 1, length 64
14:14:20.579244 IP 192.168.3.9 > 192.168.2.3: ICMP echo request, id 27384, seq 1, length 64
14:14:20.579253 IP 192.168.2.3 > 192.168.3.9: ICMP echo reply, id 27384, seq 1, length 64
14:14:20.595476 IP 192.168.3.9 > 192.168.3.1: ICMP echo request, id 27405, seq 1, length 64
14:14:20.595484 IP 192.168.3.1 > 192.168.3.9: ICMP echo reply, id 27405, seq 1, length 64
14:14:25.607490 IP 192.168.3.9 > 192.168.2.3: ICMP echo request, id 27492, seq 1, length 64
14:14:25.607499 IP 192.168.2.3 > 192.168.3.9: ICMP echo reply, id 27492, seq 1, length 64
14:14:25.625022 IP 192.168.3.9 > 192.168.3.1: ICMP echo request, id 27513, seq 1, length 64
14:14:25.625030 IP 192.168.3.1 > 192.168.3.9: ICMP echo reply, id 27513, seq 1, length 64

14:14:30.618325 ARP, Request who-has 192.168.3.9 tell 192.168.3.1, length 28
14:14:30.618491 ARP, Reply 192.168.3.9 is-at f2:ed:b3:0b:b1:15 (oui Unknown), length 28
14:14:30.641073 IP 192.168.3.9 > 192.168.2.3: ICMP echo request, id 27611, seq 1, length 64
14:14:30.641084 IP 192.168.2.3 > 192.168.3.9: ICMP echo reply, id 27611, seq 1, length 64
14:14:30.662827 IP 192.168.3.9 > 192.168.3.1: ICMP echo request, id 27632, seq 1, length 64
14:14:30.662836 IP 192.168.3.1 > 192.168.3.9: ICMP echo reply, id 27632, seq 1, length 64
14:14:35.679954 IP 192.168.3.9 > 192.168.2.3: ICMP echo request, id 27719, seq 1, length 64
14:14:35.679964 IP 192.168.2.3 > 192.168.3.9: ICMP echo reply, id 27719, seq 1, length 64
14:14:35.699998 IP 192.168.3.9 > 192.168.3.1: ICMP echo request, id 27740, seq 1, length 64
14:14:35.700007 IP 192.168.3.1 > 192.168.3.9: ICMP echo reply, id 27740, seq 1, length 64
14:14:40.682230 ARP, Request who-has 192.168.3.1 tell 192.168.3.9, length 28
14:14:40.682236 ARP, Reply 192.168.3.1 is-at ee:29:cd:ea:ea:df (oui Unknown), length 28
14:14:40.715781 IP 192.168.3.9 > 192.168.2.3: ICMP echo request, id 27829, seq 1, length 64
14:14:40.715790 IP 192.168.2.3 > 192.168.3.9: ICMP echo reply, id 27829, seq 1, length 64
14:14:40.732107 IP 192.168.3.9 > 192.168.3.1: ICMP echo request, id 27850, seq 1, length 64
14:14:40.732115 IP 192.168.3.1 > 192.168.3.9: ICMP echo reply, id 27850, seq 1, length 64
14:14:45.743392 IP 192.168.3.9 > 192.168.2.3: ICMP echo request, id 27937, seq 1, length 64
14:14:45.743401 IP 192.168.2.3 > 192.168.3.9: ICMP echo reply, id 27937, seq 1, length 64
14:14:45.759063 IP 192.168.3.9 > 192.168.3.1: ICMP echo request, id 27958, seq 1, length 64
14:14:45.759071 IP 192.168.3.1 > 192.168.3.9: ICMP echo reply, id 27958, seq 1, length 64

