01:24:36.540004 ARP, Request who-has 192.168.1.3 tell 192.168.1.1, length 28
01:24:36.543312 ARP, Request who-has 192.168.1.4 tell 192.168.1.1, length 28
01:24:36.546351 ARP, Request who-has 192.168.1.2 tell 192.168.1.1, length 28
01:24:36.592927 ARP, Request who-has 192.168.1.4 tell 192.168.1.3, length 28
01:24:36.595415 ARP, Request who-has 192.168.1.2 tell 192.168.1.3, length 28
01:24:36.608342 ARP, Request who-has 192.168.1.2 tell 192.168.1.4, length 28
01:24:36.624512 ARP, Request who-has 192.168.1.102 tell 192.168.1.1, length 28
01:24:36.624542 ARP, Reply 192.168.1.102 is-at 2a:13:71:f2:13:ec (oui Unknown), length 28
01:24:36.625352 IP 192.168.2.2 > 192.168.1.102: ICMP echo request, id 18614, seq 1, length 64
01:24:36.625361 IP 192.168.1.102 > 192.168.2.2: ICMP echo reply, id 18614, seq 1, length 64
01:24:36.628272 IP 192.168.2.3 > 192.168.1.102: ICMP echo request, id 18615, seq 1, length 64
01:24:36.628281 IP 192.168.1.102 > 192.168.2.3: ICMP echo reply, id 18615, seq 1, length 64
01:24:36.630896 IP 192.168.2.4 > 192.168.1.102: ICMP echo request, id 18616, seq 1, length 64
01:24:36.630905 IP 192.168.1.102 > 192.168.2.4: ICMP echo reply, id 18616, seq 1, length 64
01:24:41.374527 ARP, Request who-has 192.168.1.102 tell 192.168.1.101, length 28
01:24:41.374551 ARP, Reply 192.168.1.102 is-at 2a:13:71:f2:13:ec (oui Unknown), length 28
01:24:41.375785 IP 192.168.1.101 > 192.168.1.102: ICMP echo request, id 18637, seq 1, length 64
01:24:41.375797 IP 192.168.1.102 > 192.168.1.101: ICMP echo reply, id 18637, seq 1, length 64
01:24:41.639387 ARP, Request who-has 192.168.1.1 tell 192.168.1.102, length 28
01:24:41.646450 ARP, Reply 192.168.1.1 is-at 5a:9f:b7:fa:27:60 (oui Unknown), length 28
01:24:46.390362 ARP, Request who-has 192.168.1.101 tell 192.168.1.102, length 28
01:24:46.397510 ARP, Reply 192.168.1.101 is-at c6:09:93:a0:4e:62 (oui Unknown), length 28
01:24:46.432156 IP 192.168.1.101 > 192.168.1.102: ICMP echo request, id 18690, seq 1, length 64
01:24:46.432169 IP 192.168.1.102 > 192.168.1.101: ICMP echo reply, id 18690, seq 1, length 64
01:24:51.471810 IP 192.168.1.101 > 192.168.1.102: ICMP echo request, id 18747, seq 1, length 64
01:24:51.471857 IP 192.168.1.102 > 192.168.1.101: ICMP echo reply, id 18747, seq 1, length 64

01:24:56.676034 IP 192.168.1.101 > 192.168.1.102: ICMP echo request, id 18834, seq 1, length 64
01:24:56.676043 IP 192.168.1.102 > 192.168.1.101: ICMP echo reply, id 18834, seq 1, length 64
01:25:01.839710 IP 192.168.1.101 > 192.168.1.102: ICMP echo request, id 18925, seq 1, length 64
01:25:01.839717 IP 192.168.1.102 > 192.168.1.101: ICMP echo reply, id 18925, seq 1, length 64
01:25:06.956005 IP 192.168.1.101 > 192.168.1.102: ICMP echo request, id 18997, seq 1, length 64
01:25:06.956014 IP 192.168.1.102 > 192.168.1.101: ICMP echo reply, id 18997, seq 1, length 64
01:25:12.052924 IP 192.168.1.101 > 192.168.1.102: ICMP echo request, id 19055, seq 1, length 64
01:25:12.052937 IP 192.168.1.102 > 192.168.1.101: ICMP echo reply, id 19055, seq 1, length 64
01:25:17.332522 IP 192.168.1.101 > 192.168.1.102: ICMP echo request, id 19143, seq 1, length 64
01:25:17.332531 IP 192.168.1.102 > 192.168.1.101: ICMP echo reply, id 19143, seq 1, length 64
01:25:22.342809 ARP, Request who-has 192.168.1.102 tell 192.168.1.101, length 28
01:25:22.342817 ARP, Reply 192.168.1.102 is-at 2a:13:71:f2:13:ec (oui Unknown), length 28
01:25:22.587726 IP 192.168.1.101 > 192.168.1.102: ICMP echo request, id 19240, seq 1, length 64
01:25:22.587736 IP 192.168.1.102 > 192.168.1.101: ICMP echo reply, id 19240, seq 1, length 64

01:25:27.662357 IP 192.168.1.101 > 192.168.1.102: ICMP echo request, id 19300, seq 1, length 64
01:25:27.662367 IP 192.168.1.102 > 192.168.1.101: ICMP echo reply, id 19300, seq 1, length 64
01:25:32.662343 ARP, Request who-has 192.168.1.101 tell 192.168.1.102, length 28
01:25:32.662757 ARP, Reply 192.168.1.101 is-at c6:09:93:a0:4e:62 (oui Unknown), length 28
01:25:32.714780 IP 192.168.1.101 > 192.168.1.102: ICMP echo request, id 19357, seq 1, length 64
01:25:32.714790 IP 192.168.1.102 > 192.168.1.101: ICMP echo reply, id 19357, seq 1, length 64
01:25:37.746952 IP 192.168.1.101 > 192.168.1.102: ICMP echo request, id 19411, seq 1, length 64
01:25:37.746960 IP 192.168.1.102 > 192.168.1.101: ICMP echo reply, id 19411, seq 1, length 64
01:25:42.800641 IP 192.168.1.101 > 192.168.1.102: ICMP echo request, id 19467, seq 1, length 64
01:25:42.800655 IP 192.168.1.102 > 192.168.1.101: ICMP echo reply, id 19467, seq 1, length 64
01:25:47.834158 IP 192.168.1.101 > 192.168.1.102: ICMP echo request, id 19530, seq 1, length 64
01:25:47.834166 IP 192.168.1.102 > 192.168.1.101: ICMP echo reply, id 19530, seq 1, length 64
01:25:52.885283 IP 192.168.1.101 > 192.168.1.102: ICMP echo request, id 19586, seq 1, length 64
01:25:52.885295 IP 192.168.1.102 > 192.168.1.101: ICMP echo reply, id 19586, seq 1, length 64

01:25:57.950681 IP 192.168.1.101 > 192.168.1.102: ICMP echo request, id 19646, seq 1, length 64
01:25:57.950698 IP 192.168.1.102 > 192.168.1.101: ICMP echo reply, id 19646, seq 1, length 64
01:26:02.966420 ARP, Request who-has 192.168.1.102 tell 192.168.1.101, length 28
01:26:02.966431 ARP, Reply 192.168.1.102 is-at 2a:13:71:f2:13:ec (oui Unknown), length 28
01:26:03.092317 IP 192.168.1.101 > 192.168.1.102: ICMP echo request, id 19722, seq 1, length 64
01:26:03.092326 IP 192.168.1.102 > 192.168.1.101: ICMP echo reply, id 19722, seq 1, length 64
01:26:08.240468 IP 192.168.1.101 > 192.168.1.102: ICMP echo request, id 19816, seq 1, length 64
01:26:08.240479 IP 192.168.1.102 > 192.168.1.101: ICMP echo reply, id 19816, seq 1, length 64
01:26:13.275177 IP 192.168.1.101 > 192.168.1.102: ICMP echo request, id 19872, seq 1, length 64
01:26:13.275210 IP 192.168.1.102 > 192.168.1.101: ICMP echo reply, id 19872, seq 1, length 64
01:26:18.278898 ARP, Request who-has 192.168.1.101 tell 192.168.1.102, length 28
01:26:18.279314 ARP, Reply 192.168.1.101 is-at c6:09:93:a0:4e:62 (oui Unknown), length 28
01:26:18.323142 IP 192.168.1.101 > 192.168.1.102: ICMP echo request, id 19926, seq 1, length 64
01:26:18.323157 IP 192.168.1.102 > 192.168.1.101: ICMP echo reply, id 19926, seq 1, length 64
01:26:23.491512 IP 192.168.1.101 > 192.168.1.102: ICMP echo request, id 20002, seq 1, length 64
01:26:23.491540 IP 192.168.1.102 > 192.168.1.101: ICMP echo reply, id 20002, seq 1, length 64

01:26:28.645627 IP 192.168.1.101 > 192.168.1.102: ICMP echo request, id 20102, seq 1, length 64
01:26:28.645645 IP 192.168.1.102 > 192.168.1.101: ICMP echo reply, id 20102, seq 1, length 64
01:26:33.709149 IP 192.168.1.101 > 192.168.1.102: ICMP echo request, id 20158, seq 1, length 64
01:26:33.709161 IP 192.168.1.102 > 192.168.1.101: ICMP echo reply, id 20158, seq 1, length 64

