15:57:40.962868 ARP, Request who-has 12.10.5.3 tell 12.10.5.2, length 28
15:57:40.966890 ARP, Request who-has 12.10.5.1 tell 12.10.5.2, length 28
15:57:40.966905 ARP, Reply 12.10.5.1 is-at 4a:a7:e8:7b:06:20 (oui Unknown), length 28
15:57:40.967935 IP 12.10.5.2 > 192.168.1.2: ICMP echo request, id 2251, seq 1, length 64
15:57:42.968557 IP 12.10.5.2 > 192.168.1.3: ICMP echo request, id 2252, seq 1, length 64
15:57:44.970026 IP 12.10.5.2 > 192.168.2.2: ICMP echo request, id 2253, seq 1, length 64
15:57:45.941618 ARP, Request who-has 12.10.5.2 tell 12.10.5.101, length 28
15:57:46.972235 IP 12.10.5.2 > 192.168.2.3: ICMP echo request, id 2259, seq 1, length 64
15:57:48.973685 IP 12.10.5.2 > 192.168.3.2: ICMP echo request, id 2260, seq 1, length 64
15:57:50.974996 IP 12.10.5.2 > 192.168.3.3: ICMP echo request, id 2264, seq 1, length 64
15:57:52.976593 IP 12.10.5.2 > 192.168.4.2: ICMP echo request, id 2325, seq 1, length 64
15:57:54.978977 IP 12.10.5.2 > 192.168.5.2: ICMP echo request, id 2326, seq 1, length 64
15:57:56.984403 ARP, Request who-has 12.10.5.1 tell 12.10.5.3, length 28
15:57:56.984416 ARP, Reply 12.10.5.1 is-at 4a:a7:e8:7b:06:20 (oui Unknown), length 28
15:57:56.985498 IP 12.10.5.3 > 192.168.1.2: ICMP echo request, id 2333, seq 1, length 64
15:57:58.990034 IP 12.10.5.3 > 192.168.1.3: ICMP echo request, id 2334, seq 1, length 64

15:58:00.995748 IP 12.10.5.3 > 192.168.2.2: ICMP echo request, id 2353, seq 1, length 64
15:58:01.003444 ARP, Request who-has 12.10.5.3 tell 12.10.5.103, length 28
15:58:01.016118 ARP, Request who-has 12.10.5.2 tell 12.10.5.103, length 28
15:58:02.999055 IP 12.10.5.3 > 192.168.2.3: ICMP echo request, id 2418, seq 1, length 64
15:58:05.001978 IP 12.10.5.3 > 192.168.3.2: ICMP echo request, id 2428, seq 1, length 64
15:58:07.004191 IP 12.10.5.3 > 192.168.3.3: ICMP echo request, id 2451, seq 1, length 64
15:58:09.009026 IP 12.10.5.3 > 192.168.4.2: ICMP echo request, id 2452, seq 1, length 64
15:58:11.012162 IP 12.10.5.3 > 192.168.5.2: ICMP echo request, id 2459, seq 1, length 64











