











































08:48:52.289032 IP 192.168.7.2 > 192.168.6.2: ICMP echo request, id 18975, seq 1, length 64
08:48:52.289045 IP 192.168.6.2 > 192.168.7.2: ICMP echo reply, id 18975, seq 1, length 64
08:48:57.304155 IP 192.168.7.2 > 192.168.6.2: ICMP echo request, id 19002, seq 1, length 64
08:48:57.304162 IP 192.168.6.2 > 192.168.7.2: ICMP echo reply, id 19002, seq 1, length 64
08:49:02.320320 IP 192.168.7.2 > 192.168.6.2: ICMP echo request, id 19014, seq 1, length 64
08:49:02.320328 IP 192.168.6.2 > 192.168.7.2: ICMP echo reply, id 19014, seq 1, length 64
08:49:07.335616 IP 192.168.7.2 > 192.168.6.2: ICMP echo request, id 19028, seq 1, length 64
08:49:07.335627 IP 192.168.6.2 > 192.168.7.2: ICMP echo reply, id 19028, seq 1, length 64
08:49:12.354639 IP 192.168.7.2 > 192.168.6.2: ICMP echo request, id 19040, seq 1, length 64
08:49:12.354647 IP 192.168.6.2 > 192.168.7.2: ICMP echo reply, id 19040, seq 1, length 64

08:49:22.385845 IP 192.168.7.2 > 192.168.6.2: ICMP echo request, id 19073, seq 1, length 64
08:49:22.385854 IP 192.168.6.2 > 192.168.7.2: ICMP echo reply, id 19073, seq 1, length 64
08:49:27.396766 ARP, Request who-has 192.168.6.1 tell 192.168.6.2, length 28
08:49:27.397449 ARP, Reply 192.168.6.1 is-at 9a:8f:da:52:9c:27 (oui Unknown), length 28
08:49:27.405573 IP 192.168.7.2 > 192.168.6.2: ICMP echo request, id 19087, seq 1, length 64
08:49:27.405585 IP 192.168.6.2 > 192.168.7.2: ICMP echo reply, id 19087, seq 1, length 64
08:49:32.425257 IP 192.168.7.2 > 192.168.6.2: ICMP echo request, id 19113, seq 1, length 64
08:49:32.425268 IP 192.168.6.2 > 192.168.7.2: ICMP echo reply, id 19113, seq 1, length 64
08:49:37.431330 ARP, Request who-has 192.168.6.2 tell 192.168.6.1, length 28
08:49:37.431341 ARP, Reply 192.168.6.2 is-at c2:9b:da:0f:c4:35 (oui Unknown), length 28
08:49:37.442405 IP 192.168.7.2 > 192.168.6.2: ICMP echo request, id 19128, seq 1, length 64
08:49:37.442415 IP 192.168.6.2 > 192.168.7.2: ICMP echo reply, id 19128, seq 1, length 64
08:49:42.457354 IP 192.168.7.2 > 192.168.6.2: ICMP echo request, id 19153, seq 1, length 64
08:49:42.457363 IP 192.168.6.2 > 192.168.7.2: ICMP echo reply, id 19153, seq 1, length 64

08:49:52.494259 IP 192.168.7.2 > 192.168.6.2: ICMP echo request, id 19188, seq 1, length 64
08:49:52.494268 IP 192.168.6.2 > 192.168.7.2: ICMP echo reply, id 19188, seq 1, length 64
08:49:57.511659 IP 192.168.7.2 > 192.168.6.2: ICMP echo request, id 19207, seq 1, length 64
08:49:57.511668 IP 192.168.6.2 > 192.168.7.2: ICMP echo reply, id 19207, seq 1, length 64
08:50:02.527770 IP 192.168.7.2 > 192.168.6.2: ICMP echo request, id 19220, seq 1, length 64
08:50:02.527779 IP 192.168.6.2 > 192.168.7.2: ICMP echo reply, id 19220, seq 1, length 64
08:50:07.540599 ARP, Request who-has 192.168.6.1 tell 192.168.6.2, length 28
08:50:07.540781 ARP, Reply 192.168.6.1 is-at 9a:8f:da:52:9c:27 (oui Unknown), length 28
08:50:07.547846 IP 192.168.7.2 > 192.168.6.2: ICMP echo request, id 19235, seq 1, length 64
08:50:07.547855 IP 192.168.6.2 > 192.168.7.2: ICMP echo reply, id 19235, seq 1, length 64
08:50:12.567279 IP 192.168.7.2 > 192.168.6.2: ICMP echo request, id 19249, seq 1, length 64
08:50:12.567287 IP 192.168.6.2 > 192.168.7.2: ICMP echo reply, id 19249, seq 1, length 64

08:50:22.580884 ARP, Request who-has 192.168.6.2 tell 192.168.6.1, length 28
08:50:22.580892 ARP, Reply 192.168.6.2 is-at c2:9b:da:0f:c4:35 (oui Unknown), length 28
08:50:22.596381 IP 192.168.7.2 > 192.168.6.2: ICMP echo request, id 19291, seq 1, length 64
08:50:22.596389 IP 192.168.6.2 > 192.168.7.2: ICMP echo reply, id 19291, seq 1, length 64
08:50:27.610453 IP 192.168.7.2 > 192.168.6.2: ICMP echo request, id 19317, seq 1, length 64
08:50:27.610461 IP 192.168.6.2 > 192.168.7.2: ICMP echo reply, id 19317, seq 1, length 64
08:50:32.626012 IP 192.168.7.2 > 192.168.6.2: ICMP echo request, id 19329, seq 1, length 64
08:50:32.626019 IP 192.168.6.2 > 192.168.7.2: ICMP echo reply, id 19329, seq 1, length 64


08:50:59.710164 IP 192.168.6.2 > 192.168.7.2: ICMP echo request, id 20344, seq 1, length 64
08:50:59.710172 IP 192.168.7.2 > 192.168.6.2: ICMP echo reply, id 20344, seq 1, length 64
08:51:04.724917 IP 192.168.6.2 > 192.168.7.2: ICMP echo request, id 20371, seq 1, length 64
08:51:04.724926 IP 192.168.7.2 > 192.168.6.2: ICMP echo reply, id 20371, seq 1, length 64
08:51:09.743732 IP 192.168.6.2 > 192.168.7.2: ICMP echo request, id 20383, seq 1, length 64
08:51:09.743741 IP 192.168.7.2 > 192.168.6.2: ICMP echo reply, id 20383, seq 1, length 64
08:51:14.760482 IP 192.168.6.2 > 192.168.7.2: ICMP echo request, id 20409, seq 1, length 64
08:51:14.760488 IP 192.168.7.2 > 192.168.6.2: ICMP echo reply, id 20409, seq 1, length 64
08:51:19.773831 IP 192.168.6.2 > 192.168.7.2: ICMP echo request, id 20421, seq 1, length 64
08:51:19.773838 IP 192.168.7.2 > 192.168.6.2: ICMP echo reply, id 20421, seq 1, length 64

08:51:29.810698 IP 192.168.6.2 > 192.168.7.2: ICMP echo request, id 20454, seq 1, length 64
08:51:29.810707 IP 192.168.7.2 > 192.168.6.2: ICMP echo reply, id 20454, seq 1, length 64
08:51:34.830469 IP 192.168.6.2 > 192.168.7.2: ICMP echo request, id 20469, seq 1, length 64
08:51:34.830479 IP 192.168.7.2 > 192.168.6.2: ICMP echo reply, id 20469, seq 1, length 64
08:51:39.846099 ARP, Request who-has 192.168.7.2 tell 192.168.7.1, length 28
08:51:39.846107 ARP, Reply 192.168.7.2 is-at 76:58:79:ff:68:37 (oui Unknown), length 28
08:51:39.850101 IP 192.168.6.2 > 192.168.7.2: ICMP echo request, id 20482, seq 1, length 64
08:51:39.850109 IP 192.168.7.2 > 192.168.6.2: ICMP echo reply, id 20482, seq 1, length 64
08:51:44.868678 IP 192.168.6.2 > 192.168.7.2: ICMP echo request, id 20497, seq 1, length 64
08:51:44.868686 IP 192.168.7.2 > 192.168.6.2: ICMP echo reply, id 20497, seq 1, length 64
08:51:49.876917 ARP, Request who-has 192.168.7.1 tell 192.168.7.2, length 28
08:51:49.877061 ARP, Reply 192.168.7.1 is-at 12:64:e1:81:5c:74 (oui Unknown), length 28
08:51:49.886179 IP 192.168.6.2 > 192.168.7.2: ICMP echo request, id 20521, seq 1, length 64
08:51:49.886185 IP 192.168.7.2 > 192.168.6.2: ICMP echo reply, id 20521, seq 1, length 64

08:51:59.930076 IP 192.168.6.2 > 192.168.7.2: ICMP echo request, id 20565, seq 1, length 64
08:51:59.930085 IP 192.168.7.2 > 192.168.6.2: ICMP echo reply, id 20565, seq 1, length 64
08:52:04.950068 IP 192.168.6.2 > 192.168.7.2: ICMP echo request, id 20579, seq 1, length 64
08:52:04.950078 IP 192.168.7.2 > 192.168.6.2: ICMP echo reply, id 20579, seq 1, length 64
08:52:09.970440 IP 192.168.6.2 > 192.168.7.2: ICMP echo request, id 20592, seq 1, length 64
08:52:09.970447 IP 192.168.7.2 > 192.168.6.2: ICMP echo reply, id 20592, seq 1, length 64
08:52:14.980849 ARP, Request who-has 192.168.7.1 tell 192.168.7.2, length 28
08:52:14.985277 ARP, Reply 192.168.7.1 is-at 12:64:e1:81:5c:74 (oui Unknown), length 28
08:52:15.007641 IP 192.168.6.2 > 192.168.7.2: ICMP echo request, id 20606, seq 1, length 64
08:52:15.007649 IP 192.168.7.2 > 192.168.6.2: ICMP echo reply, id 20606, seq 1, length 64
08:52:20.023924 IP 192.168.6.2 > 192.168.7.2: ICMP echo request, id 20618, seq 1, length 64
08:52:20.023931 IP 192.168.7.2 > 192.168.6.2: ICMP echo reply, id 20618, seq 1, length 64

08:52:30.056374 IP 192.168.6.2 > 192.168.7.2: ICMP echo request, id 20650, seq 1, length 64
08:52:30.056381 IP 192.168.7.2 > 192.168.6.2: ICMP echo reply, id 20650, seq 1, length 64
08:52:35.080093 IP 192.168.6.2 > 192.168.7.2: ICMP echo request, id 20676, seq 1, length 64
08:52:35.080108 IP 192.168.7.2 > 192.168.6.2: ICMP echo reply, id 20676, seq 1, length 64
08:52:40.084621 ARP, Request who-has 192.168.7.1 tell 192.168.7.2, length 28
08:52:40.084750 ARP, Reply 192.168.7.1 is-at 12:64:e1:81:5c:74 (oui Unknown), length 28
08:52:40.099289 IP 192.168.6.2 > 192.168.7.2: ICMP echo request, id 20688, seq 1, length 64
08:52:40.099296 IP 192.168.7.2 > 192.168.6.2: ICMP echo reply, id 20688, seq 1, length 64
08:52:45.113468 IP 192.168.6.2 > 192.168.7.2: ICMP echo request, id 20714, seq 1, length 64
08:52:45.113474 IP 192.168.7.2 > 192.168.6.2: ICMP echo reply, id 20714, seq 1, length 64
08:52:50.128928 IP 192.168.6.2 > 192.168.7.2: ICMP echo request, id 20726, seq 1, length 64
08:52:50.128935 IP 192.168.7.2 > 192.168.6.2: ICMP echo reply, id 20726, seq 1, length 64

08:53:00.164439 IP 192.168.6.2 > 192.168.7.2: ICMP echo request, id 20755, seq 1, length 64
08:53:00.164446 IP 192.168.7.2 > 192.168.6.2: ICMP echo reply, id 20755, seq 1, length 64
08:53:05.172836 ARP, Request who-has 192.168.7.1 tell 192.168.7.2, length 28
08:53:05.172979 ARP, Reply 192.168.7.1 is-at 12:64:e1:81:5c:74 (oui Unknown), length 28
08:53:05.182548 IP 192.168.6.2 > 192.168.7.2: ICMP echo request, id 20770, seq 1, length 64
08:53:05.182557 IP 192.168.7.2 > 192.168.6.2: ICMP echo reply, id 20770, seq 1, length 64
08:53:10.197622 ARP, Request who-has 192.168.7.2 tell 192.168.7.1, length 28
08:53:10.197630 ARP, Reply 192.168.7.2 is-at 76:58:79:ff:68:37 (oui Unknown), length 28
08:53:10.202069 IP 192.168.6.2 > 192.168.7.2: ICMP echo request, id 20783, seq 1, length 64
08:53:10.202075 IP 192.168.7.2 > 192.168.6.2: ICMP echo reply, id 20783, seq 1, length 64
08:53:15.218685 IP 192.168.6.2 > 192.168.7.2: ICMP echo request, id 20799, seq 1, length 64
08:53:15.218692 IP 192.168.7.2 > 192.168.6.2: ICMP echo reply, id 20799, seq 1, length 64
08:53:20.236385 IP 192.168.6.2 > 192.168.7.2: ICMP echo request, id 20823, seq 1, length 64
08:53:20.236391 IP 192.168.7.2 > 192.168.6.2: ICMP echo reply, id 20823, seq 1, length 64

08:53:30.260475 ARP, Request who-has 192.168.7.1 tell 192.168.7.2, length 28
08:53:30.260665 ARP, Reply 192.168.7.1 is-at 12:64:e1:81:5c:74 (oui Unknown), length 28
08:53:30.266883 IP 192.168.6.2 > 192.168.7.2: ICMP echo request, id 20866, seq 1, length 64
08:53:30.266893 IP 192.168.7.2 > 192.168.6.2: ICMP echo reply, id 20866, seq 1, length 64
08:53:35.281588 IP 192.168.6.2 > 192.168.7.2: ICMP echo request, id 20880, seq 1, length 64
08:53:35.281595 IP 192.168.7.2 > 192.168.6.2: ICMP echo reply, id 20880, seq 1, length 64
08:53:40.298097 IP 192.168.6.2 > 192.168.7.2: ICMP echo request, id 20892, seq 1, length 64
08:53:40.298104 IP 192.168.7.2 > 192.168.6.2: ICMP echo reply, id 20892, seq 1, length 64
08:53:45.315349 IP 192.168.6.2 > 192.168.7.2: ICMP echo request, id 20906, seq 1, length 64
08:53:45.315358 IP 192.168.7.2 > 192.168.6.2: ICMP echo reply, id 20906, seq 1, length 64
08:53:50.331535 IP 192.168.6.2 > 192.168.7.2: ICMP echo request, id 20918, seq 1, length 64
08:53:50.331546 IP 192.168.7.2 > 192.168.6.2: ICMP echo reply, id 20918, seq 1, length 64

08:54:00.367839 IP 192.168.6.2 > 192.168.7.2: ICMP echo request, id 20947, seq 1, length 64
08:54:00.367845 IP 192.168.7.2 > 192.168.6.2: ICMP echo reply, id 20947, seq 1, length 64
08:54:05.380235 IP 192.168.6.2 > 192.168.7.2: ICMP echo request, id 20975, seq 1, length 64
08:54:05.380242 IP 192.168.7.2 > 192.168.6.2: ICMP echo reply, id 20975, seq 1, length 64
08:54:10.397908 IP 192.168.6.2 > 192.168.7.2: ICMP echo request, id 20987, seq 1, length 64
08:54:10.397931 IP 192.168.7.2 > 192.168.6.2: ICMP echo reply, id 20987, seq 1, length 64
08:54:15.418995 IP 192.168.6.2 > 192.168.7.2: ICMP echo request, id 21014, seq 1, length 64
08:54:15.419003 IP 192.168.7.2 > 192.168.6.2: ICMP echo reply, id 21014, seq 1, length 64
08:54:20.435329 IP 192.168.6.2 > 192.168.7.2: ICMP echo request, id 21029, seq 1, length 64
08:54:20.435336 IP 192.168.7.2 > 192.168.6.2: ICMP echo reply, id 21029, seq 1, length 64

08:54:30.452566 ARP, Request who-has 192.168.7.1 tell 192.168.7.2, length 28
08:54:30.452694 ARP, Reply 192.168.7.1 is-at 12:64:e1:81:5c:74 (oui Unknown), length 28
08:54:30.467319 IP 192.168.6.2 > 192.168.7.2: ICMP echo request, id 21065, seq 1, length 64
08:54:30.467327 IP 192.168.7.2 > 192.168.6.2: ICMP echo reply, id 21065, seq 1, length 64
08:54:35.485170 IP 192.168.6.2 > 192.168.7.2: ICMP echo request, id 21079, seq 1, length 64
08:54:35.485176 IP 192.168.7.2 > 192.168.6.2: ICMP echo reply, id 21079, seq 1, length 64
08:54:40.499720 IP 192.168.6.2 > 192.168.7.2: ICMP echo request, id 21091, seq 1, length 64
08:54:40.499728 IP 192.168.7.2 > 192.168.6.2: ICMP echo reply, id 21091, seq 1, length 64
08:54:40.500576 ARP, Request who-has 192.168.7.2 tell 192.168.7.1, length 28
08:54:40.500581 ARP, Reply 192.168.7.2 is-at 76:58:79:ff:68:37 (oui Unknown), length 28
08:54:45.513890 IP 192.168.6.2 > 192.168.7.2: ICMP echo request, id 21105, seq 1, length 64
08:54:45.513897 IP 192.168.7.2 > 192.168.6.2: ICMP echo reply, id 21105, seq 1, length 64
08:54:50.529262 IP 192.168.6.2 > 192.168.7.2: ICMP echo request, id 21130, seq 1, length 64
08:54:50.529268 IP 192.168.7.2 > 192.168.6.2: ICMP echo reply, id 21130, seq 1, length 64

08:55:00.558306 IP 192.168.6.2 > 192.168.7.2: ICMP echo request, id 21173, seq 1, length 64
08:55:00.558312 IP 192.168.7.2 > 192.168.6.2: ICMP echo reply, id 21173, seq 1, length 64
08:55:05.572560 ARP, Request who-has 192.168.7.1 tell 192.168.7.2, length 28
08:55:05.572637 ARP, Request who-has 192.168.7.2 tell 192.168.7.1, length 28
08:55:05.572642 ARP, Reply 192.168.7.2 is-at 76:58:79:ff:68:37 (oui Unknown), length 28
08:55:05.572679 ARP, Reply 192.168.7.1 is-at 12:64:e1:81:5c:74 (oui Unknown), length 28
08:55:05.574293 IP 192.168.6.2 > 192.168.7.2: ICMP echo request, id 21187, seq 1, length 64
08:55:05.574297 IP 192.168.7.2 > 192.168.6.2: ICMP echo reply, id 21187, seq 1, length 64
08:55:10.590873 IP 192.168.6.2 > 192.168.7.2: ICMP echo request, id 21199, seq 1, length 64
08:55:10.590879 IP 192.168.7.2 > 192.168.6.2: ICMP echo reply, id 21199, seq 1, length 64
08:55:15.605692 IP 192.168.6.2 > 192.168.7.2: ICMP echo request, id 21215, seq 1, length 64
08:55:15.605700 IP 192.168.7.2 > 192.168.6.2: ICMP echo reply, id 21215, seq 1, length 64
08:55:20.622326 IP 192.168.6.2 > 192.168.7.2: ICMP echo request, id 21227, seq 1, length 64
08:55:20.622333 IP 192.168.7.2 > 192.168.6.2: ICMP echo reply, id 21227, seq 1, length 64

08:55:30.644700 ARP, Request who-has 192.168.7.2 tell 192.168.7.1, length 28
08:55:30.644720 ARP, Reply 192.168.7.2 is-at 76:58:79:ff:68:37 (oui Unknown), length 28
08:55:30.653522 IP 192.168.6.2 > 192.168.7.2: ICMP echo request, id 21256, seq 1, length 64
08:55:30.653529 IP 192.168.7.2 > 192.168.6.2: ICMP echo reply, id 21256, seq 1, length 64
08:55:35.671440 IP 192.168.6.2 > 192.168.7.2: ICMP echo request, id 21282, seq 1, length 64
08:55:35.671448 IP 192.168.7.2 > 192.168.6.2: ICMP echo reply, id 21282, seq 1, length 64
08:55:40.676596 ARP, Request who-has 192.168.7.1 tell 192.168.7.2, length 28
08:55:40.676765 ARP, Reply 192.168.7.1 is-at 12:64:e1:81:5c:74 (oui Unknown), length 28
08:55:40.685963 IP 192.168.6.2 > 192.168.7.2: ICMP echo request, id 21296, seq 1, length 64
08:55:40.685970 IP 192.168.7.2 > 192.168.6.2: ICMP echo reply, id 21296, seq 1, length 64
08:55:45.699299 IP 192.168.6.2 > 192.168.7.2: ICMP echo request, id 21322, seq 1, length 64
08:55:45.699307 IP 192.168.7.2 > 192.168.6.2: ICMP echo reply, id 21322, seq 1, length 64
08:55:50.715246 IP 192.168.6.2 > 192.168.7.2: ICMP echo request, id 21336, seq 1, length 64
08:55:50.715253 IP 192.168.7.2 > 192.168.6.2: ICMP echo reply, id 21336, seq 1, length 64

08:56:00.748850 IP 192.168.6.2 > 192.168.7.2: ICMP echo request, id 21367, seq 1, length 64
08:56:00.748858 IP 192.168.7.2 > 192.168.6.2: ICMP echo reply, id 21367, seq 1, length 64
08:56:05.764734 IP 192.168.6.2 > 192.168.7.2: ICMP echo request, id 21381, seq 1, length 64
08:56:05.764741 IP 192.168.7.2 > 192.168.6.2: ICMP echo reply, id 21381, seq 1, length 64
08:56:10.779392 IP 192.168.6.2 > 192.168.7.2: ICMP echo request, id 21393, seq 1, length 64
08:56:10.779398 IP 192.168.7.2 > 192.168.6.2: ICMP echo reply, id 21393, seq 1, length 64
08:56:15.780677 ARP, Request who-has 192.168.7.1 tell 192.168.7.2, length 28
08:56:15.780845 ARP, Reply 192.168.7.1 is-at 12:64:e1:81:5c:74 (oui Unknown), length 28
08:56:15.793977 IP 192.168.6.2 > 192.168.7.2: ICMP echo request, id 21407, seq 1, length 64
08:56:15.793983 IP 192.168.7.2 > 192.168.6.2: ICMP echo reply, id 21407, seq 1, length 64
08:56:20.804698 ARP, Request who-has 192.168.7.2 tell 192.168.7.1, length 28
08:56:20.804706 ARP, Reply 192.168.7.2 is-at 76:58:79:ff:68:37 (oui Unknown), length 28
08:56:20.809964 IP 192.168.6.2 > 192.168.7.2: ICMP echo request, id 21431, seq 1, length 64
08:56:20.809970 IP 192.168.7.2 > 192.168.6.2: ICMP echo reply, id 21431, seq 1, length 64

08:56:30.842308 IP 192.168.6.2 > 192.168.7.2: ICMP echo request, id 21472, seq 1, length 64
08:56:30.842315 IP 192.168.7.2 > 192.168.6.2: ICMP echo reply, id 21472, seq 1, length 64
08:56:35.854513 IP 192.168.6.2 > 192.168.7.2: ICMP echo request, id 21486, seq 1, length 64
08:56:35.854521 IP 192.168.7.2 > 192.168.6.2: ICMP echo reply, id 21486, seq 1, length 64
08:56:40.871866 IP 192.168.6.2 > 192.168.7.2: ICMP echo request, id 21498, seq 1, length 64
08:56:40.871872 IP 192.168.7.2 > 192.168.6.2: ICMP echo reply, id 21498, seq 1, length 64
08:56:45.876793 ARP, Request who-has 192.168.7.2 tell 192.168.7.1, length 28
08:56:45.876798 ARP, Reply 192.168.7.2 is-at 76:58:79:ff:68:37 (oui Unknown), length 28






09:10:36.867960 ARP, Request who-has 192.168.6.2 tell 192.168.6.1, length 28
09:10:36.867968 ARP, Reply 192.168.6.2 is-at 42:8b:84:65:92:aa (oui Unknown), length 28
09:10:37.444875 IP 192.168.6.2.40350 > 192.168.178.1.domain: 33517+ PTR? 2.6.168.192.in-addr.arpa. (42)
09:10:37.446041 IP 192.168.6.1 > 192.168.6.2: ICMP net 192.168.178.1 unreachable, length 78
09:10:37.467204 IP 192.168.7.2 > 192.168.6.2: ICMP echo request, id 3734, seq 1, length 64
09:10:37.467215 IP 192.168.6.2 > 192.168.7.2: ICMP echo reply, id 3734, seq 1, length 64

09:11:22.483975 ARP, Reply 192.168.6.1 is-at 0e:2c:f2:d4:cf:8d (oui Unknown), length 28
09:11:23.483571 IP 192.168.6.2.45853 > 192.168.178.1.domain: 58070+ PTR? 1.6.168.192.in-addr.arpa. (42)
09:11:23.484794 IP 192.168.6.1 > 192.168.6.2: ICMP net 192.168.178.1 unreachable, length 78





10:47:01.608188 ARP, Request who-has 192.168.6.3 tell 192.168.6.1, length 28
10:47:01.608196 ARP, Reply 192.168.6.3 is-at 16:01:f7:83:d4:11 (oui Unknown), length 28
10:47:02.206218 IP 192.168.7.2 > 192.168.7.3: ICMP echo request, id 7661, seq 1, length 64
10:47:02.206225 IP 192.168.7.3 > 192.168.7.2: ICMP echo reply, id 7661, seq 1, length 64
10:47:02.128310 IP 192.168.6.3.34657 > 192.168.178.1.domain: 63113+ PTR? 3.6.168.192.in-addr.arpa. (42)
10:47:02.128931 IP 192.168.6.1 > 192.168.6.3: ICMP net 192.168.178.1 unreachable, length 78
10:47:03.160287 IP 192.168.7.3.35711 > 192.168.178.1.domain: 21867+ PTR? 3.7.168.192.in-addr.arpa. (42)
10:47:02.151319 ARP, Request who-has 192.168.6.2 tell 192.168.6.3, length 28
10:47:02.151937 ARP, Reply 192.168.6.2 is-at 96:bf:19:cd:dc:fa (oui Unknown), length 28
10:47:03.161578 IP 192.168.7.1 > 192.168.7.3: ICMP net 192.168.178.1 unreachable, length 78

10:47:02.211152 IP 192.168.7.2 > 192.168.6.3: ICMP echo request, id 7667, seq 1, length 64
10:47:02.211159 IP 192.168.6.3 > 192.168.7.2: ICMP echo reply, id 7667, seq 1, length 64

10:47:52.462067 IP 192.168.7.2 > 192.168.7.3: ICMP echo request, id 7950, seq 1, length 64
10:47:52.462076 IP 192.168.7.3 > 192.168.7.2: ICMP echo reply, id 7950, seq 1, length 64

10:47:57.497462 IP 192.168.7.2 > 192.168.6.3: ICMP echo request, id 7980, seq 1, length 64
10:47:57.497470 IP 192.168.6.3 > 192.168.7.2: ICMP echo reply, id 7980, seq 1, length 64

10:48:38.696491 ARP, Request who-has 192.168.6.3 tell 192.168.6.1, length 28
10:48:38.696498 ARP, Reply 192.168.6.3 is-at 22:9c:f2:16:92:fe (oui Unknown), length 28
10:48:39.261682 IP 192.168.6.2 > 192.168.7.3: ICMP echo request, id 10133, seq 1, length 64
10:48:39.261689 IP 192.168.7.3 > 192.168.6.2: ICMP echo reply, id 10133, seq 1, length 64
10:48:39.207394 ARP, Request who-has 192.168.6.2 tell 192.168.6.3, length 28
10:48:39.208793 ARP, Reply 192.168.6.2 is-at 96:d5:6e:81:93:cd (oui Unknown), length 28

10:48:40.235848 IP 192.168.7.3.60153 > 192.168.178.1.domain: 12973+ PTR? 3.7.168.192.in-addr.arpa. (42)
10:48:40.237075 IP 192.168.7.1 > 192.168.7.3: ICMP net 192.168.178.1 unreachable, length 78

10:49:14.426361 IP 192.168.6.2 > 192.168.6.3: ICMP echo request, id 10301, seq 1, length 64
10:49:14.426369 IP 192.168.6.3 > 192.168.6.2: ICMP echo reply, id 10301, seq 1, length 64

11:32:09.064249 ARP, Request who-has 192.168.6.3 tell 192.168.6.1, length 28
11:32:09.064255 ARP, Reply 192.168.6.3 is-at b2:e5:f6:65:cb:2d (oui Unknown), length 28
11:32:09.898733 IP 192.168.6.2 > 192.168.7.3: ICMP echo request, id 14177, seq 1, length 64
11:32:09.898741 IP 192.168.7.3 > 192.168.6.2: ICMP echo reply, id 14177, seq 1, length 64
11:32:09.847464 ARP, Request who-has 192.168.6.2 tell 192.168.6.3, length 28
11:32:09.848116 ARP, Reply 192.168.6.2 is-at 02:1c:96:7f:bc:6f (oui Unknown), length 28

11:32:10.860288 IP 192.168.7.3.59359 > 192.168.178.1.domain: 12344+ PTR? 3.7.168.192.in-addr.arpa. (42)
11:32:10.861281 IP 192.168.7.1 > 192.168.7.3: ICMP net 192.168.178.1 unreachable, length 78

11:32:45.063356 ARP, Request who-has 192.168.6.2 tell 192.168.6.3, length 28
11:32:45.063466 ARP, Reply 192.168.6.2 is-at 02:1c:96:7f:bc:6f (oui Unknown), length 28
11:32:45.072963 IP 192.168.6.2 > 192.168.6.3: ICMP echo request, id 14359, seq 1, length 64
11:32:45.072970 IP 192.168.6.3 > 192.168.6.2: ICMP echo reply, id 14359, seq 1, length 64
11:32:45.884128 IP 192.168.6.3.34543 > 192.168.178.1.domain: 40614+ PTR? 2.6.168.192.in-addr.arpa. (42)

11:32:45.885185 IP 192.168.6.1 > 192.168.6.3: ICMP net 192.168.178.1 unreachable, length 78

11:34:54.696124 ARP, Request who-has 192.168.6.3 tell 192.168.6.1, length 28
11:34:54.696130 ARP, Reply 192.168.6.3 is-at 0e:a1:1e:f2:60:d4 (oui Unknown), length 28
11:34:55.540750 IP 192.168.6.2 > 192.168.7.3: ICMP echo request, id 16907, seq 1, length 64
11:34:55.540757 IP 192.168.7.3 > 192.168.6.2: ICMP echo reply, id 16907, seq 1, length 64
11:34:55.495808 ARP, Request who-has 192.168.6.2 tell 192.168.6.3, length 28

11:34:56.499897 IP 192.168.7.3.38667 > 192.168.178.1.domain: 63203+ PTR? 3.7.168.192.in-addr.arpa. (42)
11:34:56.501780 IP 192.168.7.1 > 192.168.7.3: ICMP net 192.168.178.1 unreachable, length 78

11:35:30.679315 ARP, Request who-has 192.168.6.2 tell 192.168.6.3, length 28
11:35:30.679480 ARP, Reply 192.168.6.2 is-at 16:3b:a8:b4:0f:95 (oui Unknown), length 28
11:35:30.694587 IP 192.168.6.2 > 192.168.6.3: ICMP echo request, id 17106, seq 1, length 64
11:35:30.694594 IP 192.168.6.3 > 192.168.6.2: ICMP echo reply, id 17106, seq 1, length 64
11:35:31.516012 IP 192.168.6.3.50049 > 192.168.178.1.domain: 53213+ PTR? 2.6.168.192.in-addr.arpa. (42)

11:35:31.516998 IP 192.168.6.1 > 192.168.6.3: ICMP net 192.168.178.1 unreachable, length 78

11:48:54.286887 ARP, Request who-has 192.168.6.3 tell 192.168.6.2, length 28
11:48:54.286899 ARP, Reply 192.168.6.3 is-at ee:3f:88:c2:98:7e (oui Unknown), length 28
11:48:54.287899 IP 192.168.6.2 > 192.168.6.3: ICMP echo request, id 29405, seq 1, length 64
11:48:54.287908 IP 192.168.6.3 > 192.168.6.2: ICMP echo reply, id 29405, seq 1, length 64
11:48:55.284162 ARP, Request who-has 192.168.6.1 tell 192.168.6.3, length 28
11:48:55.285152 ARP, Reply 192.168.6.1 is-at de:c1:08:cc:d6:bf (oui Unknown), length 28
11:48:55.285155 IP 192.168.6.3.59692 > 192.168.178.1.domain: 47181+ PTR? 3.6.168.192.in-addr.arpa. (42)
11:48:55.286067 IP 192.168.6.1 > 192.168.6.3: ICMP net 192.168.178.1 unreachable, length 78

11:51:08.308957 ARP, Request who-has 192.168.6.3 tell 192.168.6.2, length 28
11:51:08.308969 ARP, Reply 192.168.6.3 is-at de:a0:57:49:42:d3 (oui Unknown), length 28
11:51:08.309803 IP 192.168.6.2 > 192.168.6.3: ICMP echo request, id 31457, seq 1, length 64
11:51:08.309809 IP 192.168.6.3 > 192.168.6.2: ICMP echo reply, id 31457, seq 1, length 64
11:51:09.299984 ARP, Request who-has 192.168.6.1 tell 192.168.6.3, length 28
11:51:09.300958 ARP, Reply 192.168.6.1 is-at ce:0e:66:c5:1b:f8 (oui Unknown), length 28
11:51:09.300961 IP 192.168.6.3.60275 > 192.168.178.1.domain: 4025+ PTR? 3.6.168.192.in-addr.arpa. (42)
11:51:09.301813 IP 192.168.6.1 > 192.168.6.3: ICMP net 192.168.178.1 unreachable, length 78

11:51:54.459648 IP 192.168.6.2 > 192.168.6.3: ICMP echo request, id 31625, seq 1, length 64
11:51:54.459657 IP 192.168.6.3 > 192.168.6.2: ICMP echo reply, id 31625, seq 1, length 64
11:51:55.332332 IP 192.168.6.3.40056 > 192.168.178.1.domain: 44158+ PTR? 3.6.168.192.in-addr.arpa. (42)
11:51:55.333411 IP 192.168.6.1 > 192.168.6.3: ICMP net 192.168.178.1 unreachable, length 78

12:18:48.056350 ARP, Request who-has 192.168.6.3 tell 192.168.6.2, length 28
12:18:48.056361 ARP, Reply 192.168.6.3 is-at ba:d3:fe:47:af:a5 (oui Unknown), length 28
12:18:48.057214 IP 192.168.6.2 > 192.168.6.3: ICMP echo request, id 16128, seq 1, length 64
12:18:48.057221 IP 192.168.6.3 > 192.168.6.2: ICMP echo reply, id 16128, seq 1, length 64
12:18:48.060283 ARP, Request who-has 192.168.6.1 tell 192.168.6.3, length 28
12:18:48.061255 ARP, Reply 192.168.6.1 is-at 52:7a:24:38:fd:b7 (oui Unknown), length 28
12:18:48.061259 IP 192.168.6.3.36251 > 192.168.178.1.domain: 16205+ PTR? 3.6.168.192.in-addr.arpa. (42)
12:18:48.062465 IP 192.168.6.1 > 192.168.6.3: ICMP net 192.168.178.1 unreachable, length 78



