15:57:33.577625 ARP, Request who-has 192.168.3.1 tell 192.168.3.103, length 28
15:57:33.577648 ARP, Reply 192.168.3.1 is-at f6:49:cb:82:00:b1 (oui Unknown), length 28


15:58:49.109217 ARP, Request who-has 192.168.3.2 tell 192.168.3.1, length 28
15:58:49.111021 ARP, Reply 192.168.3.2 is-at f6:e6:0b:e6:a1:9d (oui Unknown), length 28
15:58:49.111026 IP 192.168.2.2 > 192.168.3.2: ICMP echo request, id 2747, seq 1, length 64
15:58:49.112392 IP 192.168.3.2 > 192.168.2.2: ICMP echo reply, id 2747, seq 1, length 64
15:58:49.117744 ARP, Request who-has 192.168.3.3 tell 192.168.3.1, length 28
15:58:49.118757 ARP, Reply 192.168.3.3 is-at c2:49:99:c6:c5:75 (oui Unknown), length 28
15:58:49.118762 IP 192.168.2.2 > 192.168.3.3: ICMP echo request, id 2748, seq 1, length 64
15:58:49.121582 IP 192.168.3.3 > 192.168.2.2: ICMP echo reply, id 2748, seq 1, length 64
15:58:54.137810 ARP, Request who-has 192.168.3.1 tell 192.168.3.3, length 28
15:58:54.137837 ARP, Reply 192.168.3.1 is-at f6:49:cb:82:00:b1 (oui Unknown), length 28
15:58:56.011286 IP 192.168.2.101 > 192.168.3.2: ICMP echo request, id 2793, seq 1, length 64
15:58:56.012239 IP 192.168.3.2 > 192.168.2.101: ICMP echo reply, id 2793, seq 1, length 64
15:58:56.015760 IP 192.168.2.101 > 192.168.3.3: ICMP echo request, id 2799, seq 1, length 64
15:58:56.016595 IP 192.168.3.3 > 192.168.2.101: ICMP echo reply, id 2799, seq 1, length 64
15:58:56.020319 ARP, Request who-has 192.168.3.1 tell 192.168.3.101, length 28
15:58:56.020347 ARP, Reply 192.168.3.1 is-at f6:49:cb:82:00:b1 (oui Unknown), length 28
15:58:56.021108 IP 192.168.3.101 > 192.168.2.2: ICMP echo request, id 2796, seq 1, length 64
15:58:56.021975 IP 192.168.2.2 > 192.168.3.101: ICMP echo reply, id 2796, seq 1, length 64
15:58:56.030440 ARP, Request who-has 192.168.3.2 tell 192.168.3.101, length 28
15:58:56.037773 ARP, Request who-has 192.168.3.3 tell 192.168.3.101, length 28
15:58:59.150879 IP 192.168.2.3 > 192.168.3.2: ICMP echo request, id 2891, seq 1, length 64
15:58:59.152317 IP 192.168.3.2 > 192.168.2.3: ICMP echo reply, id 2891, seq 1, length 64
15:58:59.158538 IP 192.168.2.3 > 192.168.3.3: ICMP echo request, id 2892, seq 1, length 64
15:58:59.160625 IP 192.168.3.3 > 192.168.2.3: ICMP echo reply, id 2892, seq 1, length 64

15:59:01.076876 IP 192.168.2.101 > 192.168.3.2: ICMP echo request, id 2914, seq 1, length 64
15:59:01.076948 IP 192.168.3.2 > 192.168.2.101: ICMP echo reply, id 2914, seq 1, length 64
15:59:01.083729 IP 192.168.2.103.36081 > 192.168.3.3.33437: UDP, length 32
15:59:01.084581 IP 192.168.3.3 > 192.168.2.103: ICMP 192.168.3.3 udp port 33437 unreachable, length 68
15:59:01.086157 IP 192.168.2.103.34380 > 192.168.3.3.33448: UDP, length 32
15:59:01.087092 IP 192.168.3.3 > 192.168.2.103: ICMP 192.168.3.3 udp port 33448 unreachable, length 68
15:59:01.087155 IP 192.168.2.103.43452 > 192.168.3.3.33444: UDP, length 32
15:59:01.088165 IP 192.168.2.103.59300 > 192.168.3.3.33449: UDP, length 32
15:59:01.088199 IP 192.168.2.103.41586 > 192.168.3.3.33447: UDP, length 32
15:59:01.088227 IP 192.168.2.103.44311 > 192.168.3.3.33440: UDP, length 32
15:59:01.088259 IP 192.168.2.103.43635 > 192.168.3.3.33442: UDP, length 32
15:59:01.089374 IP 192.168.2.103.43954 > 192.168.3.3.33438: UDP, length 32
15:59:01.090663 IP 192.168.3.3 > 192.168.2.103: ICMP 192.168.3.3 udp port 33444 unreachable, length 68
15:59:01.090850 IP 192.168.2.103.55229 > 192.168.3.3.33441: UDP, length 32
15:59:01.090891 IP 192.168.2.103.40578 > 192.168.3.3.33446: UDP, length 32
15:59:01.092633 IP 192.168.3.3 > 192.168.2.103: ICMP 192.168.3.3 udp port 33449 unreachable, length 68
15:59:01.092678 IP 192.168.3.3 > 192.168.2.103: ICMP 192.168.3.3 udp port 33447 unreachable, length 68
15:59:01.092778 IP 192.168.2.103.45457 > 192.168.3.3.33439: UDP, length 32
15:59:01.092820 IP 192.168.2.103.49601 > 192.168.3.3.33443: UDP, length 32
15:59:01.092857 IP 192.168.2.103.57785 > 192.168.3.3.33445: UDP, length 32
15:59:01.094836 IP 192.168.3.3 > 192.168.2.103: ICMP 192.168.3.3 udp port 33440 unreachable, length 68
15:59:01.097088 IP 192.168.2.101 > 192.168.3.3: ICMP echo request, id 2921, seq 1, length 64
15:59:01.097137 IP 192.168.3.3 > 192.168.2.101: ICMP echo reply, id 2921, seq 1, length 64
15:59:01.107914 IP 192.168.3.101 > 192.168.2.101: ICMP echo request, id 2933, seq 1, length 64
15:59:01.109251 IP 192.168.2.101 > 192.168.3.101: ICMP echo reply, id 2933, seq 1, length 64
15:59:01.136631 IP 192.168.3.101 > 192.168.2.3: ICMP echo request, id 2954, seq 1, length 64
15:59:01.137750 IP 192.168.2.3 > 192.168.3.101: ICMP echo reply, id 2954, seq 1, length 64
15:59:01.148759 IP 192.168.2.101 > 192.168.3.101: ICMP echo request, id 2963, seq 1, length 64
15:59:01.149987 IP 192.168.3.101 > 192.168.2.101: ICMP echo reply, id 2963, seq 1, length 64
15:59:01.170236 IP 192.168.3.2 > 12.10.5.2: ICMP echo request, id 2970, seq 1, length 64
15:59:03.173844 IP 192.168.3.2 > 12.10.5.3: ICMP echo request, id 2971, seq 1, length 64
15:59:05.177297 IP 192.168.3.2 > 192.168.1.2: ICMP echo request, id 2972, seq 1, length 64
15:59:06.056773 ARP, Request who-has 192.168.3.101 tell 192.168.3.1, length 28
15:59:06.057921 ARP, Reply 192.168.3.101 is-at 16:2f:27:0a:01:84 (oui Unknown), length 28
15:59:06.149346 IP 192.168.3.101 > 192.168.2.2: ICMP echo request, id 2984, seq 1, length 64
15:59:06.149434 IP 192.168.2.2 > 192.168.3.101: ICMP echo reply, id 2984, seq 1, length 64
15:59:06.171094 IP 192.168.3.101 > 192.168.2.101: ICMP echo request, id 3005, seq 1, length 64
15:59:06.171173 IP 192.168.2.101 > 192.168.3.101: ICMP echo reply, id 3005, seq 1, length 64
15:59:06.174325 IP 192.168.2.101 > 192.168.3.2: ICMP echo request, id 3011, seq 1, length 64
15:59:06.174393 IP 192.168.3.2 > 192.168.2.101: ICMP echo reply, id 3011, seq 1, length 64
15:59:06.183605 IP 192.168.2.101 > 192.168.3.3: ICMP echo request, id 3020, seq 1, length 64
15:59:06.183657 IP 192.168.3.3 > 192.168.2.101: ICMP echo reply, id 3020, seq 1, length 64
15:59:06.188150 IP 192.168.3.101 > 192.168.2.3: ICMP echo request, id 3023, seq 1, length 64
15:59:06.188229 IP 192.168.2.3 > 192.168.3.101: ICMP echo reply, id 3023, seq 1, length 64
15:59:06.202218 IP 192.168.3.101 > 192.168.2.103: ICMP echo request, id 3032, seq 1, length 64
15:59:06.204053 IP 192.168.2.103 > 192.168.3.101: ICMP echo reply, id 3032, seq 1, length 64
15:59:06.211228 IP 192.168.2.101 > 192.168.3.101: ICMP echo request, id 3044, seq 1, length 64
15:59:06.211280 IP 192.168.3.101 > 192.168.2.101: ICMP echo reply, id 3044, seq 1, length 64
15:59:07.180529 IP 192.168.3.2 > 192.168.1.3: ICMP echo request, id 3055, seq 1, length 64
15:59:09.183885 IP 192.168.3.2 > 192.168.2.2: ICMP echo request, id 3106, seq 1, length 64
15:59:09.185568 IP 192.168.2.2 > 192.168.3.2: ICMP echo reply, id 3106, seq 1, length 64
15:59:09.189622 IP 192.168.3.2 > 192.168.2.3: ICMP echo request, id 3107, seq 1, length 64
15:59:09.190741 IP 192.168.2.3 > 192.168.3.2: ICMP echo reply, id 3107, seq 1, length 64
15:59:09.194211 ARP, Request who-has 192.168.3.3 tell 192.168.3.2, length 28
15:59:09.198871 IP 192.168.3.2 > 192.168.4.2: ICMP echo request, id 3109, seq 1, length 64
15:59:11.201804 IP 192.168.3.2 > 192.168.5.2: ICMP echo request, id 3117, seq 1, length 64
15:59:11.201814 IP 192.168.5.2 > 192.168.3.2: ICMP echo reply, id 3117, seq 1, length 64
15:59:11.204357 IP 192.168.3.3 > 12.10.5.2: ICMP echo request, id 3118, seq 1, length 64
15:59:11.212024 IP 192.168.3.101 > 192.168.2.2: ICMP echo request, id 3122, seq 1, length 64
15:59:11.212090 IP 192.168.2.2 > 192.168.3.101: ICMP echo reply, id 3122, seq 1, length 64
15:59:11.233896 IP 192.168.3.101 > 192.168.2.101: ICMP echo request, id 3140, seq 1, length 64
15:59:11.233956 IP 192.168.2.101 > 192.168.3.101: ICMP echo reply, id 3140, seq 1, length 64
15:59:11.239340 IP 192.168.2.101 > 192.168.3.2: ICMP echo request, id 3146, seq 1, length 64
15:59:11.239389 IP 192.168.3.2 > 192.168.2.101: ICMP echo reply, id 3146, seq 1, length 64
15:59:11.250543 IP 192.168.3.101 > 192.168.2.3: ICMP echo request, id 3158, seq 1, length 64
15:59:11.250610 IP 192.168.2.3 > 192.168.3.101: ICMP echo reply, id 3158, seq 1, length 64
15:59:11.251617 IP 192.168.2.101 > 192.168.3.3: ICMP echo request, id 3155, seq 1, length 64
15:59:11.251663 IP 192.168.3.3 > 192.168.2.101: ICMP echo reply, id 3155, seq 1, length 64
15:59:11.258247 IP 192.168.3.101 > 192.168.2.103: ICMP echo request, id 3164, seq 1, length 64
15:59:11.258302 IP 192.168.2.103 > 192.168.3.101: ICMP echo reply, id 3164, seq 1, length 64
15:59:11.266509 IP 192.168.2.101 > 192.168.3.101: ICMP echo request, id 3173, seq 1, length 64
15:59:11.266576 IP 192.168.3.101 > 192.168.2.101: ICMP echo reply, id 3173, seq 1, length 64
15:59:13.207260 IP 192.168.3.3 > 12.10.5.3: ICMP echo request, id 3182, seq 1, length 64
15:59:15.210492 IP 192.168.3.3 > 192.168.1.2: ICMP echo request, id 3183, seq 1, length 64
15:59:16.115941 IP 192.168.2.103.41430 > 192.168.3.2.33441: UDP, length 32
15:59:16.117514 IP 192.168.2.103.52901 > 192.168.3.2.33439: UDP, length 32
15:59:16.117680 IP 192.168.2.103.38160 > 192.168.3.2.33440: UDP, length 32
15:59:16.117711 IP 192.168.2.103.37849 > 192.168.3.2.33437: UDP, length 32
15:59:16.117739 IP 192.168.2.103.44872 > 192.168.3.2.33448: UDP, length 32
15:59:16.117794 IP 192.168.2.103.47646 > 192.168.3.2.33438: UDP, length 32
15:59:16.117819 IP 192.168.2.103.37077 > 192.168.3.2.33445: UDP, length 32
15:59:16.117844 IP 192.168.2.103.50682 > 192.168.3.2.33443: UDP, length 32
15:59:16.117868 IP 192.168.2.103.60311 > 192.168.3.2.33446: UDP, length 32
15:59:16.117893 IP 192.168.2.103.49243 > 192.168.3.2.33444: UDP, length 32
15:59:16.117918 IP 192.168.2.103.58722 > 192.168.3.2.33449: UDP, length 32
15:59:16.117970 IP 192.168.2.103.60019 > 192.168.3.2.33447: UDP, length 32
15:59:16.118001 IP 192.168.2.103.54461 > 192.168.3.2.33442: UDP, length 32
15:59:16.122205 IP 192.168.3.2 > 192.168.2.103: ICMP 192.168.3.2 udp port 33441 unreachable, length 68
15:59:16.122245 IP 192.168.3.2 > 192.168.2.103: ICMP 192.168.3.2 udp port 33439 unreachable, length 68
15:59:16.122272 IP 192.168.3.2 > 192.168.2.103: ICMP 192.168.3.2 udp port 33440 unreachable, length 68
15:59:16.122297 IP 192.168.3.2 > 192.168.2.103: ICMP 192.168.3.2 udp port 33437 unreachable, length 68
15:59:16.122321 IP 192.168.3.2 > 192.168.2.103: ICMP 192.168.3.2 udp port 33448 unreachable, length 68
15:59:16.122350 IP 192.168.3.2 > 192.168.2.103: ICMP 192.168.3.2 udp port 33438 unreachable, length 68
15:59:16.123807 IP 192.168.2.103.42602 > 192.168.3.2.33450: UDP, length 32
15:59:16.123846 IP 192.168.2.103.38996 > 192.168.3.2.33452: UDP, length 32
15:59:16.123875 IP 192.168.2.103.51947 > 192.168.3.2.33451: UDP, length 32
15:59:16.141171 IP 192.168.2.103.39440 > 192.168.3.103.33449: UDP, length 32
15:59:16.141863 IP 192.168.2.103.41731 > 192.168.3.103.33448: UDP, length 32
15:59:16.142321 IP 192.168.3.103 > 192.168.2.103: ICMP 192.168.3.103 udp port 33449 unreachable, length 68
15:59:16.143294 IP 192.168.2.103.43650 > 192.168.3.103.33446: UDP, length 32
15:59:16.143325 IP 192.168.2.103.43838 > 192.168.3.103.33438: UDP, length 32
15:59:16.144729 IP 192.168.3.103 > 192.168.2.103: ICMP 192.168.3.103 udp port 33448 unreachable, length 68
15:59:16.144856 IP 192.168.2.103.36467 > 192.168.3.103.33442: UDP, length 32
15:59:16.145505 IP 192.168.2.103.37170 > 192.168.3.103.33440: UDP, length 32
15:59:16.145558 IP 192.168.2.103.52029 > 192.168.3.103.33447: UDP, length 32
15:59:16.145586 IP 192.168.2.103.36195 > 192.168.3.103.33444: UDP, length 32
15:59:16.145613 IP 192.168.2.103.60068 > 192.168.3.103.33437: UDP, length 32
15:59:16.145638 IP 192.168.2.103.54114 > 192.168.3.103.33441: UDP, length 32
15:59:16.145663 IP 192.168.2.103.59848 > 192.168.3.103.33443: UDP, length 32
15:59:16.145688 IP 192.168.2.103.56436 > 192.168.3.103.33445: UDP, length 32
15:59:16.145713 IP 192.168.2.103.38985 > 192.168.3.103.33439: UDP, length 32
15:59:16.147365 IP 192.168.3.103 > 192.168.2.103: ICMP 192.168.3.103 udp port 33446 unreachable, length 68
15:59:16.147476 IP 192.168.3.103 > 192.168.2.103: ICMP 192.168.3.103 udp port 33438 unreachable, length 68
15:59:16.148552 IP 192.168.3.103 > 192.168.2.103: ICMP 192.168.3.103 udp port 33442 unreachable, length 68
15:59:16.148591 IP 192.168.3.103 > 192.168.2.103: ICMP 192.168.3.103 udp port 33440 unreachable, length 68
15:59:16.149341 IP 192.168.2.103.48279 > 192.168.3.103.33450: UDP, length 32
15:59:16.267506 IP 192.168.3.101 > 192.168.2.2: ICMP echo request, id 3205, seq 1, length 64
15:59:16.267570 IP 192.168.2.2 > 192.168.3.101: ICMP echo reply, id 3205, seq 1, length 64
15:59:16.274586 IP 192.168.3.101 > 192.168.2.101: ICMP echo request, id 3217, seq 1, length 64
15:59:16.274669 IP 192.168.2.101 > 192.168.3.101: ICMP echo reply, id 3217, seq 1, length 64
15:59:16.281236 IP 192.168.3.101 > 192.168.2.3: ICMP echo request, id 3226, seq 1, length 64
15:59:16.281301 IP 192.168.2.3 > 192.168.3.101: ICMP echo reply, id 3226, seq 1, length 64
15:59:16.284937 IP 192.168.2.101 > 192.168.3.2: ICMP echo request, id 3232, seq 1, length 64
15:59:16.284986 IP 192.168.3.2 > 192.168.2.101: ICMP echo reply, id 3232, seq 1, length 64
15:59:16.287009 IP 192.168.3.101 > 192.168.2.103: ICMP echo request, id 3229, seq 1, length 64
15:59:16.287094 IP 192.168.2.103 > 192.168.3.101: ICMP echo reply, id 3229, seq 1, length 64
15:59:16.292485 IP 192.168.3.101 > 192.168.5.2: ICMP echo request, id 3238, seq 1, length 64
15:59:16.292495 IP 192.168.5.2 > 192.168.3.101: ICMP echo reply, id 3238, seq 1, length 64
15:59:16.294583 IP 192.168.2.101 > 192.168.3.3: ICMP echo request, id 3235, seq 1, length 64
15:59:16.294650 IP 192.168.3.3 > 192.168.2.101: ICMP echo reply, id 3235, seq 1, length 64
15:59:16.308858 IP 192.168.2.101 > 192.168.3.101: ICMP echo request, id 3250, seq 1, length 64
15:59:16.308985 IP 192.168.3.101 > 192.168.2.101: ICMP echo reply, id 3250, seq 1, length 64
15:59:17.212214 IP 192.168.3.3 > 192.168.1.3: ICMP echo request, id 3261, seq 1, length 64
15:59:19.216525 IP 192.168.3.3 > 192.168.2.2: ICMP echo request, id 3262, seq 1, length 64
15:59:19.218881 IP 192.168.2.2 > 192.168.3.3: ICMP echo reply, id 3262, seq 1, length 64
15:59:19.222075 IP 192.168.3.3 > 192.168.2.3: ICMP echo request, id 3263, seq 1, length 64
15:59:19.223731 IP 192.168.2.3 > 192.168.3.3: ICMP echo reply, id 3263, seq 1, length 64
15:59:19.229967 IP 192.168.3.3 > 192.168.4.2: ICMP echo request, id 3265, seq 1, length 64
15:59:20.217128 ARP, Request who-has 192.168.3.1 tell 192.168.3.3, length 28
15:59:20.217138 ARP, Reply 192.168.3.1 is-at f6:49:cb:82:00:b1 (oui Unknown), length 28
15:59:21.144555 ARP, Request who-has 192.168.3.103 tell 192.168.3.1, length 28
15:59:21.146085 ARP, Request who-has 192.168.3.1 tell 192.168.3.103, length 28
15:59:21.146095 ARP, Reply 192.168.3.1 is-at f6:49:cb:82:00:b1 (oui Unknown), length 28
15:59:21.147265 ARP, Reply 192.168.3.103 is-at e2:41:a5:bb:0b:6b (oui Unknown), length 28
15:59:21.197612 ARP, Request who-has 192.168.3.3 tell 192.168.3.103, length 28
15:59:21.218431 IP 192.168.3.103.43358 > 192.168.5.2.33434: UDP, length 32
15:59:21.218444 IP 192.168.5.2 > 192.168.3.103: ICMP 192.168.5.2 udp port 33434 unreachable, length 68
15:59:21.219553 IP 192.168.3.103.57307 > 192.168.5.2.33435: UDP, length 32
15:59:21.219560 IP 192.168.5.2 > 192.168.3.103: ICMP 192.168.5.2 udp port 33435 unreachable, length 68
15:59:21.220654 IP 192.168.3.103.53267 > 192.168.5.2.33436: UDP, length 32
15:59:21.220660 IP 192.168.5.2 > 192.168.3.103: ICMP 192.168.5.2 udp port 33436 unreachable, length 68
15:59:21.221642 IP 192.168.3.103.50489 > 192.168.5.2.33437: UDP, length 32
15:59:21.221648 IP 192.168.5.2 > 192.168.3.103: ICMP 192.168.5.2 udp port 33437 unreachable, length 68
15:59:21.222896 IP 192.168.3.103.52910 > 192.168.5.2.33446: UDP, length 32
15:59:21.222903 IP 192.168.5.2 > 192.168.3.103: ICMP 192.168.5.2 udp port 33446 unreachable, length 68
15:59:21.223350 IP 192.168.3.103.58354 > 192.168.5.2.33440: UDP, length 32
15:59:21.223356 IP 192.168.5.2 > 192.168.3.103: ICMP 192.168.5.2 udp port 33440 unreachable, length 68
15:59:21.223788 IP 192.168.3.103.49653 > 192.168.5.2.33445: UDP, length 32
15:59:21.224204 IP 192.168.3.103.36222 > 192.168.5.2.33443: UDP, length 32
15:59:21.224700 IP 192.168.3.103.42401 > 192.168.5.2.33444: UDP, length 32
15:59:21.225385 IP 192.168.3.103.59931 > 192.168.5.2.33447: UDP, length 32
15:59:21.225401 IP 192.168.3.103.39288 > 192.168.5.2.33438: UDP, length 32
15:59:21.225410 IP 192.168.3.103.45448 > 192.168.5.2.33442: UDP, length 32
15:59:21.225424 IP 192.168.3.103.54876 > 192.168.5.2.33449: UDP, length 32
15:59:21.225436 IP 192.168.3.103.57179 > 192.168.5.2.33448: UDP, length 32
15:59:21.226350 IP 192.168.3.103.59561 > 192.168.5.2.33439: UDP, length 32
15:59:21.226367 IP 192.168.3.103.46369 > 192.168.5.2.33441: UDP, length 32
15:59:21.231724 IP 192.168.3.103.42697 > 192.168.2.3.33434: UDP, length 32
15:59:21.232848 IP 192.168.3.103.42168 > 192.168.2.3.33435: UDP, length 32
15:59:21.233429 IP 192.168.3.103.38603 > 192.168.2.3.33436: UDP, length 32
15:59:21.234672 IP 192.168.3.103.55387 > 192.168.2.3.33445: UDP, length 32
15:59:21.235202 IP 192.168.3.103.44599 > 192.168.2.3.33446: UDP, length 32
15:59:21.235242 IP 192.168.3.103.46289 > 192.168.2.3.33438: UDP, length 32
15:59:21.235271 IP 192.168.3.103.53977 > 192.168.2.3.33439: UDP, length 32
15:59:21.235297 IP 192.168.3.103.47944 > 192.168.2.3.33449: UDP, length 32
15:59:21.235323 IP 192.168.3.103.40098 > 192.168.2.3.33440: UDP, length 32
15:59:21.235348 IP 192.168.3.103.40427 > 192.168.2.3.33448: UDP, length 32
15:59:21.235373 IP 192.168.3.103.43004 > 192.168.2.3.33447: UDP, length 32
15:59:21.235397 IP 192.168.3.103.54124 > 192.168.2.3.33441: UDP, length 32
15:59:21.235422 IP 192.168.3.103.43769 > 192.168.2.3.33442: UDP, length 32
15:59:21.235447 IP 192.168.3.103.60808 > 192.168.2.3.33437: UDP, length 32
15:59:21.235536 IP 192.168.3.103.35178 > 192.168.2.3.33443: UDP, length 32
15:59:21.235570 IP 192.168.3.103.38239 > 192.168.2.3.33444: UDP, length 32
15:59:21.236601 IP 192.168.2.3 > 192.168.3.103: ICMP 192.168.2.3 udp port 33445 unreachable, length 68
15:59:21.237249 IP 192.168.2.3 > 192.168.3.103: ICMP 192.168.2.3 udp port 33446 unreachable, length 68
15:59:21.237281 IP 192.168.2.3 > 192.168.3.103: ICMP 192.168.2.3 udp port 33438 unreachable, length 68
15:59:21.237307 IP 192.168.2.3 > 192.168.3.103: ICMP 192.168.2.3 udp port 33439 unreachable, length 68
15:59:21.237332 IP 192.168.2.3 > 192.168.3.103: ICMP 192.168.2.3 udp port 33449 unreachable, length 68
15:59:21.237361 IP 192.168.2.3 > 192.168.3.103: ICMP 192.168.2.3 udp port 33440 unreachable, length 68
15:59:21.237868 IP 192.168.3.3 > 192.168.5.2: ICMP echo request, id 3291, seq 1, length 64
15:59:21.237875 IP 192.168.5.2 > 192.168.3.3: ICMP echo reply, id 3291, seq 1, length 64
15:59:21.273120 ARP, Request who-has 192.168.3.1 tell 192.168.3.101, length 28
15:59:21.273128 ARP, Reply 192.168.3.1 is-at f6:49:cb:82:00:b1 (oui Unknown), length 28
15:59:21.298875 IP 192.168.3.101 > 192.168.2.2: ICMP echo request, id 3308, seq 1, length 64
15:59:21.298944 IP 192.168.2.2 > 192.168.3.101: ICMP echo reply, id 3308, seq 1, length 64
15:59:21.306952 IP 192.168.3.101 > 192.168.2.101: ICMP echo request, id 3317, seq 1, length 64
15:59:21.307013 IP 192.168.2.101 > 192.168.3.101: ICMP echo reply, id 3317, seq 1, length 64
15:59:21.311901 IP 192.168.3.101 > 192.168.2.3: ICMP echo request, id 3323, seq 1, length 64
15:59:21.311969 IP 192.168.2.3 > 192.168.3.101: ICMP echo reply, id 3323, seq 1, length 64
15:59:21.314978 IP 192.168.3.101 > 192.168.2.103: ICMP echo request, id 3326, seq 1, length 64
15:59:21.315090 IP 192.168.2.103 > 192.168.3.101: ICMP echo reply, id 3326, seq 1, length 64
15:59:21.317957 IP 192.168.3.101 > 192.168.5.2: ICMP echo request, id 3329, seq 1, length 64
15:59:21.318025 IP 192.168.5.2 > 192.168.3.101: ICMP echo reply, id 3329, seq 1, length 64
15:59:21.321600 ARP, Request who-has 192.168.3.103 tell 192.168.3.101, length 28
15:59:21.327216 IP 192.168.2.101 > 192.168.3.2: ICMP echo request, id 3338, seq 1, length 64
15:59:21.327267 IP 192.168.3.2 > 192.168.2.101: ICMP echo reply, id 3338, seq 1, length 64
15:59:21.329816 IP 192.168.2.101 > 192.168.3.3: ICMP echo request, id 3341, seq 1, length 64
15:59:21.329866 IP 192.168.3.3 > 192.168.2.101: ICMP echo reply, id 3341, seq 1, length 64
15:59:21.339244 IP 192.168.2.101 > 192.168.3.101: ICMP echo request, id 3353, seq 1, length 64
15:59:21.339296 IP 192.168.3.101 > 192.168.2.101: ICMP echo reply, id 3353, seq 1, length 64
15:59:21.347150 IP 192.168.2.101 > 192.168.3.103: ICMP echo request, id 3362, seq 1, length 64
15:59:21.348101 IP 192.168.3.103 > 192.168.2.101: ICMP echo reply, id 3362, seq 1, length 64
15:59:26.243515 ARP, Request who-has 192.168.3.2 tell 192.168.3.103, length 28
15:59:26.248552 ARP, Request who-has 192.168.3.3 tell 192.168.3.1, length 28
15:59:26.249926 ARP, Reply 192.168.3.3 is-at c2:49:99:c6:c5:75 (oui Unknown), length 28
15:59:26.255442 IP 192.168.3.103.33842 > 192.168.2.2.33434: UDP, length 32
15:59:26.255454 IP 192.168.3.1 > 192.168.3.103: ICMP time exceeded in-transit, length 68
15:59:26.256764 IP 192.168.3.103.46993 > 192.168.2.2.33440: UDP, length 32
15:59:26.256807 IP 192.168.3.103.43271 > 192.168.2.2.33438: UDP, length 32
15:59:26.256836 IP 192.168.3.103.34058 > 192.168.2.2.33439: UDP, length 32
15:59:26.256862 IP 192.168.3.103.46425 > 192.168.2.2.33442: UDP, length 32
15:59:26.256888 IP 192.168.3.103.45482 > 192.168.2.2.33448: UDP, length 32
15:59:26.256912 IP 192.168.3.103.42931 > 192.168.2.2.33445: UDP, length 32
15:59:26.257048 IP 192.168.3.103.47572 > 192.168.2.2.33444: UDP, length 32
15:59:26.257077 IP 192.168.3.103.59997 > 192.168.2.2.33443: UDP, length 32
15:59:26.257102 IP 192.168.3.103.37189 > 192.168.2.2.33441: UDP, length 32
15:59:26.257127 IP 192.168.3.103.53564 > 192.168.2.2.33449: UDP, length 32
15:59:26.257151 IP 192.168.3.103.60520 > 192.168.2.2.33436: UDP, length 32
15:59:26.257157 IP 192.168.3.1 > 192.168.3.103: ICMP time exceeded in-transit, length 68
15:59:26.257182 IP 192.168.3.103.57685 > 192.168.2.2.33435: UDP, length 32
15:59:26.257185 IP 192.168.3.1 > 192.168.3.103: ICMP time exceeded in-transit, length 68
15:59:26.257209 IP 192.168.3.103.33264 > 192.168.2.2.33447: UDP, length 32
15:59:26.257234 IP 192.168.3.103.53331 > 192.168.2.2.33446: UDP, length 32
15:59:26.257258 IP 192.168.3.103.58773 > 192.168.2.2.33437: UDP, length 32
15:59:26.259102 IP 192.168.2.2 > 192.168.3.103: ICMP 192.168.2.2 udp port 33440 unreachable, length 68
15:59:26.259142 IP 192.168.2.2 > 192.168.3.103: ICMP 192.168.2.2 udp port 33438 unreachable, length 68
15:59:26.259170 IP 192.168.2.2 > 192.168.3.103: ICMP 192.168.2.2 udp port 33439 unreachable, length 68
15:59:26.259195 IP 192.168.2.2 > 192.168.3.103: ICMP 192.168.2.2 udp port 33442 unreachable, length 68
15:59:26.259219 IP 192.168.2.2 > 192.168.3.103: ICMP 192.168.2.2 udp port 33448 unreachable, length 68
15:59:26.259249 IP 192.168.2.2 > 192.168.3.103: ICMP 192.168.2.2 udp port 33445 unreachable, length 68
15:59:26.260651 IP 192.168.3.103.59340 > 192.168.2.2.33452: UDP, length 32
15:59:26.260691 IP 192.168.3.103.55839 > 192.168.2.2.33451: UDP, length 32
15:59:26.260724 IP 192.168.3.103.45414 > 192.168.2.2.33450: UDP, length 32
15:59:26.328651 ARP, Request who-has 192.168.3.2 tell 192.168.3.1, length 28
15:59:26.329353 ARP, Reply 192.168.3.2 is-at f6:e6:0b:e6:a1:9d (oui Unknown), length 28
15:59:26.332447 IP 192.168.3.101 > 192.168.2.2: ICMP echo request, id 3393, seq 1, length 64
15:59:26.332608 IP 192.168.2.2 > 192.168.3.101: ICMP echo reply, id 3393, seq 1, length 64
15:59:26.340808 IP 192.168.3.101 > 192.168.2.101: ICMP echo request, id 3402, seq 1, length 64
15:59:26.340871 IP 192.168.2.101 > 192.168.3.101: ICMP echo reply, id 3402, seq 1, length 64
15:59:26.346320 IP 192.168.3.101 > 192.168.2.3: ICMP echo request, id 3408, seq 1, length 64
15:59:26.346380 IP 192.168.2.3 > 192.168.3.101: ICMP echo reply, id 3408, seq 1, length 64
15:59:26.349090 IP 192.168.3.101 > 192.168.2.103: ICMP echo request, id 3411, seq 1, length 64
15:59:26.349149 IP 192.168.2.103 > 192.168.3.101: ICMP echo reply, id 3411, seq 1, length 64
15:59:26.351905 IP 192.168.3.101 > 192.168.5.2: ICMP echo request, id 3414, seq 1, length 64
15:59:26.351916 IP 192.168.5.2 > 192.168.3.101: ICMP echo reply, id 3414, seq 1, length 64
15:59:26.359487 IP 192.168.2.101 > 192.168.3.2: ICMP echo request, id 3423, seq 1, length 64
15:59:26.359539 IP 192.168.3.2 > 192.168.2.101: ICMP echo reply, id 3423, seq 1, length 64
15:59:26.362427 IP 192.168.2.101 > 192.168.3.3: ICMP echo request, id 3426, seq 1, length 64
15:59:26.362493 IP 192.168.3.3 > 192.168.2.101: ICMP echo reply, id 3426, seq 1, length 64
15:59:26.373116 IP 192.168.2.101 > 192.168.3.101: ICMP echo request, id 3438, seq 1, length 64
15:59:26.373166 IP 192.168.3.101 > 192.168.2.101: ICMP echo reply, id 3438, seq 1, length 64
15:59:26.381765 IP 192.168.2.101 > 192.168.3.103: ICMP echo request, id 3447, seq 1, length 64
15:59:26.381818 IP 192.168.3.103 > 192.168.2.101: ICMP echo reply, id 3447, seq 1, length 64

15:59:31.265385 IP 192.168.3.103.51555 > 192.168.2.103.33434: UDP, length 32
15:59:31.265397 IP 192.168.3.1 > 192.168.3.103: ICMP time exceeded in-transit, length 68
15:59:31.266442 IP 192.168.3.103.59363 > 192.168.2.103.33435: UDP, length 32
15:59:31.266448 IP 192.168.3.1 > 192.168.3.103: ICMP time exceeded in-transit, length 68
15:59:31.267441 IP 192.168.3.103.48507 > 192.168.2.103.33436: UDP, length 32
15:59:31.267448 IP 192.168.3.1 > 192.168.3.103: ICMP time exceeded in-transit, length 68
15:59:31.268442 IP 192.168.3.103.46485 > 192.168.2.103.33437: UDP, length 32
15:59:31.269462 IP 192.168.2.103 > 192.168.3.103: ICMP 192.168.2.103 udp port 33437 unreachable, length 68
15:59:31.270785 IP 192.168.3.103.53033 > 192.168.2.103.33438: UDP, length 32
15:59:31.271396 IP 192.168.3.103.55634 > 192.168.2.103.33440: UDP, length 32
15:59:31.271435 IP 192.168.3.103.40254 > 192.168.2.103.33443: UDP, length 32
15:59:31.271502 IP 192.168.3.103.48798 > 192.168.2.103.33446: UDP, length 32
15:59:31.271554 IP 192.168.3.103.41982 > 192.168.2.103.33445: UDP, length 32
15:59:31.271580 IP 192.168.3.103.44040 > 192.168.2.103.33439: UDP, length 32
15:59:31.271604 IP 192.168.3.103.48992 > 192.168.2.103.33441: UDP, length 32
15:59:31.271629 IP 192.168.3.103.36347 > 192.168.2.103.33444: UDP, length 32
15:59:31.271653 IP 192.168.3.103.34681 > 192.168.2.103.33448: UDP, length 32
15:59:31.271678 IP 192.168.3.103.39439 > 192.168.2.103.33449: UDP, length 32
15:59:31.271702 IP 192.168.3.103.43974 > 192.168.2.103.33442: UDP, length 32
15:59:31.271731 IP 192.168.3.103.39390 > 192.168.2.103.33447: UDP, length 32
15:59:31.272831 IP 192.168.2.103 > 192.168.3.103: ICMP 192.168.2.103 udp port 33438 unreachable, length 68
15:59:31.273372 IP 192.168.2.103 > 192.168.3.103: ICMP 192.168.2.103 udp port 33440 unreachable, length 68
15:59:31.273406 IP 192.168.2.103 > 192.168.3.103: ICMP 192.168.2.103 udp port 33443 unreachable, length 68
15:59:31.273432 IP 192.168.2.103 > 192.168.3.103: ICMP 192.168.2.103 udp port 33446 unreachable, length 68
15:59:31.273533 IP 192.168.2.103 > 192.168.3.103: ICMP 192.168.2.103 udp port 33445 unreachable, length 68
15:59:31.359006 IP 192.168.3.101 > 192.168.2.2: ICMP echo request, id 3505, seq 1, length 64
15:59:31.359094 IP 192.168.2.2 > 192.168.3.101: ICMP echo reply, id 3505, seq 1, length 64
15:59:31.367412 IP 192.168.3.101 > 192.168.2.101: ICMP echo request, id 3514, seq 1, length 64
15:59:31.367500 IP 192.168.2.101 > 192.168.3.101: ICMP echo reply, id 3514, seq 1, length 64
15:59:31.373133 IP 192.168.3.101 > 192.168.2.3: ICMP echo request, id 3520, seq 1, length 64
15:59:31.373208 IP 192.168.2.3 > 192.168.3.101: ICMP echo reply, id 3520, seq 1, length 64
15:59:31.376118 IP 192.168.3.101 > 192.168.2.103: ICMP echo request, id 3523, seq 1, length 64
15:59:31.376177 IP 192.168.2.103 > 192.168.3.101: ICMP echo reply, id 3523, seq 1, length 64
15:59:31.378386 IP 192.168.3.101 > 192.168.5.2: ICMP echo request, id 3526, seq 1, length 64
15:59:31.378394 IP 192.168.5.2 > 192.168.3.101: ICMP echo reply, id 3526, seq 1, length 64
15:59:31.384593 IP 192.168.3.101 > 192.168.3.1: ICMP echo request, id 3532, seq 1, length 64
15:59:31.384601 IP 192.168.3.1 > 192.168.3.101: ICMP echo reply, id 3532, seq 1, length 64
15:59:31.390730 IP 192.168.2.101 > 192.168.3.2: ICMP echo request, id 3538, seq 1, length 64
15:59:31.390865 IP 192.168.3.2 > 192.168.2.101: ICMP echo reply, id 3538, seq 1, length 64
15:59:31.393483 IP 192.168.2.101 > 192.168.3.3: ICMP echo request, id 3541, seq 1, length 64
15:59:31.393533 IP 192.168.3.3 > 192.168.2.101: ICMP echo reply, id 3541, seq 1, length 64
15:59:31.404109 IP 192.168.2.101 > 192.168.3.101: ICMP echo request, id 3553, seq 1, length 64
15:59:31.404202 IP 192.168.3.101 > 192.168.2.101: ICMP echo reply, id 3553, seq 1, length 64
15:59:31.412255 IP 192.168.2.101 > 192.168.3.103: ICMP echo request, id 3562, seq 1, length 64
15:59:31.412302 IP 192.168.3.103 > 192.168.2.101: ICMP echo reply, id 3562, seq 1, length 64
15:59:36.393947 IP 192.168.3.101 > 192.168.2.2: ICMP echo request, id 3665, seq 1, length 64
15:59:36.394023 IP 192.168.2.2 > 192.168.3.101: ICMP echo reply, id 3665, seq 1, length 64
15:59:36.411723 IP 192.168.3.101 > 192.168.2.101: ICMP echo request, id 3675, seq 1, length 64
15:59:36.411842 IP 192.168.2.101 > 192.168.3.101: ICMP echo reply, id 3675, seq 1, length 64
15:59:36.429509 IP 192.168.3.101 > 192.168.2.3: ICMP echo request, id 3692, seq 1, length 64
15:59:36.429572 IP 192.168.2.3 > 192.168.3.101: ICMP echo reply, id 3692, seq 1, length 64
15:59:36.430930 IP 192.168.2.101 > 192.168.3.2: ICMP echo request, id 3697, seq 1, length 64
15:59:36.430975 IP 192.168.3.2 > 192.168.2.101: ICMP echo reply, id 3697, seq 1, length 64
15:59:36.438652 IP 192.168.3.101 > 192.168.2.103: ICMP echo request, id 3700, seq 1, length 64
15:59:36.438717 IP 192.168.2.103 > 192.168.3.101: ICMP echo reply, id 3700, seq 1, length 64
15:59:36.440989 IP 192.168.2.101 > 192.168.3.3: ICMP echo request, id 3704, seq 1, length 64
15:59:36.441093 IP 192.168.3.3 > 192.168.2.101: ICMP echo reply, id 3704, seq 1, length 64
15:59:36.449028 IP 192.168.3.101 > 192.168.5.2: ICMP echo request, id 3707, seq 1, length 64
15:59:36.449037 IP 192.168.5.2 > 192.168.3.101: ICMP echo reply, id 3707, seq 1, length 64
15:59:36.459366 IP 192.168.3.101 > 192.168.3.1: ICMP echo request, id 3719, seq 1, length 64
15:59:36.459375 IP 192.168.3.1 > 192.168.3.101: ICMP echo reply, id 3719, seq 1, length 64
15:59:36.462535 IP 192.168.2.101 > 192.168.3.101: ICMP echo request, id 3725, seq 1, length 64
15:59:36.462588 IP 192.168.3.101 > 192.168.2.101: ICMP echo reply, id 3725, seq 1, length 64
15:59:36.470576 IP 192.168.2.101 > 192.168.3.103: ICMP echo request, id 3734, seq 1, length 64
15:59:36.470627 IP 192.168.3.103 > 192.168.2.101: ICMP echo reply, id 3734, seq 1, length 64
15:59:41.466043 IP 192.168.3.101 > 192.168.2.2: ICMP echo request, id 3776, seq 1, length 64
15:59:41.466119 IP 192.168.2.2 > 192.168.3.101: ICMP echo reply, id 3776, seq 1, length 64
15:59:41.477546 IP 192.168.3.101 > 192.168.2.101: ICMP echo request, id 3788, seq 1, length 64
15:59:41.477617 IP 192.168.2.101 > 192.168.3.101: ICMP echo reply, id 3788, seq 1, length 64
15:59:41.483467 IP 192.168.2.101 > 192.168.3.2: ICMP echo request, id 3794, seq 1, length 64
15:59:41.483524 IP 192.168.3.2 > 192.168.2.101: ICMP echo reply, id 3794, seq 1, length 64
15:59:41.489098 IP 192.168.3.101 > 192.168.2.3: ICMP echo request, id 3800, seq 1, length 64
15:59:41.489235 IP 192.168.2.3 > 192.168.3.101: ICMP echo reply, id 3800, seq 1, length 64
15:59:41.491135 IP 192.168.2.101 > 192.168.3.3: ICMP echo request, id 3797, seq 1, length 64
15:59:41.491214 IP 192.168.3.3 > 192.168.2.101: ICMP echo reply, id 3797, seq 1, length 64
15:59:41.495089 IP 192.168.3.101 > 192.168.2.103: ICMP echo request, id 3803, seq 1, length 64
15:59:41.495162 IP 192.168.2.103 > 192.168.3.101: ICMP echo reply, id 3803, seq 1, length 64
15:59:41.501946 IP 192.168.3.101 > 192.168.5.2: ICMP echo request, id 3809, seq 1, length 64
15:59:41.501958 IP 192.168.5.2 > 192.168.3.101: ICMP echo reply, id 3809, seq 1, length 64
15:59:41.514701 IP 192.168.2.101 > 192.168.3.101: ICMP echo request, id 3824, seq 1, length 64
15:59:41.514765 IP 192.168.3.101 > 192.168.2.101: ICMP echo reply, id 3824, seq 1, length 64
15:59:41.515561 IP 192.168.3.101 > 192.168.3.1: ICMP echo request, id 3821, seq 1, length 64
15:59:41.515567 IP 192.168.3.1 > 192.168.3.101: ICMP echo reply, id 3821, seq 1, length 64
15:59:41.525516 IP 192.168.2.101 > 192.168.3.103: ICMP echo request, id 3833, seq 1, length 64
15:59:41.525659 IP 192.168.3.103 > 192.168.2.101: ICMP echo reply, id 3833, seq 1, length 64
15:59:43.283116 IP 192.168.3.1 > 192.168.3.2: ICMP echo request, id 3888, seq 1, length 64
15:59:43.284007 IP 192.168.3.2 > 192.168.3.1: ICMP echo reply, id 3888, seq 1, length 64
15:59:43.285493 IP 192.168.3.1 > 192.168.3.3: ICMP echo request, id 3889, seq 1, length 64
15:59:43.286231 IP 192.168.3.3 > 192.168.3.1: ICMP echo reply, id 3889, seq 1, length 64
15:59:46.472604 ARP, Request who-has 192.168.3.101 tell 192.168.3.1, length 28
15:59:46.472689 ARP, Request who-has 192.168.3.1 tell 192.168.3.101, length 28
15:59:46.472696 ARP, Reply 192.168.3.1 is-at f6:49:cb:82:00:b1 (oui Unknown), length 28
15:59:46.472739 ARP, Reply 192.168.3.101 is-at 16:2f:27:0a:01:84 (oui Unknown), length 28
15:59:46.504996 ARP, Request who-has 192.168.3.1 tell 192.168.3.3, length 28
15:59:46.505003 ARP, Reply 192.168.3.1 is-at f6:49:cb:82:00:b1 (oui Unknown), length 28
15:59:46.524715 IP 192.168.3.101 > 192.168.2.2: ICMP echo request, id 3915, seq 1, length 64
15:59:46.524861 IP 192.168.2.2 > 192.168.3.101: ICMP echo reply, id 3915, seq 1, length 64
15:59:46.536050 IP 192.168.3.101 > 192.168.2.101: ICMP echo request, id 3927, seq 1, length 64
15:59:46.536107 IP 192.168.2.101 > 192.168.3.101: ICMP echo reply, id 3927, seq 1, length 64
15:59:46.536787 ARP, Request who-has 192.168.3.1 tell 192.168.3.103, length 28
15:59:46.536791 ARP, Reply 192.168.3.1 is-at f6:49:cb:82:00:b1 (oui Unknown), length 28
15:59:46.539571 IP 192.168.2.101 > 192.168.3.2: ICMP echo request, id 3930, seq 1, length 64
15:59:46.539618 IP 192.168.3.2 > 192.168.2.101: ICMP echo reply, id 3930, seq 1, length 64
15:59:46.544737 IP 192.168.2.101 > 192.168.3.3: ICMP echo request, id 3936, seq 1, length 64
15:59:46.544788 IP 192.168.3.3 > 192.168.2.101: ICMP echo reply, id 3936, seq 1, length 64
15:59:46.547731 IP 192.168.3.101 > 192.168.2.3: ICMP echo request, id 3939, seq 1, length 64
15:59:46.547801 IP 192.168.2.3 > 192.168.3.101: ICMP echo reply, id 3939, seq 1, length 64
15:59:46.552440 IP 192.168.3.101 > 192.168.2.103: ICMP echo request, id 3945, seq 1, length 64
15:59:46.552498 IP 192.168.2.103 > 192.168.3.101: ICMP echo reply, id 3945, seq 1, length 64
15:59:46.558698 IP 192.168.3.101 > 192.168.5.2: ICMP echo request, id 3951, seq 1, length 64
15:59:46.558708 IP 192.168.5.2 > 192.168.3.101: ICMP echo reply, id 3951, seq 1, length 64
15:59:46.566831 IP 192.168.2.101 > 192.168.3.101: ICMP echo request, id 3960, seq 1, length 64
15:59:46.566881 IP 192.168.3.101 > 192.168.2.101: ICMP echo reply, id 3960, seq 1, length 64
15:59:46.568468 IP 192.168.3.101 > 192.168.3.1: ICMP echo request, id 3963, seq 1, length 64
15:59:46.568474 IP 192.168.3.1 > 192.168.3.101: ICMP echo reply, id 3963, seq 1, length 64
15:59:46.576649 IP 192.168.2.101 > 192.168.3.103: ICMP echo request, id 3972, seq 1, length 64
15:59:46.576699 IP 192.168.3.103 > 192.168.2.101: ICMP echo reply, id 3972, seq 1, length 64
15:59:51.230501 IP 192.168.2.103.38246 > 192.168.3.3.33437: UDP, length 32
15:59:51.231351 IP 192.168.3.3 > 192.168.2.103: ICMP 192.168.3.3 udp port 33437 unreachable, length 68
15:59:51.232685 IP 192.168.2.103.49771 > 192.168.3.3.33447: UDP, length 32
15:59:51.233517 IP 192.168.2.103.38993 > 192.168.3.3.33443: UDP, length 32
15:59:51.234359 IP 192.168.3.3 > 192.168.2.103: ICMP 192.168.3.3 udp port 33447 unreachable, length 68
15:59:51.234459 IP 192.168.2.103.39174 > 192.168.3.3.33442: UDP, length 32
15:59:51.234490 IP 192.168.2.103.53889 > 192.168.3.3.33449: UDP, length 32
15:59:51.234516 IP 192.168.2.103.40403 > 192.168.3.3.33446: UDP, length 32
15:59:51.235903 IP 192.168.3.3 > 192.168.2.103: ICMP 192.168.3.3 udp port 33443 unreachable, length 68
15:59:51.236119 IP 192.168.2.103.33927 > 192.168.3.3.33439: UDP, length 32
15:59:51.236150 IP 192.168.2.103.54490 > 192.168.3.3.33441: UDP, length 32
15:59:51.236176 IP 192.168.2.103.35225 > 192.168.3.3.33448: UDP, length 32
15:59:51.236201 IP 192.168.2.103.42369 > 192.168.3.3.33438: UDP, length 32
15:59:51.236226 IP 192.168.2.103.45070 > 192.168.3.3.33445: UDP, length 32
15:59:51.236251 IP 192.168.2.103.47625 > 192.168.3.3.33444: UDP, length 32
15:59:51.237754 IP 192.168.3.3 > 192.168.2.103: ICMP 192.168.3.3 udp port 33442 unreachable, length 68
15:59:51.237806 IP 192.168.3.3 > 192.168.2.103: ICMP 192.168.3.3 udp port 33449 unreachable, length 68
15:59:51.237845 IP 192.168.3.3 > 192.168.2.103: ICMP 192.168.3.3 udp port 33446 unreachable, length 68
15:59:51.238003 IP 192.168.2.103.51776 > 192.168.3.3.33440: UDP, length 32
15:59:51.544872 ARP, Request who-has 192.168.3.1 tell 192.168.3.2, length 28
15:59:51.544879 ARP, Reply 192.168.3.1 is-at f6:49:cb:82:00:b1 (oui Unknown), length 28
15:59:51.578109 IP 192.168.3.101 > 192.168.2.2: ICMP echo request, id 4005, seq 1, length 64
15:59:51.578176 IP 192.168.2.2 > 192.168.3.101: ICMP echo reply, id 4005, seq 1, length 64
15:59:51.592992 IP 192.168.2.101 > 192.168.3.2: ICMP echo request, id 4017, seq 1, length 64
15:59:51.593050 IP 192.168.3.2 > 192.168.2.101: ICMP echo reply, id 4017, seq 1, length 64
15:59:51.594035 IP 192.168.3.101 > 192.168.2.101: ICMP echo request, id 4020, seq 1, length 64
15:59:51.594084 IP 192.168.2.101 > 192.168.3.101: ICMP echo reply, id 4020, seq 1, length 64
15:59:51.598008 IP 192.168.2.101 > 192.168.3.3: ICMP echo request, id 4026, seq 1, length 64
15:59:51.598059 IP 192.168.3.3 > 192.168.2.101: ICMP echo reply, id 4026, seq 1, length 64
15:59:51.603247 IP 192.168.3.101 > 192.168.2.3: ICMP echo request, id 4032, seq 1, length 64
15:59:51.603310 IP 192.168.2.3 > 192.168.3.101: ICMP echo reply, id 4032, seq 1, length 64
15:59:51.610893 IP 192.168.3.101 > 192.168.2.103: ICMP echo request, id 4035, seq 1, length 64
15:59:51.610953 IP 192.168.2.103 > 192.168.3.101: ICMP echo reply, id 4035, seq 1, length 64
15:59:51.614872 IP 192.168.3.101 > 192.168.5.2: ICMP echo request, id 4044, seq 1, length 64
15:59:51.614880 IP 192.168.5.2 > 192.168.3.101: ICMP echo reply, id 4044, seq 1, length 64
15:59:51.621452 IP 192.168.2.101 > 192.168.3.101: ICMP echo request, id 4047, seq 1, length 64
15:59:51.621530 IP 192.168.3.101 > 192.168.2.101: ICMP echo reply, id 4047, seq 1, length 64
15:59:51.625513 IP 192.168.3.101 > 192.168.3.1: ICMP echo request, id 4053, seq 1, length 64
15:59:51.625522 IP 192.168.3.1 > 192.168.3.101: ICMP echo reply, id 4053, seq 1, length 64
15:59:51.631669 IP 192.168.2.101 > 192.168.3.103: ICMP echo request, id 4062, seq 1, length 64
15:59:51.631773 IP 192.168.3.103 > 192.168.2.101: ICMP echo reply, id 4062, seq 1, length 64
15:59:56.631259 IP 192.168.3.101 > 192.168.2.2: ICMP echo request, id 4093, seq 1, length 64
15:59:56.631419 IP 192.168.2.2 > 192.168.3.101: ICMP echo reply, id 4093, seq 1, length 64
15:59:56.640612 IP 192.168.3.101 > 192.168.2.101: ICMP echo request, id 4105, seq 1, length 64
15:59:56.640673 IP 192.168.2.101 > 192.168.3.101: ICMP echo reply, id 4105, seq 1, length 64
15:59:56.645472 IP 192.168.2.101 > 192.168.3.2: ICMP echo request, id 4111, seq 1, length 64
15:59:56.645523 IP 192.168.3.2 > 192.168.2.101: ICMP echo reply, id 4111, seq 1, length 64
