19:29:11.353234 ARP, Request who-has 12.10.5.103 tell 12.10.5.101, length 28
19:29:11.365759 IP 12.10.5.101 > 192.168.3.1: ICMP echo request, id 20972, seq 1, length 64
19:29:12.378172 IP 12.10.5.101 > 192.168.3.103: ICMP echo request, id 20997, seq 1, length 64
19:29:13.399519 IP 12.10.5.101 > 192.168.5.1: ICMP echo request, id 21009, seq 1, length 64
19:29:14.413636 IP 12.10.5.101 > 192.168.1.103: ICMP echo request, id 21021, seq 1, length 64
19:29:15.423843 IP 12.10.5.101 > 12.10.5.1: ICMP echo request, id 21033, seq 1, length 64
19:29:16.437714 IP 12.10.5.101 > 192.168.4.2: ICMP echo request, id 21048, seq 1, length 64
19:29:17.450326 IP 12.10.5.101 > 192.168.1.1: ICMP echo request, id 21086, seq 1, length 64
19:29:18.462830 IP 12.10.5.101 > 192.168.4.1: ICMP echo request, id 21113, seq 1, length 64
19:29:19.475962 IP 12.10.5.101 > 192.168.2.103: ICMP echo request, id 21121, seq 1, length 64
19:29:20.486177 IP 12.10.5.101 > 192.168.5.2: ICMP echo request, id 21180, seq 1, length 64
19:29:22.492106 ARP, Request who-has 12.10.5.3 tell 12.10.5.2, length 28
19:29:22.504280 ARP, Request who-has 12.10.5.1 tell 12.10.5.2, length 28
19:29:22.504319 ARP, Reply 12.10.5.1 is-at b6:2d:37:7f:ba:8e (oui Unknown), length 28
19:29:22.507286 IP 12.10.5.2 > 192.168.1.2: ICMP echo request, id 21188, seq 1, length 64
19:29:26.509088 IP 12.10.5.101 > 192.168.2.1: ICMP echo request, id 21237, seq 1, length 64
19:29:27.528236 IP 12.10.5.101 > 192.168.3.1: ICMP echo request, id 21252, seq 1, length 64
19:29:28.537947 IP 12.10.5.101 > 192.168.3.103: ICMP echo request, id 21264, seq 1, length 64
19:29:29.548119 IP 12.10.5.101 > 192.168.5.1: ICMP echo request, id 21278, seq 1, length 64
19:29:30.558162 IP 12.10.5.101 > 192.168.1.103: ICMP echo request, id 21312, seq 1, length 64
19:29:31.568191 IP 12.10.5.101 > 12.10.5.1: ICMP echo request, id 21324, seq 1, length 64
19:29:32.514256 IP 12.10.5.2 > 192.168.1.3: ICMP echo request, id 21330, seq 1, length 64
19:29:32.578021 IP 12.10.5.101 > 192.168.4.2: ICMP echo request, id 21331, seq 1, length 64
19:29:33.593542 IP 12.10.5.101 > 192.168.1.1: ICMP echo request, id 21337, seq 1, length 64
19:29:34.605388 IP 12.10.5.101 > 192.168.4.1: ICMP echo request, id 21346, seq 1, length 64
19:29:35.615141 IP 12.10.5.101 > 192.168.2.103: ICMP echo request, id 21361, seq 1, length 64
19:29:36.626111 IP 12.10.5.101 > 192.168.5.2: ICMP echo request, id 21382, seq 1, length 64
19:29:37.649225 ARP, Request who-has 12.10.5.2 tell 12.10.5.101, length 28

19:29:42.521306 IP 12.10.5.2 > 192.168.2.2: ICMP echo request, id 21474, seq 1, length 64
19:29:42.673499 IP 12.10.5.101 > 192.168.2.1: ICMP echo request, id 21475, seq 1, length 64
19:29:43.693880 IP 12.10.5.101 > 192.168.3.1: ICMP echo request, id 21484, seq 1, length 64
19:29:44.704477 IP 12.10.5.101 > 192.168.3.103: ICMP echo request, id 21493, seq 1, length 64
19:29:45.401895 ARP, Request who-has 12.10.5.1 tell 12.10.5.103, length 28
19:29:45.401917 ARP, Reply 12.10.5.1 is-at b6:2d:37:7f:ba:8e (oui Unknown), length 28
19:29:45.416922 IP 12.10.5.103.41817 > 12.10.5.1.33451: UDP, length 32
19:29:45.416982 IP 12.10.5.103.38743 > 12.10.5.1.33461: UDP, length 32
19:29:45.417012 IP 12.10.5.103.39067 > 12.10.5.1.33458: UDP, length 32
19:29:45.417040 IP 12.10.5.103.44803 > 12.10.5.1.33463: UDP, length 32
19:29:45.423471 IP 12.10.5.103.48693 > 12.10.5.1.33456: UDP, length 32
19:29:45.423646 IP 12.10.5.103.47126 > 12.10.5.1.33460: UDP, length 32
19:29:45.423747 IP 12.10.5.103.36456 > 12.10.5.1.33453: UDP, length 32
19:29:45.423781 IP 12.10.5.103.34792 > 12.10.5.1.33457: UDP, length 32
19:29:45.423810 IP 12.10.5.103.38405 > 12.10.5.1.33459: UDP, length 32
19:29:45.423836 IP 12.10.5.103.53701 > 12.10.5.1.33462: UDP, length 32
19:29:45.423863 IP 12.10.5.103.42284 > 12.10.5.1.33455: UDP, length 32
19:29:45.423888 IP 12.10.5.103.41916 > 12.10.5.1.33454: UDP, length 32
19:29:45.423937 IP 12.10.5.103.39931 > 12.10.5.1.33452: UDP, length 32
19:29:45.426836 IP 12.10.5.103.38351 > 12.10.5.1.33464: UDP, length 32
19:29:45.426884 IP 12.10.5.103.45994 > 12.10.5.1.33465: UDP, length 32
19:29:45.426934 IP 12.10.5.103.45760 > 12.10.5.1.33450: UDP, length 32
19:29:45.713994 IP 12.10.5.101 > 192.168.5.1: ICMP echo request, id 21505, seq 1, length 64
19:29:46.724290 IP 12.10.5.101 > 192.168.1.103: ICMP echo request, id 21511, seq 1, length 64
19:29:47.690092 ARP, Request who-has 12.10.5.1 tell 12.10.5.101, length 28
19:29:47.690113 ARP, Reply 12.10.5.1 is-at b6:2d:37:7f:ba:8e (oui Unknown), length 28
19:29:47.734795 IP 12.10.5.101 > 12.10.5.1: ICMP echo request, id 21529, seq 1, length 64
19:29:48.744737 IP 12.10.5.101 > 192.168.4.2: ICMP echo request, id 21552, seq 1, length 64
19:29:49.754817 IP 12.10.5.101 > 192.168.1.1: ICMP echo request, id 21563, seq 1, length 64
19:29:50.421138 IP 12.10.5.103.52240 > 12.10.5.1.33467: UDP, length 32
19:29:50.421347 IP 12.10.5.103.43996 > 12.10.5.1.33472: UDP, length 32
19:29:50.425773 IP 12.10.5.103.46830 > 12.10.5.1.33475: UDP, length 32
19:29:50.425830 IP 12.10.5.103.36540 > 12.10.5.1.33476: UDP, length 32
19:29:50.425860 IP 12.10.5.103.39240 > 12.10.5.1.33480: UDP, length 32
19:29:50.425886 IP 12.10.5.103.56505 > 12.10.5.1.33470: UDP, length 32
19:29:50.425912 IP 12.10.5.103.44286 > 12.10.5.1.33481: UDP, length 32
19:29:50.425937 IP 12.10.5.103.58115 > 12.10.5.1.33466: UDP, length 32
19:29:50.425963 IP 12.10.5.103.60460 > 12.10.5.1.33474: UDP, length 32
19:29:50.429545 IP 12.10.5.103.46580 > 12.10.5.1.33478: UDP, length 32
19:29:50.429670 IP 12.10.5.103.50360 > 12.10.5.1.33471: UDP, length 32
19:29:50.429712 IP 12.10.5.103.59230 > 12.10.5.1.33479: UDP, length 32
19:29:50.429739 IP 12.10.5.103.47410 > 12.10.5.1.33473: UDP, length 32
19:29:50.429764 IP 12.10.5.103.35656 > 12.10.5.1.33468: UDP, length 32
19:29:50.429789 IP 12.10.5.103.54681 > 12.10.5.1.33469: UDP, length 32
19:29:50.431746 IP 12.10.5.103.46023 > 12.10.5.1.33477: UDP, length 32
19:29:50.762609 IP 12.10.5.101 > 192.168.4.1: ICMP echo request, id 21572, seq 1, length 64
19:29:51.775077 IP 12.10.5.101 > 192.168.2.103: ICMP echo request, id 21599, seq 1, length 64
19:29:52.528189 IP 12.10.5.2 > 192.168.2.3: ICMP echo request, id 21602, seq 1, length 64
19:29:52.785515 IP 12.10.5.101 > 192.168.5.2: ICMP echo request, id 21603, seq 1, length 64
19:29:55.428541 IP 12.10.5.103.49784 > 12.10.5.1.33492: UDP, length 32
19:29:55.428603 IP 12.10.5.103.40083 > 12.10.5.1.33485: UDP, length 32
19:29:55.432073 IP 12.10.5.103.45887 > 12.10.5.1.33489: UDP, length 32
19:29:55.432132 IP 12.10.5.103.60524 > 12.10.5.1.33497: UDP, length 32
19:29:55.433136 IP 12.10.5.103.32977 > 12.10.5.1.33494: UDP, length 32
19:29:55.433315 IP 12.10.5.103.42812 > 12.10.5.1.33488: UDP, length 32
19:29:55.433352 IP 12.10.5.103.35042 > 12.10.5.1.33495: UDP, length 32
19:29:55.433379 IP 12.10.5.103.52108 > 12.10.5.1.33486: UDP, length 32
19:29:55.433407 IP 12.10.5.103.54832 > 12.10.5.1.33484: UDP, length 32
19:29:55.437098 IP 12.10.5.103.40121 > 12.10.5.1.33491: UDP, length 32
19:29:55.437235 IP 12.10.5.103.40866 > 12.10.5.1.33490: UDP, length 32
19:29:55.437274 IP 12.10.5.103.44405 > 12.10.5.1.33482: UDP, length 32
19:29:55.437301 IP 12.10.5.103.43493 > 12.10.5.1.33483: UDP, length 32
19:29:55.437326 IP 12.10.5.103.43056 > 12.10.5.1.33493: UDP, length 32
19:29:55.437352 IP 12.10.5.103.39886 > 12.10.5.1.33496: UDP, length 32
19:29:55.439049 IP 12.10.5.103.54091 > 12.10.5.1.33487: UDP, length 32
19:29:58.818136 IP 12.10.5.101 > 192.168.2.1: ICMP echo request, id 21741, seq 1, length 64
19:29:59.830056 IP 12.10.5.101 > 192.168.3.1: ICMP echo request, id 21749, seq 1, length 64
19:30:00.437475 IP 12.10.5.103.46797 > 12.10.5.1.33503: UDP, length 32
19:30:00.437536 IP 12.10.5.103.54818 > 12.10.5.1.33511: UDP, length 32
19:30:00.437565 IP 12.10.5.103.32935 > 12.10.5.1.33502: UDP, length 32
19:30:00.437592 IP 12.10.5.103.48210 > 12.10.5.1.33501: UDP, length 32
19:30:00.437619 IP 12.10.5.103.47098 > 12.10.5.1.33500: UDP, length 32
19:30:00.444024 IP 12.10.5.103.54117 > 12.10.5.1.33513: UDP, length 32
19:30:00.444159 IP 12.10.5.103.49512 > 12.10.5.1.33509: UDP, length 32
19:30:00.444244 IP 12.10.5.103.55471 > 12.10.5.1.33505: UDP, length 32
19:30:00.444280 IP 12.10.5.103.40303 > 12.10.5.1.33507: UDP, length 32
19:30:00.444308 IP 12.10.5.103.42075 > 12.10.5.1.33498: UDP, length 32
19:30:00.444334 IP 12.10.5.103.35162 > 12.10.5.1.33499: UDP, length 32
19:30:00.444360 IP 12.10.5.103.34231 > 12.10.5.1.33504: UDP, length 32
19:30:00.444386 IP 12.10.5.103.58410 > 12.10.5.1.33508: UDP, length 32
19:30:00.444433 IP 12.10.5.103.57182 > 12.10.5.1.33506: UDP, length 32
19:30:00.447143 IP 12.10.5.103.52535 > 12.10.5.1.33510: UDP, length 32
19:30:00.447370 IP 12.10.5.103.40306 > 12.10.5.1.33512: UDP, length 32
19:30:00.839777 IP 12.10.5.101 > 192.168.5.1: ICMP echo request, id 21752, seq 1, length 64
19:30:01.852597 IP 12.10.5.101 > 12.10.5.1: ICMP echo request, id 21755, seq 1, length 64
19:30:02.535781 IP 12.10.5.2 > 192.168.3.2: ICMP echo request, id 21758, seq 1, length 64
19:30:02.862868 IP 12.10.5.101 > 192.168.1.1: ICMP echo request, id 21759, seq 1, length 64
19:30:03.874248 IP 12.10.5.101 > 192.168.2.103: ICMP echo request, id 21796, seq 1, length 64
19:30:05.439760 IP 12.10.5.103.44730 > 12.10.5.1.33523: UDP, length 32
19:30:05.441903 IP 12.10.5.103.38288 > 12.10.5.1.33522: UDP, length 32
19:30:05.442008 IP 12.10.5.103.51236 > 12.10.5.1.33515: UDP, length 32
19:30:05.445906 IP 12.10.5.103.36129 > 12.10.5.1.33519: UDP, length 32
19:30:05.445982 IP 12.10.5.103.48429 > 12.10.5.1.33521: UDP, length 32
19:30:05.446016 IP 12.10.5.103.49012 > 12.10.5.1.33520: UDP, length 32
19:30:05.449119 IP 12.10.5.103.49309 > 12.10.5.1.33517: UDP, length 32
19:30:05.449173 IP 12.10.5.103.55568 > 12.10.5.1.33518: UDP, length 32
19:30:05.449202 IP 12.10.5.103.39787 > 12.10.5.1.33516: UDP, length 32
19:30:05.449229 IP 12.10.5.103.38855 > 12.10.5.1.33514: UDP, length 32
19:30:07.546951 ARP, Request who-has 12.10.5.1 tell 12.10.5.2, length 28
19:30:07.546973 ARP, Reply 12.10.5.1 is-at b6:2d:37:7f:ba:8e (oui Unknown), length 28

19:30:10.930874 IP 12.10.5.101 > 192.168.4.2: ICMP echo request, id 21954, seq 1, length 64
19:30:11.943428 IP 12.10.5.101 > 192.168.5.2: ICMP echo request, id 21960, seq 1, length 64
19:30:12.542829 IP 12.10.5.2 > 192.168.3.3: ICMP echo request, id 21975, seq 1, length 64
19:30:15.488075 IP 12.10.5.103.40275 > 192.168.4.2.33455: UDP, length 32
19:30:15.488140 IP 12.10.5.103.33073 > 192.168.4.2.33464: UDP, length 32
19:30:15.488171 IP 12.10.5.103.45318 > 192.168.4.2.33452: UDP, length 32
19:30:15.488260 IP 12.10.5.103.54686 > 192.168.4.2.33450: UDP, length 32
19:30:15.491765 IP 12.10.5.103.48881 > 192.168.4.2.33457: UDP, length 32
19:30:15.491828 IP 12.10.5.103.43893 > 192.168.4.2.33451: UDP, length 32
19:30:15.491862 IP 12.10.5.103.33742 > 192.168.4.2.33458: UDP, length 32
19:30:15.496326 IP 12.10.5.103.45756 > 192.168.4.2.33460: UDP, length 32
19:30:15.496375 IP 12.10.5.103.45065 > 192.168.4.2.33454: UDP, length 32
19:30:15.496405 IP 12.10.5.103.57004 > 192.168.4.2.33453: UDP, length 32
19:30:15.496433 IP 12.10.5.103.59615 > 192.168.4.2.33463: UDP, length 32
19:30:15.496459 IP 12.10.5.103.44349 > 192.168.4.2.33461: UDP, length 32
19:30:15.496485 IP 12.10.5.103.55593 > 192.168.4.2.33462: UDP, length 32
19:30:15.496510 IP 12.10.5.103.44794 > 192.168.4.2.33459: UDP, length 32
19:30:15.496536 IP 12.10.5.103.44914 > 192.168.4.2.33456: UDP, length 32
19:30:15.496562 IP 12.10.5.103.41772 > 192.168.4.2.33465: UDP, length 32
19:30:17.979470 IP 12.10.5.101 > 192.168.1.103: ICMP echo request, id 22039, seq 1, length 64
19:30:20.491573 IP 12.10.5.103.56933 > 192.168.4.2.33480: UDP, length 32
19:30:20.491631 IP 12.10.5.103.53941 > 192.168.4.2.33478: UDP, length 32
19:30:20.491661 IP 12.10.5.103.57969 > 192.168.4.2.33474: UDP, length 32
19:30:20.491687 IP 12.10.5.103.43817 > 192.168.4.2.33477: UDP, length 32
19:30:20.491711 IP 12.10.5.103.35197 > 192.168.4.2.33473: UDP, length 32
19:30:20.491738 IP 12.10.5.103.58283 > 192.168.4.2.33471: UDP, length 32
19:30:20.498427 IP 12.10.5.103.47400 > 192.168.4.2.33469: UDP, length 32
19:30:20.498483 IP 12.10.5.103.56208 > 192.168.4.2.33470: UDP, length 32
19:30:20.498514 IP 12.10.5.103.40416 > 192.168.4.2.33468: UDP, length 32
19:30:20.498541 IP 12.10.5.103.59830 > 192.168.4.2.33466: UDP, length 32
19:30:20.498568 IP 12.10.5.103.60880 > 192.168.4.2.33475: UDP, length 32
19:30:20.498595 IP 12.10.5.103.40331 > 192.168.4.2.33472: UDP, length 32
19:30:20.498622 IP 12.10.5.103.51206 > 192.168.4.2.33481: UDP, length 32
19:30:20.498648 IP 12.10.5.103.51983 > 192.168.4.2.33476: UDP, length 32
19:30:20.498693 IP 12.10.5.103.41210 > 192.168.4.2.33479: UDP, length 32
19:30:20.500940 IP 12.10.5.103.42383 > 192.168.4.2.33467: UDP, length 32
19:30:22.560671 ARP, Request who-has 12.10.5.1 tell 12.10.5.3, length 28
19:30:22.560717 ARP, Reply 12.10.5.1 is-at b6:2d:37:7f:ba:8e (oui Unknown), length 28
19:30:22.564498 IP 12.10.5.3 > 192.168.1.2: ICMP echo request, id 22108, seq 1, length 64
19:30:22.984546 ARP, Request who-has 12.10.5.1 tell 12.10.5.101, length 28
19:30:22.984559 ARP, Reply 12.10.5.1 is-at b6:2d:37:7f:ba:8e (oui Unknown), length 28
19:30:24.046808 IP 12.10.5.101 > 192.168.4.1: ICMP echo request, id 22113, seq 1, length 64
19:30:25.494650 IP 12.10.5.103.42418 > 192.168.4.2.33482: UDP, length 32
19:30:25.499542 IP 12.10.5.103.49841 > 192.168.4.2.33488: UDP, length 32
19:30:25.502362 IP 12.10.5.103.47523 > 192.168.4.2.33489: UDP, length 32
19:30:25.502427 IP 12.10.5.103.54395 > 192.168.4.2.33495: UDP, length 32
19:30:25.502460 IP 12.10.5.103.58952 > 192.168.4.2.33491: UDP, length 32
19:30:25.502507 IP 12.10.5.103.54065 > 192.168.4.2.33483: UDP, length 32
19:30:25.505990 IP 12.10.5.103.56363 > 192.168.4.2.33490: UDP, length 32
19:30:25.506044 IP 12.10.5.103.35131 > 192.168.4.2.33494: UDP, length 32
19:30:25.506073 IP 12.10.5.103.59993 > 192.168.4.2.33486: UDP, length 32
19:30:25.506099 IP 12.10.5.103.58697 > 192.168.4.2.33485: UDP, length 32
19:30:25.506124 IP 12.10.5.103.55786 > 192.168.4.2.33493: UDP, length 32
19:30:25.506168 IP 12.10.5.103.51076 > 192.168.4.2.33492: UDP, length 32
19:30:25.508938 IP 12.10.5.103.43330 > 192.168.4.2.33487: UDP, length 32
19:30:25.508994 IP 12.10.5.103.59092 > 192.168.4.2.33484: UDP, length 32
19:30:25.509024 IP 12.10.5.103.44150 > 192.168.4.2.33497: UDP, length 32
19:30:25.509069 IP 12.10.5.103.53208 > 192.168.4.2.33496: UDP, length 32
19:30:30.102347 ARP, Request who-has 12.10.5.3 tell 12.10.5.101, length 28
19:30:30.504673 ARP, Request who-has 12.10.5.1 tell 12.10.5.103, length 28
19:30:30.504692 ARP, Reply 12.10.5.1 is-at b6:2d:37:7f:ba:8e (oui Unknown), length 28
19:30:30.513971 IP 12.10.5.103.60273 > 192.168.4.2.33507: UDP, length 32
19:30:30.514029 IP 12.10.5.103.51060 > 192.168.4.2.33504: UDP, length 32
19:30:30.514060 IP 12.10.5.103.44092 > 192.168.4.2.33506: UDP, length 32
19:30:30.514087 IP 12.10.5.103.41581 > 192.168.4.2.33499: UDP, length 32
19:30:30.514115 IP 12.10.5.103.34076 > 192.168.4.2.33500: UDP, length 32
19:30:30.519725 IP 12.10.5.103.33468 > 192.168.4.2.33508: UDP, length 32
19:30:30.519932 IP 12.10.5.103.50665 > 192.168.4.2.33512: UDP, length 32
19:30:30.519988 IP 12.10.5.103.43838 > 192.168.4.2.33498: UDP, length 32
19:30:30.520069 IP 12.10.5.103.50812 > 192.168.4.2.33509: UDP, length 32
19:30:30.520114 IP 12.10.5.103.33004 > 192.168.4.2.33510: UDP, length 32
19:30:30.520142 IP 12.10.5.103.50148 > 192.168.4.2.33502: UDP, length 32
19:30:30.520169 IP 12.10.5.103.54313 > 192.168.4.2.33501: UDP, length 32
19:30:30.520194 IP 12.10.5.103.51353 > 192.168.4.2.33513: UDP, length 32
19:30:30.520219 IP 12.10.5.103.40541 > 192.168.4.2.33505: UDP, length 32
19:30:30.520244 IP 12.10.5.103.50156 > 192.168.4.2.33503: UDP, length 32
19:30:30.520434 IP 12.10.5.103.52811 > 192.168.4.2.33511: UDP, length 32
19:30:32.570903 IP 12.10.5.3 > 192.168.1.3: ICMP echo request, id 22248, seq 1, length 64
19:30:35.514273 IP 12.10.5.103.60384 > 192.168.4.2.33514: UDP, length 32
19:30:35.516914 IP 12.10.5.103.60504 > 192.168.4.2.33515: UDP, length 32
19:30:35.519743 IP 12.10.5.103.57319 > 192.168.4.2.33518: UDP, length 32
19:30:35.519798 IP 12.10.5.103.34342 > 192.168.4.2.33523: UDP, length 32
19:30:35.519829 IP 12.10.5.103.51231 > 192.168.4.2.33516: UDP, length 32
19:30:35.519958 IP 12.10.5.103.38095 > 192.168.4.2.33519: UDP, length 32
19:30:35.522486 IP 12.10.5.103.59540 > 192.168.4.2.33517: UDP, length 32
19:30:35.522534 IP 12.10.5.103.35470 > 192.168.4.2.33520: UDP, length 32
19:30:35.522563 IP 12.10.5.103.51458 > 192.168.4.2.33522: UDP, length 32
19:30:35.522608 IP 12.10.5.103.60567 > 192.168.4.2.33521: UDP, length 32

19:30:40.547351 IP 12.10.5.103.33821 > 192.168.5.2.33434: UDP, length 32
19:30:40.554615 IP 12.10.5.103.50876 > 192.168.5.2.33448: UDP, length 32
19:30:40.556536 IP 12.10.5.103.49871 > 192.168.5.2.33447: UDP, length 32
19:30:40.557988 IP 12.10.5.103.54743 > 192.168.5.2.33445: UDP, length 32
19:30:40.560970 IP 12.10.5.103.38391 > 192.168.5.2.33443: UDP, length 32
19:30:40.561027 IP 12.10.5.103.39939 > 192.168.5.2.33441: UDP, length 32
19:30:40.561057 IP 12.10.5.103.47552 > 192.168.5.2.33444: UDP, length 32
19:30:40.561096 IP 12.10.5.103.56405 > 192.168.5.2.33436: UDP, length 32
19:30:40.564594 IP 12.10.5.103.41172 > 192.168.5.2.33449: UDP, length 32
19:30:40.564655 IP 12.10.5.103.41671 > 192.168.5.2.33446: UDP, length 32
19:30:40.564863 IP 12.10.5.103.36175 > 192.168.5.2.33440: UDP, length 32
19:30:40.564908 IP 12.10.5.103.49423 > 192.168.5.2.33442: UDP, length 32
19:30:40.564936 IP 12.10.5.103.45792 > 192.168.5.2.33435: UDP, length 32
19:30:40.565003 IP 12.10.5.103.38276 > 192.168.5.2.33438: UDP, length 32
19:30:40.568553 IP 12.10.5.103.58254 > 192.168.5.2.33437: UDP, length 32
19:30:40.571537 IP 12.10.5.103.56049 > 192.168.5.2.33439: UDP, length 32
19:30:42.582983 IP 12.10.5.3 > 192.168.2.2: ICMP echo request, id 22422, seq 1, length 64
19:30:45.561465 IP 12.10.5.103.39030 > 192.168.5.2.33450: UDP, length 32
19:30:45.565549 IP 12.10.5.103.37091 > 192.168.5.2.33463: UDP, length 32
19:30:45.567614 IP 12.10.5.103.41870 > 192.168.5.2.33453: UDP, length 32
19:30:45.567690 IP 12.10.5.103.46784 > 192.168.5.2.33454: UDP, length 32
19:30:45.570377 IP 12.10.5.103.44830 > 192.168.5.2.33458: UDP, length 32
19:30:45.570433 IP 12.10.5.103.38720 > 192.168.5.2.33452: UDP, length 32
19:30:45.570466 IP 12.10.5.103.58176 > 192.168.5.2.33465: UDP, length 32
19:30:45.570512 IP 12.10.5.103.38522 > 192.168.5.2.33460: UDP, length 32
19:30:45.574097 IP 12.10.5.103.44255 > 192.168.5.2.33455: UDP, length 32
19:30:45.574156 IP 12.10.5.103.42366 > 192.168.5.2.33457: UDP, length 32
19:30:45.574186 IP 12.10.5.103.46311 > 192.168.5.2.33451: UDP, length 32
19:30:45.574287 IP 12.10.5.103.52716 > 192.168.5.2.33461: UDP, length 32
19:30:45.574322 IP 12.10.5.103.48814 > 192.168.5.2.33456: UDP, length 32
19:30:45.574371 IP 12.10.5.103.38894 > 192.168.5.2.33464: UDP, length 32
19:30:45.576590 IP 12.10.5.103.50802 > 192.168.5.2.33459: UDP, length 32
19:30:45.576666 IP 12.10.5.103.44395 > 192.168.5.2.33462: UDP, length 32
19:30:50.576399 IP 12.10.5.103.37813 > 192.168.5.2.33466: UDP, length 32
19:30:50.580603 IP 12.10.5.103.48386 > 192.168.5.2.33467: UDP, length 32
19:30:50.582598 IP 12.10.5.103.53100 > 192.168.5.2.33470: UDP, length 32
19:30:50.582670 IP 12.10.5.103.44995 > 192.168.5.2.33472: UDP, length 32
19:30:50.585680 IP 12.10.5.103.32888 > 192.168.5.2.33476: UDP, length 32
19:30:50.585735 IP 12.10.5.103.60497 > 192.168.5.2.33468: UDP, length 32
19:30:50.586675 IP 12.10.5.103.37261 > 192.168.5.2.33473: UDP, length 32
19:30:50.586722 IP 12.10.5.103.58562 > 192.168.5.2.33475: UDP, length 32
19:30:50.586802 IP 12.10.5.103.60917 > 192.168.5.2.33481: UDP, length 32
19:30:50.586847 IP 12.10.5.103.50553 > 192.168.5.2.33469: UDP, length 32
19:30:50.586875 IP 12.10.5.103.39372 > 192.168.5.2.33479: UDP, length 32
19:30:50.589880 IP 12.10.5.103.54044 > 192.168.5.2.33480: UDP, length 32
19:30:50.589934 IP 12.10.5.103.57197 > 192.168.5.2.33478: UDP, length 32
19:30:50.589963 IP 12.10.5.103.55848 > 192.168.5.2.33477: UDP, length 32
19:30:50.589989 IP 12.10.5.103.48389 > 192.168.5.2.33471: UDP, length 32
19:30:50.590033 IP 12.10.5.103.58317 > 192.168.5.2.33474: UDP, length 32
19:30:52.603129 IP 12.10.5.3 > 192.168.2.3: ICMP echo request, id 22616, seq 1, length 64
19:30:55.591892 IP 12.10.5.103.59645 > 192.168.5.2.33482: UDP, length 32
19:30:55.596718 IP 12.10.5.103.43226 > 192.168.5.2.33483: UDP, length 32
19:30:55.596877 IP 12.10.5.103.38898 > 192.168.5.2.33495: UDP, length 32
19:30:55.601106 IP 12.10.5.103.56381 > 192.168.5.2.33494: UDP, length 32
19:30:55.601180 IP 12.10.5.103.32908 > 192.168.5.2.33485: UDP, length 32
19:30:55.601277 IP 12.10.5.103.44285 > 192.168.5.2.33490: UDP, length 32
19:30:55.601316 IP 12.10.5.103.58530 > 192.168.5.2.33484: UDP, length 32
19:30:55.601345 IP 12.10.5.103.33405 > 192.168.5.2.33489: UDP, length 32
19:30:55.601391 IP 12.10.5.103.52034 > 192.168.5.2.33491: UDP, length 32
19:30:55.604635 IP 12.10.5.103.39802 > 192.168.5.2.33497: UDP, length 32
19:30:55.608407 IP 12.10.5.103.33808 > 192.168.5.2.33496: UDP, length 32
19:30:55.611614 IP 12.10.5.103.38461 > 192.168.5.2.33487: UDP, length 32
19:30:55.615915 IP 12.10.5.103.56087 > 192.168.5.2.33488: UDP, length 32
19:30:55.619384 IP 12.10.5.103.46065 > 192.168.5.2.33492: UDP, length 32
19:30:55.622566 IP 12.10.5.103.49377 > 192.168.5.2.33486: UDP, length 32
19:30:55.630776 IP 12.10.5.103.35716 > 192.168.5.2.33493: UDP, length 32
19:31:00.607055 IP 12.10.5.103.58304 > 192.168.5.2.33498: UDP, length 32
19:31:00.612074 IP 12.10.5.103.40786 > 192.168.5.2.33499: UDP, length 32
19:31:00.613655 IP 12.10.5.103.37453 > 192.168.5.2.33500: UDP, length 32
19:31:00.613764 IP 12.10.5.103.47741 > 192.168.5.2.33513: UDP, length 32
19:31:00.616973 IP 12.10.5.103.50152 > 192.168.5.2.33506: UDP, length 32
19:31:00.617024 IP 12.10.5.103.38962 > 192.168.5.2.33510: UDP, length 32
19:31:00.617054 IP 12.10.5.103.46451 > 192.168.5.2.33501: UDP, length 32
19:31:00.617080 IP 12.10.5.103.52606 > 192.168.5.2.33504: UDP, length 32
19:31:00.617127 IP 12.10.5.103.37133 > 192.168.5.2.33505: UDP, length 32
19:31:00.620820 IP 12.10.5.103.41566 > 192.168.5.2.33502: UDP, length 32
19:31:00.620882 IP 12.10.5.103.46478 > 192.168.5.2.33512: UDP, length 32
19:31:00.620913 IP 12.10.5.103.38612 > 192.168.5.2.33509: UDP, length 32
19:31:00.620940 IP 12.10.5.103.37546 > 192.168.5.2.33503: UDP, length 32
19:31:00.620987 IP 12.10.5.103.48331 > 192.168.5.2.33508: UDP, length 32
19:31:00.622838 IP 12.10.5.103.39447 > 192.168.5.2.33511: UDP, length 32
19:31:00.622910 IP 12.10.5.103.55736 > 192.168.5.2.33507: UDP, length 32
19:31:02.615193 IP 12.10.5.3 > 192.168.3.2: ICMP echo request, id 22789, seq 1, length 64
19:31:05.624018 IP 12.10.5.103.58083 > 192.168.5.2.33514: UDP, length 32
19:31:05.628537 IP 12.10.5.103.47575 > 192.168.5.2.33515: UDP, length 32
19:31:05.630477 IP 12.10.5.103.41499 > 192.168.5.2.33516: UDP, length 32
19:31:05.630550 IP 12.10.5.103.37961 > 192.168.5.2.33523: UDP, length 32
19:31:05.634134 IP 12.10.5.103.59384 > 192.168.5.2.33521: UDP, length 32
19:31:05.634294 IP 12.10.5.103.50189 > 192.168.5.2.33520: UDP, length 32
19:31:05.634356 IP 12.10.5.103.47414 > 192.168.5.2.33519: UDP, length 32
19:31:05.634385 IP 12.10.5.103.53500 > 192.168.5.2.33517: UDP, length 32
19:31:05.634412 IP 12.10.5.103.53706 > 192.168.5.2.33522: UDP, length 32
19:31:05.634461 IP 12.10.5.103.49883 > 192.168.5.2.33518: UDP, length 32
19:31:07.626878 ARP, Request who-has 12.10.5.1 tell 12.10.5.3, length 28
19:31:07.626899 ARP, Reply 12.10.5.1 is-at b6:2d:37:7f:ba:8e (oui Unknown), length 28

19:31:10.670293 ARP, Request who-has 12.10.5.2 tell 12.10.5.103, length 28
19:31:12.623785 IP 12.10.5.3 > 192.168.3.3: ICMP echo request, id 22943, seq 1, length 64
19:31:15.698793 IP 12.10.5.103.58919 > 192.168.1.103.33442: UDP, length 32
19:31:15.698871 IP 12.10.5.103.39640 > 192.168.1.103.33437: UDP, length 32
19:31:15.702119 IP 12.10.5.103.42688 > 192.168.1.103.33440: UDP, length 32
19:31:15.702174 IP 12.10.5.103.39275 > 192.168.1.103.33434: UDP, length 32
19:31:15.702224 IP 12.10.5.103.42446 > 192.168.1.103.33438: UDP, length 32
19:31:15.702252 IP 12.10.5.103.59742 > 192.168.1.103.33439: UDP, length 32
19:31:15.702298 IP 12.10.5.103.50800 > 192.168.1.103.33441: UDP, length 32
19:31:15.705851 IP 12.10.5.103.45346 > 192.168.1.103.33436: UDP, length 32
19:31:15.705908 IP 12.10.5.103.38615 > 192.168.1.103.33435: UDP, length 32
19:31:15.706004 IP 12.10.5.103.34226 > 192.168.1.103.33446: UDP, length 32
19:31:15.710042 IP 12.10.5.103.55237 > 192.168.1.103.33445: UDP, length 32
19:31:15.710125 IP 12.10.5.103.51189 > 192.168.1.103.33444: UDP, length 32
19:31:15.710158 IP 12.10.5.103.33077 > 192.168.1.103.33449: UDP, length 32
19:31:15.710185 IP 12.10.5.103.37002 > 192.168.1.103.33448: UDP, length 32
19:31:15.710211 IP 12.10.5.103.38165 > 192.168.1.103.33447: UDP, length 32
19:31:15.710258 IP 12.10.5.103.56832 > 192.168.1.103.33443: UDP, length 32
19:31:20.696869 ARP, Request who-has 12.10.5.1 tell 12.10.5.103, length 28
19:31:20.696889 ARP, Reply 12.10.5.1 is-at b6:2d:37:7f:ba:8e (oui Unknown), length 28
19:31:20.721552 IP 12.10.5.103.57171 > 192.168.1.103.33454: UDP, length 32
19:31:20.721612 IP 12.10.5.103.39452 > 192.168.1.103.33465: UDP, length 32
19:31:20.721644 IP 12.10.5.103.58253 > 192.168.1.103.33459: UDP, length 32
19:31:20.721673 IP 12.10.5.103.44583 > 192.168.1.103.33460: UDP, length 32
19:31:20.727955 IP 12.10.5.103.34336 > 192.168.1.103.33463: UDP, length 32
19:31:20.728051 IP 12.10.5.103.36841 > 192.168.1.103.33450: UDP, length 32
19:31:20.728085 IP 12.10.5.103.59868 > 192.168.1.103.33451: UDP, length 32
19:31:20.728114 IP 12.10.5.103.51333 > 192.168.1.103.33462: UDP, length 32
19:31:20.728141 IP 12.10.5.103.59751 > 192.168.1.103.33457: UDP, length 32
19:31:20.728168 IP 12.10.5.103.36196 > 192.168.1.103.33453: UDP, length 32
19:31:20.728194 IP 12.10.5.103.50593 > 192.168.1.103.33452: UDP, length 32
19:31:20.728218 IP 12.10.5.103.44419 > 192.168.1.103.33458: UDP, length 32
19:31:20.728243 IP 12.10.5.103.51514 > 192.168.1.103.33456: UDP, length 32
19:31:20.728290 IP 12.10.5.103.47506 > 192.168.1.103.33461: UDP, length 32
19:31:20.730161 IP 12.10.5.103.51996 > 192.168.1.103.33455: UDP, length 32
19:31:20.730226 IP 12.10.5.103.58795 > 192.168.1.103.33464: UDP, length 32
19:31:25.725742 IP 12.10.5.103.50211 > 192.168.1.103.33477: UDP, length 32
19:31:25.729956 IP 12.10.5.103.38995 > 192.168.1.103.33474: UDP, length 32
19:31:25.730141 IP 12.10.5.103.36203 > 192.168.1.103.33475: UDP, length 32
19:31:25.730226 IP 12.10.5.103.58702 > 192.168.1.103.33481: UDP, length 32
19:31:25.730255 IP 12.10.5.103.33858 > 192.168.1.103.33471: UDP, length 32
19:31:25.730281 IP 12.10.5.103.38081 > 192.168.1.103.33467: UDP, length 32
19:31:25.730306 IP 12.10.5.103.51846 > 192.168.1.103.33478: UDP, length 32
19:31:25.730330 IP 12.10.5.103.34954 > 192.168.1.103.33472: UDP, length 32
19:31:25.730378 IP 12.10.5.103.49497 > 192.168.1.103.33480: UDP, length 32
19:31:25.732455 IP 12.10.5.103.54221 > 192.168.1.103.33473: UDP, length 32
19:31:25.733368 IP 12.10.5.103.56177 > 192.168.1.103.33470: UDP, length 32
19:31:25.733411 IP 12.10.5.103.42612 > 192.168.1.103.33479: UDP, length 32
19:31:25.733438 IP 12.10.5.103.35923 > 192.168.1.103.33468: UDP, length 32
19:31:25.733615 IP 12.10.5.103.36147 > 192.168.1.103.33469: UDP, length 32
19:31:25.734894 IP 12.10.5.103.57530 > 192.168.1.103.33476: UDP, length 32
19:31:25.735026 IP 12.10.5.103.58304 > 192.168.1.103.33466: UDP, length 32
19:31:30.734382 IP 12.10.5.103.35042 > 192.168.1.103.33491: UDP, length 32
19:31:30.734439 IP 12.10.5.103.56995 > 192.168.1.103.33489: UDP, length 32
19:31:30.734468 IP 12.10.5.103.55744 > 192.168.1.103.33492: UDP, length 32
19:31:30.734492 IP 12.10.5.103.50838 > 192.168.1.103.33486: UDP, length 32
19:31:30.734516 IP 12.10.5.103.47813 > 192.168.1.103.33483: UDP, length 32
19:31:30.734541 IP 12.10.5.103.59566 > 192.168.1.103.33482: UDP, length 32
19:31:30.737410 IP 12.10.5.103.36877 > 192.168.1.103.33487: UDP, length 32
19:31:30.737468 IP 12.10.5.103.55931 > 192.168.1.103.33490: UDP, length 32
19:31:30.737500 IP 12.10.5.103.46639 > 192.168.1.103.33485: UDP, length 32
19:31:30.737605 IP 12.10.5.103.41425 > 192.168.1.103.33493: UDP, length 32
19:31:30.737652 IP 12.10.5.103.38613 > 192.168.1.103.33495: UDP, length 32
19:31:30.739675 IP 12.10.5.103.47528 > 192.168.1.103.33494: UDP, length 32
19:31:30.739727 IP 12.10.5.103.52005 > 192.168.1.103.33496: UDP, length 32
19:31:30.739757 IP 12.10.5.103.55813 > 192.168.1.103.33484: UDP, length 32
19:31:30.739799 IP 12.10.5.103.38803 > 192.168.1.103.33497: UDP, length 32
19:31:30.740919 IP 12.10.5.103.60314 > 192.168.1.103.33488: UDP, length 32
19:31:35.737811 IP 12.10.5.103.58910 > 192.168.1.103.33498: UDP, length 32
19:31:35.737873 IP 12.10.5.103.56051 > 192.168.1.103.33505: UDP, length 32
19:31:35.737904 IP 12.10.5.103.59059 > 192.168.1.103.33506: UDP, length 32
19:31:35.741894 IP 12.10.5.103.47560 > 192.168.1.103.33508: UDP, length 32
19:31:35.741951 IP 12.10.5.103.59189 > 192.168.1.103.33500: UDP, length 32
19:31:35.741981 IP 12.10.5.103.59865 > 192.168.1.103.33511: UDP, length 32
19:31:35.742006 IP 12.10.5.103.55281 > 192.168.1.103.33513: UDP, length 32
19:31:35.742029 IP 12.10.5.103.41048 > 192.168.1.103.33501: UDP, length 32
19:31:35.742052 IP 12.10.5.103.38222 > 192.168.1.103.33499: UDP, length 32
19:31:35.742076 IP 12.10.5.103.55270 > 192.168.1.103.33504: UDP, length 32
19:31:35.742197 IP 12.10.5.103.38637 > 192.168.1.103.33512: UDP, length 32
19:31:35.744054 IP 12.10.5.103.36944 > 192.168.1.103.33510: UDP, length 32
19:31:35.744158 IP 12.10.5.103.53297 > 192.168.1.103.33502: UDP, length 32
19:31:35.744203 IP 12.10.5.103.37160 > 192.168.1.103.33503: UDP, length 32
19:31:35.744246 IP 12.10.5.103.58580 > 192.168.1.103.33509: UDP, length 32
19:31:35.745291 IP 12.10.5.103.50525 > 192.168.1.103.33507: UDP, length 32

19:31:40.738936 IP 12.10.5.103.54710 > 192.168.1.103.33514: UDP, length 32
19:31:40.741837 IP 12.10.5.103.33801 > 192.168.1.103.33515: UDP, length 32
19:31:40.756294 IP 12.10.5.103.33691 > 192.168.1.103.33516: UDP, length 32
19:31:40.760553 IP 12.10.5.103.40720 > 192.168.1.103.33517: UDP, length 32
19:31:40.763094 IP 12.10.5.103.37036 > 192.168.1.103.33518: UDP, length 32
19:31:40.764461 IP 12.10.5.103.55575 > 192.168.1.103.33519: UDP, length 32
19:31:40.765658 IP 12.10.5.103.56799 > 192.168.1.103.33520: UDP, length 32
19:31:40.766850 IP 12.10.5.103.50697 > 192.168.1.103.33521: UDP, length 32
19:31:40.767801 IP 12.10.5.103.52315 > 192.168.1.103.33522: UDP, length 32
19:31:40.769479 IP 12.10.5.103.58964 > 192.168.1.103.33523: UDP, length 32
19:31:45.796275 IP 12.10.5.103.45341 > 192.168.2.103.33434: UDP, length 32
19:31:45.799345 IP 12.10.5.103.33899 > 192.168.2.103.33449: UDP, length 32
19:31:45.800299 IP 12.10.5.103.54655 > 192.168.2.103.33435: UDP, length 32
19:31:45.801401 IP 12.10.5.103.54197 > 192.168.2.103.33448: UDP, length 32
19:31:45.802910 IP 12.10.5.103.58198 > 192.168.2.103.33444: UDP, length 32
19:31:45.803020 IP 12.10.5.103.43609 > 192.168.2.103.33443: UDP, length 32
19:31:45.803072 IP 12.10.5.103.36844 > 192.168.2.103.33439: UDP, length 32
19:31:45.805148 IP 12.10.5.103.33786 > 192.168.2.103.33442: UDP, length 32
19:31:45.805206 IP 12.10.5.103.34894 > 192.168.2.103.33436: UDP, length 32
19:31:45.805269 IP 12.10.5.103.40156 > 192.168.2.103.33438: UDP, length 32
19:31:45.806843 IP 12.10.5.103.60027 > 192.168.2.103.33440: UDP, length 32
19:31:45.806892 IP 12.10.5.103.33349 > 192.168.2.103.33445: UDP, length 32
19:31:45.806996 IP 12.10.5.103.51769 > 192.168.2.103.33446: UDP, length 32
19:31:45.808722 IP 12.10.5.103.54865 > 192.168.2.103.33437: UDP, length 32
19:31:45.808772 IP 12.10.5.103.45199 > 192.168.2.103.33441: UDP, length 32
19:31:45.808817 IP 12.10.5.103.46810 > 192.168.2.103.33447: UDP, length 32
19:31:50.809740 IP 12.10.5.103.41206 > 192.168.2.103.33465: UDP, length 32
19:31:50.809795 IP 12.10.5.103.39966 > 192.168.2.103.33457: UDP, length 32
19:31:50.809823 IP 12.10.5.103.41162 > 192.168.2.103.33458: UDP, length 32
19:31:50.809848 IP 12.10.5.103.49164 > 192.168.2.103.33463: UDP, length 32
19:31:50.809873 IP 12.10.5.103.47394 > 192.168.2.103.33452: UDP, length 32
19:31:50.814303 IP 12.10.5.103.52433 > 192.168.2.103.33461: UDP, length 32
19:31:50.814360 IP 12.10.5.103.41937 > 192.168.2.103.33462: UDP, length 32
19:31:50.814389 IP 12.10.5.103.54017 > 192.168.2.103.33450: UDP, length 32
19:31:50.814471 IP 12.10.5.103.49175 > 192.168.2.103.33460: UDP, length 32
19:31:50.814514 IP 12.10.5.103.37939 > 192.168.2.103.33451: UDP, length 32
19:31:50.814539 IP 12.10.5.103.55453 > 192.168.2.103.33464: UDP, length 32
19:31:50.814563 IP 12.10.5.103.55789 > 192.168.2.103.33456: UDP, length 32
19:31:50.814587 IP 12.10.5.103.58811 > 192.168.2.103.33455: UDP, length 32
19:31:50.814635 IP 12.10.5.103.42627 > 192.168.2.103.33454: UDP, length 32
19:31:50.816092 IP 12.10.5.103.44658 > 192.168.2.103.33459: UDP, length 32
19:31:50.816160 IP 12.10.5.103.40812 > 192.168.2.103.33453: UDP, length 32
19:31:55.812387 IP 12.10.5.103.60867 > 192.168.2.103.33472: UDP, length 32
19:31:55.812433 IP 12.10.5.103.43659 > 192.168.2.103.33479: UDP, length 32
19:31:55.812455 IP 12.10.5.103.38973 > 192.168.2.103.33468: UDP, length 32
19:31:55.812475 IP 12.10.5.103.58044 > 192.168.2.103.33467: UDP, length 32
19:31:55.812495 IP 12.10.5.103.44237 > 192.168.2.103.33476: UDP, length 32
19:31:55.815874 IP 12.10.5.103.33272 > 192.168.2.103.33470: UDP, length 32
19:31:55.815916 IP 12.10.5.103.37833 > 192.168.2.103.33473: UDP, length 32
19:31:55.815940 IP 12.10.5.103.54962 > 192.168.2.103.33471: UDP, length 32
19:31:55.815961 IP 12.10.5.103.39992 > 192.168.2.103.33469: UDP, length 32
19:31:55.815981 IP 12.10.5.103.59507 > 192.168.2.103.33477: UDP, length 32
19:31:55.816072 IP 12.10.5.103.58517 > 192.168.2.103.33466: UDP, length 32
19:31:55.816103 IP 12.10.5.103.56779 > 192.168.2.103.33475: UDP, length 32
19:31:55.816125 IP 12.10.5.103.44146 > 192.168.2.103.33480: UDP, length 32
19:31:55.816145 IP 12.10.5.103.44625 > 192.168.2.103.33478: UDP, length 32
19:31:55.816183 IP 12.10.5.103.33622 > 192.168.2.103.33474: UDP, length 32
19:31:55.817041 IP 12.10.5.103.39041 > 192.168.2.103.33481: UDP, length 32
19:32:00.819233 IP 12.10.5.103.52480 > 192.168.2.103.33488: UDP, length 32
19:32:00.819285 IP 12.10.5.103.55149 > 192.168.2.103.33497: UDP, length 32
19:32:00.819310 IP 12.10.5.103.52151 > 192.168.2.103.33487: UDP, length 32
19:32:00.819381 IP 12.10.5.103.52065 > 192.168.2.103.33492: UDP, length 32
19:32:00.823015 IP 12.10.5.103.37211 > 192.168.2.103.33489: UDP, length 32
19:32:00.823184 IP 12.10.5.103.42436 > 192.168.2.103.33482: UDP, length 32
19:32:00.823228 IP 12.10.5.103.49677 > 192.168.2.103.33491: UDP, length 32
19:32:00.823252 IP 12.10.5.103.56663 > 192.168.2.103.33493: UDP, length 32
19:32:00.823274 IP 12.10.5.103.52330 > 192.168.2.103.33485: UDP, length 32
19:32:00.823318 IP 12.10.5.103.39388 > 192.168.2.103.33486: UDP, length 32
19:32:00.825504 IP 12.10.5.103.37455 > 192.168.2.103.33490: UDP, length 32
19:32:00.825619 IP 12.10.5.103.45756 > 192.168.2.103.33495: UDP, length 32
19:32:00.825672 IP 12.10.5.103.45027 > 192.168.2.103.33496: UDP, length 32
19:32:00.827366 IP 12.10.5.103.43454 > 192.168.2.103.33494: UDP, length 32
19:32:00.827477 IP 12.10.5.103.45197 > 192.168.2.103.33484: UDP, length 32
19:32:00.827568 IP 12.10.5.103.41785 > 192.168.2.103.33483: UDP, length 32
19:32:05.818081 ARP, Request who-has 12.10.5.1 tell 12.10.5.103, length 28
19:32:05.818104 ARP, Reply 12.10.5.1 is-at b6:2d:37:7f:ba:8e (oui Unknown), length 28
19:32:05.822001 IP 12.10.5.103.40867 > 192.168.2.103.33513: UDP, length 32
19:32:05.822057 IP 12.10.5.103.41094 > 192.168.2.103.33499: UDP, length 32
19:32:05.822086 IP 12.10.5.103.56489 > 192.168.2.103.33501: UDP, length 32
19:32:05.826473 IP 12.10.5.103.59801 > 192.168.2.103.33509: UDP, length 32
19:32:05.826626 IP 12.10.5.103.52099 > 192.168.2.103.33510: UDP, length 32
19:32:05.826682 IP 12.10.5.103.45134 > 192.168.2.103.33512: UDP, length 32
19:32:05.826708 IP 12.10.5.103.48254 > 192.168.2.103.33498: UDP, length 32
19:32:05.826731 IP 12.10.5.103.45314 > 192.168.2.103.33502: UDP, length 32
19:32:05.826754 IP 12.10.5.103.42847 > 192.168.2.103.33506: UDP, length 32
19:32:05.826778 IP 12.10.5.103.54304 > 192.168.2.103.33511: UDP, length 32
19:32:05.826822 IP 12.10.5.103.54631 > 192.168.2.103.33508: UDP, length 32
19:32:05.828783 IP 12.10.5.103.55294 > 192.168.2.103.33500: UDP, length 32
19:32:05.828836 IP 12.10.5.103.53060 > 192.168.2.103.33505: UDP, length 32
19:32:05.828883 IP 12.10.5.103.56853 > 192.168.2.103.33504: UDP, length 32
19:32:05.830247 IP 12.10.5.103.43223 > 192.168.2.103.33503: UDP, length 32
19:32:05.830376 IP 12.10.5.103.35160 > 192.168.2.103.33507: UDP, length 32

19:32:10.823231 IP 12.10.5.103.58159 > 192.168.2.103.33514: UDP, length 32
19:32:10.827010 IP 12.10.5.103.33553 > 192.168.2.103.33515: UDP, length 32
19:32:10.827926 IP 12.10.5.103.57450 > 192.168.2.103.33516: UDP, length 32
19:32:10.829343 IP 12.10.5.103.33971 > 192.168.2.103.33517: UDP, length 32
19:32:10.829987 IP 12.10.5.103.43682 > 192.168.2.103.33518: UDP, length 32
19:32:10.830045 IP 12.10.5.103.45902 > 192.168.2.103.33521: UDP, length 32
19:32:10.831525 IP 12.10.5.103.50457 > 192.168.2.103.33520: UDP, length 32
19:32:10.831593 IP 12.10.5.103.50060 > 192.168.2.103.33523: UDP, length 32
19:32:10.832991 IP 12.10.5.103.36129 > 192.168.2.103.33522: UDP, length 32
19:32:10.833058 IP 12.10.5.103.52200 > 192.168.2.103.33519: UDP, length 32
19:32:15.846399 IP 12.10.5.103.43050 > 192.168.3.103.33434: UDP, length 32
19:32:15.848529 IP 12.10.5.103.36375 > 192.168.3.103.33435: UDP, length 32
19:32:15.850391 IP 12.10.5.103.56295 > 192.168.3.103.33436: UDP, length 32
19:32:15.853550 IP 12.10.5.103.58257 > 192.168.3.103.33445: UDP, length 32
19:32:15.854571 IP 12.10.5.103.35105 > 192.168.3.103.33440: UDP, length 32
19:32:15.855493 IP 12.10.5.103.55332 > 192.168.3.103.33447: UDP, length 32
19:32:15.856939 IP 12.10.5.103.42846 > 192.168.3.103.33437: UDP, length 32
19:32:15.857014 IP 12.10.5.103.35906 > 192.168.3.103.33442: UDP, length 32
19:32:15.858575 IP 12.10.5.103.50623 > 192.168.3.103.33448: UDP, length 32
19:32:15.858753 IP 12.10.5.103.39523 > 192.168.3.103.33439: UDP, length 32
19:32:15.860063 IP 12.10.5.103.54228 > 192.168.3.103.33443: UDP, length 32
19:32:15.860232 IP 12.10.5.103.49610 > 192.168.3.103.33449: UDP, length 32
19:32:15.861875 IP 12.10.5.103.37895 > 192.168.3.103.33438: UDP, length 32
19:32:15.861926 IP 12.10.5.103.52952 > 192.168.3.103.33441: UDP, length 32
19:32:15.861972 IP 12.10.5.103.38920 > 192.168.3.103.33446: UDP, length 32
19:32:15.862977 IP 12.10.5.103.35944 > 192.168.3.103.33444: UDP, length 32
19:32:20.865855 IP 12.10.5.103.45471 > 192.168.3.103.33450: UDP, length 32
19:32:20.865914 IP 12.10.5.103.36913 > 192.168.3.103.33461: UDP, length 32
19:32:20.865943 IP 12.10.5.103.34428 > 192.168.3.103.33457: UDP, length 32
19:32:20.865967 IP 12.10.5.103.39120 > 192.168.3.103.33455: UDP, length 32
19:32:20.865991 IP 12.10.5.103.36616 > 192.168.3.103.33451: UDP, length 32
19:32:20.866017 IP 12.10.5.103.44852 > 192.168.3.103.33454: UDP, length 32
19:32:20.870183 IP 12.10.5.103.44346 > 192.168.3.103.33464: UDP, length 32
19:32:20.870257 IP 12.10.5.103.60541 > 192.168.3.103.33456: UDP, length 32
19:32:20.870287 IP 12.10.5.103.57516 > 192.168.3.103.33462: UDP, length 32
19:32:20.870313 IP 12.10.5.103.38617 > 192.168.3.103.33463: UDP, length 32
19:32:20.870339 IP 12.10.5.103.51925 > 192.168.3.103.33452: UDP, length 32
19:32:20.870364 IP 12.10.5.103.37845 > 192.168.3.103.33459: UDP, length 32
19:32:20.870389 IP 12.10.5.103.44682 > 192.168.3.103.33458: UDP, length 32
19:32:20.870435 IP 12.10.5.103.54124 > 192.168.3.103.33453: UDP, length 32
19:32:20.871805 IP 12.10.5.103.57902 > 192.168.3.103.33465: UDP, length 32
19:32:20.871874 IP 12.10.5.103.46997 > 192.168.3.103.33460: UDP, length 32
19:32:25.868707 IP 12.10.5.103.59801 > 192.168.3.103.33466: UDP, length 32
19:32:25.873282 IP 12.10.5.103.46523 > 192.168.3.103.33467: UDP, length 32
19:32:25.874167 IP 12.10.5.103.57173 > 192.168.3.103.33468: UDP, length 32
19:32:25.875184 IP 12.10.5.103.45022 > 192.168.3.103.33469: UDP, length 32
19:32:25.876843 IP 12.10.5.103.44933 > 192.168.3.103.33471: UDP, length 32
19:32:25.876898 IP 12.10.5.103.50293 > 192.168.3.103.33473: UDP, length 32
19:32:25.876941 IP 12.10.5.103.60841 > 192.168.3.103.33480: UDP, length 32
19:32:25.878577 IP 12.10.5.103.51350 > 192.168.3.103.33478: UDP, length 32
19:32:25.878628 IP 12.10.5.103.42290 > 192.168.3.103.33475: UDP, length 32
19:32:25.878671 IP 12.10.5.103.58268 > 192.168.3.103.33476: UDP, length 32
19:32:25.881030 IP 12.10.5.103.34645 > 192.168.3.103.33477: UDP, length 32
19:32:25.881115 IP 12.10.5.103.51509 > 192.168.3.103.33472: UDP, length 32
19:32:25.881213 IP 12.10.5.103.35314 > 192.168.3.103.33474: UDP, length 32
19:32:25.881266 IP 12.10.5.103.34160 > 192.168.3.103.33470: UDP, length 32
19:32:25.882471 IP 12.10.5.103.38786 > 192.168.3.103.33481: UDP, length 32
19:32:25.882539 IP 12.10.5.103.54559 > 192.168.3.103.33479: UDP, length 32
19:32:30.887623 IP 12.10.5.103.50574 > 192.168.3.103.33485: UDP, length 32
19:32:30.887750 IP 12.10.5.103.45451 > 192.168.3.103.33482: UDP, length 32
19:32:30.887801 IP 12.10.5.103.52024 > 192.168.3.103.33488: UDP, length 32
19:32:30.887828 IP 12.10.5.103.53350 > 192.168.3.103.33487: UDP, length 32
19:32:30.887855 IP 12.10.5.103.53619 > 192.168.3.103.33490: UDP, length 32
19:32:30.891890 IP 12.10.5.103.48627 > 192.168.3.103.33495: UDP, length 32
19:32:30.891996 IP 12.10.5.103.48025 > 192.168.3.103.33483: UDP, length 32
19:32:30.892033 IP 12.10.5.103.55228 > 192.168.3.103.33497: UDP, length 32
19:32:30.892058 IP 12.10.5.103.38604 > 192.168.3.103.33491: UDP, length 32
19:32:30.892082 IP 12.10.5.103.32815 > 192.168.3.103.33484: UDP, length 32
19:32:30.892106 IP 12.10.5.103.42099 > 192.168.3.103.33489: UDP, length 32
19:32:30.892130 IP 12.10.5.103.53400 > 192.168.3.103.33492: UDP, length 32
19:32:30.893532 IP 12.10.5.103.54219 > 192.168.3.103.33494: UDP, length 32
19:32:30.893636 IP 12.10.5.103.48619 > 192.168.3.103.33493: UDP, length 32
19:32:30.893725 IP 12.10.5.103.57283 > 192.168.3.103.33496: UDP, length 32
19:32:30.893768 IP 12.10.5.103.50236 > 192.168.3.103.33486: UDP, length 32
19:32:35.890468 IP 12.10.5.103.55764 > 192.168.3.103.33503: UDP, length 32
19:32:35.890533 IP 12.10.5.103.35319 > 192.168.3.103.33504: UDP, length 32
19:32:35.890563 IP 12.10.5.103.47881 > 192.168.3.103.33508: UDP, length 32
19:32:35.892166 IP 12.10.5.103.37957 > 192.168.3.103.33513: UDP, length 32
19:32:35.892216 IP 12.10.5.103.36228 > 192.168.3.103.33512: UDP, length 32
19:32:35.892244 IP 12.10.5.103.49045 > 192.168.3.103.33499: UDP, length 32
19:32:35.893337 IP 12.10.5.103.58346 > 192.168.3.103.33502: UDP, length 32
19:32:35.893394 IP 12.10.5.103.44313 > 192.168.3.103.33505: UDP, length 32
19:32:35.895068 IP 12.10.5.103.55477 > 192.168.3.103.33506: UDP, length 32
19:32:35.895119 IP 12.10.5.103.36018 > 192.168.3.103.33510: UDP, length 32
19:32:35.895146 IP 12.10.5.103.32958 > 192.168.3.103.33507: UDP, length 32
19:32:35.896674 IP 12.10.5.103.34534 > 192.168.3.103.33511: UDP, length 32
19:32:35.896730 IP 12.10.5.103.57827 > 192.168.3.103.33501: UDP, length 32
19:32:35.898365 IP 12.10.5.103.53219 > 192.168.3.103.33498: UDP, length 32
19:32:35.898418 IP 12.10.5.103.46256 > 192.168.3.103.33500: UDP, length 32
19:32:35.898446 IP 12.10.5.103.56429 > 192.168.3.103.33509: UDP, length 32

19:32:40.895484 IP 12.10.5.103.52762 > 192.168.3.103.33514: UDP, length 32
19:32:40.898662 IP 12.10.5.103.60886 > 192.168.3.103.33515: UDP, length 32
19:32:40.899750 IP 12.10.5.103.43891 > 192.168.3.103.33516: UDP, length 32
19:32:40.900868 IP 12.10.5.103.59055 > 192.168.3.103.33517: UDP, length 32
19:32:40.902123 IP 12.10.5.103.37543 > 192.168.3.103.33523: UDP, length 32
19:32:40.902190 IP 12.10.5.103.36192 > 192.168.3.103.33522: UDP, length 32
19:32:40.903689 IP 12.10.5.103.44201 > 192.168.3.103.33520: UDP, length 32
19:32:40.903767 IP 12.10.5.103.53766 > 192.168.3.103.33519: UDP, length 32
19:32:40.907672 IP 12.10.5.103.41092 > 192.168.3.103.33521: UDP, length 32
19:32:40.907747 IP 12.10.5.103.36018 > 192.168.3.103.33518: UDP, length 32

19:33:16.585230 ARP, Request who-has 12.10.5.3 tell 12.10.5.103, length 28
19:33:21.608043 IP 12.10.5.103.39595 > 12.10.5.2.33436: UDP, length 32
19:33:21.608237 IP 12.10.5.103.57953 > 12.10.5.2.33442: UDP, length 32
19:33:21.610080 IP 12.10.5.103.56557 > 12.10.5.2.33440: UDP, length 32
19:33:21.610221 IP 12.10.5.103.44024 > 12.10.5.2.33443: UDP, length 32
19:33:21.610412 IP 12.10.5.103.49118 > 12.10.5.2.33435: UDP, length 32
19:33:21.610536 IP 12.10.5.103.57124 > 12.10.5.2.33444: UDP, length 32
19:33:21.610635 IP 12.10.5.103.58942 > 12.10.5.2.33434: UDP, length 32
19:33:21.610669 IP 12.10.5.103.41031 > 12.10.5.2.33447: UDP, length 32
19:33:21.610716 IP 12.10.5.103.33484 > 12.10.5.2.33437: UDP, length 32
19:33:21.613240 IP 12.10.5.103.54277 > 12.10.5.2.33441: UDP, length 32
19:33:21.613358 IP 12.10.5.103.55275 > 12.10.5.2.33445: UDP, length 32
19:33:21.613406 IP 12.10.5.103.54717 > 12.10.5.2.33438: UDP, length 32
19:33:21.613434 IP 12.10.5.103.53379 > 12.10.5.2.33449: UDP, length 32
19:33:21.613461 IP 12.10.5.103.47876 > 12.10.5.2.33446: UDP, length 32
19:33:21.617179 IP 12.10.5.103.46117 > 12.10.5.2.33439: UDP, length 32
19:33:21.617236 IP 12.10.5.103.39051 > 12.10.5.2.33448: UDP, length 32













