19:29:11.471232 IP 192.168.2.101 > 192.168.3.103: ICMP echo request, id 20982, seq 1, length 64
19:29:11.475195 IP 192.168.3.103 > 192.168.2.101: ICMP echo reply, id 20982, seq 1, length 64
19:29:11.500287 IP 192.168.3.101 > 192.168.3.1: ICMP echo request, id 20985, seq 1, length 64
19:29:11.500314 IP 192.168.3.1 > 192.168.3.101: ICMP echo reply, id 20985, seq 1, length 64
19:29:11.515303 ARP, Request who-has 192.168.3.103 tell 192.168.3.101, length 28
19:29:11.530787 IP 192.168.3.101 > 192.168.5.1: ICMP echo request, id 20994, seq 1, length 64
19:29:12.543382 IP 192.168.3.101 > 192.168.1.103: ICMP echo request, id 21006, seq 1, length 64
19:29:13.556956 IP 192.168.3.101 > 12.10.5.1: ICMP echo request, id 21018, seq 1, length 64
19:29:14.570508 IP 192.168.3.101 > 192.168.4.2: ICMP echo request, id 21030, seq 1, length 64
19:29:15.583466 IP 192.168.3.101 > 192.168.1.1: ICMP echo request, id 21045, seq 1, length 64
19:29:16.488427 ARP, Request who-has 192.168.3.1 tell 192.168.3.103, length 28
19:29:16.488442 ARP, Reply 192.168.3.1 is-at 7e:57:cf:bc:b6:42 (oui Unknown), length 28
19:29:16.596820 IP 192.168.3.101 > 192.168.4.1: ICMP echo request, id 21063, seq 1, length 64
19:29:17.624240 IP 192.168.3.101 > 192.168.2.103: ICMP echo request, id 21098, seq 1, length 64
19:29:17.628637 IP 192.168.2.103 > 192.168.3.101: ICMP echo reply, id 21098, seq 1, length 64
19:29:17.640083 IP 192.168.3.101 > 192.168.5.2: ICMP echo request, id 21104, seq 1, length 64
19:29:17.640118 IP 192.168.5.2 > 192.168.3.101: ICMP echo reply, id 21104, seq 1, length 64
19:29:17.657055 IP 192.168.3.101 > 192.168.2.101: ICMP echo request, id 21107, seq 1, length 64
19:29:17.660714 IP 192.168.2.101 > 192.168.3.101: ICMP echo reply, id 21107, seq 1, length 64
19:29:22.632801 ARP, Request who-has 192.168.3.101 tell 192.168.3.1, length 28
19:29:22.635512 ARP, Reply 192.168.3.101 is-at b6:fa:f8:3f:53:b3 (oui Unknown), length 28
19:29:22.686005 IP 192.168.3.101 > 192.168.2.1: ICMP echo request, id 21195, seq 1, length 64
19:29:22.686037 IP 192.168.2.1 > 192.168.3.101: ICMP echo reply, id 21195, seq 1, length 64
19:29:22.698200 IP 192.168.3.101 > 12.10.5.103: ICMP echo request, id 21198, seq 1, length 64
19:29:23.673397 IP 192.168.2.101 > 192.168.3.103: ICMP echo request, id 21204, seq 1, length 64
19:29:23.673687 IP 192.168.3.103 > 192.168.2.101: ICMP echo reply, id 21204, seq 1, length 64
19:29:23.708463 IP 192.168.3.101 > 192.168.3.1: ICMP echo request, id 21210, seq 1, length 64
19:29:23.708494 IP 192.168.3.1 > 192.168.3.101: ICMP echo reply, id 21210, seq 1, length 64
19:29:23.726304 IP 192.168.3.101 > 192.168.5.1: ICMP echo request, id 21216, seq 1, length 64
19:29:24.735025 IP 192.168.3.101 > 192.168.1.103: ICMP echo request, id 21225, seq 1, length 64
19:29:25.747948 IP 192.168.3.101 > 12.10.5.1: ICMP echo request, id 21234, seq 1, length 64
19:29:26.757635 IP 192.168.3.101 > 192.168.4.2: ICMP echo request, id 21246, seq 1, length 64
19:29:27.767745 IP 192.168.3.101 > 192.168.1.1: ICMP echo request, id 21261, seq 1, length 64
19:29:28.680264 ARP, Request who-has 192.168.3.103 tell 192.168.3.1, length 28
19:29:28.680645 ARP, Reply 192.168.3.103 is-at 06:65:b2:52:b9:c2 (oui Unknown), length 28
19:29:28.777387 IP 192.168.3.101 > 192.168.4.1: ICMP echo request, id 21273, seq 1, length 64
19:29:29.777359 IP 192.168.2.101 > 192.168.3.101: ICMP echo request, id 21296, seq 1, length 64
19:29:29.784949 IP 192.168.3.101 > 192.168.2.101: ICMP echo reply, id 21296, seq 1, length 64
19:29:29.797102 IP 192.168.3.101 > 192.168.2.103: ICMP echo request, id 21299, seq 1, length 64
19:29:29.797369 IP 192.168.2.103 > 192.168.3.101: ICMP echo reply, id 21299, seq 1, length 64
19:29:29.806145 IP 192.168.3.101 > 192.168.5.2: ICMP echo request, id 21302, seq 1, length 64
19:29:29.806171 IP 192.168.5.2 > 192.168.3.101: ICMP echo reply, id 21302, seq 1, length 64
19:29:29.817764 IP 192.168.3.101 > 192.168.2.101: ICMP echo request, id 21305, seq 1, length 64
19:29:29.818044 IP 192.168.2.101 > 192.168.3.101: ICMP echo reply, id 21305, seq 1, length 64
19:29:34.841877 IP 192.168.3.101 > 192.168.2.1: ICMP echo request, id 21355, seq 1, length 64
19:29:34.841910 IP 192.168.2.1 > 192.168.3.101: ICMP echo reply, id 21355, seq 1, length 64
19:29:34.851524 IP 192.168.3.101 > 12.10.5.103: ICMP echo request, id 21358, seq 1, length 64
19:29:35.834174 IP 192.168.2.101 > 192.168.3.103: ICMP echo request, id 21367, seq 1, length 64
19:29:35.834345 IP 192.168.3.103 > 192.168.2.101: ICMP echo reply, id 21367, seq 1, length 64
19:29:35.860106 IP 192.168.3.101 > 192.168.3.1: ICMP echo request, id 21373, seq 1, length 64
19:29:35.860133 IP 192.168.3.1 > 192.168.3.101: ICMP echo reply, id 21373, seq 1, length 64
19:29:35.879788 IP 192.168.3.101 > 192.168.5.1: ICMP echo request, id 21379, seq 1, length 64
19:29:36.889603 IP 192.168.3.101 > 192.168.1.103: ICMP echo request, id 21388, seq 1, length 64
19:29:37.899259 IP 192.168.3.101 > 12.10.5.1: ICMP echo request, id 21400, seq 1, length 64
19:29:38.909807 IP 192.168.3.101 > 192.168.4.2: ICMP echo request, id 21409, seq 1, length 64

19:29:40.840948 ARP, Request who-has 192.168.3.1 tell 192.168.3.103, length 28
19:29:40.840970 ARP, Reply 192.168.3.1 is-at 7e:57:cf:bc:b6:42 (oui Unknown), length 28
19:29:40.930864 IP 192.168.3.101 > 192.168.4.1: ICMP echo request, id 21444, seq 1, length 64
19:29:41.930458 IP 192.168.2.101 > 192.168.3.101: ICMP echo request, id 21459, seq 1, length 64
19:29:41.930700 IP 192.168.3.101 > 192.168.2.101: ICMP echo reply, id 21459, seq 1, length 64
19:29:41.942182 IP 192.168.3.101 > 192.168.2.103: ICMP echo request, id 21462, seq 1, length 64
19:29:41.942386 IP 192.168.2.103 > 192.168.3.101: ICMP echo reply, id 21462, seq 1, length 64
19:29:41.951917 IP 192.168.3.101 > 192.168.5.2: ICMP echo request, id 21465, seq 1, length 64
19:29:41.951939 IP 192.168.5.2 > 192.168.3.101: ICMP echo reply, id 21465, seq 1, length 64
19:29:41.961184 IP 192.168.3.101 > 192.168.2.101: ICMP echo request, id 21468, seq 1, length 64
19:29:41.961371 IP 192.168.2.101 > 192.168.3.101: ICMP echo reply, id 21468, seq 1, length 64
19:29:46.936273 ARP, Request who-has 192.168.3.101 tell 192.168.3.1, length 28
19:29:46.936707 ARP, Reply 192.168.3.101 is-at b6:fa:f8:3f:53:b3 (oui Unknown), length 28
19:29:46.986381 IP 192.168.3.101 > 192.168.2.1: ICMP echo request, id 21523, seq 1, length 64
19:29:46.986413 IP 192.168.2.1 > 192.168.3.101: ICMP echo reply, id 21523, seq 1, length 64
19:29:46.995967 IP 192.168.3.101 > 12.10.5.103: ICMP echo request, id 21526, seq 1, length 64
19:29:47.972353 IP 192.168.2.101 > 192.168.3.103: ICMP echo request, id 21538, seq 1, length 64
19:29:47.972619 IP 192.168.3.103 > 192.168.2.101: ICMP echo reply, id 21538, seq 1, length 64
19:29:48.016905 IP 192.168.3.101 > 192.168.5.1: ICMP echo request, id 21549, seq 1, length 64
19:29:49.027205 IP 192.168.3.101 > 12.10.5.1: ICMP echo request, id 21560, seq 1, length 64
19:29:50.037613 IP 192.168.3.101 > 192.168.1.1: ICMP echo request, id 21569, seq 1, length 64
19:29:51.051686 IP 192.168.3.101 > 192.168.2.103: ICMP echo request, id 21587, seq 1, length 64
19:29:51.052062 IP 192.168.2.103 > 192.168.3.101: ICMP echo reply, id 21587, seq 1, length 64
19:29:51.054171 IP 192.168.2.101 > 192.168.3.101: ICMP echo request, id 21584, seq 1, length 64
19:29:51.054322 IP 192.168.3.101 > 192.168.2.101: ICMP echo reply, id 21584, seq 1, length 64
19:29:51.063763 IP 192.168.3.101 > 192.168.5.2: ICMP echo request, id 21590, seq 1, length 64
19:29:51.063786 IP 192.168.5.2 > 192.168.3.101: ICMP echo reply, id 21590, seq 1, length 64
19:29:51.074382 IP 192.168.3.101 > 192.168.2.101: ICMP echo request, id 21593, seq 1, length 64
19:29:51.074597 IP 192.168.2.101 > 192.168.3.101: ICMP echo reply, id 21593, seq 1, length 64
19:29:51.994403 ARP, Request who-has 192.168.3.1 tell 192.168.3.101, length 28
19:29:51.994485 ARP, Reply 192.168.3.1 is-at 7e:57:cf:bc:b6:42 (oui Unknown), length 28
19:29:52.984260 ARP, Request who-has 192.168.3.103 tell 192.168.3.1, length 28
19:29:52.984579 ARP, Reply 192.168.3.103 is-at 06:65:b2:52:b9:c2 (oui Unknown), length 28
19:29:56.118092 IP 192.168.3.101 > 192.168.2.1: ICMP echo request, id 21645, seq 1, length 64
19:29:56.118171 IP 192.168.2.1 > 192.168.3.101: ICMP echo reply, id 21645, seq 1, length 64
19:29:56.129435 IP 192.168.2.101 > 192.168.3.103: ICMP echo request, id 21649, seq 1, length 64
19:29:56.129685 IP 192.168.3.103 > 192.168.2.101: ICMP echo reply, id 21649, seq 1, length 64
19:29:56.155617 IP 192.168.3.101 > 192.168.3.1: ICMP echo request, id 21659, seq 1, length 64
19:29:56.155646 IP 192.168.3.1 > 192.168.3.101: ICMP echo reply, id 21659, seq 1, length 64
19:29:56.206964 IP 192.168.3.101 > 192.168.1.103: ICMP echo request, id 21670, seq 1, length 64
19:29:57.216825 IP 192.168.3.101 > 192.168.4.1: ICMP echo request, id 21717, seq 1, length 64
19:29:58.208967 IP 192.168.2.101 > 192.168.3.101: ICMP echo request, id 21729, seq 1, length 64
19:29:58.209190 IP 192.168.3.101 > 192.168.2.101: ICMP echo reply, id 21729, seq 1, length 64
19:29:58.226018 IP 192.168.3.101 > 192.168.5.2: ICMP echo request, id 21732, seq 1, length 64
19:29:58.226045 IP 192.168.5.2 > 192.168.3.101: ICMP echo reply, id 21732, seq 1, length 64
19:29:58.235365 IP 192.168.3.101 > 192.168.2.101: ICMP echo request, id 21735, seq 1, length 64
19:29:58.235578 IP 192.168.2.101 > 192.168.3.101: ICMP echo reply, id 21735, seq 1, length 64
19:30:01.144478 ARP, Request who-has 192.168.3.1 tell 192.168.3.103, length 28
19:30:01.144500 ARP, Reply 192.168.3.1 is-at 7e:57:cf:bc:b6:42 (oui Unknown), length 28
19:30:03.242501 IP 192.168.2.101 > 192.168.3.103: ICMP echo request, id 21768, seq 1, length 64
19:30:03.242668 IP 192.168.3.103 > 192.168.2.101: ICMP echo reply, id 21768, seq 1, length 64
19:30:03.260274 IP 192.168.3.101 > 192.168.2.1: ICMP echo request, id 21774, seq 1, length 64
19:30:03.260302 IP 192.168.2.1 > 192.168.3.101: ICMP echo reply, id 21774, seq 1, length 64
19:30:03.269748 IP 192.168.3.101 > 192.168.3.1: ICMP echo request, id 21777, seq 1, length 64
19:30:03.269774 IP 192.168.3.1 > 192.168.3.101: ICMP echo reply, id 21777, seq 1, length 64
19:30:03.288365 IP 192.168.3.101 > 192.168.4.2: ICMP echo request, id 21783, seq 1, length 64
19:30:04.303167 IP 192.168.3.101 > 192.168.5.2: ICMP echo request, id 21811, seq 1, length 64
19:30:04.303198 IP 192.168.5.2 > 192.168.3.101: ICMP echo reply, id 21811, seq 1, length 64
19:30:04.306283 IP 192.168.2.101 > 192.168.3.101: ICMP echo request, id 21808, seq 1, length 64
19:30:04.306519 IP 192.168.3.101 > 192.168.2.101: ICMP echo reply, id 21808, seq 1, length 64
19:30:04.319375 IP 192.168.3.101 > 192.168.2.101: ICMP echo request, id 21814, seq 1, length 64
19:30:04.319806 IP 192.168.2.101 > 192.168.3.101: ICMP echo reply, id 21814, seq 1, length 64
19:30:09.344442 IP 192.168.2.101 > 192.168.3.103: ICMP echo request, id 21899, seq 1, length 64
19:30:09.344637 IP 192.168.3.103 > 192.168.2.101: ICMP echo reply, id 21899, seq 1, length 64
19:30:09.350069 IP 192.168.3.101 > 192.168.2.1: ICMP echo request, id 21902, seq 1, length 64
19:30:09.350099 IP 192.168.2.1 > 192.168.3.101: ICMP echo reply, id 21902, seq 1, length 64
19:30:09.371617 IP 192.168.3.101 > 192.168.3.1: ICMP echo request, id 21908, seq 1, length 64
19:30:09.371643 IP 192.168.3.1 > 192.168.3.101: ICMP echo reply, id 21908, seq 1, length 64
19:30:09.408550 IP 192.168.3.101 > 192.168.2.103: ICMP echo request, id 21920, seq 1, length 64
19:30:09.408806 IP 192.168.2.103 > 192.168.3.101: ICMP echo reply, id 21920, seq 1, length 64
19:30:09.430366 IP 192.168.2.101 > 192.168.3.101: ICMP echo request, id 21926, seq 1, length 64
19:30:09.430575 IP 192.168.3.101 > 192.168.2.101: ICMP echo reply, id 21926, seq 1, length 64
19:30:09.434110 IP 192.168.3.101 > 192.168.5.2: ICMP echo request, id 21923, seq 1, length 64
19:30:09.434136 IP 192.168.5.2 > 192.168.3.101: ICMP echo reply, id 21923, seq 1, length 64
19:30:09.447659 IP 192.168.3.101 > 192.168.2.101: ICMP echo request, id 21929, seq 1, length 64
19:30:09.448027 IP 192.168.2.101 > 192.168.3.101: ICMP echo reply, id 21929, seq 1, length 64

19:30:14.360468 ARP, Request who-has 192.168.3.101 tell 192.168.3.1, length 28
19:30:14.360752 ARP, Reply 192.168.3.101 is-at b6:fa:f8:3f:53:b3 (oui Unknown), length 28
19:30:14.475371 IP 192.168.3.101 > 192.168.2.1: ICMP echo request, id 21985, seq 1, length 64
19:30:14.475397 IP 192.168.2.1 > 192.168.3.101: ICMP echo reply, id 21985, seq 1, length 64
19:30:14.479100 IP 192.168.2.101 > 192.168.3.103: ICMP echo request, id 21988, seq 1, length 64
19:30:14.479343 IP 192.168.3.103 > 192.168.2.101: ICMP echo reply, id 21988, seq 1, length 64
19:30:14.498193 IP 192.168.3.101 > 192.168.3.1: ICMP echo request, id 21991, seq 1, length 64
19:30:14.498217 IP 192.168.3.1 > 192.168.3.101: ICMP echo reply, id 21991, seq 1, length 64
19:30:14.536515 IP 192.168.3.101 > 192.168.2.103: ICMP echo request, id 22003, seq 1, length 64
19:30:14.536754 IP 192.168.2.103 > 192.168.3.101: ICMP echo reply, id 22003, seq 1, length 64
19:30:14.547561 IP 192.168.3.101 > 192.168.5.2: ICMP echo request, id 22012, seq 1, length 64
19:30:14.547586 IP 192.168.5.2 > 192.168.3.101: ICMP echo reply, id 22012, seq 1, length 64
19:30:14.553037 IP 192.168.2.101 > 192.168.3.101: ICMP echo request, id 22009, seq 1, length 64
19:30:14.553262 IP 192.168.3.101 > 192.168.2.101: ICMP echo reply, id 22009, seq 1, length 64
19:30:14.562331 IP 192.168.3.101 > 192.168.2.101: ICMP echo request, id 22015, seq 1, length 64
19:30:14.562532 IP 192.168.2.101 > 192.168.3.101: ICMP echo reply, id 22015, seq 1, length 64
19:30:19.480505 ARP, Request who-has 192.168.3.103 tell 192.168.3.1, length 28
19:30:19.480906 ARP, Reply 192.168.3.103 is-at 06:65:b2:52:b9:c2 (oui Unknown), length 28
19:30:19.594856 IP 192.168.2.101 > 192.168.3.103: ICMP echo request, id 22056, seq 1, length 64
19:30:19.595033 IP 192.168.3.103 > 192.168.2.101: ICMP echo reply, id 22056, seq 1, length 64
19:30:19.597347 IP 192.168.3.101 > 192.168.2.1: ICMP echo request, id 22059, seq 1, length 64
19:30:19.597367 IP 192.168.2.1 > 192.168.3.101: ICMP echo reply, id 22059, seq 1, length 64
19:30:19.614196 IP 192.168.3.101 > 192.168.3.1: ICMP echo request, id 22065, seq 1, length 64
19:30:19.614219 IP 192.168.3.1 > 192.168.3.101: ICMP echo reply, id 22065, seq 1, length 64
19:30:19.650341 IP 192.168.3.101 > 192.168.2.103: ICMP echo request, id 22074, seq 1, length 64
19:30:19.650551 IP 192.168.2.103 > 192.168.3.101: ICMP echo reply, id 22074, seq 1, length 64
19:30:19.666218 IP 192.168.2.101 > 192.168.3.101: ICMP echo request, id 22083, seq 1, length 64
19:30:19.666413 IP 192.168.3.101 > 192.168.2.101: ICMP echo reply, id 22083, seq 1, length 64
19:30:19.675012 IP 192.168.3.101 > 192.168.5.2: ICMP echo request, id 22080, seq 1, length 64
19:30:19.675035 IP 192.168.5.2 > 192.168.3.101: ICMP echo reply, id 22080, seq 1, length 64
19:30:19.685087 IP 192.168.3.101 > 192.168.2.101: ICMP echo request, id 22086, seq 1, length 64
19:30:19.685304 IP 192.168.2.101 > 192.168.3.101: ICMP echo reply, id 22086, seq 1, length 64
19:30:24.600597 ARP, Request who-has 192.168.3.1 tell 192.168.3.103, length 28
19:30:24.600677 ARP, Reply 192.168.3.1 is-at 7e:57:cf:bc:b6:42 (oui Unknown), length 28
19:30:24.600708 ARP, Request who-has 192.168.3.1 tell 192.168.3.101, length 28
19:30:24.600713 ARP, Reply 192.168.3.1 is-at 7e:57:cf:bc:b6:42 (oui Unknown), length 28
19:30:24.708733 IP 192.168.2.101 > 192.168.3.103: ICMP echo request, id 22122, seq 1, length 64
19:30:24.708903 IP 192.168.3.103 > 192.168.2.101: ICMP echo reply, id 22122, seq 1, length 64
19:30:24.714114 IP 192.168.3.101 > 192.168.2.1: ICMP echo request, id 22125, seq 1, length 64
19:30:24.714135 IP 192.168.2.1 > 192.168.3.101: ICMP echo reply, id 22125, seq 1, length 64
19:30:24.731164 IP 192.168.3.101 > 192.168.3.1: ICMP echo request, id 22131, seq 1, length 64
19:30:24.731187 IP 192.168.3.1 > 192.168.3.101: ICMP echo reply, id 22131, seq 1, length 64
19:30:24.769819 IP 192.168.3.101 > 192.168.2.103: ICMP echo request, id 22140, seq 1, length 64
19:30:24.770022 IP 192.168.2.103 > 192.168.3.101: ICMP echo reply, id 22140, seq 1, length 64
19:30:24.787719 IP 192.168.3.101 > 192.168.5.2: ICMP echo request, id 22149, seq 1, length 64
19:30:24.787749 IP 192.168.5.2 > 192.168.3.101: ICMP echo reply, id 22149, seq 1, length 64
19:30:24.790451 IP 192.168.2.101 > 192.168.3.101: ICMP echo request, id 22146, seq 1, length 64
19:30:24.790689 IP 192.168.3.101 > 192.168.2.101: ICMP echo reply, id 22146, seq 1, length 64
19:30:24.802141 IP 192.168.3.101 > 192.168.2.101: ICMP echo request, id 22152, seq 1, length 64
19:30:24.802328 IP 192.168.2.101 > 192.168.3.101: ICMP echo reply, id 22152, seq 1, length 64
19:30:29.828618 IP 192.168.3.101 > 192.168.2.1: ICMP echo request, id 22184, seq 1, length 64
19:30:29.828650 IP 192.168.2.1 > 192.168.3.101: ICMP echo reply, id 22184, seq 1, length 64
19:30:29.835274 IP 192.168.2.101 > 192.168.3.103: ICMP echo request, id 22187, seq 1, length 64
19:30:29.835524 IP 192.168.3.103 > 192.168.2.101: ICMP echo reply, id 22187, seq 1, length 64
19:30:29.857808 IP 192.168.3.101 > 192.168.3.1: ICMP echo request, id 22190, seq 1, length 64
19:30:29.857836 IP 192.168.3.1 > 192.168.3.101: ICMP echo reply, id 22190, seq 1, length 64
19:30:29.900346 IP 192.168.3.101 > 192.168.2.103: ICMP echo request, id 22205, seq 1, length 64
19:30:29.900710 IP 192.168.2.103 > 192.168.3.101: ICMP echo reply, id 22205, seq 1, length 64
19:30:29.914141 IP 192.168.3.101 > 192.168.5.2: ICMP echo request, id 22211, seq 1, length 64
19:30:29.914169 IP 192.168.5.2 > 192.168.3.101: ICMP echo reply, id 22211, seq 1, length 64
19:30:29.926504 IP 192.168.2.101 > 192.168.3.101: ICMP echo request, id 22208, seq 1, length 64
19:30:29.926686 IP 192.168.3.101 > 192.168.2.101: ICMP echo reply, id 22208, seq 1, length 64
19:30:29.936450 IP 192.168.3.101 > 192.168.2.101: ICMP echo request, id 22214, seq 1, length 64
19:30:29.936654 IP 192.168.2.101 > 192.168.3.101: ICMP echo reply, id 22214, seq 1, length 64
19:30:34.966237 IP 192.168.2.101 > 192.168.3.103: ICMP echo request, id 22258, seq 1, length 64
19:30:34.966552 IP 192.168.3.103 > 192.168.2.101: ICMP echo reply, id 22258, seq 1, length 64
19:30:34.970395 IP 192.168.3.101 > 192.168.2.1: ICMP echo request, id 22255, seq 1, length 64
19:30:34.970420 IP 192.168.2.1 > 192.168.3.101: ICMP echo reply, id 22255, seq 1, length 64
19:30:34.987843 IP 192.168.3.101 > 192.168.3.1: ICMP echo request, id 22261, seq 1, length 64
19:30:34.987871 IP 192.168.3.1 > 192.168.3.101: ICMP echo reply, id 22261, seq 1, length 64
19:30:35.028109 IP 192.168.3.101 > 192.168.2.103: ICMP echo request, id 22273, seq 1, length 64
19:30:35.028490 IP 192.168.2.103 > 192.168.3.101: ICMP echo reply, id 22273, seq 1, length 64
19:30:35.051745 IP 192.168.3.101 > 192.168.5.2: ICMP echo request, id 22282, seq 1, length 64
19:30:35.051775 IP 192.168.5.2 > 192.168.3.101: ICMP echo reply, id 22282, seq 1, length 64
19:30:35.054303 IP 192.168.2.101 > 192.168.3.101: ICMP echo request, id 22279, seq 1, length 64
19:30:35.054464 IP 192.168.3.101 > 192.168.2.101: ICMP echo reply, id 22279, seq 1, length 64
19:30:35.067023 IP 192.168.3.101 > 192.168.2.101: ICMP echo request, id 22285, seq 1, length 64
19:30:35.067292 IP 192.168.2.101 > 192.168.3.101: ICMP echo reply, id 22285, seq 1, length 64

19:30:45.096306 ARP, Request who-has 192.168.3.103 tell 192.168.3.1, length 28
19:30:45.096631 ARP, Request who-has 192.168.3.1 tell 192.168.3.103, length 28
19:30:45.096645 ARP, Reply 192.168.3.1 is-at 7e:57:cf:bc:b6:42 (oui Unknown), length 28
19:30:45.096748 ARP, Reply 192.168.3.103 is-at 06:65:b2:52:b9:c2 (oui Unknown), length 28
19:30:45.205199 IP 192.168.2.101 > 192.168.3.103: ICMP echo request, id 22469, seq 1, length 64
19:30:45.205553 IP 192.168.3.103 > 192.168.2.101: ICMP echo reply, id 22469, seq 1, length 64
19:30:45.237567 IP 192.168.3.101 > 192.168.2.1: ICMP echo request, id 22478, seq 1, length 64
19:30:45.237597 IP 192.168.2.1 > 192.168.3.101: ICMP echo reply, id 22478, seq 1, length 64
19:30:45.268732 IP 192.168.3.101 > 192.168.3.1: ICMP echo request, id 22487, seq 1, length 64
19:30:45.268762 IP 192.168.3.1 > 192.168.3.101: ICMP echo reply, id 22487, seq 1, length 64
19:30:45.290015 IP 192.168.2.101 > 192.168.3.101: ICMP echo request, id 22493, seq 1, length 64
19:30:45.290179 IP 192.168.3.101 > 192.168.2.101: ICMP echo reply, id 22493, seq 1, length 64
19:30:45.313897 IP 192.168.3.101 > 192.168.2.103: ICMP echo request, id 22502, seq 1, length 64
19:30:45.314106 IP 192.168.2.103 > 192.168.3.101: ICMP echo reply, id 22502, seq 1, length 64
19:30:45.331107 IP 192.168.3.101 > 192.168.5.2: ICMP echo request, id 22508, seq 1, length 64
19:30:45.331181 IP 192.168.5.2 > 192.168.3.101: ICMP echo reply, id 22508, seq 1, length 64
19:30:45.341813 IP 192.168.3.101 > 192.168.2.101: ICMP echo request, id 22511, seq 1, length 64
19:30:45.342000 IP 192.168.2.101 > 192.168.3.101: ICMP echo reply, id 22511, seq 1, length 64
19:30:50.348382 IP 192.168.2.101 > 192.168.3.103: ICMP echo request, id 22552, seq 1, length 64
19:30:50.348583 IP 192.168.3.103 > 192.168.2.101: ICMP echo reply, id 22552, seq 1, length 64
19:30:50.375640 IP 192.168.3.101 > 192.168.2.1: ICMP echo request, id 22562, seq 1, length 64
19:30:50.375669 IP 192.168.2.1 > 192.168.3.101: ICMP echo reply, id 22562, seq 1, length 64
19:30:50.408591 IP 192.168.3.101 > 192.168.3.1: ICMP echo request, id 22571, seq 1, length 64
19:30:50.408621 IP 192.168.3.1 > 192.168.3.101: ICMP echo reply, id 22571, seq 1, length 64
19:30:50.454200 IP 192.168.3.101 > 192.168.2.103: ICMP echo request, id 22583, seq 1, length 64
19:30:50.454418 IP 192.168.2.103 > 192.168.3.101: ICMP echo reply, id 22583, seq 1, length 64
19:30:50.460266 IP 192.168.2.101 > 192.168.3.101: ICMP echo request, id 22586, seq 1, length 64
19:30:50.460428 IP 192.168.3.101 > 192.168.2.101: ICMP echo reply, id 22586, seq 1, length 64
19:30:50.474327 IP 192.168.3.101 > 192.168.5.2: ICMP echo request, id 22589, seq 1, length 64
19:30:50.474355 IP 192.168.5.2 > 192.168.3.101: ICMP echo reply, id 22589, seq 1, length 64
19:30:50.485414 IP 192.168.3.101 > 192.168.2.101: ICMP echo request, id 22592, seq 1, length 64
19:30:50.485619 IP 192.168.2.101 > 192.168.3.101: ICMP echo reply, id 22592, seq 1, length 64
19:30:55.384479 ARP, Request who-has 192.168.3.1 tell 192.168.3.101, length 28
19:30:55.384533 ARP, Reply 192.168.3.1 is-at 7e:57:cf:bc:b6:42 (oui Unknown), length 28
19:30:55.510468 IP 192.168.3.101 > 192.168.2.1: ICMP echo request, id 22682, seq 1, length 64
19:30:55.510499 IP 192.168.2.1 > 192.168.3.101: ICMP echo reply, id 22682, seq 1, length 64
19:30:55.529432 IP 192.168.2.101 > 192.168.3.103: ICMP echo request, id 22685, seq 1, length 64
19:30:55.529598 IP 192.168.3.103 > 192.168.2.101: ICMP echo reply, id 22685, seq 1, length 64
19:30:55.537834 IP 192.168.3.101 > 192.168.3.1: ICMP echo request, id 22688, seq 1, length 64
19:30:55.537858 IP 192.168.3.1 > 192.168.3.101: ICMP echo reply, id 22688, seq 1, length 64
19:30:55.576001 IP 192.168.3.101 > 192.168.2.103: ICMP echo request, id 22700, seq 1, length 64
19:30:55.576179 IP 192.168.2.103 > 192.168.3.101: ICMP echo reply, id 22700, seq 1, length 64
19:30:55.620601 IP 192.168.3.101 > 192.168.5.2: ICMP echo request, id 22706, seq 1, length 64
19:30:55.620707 IP 192.168.5.2 > 192.168.3.101: ICMP echo reply, id 22706, seq 1, length 64
19:30:55.646572 IP 192.168.3.101 > 192.168.2.101: ICMP echo request, id 22709, seq 1, length 64
19:30:55.646775 IP 192.168.2.101 > 192.168.3.101: ICMP echo reply, id 22709, seq 1, length 64
19:30:55.649647 IP 192.168.2.101 > 192.168.3.101: ICMP echo request, id 22712, seq 1, length 64
19:30:55.649804 IP 192.168.3.101 > 192.168.2.101: ICMP echo reply, id 22712, seq 1, length 64
19:31:00.687165 IP 192.168.3.101 > 192.168.2.1: ICMP echo request, id 22750, seq 1, length 64
19:31:00.687189 IP 192.168.2.1 > 192.168.3.101: ICMP echo reply, id 22750, seq 1, length 64
19:31:00.702077 IP 192.168.2.101 > 192.168.3.103: ICMP echo request, id 22756, seq 1, length 64
19:31:00.702337 IP 192.168.3.103 > 192.168.2.101: ICMP echo reply, id 22756, seq 1, length 64
19:31:00.706100 IP 192.168.3.101 > 192.168.3.1: ICMP echo request, id 22759, seq 1, length 64
19:31:00.706119 IP 192.168.3.1 > 192.168.3.101: ICMP echo reply, id 22759, seq 1, length 64
19:31:00.745521 IP 192.168.3.101 > 192.168.2.103: ICMP echo request, id 22771, seq 1, length 64
19:31:00.745742 IP 192.168.2.103 > 192.168.3.101: ICMP echo reply, id 22771, seq 1, length 64
19:31:00.762262 IP 192.168.3.101 > 192.168.5.2: ICMP echo request, id 22777, seq 1, length 64
19:31:00.762290 IP 192.168.5.2 > 192.168.3.101: ICMP echo reply, id 22777, seq 1, length 64
19:31:00.780038 IP 192.168.2.101 > 192.168.3.101: ICMP echo request, id 22780, seq 1, length 64
19:31:00.780204 IP 192.168.3.101 > 192.168.2.101: ICMP echo reply, id 22780, seq 1, length 64
19:31:00.784019 IP 192.168.3.101 > 192.168.2.101: ICMP echo request, id 22783, seq 1, length 64
19:31:00.784198 IP 192.168.2.101 > 192.168.3.101: ICMP echo reply, id 22783, seq 1, length 64
19:31:05.688237 ARP, Request who-has 192.168.3.101 tell 192.168.3.1, length 28
19:31:05.688576 ARP, Reply 192.168.3.101 is-at b6:fa:f8:3f:53:b3 (oui Unknown), length 28
19:31:05.704480 ARP, Request who-has 192.168.3.1 tell 192.168.3.103, length 28
19:31:05.704501 ARP, Reply 192.168.3.1 is-at 7e:57:cf:bc:b6:42 (oui Unknown), length 28
19:31:05.814194 IP 192.168.3.101 > 192.168.2.1: ICMP echo request, id 22820, seq 1, length 64
19:31:05.814223 IP 192.168.2.1 > 192.168.3.101: ICMP echo reply, id 22820, seq 1, length 64
19:31:05.829839 IP 192.168.3.101 > 192.168.3.1: ICMP echo request, id 22826, seq 1, length 64
19:31:05.829864 IP 192.168.3.1 > 192.168.3.101: ICMP echo reply, id 22826, seq 1, length 64
19:31:05.835292 IP 192.168.2.101 > 192.168.3.103: ICMP echo request, id 22829, seq 1, length 64
19:31:05.835455 IP 192.168.3.103 > 192.168.2.101: ICMP echo reply, id 22829, seq 1, length 64
19:31:05.869927 IP 192.168.3.101 > 192.168.2.103: ICMP echo request, id 22841, seq 1, length 64
19:31:05.870137 IP 192.168.2.103 > 192.168.3.101: ICMP echo reply, id 22841, seq 1, length 64
19:31:05.894342 IP 192.168.3.101 > 192.168.5.2: ICMP echo request, id 22844, seq 1, length 64
19:31:05.894369 IP 192.168.5.2 > 192.168.3.101: ICMP echo reply, id 22844, seq 1, length 64
19:31:05.907999 IP 192.168.3.101 > 192.168.2.101: ICMP echo request, id 22853, seq 1, length 64
19:31:05.908343 IP 192.168.2.101 > 192.168.3.101: ICMP echo reply, id 22853, seq 1, length 64
19:31:05.912197 IP 192.168.2.101 > 192.168.3.101: ICMP echo request, id 22850, seq 1, length 64
19:31:05.912372 IP 192.168.3.101 > 192.168.2.101: ICMP echo reply, id 22850, seq 1, length 64

19:31:10.840369 ARP, Request who-has 192.168.3.103 tell 192.168.3.1, length 28
19:31:10.840765 ARP, Reply 192.168.3.103 is-at 06:65:b2:52:b9:c2 (oui Unknown), length 28
19:31:10.947749 IP 192.168.3.101 > 192.168.2.1: ICMP echo request, id 22904, seq 1, length 64
19:31:10.947775 IP 192.168.2.1 > 192.168.3.101: ICMP echo reply, id 22904, seq 1, length 64
19:31:10.964087 IP 192.168.3.101 > 192.168.3.1: ICMP echo request, id 22913, seq 1, length 64
19:31:10.964115 IP 192.168.3.1 > 192.168.3.101: ICMP echo reply, id 22913, seq 1, length 64
19:31:10.970058 IP 192.168.2.101 > 192.168.3.103: ICMP echo request, id 22910, seq 1, length 64
19:31:10.970218 IP 192.168.3.103 > 192.168.2.101: ICMP echo reply, id 22910, seq 1, length 64
19:31:11.006242 IP 192.168.3.101 > 192.168.2.103: ICMP echo request, id 22925, seq 1, length 64
19:31:11.006446 IP 192.168.2.103 > 192.168.3.101: ICMP echo reply, id 22925, seq 1, length 64
19:31:11.027267 IP 192.168.3.101 > 192.168.5.2: ICMP echo request, id 22928, seq 1, length 64
19:31:11.027291 IP 192.168.5.2 > 192.168.3.101: ICMP echo reply, id 22928, seq 1, length 64
19:31:11.042043 IP 192.168.3.101 > 192.168.2.101: ICMP echo request, id 22934, seq 1, length 64
19:31:11.042252 IP 192.168.2.101 > 192.168.3.101: ICMP echo reply, id 22934, seq 1, length 64
19:31:11.046009 IP 192.168.2.101 > 192.168.3.101: ICMP echo request, id 22937, seq 1, length 64
19:31:11.046171 IP 192.168.3.101 > 192.168.2.101: ICMP echo reply, id 22937, seq 1, length 64
19:31:16.077969 IP 192.168.3.101 > 192.168.2.1: ICMP echo request, id 22975, seq 1, length 64
19:31:16.077996 IP 192.168.2.1 > 192.168.3.101: ICMP echo reply, id 22975, seq 1, length 64
19:31:16.093908 IP 192.168.2.101 > 192.168.3.103: ICMP echo request, id 22984, seq 1, length 64
19:31:16.094077 IP 192.168.3.103 > 192.168.2.101: ICMP echo reply, id 22984, seq 1, length 64
19:31:16.102197 IP 192.168.3.101 > 192.168.3.1: ICMP echo request, id 22981, seq 1, length 64
19:31:16.102224 IP 192.168.3.1 > 192.168.3.101: ICMP echo reply, id 22981, seq 1, length 64
19:31:16.137569 IP 192.168.3.101 > 192.168.2.103: ICMP echo request, id 22996, seq 1, length 64
19:31:16.137771 IP 192.168.2.103 > 192.168.3.101: ICMP echo reply, id 22996, seq 1, length 64
19:31:16.158027 IP 192.168.3.101 > 192.168.5.2: ICMP echo request, id 22999, seq 1, length 64
19:31:16.158050 IP 192.168.5.2 > 192.168.3.101: ICMP echo reply, id 22999, seq 1, length 64
19:31:16.175877 IP 192.168.2.101 > 192.168.3.101: ICMP echo request, id 23005, seq 1, length 64
19:31:16.176107 IP 192.168.3.101 > 192.168.2.101: ICMP echo reply, id 23005, seq 1, length 64
19:31:16.177478 IP 192.168.3.101 > 192.168.2.101: ICMP echo request, id 23008, seq 1, length 64
19:31:16.177636 IP 192.168.2.101 > 192.168.3.101: ICMP echo reply, id 23008, seq 1, length 64
19:31:21.204474 IP 192.168.3.101 > 192.168.2.1: ICMP echo request, id 23046, seq 1, length 64
19:31:21.204498 IP 192.168.2.1 > 192.168.3.101: ICMP echo reply, id 23046, seq 1, length 64
19:31:21.227801 IP 192.168.3.101 > 192.168.3.1: ICMP echo request, id 23052, seq 1, length 64
19:31:21.227827 IP 192.168.3.1 > 192.168.3.101: ICMP echo reply, id 23052, seq 1, length 64
19:31:21.230110 IP 192.168.2.101 > 192.168.3.103: ICMP echo request, id 23055, seq 1, length 64
19:31:21.230272 IP 192.168.3.103 > 192.168.2.101: ICMP echo reply, id 23055, seq 1, length 64
19:31:21.267678 IP 192.168.3.101 > 192.168.2.103: ICMP echo request, id 23067, seq 1, length 64
19:31:21.267983 IP 192.168.2.103 > 192.168.3.101: ICMP echo reply, id 23067, seq 1, length 64
19:31:21.285866 IP 192.168.3.101 > 192.168.5.2: ICMP echo request, id 23073, seq 1, length 64
19:31:21.285892 IP 192.168.5.2 > 192.168.3.101: ICMP echo reply, id 23073, seq 1, length 64
19:31:21.302249 IP 192.168.2.101 > 192.168.3.101: ICMP echo request, id 23076, seq 1, length 64
19:31:21.302422 IP 192.168.3.101 > 192.168.2.101: ICMP echo reply, id 23076, seq 1, length 64
19:31:21.306223 IP 192.168.3.101 > 192.168.2.101: ICMP echo request, id 23079, seq 1, length 64
19:31:21.306404 IP 192.168.2.101 > 192.168.3.101: ICMP echo reply, id 23079, seq 1, length 64
19:31:26.216448 ARP, Request who-has 192.168.3.1 tell 192.168.3.101, length 28
19:31:26.216469 ARP, Reply 192.168.3.1 is-at 7e:57:cf:bc:b6:42 (oui Unknown), length 28
19:31:26.232947 ARP, Request who-has 192.168.3.1 tell 192.168.3.103, length 28
19:31:26.232968 ARP, Reply 192.168.3.1 is-at 7e:57:cf:bc:b6:42 (oui Unknown), length 28
19:31:26.330779 IP 192.168.3.101 > 192.168.2.1: ICMP echo request, id 23119, seq 1, length 64
19:31:26.330802 IP 192.168.2.1 > 192.168.3.101: ICMP echo reply, id 23119, seq 1, length 64
19:31:26.362399 IP 192.168.3.101 > 192.168.3.1: ICMP echo request, id 23127, seq 1, length 64
19:31:26.362427 IP 192.168.3.1 > 192.168.3.101: ICMP echo reply, id 23127, seq 1, length 64
19:31:26.380280 IP 192.168.2.101 > 192.168.3.103: ICMP echo request, id 23132, seq 1, length 64
19:31:26.380456 IP 192.168.3.103 > 192.168.2.101: ICMP echo reply, id 23132, seq 1, length 64
19:31:26.439236 IP 192.168.3.101 > 192.168.2.103: ICMP echo request, id 23144, seq 1, length 64
19:31:26.439520 IP 192.168.2.103 > 192.168.3.101: ICMP echo reply, id 23144, seq 1, length 64
19:31:26.456086 IP 192.168.3.101 > 192.168.5.2: ICMP echo request, id 23153, seq 1, length 64
19:31:26.456112 IP 192.168.5.2 > 192.168.3.101: ICMP echo reply, id 23153, seq 1, length 64
19:31:26.478004 IP 192.168.2.101 > 192.168.3.101: ICMP echo request, id 23159, seq 1, length 64
19:31:26.478258 IP 192.168.3.101 > 192.168.2.101: ICMP echo reply, id 23159, seq 1, length 64
19:31:26.482409 IP 192.168.3.101 > 192.168.2.101: ICMP echo request, id 23156, seq 1, length 64
19:31:26.482676 IP 192.168.2.101 > 192.168.3.101: ICMP echo reply, id 23156, seq 1, length 64
19:31:31.336277 ARP, Request who-has 192.168.3.101 tell 192.168.3.1, length 28
19:31:31.336627 ARP, Reply 192.168.3.101 is-at b6:fa:f8:3f:53:b3 (oui Unknown), length 28
19:31:31.518092 IP 192.168.3.101 > 192.168.2.1: ICMP echo request, id 23252, seq 1, length 64
19:31:31.518113 IP 192.168.2.1 > 192.168.3.101: ICMP echo reply, id 23252, seq 1, length 64
19:31:31.538734 IP 192.168.3.101 > 192.168.3.1: ICMP echo request, id 23258, seq 1, length 64
19:31:31.538758 IP 192.168.3.1 > 192.168.3.101: ICMP echo reply, id 23258, seq 1, length 64
19:31:31.540508 IP 192.168.2.101 > 192.168.3.103: ICMP echo request, id 23261, seq 1, length 64
19:31:31.540665 IP 192.168.3.103 > 192.168.2.101: ICMP echo reply, id 23261, seq 1, length 64
19:31:31.574917 IP 192.168.3.101 > 192.168.2.103: ICMP echo request, id 23270, seq 1, length 64
19:31:31.575110 IP 192.168.2.103 > 192.168.3.101: ICMP echo reply, id 23270, seq 1, length 64
19:31:31.601254 IP 192.168.3.101 > 192.168.5.2: ICMP echo request, id 23276, seq 1, length 64
19:31:31.601278 IP 192.168.5.2 > 192.168.3.101: ICMP echo reply, id 23276, seq 1, length 64
19:31:31.616115 IP 192.168.2.101 > 192.168.3.101: ICMP echo request, id 23285, seq 1, length 64
19:31:31.616287 IP 192.168.3.101 > 192.168.2.101: ICMP echo reply, id 23285, seq 1, length 64
19:31:31.620276 IP 192.168.3.101 > 192.168.2.101: ICMP echo request, id 23282, seq 1, length 64
19:31:31.620566 IP 192.168.2.101 > 192.168.3.101: ICMP echo reply, id 23282, seq 1, length 64
19:31:36.552480 ARP, Request who-has 192.168.3.103 tell 192.168.3.1, length 28
19:31:36.552782 ARP, Reply 192.168.3.103 is-at 06:65:b2:52:b9:c2 (oui Unknown), length 28
19:31:36.650607 IP 192.168.3.101 > 192.168.2.1: ICMP echo request, id 23335, seq 1, length 64
19:31:36.650634 IP 192.168.2.1 > 192.168.3.101: ICMP echo reply, id 23335, seq 1, length 64
19:31:36.667344 IP 192.168.2.101 > 192.168.3.103: ICMP echo request, id 23344, seq 1, length 64
19:31:36.667589 IP 192.168.3.103 > 192.168.2.101: ICMP echo reply, id 23344, seq 1, length 64
19:31:36.679276 IP 192.168.3.101 > 192.168.3.1: ICMP echo request, id 23341, seq 1, length 64
19:31:36.679303 IP 192.168.3.1 > 192.168.3.101: ICMP echo reply, id 23341, seq 1, length 64
19:31:36.714668 IP 192.168.3.101 > 192.168.2.103: ICMP echo request, id 23356, seq 1, length 64
19:31:36.714928 IP 192.168.2.103 > 192.168.3.101: ICMP echo reply, id 23356, seq 1, length 64
19:31:36.739127 IP 192.168.3.101 > 192.168.5.2: ICMP echo request, id 23359, seq 1, length 64
19:31:36.739155 IP 192.168.5.2 > 192.168.3.101: ICMP echo reply, id 23359, seq 1, length 64
19:31:36.763558 IP 192.168.3.101 > 192.168.2.101: ICMP echo request, id 23368, seq 1, length 64
19:31:36.763844 IP 192.168.2.101 > 192.168.3.101: ICMP echo reply, id 23368, seq 1, length 64
19:31:36.766493 IP 192.168.2.101 > 192.168.3.101: ICMP echo request, id 23365, seq 1, length 64
19:31:36.766811 IP 192.168.3.101 > 192.168.2.101: ICMP echo reply, id 23365, seq 1, length 64

19:31:41.801307 IP 192.168.3.101 > 192.168.2.1: ICMP echo request, id 23472, seq 1, length 64
19:31:41.801327 IP 192.168.2.1 > 192.168.3.101: ICMP echo reply, id 23472, seq 1, length 64
19:31:41.824013 IP 192.168.2.101 > 192.168.3.103: ICMP echo request, id 23481, seq 1, length 64
19:31:41.824392 IP 192.168.3.103 > 192.168.2.101: ICMP echo reply, id 23481, seq 1, length 64
19:31:41.826924 IP 192.168.3.101 > 192.168.3.1: ICMP echo request, id 23478, seq 1, length 64
19:31:41.826950 IP 192.168.3.1 > 192.168.3.101: ICMP echo reply, id 23478, seq 1, length 64
19:31:41.866988 IP 192.168.3.101 > 192.168.2.103: ICMP echo request, id 23493, seq 1, length 64
19:31:41.867351 IP 192.168.2.103 > 192.168.3.101: ICMP echo reply, id 23493, seq 1, length 64
19:31:41.889121 IP 192.168.3.101 > 192.168.5.2: ICMP echo request, id 23499, seq 1, length 64
19:31:41.889145 IP 192.168.5.2 > 192.168.3.101: ICMP echo reply, id 23499, seq 1, length 64
19:31:41.902794 IP 192.168.3.101 > 192.168.2.101: ICMP echo request, id 23502, seq 1, length 64
19:31:41.903257 IP 192.168.2.101 > 192.168.3.101: ICMP echo reply, id 23502, seq 1, length 64
19:31:41.910159 IP 192.168.2.101 > 192.168.3.101: ICMP echo request, id 23505, seq 1, length 64
19:31:41.910404 IP 192.168.3.101 > 192.168.2.101: ICMP echo reply, id 23505, seq 1, length 64
19:31:46.824535 ARP, Request who-has 192.168.3.1 tell 192.168.3.103, length 28
19:31:46.824559 ARP, Reply 192.168.3.1 is-at 7e:57:cf:bc:b6:42 (oui Unknown), length 28
19:31:46.941416 IP 192.168.3.101 > 192.168.2.1: ICMP echo request, id 23547, seq 1, length 64
19:31:46.941443 IP 192.168.2.1 > 192.168.3.101: ICMP echo reply, id 23547, seq 1, length 64
19:31:46.956277 IP 192.168.3.101 > 192.168.3.1: ICMP echo request, id 23553, seq 1, length 64
19:31:46.956301 IP 192.168.3.1 > 192.168.3.101: ICMP echo reply, id 23553, seq 1, length 64
19:31:46.968354 IP 192.168.2.101 > 192.168.3.103: ICMP echo request, id 23556, seq 1, length 64
19:31:46.968519 IP 192.168.3.103 > 192.168.2.101: ICMP echo reply, id 23556, seq 1, length 64
19:31:46.991108 IP 192.168.3.101 > 192.168.2.103: ICMP echo request, id 23565, seq 1, length 64
19:31:46.991291 IP 192.168.2.103 > 192.168.3.101: ICMP echo reply, id 23565, seq 1, length 64
19:31:47.012523 IP 192.168.3.101 > 192.168.5.2: ICMP echo request, id 23571, seq 1, length 64
19:31:47.012553 IP 192.168.5.2 > 192.168.3.101: ICMP echo reply, id 23571, seq 1, length 64
19:31:47.027467 IP 192.168.3.101 > 192.168.2.101: ICMP echo request, id 23577, seq 1, length 64
19:31:47.027665 IP 192.168.2.101 > 192.168.3.101: ICMP echo reply, id 23577, seq 1, length 64
19:31:47.046767 IP 192.168.2.101 > 192.168.3.101: ICMP echo request, id 23583, seq 1, length 64
19:31:47.046937 IP 192.168.3.101 > 192.168.2.101: ICMP echo reply, id 23583, seq 1, length 64
19:31:52.066369 IP 192.168.3.101 > 192.168.2.1: ICMP echo request, id 23621, seq 1, length 64
19:31:52.066397 IP 192.168.2.1 > 192.168.3.101: ICMP echo reply, id 23621, seq 1, length 64
19:31:52.091815 IP 192.168.3.101 > 192.168.3.1: ICMP echo request, id 23624, seq 1, length 64
19:31:52.091834 IP 192.168.3.1 > 192.168.3.101: ICMP echo reply, id 23624, seq 1, length 64
19:31:52.106037 IP 192.168.2.101 > 192.168.3.103: ICMP echo request, id 23630, seq 1, length 64
19:31:52.106206 IP 192.168.3.103 > 192.168.2.101: ICMP echo reply, id 23630, seq 1, length 64
19:31:52.128150 IP 192.168.3.101 > 192.168.2.103: ICMP echo request, id 23639, seq 1, length 64
19:31:52.128470 IP 192.168.2.103 > 192.168.3.101: ICMP echo reply, id 23639, seq 1, length 64
19:31:52.142304 IP 192.168.3.101 > 192.168.5.2: ICMP echo request, id 23645, seq 1, length 64
19:31:52.142331 IP 192.168.5.2 > 192.168.3.101: ICMP echo reply, id 23645, seq 1, length 64
19:31:52.167446 IP 192.168.3.101 > 192.168.2.101: ICMP echo request, id 23648, seq 1, length 64
19:31:52.167849 IP 192.168.2.101 > 192.168.3.101: ICMP echo reply, id 23648, seq 1, length 64
19:31:52.182085 IP 192.168.2.101 > 192.168.3.101: ICMP echo request, id 23654, seq 1, length 64
19:31:52.182255 IP 192.168.3.101 > 192.168.2.101: ICMP echo reply, id 23654, seq 1, length 64
19:31:57.080442 ARP, Request who-has 192.168.3.101 tell 192.168.3.1, length 28
19:31:57.080720 ARP, Request who-has 192.168.3.1 tell 192.168.3.101, length 28
19:31:57.080744 ARP, Reply 192.168.3.1 is-at 7e:57:cf:bc:b6:42 (oui Unknown), length 28
