19:29:11.445750 IP 192.168.2.101 > 192.168.3.1: ICMP echo request, id 20978, seq 1, length 64
19:29:11.445779 IP 192.168.3.1 > 192.168.2.101: ICMP echo reply, id 20978, seq 1, length 64
19:29:11.471217 IP 192.168.2.101 > 192.168.3.103: ICMP echo request, id 20982, seq 1, length 64
19:29:11.475211 IP 192.168.3.103 > 192.168.2.101: ICMP echo reply, id 20982, seq 1, length 64
19:29:11.495825 IP 192.168.2.101 > 192.168.5.1: ICMP echo request, id 20988, seq 1, length 64
19:29:12.517572 IP 192.168.2.101 > 192.168.1.103: ICMP echo request, id 21003, seq 1, length 64
19:29:13.529365 IP 192.168.2.101 > 12.10.5.1: ICMP echo request, id 21015, seq 1, length 64
19:29:14.544517 IP 192.168.2.101 > 192.168.4.2: ICMP echo request, id 21027, seq 1, length 64
19:29:15.400785 ARP, Request who-has 192.168.2.101 tell 192.168.2.1, length 28
19:29:15.404036 ARP, Reply 192.168.2.101 is-at b6:ea:fb:cf:55:62 (oui Unknown), length 28
19:29:15.557958 IP 192.168.2.101 > 192.168.1.1: ICMP echo request, id 21042, seq 1, length 64
19:29:16.571511 IP 192.168.2.101 > 192.168.4.1: ICMP echo request, id 21060, seq 1, length 64
19:29:17.585521 ARP, Request who-has 192.168.2.103 tell 192.168.2.101, length 28
19:29:17.605020 IP 192.168.2.101 > 192.168.5.2: ICMP echo request, id 21095, seq 1, length 64
19:29:17.605048 IP 192.168.5.2 > 192.168.2.101: ICMP echo reply, id 21095, seq 1, length 64
19:29:17.624261 IP 192.168.3.101 > 192.168.2.103: ICMP echo request, id 21098, seq 1, length 64
19:29:17.628616 IP 192.168.2.103 > 192.168.3.101: ICMP echo reply, id 21098, seq 1, length 64
19:29:17.657077 IP 192.168.3.101 > 192.168.2.101: ICMP echo request, id 21107, seq 1, length 64
19:29:17.660695 IP 192.168.2.101 > 192.168.3.101: ICMP echo reply, id 21107, seq 1, length 64
19:29:22.632986 ARP, Request who-has 192.168.2.1 tell 192.168.2.103, length 28
19:29:22.633003 ARP, Reply 192.168.2.1 is-at 3a:77:af:3c:c1:c1 (oui Unknown), length 28
19:29:22.642685 IP 192.168.2.101 > 192.168.2.1: ICMP echo request, id 21189, seq 1, length 64
19:29:22.642713 IP 192.168.2.1 > 192.168.2.101: ICMP echo reply, id 21189, seq 1, length 64
19:29:22.653614 IP 192.168.2.101 > 12.10.5.103: ICMP echo request, id 21192, seq 1, length 64
19:29:23.662302 IP 192.168.2.101 > 192.168.3.1: ICMP echo request, id 21201, seq 1, length 64
19:29:23.662330 IP 192.168.3.1 > 192.168.2.101: ICMP echo reply, id 21201, seq 1, length 64
19:29:23.673374 IP 192.168.2.101 > 192.168.3.103: ICMP echo request, id 21204, seq 1, length 64
19:29:23.673698 IP 192.168.3.103 > 192.168.2.101: ICMP echo reply, id 21204, seq 1, length 64
19:29:23.679641 IP 192.168.2.101 > 192.168.5.1: ICMP echo request, id 21207, seq 1, length 64
19:29:24.693129 IP 192.168.2.101 > 192.168.1.103: ICMP echo request, id 21222, seq 1, length 64
19:29:25.702932 IP 192.168.2.101 > 12.10.5.1: ICMP echo request, id 21231, seq 1, length 64
19:29:26.712472 IP 192.168.2.101 > 192.168.4.2: ICMP echo request, id 21243, seq 1, length 64
19:29:27.724058 IP 192.168.2.101 > 192.168.1.1: ICMP echo request, id 21258, seq 1, length 64
19:29:28.734002 IP 192.168.2.101 > 192.168.4.1: ICMP echo request, id 21270, seq 1, length 64
19:29:29.755406 IP 192.168.2.101 > 192.168.5.2: ICMP echo request, id 21290, seq 1, length 64
19:29:29.755437 IP 192.168.5.2 > 192.168.2.101: ICMP echo reply, id 21290, seq 1, length 64
19:29:29.777339 IP 192.168.2.101 > 192.168.3.101: ICMP echo request, id 21296, seq 1, length 64
19:29:29.784968 IP 192.168.3.101 > 192.168.2.101: ICMP echo reply, id 21296, seq 1, length 64
19:29:29.797158 IP 192.168.3.101 > 192.168.2.103: ICMP echo request, id 21299, seq 1, length 64
19:29:29.797361 IP 192.168.2.103 > 192.168.3.101: ICMP echo reply, id 21299, seq 1, length 64
19:29:29.817785 IP 192.168.3.101 > 192.168.2.101: ICMP echo request, id 21305, seq 1, length 64
19:29:29.818033 IP 192.168.2.101 > 192.168.3.101: ICMP echo reply, id 21305, seq 1, length 64
19:29:34.802976 IP 192.168.2.101 > 192.168.2.1: ICMP echo request, id 21349, seq 1, length 64
19:29:34.803006 IP 192.168.2.1 > 192.168.2.101: ICMP echo reply, id 21349, seq 1, length 64
19:29:34.814207 IP 192.168.2.101 > 12.10.5.103: ICMP echo request, id 21352, seq 1, length 64
19:29:35.824799 IP 192.168.2.101 > 192.168.3.1: ICMP echo request, id 21364, seq 1, length 64
19:29:35.824829 IP 192.168.3.1 > 192.168.2.101: ICMP echo reply, id 21364, seq 1, length 64
19:29:35.834157 IP 192.168.2.101 > 192.168.3.103: ICMP echo request, id 21367, seq 1, length 64
19:29:35.834352 IP 192.168.3.103 > 192.168.2.101: ICMP echo reply, id 21367, seq 1, length 64
19:29:35.843735 IP 192.168.2.101 > 192.168.5.1: ICMP echo request, id 21370, seq 1, length 64
19:29:36.853701 IP 192.168.2.101 > 192.168.1.103: ICMP echo request, id 21385, seq 1, length 64
19:29:37.863788 IP 192.168.2.101 > 12.10.5.1: ICMP echo request, id 21397, seq 1, length 64
19:29:38.874070 IP 192.168.2.101 > 192.168.4.2: ICMP echo request, id 21406, seq 1, length 64

19:29:40.893880 IP 192.168.2.101 > 192.168.4.1: ICMP echo request, id 21441, seq 1, length 64
19:29:41.913468 IP 192.168.2.101 > 192.168.5.2: ICMP echo request, id 21453, seq 1, length 64
19:29:41.913495 IP 192.168.5.2 > 192.168.2.101: ICMP echo reply, id 21453, seq 1, length 64
19:29:41.930436 IP 192.168.2.101 > 192.168.3.101: ICMP echo request, id 21459, seq 1, length 64
19:29:41.930715 IP 192.168.3.101 > 192.168.2.101: ICMP echo reply, id 21459, seq 1, length 64
19:29:41.942202 IP 192.168.3.101 > 192.168.2.103: ICMP echo request, id 21462, seq 1, length 64
19:29:41.942378 IP 192.168.2.103 > 192.168.3.101: ICMP echo reply, id 21462, seq 1, length 64
19:29:41.961202 IP 192.168.3.101 > 192.168.2.101: ICMP echo request, id 21468, seq 1, length 64
19:29:41.961363 IP 192.168.2.101 > 192.168.3.101: ICMP echo reply, id 21468, seq 1, length 64
19:29:46.949995 IP 192.168.2.101 > 192.168.2.1: ICMP echo request, id 21517, seq 1, length 64
19:29:46.950029 IP 192.168.2.1 > 192.168.2.101: ICMP echo reply, id 21517, seq 1, length 64
19:29:46.952827 ARP, Request who-has 192.168.2.1 tell 192.168.2.103, length 28
19:29:46.952843 ARP, Reply 192.168.2.1 is-at 3a:77:af:3c:c1:c1 (oui Unknown), length 28
19:29:46.962229 IP 192.168.2.101 > 12.10.5.103: ICMP echo request, id 21520, seq 1, length 64
19:29:47.972330 IP 192.168.2.101 > 192.168.3.103: ICMP echo request, id 21538, seq 1, length 64
19:29:47.972637 IP 192.168.3.103 > 192.168.2.101: ICMP echo reply, id 21538, seq 1, length 64
19:29:47.982278 IP 192.168.2.101 > 192.168.5.1: ICMP echo request, id 21541, seq 1, length 64
19:29:48.992245 IP 192.168.2.101 > 12.10.5.1: ICMP echo request, id 21557, seq 1, length 64
19:29:50.001874 IP 192.168.2.101 > 192.168.1.1: ICMP echo request, id 21566, seq 1, length 64
19:29:51.023654 IP 192.168.2.101 > 192.168.5.2: ICMP echo request, id 21578, seq 1, length 64
19:29:51.023686 IP 192.168.5.2 > 192.168.2.101: ICMP echo reply, id 21578, seq 1, length 64
19:29:51.051712 IP 192.168.3.101 > 192.168.2.103: ICMP echo request, id 21587, seq 1, length 64
19:29:51.052043 IP 192.168.2.103 > 192.168.3.101: ICMP echo reply, id 21587, seq 1, length 64
19:29:51.054154 IP 192.168.2.101 > 192.168.3.101: ICMP echo request, id 21584, seq 1, length 64
19:29:51.054329 IP 192.168.3.101 > 192.168.2.101: ICMP echo reply, id 21584, seq 1, length 64
19:29:51.074403 IP 192.168.3.101 > 192.168.2.101: ICMP echo request, id 21593, seq 1, length 64
19:29:51.074589 IP 192.168.2.101 > 192.168.3.101: ICMP echo reply, id 21593, seq 1, length 64
19:29:51.960293 ARP, Request who-has 192.168.2.101 tell 192.168.2.1, length 28
19:29:51.960753 ARP, Reply 192.168.2.101 is-at b6:ea:fb:cf:55:62 (oui Unknown), length 28
19:29:56.056274 ARP, Request who-has 192.168.2.103 tell 192.168.2.1, length 28
19:29:56.056691 ARP, Reply 192.168.2.103 is-at 56:65:50:8d:2d:fa (oui Unknown), length 28
19:29:56.073577 IP 192.168.2.101 > 192.168.2.1: ICMP echo request, id 21636, seq 1, length 64
19:29:56.073607 IP 192.168.2.1 > 192.168.2.101: ICMP echo reply, id 21636, seq 1, length 64
19:29:56.092063 IP 192.168.2.101 > 192.168.3.1: ICMP echo request, id 21642, seq 1, length 64
19:29:56.092092 IP 192.168.3.1 > 192.168.2.101: ICMP echo reply, id 21642, seq 1, length 64
19:29:56.129416 IP 192.168.2.101 > 192.168.3.103: ICMP echo request, id 21649, seq 1, length 64
19:29:56.129695 IP 192.168.3.103 > 192.168.2.101: ICMP echo reply, id 21649, seq 1, length 64
19:29:56.168996 IP 192.168.2.101 > 192.168.1.103: ICMP echo request, id 21656, seq 1, length 64
19:29:57.179582 IP 192.168.2.101 > 192.168.4.1: ICMP echo request, id 21714, seq 1, length 64
19:29:58.190285 IP 192.168.2.101 > 192.168.5.2: ICMP echo request, id 21723, seq 1, length 64
19:29:58.190316 IP 192.168.5.2 > 192.168.2.101: ICMP echo reply, id 21723, seq 1, length 64
19:29:58.208854 IP 192.168.2.101 > 192.168.3.101: ICMP echo request, id 21729, seq 1, length 64
19:29:58.209198 IP 192.168.3.101 > 192.168.2.101: ICMP echo reply, id 21729, seq 1, length 64
19:29:58.235386 IP 192.168.3.101 > 192.168.2.101: ICMP echo request, id 21735, seq 1, length 64
19:29:58.235571 IP 192.168.2.101 > 192.168.3.101: ICMP echo reply, id 21735, seq 1, length 64
19:30:01.082615 ARP, Request who-has 192.168.2.1 tell 192.168.2.101, length 28
19:30:01.082637 ARP, Reply 192.168.2.1 is-at 3a:77:af:3c:c1:c1 (oui Unknown), length 28
19:30:03.224244 IP 192.168.2.101 > 192.168.2.1: ICMP echo request, id 21762, seq 1, length 64
19:30:03.224271 IP 192.168.2.1 > 192.168.2.101: ICMP echo reply, id 21762, seq 1, length 64
19:30:03.233493 IP 192.168.2.101 > 192.168.3.1: ICMP echo request, id 21765, seq 1, length 64
19:30:03.233520 IP 192.168.3.1 > 192.168.2.101: ICMP echo reply, id 21765, seq 1, length 64
19:30:03.242483 IP 192.168.2.101 > 192.168.3.103: ICMP echo request, id 21768, seq 1, length 64
19:30:03.242676 IP 192.168.3.103 > 192.168.2.101: ICMP echo reply, id 21768, seq 1, length 64
19:30:03.251812 IP 192.168.2.101 > 192.168.4.2: ICMP echo request, id 21771, seq 1, length 64
19:30:04.263772 IP 192.168.2.101 > 192.168.5.2: ICMP echo request, id 21802, seq 1, length 64
19:30:04.263803 IP 192.168.5.2 > 192.168.2.101: ICMP echo reply, id 21802, seq 1, length 64
19:30:04.306259 IP 192.168.2.101 > 192.168.3.101: ICMP echo request, id 21808, seq 1, length 64
19:30:04.306541 IP 192.168.3.101 > 192.168.2.101: ICMP echo reply, id 21808, seq 1, length 64
19:30:04.319547 IP 192.168.3.101 > 192.168.2.101: ICMP echo request, id 21814, seq 1, length 64
19:30:04.319798 IP 192.168.2.101 > 192.168.3.101: ICMP echo reply, id 21814, seq 1, length 64
19:30:09.319150 IP 192.168.2.101 > 192.168.2.1: ICMP echo request, id 21893, seq 1, length 64
19:30:09.319180 IP 192.168.2.1 > 192.168.2.101: ICMP echo reply, id 21893, seq 1, length 64
19:30:09.329720 IP 192.168.2.101 > 192.168.3.1: ICMP echo request, id 21896, seq 1, length 64
19:30:09.329750 IP 192.168.3.1 > 192.168.2.101: ICMP echo reply, id 21896, seq 1, length 64
19:30:09.344418 IP 192.168.2.101 > 192.168.3.103: ICMP echo request, id 21899, seq 1, length 64
19:30:09.344645 IP 192.168.3.103 > 192.168.2.101: ICMP echo reply, id 21899, seq 1, length 64
19:30:09.390825 IP 192.168.2.101 > 192.168.5.2: ICMP echo request, id 21911, seq 1, length 64
19:30:09.390857 IP 192.168.5.2 > 192.168.2.101: ICMP echo reply, id 21911, seq 1, length 64
19:30:09.408573 IP 192.168.3.101 > 192.168.2.103: ICMP echo request, id 21920, seq 1, length 64
19:30:09.408797 IP 192.168.2.103 > 192.168.3.101: ICMP echo reply, id 21920, seq 1, length 64
19:30:09.430291 IP 192.168.2.101 > 192.168.3.101: ICMP echo request, id 21926, seq 1, length 64
19:30:09.430585 IP 192.168.3.101 > 192.168.2.101: ICMP echo reply, id 21926, seq 1, length 64
19:30:09.447681 IP 192.168.3.101 > 192.168.2.101: ICMP echo request, id 21929, seq 1, length 64
19:30:09.448015 IP 192.168.2.101 > 192.168.3.101: ICMP echo reply, id 21929, seq 1, length 64

19:30:14.424602 ARP, Request who-has 192.168.2.1 tell 192.168.2.103, length 28
19:30:14.424626 ARP, Reply 192.168.2.1 is-at 3a:77:af:3c:c1:c1 (oui Unknown), length 28
19:30:14.453290 IP 192.168.2.101 > 192.168.2.1: ICMP echo request, id 21979, seq 1, length 64
19:30:14.453359 IP 192.168.2.1 > 192.168.2.101: ICMP echo reply, id 21979, seq 1, length 64
19:30:14.462325 IP 192.168.2.101 > 192.168.3.1: ICMP echo request, id 21982, seq 1, length 64
19:30:14.462351 IP 192.168.3.1 > 192.168.2.101: ICMP echo reply, id 21982, seq 1, length 64
19:30:14.479081 IP 192.168.2.101 > 192.168.3.103: ICMP echo request, id 21988, seq 1, length 64
19:30:14.479353 IP 192.168.3.103 > 192.168.2.101: ICMP echo reply, id 21988, seq 1, length 64
19:30:14.516039 IP 192.168.2.101 > 192.168.5.2: ICMP echo request, id 21997, seq 1, length 64
19:30:14.516066 IP 192.168.5.2 > 192.168.2.101: ICMP echo reply, id 21997, seq 1, length 64
19:30:14.536537 IP 192.168.3.101 > 192.168.2.103: ICMP echo request, id 22003, seq 1, length 64
19:30:14.536746 IP 192.168.2.103 > 192.168.3.101: ICMP echo reply, id 22003, seq 1, length 64
19:30:14.553021 IP 192.168.2.101 > 192.168.3.101: ICMP echo request, id 22009, seq 1, length 64
19:30:14.553275 IP 192.168.3.101 > 192.168.2.101: ICMP echo reply, id 22009, seq 1, length 64
19:30:14.562350 IP 192.168.3.101 > 192.168.2.101: ICMP echo request, id 22015, seq 1, length 64
19:30:14.562524 IP 192.168.2.101 > 192.168.3.101: ICMP echo reply, id 22015, seq 1, length 64
19:30:19.568128 IP 192.168.2.101 > 192.168.2.1: ICMP echo request, id 22050, seq 1, length 64
19:30:19.568156 IP 192.168.2.1 > 192.168.2.101: ICMP echo reply, id 22050, seq 1, length 64
19:30:19.577105 IP 192.168.2.101 > 192.168.3.1: ICMP echo request, id 22053, seq 1, length 64
19:30:19.577127 IP 192.168.3.1 > 192.168.2.101: ICMP echo reply, id 22053, seq 1, length 64
19:30:19.594836 IP 192.168.2.101 > 192.168.3.103: ICMP echo request, id 22056, seq 1, length 64
19:30:19.595041 IP 192.168.3.103 > 192.168.2.101: ICMP echo reply, id 22056, seq 1, length 64
19:30:19.635023 IP 192.168.2.101 > 192.168.5.2: ICMP echo request, id 22071, seq 1, length 64
19:30:19.635055 IP 192.168.5.2 > 192.168.2.101: ICMP echo reply, id 22071, seq 1, length 64
19:30:19.650362 IP 192.168.3.101 > 192.168.2.103: ICMP echo request, id 22074, seq 1, length 64
19:30:19.650543 IP 192.168.2.103 > 192.168.3.101: ICMP echo reply, id 22074, seq 1, length 64
19:30:19.666195 IP 192.168.2.101 > 192.168.3.101: ICMP echo request, id 22083, seq 1, length 64
19:30:19.666420 IP 192.168.3.101 > 192.168.2.101: ICMP echo reply, id 22083, seq 1, length 64
19:30:19.685107 IP 192.168.3.101 > 192.168.2.101: ICMP echo request, id 22086, seq 1, length 64
19:30:19.685297 IP 192.168.2.101 > 192.168.3.101: ICMP echo reply, id 22086, seq 1, length 64
19:30:24.687728 IP 192.168.2.101 > 192.168.2.1: ICMP echo request, id 22116, seq 1, length 64
19:30:24.687761 IP 192.168.2.1 > 192.168.2.101: ICMP echo reply, id 22116, seq 1, length 64
19:30:24.696919 IP 192.168.2.101 > 192.168.3.1: ICMP echo request, id 22119, seq 1, length 64
19:30:24.696944 IP 192.168.3.1 > 192.168.2.101: ICMP echo reply, id 22119, seq 1, length 64
19:30:24.708712 IP 192.168.2.101 > 192.168.3.103: ICMP echo request, id 22122, seq 1, length 64
19:30:24.708912 IP 192.168.3.103 > 192.168.2.101: ICMP echo reply, id 22122, seq 1, length 64
19:30:24.750416 IP 192.168.2.101 > 192.168.5.2: ICMP echo request, id 22134, seq 1, length 64
19:30:24.750478 IP 192.168.5.2 > 192.168.2.101: ICMP echo reply, id 22134, seq 1, length 64
19:30:24.769841 IP 192.168.3.101 > 192.168.2.103: ICMP echo request, id 22140, seq 1, length 64
19:30:24.770014 IP 192.168.2.103 > 192.168.3.101: ICMP echo reply, id 22140, seq 1, length 64
19:30:24.790437 IP 192.168.2.101 > 192.168.3.101: ICMP echo request, id 22146, seq 1, length 64
19:30:24.790699 IP 192.168.3.101 > 192.168.2.101: ICMP echo reply, id 22146, seq 1, length 64
19:30:24.802161 IP 192.168.3.101 > 192.168.2.101: ICMP echo request, id 22152, seq 1, length 64
19:30:24.802320 IP 192.168.2.101 > 192.168.3.101: ICMP echo reply, id 22152, seq 1, length 64
19:30:29.688265 ARP, Request who-has 192.168.2.101 tell 192.168.2.1, length 28
19:30:29.688616 ARP, Reply 192.168.2.101 is-at b6:ea:fb:cf:55:62 (oui Unknown), length 28
19:30:29.805878 IP 192.168.2.101 > 192.168.2.1: ICMP echo request, id 22178, seq 1, length 64
19:30:29.805906 IP 192.168.2.1 > 192.168.2.101: ICMP echo reply, id 22178, seq 1, length 64
19:30:29.814577 IP 192.168.2.101 > 192.168.3.1: ICMP echo request, id 22181, seq 1, length 64
19:30:29.814608 IP 192.168.3.1 > 192.168.2.101: ICMP echo reply, id 22181, seq 1, length 64
19:30:29.835255 IP 192.168.2.101 > 192.168.3.103: ICMP echo request, id 22187, seq 1, length 64
19:30:29.835535 IP 192.168.3.103 > 192.168.2.101: ICMP echo reply, id 22187, seq 1, length 64
19:30:29.871713 IP 192.168.2.101 > 192.168.5.2: ICMP echo request, id 22199, seq 1, length 64
19:30:29.871743 IP 192.168.5.2 > 192.168.2.101: ICMP echo reply, id 22199, seq 1, length 64
19:30:29.900370 IP 192.168.3.101 > 192.168.2.103: ICMP echo request, id 22205, seq 1, length 64
19:30:29.900698 IP 192.168.2.103 > 192.168.3.101: ICMP echo reply, id 22205, seq 1, length 64
19:30:29.926480 IP 192.168.2.101 > 192.168.3.101: ICMP echo request, id 22208, seq 1, length 64
19:30:29.926694 IP 192.168.3.101 > 192.168.2.101: ICMP echo reply, id 22208, seq 1, length 64
19:30:29.936471 IP 192.168.3.101 > 192.168.2.101: ICMP echo request, id 22214, seq 1, length 64
19:30:29.936646 IP 192.168.2.101 > 192.168.3.101: ICMP echo reply, id 22214, seq 1, length 64
19:30:34.808688 ARP, Request who-has 192.168.2.1 tell 192.168.2.101, length 28
19:30:34.808710 ARP, Reply 192.168.2.1 is-at 3a:77:af:3c:c1:c1 (oui Unknown), length 28
19:30:34.904250 ARP, Request who-has 192.168.2.103 tell 192.168.2.1, length 28
19:30:34.904653 ARP, Reply 192.168.2.103 is-at 56:65:50:8d:2d:fa (oui Unknown), length 28
19:30:34.942150 IP 192.168.2.101 > 192.168.2.1: ICMP echo request, id 22249, seq 1, length 64
19:30:34.942180 IP 192.168.2.1 > 192.168.2.101: ICMP echo reply, id 22249, seq 1, length 64
19:30:34.954012 IP 192.168.2.101 > 192.168.3.1: ICMP echo request, id 22252, seq 1, length 64
19:30:34.954040 IP 192.168.3.1 > 192.168.2.101: ICMP echo reply, id 22252, seq 1, length 64
19:30:34.966212 IP 192.168.2.101 > 192.168.3.103: ICMP echo request, id 22258, seq 1, length 64
19:30:34.966564 IP 192.168.3.103 > 192.168.2.101: ICMP echo reply, id 22258, seq 1, length 64
19:30:35.016923 IP 192.168.2.101 > 192.168.5.2: ICMP echo request, id 22267, seq 1, length 64
19:30:35.016956 IP 192.168.5.2 > 192.168.2.101: ICMP echo reply, id 22267, seq 1, length 64
19:30:35.028130 IP 192.168.3.101 > 192.168.2.103: ICMP echo request, id 22273, seq 1, length 64
19:30:35.028479 IP 192.168.2.103 > 192.168.3.101: ICMP echo reply, id 22273, seq 1, length 64
19:30:35.054285 IP 192.168.2.101 > 192.168.3.101: ICMP echo request, id 22279, seq 1, length 64
19:30:35.054472 IP 192.168.3.101 > 192.168.2.101: ICMP echo reply, id 22279, seq 1, length 64
19:30:35.067084 IP 192.168.3.101 > 192.168.2.101: ICMP echo request, id 22285, seq 1, length 64
19:30:35.067283 IP 192.168.2.101 > 192.168.3.101: ICMP echo reply, id 22285, seq 1, length 64

19:30:45.180799 IP 192.168.2.101 > 192.168.2.1: ICMP echo request, id 22463, seq 1, length 64
19:30:45.180830 IP 192.168.2.1 > 192.168.2.101: ICMP echo reply, id 22463, seq 1, length 64
19:30:45.193914 IP 192.168.2.101 > 192.168.3.1: ICMP echo request, id 22466, seq 1, length 64
19:30:45.194095 IP 192.168.3.1 > 192.168.2.101: ICMP echo reply, id 22466, seq 1, length 64
19:30:45.205178 IP 192.168.2.101 > 192.168.3.103: ICMP echo request, id 22469, seq 1, length 64
19:30:45.205565 IP 192.168.3.103 > 192.168.2.101: ICMP echo reply, id 22469, seq 1, length 64
19:30:45.240785 IP 192.168.2.101 > 192.168.5.2: ICMP echo request, id 22475, seq 1, length 64
19:30:45.240810 IP 192.168.5.2 > 192.168.2.101: ICMP echo reply, id 22475, seq 1, length 64
19:30:45.289994 IP 192.168.2.101 > 192.168.3.101: ICMP echo request, id 22493, seq 1, length 64
19:30:45.290186 IP 192.168.3.101 > 192.168.2.101: ICMP echo reply, id 22493, seq 1, length 64
19:30:45.313918 IP 192.168.3.101 > 192.168.2.103: ICMP echo request, id 22502, seq 1, length 64
19:30:45.314099 IP 192.168.2.103 > 192.168.3.101: ICMP echo reply, id 22502, seq 1, length 64
19:30:45.341830 IP 192.168.3.101 > 192.168.2.101: ICMP echo request, id 22511, seq 1, length 64
19:30:45.341993 IP 192.168.2.101 > 192.168.3.101: ICMP echo reply, id 22511, seq 1, length 64
19:30:50.318082 IP 192.168.2.101 > 192.168.2.1: ICMP echo request, id 22544, seq 1, length 64
19:30:50.318109 IP 192.168.2.1 > 192.168.2.101: ICMP echo reply, id 22544, seq 1, length 64
19:30:50.326725 IP 192.168.2.101 > 192.168.3.1: ICMP echo request, id 22547, seq 1, length 64
19:30:50.326753 IP 192.168.3.1 > 192.168.2.101: ICMP echo reply, id 22547, seq 1, length 64
19:30:50.348359 IP 192.168.2.101 > 192.168.3.103: ICMP echo request, id 22552, seq 1, length 64
19:30:50.348591 IP 192.168.3.103 > 192.168.2.101: ICMP echo reply, id 22552, seq 1, length 64
19:30:50.403689 IP 192.168.2.101 > 192.168.5.2: ICMP echo request, id 22568, seq 1, length 64
19:30:50.403713 IP 192.168.5.2 > 192.168.2.101: ICMP echo reply, id 22568, seq 1, length 64
19:30:50.454223 IP 192.168.3.101 > 192.168.2.103: ICMP echo request, id 22583, seq 1, length 64
19:30:50.454410 IP 192.168.2.103 > 192.168.3.101: ICMP echo reply, id 22583, seq 1, length 64
19:30:50.460248 IP 192.168.2.101 > 192.168.3.101: ICMP echo request, id 22586, seq 1, length 64
19:30:50.460435 IP 192.168.3.101 > 192.168.2.101: ICMP echo reply, id 22586, seq 1, length 64
19:30:50.485436 IP 192.168.3.101 > 192.168.2.101: ICMP echo request, id 22592, seq 1, length 64
19:30:50.485611 IP 192.168.2.101 > 192.168.3.101: ICMP echo reply, id 22592, seq 1, length 64
19:30:55.482875 IP 192.168.2.101 > 192.168.2.1: ICMP echo request, id 22673, seq 1, length 64
19:30:55.482900 IP 192.168.2.1 > 192.168.2.101: ICMP echo reply, id 22673, seq 1, length 64
19:30:55.499033 IP 192.168.2.101 > 192.168.3.1: ICMP echo request, id 22679, seq 1, length 64
19:30:55.499059 IP 192.168.3.1 > 192.168.2.101: ICMP echo reply, id 22679, seq 1, length 64
19:30:55.529410 IP 192.168.2.101 > 192.168.3.103: ICMP echo request, id 22685, seq 1, length 64
19:30:55.529605 IP 192.168.3.103 > 192.168.2.101: ICMP echo reply, id 22685, seq 1, length 64
19:30:55.574146 IP 192.168.2.101 > 192.168.5.2: ICMP echo request, id 22697, seq 1, length 64
19:30:55.574216 IP 192.168.5.2 > 192.168.2.101: ICMP echo reply, id 22697, seq 1, length 64
19:30:55.576018 IP 192.168.3.101 > 192.168.2.103: ICMP echo request, id 22700, seq 1, length 64
19:30:55.576171 IP 192.168.2.103 > 192.168.3.101: ICMP echo reply, id 22700, seq 1, length 64
19:30:55.646594 IP 192.168.3.101 > 192.168.2.101: ICMP echo request, id 22709, seq 1, length 64
19:30:55.646767 IP 192.168.2.101 > 192.168.3.101: ICMP echo reply, id 22709, seq 1, length 64
19:30:55.649631 IP 192.168.2.101 > 192.168.3.101: ICMP echo request, id 22712, seq 1, length 64
19:30:55.649811 IP 192.168.3.101 > 192.168.2.101: ICMP echo reply, id 22712, seq 1, length 64
19:31:00.668651 IP 192.168.2.101 > 192.168.2.1: ICMP echo request, id 22747, seq 1, length 64
19:31:00.668682 IP 192.168.2.1 > 192.168.2.101: ICMP echo reply, id 22747, seq 1, length 64
19:31:00.684950 IP 192.168.2.101 > 192.168.3.1: ICMP echo request, id 22753, seq 1, length 64
19:31:00.684979 IP 192.168.3.1 > 192.168.2.101: ICMP echo reply, id 22753, seq 1, length 64
19:31:00.702057 IP 192.168.2.101 > 192.168.3.103: ICMP echo request, id 22756, seq 1, length 64
19:31:00.702350 IP 192.168.3.103 > 192.168.2.101: ICMP echo reply, id 22756, seq 1, length 64
19:31:00.736151 IP 192.168.2.101 > 192.168.5.2: ICMP echo request, id 22768, seq 1, length 64
19:31:00.736183 IP 192.168.5.2 > 192.168.2.101: ICMP echo reply, id 22768, seq 1, length 64
19:31:00.745545 IP 192.168.3.101 > 192.168.2.103: ICMP echo request, id 22771, seq 1, length 64
19:31:00.745734 IP 192.168.2.103 > 192.168.3.101: ICMP echo reply, id 22771, seq 1, length 64
19:31:00.780018 IP 192.168.2.101 > 192.168.3.101: ICMP echo request, id 22780, seq 1, length 64
19:31:00.780212 IP 192.168.3.101 > 192.168.2.101: ICMP echo reply, id 22780, seq 1, length 64
19:31:00.784033 IP 192.168.3.101 > 192.168.2.101: ICMP echo request, id 22783, seq 1, length 64
19:31:00.784191 IP 192.168.2.101 > 192.168.3.101: ICMP echo reply, id 22783, seq 1, length 64
19:31:05.672793 ARP, Request who-has 192.168.2.101 tell 192.168.2.1, length 28
19:31:05.673047 ARP, Request who-has 192.168.2.1 tell 192.168.2.101, length 28
19:31:05.673071 ARP, Reply 192.168.2.1 is-at 3a:77:af:3c:c1:c1 (oui Unknown), length 28
19:31:05.673227 ARP, Reply 192.168.2.101 is-at b6:ea:fb:cf:55:62 (oui Unknown), length 28
19:31:05.752416 ARP, Request who-has 192.168.2.1 tell 192.168.2.103, length 28
19:31:05.752437 ARP, Reply 192.168.2.1 is-at 3a:77:af:3c:c1:c1 (oui Unknown), length 28
19:31:05.803048 IP 192.168.2.101 > 192.168.2.1: ICMP echo request, id 22817, seq 1, length 64
19:31:05.803076 IP 192.168.2.1 > 192.168.2.101: ICMP echo reply, id 22817, seq 1, length 64
19:31:05.821732 IP 192.168.2.101 > 192.168.3.1: ICMP echo request, id 22823, seq 1, length 64
19:31:05.821758 IP 192.168.3.1 > 192.168.2.101: ICMP echo reply, id 22823, seq 1, length 64
19:31:05.835272 IP 192.168.2.101 > 192.168.3.103: ICMP echo request, id 22829, seq 1, length 64
19:31:05.835463 IP 192.168.3.103 > 192.168.2.101: ICMP echo reply, id 22829, seq 1, length 64
19:31:05.869951 IP 192.168.3.101 > 192.168.2.103: ICMP echo request, id 22841, seq 1, length 64
19:31:05.870130 IP 192.168.2.103 > 192.168.3.101: ICMP echo reply, id 22841, seq 1, length 64
19:31:05.877386 IP 192.168.2.101 > 192.168.5.2: ICMP echo request, id 22838, seq 1, length 64
19:31:05.877413 IP 192.168.5.2 > 192.168.2.101: ICMP echo reply, id 22838, seq 1, length 64
19:31:05.908018 IP 192.168.3.101 > 192.168.2.101: ICMP echo request, id 22853, seq 1, length 64
19:31:05.908332 IP 192.168.2.101 > 192.168.3.101: ICMP echo reply, id 22853, seq 1, length 64
19:31:05.912180 IP 192.168.2.101 > 192.168.3.101: ICMP echo request, id 22850, seq 1, length 64
19:31:05.912380 IP 192.168.3.101 > 192.168.2.101: ICMP echo reply, id 22850, seq 1, length 64

19:31:10.872718 ARP, Request who-has 192.168.2.103 tell 192.168.2.1, length 28
19:31:10.873108 ARP, Reply 192.168.2.103 is-at 56:65:50:8d:2d:fa (oui Unknown), length 28
19:31:10.931467 IP 192.168.2.101 > 192.168.2.1: ICMP echo request, id 22901, seq 1, length 64
19:31:10.931493 IP 192.168.2.1 > 192.168.2.101: ICMP echo reply, id 22901, seq 1, length 64
19:31:10.949814 IP 192.168.2.101 > 192.168.3.1: ICMP echo request, id 22907, seq 1, length 64
19:31:10.949835 IP 192.168.3.1 > 192.168.2.101: ICMP echo reply, id 22907, seq 1, length 64
19:31:10.970042 IP 192.168.2.101 > 192.168.3.103: ICMP echo request, id 22910, seq 1, length 64
19:31:10.970226 IP 192.168.3.103 > 192.168.2.101: ICMP echo reply, id 22910, seq 1, length 64
19:31:11.006264 IP 192.168.3.101 > 192.168.2.103: ICMP echo request, id 22925, seq 1, length 64
19:31:11.006439 IP 192.168.2.103 > 192.168.3.101: ICMP echo reply, id 22925, seq 1, length 64
19:31:11.008789 IP 192.168.2.101 > 192.168.5.2: ICMP echo request, id 22922, seq 1, length 64
19:31:11.008812 IP 192.168.5.2 > 192.168.2.101: ICMP echo reply, id 22922, seq 1, length 64
19:31:11.042065 IP 192.168.3.101 > 192.168.2.101: ICMP echo request, id 22934, seq 1, length 64
19:31:11.042245 IP 192.168.2.101 > 192.168.3.101: ICMP echo reply, id 22934, seq 1, length 64
19:31:11.045992 IP 192.168.2.101 > 192.168.3.101: ICMP echo request, id 22937, seq 1, length 64
19:31:11.046178 IP 192.168.3.101 > 192.168.2.101: ICMP echo reply, id 22937, seq 1, length 64
19:31:16.062485 IP 192.168.2.101 > 192.168.2.1: ICMP echo request, id 22972, seq 1, length 64
19:31:16.062518 IP 192.168.2.1 > 192.168.2.101: ICMP echo reply, id 22972, seq 1, length 64
19:31:16.081896 IP 192.168.2.101 > 192.168.3.1: ICMP echo request, id 22978, seq 1, length 64
19:31:16.081922 IP 192.168.3.1 > 192.168.2.101: ICMP echo reply, id 22978, seq 1, length 64
19:31:16.093888 IP 192.168.2.101 > 192.168.3.103: ICMP echo request, id 22984, seq 1, length 64
19:31:16.094084 IP 192.168.3.103 > 192.168.2.101: ICMP echo reply, id 22984, seq 1, length 64
19:31:16.137591 IP 192.168.3.101 > 192.168.2.103: ICMP echo request, id 22996, seq 1, length 64
19:31:16.137764 IP 192.168.2.103 > 192.168.3.101: ICMP echo reply, id 22996, seq 1, length 64
19:31:16.139745 IP 192.168.2.101 > 192.168.5.2: ICMP echo request, id 22993, seq 1, length 64
19:31:16.139764 IP 192.168.5.2 > 192.168.2.101: ICMP echo reply, id 22993, seq 1, length 64
19:31:16.175854 IP 192.168.2.101 > 192.168.3.101: ICMP echo request, id 23005, seq 1, length 64
19:31:16.176115 IP 192.168.3.101 > 192.168.2.101: ICMP echo reply, id 23005, seq 1, length 64
19:31:16.177490 IP 192.168.3.101 > 192.168.2.101: ICMP echo request, id 23008, seq 1, length 64
19:31:16.177630 IP 192.168.2.101 > 192.168.3.101: ICMP echo reply, id 23008, seq 1, length 64
19:31:21.194980 IP 192.168.2.101 > 192.168.2.1: ICMP echo request, id 23043, seq 1, length 64
19:31:21.195008 IP 192.168.2.1 > 192.168.2.101: ICMP echo reply, id 23043, seq 1, length 64
19:31:21.213919 IP 192.168.2.101 > 192.168.3.1: ICMP echo request, id 23049, seq 1, length 64
19:31:21.213942 IP 192.168.3.1 > 192.168.2.101: ICMP echo reply, id 23049, seq 1, length 64
19:31:21.230092 IP 192.168.2.101 > 192.168.3.103: ICMP echo request, id 23055, seq 1, length 64
19:31:21.230280 IP 192.168.3.103 > 192.168.2.101: ICMP echo reply, id 23055, seq 1, length 64
19:31:21.262887 IP 192.168.2.101 > 192.168.5.2: ICMP echo request, id 23064, seq 1, length 64
19:31:21.262916 IP 192.168.5.2 > 192.168.2.101: ICMP echo reply, id 23064, seq 1, length 64
19:31:21.267694 IP 192.168.3.101 > 192.168.2.103: ICMP echo request, id 23067, seq 1, length 64
19:31:21.267969 IP 192.168.2.103 > 192.168.3.101: ICMP echo reply, id 23067, seq 1, length 64
19:31:21.302226 IP 192.168.2.101 > 192.168.3.101: ICMP echo request, id 23076, seq 1, length 64
19:31:21.302430 IP 192.168.3.101 > 192.168.2.101: ICMP echo reply, id 23076, seq 1, length 64
19:31:21.306239 IP 192.168.3.101 > 192.168.2.101: ICMP echo request, id 23079, seq 1, length 64
19:31:21.306397 IP 192.168.2.101 > 192.168.3.101: ICMP echo reply, id 23079, seq 1, length 64
19:31:26.325587 IP 192.168.2.101 > 192.168.2.1: ICMP echo request, id 23113, seq 1, length 64
19:31:26.325617 IP 192.168.2.1 > 192.168.2.101: ICMP echo reply, id 23113, seq 1, length 64
19:31:26.343939 IP 192.168.2.101 > 192.168.3.1: ICMP echo request, id 23122, seq 1, length 64
19:31:26.343965 IP 192.168.3.1 > 192.168.2.101: ICMP echo reply, id 23122, seq 1, length 64
19:31:26.380258 IP 192.168.2.101 > 192.168.3.103: ICMP echo request, id 23132, seq 1, length 64
19:31:26.380464 IP 192.168.3.103 > 192.168.2.101: ICMP echo reply, id 23132, seq 1, length 64
19:31:26.439255 IP 192.168.3.101 > 192.168.2.103: ICMP echo request, id 23144, seq 1, length 64
19:31:26.439508 IP 192.168.2.103 > 192.168.3.101: ICMP echo reply, id 23144, seq 1, length 64
19:31:26.445438 IP 192.168.2.101 > 192.168.5.2: ICMP echo request, id 23147, seq 1, length 64
19:31:26.445464 IP 192.168.5.2 > 192.168.2.101: ICMP echo reply, id 23147, seq 1, length 64
19:31:26.477984 IP 192.168.2.101 > 192.168.3.101: ICMP echo request, id 23159, seq 1, length 64
19:31:26.478268 IP 192.168.3.101 > 192.168.2.101: ICMP echo reply, id 23159, seq 1, length 64
19:31:26.482427 IP 192.168.3.101 > 192.168.2.101: ICMP echo request, id 23156, seq 1, length 64
19:31:26.482663 IP 192.168.2.101 > 192.168.3.101: ICMP echo reply, id 23156, seq 1, length 64
19:31:31.448567 ARP, Request who-has 192.168.2.1 tell 192.168.2.103, length 28
19:31:31.448589 ARP, Reply 192.168.2.1 is-at 3a:77:af:3c:c1:c1 (oui Unknown), length 28
19:31:31.503097 IP 192.168.2.101 > 192.168.2.1: ICMP echo request, id 23249, seq 1, length 64
19:31:31.503129 IP 192.168.2.1 > 192.168.2.101: ICMP echo reply, id 23249, seq 1, length 64
19:31:31.515985 IP 192.168.2.101 > 192.168.3.1: ICMP echo request, id 23255, seq 1, length 64
19:31:31.516015 IP 192.168.3.1 > 192.168.2.101: ICMP echo reply, id 23255, seq 1, length 64
19:31:31.540490 IP 192.168.2.101 > 192.168.3.103: ICMP echo request, id 23261, seq 1, length 64
19:31:31.540673 IP 192.168.3.103 > 192.168.2.101: ICMP echo reply, id 23261, seq 1, length 64
19:31:31.574936 IP 192.168.3.101 > 192.168.2.103: ICMP echo request, id 23270, seq 1, length 64
19:31:31.575103 IP 192.168.2.103 > 192.168.3.101: ICMP echo reply, id 23270, seq 1, length 64
19:31:31.583090 IP 192.168.2.101 > 192.168.5.2: ICMP echo request, id 23273, seq 1, length 64
19:31:31.583118 IP 192.168.5.2 > 192.168.2.101: ICMP echo reply, id 23273, seq 1, length 64
19:31:31.616094 IP 192.168.2.101 > 192.168.3.101: ICMP echo request, id 23285, seq 1, length 64
19:31:31.616294 IP 192.168.3.101 > 192.168.2.101: ICMP echo reply, id 23285, seq 1, length 64
19:31:31.620290 IP 192.168.3.101 > 192.168.2.101: ICMP echo request, id 23282, seq 1, length 64
19:31:31.620557 IP 192.168.2.101 > 192.168.3.101: ICMP echo reply, id 23282, seq 1, length 64
19:31:36.504465 ARP, Request who-has 192.168.2.1 tell 192.168.2.101, length 28
19:31:36.504485 ARP, Reply 192.168.2.1 is-at 3a:77:af:3c:c1:c1 (oui Unknown), length 28
19:31:36.638790 IP 192.168.2.101 > 192.168.2.1: ICMP echo request, id 23332, seq 1, length 64
19:31:36.638862 IP 192.168.2.1 > 192.168.2.101: ICMP echo reply, id 23332, seq 1, length 64
19:31:36.655991 IP 192.168.2.101 > 192.168.3.1: ICMP echo request, id 23338, seq 1, length 64
19:31:36.656019 IP 192.168.3.1 > 192.168.2.101: ICMP echo reply, id 23338, seq 1, length 64
19:31:36.667321 IP 192.168.2.101 > 192.168.3.103: ICMP echo request, id 23344, seq 1, length 64
19:31:36.667600 IP 192.168.3.103 > 192.168.2.101: ICMP echo reply, id 23344, seq 1, length 64
19:31:36.714687 IP 192.168.3.101 > 192.168.2.103: ICMP echo request, id 23356, seq 1, length 64
19:31:36.714915 IP 192.168.2.103 > 192.168.3.101: ICMP echo reply, id 23356, seq 1, length 64
19:31:36.720513 IP 192.168.2.101 > 192.168.5.2: ICMP echo request, id 23353, seq 1, length 64
19:31:36.720578 IP 192.168.5.2 > 192.168.2.101: ICMP echo reply, id 23353, seq 1, length 64
19:31:36.763635 IP 192.168.3.101 > 192.168.2.101: ICMP echo request, id 23368, seq 1, length 64
19:31:36.763836 IP 192.168.2.101 > 192.168.3.101: ICMP echo reply, id 23368, seq 1, length 64
19:31:36.766476 IP 192.168.2.101 > 192.168.3.101: ICMP echo request, id 23365, seq 1, length 64
19:31:36.766823 IP 192.168.3.101 > 192.168.2.101: ICMP echo reply, id 23365, seq 1, length 64

19:31:41.640251 ARP, Request who-has 192.168.2.101 tell 192.168.2.1, length 28
19:31:41.640692 ARP, Reply 192.168.2.101 is-at b6:ea:fb:cf:55:62 (oui Unknown), length 28
19:31:41.783279 IP 192.168.2.101 > 192.168.2.1: ICMP echo request, id 23469, seq 1, length 64
19:31:41.783306 IP 192.168.2.1 > 192.168.2.101: ICMP echo reply, id 23469, seq 1, length 64
19:31:41.799571 IP 192.168.2.101 > 192.168.3.1: ICMP echo request, id 23475, seq 1, length 64
19:31:41.799599 IP 192.168.3.1 > 192.168.2.101: ICMP echo reply, id 23475, seq 1, length 64
19:31:41.823990 IP 192.168.2.101 > 192.168.3.103: ICMP echo request, id 23481, seq 1, length 64
19:31:41.824406 IP 192.168.3.103 > 192.168.2.101: ICMP echo reply, id 23481, seq 1, length 64
19:31:41.862324 IP 192.168.2.101 > 192.168.5.2: ICMP echo request, id 23490, seq 1, length 64
19:31:41.862352 IP 192.168.5.2 > 192.168.2.101: ICMP echo reply, id 23490, seq 1, length 64
19:31:41.867007 IP 192.168.3.101 > 192.168.2.103: ICMP echo request, id 23493, seq 1, length 64
19:31:41.867338 IP 192.168.2.103 > 192.168.3.101: ICMP echo reply, id 23493, seq 1, length 64
19:31:41.902817 IP 192.168.3.101 > 192.168.2.101: ICMP echo request, id 23502, seq 1, length 64
19:31:41.903242 IP 192.168.2.101 > 192.168.3.101: ICMP echo reply, id 23502, seq 1, length 64
19:31:41.910140 IP 192.168.2.101 > 192.168.3.101: ICMP echo request, id 23505, seq 1, length 64
19:31:41.910415 IP 192.168.3.101 > 192.168.2.101: ICMP echo reply, id 23505, seq 1, length 64
19:31:46.872815 ARP, Request who-has 192.168.2.103 tell 192.168.2.1, length 28
19:31:46.873230 ARP, Reply 192.168.2.103 is-at 56:65:50:8d:2d:fa (oui Unknown), length 28
19:31:46.931191 IP 192.168.2.101 > 192.168.2.1: ICMP echo request, id 23544, seq 1, length 64
19:31:46.931217 IP 192.168.2.1 > 192.168.2.101: ICMP echo reply, id 23544, seq 1, length 64
19:31:46.950424 IP 192.168.2.101 > 192.168.3.1: ICMP echo request, id 23550, seq 1, length 64
19:31:46.950449 IP 192.168.3.1 > 192.168.2.101: ICMP echo reply, id 23550, seq 1, length 64
19:31:46.968335 IP 192.168.2.101 > 192.168.3.103: ICMP echo request, id 23556, seq 1, length 64
19:31:46.968526 IP 192.168.3.103 > 192.168.2.101: ICMP echo reply, id 23556, seq 1, length 64
19:31:46.991126 IP 192.168.3.101 > 192.168.2.103: ICMP echo request, id 23565, seq 1, length 64
19:31:46.991283 IP 192.168.2.103 > 192.168.3.101: ICMP echo reply, id 23565, seq 1, length 64
19:31:47.014467 IP 192.168.2.101 > 192.168.5.2: ICMP echo request, id 23568, seq 1, length 64
19:31:47.014488 IP 192.168.5.2 > 192.168.2.101: ICMP echo reply, id 23568, seq 1, length 64
19:31:47.027486 IP 192.168.3.101 > 192.168.2.101: ICMP echo request, id 23577, seq 1, length 64
19:31:47.027657 IP 192.168.2.101 > 192.168.3.101: ICMP echo reply, id 23577, seq 1, length 64
19:31:47.046746 IP 192.168.2.101 > 192.168.3.101: ICMP echo request, id 23583, seq 1, length 64
19:31:47.046944 IP 192.168.3.101 > 192.168.2.101: ICMP echo reply, id 23583, seq 1, length 64
19:31:52.070109 IP 192.168.2.101 > 192.168.2.1: ICMP echo request, id 23618, seq 1, length 64
19:31:52.070133 IP 192.168.2.1 > 192.168.2.101: ICMP echo reply, id 23618, seq 1, length 64
19:31:52.089704 IP 192.168.2.101 > 192.168.3.1: ICMP echo request, id 23627, seq 1, length 64
19:31:52.089730 IP 192.168.3.1 > 192.168.2.101: ICMP echo reply, id 23627, seq 1, length 64
19:31:52.106016 IP 192.168.2.101 > 192.168.3.103: ICMP echo request, id 23630, seq 1, length 64
19:31:52.106214 IP 192.168.3.103 > 192.168.2.101: ICMP echo reply, id 23630, seq 1, length 64
19:31:52.128168 IP 192.168.3.101 > 192.168.2.103: ICMP echo request, id 23639, seq 1, length 64
19:31:52.128459 IP 192.168.2.103 > 192.168.3.101: ICMP echo reply, id 23639, seq 1, length 64
19:31:52.149841 IP 192.168.2.101 > 192.168.5.2: ICMP echo request, id 23642, seq 1, length 64
19:31:52.149865 IP 192.168.5.2 > 192.168.2.101: ICMP echo reply, id 23642, seq 1, length 64
19:31:52.167466 IP 192.168.3.101 > 192.168.2.101: ICMP echo request, id 23648, seq 1, length 64
19:31:52.167835 IP 192.168.2.101 > 192.168.3.101: ICMP echo reply, id 23648, seq 1, length 64
19:31:52.182065 IP 192.168.2.101 > 192.168.3.101: ICMP echo request, id 23654, seq 1, length 64
19:31:52.182263 IP 192.168.3.101 > 192.168.2.101: ICMP echo reply, id 23654, seq 1, length 64
19:31:57.144803 ARP, Request who-has 192.168.2.1 tell 192.168.2.103, length 28
19:31:57.144825 ARP, Reply 192.168.2.1 is-at 3a:77:af:3c:c1:c1 (oui Unknown), length 28
19:31:57.210001 IP 192.168.2.101 > 192.168.2.1: ICMP echo request, id 23691, seq 1, length 64
19:31:57.210030 IP 192.168.2.1 > 192.168.2.101: ICMP echo reply, id 23691, seq 1, length 64
19:31:57.230288 IP 192.168.2.101 > 192.168.3.1: ICMP echo request, id 23700, seq 1, length 64
19:31:57.230312 IP 192.168.3.1 > 192.168.2.101: ICMP echo reply, id 23700, seq 1, length 64
19:31:57.244211 IP 192.168.2.101 > 192.168.3.103: ICMP echo request, id 23703, seq 1, length 64
19:31:57.244400 IP 192.168.3.103 > 192.168.2.101: ICMP echo reply, id 23703, seq 1, length 64
19:31:57.263796 IP 192.168.3.101 > 192.168.2.103: ICMP echo request, id 23709, seq 1, length 64
19:31:57.263941 IP 192.168.2.103 > 192.168.3.101: ICMP echo reply, id 23709, seq 1, length 64
19:31:57.279583 IP 192.168.2.101 > 192.168.5.2: ICMP echo request, id 23715, seq 1, length 64
19:31:57.279608 IP 192.168.5.2 > 192.168.2.101: ICMP echo reply, id 23715, seq 1, length 64
