15:57:33.576697 ARP, Request who-has 192.168.2.103 tell 192.168.2.1, length 28
15:57:33.578326 ARP, Reply 192.168.2.103 is-at 0a:4e:61:96:4a:15 (oui Unknown), length 28


15:58:41.089956 ARP, Request who-has 192.168.2.1 tell 192.168.2.2, length 28
15:58:41.089973 ARP, Reply 192.168.2.1 is-at ee:d6:9a:3a:e5:b2 (oui Unknown), length 28
15:58:41.090911 IP 192.168.2.2 > 12.10.5.2: ICMP echo request, id 2713, seq 1, length 64
15:58:43.094263 IP 192.168.2.2 > 12.10.5.3: ICMP echo request, id 2717, seq 1, length 64
15:58:45.097300 IP 192.168.2.2 > 192.168.1.2: ICMP echo request, id 2718, seq 1, length 64
15:58:45.991364 ARP, Request who-has 192.168.2.2 tell 192.168.2.101, length 28
15:58:47.098900 IP 192.168.2.2 > 192.168.1.3: ICMP echo request, id 2745, seq 1, length 64
15:58:49.103737 ARP, Request who-has 192.168.2.3 tell 192.168.2.2, length 28
15:58:49.109202 IP 192.168.2.2 > 192.168.3.2: ICMP echo request, id 2747, seq 1, length 64
15:58:49.112401 IP 192.168.3.2 > 192.168.2.2: ICMP echo reply, id 2747, seq 1, length 64
15:58:49.117730 IP 192.168.2.2 > 192.168.3.3: ICMP echo request, id 2748, seq 1, length 64
15:58:49.121605 IP 192.168.3.3 > 192.168.2.2: ICMP echo reply, id 2748, seq 1, length 64
15:58:49.125660 IP 192.168.2.2 > 192.168.4.2: ICMP echo request, id 2749, seq 1, length 64
15:58:51.130730 IP 192.168.2.2 > 192.168.5.2: ICMP echo request, id 2776, seq 1, length 64
15:58:51.130744 IP 192.168.5.2 > 192.168.2.2: ICMP echo reply, id 2776, seq 1, length 64
15:58:51.134267 ARP, Request who-has 192.168.2.1 tell 192.168.2.3, length 28
15:58:51.134280 ARP, Reply 192.168.2.1 is-at ee:d6:9a:3a:e5:b2 (oui Unknown), length 28
15:58:51.135147 IP 192.168.2.3 > 12.10.5.2: ICMP echo request, id 2777, seq 1, length 64
15:58:53.138586 IP 192.168.2.3 > 12.10.5.3: ICMP echo request, id 2778, seq 1, length 64
15:58:54.120517 ARP, Request who-has 192.168.2.2 tell 192.168.2.1, length 28
15:58:54.123210 ARP, Reply 192.168.2.2 is-at be:61:82:f9:22:f2 (oui Unknown), length 28
15:58:55.140545 IP 192.168.2.3 > 192.168.1.2: ICMP echo request, id 2779, seq 1, length 64
15:58:56.010560 ARP, Request who-has 192.168.2.1 tell 192.168.2.101, length 28
15:58:56.010574 ARP, Reply 192.168.2.1 is-at ee:d6:9a:3a:e5:b2 (oui Unknown), length 28
15:58:56.011281 IP 192.168.2.101 > 192.168.3.2: ICMP echo request, id 2793, seq 1, length 64
15:58:56.012246 IP 192.168.3.2 > 192.168.2.101: ICMP echo reply, id 2793, seq 1, length 64
15:58:56.015753 IP 192.168.2.101 > 192.168.3.3: ICMP echo request, id 2799, seq 1, length 64
15:58:56.016599 IP 192.168.3.3 > 192.168.2.101: ICMP echo reply, id 2799, seq 1, length 64
15:58:56.021113 IP 192.168.3.101 > 192.168.2.2: ICMP echo request, id 2796, seq 1, length 64
15:58:56.021970 IP 192.168.2.2 > 192.168.3.101: ICMP echo reply, id 2796, seq 1, length 64
15:58:56.028122 IP 192.168.2.101 > 192.168.5.2: ICMP echo request, id 2802, seq 1, length 64
15:58:56.028131 IP 192.168.5.2 > 192.168.2.101: ICMP echo reply, id 2802, seq 1, length 64
15:58:56.035404 ARP, Request who-has 192.168.2.3 tell 192.168.2.101, length 28
15:58:57.142680 IP 192.168.2.3 > 192.168.1.3: ICMP echo request, id 2838, seq 1, length 64
15:58:59.150867 IP 192.168.2.3 > 192.168.3.2: ICMP echo request, id 2891, seq 1, length 64
15:58:59.152374 IP 192.168.3.2 > 192.168.2.3: ICMP echo reply, id 2891, seq 1, length 64
15:58:59.158527 IP 192.168.2.3 > 192.168.3.3: ICMP echo request, id 2892, seq 1, length 64
15:58:59.160634 IP 192.168.3.3 > 192.168.2.3: ICMP echo reply, id 2892, seq 1, length 64
15:58:59.163625 IP 192.168.2.3 > 192.168.4.2: ICMP echo request, id 2893, seq 1, length 64

15:59:01.076866 IP 192.168.2.101 > 192.168.3.2: ICMP echo request, id 2914, seq 1, length 64
15:59:01.076953 IP 192.168.3.2 > 192.168.2.101: ICMP echo reply, id 2914, seq 1, length 64
15:59:01.079979 IP 192.168.2.103.55948 > 192.168.3.3.33434: UDP, length 32
15:59:01.080009 IP 192.168.2.1 > 192.168.2.103: ICMP time exceeded in-transit, length 68
15:59:01.081277 IP 192.168.2.103.48690 > 192.168.3.3.33435: UDP, length 32
15:59:01.081287 IP 192.168.2.1 > 192.168.2.103: ICMP time exceeded in-transit, length 68
15:59:01.082691 IP 192.168.2.103.52771 > 192.168.3.3.33436: UDP, length 32
15:59:01.082700 IP 192.168.2.1 > 192.168.2.103: ICMP time exceeded in-transit, length 68
15:59:01.083724 IP 192.168.2.103.36081 > 192.168.3.3.33437: UDP, length 32
15:59:01.084601 IP 192.168.3.3 > 192.168.2.103: ICMP 192.168.3.3 udp port 33437 unreachable, length 68
15:59:01.086152 IP 192.168.2.103.34380 > 192.168.3.3.33448: UDP, length 32
15:59:01.087096 IP 192.168.3.3 > 192.168.2.103: ICMP 192.168.3.3 udp port 33448 unreachable, length 68
15:59:01.087152 IP 192.168.2.103.43452 > 192.168.3.3.33444: UDP, length 32
15:59:01.088161 IP 192.168.2.103.59300 > 192.168.3.3.33449: UDP, length 32
15:59:01.088197 IP 192.168.2.103.41586 > 192.168.3.3.33447: UDP, length 32
15:59:01.088226 IP 192.168.2.103.44311 > 192.168.3.3.33440: UDP, length 32
15:59:01.088258 IP 192.168.2.103.43635 > 192.168.3.3.33442: UDP, length 32
15:59:01.089367 IP 192.168.2.103.43954 > 192.168.3.3.33438: UDP, length 32
15:59:01.090669 IP 192.168.3.3 > 192.168.2.103: ICMP 192.168.3.3 udp port 33444 unreachable, length 68
15:59:01.090847 IP 192.168.2.103.55229 > 192.168.3.3.33441: UDP, length 32
15:59:01.090889 IP 192.168.2.103.40578 > 192.168.3.3.33446: UDP, length 32
15:59:01.092638 IP 192.168.3.3 > 192.168.2.103: ICMP 192.168.3.3 udp port 33449 unreachable, length 68
15:59:01.092682 IP 192.168.3.3 > 192.168.2.103: ICMP 192.168.3.3 udp port 33447 unreachable, length 68
15:59:01.092776 IP 192.168.2.103.45457 > 192.168.3.3.33439: UDP, length 32
15:59:01.092818 IP 192.168.2.103.49601 > 192.168.3.3.33443: UDP, length 32
15:59:01.092855 IP 192.168.2.103.57785 > 192.168.3.3.33445: UDP, length 32
15:59:01.094843 IP 192.168.3.3 > 192.168.2.103: ICMP 192.168.3.3 udp port 33440 unreachable, length 68
15:59:01.097081 IP 192.168.2.101 > 192.168.3.3: ICMP echo request, id 2921, seq 1, length 64
15:59:01.097140 IP 192.168.3.3 > 192.168.2.101: ICMP echo reply, id 2921, seq 1, length 64
15:59:01.107925 IP 192.168.3.101 > 192.168.2.101: ICMP echo request, id 2933, seq 1, length 64
15:59:01.109243 IP 192.168.2.101 > 192.168.3.101: ICMP echo reply, id 2933, seq 1, length 64
15:59:01.116699 IP 192.168.2.101 > 192.168.5.2: ICMP echo request, id 2930, seq 1, length 64
15:59:01.116711 IP 192.168.5.2 > 192.168.2.101: ICMP echo reply, id 2930, seq 1, length 64
15:59:01.136643 IP 192.168.3.101 > 192.168.2.3: ICMP echo request, id 2954, seq 1, length 64
15:59:01.137744 IP 192.168.2.3 > 192.168.3.101: ICMP echo reply, id 2954, seq 1, length 64
15:59:01.148749 IP 192.168.2.101 > 192.168.3.101: ICMP echo request, id 2963, seq 1, length 64
15:59:01.149993 IP 192.168.3.101 > 192.168.2.101: ICMP echo reply, id 2963, seq 1, length 64
15:59:01.166592 IP 192.168.2.3 > 192.168.5.2: ICMP echo request, id 2969, seq 1, length 64
15:59:01.166605 IP 192.168.5.2 > 192.168.2.3: ICMP echo reply, id 2969, seq 1, length 64
15:59:04.152498 ARP, Request who-has 192.168.2.3 tell 192.168.2.1, length 28
15:59:04.153698 ARP, Reply 192.168.2.3 is-at b2:39:30:9a:d0:62 (oui Unknown), length 28
15:59:06.088601 ARP, Request who-has 192.168.2.101 tell 192.168.2.1, length 28
15:59:06.088606 ARP, Request who-has 192.168.2.103 tell 192.168.2.1, length 28
15:59:06.089952 ARP, Request who-has 192.168.2.1 tell 192.168.2.103, length 28
15:59:06.089961 ARP, Reply 192.168.2.1 is-at ee:d6:9a:3a:e5:b2 (oui Unknown), length 28
15:59:06.091488 ARP, Reply 192.168.2.103 is-at 0a:4e:61:96:4a:15 (oui Unknown), length 28
15:59:06.092503 ARP, Reply 192.168.2.101 is-at c2:77:95:f2:f6:30 (oui Unknown), length 28
15:59:06.096483 IP 192.168.2.103.43540 > 192.168.5.2.33434: UDP, length 32
15:59:06.096568 IP 192.168.5.2 > 192.168.2.103: ICMP 192.168.5.2 udp port 33434 unreachable, length 68
15:59:06.098019 IP 192.168.2.103.55906 > 192.168.5.2.33435: UDP, length 32
15:59:06.098029 IP 192.168.5.2 > 192.168.2.103: ICMP 192.168.5.2 udp port 33435 unreachable, length 68
15:59:06.099279 IP 192.168.2.103.60960 > 192.168.5.2.33447: UDP, length 32
15:59:06.099286 IP 192.168.5.2 > 192.168.2.103: ICMP 192.168.5.2 udp port 33447 unreachable, length 68
15:59:06.099811 IP 192.168.2.103.58514 > 192.168.5.2.33446: UDP, length 32
15:59:06.099819 IP 192.168.5.2 > 192.168.2.103: ICMP 192.168.5.2 udp port 33446 unreachable, length 68
15:59:06.100385 IP 192.168.2.103.54952 > 192.168.5.2.33440: UDP, length 32
15:59:06.100395 IP 192.168.5.2 > 192.168.2.103: ICMP 192.168.5.2 udp port 33440 unreachable, length 68
15:59:06.101041 IP 192.168.2.103.52197 > 192.168.5.2.33441: UDP, length 32
15:59:06.101049 IP 192.168.5.2 > 192.168.2.103: ICMP 192.168.5.2 udp port 33441 unreachable, length 68
15:59:06.101088 IP 192.168.2.103.47747 > 192.168.5.2.33442: UDP, length 32
15:59:06.101104 IP 192.168.2.103.51275 > 192.168.5.2.33449: UDP, length 32
15:59:06.101947 IP 192.168.2.103.48478 > 192.168.5.2.33445: UDP, length 32
15:59:06.101986 IP 192.168.2.103.33652 > 192.168.5.2.33443: UDP, length 32
15:59:06.101998 IP 192.168.2.103.34790 > 192.168.5.2.33448: UDP, length 32
15:59:06.102006 IP 192.168.2.103.58246 > 192.168.5.2.33436: UDP, length 32
15:59:06.102015 IP 192.168.2.103.45283 > 192.168.5.2.33438: UDP, length 32
15:59:06.102029 IP 192.168.2.103.53215 > 192.168.5.2.33444: UDP, length 32
15:59:06.102891 IP 192.168.2.103.36880 > 192.168.5.2.33437: UDP, length 32
15:59:06.102908 IP 192.168.2.103.39520 > 192.168.5.2.33439: UDP, length 32
15:59:06.149356 IP 192.168.3.101 > 192.168.2.2: ICMP echo request, id 2984, seq 1, length 64
15:59:06.149430 IP 192.168.2.2 > 192.168.3.101: ICMP echo reply, id 2984, seq 1, length 64
15:59:06.171103 IP 192.168.3.101 > 192.168.2.101: ICMP echo request, id 3005, seq 1, length 64
15:59:06.171170 IP 192.168.2.101 > 192.168.3.101: ICMP echo reply, id 3005, seq 1, length 64
15:59:06.174317 IP 192.168.2.101 > 192.168.3.2: ICMP echo request, id 3011, seq 1, length 64
15:59:06.174396 IP 192.168.3.2 > 192.168.2.101: ICMP echo reply, id 3011, seq 1, length 64
15:59:06.183596 IP 192.168.2.101 > 192.168.3.3: ICMP echo request, id 3020, seq 1, length 64
15:59:06.183659 IP 192.168.3.3 > 192.168.2.101: ICMP echo reply, id 3020, seq 1, length 64
15:59:06.188159 IP 192.168.3.101 > 192.168.2.3: ICMP echo request, id 3023, seq 1, length 64
15:59:06.188226 IP 192.168.2.3 > 192.168.3.101: ICMP echo reply, id 3023, seq 1, length 64
15:59:06.191380 IP 192.168.2.101 > 192.168.5.2: ICMP echo request, id 3029, seq 1, length 64
15:59:06.191387 IP 192.168.5.2 > 192.168.2.101: ICMP echo reply, id 3029, seq 1, length 64
15:59:06.202226 IP 192.168.3.101 > 192.168.2.103: ICMP echo request, id 3032, seq 1, length 64
15:59:06.204047 IP 192.168.2.103 > 192.168.3.101: ICMP echo reply, id 3032, seq 1, length 64
15:59:06.211220 IP 192.168.2.101 > 192.168.3.101: ICMP echo request, id 3044, seq 1, length 64
15:59:06.211283 IP 192.168.3.101 > 192.168.2.101: ICMP echo reply, id 3044, seq 1, length 64
15:59:06.215052 ARP, Request who-has 192.168.2.103 tell 192.168.2.101, length 28
15:59:06.220166 IP 192.168.2.101 > 192.168.2.1: ICMP echo request, id 3050, seq 1, length 64
15:59:06.220176 IP 192.168.2.1 > 192.168.2.101: ICMP echo reply, id 3050, seq 1, length 64
15:59:09.183895 IP 192.168.3.2 > 192.168.2.2: ICMP echo request, id 3106, seq 1, length 64
15:59:09.185553 IP 192.168.2.2 > 192.168.3.2: ICMP echo reply, id 3106, seq 1, length 64
15:59:09.189630 IP 192.168.3.2 > 192.168.2.3: ICMP echo request, id 3107, seq 1, length 64
15:59:09.190722 IP 192.168.2.3 > 192.168.3.2: ICMP echo reply, id 3107, seq 1, length 64
15:59:11.107231 ARP, Request who-has 192.168.2.3 tell 192.168.2.103, length 28
15:59:11.161306 ARP, Request who-has 192.168.2.1 tell 192.168.2.2, length 28
15:59:11.161316 ARP, Reply 192.168.2.1 is-at ee:d6:9a:3a:e5:b2 (oui Unknown), length 28
15:59:11.212033 IP 192.168.3.101 > 192.168.2.2: ICMP echo request, id 3122, seq 1, length 64
15:59:11.212087 IP 192.168.2.2 > 192.168.3.101: ICMP echo reply, id 3122, seq 1, length 64
15:59:11.233905 IP 192.168.3.101 > 192.168.2.101: ICMP echo request, id 3140, seq 1, length 64
15:59:11.233954 IP 192.168.2.101 > 192.168.3.101: ICMP echo reply, id 3140, seq 1, length 64
15:59:11.239333 IP 192.168.2.101 > 192.168.3.2: ICMP echo request, id 3146, seq 1, length 64
15:59:11.239392 IP 192.168.3.2 > 192.168.2.101: ICMP echo reply, id 3146, seq 1, length 64
15:59:11.250552 IP 192.168.3.101 > 192.168.2.3: ICMP echo request, id 3158, seq 1, length 64
15:59:11.250607 IP 192.168.2.3 > 192.168.3.101: ICMP echo reply, id 3158, seq 1, length 64
15:59:11.251613 IP 192.168.2.101 > 192.168.3.3: ICMP echo request, id 3155, seq 1, length 64
15:59:11.251665 IP 192.168.3.3 > 192.168.2.101: ICMP echo reply, id 3155, seq 1, length 64
15:59:11.257291 IP 192.168.2.101 > 192.168.5.2: ICMP echo request, id 3161, seq 1, length 64
15:59:11.257302 IP 192.168.5.2 > 192.168.2.101: ICMP echo reply, id 3161, seq 1, length 64
15:59:11.258253 IP 192.168.3.101 > 192.168.2.103: ICMP echo request, id 3164, seq 1, length 64
15:59:11.258300 IP 192.168.2.103 > 192.168.3.101: ICMP echo reply, id 3164, seq 1, length 64
15:59:11.266500 IP 192.168.2.101 > 192.168.3.101: ICMP echo request, id 3173, seq 1, length 64
15:59:11.266627 IP 192.168.3.101 > 192.168.2.101: ICMP echo reply, id 3173, seq 1, length 64
15:59:11.272914 IP 192.168.2.101 > 192.168.2.1: ICMP echo request, id 3179, seq 1, length 64
15:59:11.272924 IP 192.168.2.1 > 192.168.2.101: ICMP echo reply, id 3179, seq 1, length 64
15:59:14.202676 ARP, Request who-has 192.168.2.1 tell 192.168.2.3, length 28
15:59:14.202685 ARP, Reply 192.168.2.1 is-at ee:d6:9a:3a:e5:b2 (oui Unknown), length 28
15:59:16.115932 IP 192.168.2.103.41430 > 192.168.3.2.33441: UDP, length 32
15:59:16.117508 IP 192.168.2.103.52901 > 192.168.3.2.33439: UDP, length 32
15:59:16.117617 IP 192.168.2.103.46758 > 192.168.3.2.33436: UDP, length 32
15:59:16.117628 IP 192.168.2.1 > 192.168.2.103: ICMP time exceeded in-transit, length 68
15:59:16.117677 IP 192.168.2.103.38160 > 192.168.3.2.33440: UDP, length 32
15:59:16.117709 IP 192.168.2.103.37849 > 192.168.3.2.33437: UDP, length 32
15:59:16.117737 IP 192.168.2.103.44872 > 192.168.3.2.33448: UDP, length 32
15:59:16.117762 IP 192.168.2.103.44216 > 192.168.3.2.33435: UDP, length 32
15:59:16.117767 IP 192.168.2.1 > 192.168.2.103: ICMP time exceeded in-transit, length 68
15:59:16.117792 IP 192.168.2.103.47646 > 192.168.3.2.33438: UDP, length 32
15:59:16.117817 IP 192.168.2.103.37077 > 192.168.3.2.33445: UDP, length 32
15:59:16.117842 IP 192.168.2.103.50682 > 192.168.3.2.33443: UDP, length 32
15:59:16.117866 IP 192.168.2.103.60311 > 192.168.3.2.33446: UDP, length 32
15:59:16.117891 IP 192.168.2.103.49243 > 192.168.3.2.33444: UDP, length 32
15:59:16.117916 IP 192.168.2.103.58722 > 192.168.3.2.33449: UDP, length 32
15:59:16.117941 IP 192.168.2.103.34783 > 192.168.3.2.33434: UDP, length 32
15:59:16.117944 IP 192.168.2.1 > 192.168.2.103: ICMP time exceeded in-transit, length 68
15:59:16.117968 IP 192.168.2.103.60019 > 192.168.3.2.33447: UDP, length 32
15:59:16.117999 IP 192.168.2.103.54461 > 192.168.3.2.33442: UDP, length 32
15:59:16.122211 IP 192.168.3.2 > 192.168.2.103: ICMP 192.168.3.2 udp port 33441 unreachable, length 68
15:59:16.122247 IP 192.168.3.2 > 192.168.2.103: ICMP 192.168.3.2 udp port 33439 unreachable, length 68
15:59:16.122274 IP 192.168.3.2 > 192.168.2.103: ICMP 192.168.3.2 udp port 33440 unreachable, length 68
15:59:16.122299 IP 192.168.3.2 > 192.168.2.103: ICMP 192.168.3.2 udp port 33437 unreachable, length 68
15:59:16.122323 IP 192.168.3.2 > 192.168.2.103: ICMP 192.168.3.2 udp port 33448 unreachable, length 68
15:59:16.122352 IP 192.168.3.2 > 192.168.2.103: ICMP 192.168.3.2 udp port 33438 unreachable, length 68
15:59:16.123803 IP 192.168.2.103.42602 > 192.168.3.2.33450: UDP, length 32
15:59:16.123844 IP 192.168.2.103.38996 > 192.168.3.2.33452: UDP, length 32
15:59:16.123873 IP 192.168.2.103.51947 > 192.168.3.2.33451: UDP, length 32
15:59:16.129728 ARP, Request who-has 192.168.2.2 tell 192.168.2.103, length 28
15:59:16.139807 IP 192.168.2.103.35629 > 192.168.3.103.33434: UDP, length 32
15:59:16.139820 IP 192.168.2.1 > 192.168.2.103: ICMP time exceeded in-transit, length 68
15:59:16.141166 IP 192.168.2.103.39440 > 192.168.3.103.33449: UDP, length 32
15:59:16.141859 IP 192.168.2.103.41731 > 192.168.3.103.33448: UDP, length 32
15:59:16.142325 IP 192.168.3.103 > 192.168.2.103: ICMP 192.168.3.103 udp port 33449 unreachable, length 68
15:59:16.143290 IP 192.168.2.103.43650 > 192.168.3.103.33446: UDP, length 32
15:59:16.143323 IP 192.168.2.103.43838 > 192.168.3.103.33438: UDP, length 32
15:59:16.143355 IP 192.168.2.103.35418 > 192.168.3.103.33436: UDP, length 32
15:59:16.143359 IP 192.168.2.1 > 192.168.2.103: ICMP time exceeded in-transit, length 68
15:59:16.144733 IP 192.168.3.103 > 192.168.2.103: ICMP 192.168.3.103 udp port 33448 unreachable, length 68
15:59:16.144854 IP 192.168.2.103.36467 > 192.168.3.103.33442: UDP, length 32
15:59:16.144884 IP 192.168.2.103.44042 > 192.168.3.103.33435: UDP, length 32
15:59:16.144888 IP 192.168.2.1 > 192.168.2.103: ICMP time exceeded in-transit, length 68
15:59:16.145502 IP 192.168.2.103.37170 > 192.168.3.103.33440: UDP, length 32
15:59:16.145556 IP 192.168.2.103.52029 > 192.168.3.103.33447: UDP, length 32
15:59:16.145584 IP 192.168.2.103.36195 > 192.168.3.103.33444: UDP, length 32
15:59:16.145611 IP 192.168.2.103.60068 > 192.168.3.103.33437: UDP, length 32
15:59:16.145636 IP 192.168.2.103.54114 > 192.168.3.103.33441: UDP, length 32
15:59:16.145661 IP 192.168.2.103.59848 > 192.168.3.103.33443: UDP, length 32
15:59:16.145686 IP 192.168.2.103.56436 > 192.168.3.103.33445: UDP, length 32
15:59:16.145711 IP 192.168.2.103.38985 > 192.168.3.103.33439: UDP, length 32
15:59:16.147369 IP 192.168.3.103 > 192.168.2.103: ICMP 192.168.3.103 udp port 33446 unreachable, length 68
15:59:16.147479 IP 192.168.3.103 > 192.168.2.103: ICMP 192.168.3.103 udp port 33438 unreachable, length 68
15:59:16.148555 IP 192.168.3.103 > 192.168.2.103: ICMP 192.168.3.103 udp port 33442 unreachable, length 68
15:59:16.148593 IP 192.168.3.103 > 192.168.2.103: ICMP 192.168.3.103 udp port 33440 unreachable, length 68
15:59:16.149337 IP 192.168.2.103.48279 > 192.168.3.103.33450: UDP, length 32
15:59:16.267514 IP 192.168.3.101 > 192.168.2.2: ICMP echo request, id 3205, seq 1, length 64
15:59:16.267568 IP 192.168.2.2 > 192.168.3.101: ICMP echo reply, id 3205, seq 1, length 64
15:59:16.274593 IP 192.168.3.101 > 192.168.2.101: ICMP echo request, id 3217, seq 1, length 64
15:59:16.274665 IP 192.168.2.101 > 192.168.3.101: ICMP echo reply, id 3217, seq 1, length 64
15:59:16.281244 IP 192.168.3.101 > 192.168.2.3: ICMP echo request, id 3226, seq 1, length 64
15:59:16.281299 IP 192.168.2.3 > 192.168.3.101: ICMP echo reply, id 3226, seq 1, length 64
15:59:16.284931 IP 192.168.2.101 > 192.168.3.2: ICMP echo request, id 3232, seq 1, length 64
15:59:16.284988 IP 192.168.3.2 > 192.168.2.101: ICMP echo reply, id 3232, seq 1, length 64
15:59:16.287015 IP 192.168.3.101 > 192.168.2.103: ICMP echo request, id 3229, seq 1, length 64
15:59:16.287090 IP 192.168.2.103 > 192.168.3.101: ICMP echo reply, id 3229, seq 1, length 64
15:59:16.294576 IP 192.168.2.101 > 192.168.3.3: ICMP echo request, id 3235, seq 1, length 64
15:59:16.294653 IP 192.168.3.3 > 192.168.2.101: ICMP echo reply, id 3235, seq 1, length 64
15:59:16.298227 IP 192.168.2.101 > 192.168.5.2: ICMP echo request, id 3241, seq 1, length 64
15:59:16.298235 IP 192.168.5.2 > 192.168.2.101: ICMP echo reply, id 3241, seq 1, length 64
15:59:16.308842 IP 192.168.2.101 > 192.168.3.101: ICMP echo request, id 3250, seq 1, length 64
15:59:16.308991 IP 192.168.3.101 > 192.168.2.101: ICMP echo reply, id 3250, seq 1, length 64
15:59:16.314803 IP 192.168.2.101 > 192.168.2.1: ICMP echo request, id 3256, seq 1, length 64
15:59:16.314815 IP 192.168.2.1 > 192.168.2.101: ICMP echo reply, id 3256, seq 1, length 64
15:59:19.216551 IP 192.168.3.3 > 192.168.2.2: ICMP echo request, id 3262, seq 1, length 64
15:59:19.218873 IP 192.168.2.2 > 192.168.3.3: ICMP echo reply, id 3262, seq 1, length 64
15:59:19.222082 IP 192.168.3.3 > 192.168.2.3: ICMP echo request, id 3263, seq 1, length 64
15:59:19.223726 IP 192.168.2.3 > 192.168.3.3: ICMP echo reply, id 3263, seq 1, length 64
15:59:21.234677 IP 192.168.3.103.55387 > 192.168.2.3.33445: UDP, length 32
15:59:21.235206 IP 192.168.3.103.44599 > 192.168.2.3.33446: UDP, length 32
15:59:21.235245 IP 192.168.3.103.46289 > 192.168.2.3.33438: UDP, length 32
15:59:21.235273 IP 192.168.3.103.53977 > 192.168.2.3.33439: UDP, length 32
15:59:21.235298 IP 192.168.3.103.47944 > 192.168.2.3.33449: UDP, length 32
15:59:21.235325 IP 192.168.3.103.40098 > 192.168.2.3.33440: UDP, length 32
15:59:21.235350 IP 192.168.3.103.40427 > 192.168.2.3.33448: UDP, length 32
15:59:21.235375 IP 192.168.3.103.43004 > 192.168.2.3.33447: UDP, length 32
15:59:21.235399 IP 192.168.3.103.54124 > 192.168.2.3.33441: UDP, length 32
15:59:21.235424 IP 192.168.3.103.43769 > 192.168.2.3.33442: UDP, length 32
15:59:21.235449 IP 192.168.3.103.60808 > 192.168.2.3.33437: UDP, length 32
15:59:21.235540 IP 192.168.3.103.35178 > 192.168.2.3.33443: UDP, length 32
15:59:21.235572 IP 192.168.3.103.38239 > 192.168.2.3.33444: UDP, length 32
15:59:21.236598 IP 192.168.2.3 > 192.168.3.103: ICMP 192.168.2.3 udp port 33445 unreachable, length 68
15:59:21.237246 IP 192.168.2.3 > 192.168.3.103: ICMP 192.168.2.3 udp port 33446 unreachable, length 68
15:59:21.237279 IP 192.168.2.3 > 192.168.3.103: ICMP 192.168.2.3 udp port 33438 unreachable, length 68
15:59:21.237305 IP 192.168.2.3 > 192.168.3.103: ICMP 192.168.2.3 udp port 33439 unreachable, length 68
15:59:21.237330 IP 192.168.2.3 > 192.168.3.103: ICMP 192.168.2.3 udp port 33449 unreachable, length 68
15:59:21.237359 IP 192.168.2.3 > 192.168.3.103: ICMP 192.168.2.3 udp port 33440 unreachable, length 68
15:59:21.298885 IP 192.168.3.101 > 192.168.2.2: ICMP echo request, id 3308, seq 1, length 64
15:59:21.298942 IP 192.168.2.2 > 192.168.3.101: ICMP echo reply, id 3308, seq 1, length 64
15:59:21.306959 IP 192.168.3.101 > 192.168.2.101: ICMP echo request, id 3317, seq 1, length 64
15:59:21.307011 IP 192.168.2.101 > 192.168.3.101: ICMP echo reply, id 3317, seq 1, length 64
15:59:21.311910 IP 192.168.3.101 > 192.168.2.3: ICMP echo request, id 3323, seq 1, length 64
15:59:21.311966 IP 192.168.2.3 > 192.168.3.101: ICMP echo reply, id 3323, seq 1, length 64
15:59:21.315007 IP 192.168.3.101 > 192.168.2.103: ICMP echo request, id 3326, seq 1, length 64
15:59:21.315086 IP 192.168.2.103 > 192.168.3.101: ICMP echo reply, id 3326, seq 1, length 64
15:59:21.327207 IP 192.168.2.101 > 192.168.3.2: ICMP echo request, id 3338, seq 1, length 64
15:59:21.327269 IP 192.168.3.2 > 192.168.2.101: ICMP echo reply, id 3338, seq 1, length 64
15:59:21.329810 IP 192.168.2.101 > 192.168.3.3: ICMP echo request, id 3341, seq 1, length 64
15:59:21.329868 IP 192.168.3.3 > 192.168.2.101: ICMP echo reply, id 3341, seq 1, length 64
15:59:21.332341 IP 192.168.2.101 > 192.168.5.2: ICMP echo request, id 3344, seq 1, length 64
15:59:21.332350 IP 192.168.5.2 > 192.168.2.101: ICMP echo reply, id 3344, seq 1, length 64
15:59:21.339235 IP 192.168.2.101 > 192.168.3.101: ICMP echo request, id 3353, seq 1, length 64
15:59:21.339298 IP 192.168.3.101 > 192.168.2.101: ICMP echo reply, id 3353, seq 1, length 64
15:59:21.344250 IP 192.168.2.101 > 192.168.2.1: ICMP echo request, id 3359, seq 1, length 64
15:59:21.344260 IP 192.168.2.1 > 192.168.2.101: ICMP echo reply, id 3359, seq 1, length 64
15:59:21.347141 IP 192.168.2.101 > 192.168.3.103: ICMP echo request, id 3362, seq 1, length 64
15:59:21.348107 IP 192.168.3.103 > 192.168.2.101: ICMP echo reply, id 3362, seq 1, length 64
15:59:24.232896 ARP, Request who-has 192.168.2.2 tell 192.168.2.1, length 28
15:59:24.233026 ARP, Reply 192.168.2.2 is-at be:61:82:f9:22:f2 (oui Unknown), length 28
15:59:26.256769 IP 192.168.3.103.46993 > 192.168.2.2.33440: UDP, length 32
15:59:26.256809 IP 192.168.3.103.43271 > 192.168.2.2.33438: UDP, length 32
15:59:26.256838 IP 192.168.3.103.34058 > 192.168.2.2.33439: UDP, length 32
15:59:26.256864 IP 192.168.3.103.46425 > 192.168.2.2.33442: UDP, length 32
15:59:26.256889 IP 192.168.3.103.45482 > 192.168.2.2.33448: UDP, length 32
15:59:26.256914 IP 192.168.3.103.42931 > 192.168.2.2.33445: UDP, length 32
15:59:26.257052 IP 192.168.3.103.47572 > 192.168.2.2.33444: UDP, length 32
15:59:26.257079 IP 192.168.3.103.59997 > 192.168.2.2.33443: UDP, length 32
15:59:26.257104 IP 192.168.3.103.37189 > 192.168.2.2.33441: UDP, length 32
15:59:26.257129 IP 192.168.3.103.53564 > 192.168.2.2.33449: UDP, length 32
15:59:26.257211 IP 192.168.3.103.33264 > 192.168.2.2.33447: UDP, length 32
15:59:26.257235 IP 192.168.3.103.53331 > 192.168.2.2.33446: UDP, length 32
15:59:26.257260 IP 192.168.3.103.58773 > 192.168.2.2.33437: UDP, length 32
15:59:26.259098 IP 192.168.2.2 > 192.168.3.103: ICMP 192.168.2.2 udp port 33440 unreachable, length 68
15:59:26.259140 IP 192.168.2.2 > 192.168.3.103: ICMP 192.168.2.2 udp port 33438 unreachable, length 68
15:59:26.259168 IP 192.168.2.2 > 192.168.3.103: ICMP 192.168.2.2 udp port 33439 unreachable, length 68
15:59:26.259193 IP 192.168.2.2 > 192.168.3.103: ICMP 192.168.2.2 udp port 33442 unreachable, length 68
15:59:26.259217 IP 192.168.2.2 > 192.168.3.103: ICMP 192.168.2.2 udp port 33448 unreachable, length 68
15:59:26.259247 IP 192.168.2.2 > 192.168.3.103: ICMP 192.168.2.2 udp port 33445 unreachable, length 68
15:59:26.260655 IP 192.168.3.103.59340 > 192.168.2.2.33452: UDP, length 32
15:59:26.260693 IP 192.168.3.103.55839 > 192.168.2.2.33451: UDP, length 32
15:59:26.260726 IP 192.168.3.103.45414 > 192.168.2.2.33450: UDP, length 32
15:59:26.332455 IP 192.168.3.101 > 192.168.2.2: ICMP echo request, id 3393, seq 1, length 64
15:59:26.332605 IP 192.168.2.2 > 192.168.3.101: ICMP echo reply, id 3393, seq 1, length 64
15:59:26.340817 IP 192.168.3.101 > 192.168.2.101: ICMP echo request, id 3402, seq 1, length 64
15:59:26.340869 IP 192.168.2.101 > 192.168.3.101: ICMP echo reply, id 3402, seq 1, length 64
15:59:26.346328 IP 192.168.3.101 > 192.168.2.3: ICMP echo request, id 3408, seq 1, length 64
15:59:26.346377 IP 192.168.2.3 > 192.168.3.101: ICMP echo reply, id 3408, seq 1, length 64
15:59:26.349097 IP 192.168.3.101 > 192.168.2.103: ICMP echo request, id 3411, seq 1, length 64
15:59:26.349147 IP 192.168.2.103 > 192.168.3.101: ICMP echo reply, id 3411, seq 1, length 64
15:59:26.359477 IP 192.168.2.101 > 192.168.3.2: ICMP echo request, id 3423, seq 1, length 64
15:59:26.359556 IP 192.168.3.2 > 192.168.2.101: ICMP echo reply, id 3423, seq 1, length 64
15:59:26.362419 IP 192.168.2.101 > 192.168.3.3: ICMP echo request, id 3426, seq 1, length 64
15:59:26.362495 IP 192.168.3.3 > 192.168.2.101: ICMP echo reply, id 3426, seq 1, length 64
15:59:26.365225 IP 192.168.2.101 > 192.168.5.2: ICMP echo request, id 3429, seq 1, length 64
15:59:26.365233 IP 192.168.5.2 > 192.168.2.101: ICMP echo reply, id 3429, seq 1, length 64
15:59:26.373108 IP 192.168.2.101 > 192.168.3.101: ICMP echo request, id 3438, seq 1, length 64
15:59:26.373169 IP 192.168.3.101 > 192.168.2.101: ICMP echo reply, id 3438, seq 1, length 64
15:59:26.378663 IP 192.168.2.101 > 192.168.2.1: ICMP echo request, id 3444, seq 1, length 64
15:59:26.378672 IP 192.168.2.1 > 192.168.2.101: ICMP echo reply, id 3444, seq 1, length 64
15:59:26.381756 IP 192.168.2.101 > 192.168.3.103: ICMP echo request, id 3447, seq 1, length 64
15:59:26.381820 IP 192.168.3.103 > 192.168.2.101: ICMP echo reply, id 3447, seq 1, length 64

15:59:31.268447 IP 192.168.3.103.46485 > 192.168.2.103.33437: UDP, length 32
15:59:31.269459 IP 192.168.2.103 > 192.168.3.103: ICMP 192.168.2.103 udp port 33437 unreachable, length 68
15:59:31.270789 IP 192.168.3.103.53033 > 192.168.2.103.33438: UDP, length 32
15:59:31.271400 IP 192.168.3.103.55634 > 192.168.2.103.33440: UDP, length 32
15:59:31.271438 IP 192.168.3.103.40254 > 192.168.2.103.33443: UDP, length 32
15:59:31.271505 IP 192.168.3.103.48798 > 192.168.2.103.33446: UDP, length 32
15:59:31.271556 IP 192.168.3.103.41982 > 192.168.2.103.33445: UDP, length 32
15:59:31.271582 IP 192.168.3.103.44040 > 192.168.2.103.33439: UDP, length 32
15:59:31.271606 IP 192.168.3.103.48992 > 192.168.2.103.33441: UDP, length 32
15:59:31.271630 IP 192.168.3.103.36347 > 192.168.2.103.33444: UDP, length 32
15:59:31.271655 IP 192.168.3.103.34681 > 192.168.2.103.33448: UDP, length 32
15:59:31.271680 IP 192.168.3.103.39439 > 192.168.2.103.33449: UDP, length 32
15:59:31.271704 IP 192.168.3.103.43974 > 192.168.2.103.33442: UDP, length 32
15:59:31.271733 IP 192.168.3.103.39390 > 192.168.2.103.33447: UDP, length 32
15:59:31.272828 IP 192.168.2.103 > 192.168.3.103: ICMP 192.168.2.103 udp port 33438 unreachable, length 68
15:59:31.273369 IP 192.168.2.103 > 192.168.3.103: ICMP 192.168.2.103 udp port 33440 unreachable, length 68
15:59:31.273404 IP 192.168.2.103 > 192.168.3.103: ICMP 192.168.2.103 udp port 33443 unreachable, length 68
15:59:31.273430 IP 192.168.2.103 > 192.168.3.103: ICMP 192.168.2.103 udp port 33446 unreachable, length 68
15:59:31.273528 IP 192.168.2.103 > 192.168.3.103: ICMP 192.168.2.103 udp port 33445 unreachable, length 68
15:59:31.359016 IP 192.168.3.101 > 192.168.2.2: ICMP echo request, id 3505, seq 1, length 64
15:59:31.359092 IP 192.168.2.2 > 192.168.3.101: ICMP echo reply, id 3505, seq 1, length 64
15:59:31.367423 IP 192.168.3.101 > 192.168.2.101: ICMP echo request, id 3514, seq 1, length 64
15:59:31.367498 IP 192.168.2.101 > 192.168.3.101: ICMP echo reply, id 3514, seq 1, length 64
15:59:31.373142 IP 192.168.3.101 > 192.168.2.3: ICMP echo request, id 3520, seq 1, length 64
15:59:31.373205 IP 192.168.2.3 > 192.168.3.101: ICMP echo reply, id 3520, seq 1, length 64
15:59:31.376124 IP 192.168.3.101 > 192.168.2.103: ICMP echo request, id 3523, seq 1, length 64
15:59:31.376175 IP 192.168.2.103 > 192.168.3.101: ICMP echo reply, id 3523, seq 1, length 64
15:59:31.390723 IP 192.168.2.101 > 192.168.3.2: ICMP echo request, id 3538, seq 1, length 64
15:59:31.390869 IP 192.168.3.2 > 192.168.2.101: ICMP echo reply, id 3538, seq 1, length 64
15:59:31.393477 IP 192.168.2.101 > 192.168.3.3: ICMP echo request, id 3541, seq 1, length 64
15:59:31.393536 IP 192.168.3.3 > 192.168.2.101: ICMP echo reply, id 3541, seq 1, length 64
15:59:31.396173 IP 192.168.2.101 > 192.168.5.2: ICMP echo request, id 3544, seq 1, length 64
15:59:31.396181 IP 192.168.5.2 > 192.168.2.101: ICMP echo reply, id 3544, seq 1, length 64
15:59:31.404102 IP 192.168.2.101 > 192.168.3.101: ICMP echo request, id 3553, seq 1, length 64
15:59:31.404219 IP 192.168.3.101 > 192.168.2.101: ICMP echo reply, id 3553, seq 1, length 64
15:59:31.409752 IP 192.168.2.101 > 192.168.2.1: ICMP echo request, id 3559, seq 1, length 64
15:59:31.409762 IP 192.168.2.1 > 192.168.2.101: ICMP echo reply, id 3559, seq 1, length 64
15:59:31.412248 IP 192.168.2.101 > 192.168.3.103: ICMP echo request, id 3562, seq 1, length 64
15:59:31.412305 IP 192.168.3.103 > 192.168.2.101: ICMP echo reply, id 3562, seq 1, length 64
15:59:36.280517 ARP, Request who-has 192.168.2.103 tell 192.168.2.1, length 28
15:59:36.280686 ARP, Reply 192.168.2.103 is-at 0a:4e:61:96:4a:15 (oui Unknown), length 28
15:59:36.376769 ARP, Request who-has 192.168.2.101 tell 192.168.2.1, length 28
15:59:36.376774 ARP, Request who-has 192.168.2.3 tell 192.168.2.1, length 28
15:59:36.376866 ARP, Request who-has 192.168.2.1 tell 192.168.2.3, length 28
15:59:36.376871 ARP, Reply 192.168.2.1 is-at ee:d6:9a:3a:e5:b2 (oui Unknown), length 28
15:59:36.376947 ARP, Reply 192.168.2.3 is-at b2:39:30:9a:d0:62 (oui Unknown), length 28
15:59:36.376950 ARP, Reply 192.168.2.101 is-at c2:77:95:f2:f6:30 (oui Unknown), length 28
15:59:36.377556 ARP, Request who-has 192.168.2.1 tell 192.168.2.101, length 28
15:59:36.377560 ARP, Reply 192.168.2.1 is-at ee:d6:9a:3a:e5:b2 (oui Unknown), length 28
15:59:36.393957 IP 192.168.3.101 > 192.168.2.2: ICMP echo request, id 3665, seq 1, length 64
15:59:36.394020 IP 192.168.2.2 > 192.168.3.101: ICMP echo reply, id 3665, seq 1, length 64
15:59:36.411764 IP 192.168.3.101 > 192.168.2.101: ICMP echo request, id 3675, seq 1, length 64
15:59:36.411840 IP 192.168.2.101 > 192.168.3.101: ICMP echo reply, id 3675, seq 1, length 64
15:59:36.429517 IP 192.168.3.101 > 192.168.2.3: ICMP echo request, id 3692, seq 1, length 64
15:59:36.429570 IP 192.168.2.3 > 192.168.3.101: ICMP echo reply, id 3692, seq 1, length 64
15:59:36.430926 IP 192.168.2.101 > 192.168.3.2: ICMP echo request, id 3697, seq 1, length 64
15:59:36.430977 IP 192.168.3.2 > 192.168.2.101: ICMP echo reply, id 3697, seq 1, length 64
15:59:36.438660 IP 192.168.3.101 > 192.168.2.103: ICMP echo request, id 3700, seq 1, length 64
15:59:36.438714 IP 192.168.2.103 > 192.168.3.101: ICMP echo reply, id 3700, seq 1, length 64
15:59:36.440984 IP 192.168.2.101 > 192.168.3.3: ICMP echo request, id 3704, seq 1, length 64
15:59:36.441097 IP 192.168.3.3 > 192.168.2.101: ICMP echo reply, id 3704, seq 1, length 64
15:59:36.447894 IP 192.168.2.101 > 192.168.5.2: ICMP echo request, id 3710, seq 1, length 64
15:59:36.447903 IP 192.168.5.2 > 192.168.2.101: ICMP echo reply, id 3710, seq 1, length 64
15:59:36.462527 IP 192.168.2.101 > 192.168.3.101: ICMP echo request, id 3725, seq 1, length 64
15:59:36.462591 IP 192.168.3.101 > 192.168.2.101: ICMP echo reply, id 3725, seq 1, length 64
15:59:36.467818 IP 192.168.2.101 > 192.168.2.1: ICMP echo request, id 3731, seq 1, length 64
15:59:36.467827 IP 192.168.2.1 > 192.168.2.101: ICMP echo reply, id 3731, seq 1, length 64
15:59:36.470570 IP 192.168.2.101 > 192.168.3.103: ICMP echo request, id 3734, seq 1, length 64
15:59:36.470629 IP 192.168.3.103 > 192.168.2.101: ICMP echo reply, id 3734, seq 1, length 64
15:59:41.400659 ARP, Request who-has 192.168.2.1 tell 192.168.2.2, length 28
15:59:41.400667 ARP, Reply 192.168.2.1 is-at ee:d6:9a:3a:e5:b2 (oui Unknown), length 28
15:59:41.466053 IP 192.168.3.101 > 192.168.2.2: ICMP echo request, id 3776, seq 1, length 64
15:59:41.466116 IP 192.168.2.2 > 192.168.3.101: ICMP echo reply, id 3776, seq 1, length 64
15:59:41.477556 IP 192.168.3.101 > 192.168.2.101: ICMP echo request, id 3788, seq 1, length 64
15:59:41.477615 IP 192.168.2.101 > 192.168.3.101: ICMP echo reply, id 3788, seq 1, length 64
15:59:41.483458 IP 192.168.2.101 > 192.168.3.2: ICMP echo request, id 3794, seq 1, length 64
15:59:41.483526 IP 192.168.3.2 > 192.168.2.101: ICMP echo reply, id 3794, seq 1, length 64
15:59:41.489108 IP 192.168.3.101 > 192.168.2.3: ICMP echo request, id 3800, seq 1, length 64
15:59:41.489232 IP 192.168.2.3 > 192.168.3.101: ICMP echo reply, id 3800, seq 1, length 64
15:59:41.491126 IP 192.168.2.101 > 192.168.3.3: ICMP echo request, id 3797, seq 1, length 64
15:59:41.491218 IP 192.168.3.3 > 192.168.2.101: ICMP echo reply, id 3797, seq 1, length 64
15:59:41.495099 IP 192.168.3.101 > 192.168.2.103: ICMP echo request, id 3803, seq 1, length 64
15:59:41.495159 IP 192.168.2.103 > 192.168.3.101: ICMP echo reply, id 3803, seq 1, length 64
15:59:41.497751 IP 192.168.2.101 > 192.168.5.2: ICMP echo request, id 3806, seq 1, length 64
15:59:41.497763 IP 192.168.5.2 > 192.168.2.101: ICMP echo reply, id 3806, seq 1, length 64
15:59:41.514679 IP 192.168.2.101 > 192.168.3.101: ICMP echo request, id 3824, seq 1, length 64
15:59:41.514768 IP 192.168.3.101 > 192.168.2.101: ICMP echo reply, id 3824, seq 1, length 64
15:59:41.522046 IP 192.168.2.101 > 192.168.2.1: ICMP echo request, id 3830, seq 1, length 64
15:59:41.522057 IP 192.168.2.1 > 192.168.2.101: ICMP echo reply, id 3830, seq 1, length 64
15:59:41.525508 IP 192.168.2.101 > 192.168.3.103: ICMP echo request, id 3833, seq 1, length 64
15:59:41.525663 IP 192.168.3.103 > 192.168.2.101: ICMP echo reply, id 3833, seq 1, length 64
15:59:43.277521 IP 192.168.2.1 > 192.168.2.2: ICMP echo request, id 3886, seq 1, length 64
15:59:43.278819 IP 192.168.2.2 > 192.168.2.1: ICMP echo reply, id 3886, seq 1, length 64
15:59:43.280507 IP 192.168.2.1 > 192.168.2.3: ICMP echo request, id 3887, seq 1, length 64
15:59:43.281374 IP 192.168.2.3 > 192.168.2.1: ICMP echo reply, id 3887, seq 1, length 64
15:59:46.524722 IP 192.168.3.101 > 192.168.2.2: ICMP echo request, id 3915, seq 1, length 64
15:59:46.524858 IP 192.168.2.2 > 192.168.3.101: ICMP echo reply, id 3915, seq 1, length 64
15:59:46.536058 IP 192.168.3.101 > 192.168.2.101: ICMP echo request, id 3927, seq 1, length 64
15:59:46.536105 IP 192.168.2.101 > 192.168.3.101: ICMP echo reply, id 3927, seq 1, length 64
15:59:46.539566 IP 192.168.2.101 > 192.168.3.2: ICMP echo request, id 3930, seq 1, length 64
15:59:46.539620 IP 192.168.3.2 > 192.168.2.101: ICMP echo reply, id 3930, seq 1, length 64
15:59:46.544730 IP 192.168.2.101 > 192.168.3.3: ICMP echo request, id 3936, seq 1, length 64
15:59:46.544790 IP 192.168.3.3 > 192.168.2.101: ICMP echo reply, id 3936, seq 1, length 64
15:59:46.547736 IP 192.168.3.101 > 192.168.2.3: ICMP echo request, id 3939, seq 1, length 64
15:59:46.547798 IP 192.168.2.3 > 192.168.3.101: ICMP echo reply, id 3939, seq 1, length 64
15:59:46.550435 IP 192.168.2.101 > 192.168.5.2: ICMP echo request, id 3942, seq 1, length 64
15:59:46.550442 IP 192.168.5.2 > 192.168.2.101: ICMP echo reply, id 3942, seq 1, length 64
15:59:46.552446 IP 192.168.3.101 > 192.168.2.103: ICMP echo request, id 3945, seq 1, length 64
15:59:46.552496 IP 192.168.2.103 > 192.168.3.101: ICMP echo reply, id 3945, seq 1, length 64
15:59:46.566823 IP 192.168.2.101 > 192.168.3.101: ICMP echo request, id 3960, seq 1, length 64
15:59:46.566883 IP 192.168.3.101 > 192.168.2.101: ICMP echo reply, id 3960, seq 1, length 64
15:59:46.573911 IP 192.168.2.101 > 192.168.2.1: ICMP echo request, id 3969, seq 1, length 64
15:59:46.573920 IP 192.168.2.1 > 192.168.2.101: ICMP echo reply, id 3969, seq 1, length 64
15:59:46.576643 IP 192.168.2.101 > 192.168.3.103: ICMP echo request, id 3972, seq 1, length 64
15:59:46.576702 IP 192.168.3.103 > 192.168.2.101: ICMP echo reply, id 3972, seq 1, length 64
15:59:51.227317 IP 192.168.2.103.53314 > 192.168.3.3.33434: UDP, length 32
15:59:51.227329 IP 192.168.2.1 > 192.168.2.103: ICMP time exceeded in-transit, length 68
15:59:51.228435 IP 192.168.2.103.36059 > 192.168.3.3.33435: UDP, length 32
15:59:51.228442 IP 192.168.2.1 > 192.168.2.103: ICMP time exceeded in-transit, length 68
15:59:51.229470 IP 192.168.2.103.49587 > 192.168.3.3.33436: UDP, length 32
15:59:51.229476 IP 192.168.2.1 > 192.168.2.103: ICMP time exceeded in-transit, length 68
15:59:51.230497 IP 192.168.2.103.38246 > 192.168.3.3.33437: UDP, length 32
15:59:51.231355 IP 192.168.3.3 > 192.168.2.103: ICMP 192.168.3.3 udp port 33437 unreachable, length 68
15:59:51.232680 IP 192.168.2.103.49771 > 192.168.3.3.33447: UDP, length 32
15:59:51.233514 IP 192.168.2.103.38993 > 192.168.3.3.33443: UDP, length 32
15:59:51.234363 IP 192.168.3.3 > 192.168.2.103: ICMP 192.168.3.3 udp port 33447 unreachable, length 68
15:59:51.234457 IP 192.168.2.103.39174 > 192.168.3.3.33442: UDP, length 32
15:59:51.234488 IP 192.168.2.103.53889 > 192.168.3.3.33449: UDP, length 32
15:59:51.234514 IP 192.168.2.103.40403 > 192.168.3.3.33446: UDP, length 32
15:59:51.235906 IP 192.168.3.3 > 192.168.2.103: ICMP 192.168.3.3 udp port 33443 unreachable, length 68
15:59:51.236116 IP 192.168.2.103.33927 > 192.168.3.3.33439: UDP, length 32
15:59:51.236148 IP 192.168.2.103.54490 > 192.168.3.3.33441: UDP, length 32
15:59:51.236174 IP 192.168.2.103.35225 > 192.168.3.3.33448: UDP, length 32
15:59:51.236199 IP 192.168.2.103.42369 > 192.168.3.3.33438: UDP, length 32
15:59:51.236224 IP 192.168.2.103.45070 > 192.168.3.3.33445: UDP, length 32
15:59:51.236249 IP 192.168.2.103.47625 > 192.168.3.3.33444: UDP, length 32
15:59:51.237759 IP 192.168.3.3 > 192.168.2.103: ICMP 192.168.3.3 udp port 33442 unreachable, length 68
15:59:51.237809 IP 192.168.3.3 > 192.168.2.103: ICMP 192.168.3.3 udp port 33449 unreachable, length 68
