02:43:50.015827 ARP, Request who-has 192.168.2.1 tell 192.168.2.4, length 28
02:43:50.015847 ARP, Reply 192.168.2.1 is-at 3e:9f:b5:21:3b:f6 (oui Unknown), length 28
02:43:50.016827 IP 192.168.2.4 > 12.10.5.2: ICMP echo request, id 6710, seq 1, length 64
02:43:50.023411 IP 192.168.2.101 > 12.10.5.1: ICMP echo request, id 6711, seq 1, length 64
02:43:50.023422 IP 12.10.5.1 > 192.168.2.101: ICMP echo reply, id 6711, seq 1, length 64
02:43:50.032351 ARP, Request who-has 192.168.2.103 tell 192.168.2.101, length 28
02:43:50.043302 IP 192.168.2.101 > 192.168.1.1: ICMP echo request, id 6723, seq 1, length 64
02:43:50.043316 IP 192.168.1.1 > 192.168.2.101: ICMP echo reply, id 6723, seq 1, length 64
02:43:50.048270 IP 192.168.2.101 > 192.168.1.103: ICMP echo request, id 6726, seq 1, length 64
02:43:51.019657 ARP, Request who-has 192.168.2.1 tell 192.168.2.2, length 28
02:43:51.019678 ARP, Reply 192.168.2.1 is-at 3e:9f:b5:21:3b:f6 (oui Unknown), length 28
02:43:51.021019 IP 192.168.2.2 > 12.10.5.2: ICMP echo request, id 6729, seq 1, length 64
02:43:55.056566 ARP, Request who-has 192.168.2.101 tell 192.168.2.1, length 28
02:43:55.058265 ARP, Reply 192.168.2.101 is-at 9e:6a:c1:34:f5:1d (oui Unknown), length 28
02:43:56.059340 IP 192.168.2.101 > 192.168.2.1: ICMP echo request, id 6826, seq 1, length 64
02:43:56.059355 IP 192.168.2.1 > 192.168.2.101: ICMP echo reply, id 6826, seq 1, length 64
02:43:56.065896 IP 192.168.2.101 > 12.10.5.103: ICMP echo request, id 6829, seq 1, length 64
02:43:57.072406 IP 192.168.2.101 > 12.10.5.1: ICMP echo request, id 6850, seq 1, length 64
02:43:57.072422 IP 12.10.5.1 > 192.168.2.101: ICMP echo reply, id 6850, seq 1, length 64
02:43:57.078597 IP 192.168.2.101 > 192.168.1.1: ICMP echo request, id 6856, seq 1, length 64
02:43:57.078610 IP 192.168.1.1 > 192.168.2.101: ICMP echo reply, id 6856, seq 1, length 64
02:43:57.082296 IP 192.168.2.101 > 192.168.1.103: ICMP echo request, id 6859, seq 1, length 64
02:43:58.087787 ARP, Request who-has 192.168.2.4 tell 192.168.2.101, length 28
02:43:58.097966 ARP, Request who-has 192.168.2.2 tell 192.168.2.101, length 28
02:44:03.110240 IP 192.168.2.101 > 192.168.2.1: ICMP echo request, id 6927, seq 1, length 64
02:44:03.110255 IP 192.168.2.1 > 192.168.2.101: ICMP echo reply, id 6927, seq 1, length 64
02:44:03.114072 IP 192.168.2.101 > 12.10.5.103: ICMP echo request, id 6930, seq 1, length 64
02:44:04.117999 IP 192.168.2.101 > 12.10.5.1: ICMP echo request, id 6933, seq 1, length 64
02:44:04.118014 IP 12.10.5.1 > 192.168.2.101: ICMP echo reply, id 6933, seq 1, length 64
02:44:04.125922 IP 192.168.2.101 > 192.168.1.1: ICMP echo request, id 6939, seq 1, length 64
02:44:04.125949 IP 192.168.1.1 > 192.168.2.101: ICMP echo reply, id 6939, seq 1, length 64
02:44:04.128628 IP 192.168.2.101 > 192.168.1.103: ICMP echo request, id 6942, seq 1, length 64
02:44:10.148978 IP 192.168.2.101 > 192.168.2.1: ICMP echo request, id 7020, seq 1, length 64
02:44:10.148993 IP 192.168.2.1 > 192.168.2.101: ICMP echo reply, id 7020, seq 1, length 64
02:44:10.152832 IP 192.168.2.101 > 12.10.5.103: ICMP echo request, id 7023, seq 1, length 64
02:44:11.160007 IP 192.168.2.101 > 192.168.1.1: ICMP echo request, id 7029, seq 1, length 64
02:44:11.160022 IP 192.168.1.1 > 192.168.2.101: ICMP echo reply, id 7029, seq 1, length 64
02:44:11.163786 IP 192.168.2.101 > 192.168.1.103: ICMP echo request, id 7032, seq 1, length 64
02:44:15.153133 ARP, Request who-has 192.168.2.1 tell 192.168.2.101, length 28
02:44:15.153144 ARP, Reply 192.168.2.1 is-at 3e:9f:b5:21:3b:f6 (oui Unknown), length 28
02:44:17.177901 IP 192.168.2.101 > 192.168.2.1: ICMP echo request, id 7110, seq 1, length 64
02:44:17.177915 IP 192.168.2.1 > 192.168.2.101: ICMP echo reply, id 7110, seq 1, length 64
02:44:17.181627 IP 192.168.2.101 > 12.10.5.1: ICMP echo request, id 7113, seq 1, length 64
02:44:17.181642 IP 12.10.5.1 > 192.168.2.101: ICMP echo reply, id 7113, seq 1, length 64
02:44:17.188083 IP 192.168.2.101 > 192.168.1.1: ICMP echo request, id 7119, seq 1, length 64
02:44:17.188093 IP 192.168.1.1 > 192.168.2.101: ICMP echo reply, id 7119, seq 1, length 64

02:44:22.203795 IP 192.168.2.101 > 192.168.2.1: ICMP echo request, id 7248, seq 1, length 64
02:44:22.203805 IP 192.168.2.1 > 192.168.2.101: ICMP echo reply, id 7248, seq 1, length 64
02:44:22.206198 IP 192.168.2.101 > 12.10.5.1: ICMP echo request, id 7251, seq 1, length 64
02:44:22.206206 IP 12.10.5.1 > 192.168.2.101: ICMP echo reply, id 7251, seq 1, length 64
02:44:22.212174 IP 192.168.2.101 > 192.168.1.1: ICMP echo request, id 7257, seq 1, length 64
02:44:22.212184 IP 192.168.1.1 > 192.168.2.101: ICMP echo reply, id 7257, seq 1, length 64
02:44:27.227502 IP 192.168.2.101 > 192.168.2.1: ICMP echo request, id 7399, seq 1, length 64
02:44:27.227514 IP 192.168.2.1 > 192.168.2.101: ICMP echo reply, id 7399, seq 1, length 64
02:44:27.229964 IP 192.168.2.101 > 12.10.5.1: ICMP echo request, id 7402, seq 1, length 64
02:44:27.229972 IP 12.10.5.1 > 192.168.2.101: ICMP echo reply, id 7402, seq 1, length 64
02:44:27.235996 IP 192.168.2.101 > 192.168.1.1: ICMP echo request, id 7408, seq 1, length 64
02:44:27.236008 IP 192.168.1.1 > 192.168.2.101: ICMP echo reply, id 7408, seq 1, length 64
02:44:32.241375 ARP, Request who-has 192.168.2.101 tell 192.168.2.1, length 28
02:44:32.241521 ARP, Reply 192.168.2.101 is-at 9e:6a:c1:34:f5:1d (oui Unknown), length 28
02:44:32.251432 IP 192.168.2.101 > 192.168.2.1: ICMP echo request, id 7493, seq 1, length 64
02:44:32.251445 IP 192.168.2.1 > 192.168.2.101: ICMP echo reply, id 7493, seq 1, length 64
02:44:32.254528 IP 192.168.2.101 > 12.10.5.1: ICMP echo request, id 7496, seq 1, length 64
02:44:32.254538 IP 12.10.5.1 > 192.168.2.101: ICMP echo reply, id 7496, seq 1, length 64
02:44:32.259431 IP 192.168.2.101 > 192.168.1.1: ICMP echo request, id 7502, seq 1, length 64
02:44:32.259441 IP 192.168.1.1 > 192.168.2.101: ICMP echo reply, id 7502, seq 1, length 64
02:44:37.274052 IP 192.168.2.101 > 192.168.2.1: ICMP echo request, id 7660, seq 1, length 64
02:44:37.274064 IP 192.168.2.1 > 192.168.2.101: ICMP echo reply, id 7660, seq 1, length 64
02:44:37.276868 IP 192.168.2.101 > 12.10.5.1: ICMP echo request, id 7663, seq 1, length 64
02:44:37.276878 IP 12.10.5.1 > 192.168.2.101: ICMP echo reply, id 7663, seq 1, length 64
02:44:37.283554 IP 192.168.2.101 > 192.168.1.1: ICMP echo request, id 7669, seq 1, length 64
02:44:37.283567 IP 192.168.1.1 > 192.168.2.101: ICMP echo reply, id 7669, seq 1, length 64
02:44:42.288900 ARP, Request who-has 192.168.2.1 tell 192.168.2.101, length 28
02:44:42.288907 ARP, Reply 192.168.2.1 is-at 3e:9f:b5:21:3b:f6 (oui Unknown), length 28
02:44:42.302471 IP 192.168.2.101 > 192.168.2.1: ICMP echo request, id 7757, seq 1, length 64
02:44:42.302481 IP 192.168.2.1 > 192.168.2.101: ICMP echo reply, id 7757, seq 1, length 64
02:44:42.304913 IP 192.168.2.101 > 12.10.5.1: ICMP echo request, id 7760, seq 1, length 64
02:44:42.304920 IP 12.10.5.1 > 192.168.2.101: ICMP echo reply, id 7760, seq 1, length 64
02:44:42.309415 IP 192.168.2.101 > 192.168.1.1: ICMP echo request, id 7766, seq 1, length 64
02:44:42.309424 IP 192.168.1.1 > 192.168.2.101: ICMP echo reply, id 7766, seq 1, length 64
02:44:47.331397 IP 192.168.2.101 > 192.168.2.1: ICMP echo request, id 7854, seq 1, length 64
02:44:47.331408 IP 192.168.2.1 > 192.168.2.101: ICMP echo reply, id 7854, seq 1, length 64
02:44:47.334313 IP 192.168.2.101 > 12.10.5.1: ICMP echo request, id 7857, seq 1, length 64
02:44:47.334322 IP 12.10.5.1 > 192.168.2.101: ICMP echo reply, id 7857, seq 1, length 64
02:44:47.339987 IP 192.168.2.101 > 192.168.1.1: ICMP echo request, id 7863, seq 1, length 64
02:44:47.339998 IP 192.168.1.1 > 192.168.2.101: ICMP echo reply, id 7863, seq 1, length 64

02:44:49.368271 ARP, Request who-has 192.168.2.4 tell 192.168.2.103, length 28
02:44:49.379395 ARP, Request who-has 192.168.2.2 tell 192.168.2.103, length 28
02:44:49.389224 IP 192.168.2.103.33172 > 12.10.5.1.33434: UDP, length 32
02:44:49.389241 IP 12.10.5.1 > 192.168.2.103: ICMP 12.10.5.1 udp port 33434 unreachable, length 68
02:44:49.390081 IP 192.168.2.103.58073 > 12.10.5.1.33435: UDP, length 32
02:44:49.390090 IP 12.10.5.1 > 192.168.2.103: ICMP 12.10.5.1 udp port 33435 unreachable, length 68
02:44:49.391076 IP 192.168.2.103.51259 > 12.10.5.1.33436: UDP, length 32
02:44:49.391085 IP 12.10.5.1 > 192.168.2.103: ICMP 12.10.5.1 udp port 33436 unreachable, length 68
02:44:49.392715 IP 192.168.2.103.43200 > 12.10.5.1.33448: UDP, length 32
02:44:49.392724 IP 12.10.5.1 > 192.168.2.103: ICMP 12.10.5.1 udp port 33448 unreachable, length 68
02:44:49.392773 IP 192.168.2.103.47264 > 12.10.5.1.33439: UDP, length 32
02:44:49.392778 IP 12.10.5.1 > 192.168.2.103: ICMP 12.10.5.1 udp port 33439 unreachable, length 68
02:44:49.392817 IP 192.168.2.103.33630 > 12.10.5.1.33449: UDP, length 32
02:44:49.392821 IP 12.10.5.1 > 192.168.2.103: ICMP 12.10.5.1 udp port 33449 unreachable, length 68
02:44:49.392857 IP 192.168.2.103.51173 > 12.10.5.1.33447: UDP, length 32
02:44:49.392872 IP 192.168.2.103.56756 > 12.10.5.1.33446: UDP, length 32
02:44:49.392886 IP 192.168.2.103.35669 > 12.10.5.1.33442: UDP, length 32
02:44:49.392899 IP 192.168.2.103.33832 > 12.10.5.1.33443: UDP, length 32
02:44:49.392912 IP 192.168.2.103.56508 > 12.10.5.1.33438: UDP, length 32
02:44:49.392925 IP 192.168.2.103.42857 > 12.10.5.1.33440: UDP, length 32
02:44:49.392938 IP 192.168.2.103.37551 > 12.10.5.1.33445: UDP, length 32
02:44:49.393039 IP 192.168.2.103.50964 > 12.10.5.1.33444: UDP, length 32
02:44:49.393056 IP 192.168.2.103.38714 > 12.10.5.1.33437: UDP, length 32
02:44:49.393078 IP 192.168.2.103.34275 > 12.10.5.1.33441: UDP, length 32
02:44:52.355622 IP 192.168.2.101 > 192.168.2.1: ICMP echo request, id 7993, seq 1, length 64
02:44:52.355633 IP 192.168.2.1 > 192.168.2.101: ICMP echo reply, id 7993, seq 1, length 64
02:44:52.358486 IP 192.168.2.101 > 12.10.5.1: ICMP echo request, id 7996, seq 1, length 64
02:44:52.358495 IP 12.10.5.1 > 192.168.2.101: ICMP echo reply, id 7996, seq 1, length 64
02:44:52.364024 IP 192.168.2.101 > 192.168.1.1: ICMP echo request, id 8002, seq 1, length 64
02:44:52.364034 IP 192.168.1.1 > 192.168.2.101: ICMP echo reply, id 8002, seq 1, length 64
02:44:54.401086 ARP, Request who-has 192.168.2.103 tell 192.168.2.1, length 28
02:44:54.401895 ARP, Request who-has 192.168.2.1 tell 192.168.2.103, length 28
02:44:54.401902 ARP, Reply 192.168.2.1 is-at 3e:9f:b5:21:3b:f6 (oui Unknown), length 28
02:44:54.402274 ARP, Reply 192.168.2.103 is-at 26:fa:af:cc:c6:0d (oui Unknown), length 28
02:44:57.379580 IP 192.168.2.101 > 192.168.2.1: ICMP echo request, id 8107, seq 1, length 64
02:44:57.379592 IP 192.168.2.1 > 192.168.2.101: ICMP echo reply, id 8107, seq 1, length 64
02:44:57.383527 IP 192.168.2.101 > 12.10.5.1: ICMP echo request, id 8110, seq 1, length 64
02:44:57.383540 IP 12.10.5.1 > 192.168.2.101: ICMP echo reply, id 8110, seq 1, length 64
02:44:57.390207 IP 192.168.2.101 > 192.168.1.1: ICMP echo request, id 8116, seq 1, length 64
02:44:57.390220 IP 192.168.1.1 > 192.168.2.101: ICMP echo reply, id 8116, seq 1, length 64
02:45:02.407504 IP 192.168.2.101 > 192.168.2.1: ICMP echo request, id 8248, seq 1, length 64
02:45:02.407517 IP 192.168.2.1 > 192.168.2.101: ICMP echo reply, id 8248, seq 1, length 64
02:45:02.410116 IP 192.168.2.101 > 12.10.5.1: ICMP echo request, id 8251, seq 1, length 64
02:45:02.410125 IP 12.10.5.1 > 192.168.2.101: ICMP echo reply, id 8251, seq 1, length 64
02:45:02.415518 IP 192.168.2.101 > 192.168.1.1: ICMP echo request, id 8257, seq 1, length 64
02:45:02.415527 IP 192.168.1.1 > 192.168.2.101: ICMP echo reply, id 8257, seq 1, length 64
02:45:07.409238 ARP, Request who-has 192.168.2.1 tell 192.168.2.101, length 28
02:45:07.409248 ARP, Reply 192.168.2.1 is-at 3e:9f:b5:21:3b:f6 (oui Unknown), length 28
02:45:07.431261 IP 192.168.2.101 > 192.168.2.1: ICMP echo request, id 8371, seq 1, length 64
02:45:07.431272 IP 192.168.2.1 > 192.168.2.101: ICMP echo reply, id 8371, seq 1, length 64
02:45:07.434056 IP 192.168.2.101 > 12.10.5.1: ICMP echo request, id 8374, seq 1, length 64
02:45:07.434064 IP 12.10.5.1 > 192.168.2.101: ICMP echo reply, id 8374, seq 1, length 64
02:45:07.439588 IP 192.168.2.101 > 192.168.1.1: ICMP echo request, id 8380, seq 1, length 64
02:45:07.439597 IP 192.168.1.1 > 192.168.2.101: ICMP echo reply, id 8380, seq 1, length 64
02:45:12.432468 ARP, Request who-has 192.168.2.101 tell 192.168.2.1, length 28
02:45:12.432648 ARP, Reply 192.168.2.101 is-at 9e:6a:c1:34:f5:1d (oui Unknown), length 28
02:45:12.454896 IP 192.168.2.101 > 192.168.2.1: ICMP echo request, id 8515, seq 1, length 64
02:45:12.454908 IP 192.168.2.1 > 192.168.2.101: ICMP echo reply, id 8515, seq 1, length 64
02:45:12.457502 IP 192.168.2.101 > 12.10.5.1: ICMP echo request, id 8518, seq 1, length 64
02:45:12.457510 IP 12.10.5.1 > 192.168.2.101: ICMP echo reply, id 8518, seq 1, length 64
02:45:12.462728 IP 192.168.2.101 > 192.168.1.1: ICMP echo request, id 8524, seq 1, length 64
02:45:12.462736 IP 192.168.1.1 > 192.168.2.101: ICMP echo reply, id 8524, seq 1, length 64
02:45:17.477215 IP 192.168.2.101 > 192.168.2.1: ICMP echo request, id 8615, seq 1, length 64
02:45:17.477227 IP 192.168.2.1 > 192.168.2.101: ICMP echo reply, id 8615, seq 1, length 64
02:45:17.479903 IP 192.168.2.101 > 12.10.5.1: ICMP echo request, id 8618, seq 1, length 64
02:45:17.479913 IP 12.10.5.1 > 192.168.2.101: ICMP echo reply, id 8618, seq 1, length 64
02:45:17.485328 IP 192.168.2.101 > 192.168.1.1: ICMP echo request, id 8624, seq 1, length 64
02:45:17.485338 IP 192.168.1.1 > 192.168.2.101: ICMP echo reply, id 8624, seq 1, length 64

02:45:22.502929 IP 192.168.2.101 > 192.168.2.1: ICMP echo request, id 8727, seq 1, length 64
02:45:22.502944 IP 192.168.2.1 > 192.168.2.101: ICMP echo reply, id 8727, seq 1, length 64
02:45:22.506522 IP 192.168.2.101 > 12.10.5.1: ICMP echo request, id 8730, seq 1, length 64
02:45:22.506535 IP 12.10.5.1 > 192.168.2.101: ICMP echo reply, id 8730, seq 1, length 64
02:45:22.512122 IP 192.168.2.101 > 192.168.1.1: ICMP echo request, id 8736, seq 1, length 64
02:45:22.512133 IP 192.168.1.1 > 192.168.2.101: ICMP echo reply, id 8736, seq 1, length 64
02:45:27.527231 IP 192.168.2.101 > 192.168.2.1: ICMP echo request, id 8846, seq 1, length 64
02:45:27.527247 IP 192.168.2.1 > 192.168.2.101: ICMP echo reply, id 8846, seq 1, length 64
02:45:27.530557 IP 192.168.2.101 > 12.10.5.1: ICMP echo request, id 8849, seq 1, length 64
02:45:27.530570 IP 12.10.5.1 > 192.168.2.101: ICMP echo reply, id 8849, seq 1, length 64
02:45:27.538269 IP 192.168.2.101 > 192.168.1.1: ICMP echo request, id 8855, seq 1, length 64
02:45:27.538297 IP 192.168.1.1 > 192.168.2.101: ICMP echo reply, id 8855, seq 1, length 64
02:45:32.528968 ARP, Request who-has 192.168.2.1 tell 192.168.2.101, length 28
02:45:32.528984 ARP, Reply 192.168.2.1 is-at 3e:9f:b5:21:3b:f6 (oui Unknown), length 28
02:45:32.555244 IP 192.168.2.101 > 192.168.2.1: ICMP echo request, id 9014, seq 1, length 64
02:45:32.555256 IP 192.168.2.1 > 192.168.2.101: ICMP echo reply, id 9014, seq 1, length 64
02:45:32.558052 IP 192.168.2.101 > 12.10.5.1: ICMP echo request, id 9017, seq 1, length 64
02:45:32.558083 IP 12.10.5.1 > 192.168.2.101: ICMP echo reply, id 9017, seq 1, length 64
02:45:32.563881 IP 192.168.2.101 > 192.168.1.1: ICMP echo request, id 9023, seq 1, length 64
02:45:32.563896 IP 192.168.1.1 > 192.168.2.101: ICMP echo reply, id 9023, seq 1, length 64
02:45:37.579841 IP 192.168.2.101 > 192.168.2.1: ICMP echo request, id 9114, seq 1, length 64
02:45:37.579854 IP 192.168.2.1 > 192.168.2.101: ICMP echo reply, id 9114, seq 1, length 64
02:45:37.581806 IP 192.168.2.101 > 12.10.5.1: ICMP echo request, id 9117, seq 1, length 64
02:45:37.581815 IP 12.10.5.1 > 192.168.2.101: ICMP echo reply, id 9117, seq 1, length 64
02:45:37.588777 IP 192.168.2.101 > 192.168.1.1: ICMP echo request, id 9123, seq 1, length 64
02:45:37.588798 IP 192.168.1.1 > 192.168.2.101: ICMP echo reply, id 9123, seq 1, length 64
02:45:42.603321 IP 192.168.2.101 > 192.168.2.1: ICMP echo request, id 9281, seq 1, length 64
02:45:42.603336 IP 192.168.2.1 > 192.168.2.101: ICMP echo reply, id 9281, seq 1, length 64
02:45:42.607202 IP 192.168.2.101 > 12.10.5.1: ICMP echo request, id 9284, seq 1, length 64
02:45:42.607230 IP 12.10.5.1 > 192.168.2.101: ICMP echo reply, id 9284, seq 1, length 64
02:45:42.614615 IP 192.168.2.101 > 192.168.1.1: ICMP echo request, id 9290, seq 1, length 64
02:45:42.614626 IP 192.168.1.1 > 192.168.2.101: ICMP echo reply, id 9290, seq 1, length 64
02:45:47.628080 IP 192.168.2.101 > 192.168.2.1: ICMP echo request, id 9394, seq 1, length 64
02:45:47.628102 IP 192.168.2.1 > 192.168.2.101: ICMP echo reply, id 9394, seq 1, length 64
02:45:47.632587 IP 192.168.2.101 > 12.10.5.1: ICMP echo request, id 9397, seq 1, length 64
02:45:47.632602 IP 12.10.5.1 > 192.168.2.101: ICMP echo reply, id 9397, seq 1, length 64
02:45:47.638258 IP 192.168.2.101 > 192.168.1.1: ICMP echo request, id 9403, seq 1, length 64
02:45:47.638268 IP 192.168.1.1 > 192.168.2.101: ICMP echo reply, id 9403, seq 1, length 64

02:45:52.640452 ARP, Request who-has 192.168.2.101 tell 192.168.2.1, length 28
02:45:52.640597 ARP, Reply 192.168.2.101 is-at 9e:6a:c1:34:f5:1d (oui Unknown), length 28
02:45:52.655067 IP 192.168.2.101 > 192.168.2.1: ICMP echo request, id 9505, seq 1, length 64
02:45:52.655081 IP 192.168.2.1 > 192.168.2.101: ICMP echo reply, id 9505, seq 1, length 64
02:45:52.658641 IP 192.168.2.101 > 12.10.5.1: ICMP echo request, id 9508, seq 1, length 64
02:45:52.658649 IP 12.10.5.1 > 192.168.2.101: ICMP echo reply, id 9508, seq 1, length 64
02:45:52.664568 IP 192.168.2.101 > 192.168.1.1: ICMP echo request, id 9514, seq 1, length 64
02:45:52.664578 IP 192.168.1.1 > 192.168.2.101: ICMP echo reply, id 9514, seq 1, length 64
02:45:57.664603 ARP, Request who-has 192.168.2.1 tell 192.168.2.101, length 28
02:45:57.664609 ARP, Reply 192.168.2.1 is-at 3e:9f:b5:21:3b:f6 (oui Unknown), length 28
02:45:57.677835 IP 192.168.2.101 > 192.168.2.1: ICMP echo request, id 9604, seq 1, length 64
02:45:57.677848 IP 192.168.2.1 > 192.168.2.101: ICMP echo reply, id 9604, seq 1, length 64
02:45:57.680891 IP 192.168.2.101 > 12.10.5.1: ICMP echo request, id 9607, seq 1, length 64
02:45:57.680904 IP 12.10.5.1 > 192.168.2.101: ICMP echo reply, id 9607, seq 1, length 64
02:45:57.686721 IP 192.168.2.101 > 192.168.1.1: ICMP echo request, id 9613, seq 1, length 64
02:45:57.686734 IP 192.168.1.1 > 192.168.2.101: ICMP echo reply, id 9613, seq 1, length 64
02:46:02.703400 IP 192.168.2.101 > 192.168.2.1: ICMP echo request, id 9772, seq 1, length 64
02:46:02.703412 IP 192.168.2.1 > 192.168.2.101: ICMP echo reply, id 9772, seq 1, length 64
02:46:02.705825 IP 192.168.2.101 > 12.10.5.1: ICMP echo request, id 9775, seq 1, length 64
02:46:02.705835 IP 12.10.5.1 > 192.168.2.101: ICMP echo reply, id 9775, seq 1, length 64
02:46:02.713093 IP 192.168.2.101 > 192.168.1.1: ICMP echo request, id 9781, seq 1, length 64
02:46:02.713105 IP 192.168.1.1 > 192.168.2.101: ICMP echo reply, id 9781, seq 1, length 64
02:46:07.727237 IP 192.168.2.101 > 192.168.2.1: ICMP echo request, id 9901, seq 1, length 64
02:46:07.727250 IP 192.168.2.1 > 192.168.2.101: ICMP echo reply, id 9901, seq 1, length 64
02:46:07.729955 IP 192.168.2.101 > 12.10.5.1: ICMP echo request, id 9904, seq 1, length 64
02:46:07.729965 IP 12.10.5.1 > 192.168.2.101: ICMP echo reply, id 9904, seq 1, length 64
02:46:07.735290 IP 192.168.2.101 > 192.168.1.1: ICMP echo request, id 9910, seq 1, length 64
02:46:07.735303 IP 192.168.1.1 > 192.168.2.101: ICMP echo reply, id 9910, seq 1, length 64
02:46:12.753918 IP 192.168.2.101 > 192.168.2.1: ICMP echo request, id 10043, seq 1, length 64
02:46:12.753933 IP 192.168.2.1 > 192.168.2.101: ICMP echo reply, id 10043, seq 1, length 64
02:46:12.757930 IP 192.168.2.101 > 12.10.5.1: ICMP echo request, id 10046, seq 1, length 64
02:46:12.757946 IP 12.10.5.1 > 192.168.2.101: ICMP echo reply, id 10046, seq 1, length 64
02:46:12.765497 IP 192.168.2.101 > 192.168.1.1: ICMP echo request, id 10052, seq 1, length 64
02:46:12.765511 IP 192.168.1.1 > 192.168.2.101: ICMP echo reply, id 10052, seq 1, length 64
02:46:17.777858 IP 192.168.2.101 > 192.168.2.1: ICMP echo request, id 10162, seq 1, length 64
02:46:17.777869 IP 192.168.2.1 > 192.168.2.101: ICMP echo reply, id 10162, seq 1, length 64
02:46:17.780469 IP 192.168.2.101 > 12.10.5.1: ICMP echo request, id 10165, seq 1, length 64
02:46:17.780477 IP 12.10.5.1 > 192.168.2.101: ICMP echo reply, id 10165, seq 1, length 64
02:46:17.786141 IP 192.168.2.101 > 192.168.1.1: ICMP echo request, id 10171, seq 1, length 64
02:46:17.786153 IP 192.168.1.1 > 192.168.2.101: ICMP echo reply, id 10171, seq 1, length 64

02:46:22.784850 ARP, Request who-has 192.168.2.1 tell 192.168.2.101, length 28
02:46:22.784858 ARP, Reply 192.168.2.1 is-at 3e:9f:b5:21:3b:f6 (oui Unknown), length 28
02:46:22.803676 IP 192.168.2.101 > 192.168.2.1: ICMP echo request, id 10273, seq 1, length 64
02:46:22.803693 IP 192.168.2.1 > 192.168.2.101: ICMP echo reply, id 10273, seq 1, length 64
02:46:22.807618 IP 192.168.2.101 > 12.10.5.1: ICMP echo request, id 10276, seq 1, length 64
02:46:22.807634 IP 12.10.5.1 > 192.168.2.101: ICMP echo reply, id 10276, seq 1, length 64
02:46:22.814820 IP 192.168.2.101 > 192.168.1.1: ICMP echo request, id 10282, seq 1, length 64
02:46:22.814846 IP 192.168.1.1 > 192.168.2.101: ICMP echo reply, id 10282, seq 1, length 64
02:46:27.831326 IP 192.168.2.101 > 192.168.2.1: ICMP echo request, id 10372, seq 1, length 64
02:46:27.831337 IP 192.168.2.1 > 192.168.2.101: ICMP echo reply, id 10372, seq 1, length 64
02:46:27.835769 IP 192.168.2.101 > 12.10.5.1: ICMP echo request, id 10375, seq 1, length 64
02:46:27.835792 IP 12.10.5.1 > 192.168.2.101: ICMP echo reply, id 10375, seq 1, length 64
02:46:27.842922 IP 192.168.2.101 > 192.168.1.1: ICMP echo request, id 10381, seq 1, length 64
02:46:27.842935 IP 192.168.1.1 > 192.168.2.101: ICMP echo reply, id 10381, seq 1, length 64
02:46:32.833590 ARP, Request who-has 192.168.2.101 tell 192.168.2.1, length 28
02:46:32.833734 ARP, Reply 192.168.2.101 is-at 9e:6a:c1:34:f5:1d (oui Unknown), length 28
02:46:32.862144 IP 192.168.2.101 > 192.168.2.1: ICMP echo request, id 10479, seq 1, length 64
02:46:32.862156 IP 192.168.2.1 > 192.168.2.101: ICMP echo reply, id 10479, seq 1, length 64
02:46:32.865324 IP 192.168.2.101 > 12.10.5.1: ICMP echo request, id 10482, seq 1, length 64
02:46:32.865352 IP 12.10.5.1 > 192.168.2.101: ICMP echo reply, id 10482, seq 1, length 64
02:46:32.870915 IP 192.168.2.101 > 192.168.1.1: ICMP echo request, id 10488, seq 1, length 64
02:46:32.870927 IP 192.168.1.1 > 192.168.2.101: ICMP echo reply, id 10488, seq 1, length 64
02:46:37.887637 IP 192.168.2.101 > 192.168.2.1: ICMP echo request, id 10578, seq 1, length 64
02:46:37.887651 IP 192.168.2.1 > 192.168.2.101: ICMP echo reply, id 10578, seq 1, length 64
02:46:37.891176 IP 192.168.2.101 > 12.10.5.1: ICMP echo request, id 10581, seq 1, length 64
02:46:37.891191 IP 12.10.5.1 > 192.168.2.101: ICMP echo reply, id 10581, seq 1, length 64
02:46:37.898203 IP 192.168.2.101 > 192.168.1.1: ICMP echo request, id 10588, seq 1, length 64
02:46:37.898218 IP 192.168.1.1 > 192.168.2.101: ICMP echo reply, id 10588, seq 1, length 64
02:46:42.915087 IP 192.168.2.101 > 192.168.2.1: ICMP echo request, id 10681, seq 1, length 64
02:46:42.915097 IP 192.168.2.1 > 192.168.2.101: ICMP echo reply, id 10681, seq 1, length 64
02:46:42.917759 IP 192.168.2.101 > 12.10.5.1: ICMP echo request, id 10684, seq 1, length 64
02:46:42.917773 IP 12.10.5.1 > 192.168.2.101: ICMP echo reply, id 10684, seq 1, length 64
02:46:42.923444 IP 192.168.2.101 > 192.168.1.1: ICMP echo request, id 10690, seq 1, length 64
02:46:42.923453 IP 192.168.1.1 > 192.168.2.101: ICMP echo reply, id 10690, seq 1, length 64
02:46:47.920947 ARP, Request who-has 192.168.2.1 tell 192.168.2.101, length 28
02:46:47.920959 ARP, Reply 192.168.2.1 is-at 3e:9f:b5:21:3b:f6 (oui Unknown), length 28
02:46:47.939819 IP 192.168.2.101 > 192.168.2.1: ICMP echo request, id 10780, seq 1, length 64
02:46:47.939829 IP 192.168.2.1 > 192.168.2.101: ICMP echo reply, id 10780, seq 1, length 64
02:46:47.942354 IP 192.168.2.101 > 12.10.5.1: ICMP echo request, id 10783, seq 1, length 64
02:46:47.942362 IP 12.10.5.1 > 192.168.2.101: ICMP echo reply, id 10783, seq 1, length 64
02:46:47.947490 IP 192.168.2.101 > 192.168.1.1: ICMP echo request, id 10789, seq 1, length 64
02:46:47.947499 IP 192.168.1.1 > 192.168.2.101: ICMP echo reply, id 10789, seq 1, length 64

02:46:52.964663 IP 192.168.2.101 > 192.168.2.1: ICMP echo request, id 10951, seq 1, length 64
02:46:52.964676 IP 192.168.2.1 > 192.168.2.101: ICMP echo reply, id 10951, seq 1, length 64
02:46:52.967557 IP 192.168.2.101 > 12.10.5.1: ICMP echo request, id 10954, seq 1, length 64
02:46:52.967567 IP 12.10.5.1 > 192.168.2.101: ICMP echo reply, id 10954, seq 1, length 64
02:46:52.973014 IP 192.168.2.101 > 192.168.1.1: ICMP echo request, id 10960, seq 1, length 64
02:46:52.973024 IP 192.168.1.1 > 192.168.2.101: ICMP echo reply, id 10960, seq 1, length 64
02:46:57.988202 IP 192.168.2.101 > 192.168.2.1: ICMP echo request, id 11050, seq 1, length 64
02:46:57.988215 IP 192.168.2.1 > 192.168.2.101: ICMP echo reply, id 11050, seq 1, length 64
02:46:57.990808 IP 192.168.2.101 > 12.10.5.1: ICMP echo request, id 11053, seq 1, length 64
02:46:57.990817 IP 12.10.5.1 > 192.168.2.101: ICMP echo reply, id 11053, seq 1, length 64
02:46:57.995773 IP 192.168.2.101 > 192.168.1.1: ICMP echo request, id 11059, seq 1, length 64
02:46:57.995785 IP 192.168.1.1 > 192.168.2.101: ICMP echo reply, id 11059, seq 1, length 64
02:47:02.219110 IP 192.168.2.3 > 12.10.5.2: ICMP echo request, id 11209, seq 1, length 64
02:47:02.992251 ARP, Request who-has 192.168.2.101 tell 192.168.2.1, length 28
02:47:02.992379 ARP, Reply 192.168.2.101 is-at 9e:6a:c1:34:f5:1d (oui Unknown), length 28
02:47:03.010450 IP 192.168.2.101 > 192.168.2.1: ICMP echo request, id 11212, seq 1, length 64
02:47:03.010461 IP 192.168.2.1 > 192.168.2.101: ICMP echo reply, id 11212, seq 1, length 64
02:47:03.012955 IP 192.168.2.101 > 12.10.5.1: ICMP echo request, id 11215, seq 1, length 64
02:47:03.012963 IP 12.10.5.1 > 192.168.2.101: ICMP echo reply, id 11215, seq 1, length 64
02:47:03.017789 IP 192.168.2.101 > 192.168.1.1: ICMP echo request, id 11221, seq 1, length 64
02:47:03.017801 IP 192.168.1.1 > 192.168.2.101: ICMP echo reply, id 11221, seq 1, length 64
02:47:07.233574 ARP, Request who-has 192.168.2.1 tell 192.168.2.3, length 28
02:47:07.233609 ARP, Reply 192.168.2.1 is-at 3e:9f:b5:21:3b:f6 (oui Unknown), length 28
02:47:08.034627 IP 192.168.2.101 > 192.168.2.1: ICMP echo request, id 11312, seq 1, length 64
02:47:08.034639 IP 192.168.2.1 > 192.168.2.101: ICMP echo reply, id 11312, seq 1, length 64
02:47:08.037345 IP 192.168.2.101 > 12.10.5.1: ICMP echo request, id 11315, seq 1, length 64
02:47:08.037354 IP 12.10.5.1 > 192.168.2.101: ICMP echo reply, id 11315, seq 1, length 64
02:47:08.043807 IP 192.168.2.101 > 192.168.1.1: ICMP echo request, id 11321, seq 1, length 64
02:47:08.043819 IP 192.168.1.1 > 192.168.2.101: ICMP echo reply, id 11321, seq 1, length 64
02:47:08.055936 ARP, Request who-has 192.168.2.3 tell 192.168.2.101, length 28
02:47:12.221190 IP 192.168.2.3 > 12.10.5.3: ICMP echo request, id 11414, seq 1, length 64
02:47:13.040372 ARP, Request who-has 192.168.2.1 tell 192.168.2.101, length 28
02:47:13.040381 ARP, Reply 192.168.2.1 is-at 3e:9f:b5:21:3b:f6 (oui Unknown), length 28
02:47:13.063346 IP 192.168.2.101 > 192.168.2.1: ICMP echo request, id 11417, seq 1, length 64
02:47:13.063357 IP 192.168.2.1 > 192.168.2.101: ICMP echo reply, id 11417, seq 1, length 64
02:47:13.066139 IP 192.168.2.101 > 12.10.5.1: ICMP echo request, id 11420, seq 1, length 64
02:47:13.066148 IP 12.10.5.1 > 192.168.2.101: ICMP echo reply, id 11420, seq 1, length 64
02:47:13.071611 IP 192.168.2.101 > 192.168.1.1: ICMP echo request, id 11426, seq 1, length 64
02:47:13.071621 IP 192.168.1.1 > 192.168.2.101: ICMP echo reply, id 11426, seq 1, length 64
02:47:18.092757 IP 192.168.2.101 > 192.168.2.1: ICMP echo request, id 11520, seq 1, length 64
02:47:18.092769 IP 192.168.2.1 > 192.168.2.101: ICMP echo reply, id 11520, seq 1, length 64
02:47:18.095179 IP 192.168.2.101 > 12.10.5.1: ICMP echo request, id 11523, seq 1, length 64
02:47:18.095188 IP 12.10.5.1 > 192.168.2.101: ICMP echo reply, id 11523, seq 1, length 64
02:47:18.100926 IP 192.168.2.101 > 192.168.1.1: ICMP echo request, id 11529, seq 1, length 64
02:47:18.100937 IP 192.168.1.1 > 192.168.2.101: ICMP echo reply, id 11529, seq 1, length 64

02:47:19.564954 IP 192.168.2.103.53302 > 192.168.2.4.33434: UDP, length 32
02:47:19.578687 IP 192.168.2.103.46321 > 192.168.2.2.33434: UDP, length 32
02:47:22.223116 IP 192.168.2.3 > 12.10.5.4: ICMP echo request, id 11641, seq 1, length 64
02:47:23.120165 IP 192.168.2.101 > 192.168.2.1: ICMP echo request, id 11644, seq 1, length 64
02:47:23.120178 IP 192.168.2.1 > 192.168.2.101: ICMP echo reply, id 11644, seq 1, length 64
02:47:23.123639 IP 192.168.2.101 > 12.10.5.1: ICMP echo request, id 11647, seq 1, length 64
02:47:23.123648 IP 12.10.5.1 > 192.168.2.101: ICMP echo reply, id 11647, seq 1, length 64
02:47:23.129813 IP 192.168.2.101 > 192.168.1.1: ICMP echo request, id 11653, seq 1, length 64
02:47:23.129825 IP 192.168.1.1 > 192.168.2.101: ICMP echo reply, id 11653, seq 1, length 64
02:47:24.589320 IP 192.168.2.103.49508 > 12.10.5.1.33434: UDP, length 32
02:47:24.589335 IP 12.10.5.1 > 192.168.2.103: ICMP 12.10.5.1 udp port 33434 unreachable, length 68
02:47:24.590227 IP 192.168.2.103.58018 > 12.10.5.1.33435: UDP, length 32
02:47:24.590234 IP 12.10.5.1 > 192.168.2.103: ICMP 12.10.5.1 udp port 33435 unreachable, length 68
02:47:24.591099 IP 192.168.2.103.52779 > 12.10.5.1.33436: UDP, length 32
02:47:24.591132 IP 12.10.5.1 > 192.168.2.103: ICMP 12.10.5.1 udp port 33436 unreachable, length 68
02:47:24.592041 IP 192.168.2.103.52930 > 12.10.5.1.33437: UDP, length 32
02:47:24.592048 IP 12.10.5.1 > 192.168.2.103: ICMP 12.10.5.1 udp port 33437 unreachable, length 68
02:47:24.594811 IP 192.168.2.103.60140 > 12.10.5.1.33449: UDP, length 32
02:47:24.594819 IP 12.10.5.1 > 192.168.2.103: ICMP 12.10.5.1 udp port 33449 unreachable, length 68
02:47:24.595392 IP 192.168.2.103.60977 > 12.10.5.1.33438: UDP, length 32
02:47:24.595399 IP 12.10.5.1 > 192.168.2.103: ICMP 12.10.5.1 udp port 33438 unreachable, length 68
02:47:24.595436 IP 192.168.2.103.54381 > 12.10.5.1.33441: UDP, length 32
02:47:24.595451 IP 192.168.2.103.36556 > 12.10.5.1.33442: UDP, length 32
02:47:24.596439 IP 192.168.2.103.45376 > 12.10.5.1.33445: UDP, length 32
02:47:24.596455 IP 192.168.2.103.51751 > 12.10.5.1.33439: UDP, length 32
02:47:24.596465 IP 192.168.2.103.56959 > 12.10.5.1.33443: UDP, length 32
02:47:24.596474 IP 192.168.2.103.40750 > 12.10.5.1.33448: UDP, length 32
02:47:24.596482 IP 192.168.2.103.53138 > 12.10.5.1.33447: UDP, length 32
02:47:24.596490 IP 192.168.2.103.35859 > 12.10.5.1.33440: UDP, length 32
02:47:24.596498 IP 192.168.2.103.52817 > 12.10.5.1.33444: UDP, length 32
02:47:24.596505 IP 192.168.2.103.46758 > 12.10.5.1.33446: UDP, length 32
02:47:24.601629 ARP, Request who-has 192.168.2.3 tell 192.168.2.103, length 28
02:47:28.149073 IP 192.168.2.101 > 192.168.2.1: ICMP echo request, id 11748, seq 1, length 64
02:47:28.149085 IP 192.168.2.1 > 192.168.2.101: ICMP echo reply, id 11748, seq 1, length 64
02:47:28.152629 IP 192.168.2.101 > 12.10.5.1: ICMP echo request, id 11751, seq 1, length 64
02:47:28.152639 IP 12.10.5.1 > 192.168.2.101: ICMP echo reply, id 11751, seq 1, length 64
02:47:28.158451 IP 192.168.2.101 > 192.168.1.1: ICMP echo request, id 11757, seq 1, length 64
02:47:28.158460 IP 192.168.1.1 > 192.168.2.101: ICMP echo reply, id 11757, seq 1, length 64
02:47:29.600922 ARP, Request who-has 192.168.2.1 tell 192.168.2.103, length 28
02:47:29.600931 ARP, Reply 192.168.2.1 is-at 3e:9f:b5:21:3b:f6 (oui Unknown), length 28
02:47:32.225938 IP 192.168.2.3 > 192.168.1.3: ICMP echo request, id 11864, seq 1, length 64
02:47:33.152817 ARP, Request who-has 192.168.2.101 tell 192.168.2.1, length 28
02:47:33.152973 ARP, Reply 192.168.2.101 is-at 9e:6a:c1:34:f5:1d (oui Unknown), length 28
02:47:33.177450 IP 192.168.2.101 > 192.168.2.1: ICMP echo request, id 11867, seq 1, length 64
02:47:33.177461 IP 192.168.2.1 > 192.168.2.101: ICMP echo reply, id 11867, seq 1, length 64
02:47:33.180189 IP 192.168.2.101 > 12.10.5.1: ICMP echo request, id 11870, seq 1, length 64
02:47:33.180214 IP 12.10.5.1 > 192.168.2.101: ICMP echo reply, id 11870, seq 1, length 64
02:47:33.186627 IP 192.168.2.101 > 192.168.1.1: ICMP echo request, id 11876, seq 1, length 64
02:47:33.186641 IP 192.168.1.1 > 192.168.2.101: ICMP echo reply, id 11876, seq 1, length 64
02:47:38.192400 ARP, Request who-has 192.168.2.1 tell 192.168.2.101, length 28
02:47:38.192408 ARP, Reply 192.168.2.1 is-at 3e:9f:b5:21:3b:f6 (oui Unknown), length 28
02:47:38.203618 IP 192.168.2.101 > 192.168.2.1: ICMP echo request, id 12030, seq 1, length 64
02:47:38.203631 IP 192.168.2.1 > 192.168.2.101: ICMP echo reply, id 12030, seq 1, length 64
02:47:38.206893 IP 192.168.2.101 > 12.10.5.1: ICMP echo request, id 12033, seq 1, length 64
02:47:38.206903 IP 12.10.5.1 > 192.168.2.101: ICMP echo reply, id 12033, seq 1, length 64
02:47:38.212832 IP 192.168.2.101 > 192.168.1.1: ICMP echo request, id 12039, seq 1, length 64
02:47:38.212844 IP 192.168.1.1 > 192.168.2.101: ICMP echo reply, id 12039, seq 1, length 64
02:47:42.227683 IP 192.168.2.3 > 192.168.1.2: ICMP echo request, id 12132, seq 1, length 64
02:47:43.233775 IP 192.168.2.101 > 192.168.2.1: ICMP echo request, id 12135, seq 1, length 64
02:47:43.233800 IP 192.168.2.1 > 192.168.2.101: ICMP echo reply, id 12135, seq 1, length 64
02:47:43.237240 IP 192.168.2.101 > 12.10.5.1: ICMP echo request, id 12138, seq 1, length 64
02:47:43.237251 IP 12.10.5.1 > 192.168.2.101: ICMP echo reply, id 12138, seq 1, length 64
02:47:43.243633 IP 192.168.2.101 > 192.168.1.1: ICMP echo request, id 12144, seq 1, length 64
02:47:43.243642 IP 192.168.1.1 > 192.168.2.101: ICMP echo reply, id 12144, seq 1, length 64
02:47:47.233621 ARP, Request who-has 192.168.2.1 tell 192.168.2.3, length 28
02:47:47.233630 ARP, Reply 192.168.2.1 is-at 3e:9f:b5:21:3b:f6 (oui Unknown), length 28

02:47:52.230824 IP 192.168.2.3 > 192.168.1.4: ICMP echo request, id 12408, seq 1, length 64
02:47:53.294978 IP 192.168.2.101 > 192.168.2.1: ICMP echo request, id 12411, seq 1, length 64
02:47:53.295021 IP 192.168.2.1 > 192.168.2.101: ICMP echo reply, id 12411, seq 1, length 64
02:47:53.298337 IP 192.168.2.101 > 12.10.5.1: ICMP echo request, id 12414, seq 1, length 64
02:47:53.298350 IP 12.10.5.1 > 192.168.2.101: ICMP echo reply, id 12414, seq 1, length 64
02:47:53.305271 IP 192.168.2.101 > 192.168.1.1: ICMP echo request, id 12420, seq 1, length 64
02:47:53.305282 IP 192.168.1.1 > 192.168.2.101: ICMP echo reply, id 12420, seq 1, length 64
02:47:58.327147 IP 192.168.2.101 > 192.168.2.1: ICMP echo request, id 12513, seq 1, length 64
02:47:58.327180 IP 192.168.2.1 > 192.168.2.101: ICMP echo reply, id 12513, seq 1, length 64
02:47:58.329701 IP 192.168.2.101 > 12.10.5.1: ICMP echo request, id 12516, seq 1, length 64
02:47:58.329709 IP 12.10.5.1 > 192.168.2.101: ICMP echo reply, id 12516, seq 1, length 64
02:47:58.334487 IP 192.168.2.101 > 192.168.1.1: ICMP echo request, id 12522, seq 1, length 64
02:47:58.334498 IP 192.168.1.1 > 192.168.2.101: ICMP echo reply, id 12522, seq 1, length 64
02:48:02.233383 ARP, Request who-has 192.168.2.4 tell 192.168.2.3, length 28
02:48:02.238796 ARP, Request who-has 192.168.2.2 tell 192.168.2.3, length 28
02:48:02.242993 IP 192.168.2.4 > 12.10.5.2: ICMP echo request, id 12618, seq 1, length 64
02:48:03.328830 ARP, Request who-has 192.168.2.101 tell 192.168.2.1, length 28
02:48:03.328974 ARP, Request who-has 192.168.2.1 tell 192.168.2.101, length 28
02:48:03.328995 ARP, Reply 192.168.2.1 is-at 3e:9f:b5:21:3b:f6 (oui Unknown), length 28
02:48:03.329041 ARP, Reply 192.168.2.101 is-at 9e:6a:c1:34:f5:1d (oui Unknown), length 28
02:48:03.352065 IP 192.168.2.101 > 192.168.2.1: ICMP echo request, id 12621, seq 1, length 64
02:48:03.352078 IP 192.168.2.1 > 192.168.2.101: ICMP echo reply, id 12621, seq 1, length 64
02:48:03.355344 IP 192.168.2.101 > 12.10.5.1: ICMP echo request, id 12624, seq 1, length 64
02:48:03.355393 IP 12.10.5.1 > 192.168.2.101: ICMP echo reply, id 12624, seq 1, length 64
02:48:03.362485 IP 192.168.2.101 > 192.168.1.1: ICMP echo request, id 12630, seq 1, length 64
02:48:03.362498 IP 192.168.1.1 > 192.168.2.101: ICMP echo reply, id 12630, seq 1, length 64
02:48:07.249740 ARP, Request who-has 192.168.2.1 tell 192.168.2.4, length 28
02:48:07.249750 ARP, Reply 192.168.2.1 is-at 3e:9f:b5:21:3b:f6 (oui Unknown), length 28
02:48:08.386706 IP 192.168.2.101 > 192.168.2.1: ICMP echo request, id 12723, seq 1, length 64
02:48:08.386720 IP 192.168.2.1 > 192.168.2.101: ICMP echo reply, id 12723, seq 1, length 64
02:48:08.389803 IP 192.168.2.101 > 12.10.5.1: ICMP echo request, id 12726, seq 1, length 64
02:48:08.389814 IP 12.10.5.1 > 192.168.2.101: ICMP echo reply, id 12726, seq 1, length 64
02:48:08.395301 IP 192.168.2.101 > 192.168.1.1: ICMP echo request, id 12732, seq 1, length 64
02:48:08.395312 IP 192.168.1.1 > 192.168.2.101: ICMP echo reply, id 12732, seq 1, length 64
02:48:12.245484 IP 192.168.2.4 > 12.10.5.3: ICMP echo request, id 12825, seq 1, length 64
02:48:13.416743 IP 192.168.2.101 > 192.168.2.1: ICMP echo request, id 12828, seq 1, length 64
02:48:13.416755 IP 192.168.2.1 > 192.168.2.101: ICMP echo reply, id 12828, seq 1, length 64
02:48:13.421122 IP 192.168.2.101 > 12.10.5.1: ICMP echo request, id 12831, seq 1, length 64
02:48:13.421150 IP 12.10.5.1 > 192.168.2.101: ICMP echo reply, id 12831, seq 1, length 64
02:48:13.428692 IP 192.168.2.101 > 192.168.1.1: ICMP echo request, id 12837, seq 1, length 64
02:48:13.428708 IP 192.168.1.1 > 192.168.2.101: ICMP echo reply, id 12837, seq 1, length 64

02:48:22.248174 IP 192.168.2.4 > 12.10.5.4: ICMP echo request, id 13102, seq 1, length 64
02:48:23.479934 IP 192.168.2.101 > 192.168.2.1: ICMP echo request, id 13105, seq 1, length 64
02:48:23.479945 IP 192.168.2.1 > 192.168.2.101: ICMP echo reply, id 13105, seq 1, length 64
02:48:23.483468 IP 192.168.2.101 > 12.10.5.1: ICMP echo request, id 13108, seq 1, length 64
02:48:23.483483 IP 12.10.5.1 > 192.168.2.101: ICMP echo reply, id 13108, seq 1, length 64
02:48:23.491138 IP 192.168.2.101 > 192.168.1.1: ICMP echo request, id 13114, seq 1, length 64
02:48:23.491154 IP 192.168.1.1 > 192.168.2.101: ICMP echo reply, id 13114, seq 1, length 64
02:48:28.480938 ARP, Request who-has 192.168.2.1 tell 192.168.2.101, length 28
02:48:28.480948 ARP, Reply 192.168.2.1 is-at 3e:9f:b5:21:3b:f6 (oui Unknown), length 28
02:48:28.513519 IP 192.168.2.101 > 192.168.2.1: ICMP echo request, id 13217, seq 1, length 64
02:48:28.513531 IP 192.168.2.1 > 192.168.2.101: ICMP echo reply, id 13217, seq 1, length 64
02:48:28.516027 IP 192.168.2.101 > 12.10.5.1: ICMP echo request, id 13220, seq 1, length 64
02:48:28.516036 IP 12.10.5.1 > 192.168.2.101: ICMP echo reply, id 13220, seq 1, length 64
02:48:28.521344 IP 192.168.2.101 > 192.168.1.1: ICMP echo request, id 13226, seq 1, length 64
02:48:28.521354 IP 192.168.1.1 > 192.168.2.101: ICMP echo reply, id 13226, seq 1, length 64
02:48:32.252333 IP 192.168.2.4 > 192.168.1.3: ICMP echo request, id 13369, seq 1, length 64
02:48:33.521240 ARP, Request who-has 192.168.2.101 tell 192.168.2.1, length 28
02:48:33.521403 ARP, Reply 192.168.2.101 is-at 9e:6a:c1:34:f5:1d (oui Unknown), length 28
02:48:33.539740 IP 192.168.2.101 > 192.168.2.1: ICMP echo request, id 13372, seq 1, length 64
02:48:33.539752 IP 192.168.2.1 > 192.168.2.101: ICMP echo reply, id 13372, seq 1, length 64
02:48:33.542771 IP 192.168.2.101 > 12.10.5.1: ICMP echo request, id 13375, seq 1, length 64
02:48:33.542783 IP 12.10.5.1 > 192.168.2.101: ICMP echo reply, id 13375, seq 1, length 64
02:48:33.548802 IP 192.168.2.101 > 192.168.1.1: ICMP echo request, id 13381, seq 1, length 64
02:48:33.548814 IP 192.168.1.1 > 192.168.2.101: ICMP echo reply, id 13381, seq 1, length 64
02:48:38.563494 IP 192.168.2.101 > 192.168.2.1: ICMP echo request, id 13474, seq 1, length 64
02:48:38.563516 IP 192.168.2.1 > 192.168.2.101: ICMP echo reply, id 13474, seq 1, length 64
02:48:38.565736 IP 192.168.2.101 > 12.10.5.1: ICMP echo request, id 13477, seq 1, length 64
02:48:38.565743 IP 12.10.5.1 > 192.168.2.101: ICMP echo reply, id 13477, seq 1, length 64
02:48:38.570708 IP 192.168.2.101 > 192.168.1.1: ICMP echo request, id 13483, seq 1, length 64
02:48:38.570717 IP 192.168.1.1 > 192.168.2.101: ICMP echo reply, id 13483, seq 1, length 64
02:48:42.256250 IP 192.168.2.4 > 192.168.1.2: ICMP echo request, id 13585, seq 1, length 64
02:48:43.588156 IP 192.168.2.101 > 192.168.2.1: ICMP echo request, id 13588, seq 1, length 64
02:48:43.588170 IP 192.168.2.1 > 192.168.2.101: ICMP echo reply, id 13588, seq 1, length 64
02:48:43.590863 IP 192.168.2.101 > 12.10.5.1: ICMP echo request, id 13591, seq 1, length 64
02:48:43.590872 IP 12.10.5.1 > 192.168.2.101: ICMP echo reply, id 13591, seq 1, length 64
02:48:43.596640 IP 192.168.2.101 > 192.168.1.1: ICMP echo request, id 13597, seq 1, length 64
02:48:43.596650 IP 192.168.1.1 > 192.168.2.101: ICMP echo reply, id 13597, seq 1, length 64
02:48:48.612690 IP 192.168.2.101 > 192.168.2.1: ICMP echo request, id 13696, seq 1, length 64
02:48:48.612703 IP 192.168.2.1 > 192.168.2.101: ICMP echo reply, id 13696, seq 1, length 64
02:48:48.615835 IP 192.168.2.101 > 12.10.5.1: ICMP echo request, id 13699, seq 1, length 64
02:48:48.615844 IP 12.10.5.1 > 192.168.2.101: ICMP echo reply, id 13699, seq 1, length 64
02:48:48.621515 IP 192.168.2.101 > 192.168.1.1: ICMP echo request, id 13705, seq 1, length 64
02:48:48.621525 IP 192.168.1.1 > 192.168.2.101: ICMP echo reply, id 13705, seq 1, length 64

02:48:52.260064 IP 192.168.2.4 > 192.168.1.4: ICMP echo request, id 13807, seq 1, length 64
02:48:53.617162 ARP, Request who-has 192.168.2.1 tell 192.168.2.101, length 28
02:48:53.617171 ARP, Reply 192.168.2.1 is-at 3e:9f:b5:21:3b:f6 (oui Unknown), length 28
02:48:53.639909 IP 192.168.2.101 > 192.168.2.1: ICMP echo request, id 13810, seq 1, length 64
02:48:53.639924 IP 192.168.2.1 > 192.168.2.101: ICMP echo reply, id 13810, seq 1, length 64
02:48:53.643167 IP 192.168.2.101 > 12.10.5.1: ICMP echo request, id 13813, seq 1, length 64
02:48:53.643176 IP 12.10.5.1 > 192.168.2.101: ICMP echo reply, id 13813, seq 1, length 64
02:48:53.650090 IP 192.168.2.101 > 192.168.1.1: ICMP echo request, id 13819, seq 1, length 64
02:48:53.650100 IP 192.168.1.1 > 192.168.2.101: ICMP echo reply, id 13819, seq 1, length 64
02:48:57.264714 ARP, Request who-has 192.168.2.1 tell 192.168.2.4, length 28
02:48:57.264725 ARP, Reply 192.168.2.1 is-at 3e:9f:b5:21:3b:f6 (oui Unknown), length 28
02:48:58.667458 IP 192.168.2.101 > 192.168.2.1: ICMP echo request, id 13912, seq 1, length 64
02:48:58.667469 IP 192.168.2.1 > 192.168.2.101: ICMP echo reply, id 13912, seq 1, length 64
02:48:58.669649 IP 192.168.2.101 > 12.10.5.1: ICMP echo request, id 13915, seq 1, length 64
02:48:58.669658 IP 12.10.5.1 > 192.168.2.101: ICMP echo reply, id 13915, seq 1, length 64
02:48:58.676170 IP 192.168.2.101 > 192.168.1.1: ICMP echo request, id 13921, seq 1, length 64
02:48:58.676182 IP 192.168.1.1 > 192.168.2.101: ICMP echo reply, id 13921, seq 1, length 64
02:49:02.266387 ARP, Request who-has 192.168.2.2 tell 192.168.2.4, length 28
02:49:02.269755 IP 192.168.2.2 > 12.10.5.2: ICMP echo request, id 14017, seq 1, length 64
02:49:03.680328 ARP, Request who-has 192.168.2.101 tell 192.168.2.1, length 28
02:49:03.680496 ARP, Reply 192.168.2.101 is-at 9e:6a:c1:34:f5:1d (oui Unknown), length 28
02:49:03.690996 IP 192.168.2.101 > 192.168.2.1: ICMP echo request, id 14020, seq 1, length 64
02:49:03.691007 IP 192.168.2.1 > 192.168.2.101: ICMP echo reply, id 14020, seq 1, length 64
02:49:03.693696 IP 192.168.2.101 > 12.10.5.1: ICMP echo request, id 14023, seq 1, length 64
02:49:03.693708 IP 12.10.5.1 > 192.168.2.101: ICMP echo reply, id 14023, seq 1, length 64
02:49:03.701088 IP 192.168.2.101 > 192.168.1.1: ICMP echo request, id 14029, seq 1, length 64
02:49:03.701098 IP 192.168.1.1 > 192.168.2.101: ICMP echo reply, id 14029, seq 1, length 64
02:49:07.281731 ARP, Request who-has 192.168.2.1 tell 192.168.2.2, length 28
02:49:07.281741 ARP, Reply 192.168.2.1 is-at 3e:9f:b5:21:3b:f6 (oui Unknown), length 28
02:49:08.720630 IP 192.168.2.101 > 192.168.2.1: ICMP echo request, id 14182, seq 1, length 64
02:49:08.720645 IP 192.168.2.1 > 192.168.2.101: ICMP echo reply, id 14182, seq 1, length 64
02:49:08.723951 IP 192.168.2.101 > 12.10.5.1: ICMP echo request, id 14185, seq 1, length 64
02:49:08.723984 IP 12.10.5.1 > 192.168.2.101: ICMP echo reply, id 14185, seq 1, length 64
02:49:08.730490 IP 192.168.2.101 > 192.168.1.1: ICMP echo request, id 14191, seq 1, length 64
02:49:08.730502 IP 192.168.1.1 > 192.168.2.101: ICMP echo reply, id 14191, seq 1, length 64
02:49:12.272962 IP 192.168.2.2 > 12.10.5.3: ICMP echo request, id 14284, seq 1, length 64
02:49:13.750581 IP 192.168.2.101 > 192.168.2.1: ICMP echo request, id 14287, seq 1, length 64
02:49:13.750596 IP 192.168.2.1 > 192.168.2.101: ICMP echo reply, id 14287, seq 1, length 64
02:49:13.753955 IP 192.168.2.101 > 12.10.5.1: ICMP echo request, id 14290, seq 1, length 64
02:49:13.753966 IP 12.10.5.1 > 192.168.2.101: ICMP echo reply, id 14290, seq 1, length 64
02:49:13.760857 IP 192.168.2.101 > 192.168.1.1: ICMP echo request, id 14296, seq 1, length 64
02:49:13.760871 IP 192.168.1.1 > 192.168.2.101: ICMP echo reply, id 14296, seq 1, length 64
02:49:18.752806 ARP, Request who-has 192.168.2.1 tell 192.168.2.101, length 28
02:49:18.752819 ARP, Reply 192.168.2.1 is-at 3e:9f:b5:21:3b:f6 (oui Unknown), length 28
02:49:18.779156 IP 192.168.2.101 > 192.168.2.1: ICMP echo request, id 14450, seq 1, length 64
02:49:18.779167 IP 192.168.2.1 > 192.168.2.101: ICMP echo reply, id 14450, seq 1, length 64
02:49:18.781691 IP 192.168.2.101 > 12.10.5.1: ICMP echo request, id 14453, seq 1, length 64
02:49:18.781699 IP 12.10.5.1 > 192.168.2.101: ICMP echo reply, id 14453, seq 1, length 64
02:49:18.786975 IP 192.168.2.101 > 192.168.1.1: ICMP echo request, id 14459, seq 1, length 64
02:49:18.786987 IP 192.168.1.1 > 192.168.2.101: ICMP echo reply, id 14459, seq 1, length 64

02:49:22.276281 IP 192.168.2.2 > 12.10.5.4: ICMP echo request, id 14561, seq 1, length 64
02:49:23.803781 IP 192.168.2.101 > 192.168.2.1: ICMP echo request, id 14564, seq 1, length 64
02:49:23.803794 IP 192.168.2.1 > 192.168.2.101: ICMP echo reply, id 14564, seq 1, length 64
02:49:23.806632 IP 192.168.2.101 > 12.10.5.1: ICMP echo request, id 14567, seq 1, length 64
02:49:23.806642 IP 12.10.5.1 > 192.168.2.101: ICMP echo reply, id 14567, seq 1, length 64
02:49:23.813147 IP 192.168.2.101 > 192.168.1.1: ICMP echo request, id 14573, seq 1, length 64
02:49:23.813172 IP 192.168.1.1 > 192.168.2.101: ICMP echo reply, id 14573, seq 1, length 64
02:49:28.837511 IP 192.168.2.101 > 192.168.2.1: ICMP echo request, id 14666, seq 1, length 64
02:49:28.837545 IP 192.168.2.1 > 192.168.2.101: ICMP echo reply, id 14666, seq 1, length 64
02:49:28.841220 IP 192.168.2.101 > 12.10.5.1: ICMP echo request, id 14669, seq 1, length 64
02:49:28.841231 IP 12.10.5.1 > 192.168.2.101: ICMP echo reply, id 14669, seq 1, length 64
02:49:28.847801 IP 192.168.2.101 > 192.168.1.1: ICMP echo request, id 14675, seq 1, length 64
02:49:28.847828 IP 192.168.1.1 > 192.168.2.101: ICMP echo reply, id 14675, seq 1, length 64
02:49:32.280145 IP 192.168.2.2 > 192.168.1.3: ICMP echo request, id 14768, seq 1, length 64
02:49:33.840459 ARP, Request who-has 192.168.2.101 tell 192.168.2.1, length 28
02:49:33.840677 ARP, Reply 192.168.2.101 is-at 9e:6a:c1:34:f5:1d (oui Unknown), length 28
02:49:33.867069 IP 192.168.2.101 > 192.168.2.1: ICMP echo request, id 14771, seq 1, length 64
02:49:33.867080 IP 192.168.2.1 > 192.168.2.101: ICMP echo reply, id 14771, seq 1, length 64
02:49:33.870026 IP 192.168.2.101 > 12.10.5.1: ICMP echo request, id 14774, seq 1, length 64
02:49:33.870039 IP 12.10.5.1 > 192.168.2.101: ICMP echo reply, id 14774, seq 1, length 64
02:49:33.876130 IP 192.168.2.101 > 192.168.1.1: ICMP echo request, id 14780, seq 1, length 64
02:49:33.876141 IP 192.168.1.1 > 192.168.2.101: ICMP echo reply, id 14780, seq 1, length 64
02:49:38.895892 IP 192.168.2.101 > 192.168.2.1: ICMP echo request, id 14873, seq 1, length 64
02:49:38.895903 IP 192.168.2.1 > 192.168.2.101: ICMP echo reply, id 14873, seq 1, length 64
02:49:38.899439 IP 192.168.2.101 > 12.10.5.1: ICMP echo request, id 14876, seq 1, length 64
02:49:38.899451 IP 12.10.5.1 > 192.168.2.101: ICMP echo reply, id 14876, seq 1, length 64
02:49:38.904996 IP 192.168.2.101 > 192.168.1.1: ICMP echo request, id 14882, seq 1, length 64
02:49:38.905005 IP 192.168.1.1 > 192.168.2.101: ICMP echo reply, id 14882, seq 1, length 64
02:49:42.283279 IP 192.168.2.2 > 192.168.1.2: ICMP echo request, id 14975, seq 1, length 64
02:49:43.905357 ARP, Request who-has 192.168.2.1 tell 192.168.2.101, length 28
02:49:43.905365 ARP, Reply 192.168.2.1 is-at 3e:9f:b5:21:3b:f6 (oui Unknown), length 28
02:49:43.924323 IP 192.168.2.101 > 192.168.2.1: ICMP echo request, id 14978, seq 1, length 64
02:49:43.924334 IP 192.168.2.1 > 192.168.2.101: ICMP echo reply, id 14978, seq 1, length 64
02:49:43.927669 IP 192.168.2.101 > 12.10.5.1: ICMP echo request, id 14981, seq 1, length 64
02:49:43.927678 IP 12.10.5.1 > 192.168.2.101: ICMP echo reply, id 14981, seq 1, length 64
02:49:43.933320 IP 192.168.2.101 > 192.168.1.1: ICMP echo request, id 14987, seq 1, length 64
02:49:43.933328 IP 192.168.1.1 > 192.168.2.101: ICMP echo reply, id 14987, seq 1, length 64
02:49:47.298016 ARP, Request who-has 192.168.2.1 tell 192.168.2.2, length 28
02:49:47.298026 ARP, Reply 192.168.2.1 is-at 3e:9f:b5:21:3b:f6 (oui Unknown), length 28

02:49:52.286376 IP 192.168.2.2 > 192.168.1.4: ICMP echo request, id 15222, seq 1, length 64
02:49:53.985985 IP 192.168.2.101 > 192.168.2.1: ICMP echo request, id 15255, seq 1, length 64
02:49:53.985999 IP 192.168.2.1 > 192.168.2.101: ICMP echo reply, id 15255, seq 1, length 64
02:49:53.989775 IP 192.168.2.101 > 12.10.5.1: ICMP echo request, id 15258, seq 1, length 64
02:49:53.989788 IP 12.10.5.1 > 192.168.2.101: ICMP echo reply, id 15258, seq 1, length 64
02:49:53.996103 IP 192.168.2.101 > 192.168.1.1: ICMP echo request, id 15264, seq 1, length 64
02:49:53.996114 IP 192.168.1.1 > 192.168.2.101: ICMP echo reply, id 15264, seq 1, length 64
02:49:59.016874 IP 192.168.2.101 > 192.168.2.1: ICMP echo request, id 15357, seq 1, length 64
02:49:59.016888 IP 192.168.2.1 > 192.168.2.101: ICMP echo reply, id 15357, seq 1, length 64
02:49:59.020090 IP 192.168.2.101 > 12.10.5.1: ICMP echo request, id 15360, seq 1, length 64
02:49:59.020100 IP 12.10.5.1 > 192.168.2.101: ICMP echo reply, id 15360, seq 1, length 64
02:49:59.025901 IP 192.168.2.101 > 192.168.1.1: ICMP echo request, id 15366, seq 1, length 64
02:49:59.025912 IP 192.168.1.1 > 192.168.2.101: ICMP echo reply, id 15366, seq 1, length 64

