19:29:11.376477 IP 192.168.1.101 > 12.10.5.103: ICMP echo request, id 20975, seq 1, length 64
19:29:11.460862 ARP, Request who-has 192.168.1.1 tell 192.168.1.3, length 28
19:29:11.461066 ARP, Reply 192.168.1.1 is-at de:39:3f:9d:2e:44 (oui Unknown), length 28
19:29:11.465926 IP 192.168.1.3 > 12.10.5.2: ICMP echo request, id 20981, seq 1, length 64
19:29:12.390515 IP 192.168.1.101 > 192.168.3.1: ICMP echo request, id 21000, seq 1, length 64
19:29:13.427110 IP 192.168.1.101 > 192.168.3.103: ICMP echo request, id 21012, seq 1, length 64
19:29:14.442489 IP 192.168.1.101 > 192.168.5.1: ICMP echo request, id 21024, seq 1, length 64
19:29:15.456197 ARP, Request who-has 192.168.1.103 tell 192.168.1.101, length 28
19:29:15.474391 IP 192.168.1.101 > 12.10.5.1: ICMP echo request, id 21039, seq 1, length 64
19:29:16.488067 IP 192.168.1.101 > 192.168.4.2: ICMP echo request, id 21051, seq 1, length 64
19:29:16.488099 IP 192.168.4.2 > 192.168.1.101: ICMP echo reply, id 21051, seq 1, length 64
19:29:16.502983 IP 192.168.1.101 > 192.168.1.1: ICMP echo request, id 21054, seq 1, length 64
19:29:16.503012 IP 192.168.1.1 > 192.168.1.101: ICMP echo reply, id 21054, seq 1, length 64
19:29:16.516626 IP 192.168.1.101 > 192.168.4.1: ICMP echo request, id 21057, seq 1, length 64
19:29:17.529616 IP 192.168.1.101 > 192.168.2.103: ICMP echo request, id 21089, seq 1, length 64
19:29:18.543270 IP 192.168.1.101 > 192.168.5.2: ICMP echo request, id 21116, seq 1, length 64
19:29:19.564804 ARP, Request who-has 192.168.1.3 tell 192.168.1.101, length 28
19:29:24.583845 IP 192.168.1.101 > 192.168.2.1: ICMP echo request, id 21219, seq 1, length 64
19:29:25.594574 IP 192.168.1.101 > 12.10.5.103: ICMP echo request, id 21228, seq 1, length 64
19:29:26.606352 IP 192.168.1.101 > 192.168.3.1: ICMP echo request, id 21240, seq 1, length 64
19:29:27.616435 IP 192.168.1.101 > 192.168.3.103: ICMP echo request, id 21255, seq 1, length 64
19:29:28.626132 IP 192.168.1.101 > 192.168.5.1: ICMP echo request, id 21267, seq 1, length 64
19:29:29.646800 IP 192.168.1.101 > 12.10.5.1: ICMP echo request, id 21284, seq 1, length 64
19:29:30.656361 IP 192.168.1.101 > 192.168.4.2: ICMP echo request, id 21315, seq 1, length 64
19:29:30.656391 IP 192.168.4.2 > 192.168.1.101: ICMP echo reply, id 21315, seq 1, length 64
19:29:30.668627 IP 192.168.1.101 > 192.168.1.1: ICMP echo request, id 21318, seq 1, length 64
19:29:30.668655 IP 192.168.1.1 > 192.168.1.101: ICMP echo reply, id 21318, seq 1, length 64
19:29:30.678571 IP 192.168.1.101 > 192.168.4.1: ICMP echo request, id 21321, seq 1, length 64
19:29:31.687528 IP 192.168.1.101 > 192.168.2.103: ICMP echo request, id 21327, seq 1, length 64
19:29:32.699586 IP 192.168.1.101 > 192.168.5.2: ICMP echo request, id 21334, seq 1, length 64
19:29:35.656259 ARP, Request who-has 192.168.1.101 tell 192.168.1.1, length 28
19:29:35.661250 ARP, Reply 192.168.1.101 is-at 66:98:fb:f7:3b:40 (oui Unknown), length 28
19:29:38.735284 IP 192.168.1.101 > 192.168.2.1: ICMP echo request, id 21403, seq 1, length 64

19:29:40.755777 IP 192.168.1.101 > 192.168.3.1: ICMP echo request, id 21438, seq 1, length 64
19:29:41.766429 IP 192.168.1.101 > 192.168.3.103: ICMP echo request, id 21447, seq 1, length 64
19:29:42.776479 IP 192.168.1.101 > 192.168.5.1: ICMP echo request, id 21478, seq 1, length 64
19:29:43.797185 IP 192.168.1.101 > 12.10.5.1: ICMP echo request, id 21490, seq 1, length 64
19:29:44.805960 IP 192.168.1.101 > 192.168.4.2: ICMP echo request, id 21496, seq 1, length 64
19:29:44.805987 IP 192.168.4.2 > 192.168.1.101: ICMP echo reply, id 21496, seq 1, length 64
19:29:44.816751 IP 192.168.1.101 > 192.168.1.1: ICMP echo request, id 21499, seq 1, length 64
19:29:44.816775 IP 192.168.1.1 > 192.168.1.101: ICMP echo reply, id 21499, seq 1, length 64
19:29:44.825964 IP 192.168.1.101 > 192.168.4.1: ICMP echo request, id 21502, seq 1, length 64
19:29:45.836299 IP 192.168.1.101 > 192.168.2.103: ICMP echo request, id 21508, seq 1, length 64
19:29:46.848267 IP 192.168.1.101 > 192.168.5.2: ICMP echo request, id 21514, seq 1, length 64
19:29:52.881887 IP 192.168.1.101 > 192.168.2.1: ICMP echo request, id 21606, seq 1, length 64
19:29:53.892418 IP 192.168.1.101 > 192.168.3.1: ICMP echo request, id 21625, seq 1, length 64
19:29:54.903481 IP 192.168.1.101 > 192.168.5.1: ICMP echo request, id 21628, seq 1, length 64
19:29:55.912505 IP 192.168.1.101 > 12.10.5.1: ICMP echo request, id 21631, seq 1, length 64
19:29:56.924104 IP 192.168.1.101 > 192.168.1.1: ICMP echo request, id 21708, seq 1, length 64
19:29:56.924133 IP 192.168.1.1 > 192.168.1.101: ICMP echo reply, id 21708, seq 1, length 64
19:29:56.934034 IP 192.168.1.101 > 192.168.4.1: ICMP echo request, id 21711, seq 1, length 64
19:29:57.944345 IP 192.168.1.101 > 192.168.5.2: ICMP echo request, id 21720, seq 1, length 64
19:29:59.914377 ARP, Request who-has 192.168.1.1 tell 192.168.1.101, length 28
19:29:59.914430 ARP, Reply 192.168.1.1 is-at de:39:3f:9d:2e:44 (oui Unknown), length 28
19:30:03.968710 IP 192.168.1.101 > 12.10.5.103: ICMP echo request, id 21799, seq 1, length 64
19:30:04.989384 IP 192.168.1.101 > 192.168.4.2: ICMP echo request, id 21829, seq 1, length 64
19:30:04.989414 IP 192.168.4.2 > 192.168.1.101: ICMP echo reply, id 21829, seq 1, length 64
19:30:04.998966 IP 192.168.1.101 > 192.168.1.1: ICMP echo request, id 21832, seq 1, length 64
19:30:04.998997 IP 192.168.1.1 > 192.168.1.101: ICMP echo reply, id 21832, seq 1, length 64
19:30:05.009281 IP 192.168.1.101 > 192.168.2.103: ICMP echo request, id 21835, seq 1, length 64

19:30:11.030082 IP 192.168.1.101 > 192.168.3.103: ICMP echo request, id 21957, seq 1, length 64
19:30:12.039816 IP 192.168.1.101 > 192.168.4.2: ICMP echo request, id 21963, seq 1, length 64
19:30:12.039913 IP 192.168.4.2 > 192.168.1.101: ICMP echo reply, id 21963, seq 1, length 64
19:30:12.051582 IP 192.168.1.101 > 192.168.1.1: ICMP echo request, id 21966, seq 1, length 64
19:30:12.051609 IP 192.168.1.1 > 192.168.1.101: ICMP echo reply, id 21966, seq 1, length 64
19:30:17.096711 IP 192.168.1.101 > 192.168.4.2: ICMP echo request, id 22024, seq 1, length 64
19:30:17.096833 IP 192.168.4.2 > 192.168.1.101: ICMP echo reply, id 22024, seq 1, length 64
19:30:17.106757 IP 192.168.1.101 > 192.168.1.1: ICMP echo request, id 22027, seq 1, length 64
19:30:17.106784 IP 192.168.1.1 > 192.168.1.101: ICMP echo reply, id 22027, seq 1, length 64
19:30:22.149672 IP 192.168.1.101 > 192.168.4.2: ICMP echo request, id 22095, seq 1, length 64
19:30:22.149700 IP 192.168.4.2 > 192.168.1.101: ICMP echo reply, id 22095, seq 1, length 64
19:30:22.158869 IP 192.168.1.101 > 192.168.1.1: ICMP echo request, id 22098, seq 1, length 64
19:30:22.158891 IP 192.168.1.1 > 192.168.1.101: ICMP echo reply, id 22098, seq 1, length 64
19:30:27.208044 IP 192.168.1.101 > 192.168.4.2: ICMP echo request, id 22164, seq 1, length 64
19:30:27.208070 IP 192.168.4.2 > 192.168.1.101: ICMP echo reply, id 22164, seq 1, length 64
19:30:27.217136 IP 192.168.1.101 > 192.168.1.1: ICMP echo request, id 22167, seq 1, length 64
19:30:27.217158 IP 192.168.1.1 > 192.168.1.101: ICMP echo reply, id 22167, seq 1, length 64
19:30:32.271076 IP 192.168.1.101 > 192.168.4.2: ICMP echo request, id 22236, seq 1, length 64
19:30:32.271106 IP 192.168.4.2 > 192.168.1.101: ICMP echo reply, id 22236, seq 1, length 64
19:30:32.279858 IP 192.168.1.101 > 192.168.1.1: ICMP echo request, id 22239, seq 1, length 64
19:30:32.279879 IP 192.168.1.1 > 192.168.1.101: ICMP echo reply, id 22239, seq 1, length 64
19:30:37.337999 IP 192.168.1.101 > 192.168.4.2: ICMP echo request, id 22306, seq 1, length 64
19:30:37.338114 IP 192.168.4.2 > 192.168.1.101: ICMP echo reply, id 22306, seq 1, length 64
19:30:37.349758 IP 192.168.1.101 > 192.168.1.1: ICMP echo request, id 22309, seq 1, length 64
19:30:37.349784 IP 192.168.1.1 > 192.168.1.101: ICMP echo reply, id 22309, seq 1, length 64

19:30:42.344372 ARP, Request who-has 192.168.1.101 tell 192.168.1.1, length 28
19:30:42.344970 ARP, Reply 192.168.1.101 is-at 66:98:fb:f7:3b:40 (oui Unknown), length 28
19:30:42.413716 IP 192.168.1.101 > 192.168.4.2: ICMP echo request, id 22400, seq 1, length 64
19:30:42.413754 IP 192.168.4.2 > 192.168.1.101: ICMP echo reply, id 22400, seq 1, length 64
19:30:42.425802 IP 192.168.1.101 > 192.168.1.1: ICMP echo request, id 22403, seq 1, length 64
19:30:42.425830 IP 192.168.1.1 > 192.168.1.101: ICMP echo reply, id 22403, seq 1, length 64
19:30:47.479614 IP 192.168.1.101 > 192.168.4.2: ICMP echo request, id 22520, seq 1, length 64
19:30:47.479644 IP 192.168.4.2 > 192.168.1.101: ICMP echo reply, id 22520, seq 1, length 64
19:30:47.494603 IP 192.168.1.101 > 192.168.1.1: ICMP echo request, id 22523, seq 1, length 64
19:30:47.494627 IP 192.168.1.1 > 192.168.1.101: ICMP echo reply, id 22523, seq 1, length 64
19:30:52.489548 ARP, Request who-has 192.168.1.1 tell 192.168.1.101, length 28
19:30:52.489571 ARP, Reply 192.168.1.1 is-at de:39:3f:9d:2e:44 (oui Unknown), length 28
19:30:52.548954 IP 192.168.1.101 > 192.168.4.2: ICMP echo request, id 22601, seq 1, length 64
19:30:52.548983 IP 192.168.4.2 > 192.168.1.101: ICMP echo reply, id 22601, seq 1, length 64
19:30:52.562801 IP 192.168.1.101 > 192.168.1.1: ICMP echo request, id 22604, seq 1, length 64
19:30:52.562827 IP 192.168.1.1 > 192.168.1.101: ICMP echo reply, id 22604, seq 1, length 64
19:30:57.633489 IP 192.168.1.101 > 192.168.4.2: ICMP echo request, id 22721, seq 1, length 64
19:30:57.633518 IP 192.168.4.2 > 192.168.1.101: ICMP echo reply, id 22721, seq 1, length 64
19:30:57.642909 IP 192.168.1.101 > 192.168.1.1: ICMP echo request, id 22724, seq 1, length 64
19:30:57.642930 IP 192.168.1.1 > 192.168.1.101: ICMP echo reply, id 22724, seq 1, length 64
19:31:02.696642 IP 192.168.1.101 > 192.168.4.2: ICMP echo request, id 22793, seq 1, length 64
19:31:02.696755 IP 192.168.4.2 > 192.168.1.101: ICMP echo reply, id 22793, seq 1, length 64
19:31:02.708377 IP 192.168.1.101 > 192.168.1.1: ICMP echo request, id 22796, seq 1, length 64
19:31:02.708399 IP 192.168.1.1 > 192.168.1.101: ICMP echo reply, id 22796, seq 1, length 64
19:31:07.765716 IP 192.168.1.101 > 192.168.4.2: ICMP echo request, id 22862, seq 1, length 64
19:31:07.765835 IP 192.168.4.2 > 192.168.1.101: ICMP echo reply, id 22862, seq 1, length 64
19:31:07.776736 IP 192.168.1.101 > 192.168.1.1: ICMP echo request, id 22865, seq 1, length 64
19:31:07.776763 IP 192.168.1.1 > 192.168.1.101: ICMP echo reply, id 22865, seq 1, length 64

19:31:12.778376 ARP, Request who-has 192.168.1.101 tell 192.168.1.1, length 28
19:31:12.778731 ARP, Reply 192.168.1.101 is-at 66:98:fb:f7:3b:40 (oui Unknown), length 28
19:31:12.832287 IP 192.168.1.101 > 192.168.4.2: ICMP echo request, id 22947, seq 1, length 64
19:31:12.832314 IP 192.168.4.2 > 192.168.1.101: ICMP echo reply, id 22947, seq 1, length 64
19:31:12.841742 IP 192.168.1.101 > 192.168.1.1: ICMP echo request, id 22950, seq 1, length 64
19:31:12.841774 IP 192.168.1.1 > 192.168.1.101: ICMP echo reply, id 22950, seq 1, length 64
19:31:17.904949 IP 192.168.1.101 > 192.168.4.2: ICMP echo request, id 23017, seq 1, length 64
19:31:17.904978 IP 192.168.4.2 > 192.168.1.101: ICMP echo reply, id 23017, seq 1, length 64
19:31:17.914363 IP 192.168.1.101 > 192.168.1.1: ICMP echo request, id 23020, seq 1, length 64
19:31:17.914389 IP 192.168.1.1 > 192.168.1.101: ICMP echo reply, id 23020, seq 1, length 64
19:31:22.632006 IP 192.168.1.2 > 12.10.5.2: ICMP echo request, id 23085, seq 1, length 64
19:31:22.980515 IP 192.168.1.101 > 192.168.4.2: ICMP echo request, id 23089, seq 1, length 64
19:31:22.980540 IP 192.168.4.2 > 192.168.1.101: ICMP echo reply, id 23089, seq 1, length 64
19:31:22.991734 IP 192.168.1.101 > 192.168.1.1: ICMP echo request, id 23092, seq 1, length 64
19:31:22.991760 IP 192.168.1.1 > 192.168.1.101: ICMP echo reply, id 23092, seq 1, length 64
19:31:27.644439 ARP, Request who-has 192.168.1.1 tell 192.168.1.2, length 28
19:31:27.644461 ARP, Reply 192.168.1.1 is-at de:39:3f:9d:2e:44 (oui Unknown), length 28
19:31:28.048654 IP 192.168.1.101 > 192.168.4.2: ICMP echo request, id 23169, seq 1, length 64
19:31:28.048681 IP 192.168.4.2 > 192.168.1.101: ICMP echo reply, id 23169, seq 1, length 64
19:31:28.057697 IP 192.168.1.101 > 192.168.1.1: ICMP echo request, id 23172, seq 1, length 64
19:31:28.057719 IP 192.168.1.1 > 192.168.1.101: ICMP echo reply, id 23172, seq 1, length 64
19:31:28.086031 ARP, Request who-has 192.168.1.2 tell 192.168.1.101, length 28
19:31:32.640191 IP 192.168.1.2 > 12.10.5.3: ICMP echo request, id 23291, seq 1, length 64
19:31:33.125611 IP 192.168.1.101 > 192.168.4.2: ICMP echo request, id 23295, seq 1, length 64
19:31:33.125639 IP 192.168.4.2 > 192.168.1.101: ICMP echo reply, id 23295, seq 1, length 64
19:31:33.135122 IP 192.168.1.101 > 192.168.1.1: ICMP echo request, id 23298, seq 1, length 64
19:31:33.135146 IP 192.168.1.1 > 192.168.1.101: ICMP echo reply, id 23298, seq 1, length 64
19:31:38.193019 IP 192.168.1.101 > 192.168.4.2: ICMP echo request, id 23378, seq 1, length 64
19:31:38.193045 IP 192.168.4.2 > 192.168.1.101: ICMP echo reply, id 23378, seq 1, length 64
19:31:38.202352 IP 192.168.1.101 > 192.168.1.1: ICMP echo request, id 23381, seq 1, length 64
19:31:38.202375 IP 192.168.1.1 > 192.168.1.101: ICMP echo reply, id 23381, seq 1, length 64

19:31:42.649119 ARP, Request who-has 192.168.1.3 tell 192.168.1.2, length 28
19:31:42.661870 IP 192.168.1.2 > 192.168.2.2: ICMP echo request, id 23512, seq 1, length 64
19:31:43.208292 ARP, Request who-has 192.168.1.101 tell 192.168.1.1, length 28
19:31:43.208550 ARP, Request who-has 192.168.1.1 tell 192.168.1.101, length 28
19:31:43.208561 ARP, Reply 192.168.1.1 is-at de:39:3f:9d:2e:44 (oui Unknown), length 28
19:31:43.208648 ARP, Reply 192.168.1.101 is-at 66:98:fb:f7:3b:40 (oui Unknown), length 28
19:31:43.267295 IP 192.168.1.101 > 192.168.4.2: ICMP echo request, id 23516, seq 1, length 64
19:31:43.267324 IP 192.168.4.2 > 192.168.1.101: ICMP echo reply, id 23516, seq 1, length 64
19:31:43.277746 IP 192.168.1.101 > 192.168.1.1: ICMP echo request, id 23519, seq 1, length 64
19:31:43.277951 IP 192.168.1.1 > 192.168.1.101: ICMP echo reply, id 23519, seq 1, length 64
19:31:48.342269 IP 192.168.1.101 > 192.168.4.2: ICMP echo request, id 23589, seq 1, length 64
19:31:48.342295 IP 192.168.4.2 > 192.168.1.101: ICMP echo reply, id 23589, seq 1, length 64
19:31:48.351850 IP 192.168.1.101 > 192.168.1.1: ICMP echo request, id 23592, seq 1, length 64
19:31:48.351873 IP 192.168.1.1 > 192.168.1.101: ICMP echo reply, id 23592, seq 1, length 64
19:31:52.670825 IP 192.168.1.2 > 192.168.2.3: ICMP echo request, id 23660, seq 1, length 64
19:31:53.409923 IP 192.168.1.101 > 192.168.4.2: ICMP echo request, id 23664, seq 1, length 64
19:31:53.409951 IP 192.168.4.2 > 192.168.1.101: ICMP echo reply, id 23664, seq 1, length 64
19:31:53.420777 IP 192.168.1.101 > 192.168.1.1: ICMP echo request, id 23667, seq 1, length 64
19:31:53.420804 IP 192.168.1.1 > 192.168.1.101: ICMP echo reply, id 23667, seq 1, length 64
19:31:58.483560 IP 192.168.1.101 > 192.168.4.2: ICMP echo request, id 23736, seq 1, length 64
19:31:58.483587 IP 192.168.4.2 > 192.168.1.101: ICMP echo reply, id 23736, seq 1, length 64
19:31:58.492900 IP 192.168.1.101 > 192.168.1.1: ICMP echo request, id 23739, seq 1, length 64
19:31:58.492923 IP 192.168.1.1 > 192.168.1.101: ICMP echo reply, id 23739, seq 1, length 64
19:32:02.681179 IP 192.168.1.2 > 192.168.3.2: ICMP echo request, id 23807, seq 1, length 64
19:32:03.554080 IP 192.168.1.101 > 192.168.4.2: ICMP echo request, id 23811, seq 1, length 64
19:32:03.554117 IP 192.168.4.2 > 192.168.1.101: ICMP echo reply, id 23811, seq 1, length 64
19:32:03.563776 IP 192.168.1.101 > 192.168.1.1: ICMP echo request, id 23814, seq 1, length 64
19:32:03.563799 IP 192.168.1.1 > 192.168.1.101: ICMP echo reply, id 23814, seq 1, length 64
19:32:08.631473 IP 192.168.1.101 > 192.168.4.2: ICMP echo request, id 23883, seq 1, length 64
19:32:08.631503 IP 192.168.4.2 > 192.168.1.101: ICMP echo reply, id 23883, seq 1, length 64
19:32:08.643389 IP 192.168.1.101 > 192.168.1.1: ICMP echo request, id 23886, seq 1, length 64
19:32:08.643410 IP 192.168.1.1 > 192.168.1.101: ICMP echo reply, id 23886, seq 1, length 64

19:32:12.700003 IP 192.168.1.2 > 192.168.3.3: ICMP echo request, id 23954, seq 1, length 64
19:32:13.640281 ARP, Request who-has 192.168.1.101 tell 192.168.1.1, length 28
19:32:13.640627 ARP, Reply 192.168.1.101 is-at 66:98:fb:f7:3b:40 (oui Unknown), length 28
19:32:13.710524 IP 192.168.1.101 > 192.168.4.2: ICMP echo request, id 23990, seq 1, length 64
19:32:13.710554 IP 192.168.4.2 > 192.168.1.101: ICMP echo reply, id 23990, seq 1, length 64
19:32:13.722043 IP 192.168.1.101 > 192.168.1.1: ICMP echo request, id 23993, seq 1, length 64
19:32:13.722070 IP 192.168.1.1 > 192.168.1.101: ICMP echo reply, id 23993, seq 1, length 64
19:32:17.705931 ARP, Request who-has 192.168.1.1 tell 192.168.1.2, length 28
19:32:17.705949 ARP, Reply 192.168.1.1 is-at de:39:3f:9d:2e:44 (oui Unknown), length 28
19:32:18.787937 IP 192.168.1.101 > 192.168.4.2: ICMP echo request, id 24103, seq 1, length 64
19:32:18.787967 IP 192.168.4.2 > 192.168.1.101: ICMP echo reply, id 24103, seq 1, length 64
19:32:18.800972 IP 192.168.1.101 > 192.168.1.1: ICMP echo request, id 24106, seq 1, length 64
19:32:18.801000 IP 192.168.1.1 > 192.168.1.101: ICMP echo reply, id 24106, seq 1, length 64
19:32:22.710760 IP 192.168.1.3 > 12.10.5.2: ICMP echo request, id 24132, seq 1, length 64
19:32:23.860804 IP 192.168.1.101 > 192.168.4.2: ICMP echo request, id 24198, seq 1, length 64
19:32:23.860834 IP 192.168.4.2 > 192.168.1.101: ICMP echo reply, id 24198, seq 1, length 64
19:32:23.873614 IP 192.168.1.101 > 192.168.1.1: ICMP echo request, id 24201, seq 1, length 64
19:32:23.873643 IP 192.168.1.1 > 192.168.1.101: ICMP echo reply, id 24201, seq 1, length 64
19:32:27.722111 ARP, Request who-has 192.168.1.1 tell 192.168.1.3, length 28
19:32:27.722133 ARP, Reply 192.168.1.1 is-at de:39:3f:9d:2e:44 (oui Unknown), length 28
19:32:28.927080 IP 192.168.1.101 > 192.168.4.2: ICMP echo request, id 24311, seq 1, length 64
19:32:28.927105 IP 192.168.4.2 > 192.168.1.101: ICMP echo reply, id 24311, seq 1, length 64
19:32:28.937447 IP 192.168.1.101 > 192.168.1.1: ICMP echo request, id 24314, seq 1, length 64
19:32:28.937472 IP 192.168.1.1 > 192.168.1.101: ICMP echo reply, id 24314, seq 1, length 64
19:32:32.718866 IP 192.168.1.3 > 12.10.5.3: ICMP echo request, id 24340, seq 1, length 64
19:32:33.929331 ARP, Request who-has 192.168.1.1 tell 192.168.1.101, length 28
19:32:33.929410 ARP, Reply 192.168.1.1 is-at de:39:3f:9d:2e:44 (oui Unknown), length 28
19:32:33.992872 IP 192.168.1.101 > 192.168.4.2: ICMP echo request, id 24386, seq 1, length 64
19:32:33.993020 IP 192.168.4.2 > 192.168.1.101: ICMP echo reply, id 24386, seq 1, length 64
19:32:34.002565 IP 192.168.1.101 > 192.168.1.1: ICMP echo request, id 24389, seq 1, length 64
19:32:34.002592 IP 192.168.1.1 > 192.168.1.101: ICMP echo reply, id 24389, seq 1, length 64
19:32:39.058912 IP 192.168.1.101 > 192.168.4.2: ICMP echo request, id 24459, seq 1, length 64
19:32:39.058939 IP 192.168.4.2 > 192.168.1.101: ICMP echo reply, id 24459, seq 1, length 64
19:32:39.067051 IP 192.168.1.101 > 192.168.1.1: ICMP echo request, id 24462, seq 1, length 64
19:32:39.067071 IP 192.168.1.1 > 192.168.1.101: ICMP echo reply, id 24462, seq 1, length 64

19:32:42.734539 IP 192.168.1.3 > 192.168.2.2: ICMP echo request, id 24501, seq 1, length 64
19:32:44.072604 ARP, Request who-has 192.168.1.101 tell 192.168.1.1, length 28
19:32:44.073834 ARP, Reply 192.168.1.101 is-at 66:98:fb:f7:3b:40 (oui Unknown), length 28
19:32:44.144809 IP 192.168.1.101 > 192.168.4.2: ICMP echo request, id 24547, seq 1, length 64
19:32:44.144839 IP 192.168.4.2 > 192.168.1.101: ICMP echo reply, id 24547, seq 1, length 64
19:32:44.154679 IP 192.168.1.101 > 192.168.1.1: ICMP echo request, id 24550, seq 1, length 64
19:32:44.154708 IP 192.168.1.1 > 192.168.1.101: ICMP echo reply, id 24550, seq 1, length 64
19:32:46.102926 ARP, Request who-has 192.168.1.3 tell 192.168.1.103, length 28
19:32:46.154091 IP 192.168.1.103.44780 > 192.168.4.2.33434: UDP, length 32
19:32:46.154129 IP 192.168.4.2 > 192.168.1.103: ICMP 192.168.4.2 udp port 33434 unreachable, length 68
19:32:46.159782 IP 192.168.1.103.41815 > 192.168.4.2.33438: UDP, length 32
19:32:46.159810 IP 192.168.4.2 > 192.168.1.103: ICMP 192.168.4.2 udp port 33438 unreachable, length 68
19:32:46.161519 IP 192.168.1.103.52232 > 192.168.4.2.33439: UDP, length 32
19:32:46.161545 IP 192.168.4.2 > 192.168.1.103: ICMP 192.168.4.2 udp port 33439 unreachable, length 68
19:32:46.166238 IP 192.168.1.103.43081 > 192.168.4.2.33440: UDP, length 32
19:32:46.166265 IP 192.168.4.2 > 192.168.1.103: ICMP 192.168.4.2 udp port 33440 unreachable, length 68
19:32:46.166479 IP 192.168.1.103.54885 > 192.168.4.2.33442: UDP, length 32
19:32:46.166501 IP 192.168.4.2 > 192.168.1.103: ICMP 192.168.4.2 udp port 33442 unreachable, length 68
19:32:46.166611 IP 192.168.1.103.48787 > 192.168.4.2.33436: UDP, length 32
19:32:46.166625 IP 192.168.4.2 > 192.168.1.103: ICMP 192.168.4.2 udp port 33436 unreachable, length 68
19:32:46.166720 IP 192.168.1.103.56434 > 192.168.4.2.33447: UDP, length 32
19:32:46.166756 IP 192.168.1.103.60107 > 192.168.4.2.33435: UDP, length 32
19:32:46.166787 IP 192.168.1.103.54247 > 192.168.4.2.33449: UDP, length 32
19:32:46.166888 IP 192.168.1.103.54563 > 192.168.4.2.33448: UDP, length 32
19:32:46.166927 IP 192.168.1.103.54166 > 192.168.4.2.33446: UDP, length 32
19:32:46.172887 IP 192.168.1.103.41047 > 192.168.4.2.33445: UDP, length 32
19:32:46.172959 IP 192.168.1.103.37926 > 192.168.4.2.33443: UDP, length 32
19:32:46.172994 IP 192.168.1.103.47429 > 192.168.4.2.33437: UDP, length 32
19:32:46.173026 IP 192.168.1.103.49712 > 192.168.4.2.33441: UDP, length 32
19:32:46.173055 IP 192.168.1.103.45129 > 192.168.4.2.33444: UDP, length 32
19:32:49.218646 IP 192.168.1.101 > 192.168.4.2: ICMP echo request, id 24669, seq 1, length 64
19:32:49.218674 IP 192.168.4.2 > 192.168.1.101: ICMP echo reply, id 24669, seq 1, length 64
19:32:49.228466 IP 192.168.1.101 > 192.168.1.1: ICMP echo request, id 24672, seq 1, length 64
19:32:49.228494 IP 192.168.1.1 > 192.168.1.101: ICMP echo reply, id 24672, seq 1, length 64
19:32:51.160254 ARP, Request who-has 192.168.1.103 tell 192.168.1.1, length 28
19:32:51.163782 ARP, Request who-has 192.168.1.1 tell 192.168.1.103, length 28
19:32:51.163807 ARP, Reply 192.168.1.1 is-at de:39:3f:9d:2e:44 (oui Unknown), length 28
19:32:51.169249 ARP, Reply 192.168.1.103 is-at b6:92:70:b4:27:97 (oui Unknown), length 28
19:32:51.176993 ARP, Request who-has 192.168.1.2 tell 192.168.1.103, length 28
19:32:52.747985 IP 192.168.1.3 > 192.168.2.3: ICMP echo request, id 24723, seq 1, length 64
19:32:54.284031 IP 192.168.1.101 > 192.168.4.2: ICMP echo request, id 24773, seq 1, length 64
19:32:54.284112 IP 192.168.4.2 > 192.168.1.101: ICMP echo reply, id 24773, seq 1, length 64
19:32:54.293581 IP 192.168.1.101 > 192.168.1.1: ICMP echo request, id 24776, seq 1, length 64
19:32:54.293606 IP 192.168.1.1 > 192.168.1.101: ICMP echo reply, id 24776, seq 1, length 64
19:32:59.372305 IP 192.168.1.101 > 192.168.4.2: ICMP echo request, id 24894, seq 1, length 64
19:32:59.372335 IP 192.168.4.2 > 192.168.1.101: ICMP echo reply, id 24894, seq 1, length 64
19:32:59.382870 IP 192.168.1.101 > 192.168.1.1: ICMP echo request, id 24897, seq 1, length 64
19:32:59.382898 IP 192.168.1.1 > 192.168.1.101: ICMP echo reply, id 24897, seq 1, length 64
19:33:02.756952 IP 192.168.1.3 > 192.168.3.2: ICMP echo request, id 24942, seq 1, length 64
19:33:04.448073 IP 192.168.1.101 > 192.168.4.2: ICMP echo request, id 24998, seq 1, length 64
19:33:04.448101 IP 192.168.4.2 > 192.168.1.101: ICMP echo reply, id 24998, seq 1, length 64
19:33:04.458879 IP 192.168.1.101 > 192.168.1.1: ICMP echo request, id 25001, seq 1, length 64
19:33:04.458907 IP 192.168.1.1 > 192.168.1.101: ICMP echo reply, id 25001, seq 1, length 64
19:33:07.768567 ARP, Request who-has 192.168.1.1 tell 192.168.1.3, length 28
19:33:07.768588 ARP, Reply 192.168.1.1 is-at de:39:3f:9d:2e:44 (oui Unknown), length 28
19:33:09.544229 IP 192.168.1.101 > 192.168.4.2: ICMP echo request, id 25069, seq 1, length 64
19:33:09.544253 IP 192.168.4.2 > 192.168.1.101: ICMP echo reply, id 25069, seq 1, length 64
19:33:09.571790 IP 192.168.1.101 > 192.168.1.1: ICMP echo request, id 25078, seq 1, length 64
19:33:09.571817 IP 192.168.1.1 > 192.168.1.101: ICMP echo reply, id 25078, seq 1, length 64

19:33:12.765668 IP 192.168.1.3 > 192.168.3.3: ICMP echo request, id 25130, seq 1, length 64
19:33:14.552610 ARP, Request who-has 192.168.1.101 tell 192.168.1.1, length 28
19:33:14.553775 ARP, Reply 192.168.1.101 is-at 66:98:fb:f7:3b:40 (oui Unknown), length 28
19:33:14.702414 IP 192.168.1.101 > 192.168.4.2: ICMP echo request, id 25149, seq 1, length 64
19:33:14.702435 IP 192.168.4.2 > 192.168.1.101: ICMP echo reply, id 25149, seq 1, length 64
19:33:14.727340 IP 192.168.1.101 > 192.168.1.1: ICMP echo request, id 25155, seq 1, length 64
19:33:14.727393 IP 192.168.1.1 > 192.168.1.101: ICMP echo reply, id 25155, seq 1, length 64
19:33:19.877469 IP 192.168.1.101 > 192.168.4.2: ICMP echo request, id 25249, seq 1, length 64
19:33:19.877538 IP 192.168.4.2 > 192.168.1.101: ICMP echo reply, id 25249, seq 1, length 64
19:33:19.887713 IP 192.168.1.101 > 192.168.1.1: ICMP echo request, id 25258, seq 1, length 64
19:33:19.887734 IP 192.168.1.1 > 192.168.1.101: ICMP echo reply, id 25258, seq 1, length 64
19:33:24.888982 ARP, Request who-has 192.168.1.1 tell 192.168.1.101, length 28
19:33:24.889002 ARP, Reply 192.168.1.1 is-at de:39:3f:9d:2e:44 (oui Unknown), length 28
19:33:25.027968 IP 192.168.1.101 > 192.168.4.2: ICMP echo request, id 25361, seq 1, length 64
19:33:25.027997 IP 192.168.4.2 > 192.168.1.101: ICMP echo reply, id 25361, seq 1, length 64
19:33:25.068232 IP 192.168.1.101 > 192.168.1.1: ICMP echo request, id 25370, seq 1, length 64
19:33:25.068364 IP 192.168.1.1 > 192.168.1.101: ICMP echo reply, id 25370, seq 1, length 64
19:33:30.227437 IP 192.168.1.101 > 192.168.4.2: ICMP echo request, id 25479, seq 1, length 64
19:33:30.227463 IP 192.168.4.2 > 192.168.1.101: ICMP echo reply, id 25479, seq 1, length 64
19:33:30.248101 IP 192.168.1.101 > 192.168.1.1: ICMP echo request, id 25485, seq 1, length 64
19:33:30.248130 IP 192.168.1.1 > 192.168.1.101: ICMP echo reply, id 25485, seq 1, length 64
19:33:31.766677 IP 192.168.1.103.48376 > 192.168.4.2.33434: UDP, length 32
19:33:31.766716 IP 192.168.4.2 > 192.168.1.103: ICMP 192.168.4.2 udp port 33434 unreachable, length 68
19:33:31.772431 IP 192.168.1.103.48503 > 192.168.4.2.33440: UDP, length 32
19:33:31.772462 IP 192.168.4.2 > 192.168.1.103: ICMP 192.168.4.2 udp port 33440 unreachable, length 68
19:33:31.777020 IP 192.168.1.103.44866 > 192.168.4.2.33447: UDP, length 32
19:33:31.777062 IP 192.168.4.2 > 192.168.1.103: ICMP 192.168.4.2 udp port 33447 unreachable, length 68
19:33:31.777239 IP 192.168.1.103.33577 > 192.168.4.2.33443: UDP, length 32
19:33:31.777255 IP 192.168.4.2 > 192.168.1.103: ICMP 192.168.4.2 udp port 33443 unreachable, length 68
19:33:31.777358 IP 192.168.1.103.39251 > 192.168.4.2.33441: UDP, length 32
19:33:31.777372 IP 192.168.4.2 > 192.168.1.103: ICMP 192.168.4.2 udp port 33441 unreachable, length 68
19:33:31.777465 IP 192.168.1.103.47183 > 192.168.4.2.33442: UDP, length 32
19:33:31.777478 IP 192.168.4.2 > 192.168.1.103: ICMP 192.168.4.2 udp port 33442 unreachable, length 68
19:33:31.777782 IP 192.168.1.103.52623 > 192.168.4.2.33445: UDP, length 32
19:33:31.783859 IP 192.168.1.103.57919 > 192.168.4.2.33446: UDP, length 32
19:33:31.783931 IP 192.168.1.103.39672 > 192.168.4.2.33449: UDP, length 32
19:33:31.784027 IP 192.168.1.103.37062 > 192.168.4.2.33448: UDP, length 32
19:33:31.784070 IP 192.168.1.103.46464 > 192.168.4.2.33444: UDP, length 32
19:33:31.784102 IP 192.168.1.103.41538 > 192.168.4.2.33437: UDP, length 32
19:33:31.784132 IP 192.168.1.103.42725 > 192.168.4.2.33439: UDP, length 32
19:33:31.784161 IP 192.168.1.103.50682 > 192.168.4.2.33436: UDP, length 32
19:33:31.784190 IP 192.168.1.103.48225 > 192.168.4.2.33435: UDP, length 32
19:33:31.784219 IP 192.168.1.103.39943 > 192.168.4.2.33438: UDP, length 32
19:33:35.370810 IP 192.168.1.101 > 192.168.4.2: ICMP echo request, id 25596, seq 1, length 64
19:33:35.370834 IP 192.168.4.2 > 192.168.1.101: ICMP echo reply, id 25596, seq 1, length 64
19:33:35.381415 IP 192.168.1.101 > 192.168.1.1: ICMP echo request, id 25599, seq 1, length 64
19:33:35.381442 IP 192.168.1.1 > 192.168.1.101: ICMP echo reply, id 25599, seq 1, length 64
19:33:36.776366 ARP, Request who-has 192.168.1.103 tell 192.168.1.1, length 28
19:33:36.776703 ARP, Request who-has 192.168.1.1 tell 192.168.1.103, length 28
19:33:36.776727 ARP, Reply 192.168.1.1 is-at de:39:3f:9d:2e:44 (oui Unknown), length 28
19:33:36.776860 ARP, Reply 192.168.1.103 is-at b6:92:70:b4:27:97 (oui Unknown), length 28
19:33:40.442662 IP 192.168.1.101 > 192.168.4.2: ICMP echo request, id 25707, seq 1, length 64
19:33:40.442741 IP 192.168.4.2 > 192.168.1.101: ICMP echo reply, id 25707, seq 1, length 64
19:33:40.454374 IP 192.168.1.101 > 192.168.1.1: ICMP echo request, id 25710, seq 1, length 64
19:33:40.454396 IP 192.168.1.1 > 192.168.1.101: ICMP echo reply, id 25710, seq 1, length 64

19:33:45.448261 ARP, Request who-has 192.168.1.101 tell 192.168.1.1, length 28
19:33:45.448509 ARP, Reply 192.168.1.101 is-at 66:98:fb:f7:3b:40 (oui Unknown), length 28
19:33:45.510398 IP 192.168.1.101 > 192.168.4.2: ICMP echo request, id 25812, seq 1, length 64
19:33:45.510421 IP 192.168.4.2 > 192.168.1.101: ICMP echo reply, id 25812, seq 1, length 64
19:33:45.518475 IP 192.168.1.101 > 192.168.1.1: ICMP echo request, id 25815, seq 1, length 64
19:33:45.518496 IP 192.168.1.1 > 192.168.1.101: ICMP echo reply, id 25815, seq 1, length 64
19:33:50.569395 IP 192.168.1.101 > 192.168.4.2: ICMP echo request, id 25902, seq 1, length 64
19:33:50.569421 IP 192.168.4.2 > 192.168.1.101: ICMP echo reply, id 25902, seq 1, length 64
19:33:50.578070 IP 192.168.1.101 > 192.168.1.1: ICMP echo request, id 25905, seq 1, length 64
19:33:50.578098 IP 192.168.1.1 > 192.168.1.101: ICMP echo reply, id 25905, seq 1, length 64
19:33:55.628961 IP 192.168.1.101 > 192.168.4.2: ICMP echo request, id 25979, seq 1, length 64
19:33:55.628986 IP 192.168.4.2 > 192.168.1.101: ICMP echo reply, id 25979, seq 1, length 64
19:33:55.637790 IP 192.168.1.101 > 192.168.1.1: ICMP echo request, id 25982, seq 1, length 64
19:33:55.637814 IP 192.168.1.1 > 192.168.1.101: ICMP echo reply, id 25982, seq 1, length 64
19:34:00.691594 IP 192.168.1.101 > 192.168.4.2: ICMP echo request, id 26130, seq 1, length 64
19:34:00.691623 IP 192.168.4.2 > 192.168.1.101: ICMP echo reply, id 26130, seq 1, length 64
19:34:00.699277 IP 192.168.1.101 > 192.168.1.1: ICMP echo request, id 26133, seq 1, length 64
19:34:00.699304 IP 192.168.1.1 > 192.168.1.101: ICMP echo reply, id 26133, seq 1, length 64
19:34:05.757239 IP 192.168.1.101 > 192.168.4.2: ICMP echo request, id 26209, seq 1, length 64
19:34:05.757308 IP 192.168.4.2 > 192.168.1.101: ICMP echo reply, id 26209, seq 1, length 64
19:34:05.767681 IP 192.168.1.101 > 192.168.1.1: ICMP echo request, id 26212, seq 1, length 64
19:34:05.767707 IP 192.168.1.1 > 192.168.1.101: ICMP echo reply, id 26212, seq 1, length 64

19:34:15.848483 ARP, Request who-has 192.168.1.101 tell 192.168.1.1, length 28
19:34:15.848700 ARP, Request who-has 192.168.1.1 tell 192.168.1.101, length 28
19:34:15.848711 ARP, Reply 192.168.1.1 is-at de:39:3f:9d:2e:44 (oui Unknown), length 28
19:34:15.848865 ARP, Reply 192.168.1.101 is-at 66:98:fb:f7:3b:40 (oui Unknown), length 28
19:34:15.911965 IP 192.168.1.101 > 192.168.4.2: ICMP echo request, id 26481, seq 1, length 64
19:34:15.911992 IP 192.168.4.2 > 192.168.1.101: ICMP echo reply, id 26481, seq 1, length 64
19:34:15.923796 IP 192.168.1.101 > 192.168.1.1: ICMP echo request, id 26484, seq 1, length 64
19:34:15.923914 IP 192.168.1.1 > 192.168.1.101: ICMP echo reply, id 26484, seq 1, length 64
19:34:20.978198 IP 192.168.1.101 > 192.168.4.2: ICMP echo request, id 26579, seq 1, length 64
19:34:20.978225 IP 192.168.4.2 > 192.168.1.101: ICMP echo reply, id 26579, seq 1, length 64
19:34:20.987305 IP 192.168.1.101 > 192.168.1.1: ICMP echo request, id 26582, seq 1, length 64
19:34:20.987326 IP 192.168.1.1 > 192.168.1.101: ICMP echo reply, id 26582, seq 1, length 64
19:34:26.039619 IP 192.168.1.101 > 192.168.4.2: ICMP echo request, id 26675, seq 1, length 64
19:34:26.039643 IP 192.168.4.2 > 192.168.1.101: ICMP echo reply, id 26675, seq 1, length 64
19:34:26.049085 IP 192.168.1.101 > 192.168.1.1: ICMP echo request, id 26678, seq 1, length 64
19:34:26.049109 IP 192.168.1.1 > 192.168.1.101: ICMP echo reply, id 26678, seq 1, length 64
19:34:31.123040 IP 192.168.1.101 > 192.168.4.2: ICMP echo request, id 26827, seq 1, length 64
19:34:31.123069 IP 192.168.4.2 > 192.168.1.101: ICMP echo reply, id 26827, seq 1, length 64
19:34:31.155217 IP 192.168.1.101 > 192.168.1.1: ICMP echo request, id 26835, seq 1, length 64
19:34:31.155287 IP 192.168.1.1 > 192.168.1.101: ICMP echo reply, id 26835, seq 1, length 64
19:34:36.214197 IP 192.168.1.101 > 192.168.4.2: ICMP echo request, id 26927, seq 1, length 64
19:34:36.214225 IP 192.168.4.2 > 192.168.1.101: ICMP echo reply, id 26927, seq 1, length 64
19:34:36.226528 IP 192.168.1.101 > 192.168.1.1: ICMP echo request, id 26930, seq 1, length 64
19:34:36.226557 IP 192.168.1.1 > 192.168.1.101: ICMP echo reply, id 26930, seq 1, length 64

19:34:41.278739 IP 192.168.1.101 > 192.168.4.2: ICMP echo request, id 27106, seq 1, length 64
19:34:41.278769 IP 192.168.4.2 > 192.168.1.101: ICMP echo reply, id 27106, seq 1, length 64
19:34:41.287197 IP 192.168.1.101 > 192.168.1.1: ICMP echo request, id 27109, seq 1, length 64
19:34:41.287220 IP 192.168.1.1 > 192.168.1.101: ICMP echo reply, id 27109, seq 1, length 64
19:34:46.342053 IP 192.168.1.101 > 192.168.4.2: ICMP echo request, id 27220, seq 1, length 64
19:34:46.342085 IP 192.168.4.2 > 192.168.1.101: ICMP echo reply, id 27220, seq 1, length 64
19:34:46.353308 IP 192.168.1.101 > 192.168.1.1: ICMP echo request, id 27223, seq 1, length 64
19:34:46.353371 IP 192.168.1.1 > 192.168.1.101: ICMP echo reply, id 27223, seq 1, length 64
19:34:51.352504 ARP, Request who-has 192.168.1.101 tell 192.168.1.1, length 28
19:34:51.352806 ARP, Reply 192.168.1.101 is-at 66:98:fb:f7:3b:40 (oui Unknown), length 28
19:34:51.419126 IP 192.168.1.101 > 192.168.4.2: ICMP echo request, id 27319, seq 1, length 64
19:34:51.419156 IP 192.168.4.2 > 192.168.1.101: ICMP echo reply, id 27319, seq 1, length 64
19:34:51.430273 IP 192.168.1.101 > 192.168.1.1: ICMP echo request, id 27322, seq 1, length 64
19:34:51.430341 IP 192.168.1.1 > 192.168.1.101: ICMP echo reply, id 27322, seq 1, length 64
19:34:56.486431 IP 192.168.1.101 > 192.168.4.2: ICMP echo request, id 27418, seq 1, length 64
19:34:56.486460 IP 192.168.4.2 > 192.168.1.101: ICMP echo reply, id 27418, seq 1, length 64
19:34:56.496311 IP 192.168.1.101 > 192.168.1.1: ICMP echo request, id 27421, seq 1, length 64
19:34:56.496333 IP 192.168.1.1 > 192.168.1.101: ICMP echo reply, id 27421, seq 1, length 64
19:35:01.548153 IP 192.168.1.101 > 192.168.4.2: ICMP echo request, id 27527, seq 1, length 64
19:35:01.548180 IP 192.168.4.2 > 192.168.1.101: ICMP echo reply, id 27527, seq 1, length 64
19:35:01.558974 IP 192.168.1.101 > 192.168.1.1: ICMP echo request, id 27530, seq 1, length 64
19:35:01.559002 IP 192.168.1.1 > 192.168.1.101: ICMP echo reply, id 27530, seq 1, length 64
19:35:06.552456 ARP, Request who-has 192.168.1.1 tell 192.168.1.101, length 28
19:35:06.552577 ARP, Reply 192.168.1.1 is-at de:39:3f:9d:2e:44 (oui Unknown), length 28
19:35:06.615826 IP 192.168.1.101 > 192.168.4.2: ICMP echo request, id 27676, seq 1, length 64
19:35:06.615853 IP 192.168.4.2 > 192.168.1.101: ICMP echo reply, id 27676, seq 1, length 64
19:35:06.626309 IP 192.168.1.101 > 192.168.1.1: ICMP echo request, id 27679, seq 1, length 64
19:35:06.626337 IP 192.168.1.1 > 192.168.1.101: ICMP echo reply, id 27679, seq 1, length 64

19:35:11.678315 IP 192.168.1.101 > 192.168.4.2: ICMP echo request, id 27810, seq 1, length 64
19:35:11.678340 IP 192.168.4.2 > 192.168.1.101: ICMP echo reply, id 27810, seq 1, length 64
19:35:11.685179 IP 192.168.1.101 > 192.168.1.1: ICMP echo request, id 27813, seq 1, length 64
19:35:11.685200 IP 192.168.1.1 > 192.168.1.101: ICMP echo reply, id 27813, seq 1, length 64
19:35:16.743364 IP 192.168.1.101 > 192.168.4.2: ICMP echo request, id 27960, seq 1, length 64
19:35:16.743390 IP 192.168.4.2 > 192.168.1.101: ICMP echo reply, id 27960, seq 1, length 64
19:35:16.752599 IP 192.168.1.101 > 192.168.1.1: ICMP echo request, id 27963, seq 1, length 64
19:35:16.752622 IP 192.168.1.1 > 192.168.1.101: ICMP echo reply, id 27963, seq 1, length 64
19:35:21.802746 IP 192.168.1.101 > 192.168.4.2: ICMP echo request, id 28059, seq 1, length 64
19:35:21.802775 IP 192.168.4.2 > 192.168.1.101: ICMP echo reply, id 28059, seq 1, length 64
19:35:21.812213 IP 192.168.1.101 > 192.168.1.1: ICMP echo request, id 28062, seq 1, length 64
19:35:21.812312 IP 192.168.1.1 > 192.168.1.101: ICMP echo reply, id 28062, seq 1, length 64
19:35:26.808534 ARP, Request who-has 192.168.1.101 tell 192.168.1.1, length 28
19:35:26.808968 ARP, Reply 192.168.1.101 is-at 66:98:fb:f7:3b:40 (oui Unknown), length 28
19:35:26.864470 IP 192.168.1.101 > 192.168.4.2: ICMP echo request, id 28161, seq 1, length 64
19:35:26.864590 IP 192.168.4.2 > 192.168.1.101: ICMP echo reply, id 28161, seq 1, length 64
19:35:26.874902 IP 192.168.1.101 > 192.168.1.1: ICMP echo request, id 28164, seq 1, length 64
19:35:26.874979 IP 192.168.1.1 > 192.168.1.101: ICMP echo reply, id 28164, seq 1, length 64
19:35:31.932933 IP 192.168.1.101 > 192.168.4.2: ICMP echo request, id 28260, seq 1, length 64
19:35:31.932960 IP 192.168.4.2 > 192.168.1.101: ICMP echo reply, id 28260, seq 1, length 64
19:35:31.942345 IP 192.168.1.101 > 192.168.1.1: ICMP echo request, id 28263, seq 1, length 64
19:35:31.942369 IP 192.168.1.1 > 192.168.1.101: ICMP echo reply, id 28263, seq 1, length 64
19:35:36.996973 IP 192.168.1.101 > 192.168.4.2: ICMP echo request, id 28408, seq 1, length 64
19:35:36.997033 IP 192.168.4.2 > 192.168.1.101: ICMP echo reply, id 28408, seq 1, length 64
19:35:37.007260 IP 192.168.1.101 > 192.168.1.1: ICMP echo request, id 28411, seq 1, length 64
19:35:37.007284 IP 192.168.1.1 > 192.168.1.101: ICMP echo reply, id 28411, seq 1, length 64

19:35:42.062979 IP 192.168.1.101 > 192.168.4.2: ICMP echo request, id 28529, seq 1, length 64
19:35:42.063004 IP 192.168.4.2 > 192.168.1.101: ICMP echo reply, id 28529, seq 1, length 64
19:35:42.072495 IP 192.168.1.101 > 192.168.1.1: ICMP echo request, id 28532, seq 1, length 64
19:35:42.072635 IP 192.168.1.1 > 192.168.1.101: ICMP echo reply, id 28532, seq 1, length 64
19:35:47.064676 ARP, Request who-has 192.168.1.1 tell 192.168.1.101, length 28
19:35:47.064747 ARP, Reply 192.168.1.1 is-at de:39:3f:9d:2e:44 (oui Unknown), length 28
19:35:47.125743 IP 192.168.1.101 > 192.168.4.2: ICMP echo request, id 28690, seq 1, length 64
19:35:47.125770 IP 192.168.4.2 > 192.168.1.101: ICMP echo reply, id 28690, seq 1, length 64
19:35:47.134887 IP 192.168.1.101 > 192.168.1.1: ICMP echo request, id 28693, seq 1, length 64
19:35:47.134913 IP 192.168.1.1 > 192.168.1.101: ICMP echo reply, id 28693, seq 1, length 64
19:35:52.186429 IP 192.168.1.101 > 192.168.4.2: ICMP echo request, id 28798, seq 1, length 64
19:35:52.186455 IP 192.168.4.2 > 192.168.1.101: ICMP echo reply, id 28798, seq 1, length 64
19:35:52.196043 IP 192.168.1.101 > 192.168.1.1: ICMP echo request, id 28801, seq 1, length 64
19:35:52.196068 IP 192.168.1.1 > 192.168.1.101: ICMP echo reply, id 28801, seq 1, length 64
19:35:57.246744 IP 192.168.1.101 > 192.168.4.2: ICMP echo request, id 28895, seq 1, length 64
19:35:57.246772 IP 192.168.4.2 > 192.168.1.101: ICMP echo reply, id 28895, seq 1, length 64
19:35:57.256389 IP 192.168.1.101 > 192.168.1.1: ICMP echo request, id 28898, seq 1, length 64
19:35:57.256416 IP 192.168.1.1 > 192.168.1.101: ICMP echo reply, id 28898, seq 1, length 64
19:36:02.248244 ARP, Request who-has 192.168.1.101 tell 192.168.1.1, length 28
19:36:02.248634 ARP, Reply 192.168.1.101 is-at 66:98:fb:f7:3b:40 (oui Unknown), length 28
19:36:02.306344 IP 192.168.1.101 > 192.168.4.2: ICMP echo request, id 28993, seq 1, length 64
19:36:02.306371 IP 192.168.4.2 > 192.168.1.101: ICMP echo reply, id 28993, seq 1, length 64
19:36:02.317613 IP 192.168.1.101 > 192.168.1.1: ICMP echo request, id 28996, seq 1, length 64
19:36:02.317641 IP 192.168.1.1 > 192.168.1.101: ICMP echo reply, id 28996, seq 1, length 64
19:36:07.373019 IP 192.168.1.101 > 192.168.4.2: ICMP echo request, id 29113, seq 1, length 64
19:36:07.373048 IP 192.168.4.2 > 192.168.1.101: ICMP echo reply, id 29113, seq 1, length 64
19:36:07.383021 IP 192.168.1.101 > 192.168.1.1: ICMP echo request, id 29116, seq 1, length 64
19:36:07.383046 IP 192.168.1.1 > 192.168.1.101: ICMP echo reply, id 29116, seq 1, length 64

19:36:12.443437 IP 192.168.1.101 > 192.168.4.2: ICMP echo request, id 29263, seq 1, length 64
19:36:12.443464 IP 192.168.4.2 > 192.168.1.101: ICMP echo reply, id 29263, seq 1, length 64
19:36:12.452665 IP 192.168.1.101 > 192.168.1.1: ICMP echo request, id 29266, seq 1, length 64
19:36:12.452686 IP 192.168.1.1 > 192.168.1.101: ICMP echo reply, id 29266, seq 1, length 64
19:36:17.522016 IP 192.168.1.101 > 192.168.4.2: ICMP echo request, id 29386, seq 1, length 64
19:36:17.522069 IP 192.168.4.2 > 192.168.1.101: ICMP echo reply, id 29386, seq 1, length 64
19:36:17.541677 IP 192.168.1.101 > 192.168.1.1: ICMP echo request, id 29391, seq 1, length 64
19:36:17.541699 IP 192.168.1.1 > 192.168.1.101: ICMP echo reply, id 29391, seq 1, length 64
19:36:22.600193 IP 192.168.1.101 > 192.168.4.2: ICMP echo request, id 29517, seq 1, length 64
19:36:22.600220 IP 192.168.4.2 > 192.168.1.101: ICMP echo reply, id 29517, seq 1, length 64
19:36:22.609291 IP 192.168.1.101 > 192.168.1.1: ICMP echo request, id 29520, seq 1, length 64
19:36:22.609312 IP 192.168.1.1 > 192.168.1.101: ICMP echo reply, id 29520, seq 1, length 64
19:36:27.608505 ARP, Request who-has 192.168.1.1 tell 192.168.1.101, length 28
19:36:27.608527 ARP, Reply 192.168.1.1 is-at de:39:3f:9d:2e:44 (oui Unknown), length 28
19:36:27.660160 IP 192.168.1.101 > 192.168.4.2: ICMP echo request, id 29613, seq 1, length 64
19:36:27.660186 IP 192.168.4.2 > 192.168.1.101: ICMP echo reply, id 29613, seq 1, length 64
19:36:27.670757 IP 192.168.1.101 > 192.168.1.1: ICMP echo request, id 29616, seq 1, length 64
19:36:27.670889 IP 192.168.1.1 > 192.168.1.101: ICMP echo reply, id 29616, seq 1, length 64
19:36:32.725696 IP 192.168.1.101 > 192.168.4.2: ICMP echo request, id 29711, seq 1, length 64
19:36:32.725726 IP 192.168.4.2 > 192.168.1.101: ICMP echo reply, id 29711, seq 1, length 64
19:36:32.734819 IP 192.168.1.101 > 192.168.1.1: ICMP echo request, id 29714, seq 1, length 64
19:36:32.734842 IP 192.168.1.1 > 192.168.1.101: ICMP echo reply, id 29714, seq 1, length 64
19:36:37.736254 ARP, Request who-has 192.168.1.101 tell 192.168.1.1, length 28
19:36:37.736521 ARP, Reply 192.168.1.101 is-at 66:98:fb:f7:3b:40 (oui Unknown), length 28
19:36:37.787074 IP 192.168.1.101 > 192.168.4.2: ICMP echo request, id 29807, seq 1, length 64
19:36:37.787104 IP 192.168.4.2 > 192.168.1.101: ICMP echo reply, id 29807, seq 1, length 64
19:36:37.798026 IP 192.168.1.101 > 192.168.1.1: ICMP echo request, id 29810, seq 1, length 64
19:36:37.798053 IP 192.168.1.1 > 192.168.1.101: ICMP echo reply, id 29810, seq 1, length 64

19:36:42.850640 IP 192.168.1.101 > 192.168.4.2: ICMP echo request, id 29917, seq 1, length 64
19:36:42.850664 IP 192.168.4.2 > 192.168.1.101: ICMP echo reply, id 29917, seq 1, length 64
19:36:42.855804 IP 192.168.1.101 > 192.168.1.1: ICMP echo request, id 29920, seq 1, length 64
19:36:42.855826 IP 192.168.1.1 > 192.168.1.101: ICMP echo reply, id 29920, seq 1, length 64
19:36:47.913291 IP 192.168.1.101 > 192.168.4.2: ICMP echo request, id 30013, seq 1, length 64
19:36:47.913320 IP 192.168.4.2 > 192.168.1.101: ICMP echo reply, id 30013, seq 1, length 64
19:36:47.925967 IP 192.168.1.101 > 192.168.1.1: ICMP echo request, id 30016, seq 1, length 64
19:36:47.925990 IP 192.168.1.1 > 192.168.1.101: ICMP echo reply, id 30016, seq 1, length 64
19:36:52.978142 IP 192.168.1.101 > 192.168.4.2: ICMP echo request, id 30121, seq 1, length 64
19:36:52.978165 IP 192.168.4.2 > 192.168.1.101: ICMP echo reply, id 30121, seq 1, length 64
19:36:52.986679 IP 192.168.1.101 > 192.168.1.1: ICMP echo request, id 30124, seq 1, length 64
19:36:52.986699 IP 192.168.1.1 > 192.168.1.101: ICMP echo reply, id 30124, seq 1, length 64
19:36:58.035738 IP 192.168.1.101 > 192.168.4.2: ICMP echo request, id 30267, seq 1, length 64
19:36:58.035765 IP 192.168.4.2 > 192.168.1.101: ICMP echo reply, id 30267, seq 1, length 64
19:36:58.044465 IP 192.168.1.101 > 192.168.1.1: ICMP echo request, id 30270, seq 1, length 64
19:36:58.044487 IP 192.168.1.1 > 192.168.1.101: ICMP echo reply, id 30270, seq 1, length 64
19:37:03.096554 IP 192.168.1.101 > 192.168.4.2: ICMP echo request, id 30375, seq 1, length 64
19:37:03.096579 IP 192.168.4.2 > 192.168.1.101: ICMP echo reply, id 30375, seq 1, length 64
19:37:03.105682 IP 192.168.1.101 > 192.168.1.1: ICMP echo request, id 30378, seq 1, length 64
19:37:03.105703 IP 192.168.1.1 > 192.168.1.101: ICMP echo reply, id 30378, seq 1, length 64
19:37:08.105171 ARP, Request who-has 192.168.1.1 tell 192.168.1.101, length 28
19:37:08.105198 ARP, Reply 192.168.1.1 is-at de:39:3f:9d:2e:44 (oui Unknown), length 28
19:37:08.154579 IP 192.168.1.101 > 192.168.4.2: ICMP echo request, id 30521, seq 1, length 64
19:37:08.154609 IP 192.168.4.2 > 192.168.1.101: ICMP echo reply, id 30521, seq 1, length 64
19:37:08.165146 IP 192.168.1.101 > 192.168.1.1: ICMP echo request, id 30524, seq 1, length 64
19:37:08.165174 IP 192.168.1.1 > 192.168.1.101: ICMP echo reply, id 30524, seq 1, length 64

19:37:13.160514 ARP, Request who-has 192.168.1.101 tell 192.168.1.1, length 28
19:37:13.160940 ARP, Reply 192.168.1.101 is-at 66:98:fb:f7:3b:40 (oui Unknown), length 28
19:37:13.222146 IP 192.168.1.101 > 192.168.4.2: ICMP echo request, id 30631, seq 1, length 64
19:37:13.222180 IP 192.168.4.2 > 192.168.1.101: ICMP echo reply, id 30631, seq 1, length 64
19:37:13.233016 IP 192.168.1.101 > 192.168.1.1: ICMP echo request, id 30634, seq 1, length 64
19:37:13.233041 IP 192.168.1.1 > 192.168.1.101: ICMP echo reply, id 30634, seq 1, length 64
19:37:18.285147 IP 192.168.1.101 > 192.168.4.2: ICMP echo request, id 30727, seq 1, length 64
19:37:18.285172 IP 192.168.4.2 > 192.168.1.101: ICMP echo reply, id 30727, seq 1, length 64
19:37:18.293608 IP 192.168.1.101 > 192.168.1.1: ICMP echo request, id 30730, seq 1, length 64
19:37:18.293626 IP 192.168.1.1 > 192.168.1.101: ICMP echo reply, id 30730, seq 1, length 64
19:37:23.341723 IP 192.168.1.101 > 192.168.4.2: ICMP echo request, id 30825, seq 1, length 64
19:37:23.341745 IP 192.168.4.2 > 192.168.1.101: ICMP echo reply, id 30825, seq 1, length 64
19:37:23.350246 IP 192.168.1.101 > 192.168.1.1: ICMP echo request, id 30828, seq 1, length 64
19:37:23.350264 IP 192.168.1.1 > 192.168.1.101: ICMP echo reply, id 30828, seq 1, length 64
19:37:28.393870 IP 192.168.1.101 > 192.168.4.2: ICMP echo request, id 30930, seq 1, length 64
19:37:28.393891 IP 192.168.4.2 > 192.168.1.101: ICMP echo reply, id 30930, seq 1, length 64
19:37:28.402635 IP 192.168.1.101 > 192.168.1.1: ICMP echo request, id 30933, seq 1, length 64
19:37:28.402655 IP 192.168.1.1 > 192.168.1.101: ICMP echo reply, id 30933, seq 1, length 64
19:37:33.449676 IP 192.168.1.101 > 192.168.4.2: ICMP echo request, id 31028, seq 1, length 64
19:37:33.449699 IP 192.168.4.2 > 192.168.1.101: ICMP echo reply, id 31028, seq 1, length 64
19:37:33.458487 IP 192.168.1.101 > 192.168.1.1: ICMP echo request, id 31031, seq 1, length 64
19:37:33.458509 IP 192.168.1.1 > 192.168.1.101: ICMP echo reply, id 31031, seq 1, length 64
19:37:38.506808 IP 192.168.1.101 > 192.168.4.2: ICMP echo request, id 31144, seq 1, length 64
19:37:38.506832 IP 192.168.4.2 > 192.168.1.101: ICMP echo reply, id 31144, seq 1, length 64
19:37:38.516246 IP 192.168.1.101 > 192.168.1.1: ICMP echo request, id 31147, seq 1, length 64
19:37:38.516268 IP 192.168.1.1 > 192.168.1.101: ICMP echo reply, id 31147, seq 1, length 64

19:37:43.570380 IP 192.168.1.101 > 192.168.4.2: ICMP echo request, id 31294, seq 1, length 64
19:37:43.570411 IP 192.168.4.2 > 192.168.1.101: ICMP echo reply, id 31294, seq 1, length 64
19:37:43.582156 IP 192.168.1.101 > 192.168.1.1: ICMP echo request, id 31297, seq 1, length 64
19:37:43.582180 IP 192.168.1.1 > 192.168.1.101: ICMP echo reply, id 31297, seq 1, length 64
19:37:48.584261 ARP, Request who-has 192.168.1.101 tell 192.168.1.1, length 28
19:37:48.584544 ARP, Request who-has 192.168.1.1 tell 192.168.1.101, length 28
19:37:48.584555 ARP, Reply 192.168.1.1 is-at de:39:3f:9d:2e:44 (oui Unknown), length 28
19:37:48.584645 ARP, Reply 192.168.1.101 is-at 66:98:fb:f7:3b:40 (oui Unknown), length 28
19:37:48.629808 IP 192.168.1.101 > 192.168.4.2: ICMP echo request, id 31410, seq 1, length 64
19:37:48.629831 IP 192.168.4.2 > 192.168.1.101: ICMP echo reply, id 31410, seq 1, length 64
19:37:48.638490 IP 192.168.1.101 > 192.168.1.1: ICMP echo request, id 31413, seq 1, length 64
19:37:48.638510 IP 192.168.1.1 > 192.168.1.101: ICMP echo reply, id 31413, seq 1, length 64
19:37:53.687133 IP 192.168.1.101 > 192.168.4.2: ICMP echo request, id 31548, seq 1, length 64
19:37:53.687156 IP 192.168.4.2 > 192.168.1.101: ICMP echo reply, id 31548, seq 1, length 64
19:37:53.695379 IP 192.168.1.101 > 192.168.1.1: ICMP echo request, id 31551, seq 1, length 64
19:37:53.695399 IP 192.168.1.1 > 192.168.1.101: ICMP echo reply, id 31551, seq 1, length 64
19:37:58.743614 IP 192.168.1.101 > 192.168.4.2: ICMP echo request, id 31644, seq 1, length 64
19:37:58.743637 IP 192.168.4.2 > 192.168.1.101: ICMP echo reply, id 31644, seq 1, length 64
19:37:58.751853 IP 192.168.1.101 > 192.168.1.1: ICMP echo request, id 31647, seq 1, length 64
19:37:58.751872 IP 192.168.1.1 > 192.168.1.101: ICMP echo reply, id 31647, seq 1, length 64
19:38:03.802494 IP 192.168.1.101 > 192.168.4.2: ICMP echo request, id 31742, seq 1, length 64
19:38:03.802519 IP 192.168.4.2 > 192.168.1.101: ICMP echo reply, id 31742, seq 1, length 64
19:38:03.810640 IP 192.168.1.101 > 192.168.1.1: ICMP echo request, id 31745, seq 1, length 64
19:38:03.810663 IP 192.168.1.1 > 192.168.1.101: ICMP echo reply, id 31745, seq 1, length 64
19:38:08.872430 IP 192.168.1.101 > 192.168.4.2: ICMP echo request, id 31838, seq 1, length 64
19:38:08.872535 IP 192.168.4.2 > 192.168.1.101: ICMP echo reply, id 31838, seq 1, length 64
19:38:08.881729 IP 192.168.1.101 > 192.168.1.1: ICMP echo request, id 31841, seq 1, length 64
19:38:08.881752 IP 192.168.1.1 > 192.168.1.101: ICMP echo reply, id 31841, seq 1, length 64

19:38:13.929611 IP 192.168.1.101 > 192.168.4.2: ICMP echo request, id 31948, seq 1, length 64
19:38:13.929631 IP 192.168.4.2 > 192.168.1.101: ICMP echo reply, id 31948, seq 1, length 64
19:38:13.937394 IP 192.168.1.101 > 192.168.1.1: ICMP echo request, id 31951, seq 1, length 64
19:38:13.937414 IP 192.168.1.1 > 192.168.1.101: ICMP echo reply, id 31951, seq 1, length 64
19:38:18.981821 IP 192.168.1.101 > 192.168.4.2: ICMP echo request, id 32044, seq 1, length 64
19:38:18.981845 IP 192.168.4.2 > 192.168.1.101: ICMP echo reply, id 32044, seq 1, length 64
19:38:18.989895 IP 192.168.1.101 > 192.168.1.1: ICMP echo request, id 32047, seq 1, length 64
19:38:18.989913 IP 192.168.1.1 > 192.168.1.101: ICMP echo reply, id 32047, seq 1, length 64
19:38:23.992358 ARP, Request who-has 192.168.1.101 tell 192.168.1.1, length 28
19:38:23.992784 ARP, Reply 192.168.1.101 is-at 66:98:fb:f7:3b:40 (oui Unknown), length 28
19:38:24.037593 IP 192.168.1.101 > 192.168.4.2: ICMP echo request, id 32142, seq 1, length 64
19:38:24.037615 IP 192.168.4.2 > 192.168.1.101: ICMP echo reply, id 32142, seq 1, length 64
19:38:24.045974 IP 192.168.1.101 > 192.168.1.1: ICMP echo request, id 32145, seq 1, length 64
19:38:24.045992 IP 192.168.1.1 > 192.168.1.101: ICMP echo reply, id 32145, seq 1, length 64
19:38:29.048896 ARP, Request who-has 192.168.1.1 tell 192.168.1.101, length 28
19:38:29.048918 ARP, Reply 192.168.1.1 is-at de:39:3f:9d:2e:44 (oui Unknown), length 28
19:38:29.094484 IP 192.168.1.101 > 192.168.4.2: ICMP echo request, id 32298, seq 1, length 64
19:38:29.094551 IP 192.168.4.2 > 192.168.1.101: ICMP echo reply, id 32298, seq 1, length 64
19:38:29.102886 IP 192.168.1.101 > 192.168.1.1: ICMP echo request, id 32301, seq 1, length 64
19:38:29.102903 IP 192.168.1.1 > 192.168.1.101: ICMP echo reply, id 32301, seq 1, length 64
19:38:34.150678 IP 192.168.1.101 > 192.168.4.2: ICMP echo request, id 32396, seq 1, length 64
19:38:34.150701 IP 192.168.4.2 > 192.168.1.101: ICMP echo reply, id 32396, seq 1, length 64
19:38:34.159910 IP 192.168.1.101 > 192.168.1.1: ICMP echo request, id 32399, seq 1, length 64
19:38:34.159932 IP 192.168.1.1 > 192.168.1.101: ICMP echo reply, id 32399, seq 1, length 64
19:38:39.211652 IP 192.168.1.101 > 192.168.4.2: ICMP echo request, id 32552, seq 1, length 64
19:38:39.211676 IP 192.168.4.2 > 192.168.1.101: ICMP echo reply, id 32552, seq 1, length 64
19:38:39.220632 IP 192.168.1.101 > 192.168.1.1: ICMP echo request, id 32555, seq 1, length 64
19:38:39.220651 IP 192.168.1.1 > 192.168.1.101: ICMP echo reply, id 32555, seq 1, length 64

19:38:44.271927 IP 192.168.1.101 > 192.168.4.2: ICMP echo request, id 32662, seq 1, length 64
19:38:44.271948 IP 192.168.4.2 > 192.168.1.101: ICMP echo reply, id 32662, seq 1, length 64
19:38:44.280596 IP 192.168.1.101 > 192.168.1.1: ICMP echo request, id 32665, seq 1, length 64
19:38:44.280618 IP 192.168.1.1 > 192.168.1.101: ICMP echo reply, id 32665, seq 1, length 64
19:38:49.326737 IP 192.168.1.101 > 192.168.4.2: ICMP echo request, id 32758, seq 1, length 64
19:38:49.326760 IP 192.168.4.2 > 192.168.1.101: ICMP echo reply, id 32758, seq 1, length 64
19:38:49.334860 IP 192.168.1.101 > 192.168.1.1: ICMP echo request, id 32761, seq 1, length 64
19:38:49.334880 IP 192.168.1.1 > 192.168.1.101: ICMP echo reply, id 32761, seq 1, length 64
19:38:54.402916 IP 192.168.1.101 > 192.168.4.2: ICMP echo request, id 391, seq 1, length 64
19:38:54.402938 IP 192.168.4.2 > 192.168.1.101: ICMP echo reply, id 391, seq 1, length 64
19:38:54.412533 IP 192.168.1.101 > 192.168.1.1: ICMP echo request, id 394, seq 1, length 64
19:38:54.412629 IP 192.168.1.1 > 192.168.1.101: ICMP echo reply, id 394, seq 1, length 64
19:38:59.416283 ARP, Request who-has 192.168.1.101 tell 192.168.1.1, length 28
19:38:59.420427 ARP, Reply 192.168.1.101 is-at 66:98:fb:f7:3b:40 (oui Unknown), length 28
19:38:59.488489 IP 192.168.1.101 > 192.168.4.2: ICMP echo request, id 456, seq 1, length 64
19:38:59.488507 IP 192.168.4.2 > 192.168.1.101: ICMP echo reply, id 456, seq 1, length 64
19:38:59.514200 IP 192.168.1.101 > 192.168.1.1: ICMP echo request, id 462, seq 1, length 64
19:38:59.514222 IP 192.168.1.1 > 192.168.1.101: ICMP echo reply, id 462, seq 1, length 64
19:39:04.616779 IP 192.168.1.101 > 192.168.4.2: ICMP echo request, id 529, seq 1, length 64
19:39:04.616802 IP 192.168.4.2 > 192.168.1.101: ICMP echo reply, id 529, seq 1, length 64
19:39:04.627601 IP 192.168.1.101 > 192.168.1.1: ICMP echo request, id 532, seq 1, length 64
19:39:04.627626 IP 192.168.1.1 > 192.168.1.101: ICMP echo reply, id 532, seq 1, length 64
19:39:09.624508 ARP, Request who-has 192.168.1.1 tell 192.168.1.101, length 28
19:39:09.624530 ARP, Reply 192.168.1.1 is-at de:39:3f:9d:2e:44 (oui Unknown), length 28
19:39:09.734868 IP 192.168.1.101 > 192.168.4.2: ICMP echo request, id 627, seq 1, length 64
19:39:09.734892 IP 192.168.4.2 > 192.168.1.101: ICMP echo reply, id 627, seq 1, length 64
19:39:09.744571 IP 192.168.1.101 > 192.168.1.1: ICMP echo request, id 630, seq 1, length 64
19:39:09.744594 IP 192.168.1.1 > 192.168.1.101: ICMP echo reply, id 630, seq 1, length 64

19:39:14.795069 IP 192.168.1.101 > 192.168.4.2: ICMP echo request, id 797, seq 1, length 64
19:39:14.795090 IP 192.168.4.2 > 192.168.1.101: ICMP echo reply, id 797, seq 1, length 64
19:39:14.803596 IP 192.168.1.101 > 192.168.1.1: ICMP echo request, id 800, seq 1, length 64
19:39:14.803615 IP 192.168.1.1 > 192.168.1.101: ICMP echo reply, id 800, seq 1, length 64
19:39:19.852190 IP 192.168.1.101 > 192.168.4.2: ICMP echo request, id 902, seq 1, length 64
19:39:19.852213 IP 192.168.4.2 > 192.168.1.101: ICMP echo reply, id 902, seq 1, length 64
19:39:19.860604 IP 192.168.1.101 > 192.168.1.1: ICMP echo request, id 905, seq 1, length 64
19:39:19.860621 IP 192.168.1.1 > 192.168.1.101: ICMP echo reply, id 905, seq 1, length 64

