14:08:02.442196 ARP, Request who-has 192.168.2.10 tell 192.168.2.1, length 28
14:08:02.443485 ARP, Reply 192.168.2.10 is-at 6a:24:68:8d:86:c9 (oui Unknown), length 28
14:08:02.506639 ARP, Request who-has 192.168.2.1 tell 192.168.2.3, length 28
14:08:02.506646 ARP, Reply 192.168.2.1 is-at 12:af:d3:99:19:77 (oui Unknown), length 28
14:08:09.719567 ARP, Request who-has 192.168.2.1 tell 192.168.2.11, length 28
14:08:09.719586 ARP, Reply 192.168.2.1 is-at 12:af:d3:99:19:77 (oui Unknown), length 28
14:08:09.720489 IP 192.168.2.11 > 192.168.4.2: ICMP echo request, id 18641, seq 1, length 64
14:08:09.720497 IP 192.168.4.2 > 192.168.2.11: ICMP echo reply, id 18641, seq 1, length 64
14:08:09.722649 ARP, Request who-has 192.168.2.1 tell 192.168.2.12, length 28
14:08:09.722661 ARP, Reply 192.168.2.1 is-at 12:af:d3:99:19:77 (oui Unknown), length 28
14:08:09.723561 IP 192.168.2.12 > 192.168.4.2: ICMP echo request, id 18642, seq 1, length 64
14:08:09.723568 IP 192.168.4.2 > 192.168.2.12: ICMP echo reply, id 18642, seq 1, length 64
14:08:09.725927 ARP, Request who-has 192.168.2.1 tell 192.168.2.13, length 28
14:08:09.725938 ARP, Reply 192.168.2.1 is-at 12:af:d3:99:19:77 (oui Unknown), length 28
14:08:09.726906 IP 192.168.2.13 > 192.168.4.2: ICMP echo request, id 18643, seq 1, length 64
14:08:09.726916 IP 192.168.4.2 > 192.168.2.13: ICMP echo reply, id 18643, seq 1, length 64
14:08:09.729193 ARP, Request who-has 192.168.2.1 tell 192.168.2.14, length 28
14:08:09.729209 ARP, Reply 192.168.2.1 is-at 12:af:d3:99:19:77 (oui Unknown), length 28
14:08:09.730154 IP 192.168.2.14 > 192.168.4.2: ICMP echo request, id 18644, seq 1, length 64
14:08:09.730164 IP 192.168.4.2 > 192.168.2.14: ICMP echo reply, id 18644, seq 1, length 64
14:08:09.732443 ARP, Request who-has 192.168.2.1 tell 192.168.2.15, length 28
14:08:09.732459 ARP, Reply 192.168.2.1 is-at 12:af:d3:99:19:77 (oui Unknown), length 28
14:08:09.733233 IP 192.168.2.15 > 192.168.4.2: ICMP echo request, id 18645, seq 1, length 64
14:08:09.733255 IP 192.168.4.2 > 192.168.2.15: ICMP echo reply, id 18645, seq 1, length 64
14:08:09.735379 ARP, Request who-has 192.168.2.1 tell 192.168.2.16, length 28
14:08:09.735391 ARP, Reply 192.168.2.1 is-at 12:af:d3:99:19:77 (oui Unknown), length 28
14:08:09.736241 IP 192.168.2.16 > 192.168.4.2: ICMP echo request, id 18646, seq 1, length 64
14:08:09.736248 IP 192.168.4.2 > 192.168.2.16: ICMP echo reply, id 18646, seq 1, length 64
14:08:09.738797 ARP, Request who-has 192.168.2.1 tell 192.168.2.17, length 28
14:08:09.738812 ARP, Reply 192.168.2.1 is-at 12:af:d3:99:19:77 (oui Unknown), length 28
14:08:09.739976 IP 192.168.2.17 > 192.168.4.2: ICMP echo request, id 18647, seq 1, length 64
14:08:09.739984 IP 192.168.4.2 > 192.168.2.17: ICMP echo reply, id 18647, seq 1, length 64
14:08:09.807727 ARP, Request who-has 192.168.2.1 tell 192.168.2.2, length 28
14:08:09.807743 ARP, Reply 192.168.2.1 is-at 12:af:d3:99:19:77 (oui Unknown), length 28
14:08:09.808696 IP 192.168.2.2 > 192.168.4.2: ICMP echo request, id 18665, seq 1, length 64
14:08:09.808703 IP 192.168.4.2 > 192.168.2.2: ICMP echo reply, id 18665, seq 1, length 64
14:08:09.810882 IP 192.168.2.3 > 192.168.4.2: ICMP echo request, id 18666, seq 1, length 64
14:08:09.810889 IP 192.168.4.2 > 192.168.2.3: ICMP echo reply, id 18666, seq 1, length 64
14:08:09.812676 IP 192.168.2.1 > 192.168.2.2: ICMP echo request, id 18667, seq 1, length 64
14:08:09.814141 IP 192.168.2.2 > 192.168.2.1: ICMP echo reply, id 18667, seq 1, length 64
14:08:09.815296 IP 192.168.2.1 > 192.168.2.3: ICMP echo request, id 18668, seq 1, length 64
14:08:09.816189 IP 192.168.2.3 > 192.168.2.1: ICMP echo reply, id 18668, seq 1, length 64
14:08:14.512001 ARP, Request who-has 192.168.2.11 tell 192.168.2.9, length 28
14:08:14.516887 ARP, Request who-has 192.168.2.1 tell 192.168.2.9, length 28
14:08:14.516907 ARP, Reply 192.168.2.1 is-at 12:af:d3:99:19:77 (oui Unknown), length 28
14:08:14.517901 IP 192.168.2.9 > 192.168.4.2: ICMP echo request, id 18674, seq 1, length 64
14:08:14.517910 IP 192.168.4.2 > 192.168.2.9: ICMP echo reply, id 18674, seq 1, length 64
14:08:14.521462 ARP, Request who-has 192.168.2.12 tell 192.168.2.9, length 28
14:08:14.525945 ARP, Request who-has 192.168.2.13 tell 192.168.2.9, length 28
14:08:14.530208 ARP, Request who-has 192.168.2.14 tell 192.168.2.9, length 28
14:08:14.534470 ARP, Request who-has 192.168.2.15 tell 192.168.2.9, length 28
14:08:14.539285 ARP, Request who-has 192.168.2.16 tell 192.168.2.9, length 28
14:08:14.544183 ARP, Request who-has 192.168.2.17 tell 192.168.2.9, length 28
14:08:14.549376 ARP, Request who-has 192.168.2.2 tell 192.168.2.9, length 28
14:08:14.554858 ARP, Request who-has 192.168.2.3 tell 192.168.2.9, length 28
14:08:14.561718 IP 192.168.2.9 > 192.168.2.1: ICMP echo request, id 18701, seq 1, length 64
14:08:14.561730 IP 192.168.2.1 > 192.168.2.9: ICMP echo reply, id 18701, seq 1, length 64
14:08:14.730404 ARP, Request who-has 192.168.2.11 tell 192.168.2.1, length 28
14:08:14.730406 ARP, Request who-has 192.168.2.12 tell 192.168.2.1, length 28
14:08:14.730407 ARP, Request who-has 192.168.2.13 tell 192.168.2.1, length 28
14:08:14.730408 ARP, Request who-has 192.168.2.14 tell 192.168.2.1, length 28
14:08:14.731999 ARP, Reply 192.168.2.14 is-at a2:82:09:88:47:bc (oui Unknown), length 28
14:08:14.733039 ARP, Reply 192.168.2.11 is-at 22:ac:c2:4c:3d:e0 (oui Unknown), length 28
14:08:14.733057 ARP, Reply 192.168.2.13 is-at 42:43:39:0a:3c:41 (oui Unknown), length 28
14:08:14.733071 ARP, Reply 192.168.2.12 is-at 5e:a4:77:d0:c9:91 (oui Unknown), length 28
14:08:14.746327 ARP, Request who-has 192.168.2.15 tell 192.168.2.1, length 28
14:08:14.746329 ARP, Request who-has 192.168.2.16 tell 192.168.2.1, length 28
14:08:14.746330 ARP, Request who-has 192.168.2.17 tell 192.168.2.1, length 28
14:08:14.748682 ARP, Reply 192.168.2.16 is-at 02:37:db:44:70:14 (oui Unknown), length 28
14:08:14.748696 ARP, Reply 192.168.2.17 is-at ae:75:d8:e2:b1:c5 (oui Unknown), length 28
14:08:14.748705 ARP, Reply 192.168.2.15 is-at ca:cb:2e:d1:3d:bb (oui Unknown), length 28
14:08:14.810118 ARP, Request who-has 192.168.2.2 tell 192.168.2.1, length 28
14:08:14.811416 ARP, Reply 192.168.2.2 is-at ca:c3:0e:c4:48:0d (oui Unknown), length 28
14:08:19.562123 ARP, Request who-has 192.168.2.9 tell 192.168.2.1, length 28
14:08:19.563807 ARP, Reply 192.168.2.9 is-at 46:17:bc:dd:9e:58 (oui Unknown), length 28
14:08:19.572763 IP 192.168.2.9 > 192.168.4.2: ICMP echo request, id 18767, seq 1, length 64
14:08:19.572774 IP 192.168.4.2 > 192.168.2.9: ICMP echo reply, id 18767, seq 1, length 64
14:08:19.604614 IP 192.168.2.9 > 192.168.2.1: ICMP echo request, id 18796, seq 1, length 64
14:08:19.604624 IP 192.168.2.1 > 192.168.2.9: ICMP echo reply, id 18796, seq 1, length 64
14:08:24.617778 IP 192.168.2.9 > 192.168.4.2: ICMP echo request, id 18872, seq 1, length 64
14:08:24.617788 IP 192.168.4.2 > 192.168.2.9: ICMP echo reply, id 18872, seq 1, length 64
14:08:24.643465 IP 192.168.2.9 > 192.168.2.1: ICMP echo request, id 18899, seq 1, length 64
14:08:24.643474 IP 192.168.2.1 > 192.168.2.9: ICMP echo reply, id 18899, seq 1, length 64

14:08:29.561809 ARP, Request who-has 192.168.2.2 tell 192.168.2.10, length 28
14:08:29.656656 IP 192.168.2.9 > 192.168.4.2: ICMP echo request, id 18986, seq 1, length 64
14:08:29.656665 IP 192.168.4.2 > 192.168.2.9: ICMP echo reply, id 18986, seq 1, length 64
14:08:29.679420 IP 192.168.2.9 > 192.168.2.1: ICMP echo request, id 19013, seq 1, length 64
14:08:29.679430 IP 192.168.2.1 > 192.168.2.9: ICMP echo reply, id 19013, seq 1, length 64
14:08:34.582560 IP 192.168.2.10.50509 > 192.168.4.2.33434: UDP, length 32
14:08:34.582574 IP 192.168.4.2 > 192.168.2.10: ICMP 192.168.4.2 udp port 33434 unreachable, length 68
14:08:34.583772 IP 192.168.2.10.40828 > 192.168.4.2.33435: UDP, length 32
14:08:34.583779 IP 192.168.4.2 > 192.168.2.10: ICMP 192.168.4.2 udp port 33435 unreachable, length 68
14:08:34.585178 IP 192.168.2.10.47073 > 192.168.4.2.33449: UDP, length 32
14:08:34.585185 IP 192.168.4.2 > 192.168.2.10: ICMP 192.168.4.2 udp port 33449 unreachable, length 68
14:08:34.585744 IP 192.168.2.10.38803 > 192.168.4.2.33441: UDP, length 32
14:08:34.585751 IP 192.168.4.2 > 192.168.2.10: ICMP 192.168.4.2 udp port 33441 unreachable, length 68
14:08:34.586236 IP 192.168.2.10.52446 > 192.168.4.2.33447: UDP, length 32
14:08:34.586243 IP 192.168.4.2 > 192.168.2.10: ICMP 192.168.4.2 udp port 33447 unreachable, length 68
14:08:34.587305 IP 192.168.2.10.44670 > 192.168.4.2.33439: UDP, length 32
14:08:34.587313 IP 192.168.4.2 > 192.168.2.10: ICMP 192.168.4.2 udp port 33439 unreachable, length 68
14:08:34.587347 IP 192.168.2.10.49084 > 192.168.4.2.33442: UDP, length 32
14:08:34.587358 IP 192.168.2.10.55114 > 192.168.4.2.33448: UDP, length 32
14:08:34.587367 IP 192.168.2.10.55771 > 192.168.4.2.33437: UDP, length 32
14:08:34.587376 IP 192.168.2.10.50795 > 192.168.4.2.33436: UDP, length 32
14:08:34.587391 IP 192.168.2.10.42617 > 192.168.4.2.33438: UDP, length 32
14:08:34.588660 IP 192.168.2.10.43307 > 192.168.4.2.33445: UDP, length 32
14:08:34.588682 IP 192.168.2.10.33354 > 192.168.4.2.33446: UDP, length 32
14:08:34.588692 IP 192.168.2.10.42898 > 192.168.4.2.33444: UDP, length 32
14:08:34.588702 IP 192.168.2.10.47690 > 192.168.4.2.33440: UDP, length 32
14:08:34.588711 IP 192.168.2.10.40158 > 192.168.4.2.33443: UDP, length 32
14:08:34.692374 IP 192.168.2.9 > 192.168.4.2: ICMP echo request, id 19089, seq 1, length 64
14:08:34.692384 IP 192.168.4.2 > 192.168.2.9: ICMP echo reply, id 19089, seq 1, length 64
14:08:34.716065 IP 192.168.2.9 > 192.168.2.1: ICMP echo request, id 19116, seq 1, length 64
14:08:34.716074 IP 192.168.2.1 > 192.168.2.9: ICMP echo reply, id 19116, seq 1, length 64
14:08:39.594743 ARP, Request who-has 192.168.2.1 tell 192.168.2.10, length 28
14:08:39.594752 ARP, Reply 192.168.2.1 is-at 12:af:d3:99:19:77 (oui Unknown), length 28
14:08:39.599821 ARP, Request who-has 192.168.2.15 tell 192.168.2.10, length 28
14:08:39.725540 IP 192.168.2.9 > 192.168.4.2: ICMP echo request, id 19191, seq 1, length 64
14:08:39.725550 IP 192.168.4.2 > 192.168.2.9: ICMP echo reply, id 19191, seq 1, length 64
14:08:39.750438 IP 192.168.2.9 > 192.168.2.1: ICMP echo request, id 19218, seq 1, length 64
14:08:39.750447 IP 192.168.2.1 > 192.168.2.9: ICMP echo reply, id 19218, seq 1, length 64
14:08:39.755905 ARP, Request who-has 192.168.2.10 tell 192.168.2.9, length 28
14:08:44.610609 ARP, Request who-has 192.168.2.14 tell 192.168.2.10, length 28
14:08:44.768410 IP 192.168.2.9 > 192.168.4.2: ICMP echo request, id 19294, seq 1, length 64
14:08:44.768419 IP 192.168.4.2 > 192.168.2.9: ICMP echo reply, id 19294, seq 1, length 64
14:08:44.793236 IP 192.168.2.9 > 192.168.2.1: ICMP echo request, id 19321, seq 1, length 64
14:08:44.793245 IP 192.168.2.1 > 192.168.2.9: ICMP echo reply, id 19321, seq 1, length 64
14:08:49.621160 ARP, Request who-has 192.168.2.17 tell 192.168.2.10, length 28
14:08:49.633730 ARP, Request who-has 192.168.2.16 tell 192.168.2.10, length 28
14:08:49.810770 IP 192.168.2.9 > 192.168.4.2: ICMP echo request, id 19400, seq 1, length 64
14:08:49.810780 IP 192.168.4.2 > 192.168.2.9: ICMP echo reply, id 19400, seq 1, length 64
14:08:49.837004 IP 192.168.2.9 > 192.168.2.1: ICMP echo request, id 19427, seq 1, length 64
14:08:49.837012 IP 192.168.2.1 > 192.168.2.9: ICMP echo reply, id 19427, seq 1, length 64
14:08:54.642618 ARP, Request who-has 192.168.2.11 tell 192.168.2.10, length 28
14:08:54.851907 IP 192.168.2.9 > 192.168.4.2: ICMP echo request, id 19503, seq 1, length 64
14:08:54.851943 IP 192.168.4.2 > 192.168.2.9: ICMP echo reply, id 19503, seq 1, length 64
14:08:54.876527 IP 192.168.2.9 > 192.168.2.1: ICMP echo request, id 19530, seq 1, length 64
14:08:54.876538 IP 192.168.2.1 > 192.168.2.9: ICMP echo reply, id 19530, seq 1, length 64

14:08:59.798925 ARP, Request who-has 192.168.2.13 tell 192.168.2.10, length 28
14:08:59.831408 ARP, Request who-has 192.168.2.12 tell 192.168.2.10, length 28
14:08:59.944717 IP 192.168.2.9 > 192.168.4.2: ICMP echo request, id 19656, seq 1, length 64
14:08:59.944726 IP 192.168.4.2 > 192.168.2.9: ICMP echo reply, id 19656, seq 1, length 64
14:09:00.243054 IP 192.168.2.9 > 192.168.2.1: ICMP echo request, id 19718, seq 1, length 64
14:09:00.243065 IP 192.168.2.1 > 192.168.2.9: ICMP echo reply, id 19718, seq 1, length 64
14:09:04.958416 ARP, Request who-has 192.168.2.1 tell 192.168.2.9, length 28
14:09:04.958422 ARP, Reply 192.168.2.1 is-at 12:af:d3:99:19:77 (oui Unknown), length 28
14:09:05.374367 IP 192.168.2.9 > 192.168.4.2: ICMP echo request, id 19822, seq 1, length 64
14:09:05.374377 IP 192.168.4.2 > 192.168.2.9: ICMP echo reply, id 19822, seq 1, length 64
14:09:05.543954 IP 192.168.2.9 > 192.168.2.1: ICMP echo request, id 19855, seq 1, length 64
14:09:05.543966 IP 192.168.2.1 > 192.168.2.9: ICMP echo reply, id 19855, seq 1, length 64
14:09:10.378201 ARP, Request who-has 192.168.2.9 tell 192.168.2.1, length 28
14:09:10.378300 ARP, Reply 192.168.2.9 is-at 46:17:bc:dd:9e:58 (oui Unknown), length 28
14:09:10.594512 IP 192.168.2.9 > 192.168.4.2: ICMP echo request, id 19939, seq 1, length 64
14:09:10.594523 IP 192.168.4.2 > 192.168.2.9: ICMP echo reply, id 19939, seq 1, length 64
14:09:10.625672 IP 192.168.2.9 > 192.168.2.1: ICMP echo request, id 19966, seq 1, length 64
14:09:10.625683 IP 192.168.2.1 > 192.168.2.9: ICMP echo reply, id 19966, seq 1, length 64
14:09:15.643077 IP 192.168.2.9 > 192.168.4.2: ICMP echo request, id 20046, seq 1, length 64
14:09:15.643090 IP 192.168.4.2 > 192.168.2.9: ICMP echo reply, id 20046, seq 1, length 64
14:09:15.667433 IP 192.168.2.9 > 192.168.2.1: ICMP echo request, id 20073, seq 1, length 64
14:09:15.667441 IP 192.168.2.1 > 192.168.2.9: ICMP echo reply, id 20073, seq 1, length 64
14:09:20.729065 IP 192.168.2.9 > 192.168.4.2: ICMP echo request, id 20195, seq 1, length 64
14:09:20.729076 IP 192.168.4.2 > 192.168.2.9: ICMP echo reply, id 20195, seq 1, length 64
14:09:21.012856 IP 192.168.2.9 > 192.168.2.1: ICMP echo request, id 20237, seq 1, length 64
14:09:21.012869 IP 192.168.2.1 > 192.168.2.9: ICMP echo reply, id 20237, seq 1, length 64
14:09:26.168441 IP 192.168.2.9 > 192.168.4.2: ICMP echo request, id 20340, seq 1, length 64
14:09:26.168453 IP 192.168.4.2 > 192.168.2.9: ICMP echo reply, id 20340, seq 1, length 64
14:09:26.251780 IP 192.168.2.9 > 192.168.2.1: ICMP echo request, id 20367, seq 1, length 64
14:09:26.251793 IP 192.168.2.1 > 192.168.2.9: ICMP echo reply, id 20367, seq 1, length 64

14:09:31.267920 IP 192.168.2.9 > 192.168.4.2: ICMP echo request, id 20460, seq 1, length 64
14:09:31.267931 IP 192.168.4.2 > 192.168.2.9: ICMP echo reply, id 20460, seq 1, length 64
14:09:31.294354 IP 192.168.2.9 > 192.168.2.1: ICMP echo request, id 20487, seq 1, length 64
14:09:31.294363 IP 192.168.2.1 > 192.168.2.9: ICMP echo reply, id 20487, seq 1, length 64
14:09:36.311957 IP 192.168.2.9 > 192.168.4.2: ICMP echo request, id 20570, seq 1, length 64
14:09:36.311968 IP 192.168.4.2 > 192.168.2.9: ICMP echo reply, id 20570, seq 1, length 64
14:09:36.337289 IP 192.168.2.9 > 192.168.2.1: ICMP echo request, id 20597, seq 1, length 64
14:09:36.337299 IP 192.168.2.1 > 192.168.2.9: ICMP echo reply, id 20597, seq 1, length 64
14:09:41.353669 IP 192.168.2.9 > 192.168.4.2: ICMP echo request, id 20681, seq 1, length 64
14:09:41.353680 IP 192.168.4.2 > 192.168.2.9: ICMP echo reply, id 20681, seq 1, length 64
14:09:41.380496 IP 192.168.2.9 > 192.168.2.1: ICMP echo request, id 20708, seq 1, length 64
14:09:41.380506 IP 192.168.2.1 > 192.168.2.9: ICMP echo reply, id 20708, seq 1, length 64
14:09:46.397678 IP 192.168.2.9 > 192.168.4.2: ICMP echo request, id 20790, seq 1, length 64
14:09:46.397689 IP 192.168.4.2 > 192.168.2.9: ICMP echo reply, id 20790, seq 1, length 64
14:09:46.422025 IP 192.168.2.9 > 192.168.2.1: ICMP echo request, id 20817, seq 1, length 64
14:09:46.422034 IP 192.168.2.1 > 192.168.2.9: ICMP echo reply, id 20817, seq 1, length 64
14:09:50.523811 IP 192.168.2.10.53867 > 192.168.2.2.33434: UDP, length 32
14:09:50.562597 IP 192.168.2.10.35519 > 192.168.2.3.33434: UDP, length 32
14:09:50.599594 IP 192.168.2.10.49418 > 192.168.4.2.33434: UDP, length 32
14:09:50.599617 IP 192.168.4.2 > 192.168.2.10: ICMP 192.168.4.2 udp port 33434 unreachable, length 68
14:09:50.600485 IP 192.168.2.10.37116 > 192.168.4.2.33435: UDP, length 32
14:09:50.600492 IP 192.168.4.2 > 192.168.2.10: ICMP 192.168.4.2 udp port 33435 unreachable, length 68
14:09:50.601477 IP 192.168.2.10.47247 > 192.168.4.2.33436: UDP, length 32
14:09:50.601483 IP 192.168.4.2 > 192.168.2.10: ICMP 192.168.4.2 udp port 33436 unreachable, length 68
14:09:50.602955 IP 192.168.2.10.53277 > 192.168.4.2.33449: UDP, length 32
14:09:50.602963 IP 192.168.4.2 > 192.168.2.10: ICMP 192.168.4.2 udp port 33449 unreachable, length 68
14:09:50.603006 IP 192.168.2.10.39976 > 192.168.4.2.33443: UDP, length 32
14:09:50.603010 IP 192.168.4.2 > 192.168.2.10: ICMP 192.168.4.2 udp port 33443 unreachable, length 68
14:09:50.603062 IP 192.168.2.10.60470 > 192.168.4.2.33446: UDP, length 32
14:09:50.603068 IP 192.168.4.2 > 192.168.2.10: ICMP 192.168.4.2 udp port 33446 unreachable, length 68
14:09:50.603097 IP 192.168.2.10.54991 > 192.168.4.2.33445: UDP, length 32
14:09:50.603109 IP 192.168.2.10.40860 > 192.168.4.2.33440: UDP, length 32
14:09:50.603118 IP 192.168.2.10.45980 > 192.168.4.2.33441: UDP, length 32
14:09:50.603127 IP 192.168.2.10.50024 > 192.168.4.2.33438: UDP, length 32
14:09:50.603135 IP 192.168.2.10.49496 > 192.168.4.2.33437: UDP, length 32
14:09:50.603144 IP 192.168.2.10.32944 > 192.168.4.2.33439: UDP, length 32
14:09:50.603152 IP 192.168.2.10.43407 > 192.168.4.2.33444: UDP, length 32
14:09:50.603161 IP 192.168.2.10.37380 > 192.168.4.2.33447: UDP, length 32
14:09:50.603170 IP 192.168.2.10.52621 > 192.168.4.2.33448: UDP, length 32
14:09:50.603184 IP 192.168.2.10.42830 > 192.168.4.2.33442: UDP, length 32
14:09:50.627651 IP 192.168.2.10.53657 > 192.168.2.15.33434: UDP, length 32
14:09:50.647780 IP 192.168.2.10.60335 > 192.168.2.14.33434: UDP, length 32
14:09:50.687317 IP 192.168.2.10.55490 > 192.168.2.17.33434: UDP, length 32
14:09:50.703462 IP 192.168.2.10.39339 > 192.168.2.16.33434: UDP, length 32
14:09:51.487518 IP 192.168.2.9 > 192.168.4.2: ICMP echo request, id 20940, seq 1, length 64
14:09:51.487530 IP 192.168.4.2 > 192.168.2.9: ICMP echo reply, id 20940, seq 1, length 64
14:09:51.643532 IP 192.168.2.9 > 192.168.2.1: ICMP echo request, id 20967, seq 1, length 64
14:09:51.643543 IP 192.168.2.1 > 192.168.2.9: ICMP echo reply, id 20967, seq 1, length 64
14:09:55.610119 ARP, Request who-has 192.168.2.10 tell 192.168.2.1, length 28
14:09:55.610551 ARP, Request who-has 192.168.2.1 tell 192.168.2.10, length 28
14:09:55.610559 ARP, Reply 192.168.2.1 is-at 12:af:d3:99:19:77 (oui Unknown), length 28
14:09:55.611172 ARP, Reply 192.168.2.10 is-at 6a:24:68:8d:86:c9 (oui Unknown), length 28
14:09:56.490172 ARP, Request who-has 192.168.2.1 tell 192.168.2.9, length 28
14:09:56.490181 ARP, Reply 192.168.2.1 is-at 12:af:d3:99:19:77 (oui Unknown), length 28
14:09:56.697641 IP 192.168.2.9 > 192.168.4.2: ICMP echo request, id 21052, seq 1, length 64
14:09:56.697652 IP 192.168.4.2 > 192.168.2.9: ICMP echo reply, id 21052, seq 1, length 64
14:09:56.725925 IP 192.168.2.9 > 192.168.2.1: ICMP echo request, id 21079, seq 1, length 64
14:09:56.725936 IP 192.168.2.1 > 192.168.2.9: ICMP echo reply, id 21079, seq 1, length 64

14:10:01.706331 ARP, Request who-has 192.168.2.9 tell 192.168.2.1, length 28
14:10:01.706489 ARP, Reply 192.168.2.9 is-at 46:17:bc:dd:9e:58 (oui Unknown), length 28
14:10:01.742406 IP 192.168.2.9 > 192.168.4.2: ICMP echo request, id 21172, seq 1, length 64
14:10:01.742416 IP 192.168.4.2 > 192.168.2.9: ICMP echo reply, id 21172, seq 1, length 64
14:10:01.772610 IP 192.168.2.9 > 192.168.2.1: ICMP echo request, id 21199, seq 1, length 64
14:10:01.772621 IP 192.168.2.1 > 192.168.2.9: ICMP echo reply, id 21199, seq 1, length 64
14:10:06.932206 IP 192.168.2.9 > 192.168.4.2: ICMP echo request, id 21333, seq 1, length 64
14:10:06.932217 IP 192.168.4.2 > 192.168.2.9: ICMP echo reply, id 21333, seq 1, length 64
14:10:07.443784 IP 192.168.2.9 > 192.168.2.1: ICMP echo request, id 21377, seq 1, length 64
14:10:07.443795 IP 192.168.2.1 > 192.168.2.9: ICMP echo reply, id 21377, seq 1, length 64
14:10:12.600977 IP 192.168.2.9 > 192.168.4.2: ICMP echo request, id 21501, seq 1, length 64
14:10:12.600989 IP 192.168.4.2 > 192.168.2.9: ICMP echo reply, id 21501, seq 1, length 64
14:10:12.629625 IP 192.168.2.9 > 192.168.2.1: ICMP echo request, id 21528, seq 1, length 64
14:10:12.629635 IP 192.168.2.1 > 192.168.2.9: ICMP echo reply, id 21528, seq 1, length 64
14:10:17.643229 IP 192.168.2.9 > 192.168.4.2: ICMP echo request, id 21609, seq 1, length 64
14:10:17.643240 IP 192.168.4.2 > 192.168.2.9: ICMP echo reply, id 21609, seq 1, length 64
14:10:17.667820 IP 192.168.2.9 > 192.168.2.1: ICMP echo request, id 21636, seq 1, length 64
14:10:17.667829 IP 192.168.2.1 > 192.168.2.9: ICMP echo reply, id 21636, seq 1, length 64
14:10:22.650263 ARP, Request who-has 192.168.2.1 tell 192.168.2.9, length 28
14:10:22.650270 ARP, Reply 192.168.2.1 is-at 12:af:d3:99:19:77 (oui Unknown), length 28
14:10:22.684052 IP 192.168.2.9 > 192.168.4.2: ICMP echo request, id 21756, seq 1, length 64
14:10:22.684061 IP 192.168.4.2 > 192.168.2.9: ICMP echo reply, id 21756, seq 1, length 64
14:10:22.713903 IP 192.168.2.9 > 192.168.2.1: ICMP echo request, id 21783, seq 1, length 64
14:10:22.713912 IP 192.168.2.1 > 192.168.2.9: ICMP echo reply, id 21783, seq 1, length 64
14:10:27.755499 IP 192.168.2.9 > 192.168.4.2: ICMP echo request, id 21924, seq 1, length 64
14:10:27.755510 IP 192.168.4.2 > 192.168.2.9: ICMP echo reply, id 21924, seq 1, length 64
14:10:28.207659 IP 192.168.2.9 > 192.168.2.1: ICMP echo request, id 21958, seq 1, length 64
14:10:28.207670 IP 192.168.2.1 > 192.168.2.9: ICMP echo reply, id 21958, seq 1, length 64

14:10:33.304331 IP 192.168.2.9 > 192.168.4.2: ICMP echo request, id 22073, seq 1, length 64
14:10:33.304341 IP 192.168.4.2 > 192.168.2.9: ICMP echo reply, id 22073, seq 1, length 64
14:10:33.329043 IP 192.168.2.9 > 192.168.2.1: ICMP echo request, id 22100, seq 1, length 64
14:10:33.329052 IP 192.168.2.1 > 192.168.2.9: ICMP echo reply, id 22100, seq 1, length 64
14:10:38.314127 ARP, Request who-has 192.168.2.9 tell 192.168.2.1, length 28
14:10:38.314273 ARP, Reply 192.168.2.9 is-at 46:17:bc:dd:9e:58 (oui Unknown), length 28
14:10:38.343757 IP 192.168.2.9 > 192.168.4.2: ICMP echo request, id 22181, seq 1, length 64
14:10:38.343786 IP 192.168.4.2 > 192.168.2.9: ICMP echo reply, id 22181, seq 1, length 64
14:10:38.371775 IP 192.168.2.9 > 192.168.2.1: ICMP echo request, id 22208, seq 1, length 64
14:10:38.371784 IP 192.168.2.1 > 192.168.2.9: ICMP echo reply, id 22208, seq 1, length 64
14:10:43.388496 IP 192.168.2.9 > 192.168.4.2: ICMP echo request, id 22291, seq 1, length 64
14:10:43.388506 IP 192.168.4.2 > 192.168.2.9: ICMP echo reply, id 22291, seq 1, length 64
14:10:43.413366 IP 192.168.2.9 > 192.168.2.1: ICMP echo request, id 22318, seq 1, length 64
14:10:43.413376 IP 192.168.2.1 > 192.168.2.9: ICMP echo reply, id 22318, seq 1, length 64
14:10:48.394349 ARP, Request who-has 192.168.2.1 tell 192.168.2.9, length 28
14:10:48.394355 ARP, Reply 192.168.2.1 is-at 12:af:d3:99:19:77 (oui Unknown), length 28
14:10:48.429887 IP 192.168.2.9 > 192.168.4.2: ICMP echo request, id 22408, seq 1, length 64
14:10:48.429897 IP 192.168.4.2 > 192.168.2.9: ICMP echo reply, id 22408, seq 1, length 64
14:10:48.461954 IP 192.168.2.9 > 192.168.2.1: ICMP echo request, id 22435, seq 1, length 64
14:10:48.461965 IP 192.168.2.1 > 192.168.2.9: ICMP echo reply, id 22435, seq 1, length 64
14:10:53.481151 IP 192.168.2.9 > 192.168.4.2: ICMP echo request, id 22518, seq 1, length 64
14:10:53.481164 IP 192.168.4.2 > 192.168.2.9: ICMP echo reply, id 22518, seq 1, length 64
14:10:53.511167 IP 192.168.2.9 > 192.168.2.1: ICMP echo request, id 22547, seq 1, length 64
14:10:53.511180 IP 192.168.2.1 > 192.168.2.9: ICMP echo reply, id 22547, seq 1, length 64
14:10:58.530910 IP 192.168.2.9 > 192.168.4.2: ICMP echo request, id 22628, seq 1, length 64
14:10:58.530921 IP 192.168.4.2 > 192.168.2.9: ICMP echo reply, id 22628, seq 1, length 64
14:10:58.555827 IP 192.168.2.9 > 192.168.2.1: ICMP echo request, id 22655, seq 1, length 64
14:10:58.555836 IP 192.168.2.1 > 192.168.2.9: ICMP echo reply, id 22655, seq 1, length 64

14:11:03.572632 IP 192.168.2.9 > 192.168.4.2: ICMP echo request, id 22748, seq 1, length 64
14:11:03.572647 IP 192.168.4.2 > 192.168.2.9: ICMP echo reply, id 22748, seq 1, length 64
14:11:03.600585 IP 192.168.2.9 > 192.168.2.1: ICMP echo request, id 22775, seq 1, length 64
14:11:03.600596 IP 192.168.2.1 > 192.168.2.9: ICMP echo reply, id 22775, seq 1, length 64
14:11:08.615686 IP 192.168.2.9 > 192.168.4.2: ICMP echo request, id 22857, seq 1, length 64
14:11:08.615695 IP 192.168.4.2 > 192.168.2.9: ICMP echo reply, id 22857, seq 1, length 64
14:11:08.639808 IP 192.168.2.9 > 192.168.2.1: ICMP echo request, id 22884, seq 1, length 64
14:11:08.639817 IP 192.168.2.1 > 192.168.2.9: ICMP echo reply, id 22884, seq 1, length 64
14:11:13.626540 ARP, Request who-has 192.168.2.1 tell 192.168.2.9, length 28
14:11:13.626548 ARP, Reply 192.168.2.1 is-at 12:af:d3:99:19:77 (oui Unknown), length 28
14:11:13.655452 IP 192.168.2.9 > 192.168.4.2: ICMP echo request, id 22967, seq 1, length 64
14:11:13.655463 IP 192.168.4.2 > 192.168.2.9: ICMP echo reply, id 22967, seq 1, length 64
14:11:13.681151 IP 192.168.2.9 > 192.168.2.1: ICMP echo request, id 22994, seq 1, length 64
14:11:13.681160 IP 192.168.2.1 > 192.168.2.9: ICMP echo reply, id 22994, seq 1, length 64
14:11:18.666155 ARP, Request who-has 192.168.2.9 tell 192.168.2.1, length 28
14:11:18.666320 ARP, Reply 192.168.2.9 is-at 46:17:bc:dd:9e:58 (oui Unknown), length 28
14:11:18.692591 IP 192.168.2.9 > 192.168.4.2: ICMP echo request, id 23075, seq 1, length 64
14:11:18.692600 IP 192.168.4.2 > 192.168.2.9: ICMP echo reply, id 23075, seq 1, length 64
14:11:18.717101 IP 192.168.2.9 > 192.168.2.1: ICMP echo request, id 23102, seq 1, length 64
14:11:18.717110 IP 192.168.2.1 > 192.168.2.9: ICMP echo reply, id 23102, seq 1, length 64
14:11:23.733414 IP 192.168.2.9 > 192.168.4.2: ICMP echo request, id 23185, seq 1, length 64
14:11:23.733424 IP 192.168.4.2 > 192.168.2.9: ICMP echo reply, id 23185, seq 1, length 64
14:11:23.762094 IP 192.168.2.9 > 192.168.2.1: ICMP echo request, id 23212, seq 1, length 64
14:11:23.762104 IP 192.168.2.1 > 192.168.2.9: ICMP echo reply, id 23212, seq 1, length 64

14:11:33.817834 IP 192.168.2.9 > 192.168.4.2: ICMP echo request, id 23412, seq 1, length 64
14:11:33.817846 IP 192.168.4.2 > 192.168.2.9: ICMP echo reply, id 23412, seq 1, length 64
14:11:33.841711 IP 192.168.2.9 > 192.168.2.1: ICMP echo request, id 23439, seq 1, length 64
14:11:33.841720 IP 192.168.2.1 > 192.168.2.9: ICMP echo reply, id 23439, seq 1, length 64
14:11:38.826791 ARP, Request who-has 192.168.2.1 tell 192.168.2.9, length 28
14:11:38.826798 ARP, Reply 192.168.2.1 is-at 12:af:d3:99:19:77 (oui Unknown), length 28
14:11:38.887588 IP 192.168.2.9 > 192.168.4.2: ICMP echo request, id 23545, seq 1, length 64
14:11:38.887614 IP 192.168.4.2 > 192.168.2.9: ICMP echo reply, id 23545, seq 1, length 64
14:11:39.083955 IP 192.168.2.9 > 192.168.2.1: ICMP echo request, id 23572, seq 1, length 64
14:11:39.083965 IP 192.168.2.1 > 192.168.2.9: ICMP echo reply, id 23572, seq 1, length 64
14:11:44.177183 IP 192.168.2.9 > 192.168.4.2: ICMP echo request, id 23720, seq 1, length 64
14:11:44.177194 IP 192.168.4.2 > 192.168.2.9: ICMP echo reply, id 23720, seq 1, length 64
14:11:44.200878 IP 192.168.2.9 > 192.168.2.1: ICMP echo request, id 23747, seq 1, length 64
14:11:44.200886 IP 192.168.2.1 > 192.168.2.9: ICMP echo reply, id 23747, seq 1, length 64
14:11:49.215419 IP 192.168.2.9 > 192.168.4.2: ICMP echo request, id 23828, seq 1, length 64
14:11:49.215428 IP 192.168.4.2 > 192.168.2.9: ICMP echo reply, id 23828, seq 1, length 64
14:11:49.238988 IP 192.168.2.9 > 192.168.2.1: ICMP echo request, id 23855, seq 1, length 64
14:11:49.238996 IP 192.168.2.1 > 192.168.2.9: ICMP echo reply, id 23855, seq 1, length 64
14:11:54.218143 ARP, Request who-has 192.168.2.9 tell 192.168.2.1, length 28
14:11:54.218271 ARP, Reply 192.168.2.9 is-at 46:17:bc:dd:9e:58 (oui Unknown), length 28
14:11:54.253728 IP 192.168.2.9 > 192.168.4.2: ICMP echo request, id 23938, seq 1, length 64
14:11:54.253737 IP 192.168.4.2 > 192.168.2.9: ICMP echo reply, id 23938, seq 1, length 64
14:11:54.274413 IP 192.168.2.9 > 192.168.2.1: ICMP echo request, id 23965, seq 1, length 64
14:11:54.274421 IP 192.168.2.1 > 192.168.2.9: ICMP echo reply, id 23965, seq 1, length 64

14:12:04.330244 ARP, Request who-has 192.168.2.1 tell 192.168.2.9, length 28
14:12:04.330254 ARP, Reply 192.168.2.1 is-at 12:af:d3:99:19:77 (oui Unknown), length 28
14:12:04.615859 IP 192.168.2.9 > 192.168.4.2: ICMP echo request, id 24257, seq 1, length 64
14:12:04.615868 IP 192.168.4.2 > 192.168.2.9: ICMP echo reply, id 24257, seq 1, length 64
14:12:04.641038 IP 192.168.2.9 > 192.168.2.1: ICMP echo request, id 24284, seq 1, length 64
14:12:04.641047 IP 192.168.2.1 > 192.168.2.9: ICMP echo reply, id 24284, seq 1, length 64
14:12:09.655058 IP 192.168.2.9 > 192.168.4.2: ICMP echo request, id 24367, seq 1, length 64
14:12:09.655067 IP 192.168.4.2 > 192.168.2.9: ICMP echo reply, id 24367, seq 1, length 64
14:12:09.676957 IP 192.168.2.9 > 192.168.2.1: ICMP echo request, id 24394, seq 1, length 64
14:12:09.676965 IP 192.168.2.1 > 192.168.2.9: ICMP echo reply, id 24394, seq 1, length 64
14:12:14.691000 IP 192.168.2.9 > 192.168.4.2: ICMP echo request, id 24475, seq 1, length 64
14:12:14.691009 IP 192.168.4.2 > 192.168.2.9: ICMP echo reply, id 24475, seq 1, length 64
14:12:14.714091 IP 192.168.2.9 > 192.168.2.1: ICMP echo request, id 24502, seq 1, length 64
14:12:14.714101 IP 192.168.2.1 > 192.168.2.9: ICMP echo reply, id 24502, seq 1, length 64
14:12:19.727963 IP 192.168.2.9 > 192.168.4.2: ICMP echo request, id 24585, seq 1, length 64
14:12:19.727972 IP 192.168.4.2 > 192.168.2.9: ICMP echo reply, id 24585, seq 1, length 64
14:12:19.749831 IP 192.168.2.9 > 192.168.2.1: ICMP echo request, id 24612, seq 1, length 64
14:12:19.749839 IP 192.168.2.1 > 192.168.2.9: ICMP echo reply, id 24612, seq 1, length 64
14:12:24.765589 IP 192.168.2.9 > 192.168.4.2: ICMP echo request, id 24693, seq 1, length 64
14:12:24.765598 IP 192.168.4.2 > 192.168.2.9: ICMP echo reply, id 24693, seq 1, length 64
14:12:24.787575 IP 192.168.2.9 > 192.168.2.1: ICMP echo request, id 24720, seq 1, length 64
14:12:24.787583 IP 192.168.2.1 > 192.168.2.9: ICMP echo reply, id 24720, seq 1, length 64

14:12:34.839105 IP 192.168.2.9 > 192.168.4.2: ICMP echo request, id 24920, seq 1, length 64
14:12:34.839114 IP 192.168.4.2 > 192.168.2.9: ICMP echo reply, id 24920, seq 1, length 64
14:12:34.862348 IP 192.168.2.9 > 192.168.2.1: ICMP echo request, id 24947, seq 1, length 64
14:12:34.862356 IP 192.168.2.1 > 192.168.2.9: ICMP echo reply, id 24947, seq 1, length 64
14:12:39.874963 IP 192.168.2.9 > 192.168.4.2: ICMP echo request, id 25030, seq 1, length 64
14:12:39.874972 IP 192.168.4.2 > 192.168.2.9: ICMP echo reply, id 25030, seq 1, length 64
14:12:39.899708 IP 192.168.2.9 > 192.168.2.1: ICMP echo request, id 25057, seq 1, length 64
14:12:39.899719 IP 192.168.2.1 > 192.168.2.9: ICMP echo reply, id 25057, seq 1, length 64
14:12:44.912083 IP 192.168.2.9 > 192.168.4.2: ICMP echo request, id 25138, seq 1, length 64
14:12:44.912092 IP 192.168.4.2 > 192.168.2.9: ICMP echo reply, id 25138, seq 1, length 64
14:12:44.935030 IP 192.168.2.9 > 192.168.2.1: ICMP echo request, id 25165, seq 1, length 64
14:12:44.935039 IP 192.168.2.1 > 192.168.2.9: ICMP echo reply, id 25165, seq 1, length 64
14:12:49.948730 IP 192.168.2.9 > 192.168.4.2: ICMP echo request, id 25248, seq 1, length 64
14:12:49.948740 IP 192.168.4.2 > 192.168.2.9: ICMP echo reply, id 25248, seq 1, length 64
14:12:49.973799 IP 192.168.2.9 > 192.168.2.1: ICMP echo request, id 25275, seq 1, length 64
14:12:49.973808 IP 192.168.2.1 > 192.168.2.9: ICMP echo reply, id 25275, seq 1, length 64
14:12:54.954239 ARP, Request who-has 192.168.2.1 tell 192.168.2.9, length 28
14:12:54.954247 ARP, Reply 192.168.2.1 is-at 12:af:d3:99:19:77 (oui Unknown), length 28
14:12:54.990577 IP 192.168.2.9 > 192.168.4.2: ICMP echo request, id 25356, seq 1, length 64
14:12:54.990586 IP 192.168.4.2 > 192.168.2.9: ICMP echo reply, id 25356, seq 1, length 64
14:12:55.013847 IP 192.168.2.9 > 192.168.2.1: ICMP echo request, id 25383, seq 1, length 64
14:12:55.013855 IP 192.168.2.1 > 192.168.2.9: ICMP echo reply, id 25383, seq 1, length 64

14:13:00.030568 IP 192.168.2.9 > 192.168.4.2: ICMP echo request, id 25472, seq 1, length 64
14:13:00.030576 IP 192.168.4.2 > 192.168.2.9: ICMP echo reply, id 25472, seq 1, length 64
14:13:00.063681 IP 192.168.2.9 > 192.168.2.1: ICMP echo request, id 25501, seq 1, length 64
14:13:00.063690 IP 192.168.2.1 > 192.168.2.9: ICMP echo reply, id 25501, seq 1, length 64
14:13:05.079701 IP 192.168.2.9 > 192.168.4.2: ICMP echo request, id 25583, seq 1, length 64
14:13:05.079711 IP 192.168.4.2 > 192.168.2.9: ICMP echo reply, id 25583, seq 1, length 64
14:13:05.101119 IP 192.168.2.9 > 192.168.2.1: ICMP echo request, id 25610, seq 1, length 64
14:13:05.101128 IP 192.168.2.1 > 192.168.2.9: ICMP echo reply, id 25610, seq 1, length 64
14:13:10.090126 ARP, Request who-has 192.168.2.9 tell 192.168.2.1, length 28
14:13:10.090259 ARP, Reply 192.168.2.9 is-at 46:17:bc:dd:9e:58 (oui Unknown), length 28
14:13:10.116302 IP 192.168.2.9 > 192.168.4.2: ICMP echo request, id 25693, seq 1, length 64
14:13:10.116313 IP 192.168.4.2 > 192.168.2.9: ICMP echo reply, id 25693, seq 1, length 64
14:13:10.142675 IP 192.168.2.9 > 192.168.2.1: ICMP echo request, id 25720, seq 1, length 64
14:13:10.142685 IP 192.168.2.1 > 192.168.2.9: ICMP echo reply, id 25720, seq 1, length 64
14:13:15.226882 IP 192.168.2.9 > 192.168.4.2: ICMP echo request, id 25861, seq 1, length 64
14:13:15.226892 IP 192.168.4.2 > 192.168.2.9: ICMP echo reply, id 25861, seq 1, length 64
14:13:15.523709 IP 192.168.2.9 > 192.168.2.1: ICMP echo request, id 25893, seq 1, length 64
14:13:15.523719 IP 192.168.2.1 > 192.168.2.9: ICMP echo reply, id 25893, seq 1, length 64
14:13:20.234321 ARP, Request who-has 192.168.2.1 tell 192.168.2.9, length 28
14:13:20.234330 ARP, Reply 192.168.2.1 is-at 12:af:d3:99:19:77 (oui Unknown), length 28
14:13:20.623345 IP 192.168.2.9 > 192.168.4.2: ICMP echo request, id 26001, seq 1, length 64
14:13:20.623354 IP 192.168.4.2 > 192.168.2.9: ICMP echo reply, id 26001, seq 1, length 64
14:13:20.645086 IP 192.168.2.9 > 192.168.2.1: ICMP echo request, id 26028, seq 1, length 64
14:13:20.645095 IP 192.168.2.1 > 192.168.2.9: ICMP echo reply, id 26028, seq 1, length 64
14:13:25.660210 IP 192.168.2.9 > 192.168.4.2: ICMP echo request, id 26109, seq 1, length 64
14:13:25.660219 IP 192.168.4.2 > 192.168.2.9: ICMP echo reply, id 26109, seq 1, length 64
14:13:25.681527 IP 192.168.2.9 > 192.168.2.1: ICMP echo request, id 26136, seq 1, length 64
14:13:25.681535 IP 192.168.2.1 > 192.168.2.9: ICMP echo reply, id 26136, seq 1, length 64

14:13:30.695599 IP 192.168.2.9 > 192.168.4.2: ICMP echo request, id 26228, seq 1, length 64
14:13:30.695608 IP 192.168.4.2 > 192.168.2.9: ICMP echo reply, id 26228, seq 1, length 64
14:13:30.716731 IP 192.168.2.9 > 192.168.2.1: ICMP echo request, id 26255, seq 1, length 64
14:13:30.716738 IP 192.168.2.1 > 192.168.2.9: ICMP echo reply, id 26255, seq 1, length 64
14:13:35.768166 IP 192.168.2.9 > 192.168.4.2: ICMP echo request, id 26401, seq 1, length 64
14:13:35.768177 IP 192.168.4.2 > 192.168.2.9: ICMP echo reply, id 26401, seq 1, length 64
14:13:36.219270 IP 192.168.2.9 > 192.168.2.1: ICMP echo request, id 26431, seq 1, length 64
14:13:36.219281 IP 192.168.2.1 > 192.168.2.9: ICMP echo reply, id 26431, seq 1, length 64
14:13:41.288320 IP 192.168.2.9 > 192.168.4.2: ICMP echo request, id 26536, seq 1, length 64
14:13:41.288330 IP 192.168.4.2 > 192.168.2.9: ICMP echo reply, id 26536, seq 1, length 64
14:13:41.310925 IP 192.168.2.9 > 192.168.2.1: ICMP echo request, id 26563, seq 1, length 64
14:13:41.310933 IP 192.168.2.1 > 192.168.2.9: ICMP echo reply, id 26563, seq 1, length 64
14:13:46.298124 ARP, Request who-has 192.168.2.9 tell 192.168.2.1, length 28
14:13:46.298260 ARP, Request who-has 192.168.2.1 tell 192.168.2.9, length 28
14:13:46.298265 ARP, Reply 192.168.2.1 is-at 12:af:d3:99:19:77 (oui Unknown), length 28
14:13:46.298313 ARP, Reply 192.168.2.9 is-at 46:17:bc:dd:9e:58 (oui Unknown), length 28
14:13:46.322915 IP 192.168.2.9 > 192.168.4.2: ICMP echo request, id 26644, seq 1, length 64
14:13:46.322923 IP 192.168.4.2 > 192.168.2.9: ICMP echo reply, id 26644, seq 1, length 64
14:13:46.344044 IP 192.168.2.9 > 192.168.2.1: ICMP echo request, id 26671, seq 1, length 64
14:13:46.344052 IP 192.168.2.1 > 192.168.2.9: ICMP echo reply, id 26671, seq 1, length 64
14:13:51.359980 IP 192.168.2.9 > 192.168.4.2: ICMP echo request, id 26754, seq 1, length 64
14:13:51.359991 IP 192.168.4.2 > 192.168.2.9: ICMP echo reply, id 26754, seq 1, length 64
14:13:51.386577 IP 192.168.2.9 > 192.168.2.1: ICMP echo request, id 26781, seq 1, length 64
14:13:51.386587 IP 192.168.2.1 > 192.168.2.9: ICMP echo reply, id 26781, seq 1, length 64
14:13:56.404575 IP 192.168.2.9 > 192.168.4.2: ICMP echo request, id 26862, seq 1, length 64
14:13:56.404588 IP 192.168.4.2 > 192.168.2.9: ICMP echo reply, id 26862, seq 1, length 64
14:13:56.433947 IP 192.168.2.9 > 192.168.2.1: ICMP echo request, id 26889, seq 1, length 64
14:13:56.433958 IP 192.168.2.1 > 192.168.2.9: ICMP echo reply, id 26889, seq 1, length 64

14:14:01.447065 IP 192.168.2.9 > 192.168.4.2: ICMP echo request, id 26981, seq 1, length 64
14:14:01.447075 IP 192.168.4.2 > 192.168.2.9: ICMP echo reply, id 26981, seq 1, length 64
14:14:01.470816 IP 192.168.2.9 > 192.168.2.1: ICMP echo request, id 27008, seq 1, length 64
14:14:01.470825 IP 192.168.2.1 > 192.168.2.9: ICMP echo reply, id 27008, seq 1, length 64
14:14:06.486335 IP 192.168.2.9 > 192.168.4.2: ICMP echo request, id 27089, seq 1, length 64
14:14:06.486344 IP 192.168.4.2 > 192.168.2.9: ICMP echo reply, id 27089, seq 1, length 64
14:14:06.509812 IP 192.168.2.9 > 192.168.2.1: ICMP echo request, id 27116, seq 1, length 64
14:14:06.509820 IP 192.168.2.1 > 192.168.2.9: ICMP echo reply, id 27116, seq 1, length 64
14:14:11.498377 ARP, Request who-has 192.168.2.1 tell 192.168.2.9, length 28
14:14:11.498383 ARP, Reply 192.168.2.1 is-at 12:af:d3:99:19:77 (oui Unknown), length 28
14:14:11.523588 IP 192.168.2.9 > 192.168.4.2: ICMP echo request, id 27199, seq 1, length 64
14:14:11.523597 IP 192.168.4.2 > 192.168.2.9: ICMP echo reply, id 27199, seq 1, length 64
14:14:11.545794 IP 192.168.2.9 > 192.168.2.1: ICMP echo request, id 27226, seq 1, length 64
14:14:11.545802 IP 192.168.2.1 > 192.168.2.9: ICMP echo reply, id 27226, seq 1, length 64
14:14:16.559655 IP 192.168.2.9 > 192.168.4.2: ICMP echo request, id 27307, seq 1, length 64
14:14:16.559664 IP 192.168.4.2 > 192.168.2.9: ICMP echo reply, id 27307, seq 1, length 64
14:14:16.580733 IP 192.168.2.9 > 192.168.2.1: ICMP echo request, id 27334, seq 1, length 64
14:14:16.580741 IP 192.168.2.1 > 192.168.2.9: ICMP echo reply, id 27334, seq 1, length 64
14:14:21.592445 IP 192.168.2.9 > 192.168.4.2: ICMP echo request, id 27417, seq 1, length 64
14:14:21.592454 IP 192.168.4.2 > 192.168.2.9: ICMP echo reply, id 27417, seq 1, length 64
14:14:21.613591 IP 192.168.2.9 > 192.168.2.1: ICMP echo request, id 27444, seq 1, length 64
14:14:21.613599 IP 192.168.2.1 > 192.168.2.9: ICMP echo reply, id 27444, seq 1, length 64
14:14:26.602492 ARP, Request who-has 192.168.2.9 tell 192.168.2.1, length 28
14:14:26.602625 ARP, Reply 192.168.2.9 is-at 46:17:bc:dd:9e:58 (oui Unknown), length 28
14:14:26.629416 IP 192.168.2.9 > 192.168.4.2: ICMP echo request, id 27525, seq 1, length 64
14:14:26.629425 IP 192.168.4.2 > 192.168.2.9: ICMP echo reply, id 27525, seq 1, length 64
14:14:26.652294 IP 192.168.2.9 > 192.168.2.1: ICMP echo request, id 27552, seq 1, length 64
14:14:26.652303 IP 192.168.2.1 > 192.168.2.9: ICMP echo reply, id 27552, seq 1, length 64

14:14:31.667007 IP 192.168.2.9 > 192.168.4.2: ICMP echo request, id 27644, seq 1, length 64
14:14:31.667016 IP 192.168.4.2 > 192.168.2.9: ICMP echo reply, id 27644, seq 1, length 64
14:14:31.688923 IP 192.168.2.9 > 192.168.2.1: ICMP echo request, id 27671, seq 1, length 64
14:14:31.688932 IP 192.168.2.1 > 192.168.2.9: ICMP echo reply, id 27671, seq 1, length 64
14:14:36.682348 ARP, Request who-has 192.168.2.1 tell 192.168.2.9, length 28
14:14:36.682355 ARP, Reply 192.168.2.1 is-at 12:af:d3:99:19:77 (oui Unknown), length 28
14:14:36.704427 IP 192.168.2.9 > 192.168.4.2: ICMP echo request, id 27752, seq 1, length 64
14:14:36.704438 IP 192.168.4.2 > 192.168.2.9: ICMP echo reply, id 27752, seq 1, length 64
14:14:36.727181 IP 192.168.2.9 > 192.168.2.1: ICMP echo request, id 27779, seq 1, length 64
14:14:36.727188 IP 192.168.2.1 > 192.168.2.9: ICMP echo reply, id 27779, seq 1, length 64
14:14:41.741609 IP 192.168.2.9 > 192.168.4.2: ICMP echo request, id 27862, seq 1, length 64
14:14:41.741621 IP 192.168.4.2 > 192.168.2.9: ICMP echo reply, id 27862, seq 1, length 64
14:14:41.763571 IP 192.168.2.9 > 192.168.2.1: ICMP echo request, id 27889, seq 1, length 64
14:14:41.763579 IP 192.168.2.1 > 192.168.2.9: ICMP echo reply, id 27889, seq 1, length 64
14:14:46.803196 IP 192.168.2.9 > 192.168.4.2: ICMP echo request, id 27980, seq 1, length 64
14:14:46.803206 IP 192.168.4.2 > 192.168.2.9: ICMP echo reply, id 27980, seq 1, length 64
14:14:46.935372 IP 192.168.2.9 > 192.168.2.1: ICMP echo request, id 28007, seq 1, length 64
14:14:46.935383 IP 192.168.2.1 > 192.168.2.9: ICMP echo reply, id 28007, seq 1, length 64

