
15:58:13.015478 ARP, Request who-has 192.168.1.1 tell 192.168.1.2, length 28
15:58:13.015491 ARP, Reply 192.168.1.1 is-at 66:c2:ae:e1:6a:17 (oui Unknown), length 28
15:58:13.016346 IP 192.168.1.2 > 12.10.5.2: ICMP echo request, id 2460, seq 1, length 64
15:58:15.019288 IP 192.168.1.2 > 12.10.5.3: ICMP echo request, id 2461, seq 1, length 64
15:58:17.020992 ARP, Request who-has 192.168.1.3 tell 192.168.1.2, length 28
15:58:17.024264 IP 192.168.1.2 > 192.168.2.2: ICMP echo request, id 2471, seq 1, length 64
15:58:19.028599 IP 192.168.1.2 > 192.168.2.3: ICMP echo request, id 2472, seq 1, length 64
15:58:20.966313 ARP, Request who-has 192.168.1.2 tell 192.168.1.101, length 28
15:58:21.032825 IP 192.168.1.2 > 192.168.3.2: ICMP echo request, id 2482, seq 1, length 64
15:58:23.036221 IP 192.168.1.2 > 192.168.3.3: ICMP echo request, id 2493, seq 1, length 64
15:58:25.039606 IP 192.168.1.2 > 192.168.4.2: ICMP echo request, id 2494, seq 1, length 64
15:58:25.039618 IP 192.168.4.2 > 192.168.1.2: ICMP echo reply, id 2494, seq 1, length 64
15:58:25.042048 IP 192.168.1.2 > 192.168.5.2: ICMP echo request, id 2495, seq 1, length 64
15:58:27.044393 ARP, Request who-has 192.168.1.1 tell 192.168.1.3, length 28
15:58:27.044408 ARP, Reply 192.168.1.1 is-at 66:c2:ae:e1:6a:17 (oui Unknown), length 28
15:58:27.045260 IP 192.168.1.3 > 12.10.5.2: ICMP echo request, id 2558, seq 1, length 64
15:58:29.049283 IP 192.168.1.3 > 12.10.5.3: ICMP echo request, id 2559, seq 1, length 64

15:58:31.032453 ARP, Request who-has 192.168.1.2 tell 192.168.1.103, length 28
15:58:31.053498 ARP, Request who-has 192.168.1.3 tell 192.168.1.103, length 28
15:58:31.066332 IP 192.168.1.3 > 192.168.2.2: ICMP echo request, id 2592, seq 1, length 64
15:58:31.070564 IP 192.168.1.103.60877 > 192.168.4.2.33434: UDP, length 32
15:58:31.070577 IP 192.168.4.2 > 192.168.1.103: ICMP 192.168.4.2 udp port 33434 unreachable, length 68
15:58:31.071641 IP 192.168.1.103.48274 > 192.168.4.2.33435: UDP, length 32
15:58:31.071648 IP 192.168.4.2 > 192.168.1.103: ICMP 192.168.4.2 udp port 33435 unreachable, length 68
15:58:31.072922 IP 192.168.1.103.38090 > 192.168.4.2.33442: UDP, length 32
15:58:31.072929 IP 192.168.4.2 > 192.168.1.103: ICMP 192.168.4.2 udp port 33442 unreachable, length 68
15:58:31.073398 IP 192.168.1.103.46162 > 192.168.4.2.33448: UDP, length 32
15:58:31.073405 IP 192.168.4.2 > 192.168.1.103: ICMP 192.168.4.2 udp port 33448 unreachable, length 68
15:58:31.073828 IP 192.168.1.103.44912 > 192.168.4.2.33444: UDP, length 32
15:58:31.073834 IP 192.168.4.2 > 192.168.1.103: ICMP 192.168.4.2 udp port 33444 unreachable, length 68
15:58:31.074262 IP 192.168.1.103.45924 > 192.168.4.2.33437: UDP, length 32
15:58:31.074268 IP 192.168.4.2 > 192.168.1.103: ICMP 192.168.4.2 udp port 33437 unreachable, length 68
15:58:31.075205 IP 192.168.1.103.57751 > 192.168.4.2.33449: UDP, length 32
15:58:31.075228 IP 192.168.1.103.48590 > 192.168.4.2.33445: UDP, length 32
15:58:31.075243 IP 192.168.1.103.60760 > 192.168.4.2.33436: UDP, length 32
15:58:31.075262 IP 192.168.1.103.45931 > 192.168.4.2.33443: UDP, length 32
15:58:31.076725 IP 192.168.1.103.45165 > 192.168.4.2.33447: UDP, length 32
15:58:31.076747 IP 192.168.1.103.37184 > 192.168.4.2.33446: UDP, length 32
15:58:31.076762 IP 192.168.1.103.33919 > 192.168.4.2.33438: UDP, length 32
15:58:31.076775 IP 192.168.1.103.42037 > 192.168.4.2.33439: UDP, length 32
15:58:31.076788 IP 192.168.1.103.44430 > 192.168.4.2.33440: UDP, length 32
15:58:31.076802 IP 192.168.1.103.35311 > 192.168.4.2.33441: UDP, length 32
15:58:33.069377 IP 192.168.1.3 > 192.168.2.3: ICMP echo request, id 2605, seq 1, length 64
15:58:35.072039 IP 192.168.1.3 > 192.168.3.2: ICMP echo request, id 2607, seq 1, length 64
15:58:36.001765 IP 192.168.1.101 > 192.168.4.2: ICMP echo request, id 2661, seq 1, length 64
15:58:36.001781 IP 192.168.4.2 > 192.168.1.101: ICMP echo reply, id 2661, seq 1, length 64
15:58:36.009365 ARP, Request who-has 192.168.1.103 tell 192.168.1.101, length 28
15:58:36.072531 ARP, Request who-has 192.168.1.103 tell 192.168.1.1, length 28
15:58:36.073256 ARP, Request who-has 192.168.1.1 tell 192.168.1.103, length 28
15:58:36.073265 ARP, Reply 192.168.1.1 is-at 66:c2:ae:e1:6a:17 (oui Unknown), length 28
15:58:36.075486 ARP, Reply 192.168.1.103 is-at 22:8c:9f:70:21:ae (oui Unknown), length 28
15:58:37.075016 IP 192.168.1.3 > 192.168.3.3: ICMP echo request, id 2692, seq 1, length 64
15:58:39.078628 IP 192.168.1.3 > 192.168.4.2: ICMP echo request, id 2693, seq 1, length 64
15:58:39.078640 IP 192.168.4.2 > 192.168.1.3: ICMP echo reply, id 2693, seq 1, length 64
15:58:39.083686 IP 192.168.1.3 > 192.168.5.2: ICMP echo request, id 2694, seq 1, length 64
15:58:41.019578 IP 192.168.1.101 > 192.168.4.2: ICMP echo request, id 2698, seq 1, length 64
15:58:41.019589 IP 192.168.4.2 > 192.168.1.101: ICMP echo reply, id 2698, seq 1, length 64
15:58:44.088573 ARP, Request who-has 192.168.1.3 tell 192.168.1.1, length 28
15:58:44.090811 ARP, Reply 192.168.1.3 is-at 9e:64:81:62:33:80 (oui Unknown), length 28
15:58:46.024595 ARP, Request who-has 192.168.1.101 tell 192.168.1.1, length 28
15:58:46.026175 ARP, Reply 192.168.1.101 is-at da:77:25:82:e9:80 (oui Unknown), length 28
15:58:46.037417 IP 192.168.1.101 > 192.168.4.2: ICMP echo request, id 2725, seq 1, length 64
15:58:46.037427 IP 192.168.4.2 > 192.168.1.101: ICMP echo reply, id 2725, seq 1, length 64
15:58:51.055987 IP 192.168.1.101 > 192.168.4.2: ICMP echo request, id 2756, seq 1, length 64
15:58:51.056015 IP 192.168.4.2 > 192.168.1.101: ICMP echo reply, id 2756, seq 1, length 64
15:58:56.074863 IP 192.168.1.101 > 192.168.4.2: ICMP echo request, id 2817, seq 1, length 64
15:58:56.074874 IP 192.168.4.2 > 192.168.1.101: ICMP echo reply, id 2817, seq 1, length 64

15:59:01.113935 IP 192.168.1.101 > 192.168.4.2: ICMP echo request, id 2936, seq 1, length 64
15:59:01.113949 IP 192.168.4.2 > 192.168.1.101: ICMP echo reply, id 2936, seq 1, length 64
15:59:06.176166 IP 192.168.1.101 > 192.168.4.2: ICMP echo request, id 3008, seq 1, length 64
15:59:06.176174 IP 192.168.4.2 > 192.168.1.101: ICMP echo reply, id 3008, seq 1, length 64
15:59:11.218652 IP 192.168.1.101 > 192.168.4.2: ICMP echo request, id 3128, seq 1, length 64
15:59:11.218662 IP 192.168.4.2 > 192.168.1.101: ICMP echo reply, id 3128, seq 1, length 64
15:59:16.258358 IP 192.168.1.101 > 192.168.4.2: ICMP echo request, id 3196, seq 1, length 64
15:59:16.258368 IP 192.168.4.2 > 192.168.1.101: ICMP echo reply, id 3196, seq 1, length 64
15:59:21.274180 ARP, Request who-has 192.168.1.1 tell 192.168.1.101, length 28
15:59:21.274184 ARP, Reply 192.168.1.1 is-at 66:c2:ae:e1:6a:17 (oui Unknown), length 28
15:59:21.278256 IP 192.168.1.101 > 192.168.4.2: ICMP echo request, id 3296, seq 1, length 64
15:59:21.278282 IP 192.168.4.2 > 192.168.1.101: ICMP echo reply, id 3296, seq 1, length 64
15:59:25.244558 IP 192.168.1.1 > 192.168.1.2: ICMP echo request, id 3366, seq 1, length 64
15:59:25.245688 IP 192.168.1.2 > 192.168.1.1: ICMP echo reply, id 3366, seq 1, length 64
15:59:25.247112 IP 192.168.1.1 > 192.168.1.3: ICMP echo request, id 3367, seq 1, length 64
15:59:25.247986 IP 192.168.1.3 > 192.168.1.1: ICMP echo reply, id 3367, seq 1, length 64
15:59:26.293666 IP 192.168.1.101 > 192.168.4.2: ICMP echo request, id 3381, seq 1, length 64
15:59:26.293676 IP 192.168.4.2 > 192.168.1.101: ICMP echo reply, id 3381, seq 1, length 64

15:59:31.310318 IP 192.168.1.101 > 192.168.4.2: ICMP echo request, id 3490, seq 1, length 64
15:59:31.310330 IP 192.168.4.2 > 192.168.1.101: ICMP echo reply, id 3490, seq 1, length 64
15:59:31.320930 IP 192.168.1.101 > 192.168.1.1: ICMP echo request, id 3502, seq 1, length 64
15:59:31.320940 IP 192.168.1.1 > 192.168.1.101: ICMP echo reply, id 3502, seq 1, length 64
15:59:36.312848 ARP, Request who-has 192.168.1.101 tell 192.168.1.1, length 28
15:59:36.312972 ARP, Reply 192.168.1.101 is-at da:77:25:82:e9:80 (oui Unknown), length 28
15:59:36.339939 IP 192.168.1.101 > 192.168.4.2: ICMP echo request, id 3645, seq 1, length 64
15:59:36.339949 IP 192.168.4.2 > 192.168.1.101: ICMP echo reply, id 3645, seq 1, length 64
15:59:36.370929 IP 192.168.1.103.32789 > 192.168.4.2.33434: UDP, length 32
15:59:36.370972 IP 192.168.4.2 > 192.168.1.103: ICMP 192.168.4.2 udp port 33434 unreachable, length 68
15:59:36.371821 IP 192.168.1.103.58971 > 192.168.4.2.33435: UDP, length 32
15:59:36.371828 IP 192.168.4.2 > 192.168.1.103: ICMP 192.168.4.2 udp port 33435 unreachable, length 68
15:59:36.372704 IP 192.168.1.103.50179 > 192.168.4.2.33436: UDP, length 32
15:59:36.372710 IP 192.168.4.2 > 192.168.1.103: ICMP 192.168.4.2 udp port 33436 unreachable, length 68
15:59:36.373598 IP 192.168.1.103.48494 > 192.168.4.2.33437: UDP, length 32
15:59:36.373608 IP 192.168.4.2 > 192.168.1.103: ICMP 192.168.4.2 udp port 33437 unreachable, length 68
15:59:36.375046 IP 192.168.1.103.35166 > 192.168.4.2.33442: UDP, length 32
15:59:36.375053 IP 192.168.4.2 > 192.168.1.103: ICMP 192.168.4.2 udp port 33442 unreachable, length 68
15:59:36.375091 IP 192.168.1.103.47903 > 192.168.4.2.33444: UDP, length 32
15:59:36.375095 IP 192.168.4.2 > 192.168.1.103: ICMP 192.168.4.2 udp port 33444 unreachable, length 68
15:59:36.375122 IP 192.168.1.103.56368 > 192.168.4.2.33449: UDP, length 32
15:59:36.375132 IP 192.168.1.103.51985 > 192.168.4.2.33448: UDP, length 32
15:59:36.375140 IP 192.168.1.103.41236 > 192.168.4.2.33447: UDP, length 32
15:59:36.375149 IP 192.168.1.103.33366 > 192.168.4.2.33441: UDP, length 32
15:59:36.375157 IP 192.168.1.103.39587 > 192.168.4.2.33438: UDP, length 32
15:59:36.375164 IP 192.168.1.103.48202 > 192.168.4.2.33446: UDP, length 32
15:59:36.375172 IP 192.168.1.103.47616 > 192.168.4.2.33440: UDP, length 32
15:59:36.375180 IP 192.168.1.103.44037 > 192.168.4.2.33445: UDP, length 32
15:59:36.375187 IP 192.168.1.103.35881 > 192.168.4.2.33439: UDP, length 32
15:59:36.375200 IP 192.168.1.103.43915 > 192.168.4.2.33443: UDP, length 32
15:59:36.379797 IP 192.168.1.101 > 192.168.1.1: ICMP echo request, id 3660, seq 1, length 64
15:59:36.379810 IP 192.168.1.1 > 192.168.1.101: ICMP echo reply, id 3660, seq 1, length 64
15:59:41.384533 ARP, Request who-has 192.168.1.103 tell 192.168.1.1, length 28
15:59:41.386041 ARP, Request who-has 192.168.1.1 tell 192.168.1.103, length 28
15:59:41.386050 ARP, Reply 192.168.1.1 is-at 66:c2:ae:e1:6a:17 (oui Unknown), length 28
15:59:41.388095 ARP, Reply 192.168.1.103 is-at 22:8c:9f:70:21:ae (oui Unknown), length 28
15:59:41.391597 IP 192.168.1.101 > 192.168.4.2: ICMP echo request, id 3761, seq 1, length 64
15:59:41.391608 IP 192.168.4.2 > 192.168.1.101: ICMP echo reply, id 3761, seq 1, length 64
15:59:41.402594 IP 192.168.1.101 > 192.168.1.1: ICMP echo request, id 3773, seq 1, length 64
15:59:41.402603 IP 192.168.1.1 > 192.168.1.101: ICMP echo reply, id 3773, seq 1, length 64
15:59:46.409298 IP 192.168.1.101 > 192.168.4.2: ICMP echo request, id 3900, seq 1, length 64
15:59:46.409308 IP 192.168.4.2 > 192.168.1.101: ICMP echo reply, id 3900, seq 1, length 64
15:59:46.419929 IP 192.168.1.101 > 192.168.1.1: ICMP echo request, id 3912, seq 1, length 64
15:59:46.419941 IP 192.168.1.1 > 192.168.1.101: ICMP echo reply, id 3912, seq 1, length 64
15:59:51.431312 IP 192.168.1.101 > 192.168.4.2: ICMP echo request, id 3990, seq 1, length 64
15:59:51.431322 IP 192.168.4.2 > 192.168.1.101: ICMP echo reply, id 3990, seq 1, length 64
15:59:51.442150 IP 192.168.1.101 > 192.168.1.1: ICMP echo request, id 4002, seq 1, length 64
15:59:51.442159 IP 192.168.1.1 > 192.168.1.101: ICMP echo reply, id 4002, seq 1, length 64
15:59:56.449979 IP 192.168.1.101 > 192.168.4.2: ICMP echo request, id 4076, seq 1, length 64
15:59:56.449990 IP 192.168.4.2 > 192.168.1.101: ICMP echo reply, id 4076, seq 1, length 64
15:59:56.460282 IP 192.168.1.101 > 192.168.1.1: ICMP echo request, id 4088, seq 1, length 64
15:59:56.460291 IP 192.168.1.1 > 192.168.1.101: ICMP echo reply, id 4088, seq 1, length 64

16:00:01.468637 IP 192.168.1.101 > 192.168.4.2: ICMP echo request, id 4180, seq 1, length 64
16:00:01.468647 IP 192.168.4.2 > 192.168.1.101: ICMP echo reply, id 4180, seq 1, length 64
16:00:01.479141 IP 192.168.1.101 > 192.168.1.1: ICMP echo request, id 4192, seq 1, length 64
16:00:01.479151 IP 192.168.1.1 > 192.168.1.101: ICMP echo reply, id 4192, seq 1, length 64
16:00:06.489759 IP 192.168.1.101 > 192.168.4.2: ICMP echo request, id 4325, seq 1, length 64
16:00:06.489769 IP 192.168.4.2 > 192.168.1.101: ICMP echo reply, id 4325, seq 1, length 64
16:00:06.500565 IP 192.168.1.101 > 192.168.1.1: ICMP echo request, id 4339, seq 1, length 64
16:00:06.500574 IP 192.168.1.1 > 192.168.1.101: ICMP echo reply, id 4339, seq 1, length 64
16:00:11.497034 ARP, Request who-has 192.168.1.1 tell 192.168.1.101, length 28
16:00:11.497041 ARP, Reply 192.168.1.1 is-at 66:c2:ae:e1:6a:17 (oui Unknown), length 28
16:00:11.509893 IP 192.168.1.101 > 192.168.4.2: ICMP echo request, id 4414, seq 1, length 64
16:00:11.509906 IP 192.168.4.2 > 192.168.1.101: ICMP echo reply, id 4414, seq 1, length 64
16:00:11.522184 IP 192.168.1.101 > 192.168.1.1: ICMP echo request, id 4426, seq 1, length 64
16:00:11.522199 IP 192.168.1.1 > 192.168.1.101: ICMP echo reply, id 4426, seq 1, length 64
16:00:16.530042 IP 192.168.1.101 > 192.168.4.2: ICMP echo request, id 4576, seq 1, length 64
16:00:16.530053 IP 192.168.4.2 > 192.168.1.101: ICMP echo reply, id 4576, seq 1, length 64
16:00:16.541555 IP 192.168.1.101 > 192.168.1.1: ICMP echo request, id 4588, seq 1, length 64
16:00:16.541567 IP 192.168.1.1 > 192.168.1.101: ICMP echo reply, id 4588, seq 1, length 64
16:00:21.550305 IP 192.168.1.101 > 192.168.4.2: ICMP echo request, id 4663, seq 1, length 64
16:00:21.550322 IP 192.168.4.2 > 192.168.1.101: ICMP echo reply, id 4663, seq 1, length 64
16:00:21.563622 IP 192.168.1.101 > 192.168.1.1: ICMP echo request, id 4675, seq 1, length 64
16:00:21.563636 IP 192.168.1.1 > 192.168.1.101: ICMP echo reply, id 4675, seq 1, length 64
16:00:26.552839 ARP, Request who-has 192.168.1.101 tell 192.168.1.1, length 28
16:00:26.552971 ARP, Reply 192.168.1.101 is-at da:77:25:82:e9:80 (oui Unknown), length 28
16:00:26.574939 IP 192.168.1.101 > 192.168.4.2: ICMP echo request, id 4749, seq 1, length 64
16:00:26.574949 IP 192.168.4.2 > 192.168.1.101: ICMP echo reply, id 4749, seq 1, length 64
16:00:26.585607 IP 192.168.1.101 > 192.168.1.1: ICMP echo request, id 4761, seq 1, length 64
16:00:26.585631 IP 192.168.1.1 > 192.168.1.101: ICMP echo reply, id 4761, seq 1, length 64

16:00:31.594199 IP 192.168.1.101 > 192.168.4.2: ICMP echo request, id 4849, seq 1, length 64
16:00:31.594212 IP 192.168.4.2 > 192.168.1.101: ICMP echo reply, id 4849, seq 1, length 64
16:00:31.604573 IP 192.168.1.101 > 192.168.1.1: ICMP echo request, id 4861, seq 1, length 64
16:00:31.604583 IP 192.168.1.1 > 192.168.1.101: ICMP echo reply, id 4861, seq 1, length 64
16:00:36.494066 IP 192.168.1.103.55353 > 192.168.4.2.33434: UDP, length 32
16:00:36.494082 IP 192.168.4.2 > 192.168.1.103: ICMP 192.168.4.2 udp port 33434 unreachable, length 68
16:00:36.494948 IP 192.168.1.103.60101 > 192.168.4.2.33435: UDP, length 32
16:00:36.494959 IP 192.168.4.2 > 192.168.1.103: ICMP 192.168.4.2 udp port 33435 unreachable, length 68
16:00:36.495727 IP 192.168.1.103.34470 > 192.168.4.2.33436: UDP, length 32
16:00:36.495736 IP 192.168.4.2 > 192.168.1.103: ICMP 192.168.4.2 udp port 33436 unreachable, length 68
16:00:36.496994 IP 192.168.1.103.48792 > 192.168.4.2.33449: UDP, length 32
16:00:36.497003 IP 192.168.4.2 > 192.168.1.103: ICMP 192.168.4.2 udp port 33449 unreachable, length 68
16:00:36.497045 IP 192.168.1.103.50107 > 192.168.4.2.33439: UDP, length 32
16:00:36.497049 IP 192.168.4.2 > 192.168.1.103: ICMP 192.168.4.2 udp port 33439 unreachable, length 68
16:00:36.497078 IP 192.168.1.103.48220 > 192.168.4.2.33445: UDP, length 32
16:00:36.497082 IP 192.168.4.2 > 192.168.1.103: ICMP 192.168.4.2 udp port 33445 unreachable, length 68
16:00:36.497108 IP 192.168.1.103.41563 > 192.168.4.2.33437: UDP, length 32
16:00:36.497118 IP 192.168.1.103.39289 > 192.168.4.2.33442: UDP, length 32
16:00:36.497127 IP 192.168.1.103.34337 > 192.168.4.2.33447: UDP, length 32
16:00:36.497135 IP 192.168.1.103.35673 > 192.168.4.2.33443: UDP, length 32
16:00:36.497143 IP 192.168.1.103.38565 > 192.168.4.2.33444: UDP, length 32
16:00:36.497151 IP 192.168.1.103.35148 > 192.168.4.2.33446: UDP, length 32
16:00:36.497159 IP 192.168.1.103.51294 > 192.168.4.2.33440: UDP, length 32
16:00:36.497168 IP 192.168.1.103.37853 > 192.168.4.2.33441: UDP, length 32
16:00:36.497176 IP 192.168.1.103.36506 > 192.168.4.2.33448: UDP, length 32
16:00:36.497189 IP 192.168.1.103.33855 > 192.168.4.2.33438: UDP, length 32
16:00:36.617547 IP 192.168.1.101 > 192.168.4.2: ICMP echo request, id 4979, seq 1, length 64
16:00:36.617559 IP 192.168.4.2 > 192.168.1.101: ICMP echo reply, id 4979, seq 1, length 64
16:00:36.628392 IP 192.168.1.101 > 192.168.1.1: ICMP echo request, id 4991, seq 1, length 64
16:00:36.628402 IP 192.168.1.1 > 192.168.1.101: ICMP echo reply, id 4991, seq 1, length 64
16:00:41.496508 ARP, Request who-has 192.168.1.103 tell 192.168.1.1, length 28
16:00:41.496602 ARP, Request who-has 192.168.1.1 tell 192.168.1.103, length 28
16:00:41.496606 ARP, Reply 192.168.1.1 is-at 66:c2:ae:e1:6a:17 (oui Unknown), length 28
16:00:41.496653 ARP, Reply 192.168.1.103 is-at 22:8c:9f:70:21:ae (oui Unknown), length 28
16:00:41.639796 IP 192.168.1.101 > 192.168.4.2: ICMP echo request, id 5138, seq 1, length 64
16:00:41.639810 IP 192.168.4.2 > 192.168.1.101: ICMP echo reply, id 5138, seq 1, length 64
16:00:41.651786 IP 192.168.1.101 > 192.168.1.1: ICMP echo request, id 5150, seq 1, length 64
16:00:41.651797 IP 192.168.1.1 > 192.168.1.101: ICMP echo reply, id 5150, seq 1, length 64
16:00:46.662266 IP 192.168.1.101 > 192.168.4.2: ICMP echo request, id 5244, seq 1, length 64
16:00:46.662278 IP 192.168.4.2 > 192.168.1.101: ICMP echo reply, id 5244, seq 1, length 64
16:00:46.672394 IP 192.168.1.101 > 192.168.1.1: ICMP echo request, id 5256, seq 1, length 64
16:00:46.672404 IP 192.168.1.1 > 192.168.1.101: ICMP echo reply, id 5256, seq 1, length 64
16:00:51.681497 IP 192.168.1.101 > 192.168.4.2: ICMP echo request, id 5379, seq 1, length 64
16:00:51.681508 IP 192.168.4.2 > 192.168.1.101: ICMP echo reply, id 5379, seq 1, length 64
16:00:51.691564 IP 192.168.1.101 > 192.168.1.1: ICMP echo request, id 5391, seq 1, length 64
16:00:51.691573 IP 192.168.1.1 > 192.168.1.101: ICMP echo reply, id 5391, seq 1, length 64
16:00:56.701505 IP 192.168.1.101 > 192.168.4.2: ICMP echo request, id 5465, seq 1, length 64
16:00:56.701534 IP 192.168.4.2 > 192.168.1.101: ICMP echo reply, id 5465, seq 1, length 64
16:00:56.713001 IP 192.168.1.101 > 192.168.1.1: ICMP echo request, id 5477, seq 1, length 64
16:00:56.713025 IP 192.168.1.1 > 192.168.1.101: ICMP echo reply, id 5477, seq 1, length 64

16:01:01.704774 ARP, Request who-has 192.168.1.1 tell 192.168.1.101, length 28
16:01:01.704783 ARP, Reply 192.168.1.1 is-at 66:c2:ae:e1:6a:17 (oui Unknown), length 28
16:01:01.723918 IP 192.168.1.101 > 192.168.4.2: ICMP echo request, id 5562, seq 1, length 64
16:01:01.723928 IP 192.168.4.2 > 192.168.1.101: ICMP echo reply, id 5562, seq 1, length 64
16:01:01.734235 IP 192.168.1.101 > 192.168.1.1: ICMP echo request, id 5574, seq 1, length 64
16:01:01.734245 IP 192.168.1.1 > 192.168.1.101: ICMP echo reply, id 5574, seq 1, length 64
16:01:06.743759 IP 192.168.1.101 > 192.168.4.2: ICMP echo request, id 5648, seq 1, length 64
16:01:06.743769 IP 192.168.4.2 > 192.168.1.101: ICMP echo reply, id 5648, seq 1, length 64
16:01:06.754213 IP 192.168.1.101 > 192.168.1.1: ICMP echo request, id 5660, seq 1, length 64
16:01:06.754223 IP 192.168.1.1 > 192.168.1.101: ICMP echo reply, id 5660, seq 1, length 64
16:01:11.766961 IP 192.168.1.101 > 192.168.4.2: ICMP echo request, id 5732, seq 1, length 64
16:01:11.766974 IP 192.168.4.2 > 192.168.1.101: ICMP echo reply, id 5732, seq 1, length 64
16:01:11.779970 IP 192.168.1.101 > 192.168.1.1: ICMP echo request, id 5744, seq 1, length 64
16:01:11.779984 IP 192.168.1.1 > 192.168.1.101: ICMP echo reply, id 5744, seq 1, length 64
16:01:16.777124 ARP, Request who-has 192.168.1.101 tell 192.168.1.1, length 28
16:01:16.777209 ARP, Reply 192.168.1.101 is-at da:77:25:82:e9:80 (oui Unknown), length 28
16:01:16.789696 IP 192.168.1.101 > 192.168.4.2: ICMP echo request, id 5818, seq 1, length 64
16:01:16.789705 IP 192.168.4.2 > 192.168.1.101: ICMP echo reply, id 5818, seq 1, length 64
16:01:16.799633 IP 192.168.1.101 > 192.168.1.1: ICMP echo request, id 5830, seq 1, length 64
16:01:16.799642 IP 192.168.1.1 > 192.168.1.101: ICMP echo reply, id 5830, seq 1, length 64
16:01:21.809294 IP 192.168.1.101 > 192.168.4.2: ICMP echo request, id 5912, seq 1, length 64
16:01:21.809304 IP 192.168.4.2 > 192.168.1.101: ICMP echo reply, id 5912, seq 1, length 64
16:01:21.820159 IP 192.168.1.101 > 192.168.1.1: ICMP echo request, id 5924, seq 1, length 64
16:01:21.820168 IP 192.168.1.1 > 192.168.1.101: ICMP echo reply, id 5924, seq 1, length 64
16:01:26.830664 IP 192.168.1.101 > 192.168.4.2: ICMP echo request, id 6096, seq 1, length 64
16:01:26.830675 IP 192.168.4.2 > 192.168.1.101: ICMP echo reply, id 6096, seq 1, length 64
16:01:26.841608 IP 192.168.1.101 > 192.168.1.1: ICMP echo request, id 6108, seq 1, length 64
16:01:26.841617 IP 192.168.1.1 > 192.168.1.101: ICMP echo reply, id 6108, seq 1, length 64

16:01:31.853453 IP 192.168.1.101 > 192.168.4.2: ICMP echo request, id 6202, seq 1, length 64
16:01:31.853462 IP 192.168.4.2 > 192.168.1.101: ICMP echo reply, id 6202, seq 1, length 64
16:01:31.864072 IP 192.168.1.101 > 192.168.1.1: ICMP echo request, id 6214, seq 1, length 64
16:01:31.864081 IP 192.168.1.1 > 192.168.1.101: ICMP echo reply, id 6214, seq 1, length 64
16:01:36.874860 IP 192.168.1.101 > 192.168.4.2: ICMP echo request, id 6339, seq 1, length 64
16:01:36.874870 IP 192.168.4.2 > 192.168.1.101: ICMP echo reply, id 6339, seq 1, length 64
16:01:36.884680 IP 192.168.1.101 > 192.168.1.1: ICMP echo request, id 6351, seq 1, length 64
16:01:36.884689 IP 192.168.1.1 > 192.168.1.101: ICMP echo reply, id 6351, seq 1, length 64
16:01:41.897576 IP 192.168.1.101 > 192.168.4.2: ICMP echo request, id 6423, seq 1, length 64
16:01:41.897591 IP 192.168.4.2 > 192.168.1.101: ICMP echo reply, id 6423, seq 1, length 64
16:01:41.909657 IP 192.168.1.101 > 192.168.1.1: ICMP echo request, id 6435, seq 1, length 64
16:01:41.909673 IP 192.168.1.1 > 192.168.1.101: ICMP echo reply, id 6435, seq 1, length 64
16:01:46.918577 IP 192.168.1.101 > 192.168.4.2: ICMP echo request, id 6509, seq 1, length 64
16:01:46.918587 IP 192.168.4.2 > 192.168.1.101: ICMP echo reply, id 6509, seq 1, length 64
16:01:46.929694 IP 192.168.1.101 > 192.168.1.1: ICMP echo request, id 6521, seq 1, length 64
16:01:46.929705 IP 192.168.1.1 > 192.168.1.101: ICMP echo reply, id 6521, seq 1, length 64
16:01:51.928963 ARP, Request who-has 192.168.1.1 tell 192.168.1.101, length 28
16:01:51.928989 ARP, Reply 192.168.1.1 is-at 66:c2:ae:e1:6a:17 (oui Unknown), length 28
16:01:51.938288 IP 192.168.1.101 > 192.168.4.2: ICMP echo request, id 6593, seq 1, length 64
16:01:51.938297 IP 192.168.4.2 > 192.168.1.101: ICMP echo reply, id 6593, seq 1, length 64
16:01:51.950054 IP 192.168.1.101 > 192.168.1.1: ICMP echo request, id 6605, seq 1, length 64
16:01:51.950064 IP 192.168.1.1 > 192.168.1.101: ICMP echo reply, id 6605, seq 1, length 64
16:01:56.960496 IP 192.168.1.101 > 192.168.4.2: ICMP echo request, id 6689, seq 1, length 64
16:01:56.960508 IP 192.168.4.2 > 192.168.1.101: ICMP echo reply, id 6689, seq 1, length 64
16:01:56.972204 IP 192.168.1.101 > 192.168.1.1: ICMP echo request, id 6701, seq 1, length 64
16:01:56.972212 IP 192.168.1.1 > 192.168.1.101: ICMP echo reply, id 6701, seq 1, length 64

16:02:01.984176 IP 192.168.1.101 > 192.168.4.2: ICMP echo request, id 6835, seq 1, length 64
16:02:01.984188 IP 192.168.4.2 > 192.168.1.101: ICMP echo reply, id 6835, seq 1, length 64
16:02:01.994386 IP 192.168.1.101 > 192.168.1.1: ICMP echo request, id 6847, seq 1, length 64
16:02:01.994394 IP 192.168.1.1 > 192.168.1.101: ICMP echo reply, id 6847, seq 1, length 64
16:02:06.984761 ARP, Request who-has 192.168.1.101 tell 192.168.1.1, length 28
16:02:06.984892 ARP, Reply 192.168.1.101 is-at da:77:25:82:e9:80 (oui Unknown), length 28
16:02:07.004970 IP 192.168.1.101 > 192.168.4.2: ICMP echo request, id 6936, seq 1, length 64
16:02:07.004979 IP 192.168.4.2 > 192.168.1.101: ICMP echo reply, id 6936, seq 1, length 64
16:02:07.014939 IP 192.168.1.101 > 192.168.1.1: ICMP echo request, id 6948, seq 1, length 64
16:02:07.014947 IP 192.168.1.1 > 192.168.1.101: ICMP echo reply, id 6948, seq 1, length 64
16:02:12.029581 IP 192.168.1.101 > 192.168.4.2: ICMP echo request, id 7101, seq 1, length 64
16:02:12.029591 IP 192.168.4.2 > 192.168.1.101: ICMP echo reply, id 7101, seq 1, length 64
16:02:12.040611 IP 192.168.1.101 > 192.168.1.1: ICMP echo request, id 7113, seq 1, length 64
16:02:12.040620 IP 192.168.1.1 > 192.168.1.101: ICMP echo reply, id 7113, seq 1, length 64
16:02:17.050566 IP 192.168.1.101 > 192.168.4.2: ICMP echo request, id 7187, seq 1, length 64
16:02:17.050575 IP 192.168.4.2 > 192.168.1.101: ICMP echo reply, id 7187, seq 1, length 64
16:02:17.060728 IP 192.168.1.101 > 192.168.1.1: ICMP echo request, id 7199, seq 1, length 64
16:02:17.060737 IP 192.168.1.1 > 192.168.1.101: ICMP echo reply, id 7199, seq 1, length 64
16:02:22.068413 IP 192.168.1.101 > 192.168.4.2: ICMP echo request, id 7271, seq 1, length 64
16:02:22.068422 IP 192.168.4.2 > 192.168.1.101: ICMP echo reply, id 7271, seq 1, length 64
16:02:22.078275 IP 192.168.1.101 > 192.168.1.1: ICMP echo request, id 7283, seq 1, length 64
16:02:22.078284 IP 192.168.1.1 > 192.168.1.101: ICMP echo reply, id 7283, seq 1, length 64
16:02:27.085892 IP 192.168.1.101 > 192.168.4.2: ICMP echo request, id 7357, seq 1, length 64
16:02:27.085901 IP 192.168.4.2 > 192.168.1.101: ICMP echo reply, id 7357, seq 1, length 64
16:02:27.095653 IP 192.168.1.101 > 192.168.1.1: ICMP echo request, id 7369, seq 1, length 64
16:02:27.095662 IP 192.168.1.1 > 192.168.1.101: ICMP echo reply, id 7369, seq 1, length 64

16:02:32.106415 IP 192.168.1.101 > 192.168.4.2: ICMP echo request, id 7453, seq 1, length 64
16:02:32.106424 IP 192.168.4.2 > 192.168.1.101: ICMP echo reply, id 7453, seq 1, length 64
16:02:32.116272 IP 192.168.1.101 > 192.168.1.1: ICMP echo request, id 7465, seq 1, length 64
16:02:32.116283 IP 192.168.1.1 > 192.168.1.101: ICMP echo reply, id 7465, seq 1, length 64
16:02:37.127359 IP 192.168.1.101 > 192.168.4.2: ICMP echo request, id 7539, seq 1, length 64
16:02:37.127369 IP 192.168.4.2 > 192.168.1.101: ICMP echo reply, id 7539, seq 1, length 64
16:02:37.137276 IP 192.168.1.101 > 192.168.1.1: ICMP echo request, id 7551, seq 1, length 64
16:02:37.137284 IP 192.168.1.1 > 192.168.1.101: ICMP echo reply, id 7551, seq 1, length 64
16:02:42.136647 ARP, Request who-has 192.168.1.1 tell 192.168.1.101, length 28
16:02:42.136653 ARP, Reply 192.168.1.1 is-at 66:c2:ae:e1:6a:17 (oui Unknown), length 28
16:02:42.146092 IP 192.168.1.101 > 192.168.4.2: ICMP echo request, id 7633, seq 1, length 64
16:02:42.146101 IP 192.168.4.2 > 192.168.1.101: ICMP echo reply, id 7633, seq 1, length 64
16:02:42.155408 IP 192.168.1.101 > 192.168.1.1: ICMP echo request, id 7645, seq 1, length 64
16:02:42.155416 IP 192.168.1.1 > 192.168.1.101: ICMP echo reply, id 7645, seq 1, length 64
16:02:47.166461 IP 192.168.1.101 > 192.168.4.2: ICMP echo request, id 7769, seq 1, length 64
16:02:47.166472 IP 192.168.4.2 > 192.168.1.101: ICMP echo reply, id 7769, seq 1, length 64
16:02:47.176979 IP 192.168.1.101 > 192.168.1.1: ICMP echo request, id 7781, seq 1, length 64
16:02:47.176989 IP 192.168.1.1 > 192.168.1.101: ICMP echo reply, id 7781, seq 1, length 64
16:02:52.183800 IP 192.168.1.101 > 192.168.4.2: ICMP echo request, id 7868, seq 1, length 64
16:02:52.183811 IP 192.168.4.2 > 192.168.1.101: ICMP echo reply, id 7868, seq 1, length 64
16:02:52.193189 IP 192.168.1.101 > 192.168.1.1: ICMP echo request, id 7880, seq 1, length 64
16:02:52.193197 IP 192.168.1.1 > 192.168.1.101: ICMP echo reply, id 7880, seq 1, length 64
16:02:57.193011 ARP, Request who-has 192.168.1.101 tell 192.168.1.1, length 28
16:02:57.193122 ARP, Reply 192.168.1.101 is-at da:77:25:82:e9:80 (oui Unknown), length 28
16:02:57.201683 IP 192.168.1.101 > 192.168.4.2: ICMP echo request, id 8029, seq 1, length 64
16:02:57.201691 IP 192.168.4.2 > 192.168.1.101: ICMP echo reply, id 8029, seq 1, length 64
16:02:57.211574 IP 192.168.1.101 > 192.168.1.1: ICMP echo request, id 8041, seq 1, length 64
16:02:57.211581 IP 192.168.1.1 > 192.168.1.101: ICMP echo reply, id 8041, seq 1, length 64

16:03:02.218526 IP 192.168.1.101 > 192.168.4.2: ICMP echo request, id 8125, seq 1, length 64
16:03:02.218536 IP 192.168.4.2 > 192.168.1.101: ICMP echo reply, id 8125, seq 1, length 64
16:03:02.228412 IP 192.168.1.101 > 192.168.1.1: ICMP echo request, id 8137, seq 1, length 64
16:03:02.228422 IP 192.168.1.1 > 192.168.1.101: ICMP echo reply, id 8137, seq 1, length 64

