02:43:50.000877 IP 12.10.5.101 > 192.168.1.1: ICMP echo request, id 6704, seq 1, length 64
02:43:50.000890 IP 192.168.1.1 > 12.10.5.101: ICMP echo reply, id 6704, seq 1, length 64
02:43:50.005515 IP 12.10.5.101 > 192.168.1.103: ICMP echo request, id 6707, seq 1, length 64
02:43:50.006582 IP 192.168.1.103 > 12.10.5.101: ICMP echo reply, id 6707, seq 1, length 64
02:43:53.984400 ARP, Request who-has 12.10.5.101 tell 12.10.5.1, length 28
02:43:53.985485 ARP, Reply 12.10.5.101 is-at 1e:f6:60:c5:d7:87 (oui Unknown), length 28
02:43:55.015846 IP 12.10.5.101 > 192.168.2.1: ICMP echo request, id 6732, seq 1, length 64
02:43:55.015861 IP 192.168.2.1 > 12.10.5.101: ICMP echo reply, id 6732, seq 1, length 64
02:43:55.022165 IP 12.10.5.101 > 12.10.5.1: ICMP echo request, id 6738, seq 1, length 64
02:43:55.022178 IP 12.10.5.1 > 12.10.5.101: ICMP echo reply, id 6738, seq 1, length 64
02:43:55.028876 IP 12.10.5.101 > 192.168.2.103: ICMP echo request, id 6741, seq 1, length 64
02:43:55.052270 IP 192.168.1.101 > 12.10.5.103: ICMP echo request, id 6749, seq 1, length 64
02:43:55.052346 IP 12.10.5.103 > 192.168.1.101: ICMP echo reply, id 6749, seq 1, length 64
02:43:56.061331 IP 12.10.5.101 > 192.168.1.1: ICMP echo request, id 6823, seq 1, length 64
02:43:56.061345 IP 192.168.1.1 > 12.10.5.101: ICMP echo reply, id 6823, seq 1, length 64
02:43:56.074176 IP 12.10.5.101 > 192.168.1.103: ICMP echo request, id 6838, seq 1, length 64
02:43:56.074243 IP 192.168.1.103 > 12.10.5.101: ICMP echo reply, id 6838, seq 1, length 64
02:43:56.081003 IP 192.168.1.101 > 12.10.5.101: ICMP echo request, id 6841, seq 1, length 64
02:43:56.082212 IP 12.10.5.101 > 192.168.1.101: ICMP echo reply, id 6841, seq 1, length 64
02:44:00.064601 ARP, Request who-has 12.10.5.103 tell 12.10.5.1, length 28
02:44:00.064700 ARP, Reply 12.10.5.103 is-at ce:c6:f9:09:40:2d (oui Unknown), length 28
02:44:01.094717 IP 12.10.5.101 > 192.168.2.1: ICMP echo request, id 6871, seq 1, length 64
02:44:01.094730 IP 192.168.2.1 > 12.10.5.101: ICMP echo reply, id 6871, seq 1, length 64
02:44:01.106893 IP 192.168.1.101 > 12.10.5.103: ICMP echo request, id 6880, seq 1, length 64
02:44:01.107023 IP 12.10.5.103 > 192.168.1.101: ICMP echo reply, id 6880, seq 1, length 64
02:44:01.111337 IP 12.10.5.101 > 12.10.5.1: ICMP echo request, id 6883, seq 1, length 64
02:44:01.111351 IP 12.10.5.1 > 12.10.5.101: ICMP echo reply, id 6883, seq 1, length 64
02:44:01.117225 IP 12.10.5.101 > 192.168.2.103: ICMP echo request, id 6889, seq 1, length 64
02:44:02.036378 ARP, Request who-has 12.10.5.3 tell 12.10.5.2, length 28
02:44:02.046544 ARP, Request who-has 12.10.5.4 tell 12.10.5.2, length 28
02:44:02.055675 ARP, Request who-has 12.10.5.1 tell 12.10.5.2, length 28
02:44:02.055701 ARP, Reply 12.10.5.1 is-at 06:c5:13:9c:b8:90 (oui Unknown), length 28
02:44:02.056804 IP 12.10.5.2 > 192.168.1.3: ICMP echo request, id 6897, seq 1, length 64
02:44:02.059113 IP 192.168.1.3 > 12.10.5.2: ICMP echo reply, id 6897, seq 1, length 64
02:44:02.064788 IP 12.10.5.2 > 192.168.1.2: ICMP echo request, id 6898, seq 1, length 64
02:44:02.069463 IP 192.168.1.2 > 12.10.5.2: ICMP echo reply, id 6898, seq 1, length 64
02:44:02.074323 IP 12.10.5.2 > 192.168.1.4: ICMP echo request, id 6899, seq 1, length 64
02:44:02.076761 IP 192.168.1.4 > 12.10.5.2: ICMP echo reply, id 6899, seq 1, length 64
02:44:02.080277 IP 12.10.5.2 > 192.168.2.3: ICMP echo request, id 6900, seq 1, length 64
02:44:02.124854 IP 12.10.5.101 > 192.168.1.1: ICMP echo request, id 6901, seq 1, length 64
02:44:02.124871 IP 192.168.1.1 > 12.10.5.101: ICMP echo reply, id 6901, seq 1, length 64
02:44:02.159743 IP 12.10.5.101 > 192.168.1.103: ICMP echo request, id 6907, seq 1, length 64
02:44:02.159933 IP 192.168.1.103 > 12.10.5.101: ICMP echo reply, id 6907, seq 1, length 64
02:44:02.177957 IP 12.10.5.101 > 192.168.1.101: ICMP echo request, id 6913, seq 1, length 64
02:44:02.179914 IP 192.168.1.101 > 12.10.5.101: ICMP echo reply, id 6913, seq 1, length 64
02:44:02.194048 IP 192.168.1.101 > 12.10.5.101: ICMP echo request, id 6919, seq 1, length 64
02:44:02.194147 IP 12.10.5.101 > 192.168.1.101: ICMP echo reply, id 6919, seq 1, length 64
02:44:06.113072 ARP, Request who-has 12.10.5.1 tell 12.10.5.103, length 28
02:44:06.113084 ARP, Reply 12.10.5.1 is-at 06:c5:13:9c:b8:90 (oui Unknown), length 28
02:44:07.072451 ARP, Request who-has 12.10.5.2 tell 12.10.5.1, length 28
02:44:07.074009 ARP, Reply 12.10.5.2 is-at 5a:13:bd:24:0f:63 (oui Unknown), length 28
02:44:07.199827 IP 12.10.5.101 > 192.168.2.1: ICMP echo request, id 6954, seq 1, length 64
02:44:07.199840 IP 192.168.2.1 > 12.10.5.101: ICMP echo reply, id 6954, seq 1, length 64
02:44:07.208394 IP 192.168.1.101 > 12.10.5.103: ICMP echo request, id 6963, seq 1, length 64
02:44:07.208465 IP 12.10.5.103 > 192.168.1.101: ICMP echo reply, id 6963, seq 1, length 64
02:44:07.211975 IP 12.10.5.101 > 12.10.5.1: ICMP echo request, id 6966, seq 1, length 64
02:44:07.211988 IP 12.10.5.1 > 12.10.5.101: ICMP echo reply, id 6966, seq 1, length 64
02:44:07.218075 IP 12.10.5.101 > 192.168.2.103: ICMP echo request, id 6972, seq 1, length 64
02:44:08.222091 IP 12.10.5.101 > 192.168.1.103: ICMP echo request, id 6978, seq 1, length 64
02:44:08.222195 IP 192.168.1.103 > 12.10.5.101: ICMP echo reply, id 6978, seq 1, length 64
02:44:08.233010 IP 192.168.1.101 > 12.10.5.101: ICMP echo request, id 6990, seq 1, length 64
02:44:08.233104 IP 12.10.5.101 > 192.168.1.101: ICMP echo reply, id 6990, seq 1, length 64
02:44:08.233637 IP 12.10.5.101 > 192.168.1.101: ICMP echo request, id 6987, seq 1, length 64
02:44:08.233689 IP 192.168.1.101 > 12.10.5.101: ICMP echo reply, id 6987, seq 1, length 64
02:44:08.239029 ARP, Request who-has 12.10.5.2 tell 12.10.5.101, length 28
02:44:08.247837 IP 12.10.5.101 > 192.168.1.3: ICMP echo request, id 6999, seq 1, length 64
02:44:08.249170 IP 192.168.1.3 > 12.10.5.101: ICMP echo reply, id 6999, seq 1, length 64
02:44:08.251187 IP 192.168.1.101 > 12.10.5.2: ICMP echo request, id 7002, seq 1, length 64
02:44:08.252317 IP 12.10.5.2 > 192.168.1.101: ICMP echo reply, id 7002, seq 1, length 64
02:44:08.258128 IP 12.10.5.101 > 192.168.1.2: ICMP echo request, id 7008, seq 1, length 64
02:44:08.258974 IP 192.168.1.2 > 12.10.5.101: ICMP echo reply, id 7008, seq 1, length 64
02:44:08.272538 IP 12.10.5.101 > 192.168.1.4: ICMP echo request, id 7011, seq 1, length 64
02:44:08.273482 IP 192.168.1.4 > 12.10.5.101: ICMP echo reply, id 7011, seq 1, length 64
02:44:12.084673 IP 12.10.5.2 > 192.168.2.4: ICMP echo request, id 7035, seq 1, length 64
02:44:13.286105 IP 12.10.5.101 > 192.168.2.1: ICMP echo request, id 7044, seq 1, length 64
02:44:13.286119 IP 192.168.2.1 > 12.10.5.101: ICMP echo reply, id 7044, seq 1, length 64
02:44:13.299400 IP 192.168.1.101 > 12.10.5.103: ICMP echo request, id 7056, seq 1, length 64
02:44:13.299498 IP 12.10.5.103 > 192.168.1.101: ICMP echo reply, id 7056, seq 1, length 64
02:44:13.300973 IP 12.10.5.101 > 12.10.5.1: ICMP echo request, id 7053, seq 1, length 64
02:44:13.300985 IP 12.10.5.1 > 12.10.5.101: ICMP echo reply, id 7053, seq 1, length 64
02:44:13.306169 IP 12.10.5.101 > 192.168.1.1: ICMP echo request, id 7062, seq 1, length 64
02:44:13.306239 IP 192.168.1.1 > 12.10.5.101: ICMP echo reply, id 7062, seq 1, length 64
02:44:13.316437 IP 12.10.5.101 > 192.168.1.103: ICMP echo request, id 7065, seq 1, length 64
02:44:13.316563 IP 192.168.1.103 > 12.10.5.101: ICMP echo reply, id 7065, seq 1, length 64
02:44:13.330673 IP 12.10.5.101 > 192.168.1.101: ICMP echo request, id 7080, seq 1, length 64
02:44:13.330800 IP 192.168.1.101 > 12.10.5.101: ICMP echo reply, id 7080, seq 1, length 64
02:44:13.333763 IP 192.168.1.101 > 12.10.5.101: ICMP echo request, id 7077, seq 1, length 64
02:44:13.333839 IP 12.10.5.101 > 192.168.1.101: ICMP echo reply, id 7077, seq 1, length 64
02:44:13.343610 IP 12.10.5.101 > 192.168.1.3: ICMP echo request, id 7092, seq 1, length 64
02:44:13.343722 IP 192.168.1.3 > 12.10.5.101: ICMP echo reply, id 7092, seq 1, length 64
02:44:13.349425 IP 192.168.1.101 > 12.10.5.2: ICMP echo request, id 7089, seq 1, length 64
02:44:13.349562 IP 12.10.5.2 > 192.168.1.101: ICMP echo reply, id 7089, seq 1, length 64
02:44:13.354303 IP 12.10.5.101 > 192.168.1.2: ICMP echo request, id 7095, seq 1, length 64
02:44:13.354388 IP 192.168.1.2 > 12.10.5.101: ICMP echo reply, id 7095, seq 1, length 64
02:44:13.364823 IP 12.10.5.101 > 192.168.1.4: ICMP echo request, id 7101, seq 1, length 64
02:44:13.364978 IP 192.168.1.4 > 12.10.5.101: ICMP echo reply, id 7101, seq 1, length 64

02:44:19.087206 IP 12.10.5.103.38000 > 12.10.5.1.33434: UDP, length 32
02:44:19.087226 IP 12.10.5.1 > 12.10.5.103: ICMP 12.10.5.1 udp port 33434 unreachable, length 68
02:44:19.088649 IP 12.10.5.103.59795 > 12.10.5.1.33435: UDP, length 32
02:44:19.088658 IP 12.10.5.1 > 12.10.5.103: ICMP 12.10.5.1 udp port 33435 unreachable, length 68
02:44:19.089623 IP 12.10.5.103.58432 > 12.10.5.1.33436: UDP, length 32
02:44:19.089630 IP 12.10.5.1 > 12.10.5.103: ICMP 12.10.5.1 udp port 33436 unreachable, length 68
02:44:19.090551 IP 12.10.5.103.52589 > 12.10.5.1.33437: UDP, length 32
02:44:19.090558 IP 12.10.5.1 > 12.10.5.103: ICMP 12.10.5.1 udp port 33437 unreachable, length 68
02:44:19.091839 IP 12.10.5.103.50731 > 12.10.5.1.33439: UDP, length 32
02:44:19.091847 IP 12.10.5.1 > 12.10.5.103: ICMP 12.10.5.1 udp port 33439 unreachable, length 68
02:44:19.092259 IP 12.10.5.103.46183 > 12.10.5.1.33441: UDP, length 32
02:44:19.092269 IP 12.10.5.1 > 12.10.5.103: ICMP 12.10.5.1 udp port 33441 unreachable, length 68
02:44:19.092637 IP 12.10.5.103.51754 > 12.10.5.1.33443: UDP, length 32
02:44:19.093043 IP 12.10.5.103.60468 > 12.10.5.1.33442: UDP, length 32
02:44:19.093395 IP 12.10.5.103.43148 > 12.10.5.1.33449: UDP, length 32
02:44:19.093751 IP 12.10.5.103.60852 > 12.10.5.1.33438: UDP, length 32
02:44:19.094184 IP 12.10.5.103.51478 > 12.10.5.1.33448: UDP, length 32
02:44:19.094212 IP 12.10.5.103.51372 > 12.10.5.1.33447: UDP, length 32
02:44:19.094854 IP 12.10.5.103.53394 > 12.10.5.1.33444: UDP, length 32
02:44:19.094872 IP 12.10.5.103.35881 > 12.10.5.1.33440: UDP, length 32
02:44:19.094881 IP 12.10.5.103.40760 > 12.10.5.1.33446: UDP, length 32
02:44:19.094895 IP 12.10.5.103.48082 > 12.10.5.1.33445: UDP, length 32
02:44:19.112263 ARP, Request who-has 12.10.5.2 tell 12.10.5.103, length 28
02:44:19.127612 IP 12.10.5.103.40842 > 192.168.1.4.33434: UDP, length 32
02:44:19.128158 IP 12.10.5.103.56829 > 192.168.1.4.33435: UDP, length 32
02:44:19.128970 IP 12.10.5.103.51332 > 192.168.1.4.33436: UDP, length 32
02:44:19.130102 IP 12.10.5.103.33840 > 192.168.1.4.33447: UDP, length 32
02:44:19.130183 IP 12.10.5.103.35156 > 192.168.1.4.33438: UDP, length 32
02:44:19.130241 IP 12.10.5.103.44891 > 192.168.1.4.33444: UDP, length 32
02:44:19.130273 IP 12.10.5.103.33359 > 192.168.1.4.33441: UDP, length 32
02:44:19.130339 IP 12.10.5.103.35299 > 192.168.1.4.33449: UDP, length 32
02:44:19.130386 IP 12.10.5.103.55767 > 192.168.1.4.33446: UDP, length 32
02:44:19.130443 IP 12.10.5.103.33609 > 192.168.1.4.33437: UDP, length 32
02:44:19.130497 IP 12.10.5.103.53874 > 192.168.1.4.33448: UDP, length 32
02:44:19.130530 IP 12.10.5.103.49996 > 192.168.1.4.33445: UDP, length 32
02:44:19.130588 IP 12.10.5.103.34460 > 192.168.1.4.33439: UDP, length 32
02:44:19.130639 IP 12.10.5.103.45846 > 192.168.1.4.33443: UDP, length 32
02:44:19.130667 IP 12.10.5.103.37389 > 192.168.1.4.33440: UDP, length 32
02:44:19.130720 IP 12.10.5.103.45077 > 192.168.1.4.33442: UDP, length 32
02:44:19.132398 IP 192.168.1.4 > 12.10.5.103: ICMP 192.168.1.4 udp port 33447 unreachable, length 68
02:44:19.132570 IP 192.168.1.4 > 12.10.5.103: ICMP 192.168.1.4 udp port 33438 unreachable, length 68
02:44:19.132614 IP 192.168.1.4 > 12.10.5.103: ICMP 192.168.1.4 udp port 33444 unreachable, length 68
02:44:19.132652 IP 192.168.1.4 > 12.10.5.103: ICMP 192.168.1.4 udp port 33441 unreachable, length 68
02:44:19.132689 IP 192.168.1.4 > 12.10.5.103: ICMP 192.168.1.4 udp port 33449 unreachable, length 68
02:44:19.132733 IP 192.168.1.4 > 12.10.5.103: ICMP 192.168.1.4 udp port 33446 unreachable, length 68
02:44:22.086858 IP 12.10.5.2 > 192.168.2.2: ICMP echo request, id 7247, seq 1, length 64
02:44:23.451335 IP 12.10.5.101 > 192.168.2.1: ICMP echo request, id 7281, seq 1, length 64
02:44:23.451361 IP 192.168.2.1 > 12.10.5.101: ICMP echo reply, id 7281, seq 1, length 64
02:44:23.462628 IP 12.10.5.101 > 12.10.5.1: ICMP echo request, id 7290, seq 1, length 64
02:44:23.462651 IP 12.10.5.1 > 12.10.5.101: ICMP echo reply, id 7290, seq 1, length 64
02:44:23.463336 IP 192.168.1.101 > 12.10.5.103: ICMP echo request, id 7293, seq 1, length 64
02:44:23.463402 IP 12.10.5.103 > 192.168.1.101: ICMP echo reply, id 7293, seq 1, length 64
02:44:23.469963 IP 12.10.5.101 > 192.168.1.1: ICMP echo request, id 7296, seq 1, length 64
02:44:23.469971 IP 192.168.1.1 > 12.10.5.101: ICMP echo reply, id 7296, seq 1, length 64
02:44:23.475119 IP 12.10.5.101 > 192.168.1.103: ICMP echo request, id 7305, seq 1, length 64
02:44:23.475182 IP 192.168.1.103 > 12.10.5.101: ICMP echo reply, id 7305, seq 1, length 64
02:44:23.486084 IP 192.168.1.101 > 12.10.5.101: ICMP echo request, id 7317, seq 1, length 64
02:44:23.486136 IP 12.10.5.101 > 192.168.1.101: ICMP echo reply, id 7317, seq 1, length 64
02:44:23.489078 IP 12.10.5.101 > 192.168.1.101: ICMP echo request, id 7314, seq 1, length 64
02:44:23.489208 IP 192.168.1.101 > 12.10.5.101: ICMP echo reply, id 7314, seq 1, length 64
02:44:23.500958 IP 192.168.1.101 > 12.10.5.2: ICMP echo request, id 7329, seq 1, length 64
02:44:23.501073 IP 12.10.5.2 > 192.168.1.101: ICMP echo reply, id 7329, seq 1, length 64
02:44:23.503149 IP 12.10.5.101 > 192.168.1.3: ICMP echo request, id 7326, seq 1, length 64
02:44:23.503270 IP 192.168.1.3 > 12.10.5.101: ICMP echo reply, id 7326, seq 1, length 64
02:44:23.508928 IP 12.10.5.101 > 192.168.1.2: ICMP echo request, id 7335, seq 1, length 64
02:44:23.508995 IP 192.168.1.2 > 12.10.5.101: ICMP echo reply, id 7335, seq 1, length 64
02:44:23.513104 IP 12.10.5.101 > 192.168.1.4: ICMP echo request, id 7341, seq 1, length 64
02:44:23.513212 IP 192.168.1.4 > 12.10.5.101: ICMP echo reply, id 7341, seq 1, length 64
02:44:24.137422 IP 12.10.5.103.43609 > 192.168.1.3.33434: UDP, length 32
02:44:24.137435 IP 12.10.5.1 > 12.10.5.103: ICMP time exceeded in-transit, length 68
02:44:24.138502 IP 12.10.5.103.37288 > 192.168.1.3.33435: UDP, length 32
02:44:24.138510 IP 12.10.5.1 > 12.10.5.103: ICMP time exceeded in-transit, length 68
02:44:24.139311 IP 12.10.5.103.42346 > 192.168.1.3.33436: UDP, length 32
02:44:24.139317 IP 12.10.5.1 > 12.10.5.103: ICMP time exceeded in-transit, length 68
02:44:24.140169 IP 12.10.5.103.59341 > 192.168.1.3.33437: UDP, length 32
02:44:24.140911 IP 192.168.1.3 > 12.10.5.103: ICMP 192.168.1.3 udp port 33437 unreachable, length 68
02:44:24.142266 IP 12.10.5.103.36258 > 192.168.1.3.33449: UDP, length 32
02:44:24.143101 IP 12.10.5.103.56464 > 192.168.1.3.33438: UDP, length 32
02:44:24.143413 IP 192.168.1.3 > 12.10.5.103: ICMP 192.168.1.3 udp port 33449 unreachable, length 68
02:44:24.143798 IP 12.10.5.103.35917 > 192.168.1.3.33446: UDP, length 32
02:44:24.144487 ARP, Request who-has 12.10.5.103 tell 12.10.5.1, length 28
02:44:24.144594 ARP, Reply 12.10.5.103 is-at ce:c6:f9:09:40:2d (oui Unknown), length 28
02:44:24.144901 IP 12.10.5.103.59534 > 192.168.1.3.33439: UDP, length 32
02:44:24.145533 IP 192.168.1.3 > 12.10.5.103: ICMP 192.168.1.3 udp port 33438 unreachable, length 68
02:44:24.145574 IP 192.168.1.3 > 12.10.5.103: ICMP 192.168.1.3 udp port 33446 unreachable, length 68
02:44:24.145673 IP 12.10.5.103.45556 > 192.168.1.3.33445: UDP, length 32
02:44:24.145704 IP 12.10.5.103.34702 > 192.168.1.3.33441: UDP, length 32
02:44:24.145729 IP 12.10.5.103.33113 > 192.168.1.3.33442: UDP, length 32
02:44:24.145755 IP 12.10.5.103.40718 > 192.168.1.3.33447: UDP, length 32
02:44:24.145780 IP 12.10.5.103.43188 > 192.168.1.3.33448: UDP, length 32
02:44:24.145805 IP 12.10.5.103.33922 > 192.168.1.3.33443: UDP, length 32
02:44:24.145830 IP 12.10.5.103.55711 > 192.168.1.3.33444: UDP, length 32
02:44:24.145854 IP 12.10.5.103.55599 > 192.168.1.3.33440: UDP, length 32
02:44:24.146548 IP 192.168.1.3 > 12.10.5.103: ICMP 192.168.1.3 udp port 33439 unreachable, length 68
02:44:24.147136 IP 192.168.1.3 > 12.10.5.103: ICMP 192.168.1.3 udp port 33445 unreachable, length 68
02:44:24.152542 IP 12.10.5.103.34184 > 192.168.1.2.33441: UDP, length 32
02:44:24.152594 IP 12.10.5.103.58953 > 192.168.1.2.33435: UDP, length 32
02:44:24.152601 IP 12.10.5.1 > 12.10.5.103: ICMP time exceeded in-transit, length 68
02:44:24.152633 IP 12.10.5.103.47210 > 192.168.1.2.33442: UDP, length 32
02:44:24.152660 IP 12.10.5.103.36174 > 192.168.1.2.33439: UDP, length 32
02:44:24.152687 IP 12.10.5.103.34203 > 192.168.1.2.33434: UDP, length 32
02:44:24.152691 IP 12.10.5.1 > 12.10.5.103: ICMP time exceeded in-transit, length 68
02:44:24.152716 IP 12.10.5.103.50576 > 192.168.1.2.33445: UDP, length 32
02:44:24.152742 IP 12.10.5.103.56880 > 192.168.1.2.33448: UDP, length 32
02:44:24.152768 IP 12.10.5.103.53675 > 192.168.1.2.33438: UDP, length 32
02:44:24.152793 IP 12.10.5.103.47456 > 192.168.1.2.33449: UDP, length 32
02:44:24.152833 IP 12.10.5.103.35249 > 192.168.1.2.33437: UDP, length 32
02:44:24.152859 IP 12.10.5.103.55322 > 192.168.1.2.33443: UDP, length 32
02:44:24.152918 IP 12.10.5.103.48341 > 192.168.1.2.33444: UDP, length 32
02:44:24.153937 IP 12.10.5.103.55944 > 192.168.1.2.33447: UDP, length 32
02:44:24.153984 IP 12.10.5.103.47172 > 192.168.1.2.33436: UDP, length 32
02:44:24.154013 IP 12.10.5.103.56911 > 192.168.1.2.33440: UDP, length 32
02:44:24.154082 IP 12.10.5.103.50983 > 192.168.1.2.33446: UDP, length 32
02:44:24.154831 IP 192.168.1.2 > 12.10.5.103: ICMP 192.168.1.2 udp port 33441 unreachable, length 68
02:44:24.154865 IP 192.168.1.2 > 12.10.5.103: ICMP 192.168.1.2 udp port 33442 unreachable, length 68
02:44:24.154932 IP 192.168.1.2 > 12.10.5.103: ICMP 192.168.1.2 udp port 33439 unreachable, length 68
02:44:24.154977 IP 192.168.1.2 > 12.10.5.103: ICMP 192.168.1.2 udp port 33445 unreachable, length 68
02:44:24.155003 IP 192.168.1.2 > 12.10.5.103: ICMP 192.168.1.2 udp port 33448 unreachable, length 68
02:44:24.155028 IP 192.168.1.2 > 12.10.5.103: ICMP 192.168.1.2 udp port 33438 unreachable, length 68
02:44:24.155543 IP 12.10.5.103.57031 > 192.168.1.2.33451: UDP, length 32
02:44:24.155582 IP 12.10.5.103.45683 > 192.168.1.2.33450: UDP, length 32
02:44:28.523262 IP 12.10.5.101 > 192.168.2.1: ICMP echo request, id 7420, seq 1, length 64
02:44:28.523277 IP 192.168.2.1 > 12.10.5.101: ICMP echo reply, id 7420, seq 1, length 64
02:44:28.531943 IP 12.10.5.101 > 12.10.5.1: ICMP echo request, id 7429, seq 1, length 64
02:44:28.531953 IP 12.10.5.1 > 12.10.5.101: ICMP echo reply, id 7429, seq 1, length 64
02:44:28.534762 IP 192.168.1.101 > 12.10.5.103: ICMP echo request, id 7432, seq 1, length 64
02:44:28.534833 IP 12.10.5.103 > 192.168.1.101: ICMP echo reply, id 7432, seq 1, length 64
02:44:28.541345 IP 12.10.5.101 > 192.168.1.1: ICMP echo request, id 7435, seq 1, length 64
02:44:28.541359 IP 192.168.1.1 > 12.10.5.101: ICMP echo reply, id 7435, seq 1, length 64
02:44:28.547203 IP 12.10.5.101 > 192.168.1.103: ICMP echo request, id 7444, seq 1, length 64
02:44:28.547297 IP 192.168.1.103 > 12.10.5.101: ICMP echo reply, id 7444, seq 1, length 64
02:44:28.562268 IP 192.168.1.101 > 12.10.5.101: ICMP echo request, id 7456, seq 1, length 64
02:44:28.562357 IP 12.10.5.101 > 192.168.1.101: ICMP echo reply, id 7456, seq 1, length 64
02:44:28.564750 IP 12.10.5.101 > 192.168.1.101: ICMP echo request, id 7453, seq 1, length 64
02:44:28.564811 IP 192.168.1.101 > 12.10.5.101: ICMP echo reply, id 7453, seq 1, length 64
02:44:28.574160 IP 192.168.1.101 > 12.10.5.2: ICMP echo request, id 7468, seq 1, length 64
02:44:28.574214 IP 12.10.5.2 > 192.168.1.101: ICMP echo reply, id 7468, seq 1, length 64
02:44:28.575719 IP 12.10.5.101 > 192.168.1.3: ICMP echo request, id 7465, seq 1, length 64
02:44:28.575777 IP 192.168.1.3 > 12.10.5.101: ICMP echo reply, id 7465, seq 1, length 64
02:44:28.579642 IP 12.10.5.101 > 192.168.1.2: ICMP echo request, id 7474, seq 1, length 64
02:44:28.579709 IP 192.168.1.2 > 12.10.5.101: ICMP echo reply, id 7474, seq 1, length 64
02:44:28.585551 IP 12.10.5.101 > 192.168.1.4: ICMP echo request, id 7480, seq 1, length 64
02:44:28.585605 IP 192.168.1.4 > 12.10.5.101: ICMP echo reply, id 7480, seq 1, length 64
02:44:29.161714 IP 12.10.5.103.33020 > 192.168.1.103.33434: UDP, length 32
02:44:29.161728 IP 12.10.5.1 > 12.10.5.103: ICMP time exceeded in-transit, length 68
02:44:29.162646 IP 12.10.5.103.35977 > 192.168.1.103.33435: UDP, length 32
02:44:29.162653 IP 12.10.5.1 > 12.10.5.103: ICMP time exceeded in-transit, length 68
02:44:29.163682 IP 12.10.5.103.49606 > 192.168.1.103.33436: UDP, length 32
02:44:29.163690 IP 12.10.5.1 > 12.10.5.103: ICMP time exceeded in-transit, length 68
02:44:29.164874 IP 12.10.5.103.36202 > 192.168.1.103.33437: UDP, length 32
02:44:29.165882 IP 192.168.1.103 > 12.10.5.103: ICMP 192.168.1.103 udp port 33437 unreachable, length 68
02:44:29.166767 IP 12.10.5.103.43801 > 192.168.1.103.33438: UDP, length 32
02:44:29.167543 IP 192.168.1.103 > 12.10.5.103: ICMP 192.168.1.103 udp port 33438 unreachable, length 68
02:44:29.168574 IP 12.10.5.103.59503 > 192.168.1.103.33449: UDP, length 32
02:44:29.169322 IP 12.10.5.103.58925 > 192.168.1.103.33440: UDP, length 32
02:44:29.170205 IP 192.168.1.103 > 12.10.5.103: ICMP 192.168.1.103 udp port 33449 unreachable, length 68
02:44:29.170309 IP 12.10.5.103.41303 > 192.168.1.103.33444: UDP, length 32
02:44:29.170341 IP 12.10.5.103.52469 > 192.168.1.103.33445: UDP, length 32
02:44:29.170368 IP 12.10.5.103.51035 > 192.168.1.103.33447: UDP, length 32
02:44:29.170430 IP 12.10.5.103.39685 > 192.168.1.103.33443: UDP, length 32
02:44:29.170461 IP 12.10.5.103.32832 > 192.168.1.103.33439: UDP, length 32
02:44:29.170487 IP 12.10.5.103.35427 > 192.168.1.103.33441: UDP, length 32
02:44:29.170512 IP 12.10.5.103.33658 > 192.168.1.103.33448: UDP, length 32
02:44:29.170537 IP 12.10.5.103.59928 > 192.168.1.103.33446: UDP, length 32
02:44:29.170562 IP 12.10.5.103.35454 > 192.168.1.103.33442: UDP, length 32
02:44:29.171281 IP 192.168.1.103 > 12.10.5.103: ICMP 192.168.1.103 udp port 33440 unreachable, length 68
02:44:29.171896 IP 192.168.1.103 > 12.10.5.103: ICMP 192.168.1.103 udp port 33444 unreachable, length 68
02:44:29.171955 IP 192.168.1.103 > 12.10.5.103: ICMP 192.168.1.103 udp port 33445 unreachable, length 68
02:44:32.092010 ARP, Request who-has 12.10.5.4 tell 12.10.5.3, length 28
02:44:32.094745 ARP, Request who-has 12.10.5.1 tell 12.10.5.3, length 28
02:44:32.094757 ARP, Reply 12.10.5.1 is-at 06:c5:13:9c:b8:90 (oui Unknown), length 28
02:44:32.095364 IP 12.10.5.3 > 192.168.1.3: ICMP echo request, id 7489, seq 1, length 64
02:44:32.096329 IP 192.168.1.3 > 12.10.5.3: ICMP echo reply, id 7489, seq 1, length 64
02:44:32.098849 IP 12.10.5.3 > 192.168.1.2: ICMP echo request, id 7490, seq 1, length 64
02:44:32.099479 IP 192.168.1.2 > 12.10.5.3: ICMP echo reply, id 7490, seq 1, length 64
02:44:32.101825 IP 12.10.5.3 > 192.168.1.4: ICMP echo request, id 7491, seq 1, length 64
02:44:32.102377 IP 192.168.1.4 > 12.10.5.3: ICMP echo reply, id 7491, seq 1, length 64
02:44:32.104781 IP 12.10.5.3 > 192.168.2.3: ICMP echo request, id 7492, seq 1, length 64
02:44:33.585472 ARP, Request who-has 12.10.5.2 tell 12.10.5.1, length 28
02:44:33.585625 ARP, Reply 12.10.5.2 is-at 5a:13:bd:24:0f:63 (oui Unknown), length 28
02:44:33.591151 IP 12.10.5.101 > 192.168.2.1: ICMP echo request, id 7526, seq 1, length 64
02:44:33.591162 IP 192.168.2.1 > 12.10.5.101: ICMP echo reply, id 7526, seq 1, length 64
02:44:33.598540 IP 12.10.5.101 > 12.10.5.1: ICMP echo request, id 7535, seq 1, length 64
02:44:33.598548 IP 12.10.5.1 > 12.10.5.101: ICMP echo reply, id 7535, seq 1, length 64
02:44:33.603630 IP 192.168.1.101 > 12.10.5.103: ICMP echo request, id 7538, seq 1, length 64
02:44:33.603678 IP 12.10.5.103 > 192.168.1.101: ICMP echo reply, id 7538, seq 1, length 64
02:44:33.605765 IP 12.10.5.101 > 192.168.1.1: ICMP echo request, id 7541, seq 1, length 64
02:44:33.605772 IP 192.168.1.1 > 12.10.5.101: ICMP echo reply, id 7541, seq 1, length 64
02:44:33.610647 IP 12.10.5.101 > 192.168.1.103: ICMP echo request, id 7547, seq 1, length 64
02:44:33.610703 IP 192.168.1.103 > 12.10.5.101: ICMP echo reply, id 7547, seq 1, length 64
02:44:33.621010 IP 12.10.5.101 > 192.168.1.101: ICMP echo request, id 7556, seq 1, length 64
02:44:33.621066 IP 192.168.1.101 > 12.10.5.101: ICMP echo reply, id 7556, seq 1, length 64
02:44:33.625372 IP 192.168.1.101 > 12.10.5.101: ICMP echo request, id 7562, seq 1, length 64
02:44:33.625417 IP 12.10.5.101 > 192.168.1.101: ICMP echo reply, id 7562, seq 1, length 64
02:44:33.629463 IP 12.10.5.101 > 192.168.1.3: ICMP echo request, id 7568, seq 1, length 64
02:44:33.629525 IP 192.168.1.3 > 12.10.5.101: ICMP echo reply, id 7568, seq 1, length 64
02:44:33.634575 IP 12.10.5.101 > 192.168.1.2: ICMP echo request, id 7577, seq 1, length 64
02:44:33.634667 IP 192.168.1.2 > 12.10.5.101: ICMP echo reply, id 7577, seq 1, length 64
02:44:33.635280 IP 192.168.1.101 > 12.10.5.2: ICMP echo request, id 7574, seq 1, length 64
02:44:33.635326 IP 12.10.5.2 > 192.168.1.101: ICMP echo reply, id 7574, seq 1, length 64
02:44:33.638952 IP 12.10.5.101 > 192.168.1.4: ICMP echo request, id 7583, seq 1, length 64
02:44:33.639009 IP 192.168.1.4 > 12.10.5.101: ICMP echo reply, id 7583, seq 1, length 64
02:44:34.242466 IP 192.168.1.103.43818 > 12.10.5.3.33437: UDP, length 32
02:44:34.243270 IP 12.10.5.3 > 192.168.1.103: ICMP 12.10.5.3 udp port 33437 unreachable, length 68
02:44:34.244028 IP 192.168.1.103.55212 > 12.10.5.3.33438: UDP, length 32
02:44:34.245145 IP 192.168.1.103.59481 > 12.10.5.3.33447: UDP, length 32
02:44:34.245186 IP 192.168.1.103.45221 > 12.10.5.3.33439: UDP, length 32
02:44:34.245216 IP 192.168.1.103.38333 > 12.10.5.3.33445: UDP, length 32
02:44:34.245244 IP 192.168.1.103.39284 > 12.10.5.3.33448: UDP, length 32
02:44:34.245270 IP 192.168.1.103.45757 > 12.10.5.3.33440: UDP, length 32
02:44:34.245296 IP 192.168.1.103.49168 > 12.10.5.3.33441: UDP, length 32
02:44:34.245322 IP 192.168.1.103.45086 > 12.10.5.3.33442: UDP, length 32
02:44:34.245348 IP 192.168.1.103.36156 > 12.10.5.3.33446: UDP, length 32
02:44:34.245373 IP 192.168.1.103.59573 > 12.10.5.3.33449: UDP, length 32
02:44:34.245399 IP 192.168.1.103.60788 > 12.10.5.3.33443: UDP, length 32
02:44:34.245430 IP 192.168.1.103.46923 > 12.10.5.3.33444: UDP, length 32
02:44:34.245496 IP 12.10.5.3 > 192.168.1.103: ICMP 12.10.5.3 udp port 33438 unreachable, length 68
02:44:34.246900 IP 12.10.5.3 > 192.168.1.103: ICMP 12.10.5.3 udp port 33447 unreachable, length 68
02:44:34.246941 IP 12.10.5.3 > 192.168.1.103: ICMP 12.10.5.3 udp port 33439 unreachable, length 68
02:44:34.246970 IP 12.10.5.3 > 192.168.1.103: ICMP 12.10.5.3 udp port 33445 unreachable, length 68
02:44:34.247001 IP 12.10.5.3 > 192.168.1.103: ICMP 12.10.5.3 udp port 33448 unreachable, length 68
02:44:37.105279 ARP, Request who-has 12.10.5.3 tell 12.10.5.1, length 28
02:44:37.106650 ARP, Reply 12.10.5.3 is-at ce:51:83:fe:03:f6 (oui Unknown), length 28
02:44:38.640601 ARP, Request who-has 12.10.5.1 tell 12.10.5.2, length 28
02:44:38.640607 ARP, Reply 12.10.5.1 is-at 06:c5:13:9c:b8:90 (oui Unknown), length 28
02:44:38.647387 IP 12.10.5.101 > 192.168.2.1: ICMP echo request, id 7682, seq 1, length 64
02:44:38.647398 IP 192.168.2.1 > 12.10.5.101: ICMP echo reply, id 7682, seq 1, length 64
02:44:38.654903 IP 12.10.5.101 > 12.10.5.1: ICMP echo request, id 7691, seq 1, length 64
02:44:38.654910 IP 12.10.5.1 > 12.10.5.101: ICMP echo reply, id 7691, seq 1, length 64
02:44:38.659212 IP 192.168.1.101 > 12.10.5.103: ICMP echo request, id 7697, seq 1, length 64
02:44:38.659265 IP 12.10.5.103 > 192.168.1.101: ICMP echo reply, id 7697, seq 1, length 64
02:44:38.660025 IP 12.10.5.101 > 192.168.1.1: ICMP echo request, id 7694, seq 1, length 64
02:44:38.660031 IP 192.168.1.1 > 12.10.5.101: ICMP echo reply, id 7694, seq 1, length 64
02:44:38.664278 IP 12.10.5.101 > 192.168.1.103: ICMP echo request, id 7703, seq 1, length 64
02:44:38.664336 IP 192.168.1.103 > 12.10.5.101: ICMP echo reply, id 7703, seq 1, length 64
02:44:38.675192 IP 12.10.5.101 > 192.168.1.101: ICMP echo request, id 7712, seq 1, length 64
02:44:38.675250 IP 192.168.1.101 > 12.10.5.101: ICMP echo reply, id 7712, seq 1, length 64
02:44:38.681175 IP 192.168.1.101 > 12.10.5.101: ICMP echo request, id 7718, seq 1, length 64
02:44:38.681239 IP 12.10.5.101 > 192.168.1.101: ICMP echo reply, id 7718, seq 1, length 64
02:44:38.685001 IP 12.10.5.101 > 192.168.1.3: ICMP echo request, id 7724, seq 1, length 64
02:44:38.685073 IP 192.168.1.3 > 12.10.5.101: ICMP echo reply, id 7724, seq 1, length 64
02:44:38.689097 IP 12.10.5.101 > 192.168.1.2: ICMP echo request, id 7733, seq 1, length 64
02:44:38.689160 IP 192.168.1.2 > 12.10.5.101: ICMP echo reply, id 7733, seq 1, length 64
02:44:38.691236 IP 192.168.1.101 > 12.10.5.2: ICMP echo request, id 7730, seq 1, length 64
02:44:38.691284 IP 12.10.5.2 > 192.168.1.101: ICMP echo reply, id 7730, seq 1, length 64
02:44:38.696925 IP 12.10.5.101 > 192.168.1.4: ICMP echo request, id 7736, seq 1, length 64
02:44:38.696986 IP 192.168.1.4 > 12.10.5.101: ICMP echo reply, id 7736, seq 1, length 64
02:44:38.704254 ARP, Request who-has 12.10.5.3 tell 12.10.5.101, length 28
02:44:38.713437 IP 192.168.1.101 > 12.10.5.3: ICMP echo request, id 7751, seq 1, length 64
02:44:38.714538 IP 12.10.5.3 > 192.168.1.101: ICMP echo reply, id 7751, seq 1, length 64
02:44:39.254044 IP 192.168.1.103.47781 > 12.10.5.103.33437: UDP, length 32
02:44:39.254856 IP 12.10.5.103 > 192.168.1.103: ICMP 12.10.5.103 udp port 33437 unreachable, length 68
02:44:39.256453 IP 192.168.1.103.53098 > 12.10.5.103.33446: UDP, length 32
02:44:39.256506 IP 192.168.1.103.38768 > 12.10.5.103.33442: UDP, length 32
02:44:39.256547 IP 192.168.1.103.40340 > 12.10.5.103.33439: UDP, length 32
02:44:39.256684 IP 192.168.1.103.38715 > 12.10.5.103.33438: UDP, length 32
02:44:39.256737 IP 192.168.1.103.52870 > 12.10.5.103.33449: UDP, length 32
02:44:39.256773 IP 192.168.1.103.34552 > 12.10.5.103.33448: UDP, length 32
02:44:39.256808 IP 192.168.1.103.59389 > 12.10.5.103.33441: UDP, length 32
02:44:39.256844 IP 192.168.1.103.50126 > 12.10.5.103.33447: UDP, length 32
02:44:39.256879 IP 192.168.1.103.45282 > 12.10.5.103.33445: UDP, length 32
02:44:39.256914 IP 192.168.1.103.37109 > 12.10.5.103.33440: UDP, length 32
02:44:39.256949 IP 192.168.1.103.34019 > 12.10.5.103.33443: UDP, length 32
02:44:39.256991 IP 192.168.1.103.51625 > 12.10.5.103.33444: UDP, length 32
02:44:39.258664 IP 12.10.5.103 > 192.168.1.103: ICMP 12.10.5.103 udp port 33446 unreachable, length 68
02:44:39.258706 IP 12.10.5.103 > 192.168.1.103: ICMP 12.10.5.103 udp port 33442 unreachable, length 68
02:44:39.258735 IP 12.10.5.103 > 192.168.1.103: ICMP 12.10.5.103 udp port 33439 unreachable, length 68
02:44:39.258761 IP 12.10.5.103 > 192.168.1.103: ICMP 12.10.5.103 udp port 33438 unreachable, length 68
02:44:39.258793 IP 12.10.5.103 > 192.168.1.103: ICMP 12.10.5.103 udp port 33449 unreachable, length 68
02:44:39.265214 IP 192.168.1.103.60195 > 12.10.5.2.33445: UDP, length 32
02:44:39.265253 IP 192.168.1.103.48014 > 12.10.5.2.33437: UDP, length 32
02:44:39.265281 IP 192.168.1.103.51042 > 12.10.5.2.33438: UDP, length 32
02:44:39.265307 IP 192.168.1.103.50386 > 12.10.5.2.33448: UDP, length 32
02:44:39.265333 IP 192.168.1.103.60572 > 12.10.5.2.33443: UDP, length 32
02:44:39.265358 IP 192.168.1.103.35848 > 12.10.5.2.33439: UDP, length 32
02:44:39.265382 IP 192.168.1.103.36627 > 12.10.5.2.33441: UDP, length 32
02:44:39.265406 IP 192.168.1.103.56257 > 12.10.5.2.33444: UDP, length 32
02:44:39.265431 IP 192.168.1.103.56572 > 12.10.5.2.33440: UDP, length 32
02:44:39.265455 IP 192.168.1.103.60025 > 12.10.5.2.33449: UDP, length 32
02:44:39.265568 IP 192.168.1.103.59379 > 12.10.5.2.33442: UDP, length 32
02:44:39.265598 IP 192.168.1.103.49801 > 12.10.5.2.33447: UDP, length 32
02:44:39.265623 IP 192.168.1.103.38016 > 12.10.5.2.33446: UDP, length 32
02:44:39.267167 IP 12.10.5.2 > 192.168.1.103: ICMP 12.10.5.2 udp port 33445 unreachable, length 68
02:44:39.267205 IP 12.10.5.2 > 192.168.1.103: ICMP 12.10.5.2 udp port 33437 unreachable, length 68
02:44:39.267232 IP 12.10.5.2 > 192.168.1.103: ICMP 12.10.5.2 udp port 33438 unreachable, length 68
02:44:39.267258 IP 12.10.5.2 > 192.168.1.103: ICMP 12.10.5.2 udp port 33448 unreachable, length 68
02:44:39.267283 IP 12.10.5.2 > 192.168.1.103: ICMP 12.10.5.2 udp port 33443 unreachable, length 68
02:44:39.267313 IP 12.10.5.2 > 192.168.1.103: ICMP 12.10.5.2 udp port 33439 unreachable, length 68
02:44:39.267826 IP 192.168.1.103.38129 > 12.10.5.2.33450: UDP, length 32
02:44:39.268266 IP 192.168.1.103.46369 > 12.10.5.2.33451: UDP, length 32
02:44:42.107011 IP 12.10.5.3 > 192.168.2.4: ICMP echo request, id 7756, seq 1, length 64
02:44:43.664334 ARP, Request who-has 12.10.5.1 tell 12.10.5.103, length 28
02:44:43.664344 ARP, Reply 12.10.5.1 is-at 06:c5:13:9c:b8:90 (oui Unknown), length 28
02:44:43.716234 IP 12.10.5.101 > 192.168.2.1: ICMP echo request, id 7780, seq 1, length 64
02:44:43.716245 IP 192.168.2.1 > 12.10.5.101: ICMP echo reply, id 7780, seq 1, length 64
02:44:43.723202 IP 12.10.5.101 > 12.10.5.1: ICMP echo request, id 7786, seq 1, length 64
02:44:43.723213 IP 12.10.5.1 > 12.10.5.101: ICMP echo reply, id 7786, seq 1, length 64
02:44:43.729627 IP 12.10.5.101 > 192.168.1.1: ICMP echo request, id 7792, seq 1, length 64
02:44:43.729636 IP 192.168.1.1 > 12.10.5.101: ICMP echo reply, id 7792, seq 1, length 64
02:44:43.731893 IP 192.168.1.101 > 12.10.5.103: ICMP echo request, id 7795, seq 1, length 64
02:44:43.731941 IP 12.10.5.103 > 192.168.1.101: ICMP echo reply, id 7795, seq 1, length 64
02:44:43.735380 IP 12.10.5.101 > 192.168.1.103: ICMP echo request, id 7798, seq 1, length 64
02:44:43.735454 IP 192.168.1.103 > 12.10.5.101: ICMP echo reply, id 7798, seq 1, length 64
02:44:43.746360 IP 12.10.5.101 > 192.168.1.101: ICMP echo request, id 7810, seq 1, length 64
02:44:43.746415 IP 192.168.1.101 > 12.10.5.101: ICMP echo reply, id 7810, seq 1, length 64
02:44:43.753880 IP 192.168.1.101 > 12.10.5.101: ICMP echo request, id 7819, seq 1, length 64
02:44:43.753944 IP 12.10.5.101 > 192.168.1.101: ICMP echo reply, id 7819, seq 1, length 64
02:44:43.760828 IP 12.10.5.101 > 192.168.1.3: ICMP echo request, id 7822, seq 1, length 64
02:44:43.760891 IP 192.168.1.3 > 12.10.5.101: ICMP echo reply, id 7822, seq 1, length 64
02:44:43.763924 IP 192.168.1.101 > 12.10.5.2: ICMP echo request, id 7828, seq 1, length 64
02:44:43.763972 IP 12.10.5.2 > 192.168.1.101: ICMP echo reply, id 7828, seq 1, length 64
02:44:43.766141 IP 12.10.5.101 > 192.168.1.2: ICMP echo request, id 7831, seq 1, length 64
02:44:43.766197 IP 192.168.1.2 > 12.10.5.101: ICMP echo reply, id 7831, seq 1, length 64
02:44:43.771797 IP 12.10.5.101 > 192.168.1.4: ICMP echo request, id 7837, seq 1, length 64
02:44:43.771874 IP 192.168.1.4 > 12.10.5.101: ICMP echo reply, id 7837, seq 1, length 64
02:44:43.785204 IP 192.168.1.101 > 12.10.5.3: ICMP echo request, id 7849, seq 1, length 64
02:44:43.785268 IP 12.10.5.3 > 192.168.1.101: ICMP echo reply, id 7849, seq 1, length 64

02:44:52.109081 IP 12.10.5.3 > 192.168.2.2: ICMP echo request, id 7990, seq 1, length 64
02:44:53.863317 IP 12.10.5.101 > 192.168.2.1: ICMP echo request, id 8014, seq 1, length 64
02:44:53.863331 IP 192.168.2.1 > 12.10.5.101: ICMP echo reply, id 8014, seq 1, length 64
02:44:53.873662 IP 192.168.1.101 > 12.10.5.103: ICMP echo request, id 8026, seq 1, length 64
02:44:53.873719 IP 12.10.5.103 > 192.168.1.101: ICMP echo reply, id 8026, seq 1, length 64
02:44:53.874719 IP 12.10.5.101 > 12.10.5.1: ICMP echo request, id 8023, seq 1, length 64
02:44:53.874725 IP 12.10.5.1 > 12.10.5.101: ICMP echo reply, id 8023, seq 1, length 64
02:44:53.879370 IP 12.10.5.101 > 192.168.1.1: ICMP echo request, id 8032, seq 1, length 64
02:44:53.879380 IP 192.168.1.1 > 12.10.5.101: ICMP echo reply, id 8032, seq 1, length 64
02:44:53.886075 IP 12.10.5.101 > 192.168.1.103: ICMP echo request, id 8035, seq 1, length 64
02:44:53.886132 IP 192.168.1.103 > 12.10.5.101: ICMP echo reply, id 8035, seq 1, length 64
02:44:53.895137 IP 192.168.1.101 > 12.10.5.101: ICMP echo request, id 8050, seq 1, length 64
02:44:53.895211 IP 12.10.5.101 > 192.168.1.101: ICMP echo reply, id 8050, seq 1, length 64
02:44:53.897325 IP 12.10.5.101 > 192.168.1.101: ICMP echo request, id 8047, seq 1, length 64
02:44:53.897381 IP 192.168.1.101 > 12.10.5.101: ICMP echo reply, id 8047, seq 1, length 64
02:44:53.906836 IP 192.168.1.101 > 12.10.5.2: ICMP echo request, id 8059, seq 1, length 64
02:44:53.906885 IP 12.10.5.2 > 192.168.1.101: ICMP echo reply, id 8059, seq 1, length 64
02:44:53.908353 IP 12.10.5.101 > 192.168.1.3: ICMP echo request, id 8062, seq 1, length 64
02:44:53.908481 IP 192.168.1.3 > 12.10.5.101: ICMP echo reply, id 8062, seq 1, length 64
02:44:53.911775 IP 12.10.5.101 > 192.168.1.2: ICMP echo request, id 8068, seq 1, length 64
02:44:53.911831 IP 192.168.1.2 > 12.10.5.101: ICMP echo reply, id 8068, seq 1, length 64
02:44:53.919476 IP 12.10.5.101 > 192.168.1.4: ICMP echo request, id 8071, seq 1, length 64
02:44:53.919534 IP 192.168.1.4 > 12.10.5.101: ICMP echo reply, id 8071, seq 1, length 64
02:44:53.926159 IP 192.168.1.101 > 12.10.5.3: ICMP echo request, id 8083, seq 1, length 64
02:44:53.926206 IP 12.10.5.3 > 192.168.1.101: ICMP echo reply, id 8083, seq 1, length 64
02:44:58.912503 ARP, Request who-has 12.10.5.2 tell 12.10.5.1, length 28
02:44:58.912713 ARP, Reply 12.10.5.2 is-at 5a:13:bd:24:0f:63 (oui Unknown), length 28
02:44:58.932152 IP 12.10.5.101 > 192.168.2.1: ICMP echo request, id 8168, seq 1, length 64
02:44:58.932195 IP 192.168.2.1 > 12.10.5.101: ICMP echo reply, id 8168, seq 1, length 64
02:44:58.943373 IP 12.10.5.101 > 12.10.5.1: ICMP echo request, id 8177, seq 1, length 64
02:44:58.943385 IP 12.10.5.1 > 12.10.5.101: ICMP echo reply, id 8177, seq 1, length 64
02:44:58.944732 IP 192.168.1.101 > 12.10.5.103: ICMP echo request, id 8180, seq 1, length 64
02:44:58.944856 IP 12.10.5.103 > 192.168.1.101: ICMP echo reply, id 8180, seq 1, length 64
02:44:58.949616 IP 12.10.5.101 > 192.168.1.1: ICMP echo request, id 8186, seq 1, length 64
02:44:58.949630 IP 192.168.1.1 > 12.10.5.101: ICMP echo reply, id 8186, seq 1, length 64
02:44:58.957124 IP 12.10.5.101 > 192.168.1.103: ICMP echo request, id 8189, seq 1, length 64
02:44:58.957221 IP 192.168.1.103 > 12.10.5.101: ICMP echo reply, id 8189, seq 1, length 64
02:44:58.969764 IP 192.168.1.101 > 12.10.5.101: ICMP echo request, id 8204, seq 1, length 64
02:44:58.969837 IP 12.10.5.101 > 192.168.1.101: ICMP echo reply, id 8204, seq 1, length 64
02:44:58.970830 IP 12.10.5.101 > 192.168.1.101: ICMP echo request, id 8201, seq 1, length 64
02:44:58.970919 IP 192.168.1.101 > 12.10.5.101: ICMP echo reply, id 8201, seq 1, length 64
02:44:58.982678 IP 12.10.5.101 > 192.168.1.3: ICMP echo request, id 8216, seq 1, length 64
02:44:58.982745 IP 192.168.1.3 > 12.10.5.101: ICMP echo reply, id 8216, seq 1, length 64
02:44:58.983433 IP 192.168.1.101 > 12.10.5.2: ICMP echo request, id 8213, seq 1, length 64
02:44:58.983481 IP 12.10.5.2 > 192.168.1.101: ICMP echo reply, id 8213, seq 1, length 64
02:44:58.988224 IP 12.10.5.101 > 192.168.1.2: ICMP echo request, id 8222, seq 1, length 64
02:44:58.988298 IP 192.168.1.2 > 12.10.5.101: ICMP echo reply, id 8222, seq 1, length 64
02:44:58.997229 IP 12.10.5.101 > 192.168.1.4: ICMP echo request, id 8225, seq 1, length 64
02:44:58.997312 IP 192.168.1.4 > 12.10.5.101: ICMP echo reply, id 8225, seq 1, length 64
02:44:59.007351 IP 192.168.1.101 > 12.10.5.3: ICMP echo request, id 8237, seq 1, length 64
02:44:59.007431 IP 12.10.5.3 > 192.168.1.101: ICMP echo reply, id 8237, seq 1, length 64
